,text
0,You have got to be fucking kidding me.
1,When does your episode of Bob’s Burgers premiere?
2,You probably need to take a shot just to masturbate
3,Instead of roasting you I'm going to make a donation to whatever disease it is that you have. 
4,Looks like Angelica’s doll from Rugrats....
5,It’s Beaker from the muppets.
6,Its not fun when it's this easy. 
7,"Attractive women who post here usually get comments about being sluts, trying hard to look good, and having webcams.  Fortunately, you don't have to worry about those kinds of comments."
8,You look like your parents clicked “randomise all” when you were born.
9,You look like you're about to ask for the manager at The Krusty Krab
10,"A college dropout in her panties, and not a single comment about masturbation.  I believe that says it all."
11,You look like the mix of Shia LaBeouf and a big eyed chihuahua 
12,Do they actually have dementia or are you just that forgettable as a son? 
13,Looks like the female sloths from the Ice Age 
14,r/justfuckmyshitup
15,Even your hair is trying to get as far away from your face as possible.
16,The face you’re making is also the reaction of the dentist when he realises how much money he can make off of you.
17,"Knocking her down is easy, it's finding someone to knock her up that's the real challenge."
18,Harry potter and the experimental faze.
19,Even Sandra Bullocks’s pity  couldn’t save this one. 
20,You look like you sneezed during a staring contest
21,If you were hot this might belong on r/trashyboners.  Instead it’s just r/trashy. 
22,Sir you look like spongebobs house
23,You look like the kind of person that would bitch about vegan options at Taco Bell
24,You look like a character from big mouth
25,"You and your girlfriend are like your eyes, both going their separate ways"
26,Biggie Smells
27,"Panties? Looks like boxers from her dads college drop out days

But clearly not her dads because you just know theres issues there"
28,have your eyes gotten a divorce ?
29,"You look 22 and 35 at the same time. Maybe it’s inbreeding, maybe it’s Maybelline."
30,The waves of her hair really compliment the beach of her forehead
31,‘It’s only 30 bucks a gram? Bro this bud is fire thank you’
32,Even your teeth are blonde. 
33,I think it's cool that they let you eat healthy food and enjoy nature at the special care unit!
34,Contact your local police station. Maybe someone found your eyebrows and handed them in. 
35,Look like a deflating sex doll.
36,Which part does she have to worry about be called a slut or being mistaked for a woman
37,"Holy shit! It's a fucking baby ostrich!
(See pic in my replies)"
38,"Oooh, a girl gamer.  I bet guys are always trying to flirt with you in game chat after they hear your voice. If you ever want it to stop, just send them this picture."
39,"They could still be her dads, sometimes girls don't return everything after a breakup."
40,That forehead has to add at least an hour to makeup time
41,The banana completes the fruit salad. 
42,You father definitely didn't give your mother his best shot.
43,"Shia LaBeouf and Sid from Ice Age.
"
44,I don’t think it’s possible to uppercut you. 
45,Do you self identify your gender as a fish?
46,Thank god for my parents genes. This pic is a reminder of what could have been. 
47,60% forehead 25% cheeks 15% face
48,Jesus Christ . Lmao 
49,A perfect example of what happens when you eat out a prostitute 
50,Aye bruh can I buy some fortnite skins?
51,Someone setup a gofundme for this poor bloke
52,Notorious P.I.G.
53,That's for sure.
54,That purity ring is just unnecessary. 
55,"Nah, randomizing means that there should be at least one good feature."
56,*Sir*
57,They should put you in the background of the new Grinch movie
58,"Well your pants are halfway off, so you have experience for your new career"
59,My dad for my birthday got me a shirt that had a picture of Beaker and said what would beaker do 😂 you rock. 
60,Your nostrils look like a thai football team could get lost in them
61,Lol first thing i said
62,I'm following her Reddit account so I can read about all of her future poor life choices.
63,How the fuck you broke but still manage to look like you ate everything?
64,I wonder how many times a guy has said that to her...
65,Really excited to see Bohemian Rhapsody Eh?
66,"Oh look, a rejected Furbie concept"
67,Then she'd have to #metoo herself
68,No. Just separated. 
69,I’m starting a betting pool on how many times you overdose before you turn 30.
70,"I really hope those are some fake Halloween teeth bro, cuz damn"
71,"That's a very long and complicated way of saying ""I'm an adult virgin"""
72,I would but I can't tell if you're talking to me or the person next to me 
73,"Home Alone 27: Kevin is home alone but this time he's just living his lonely life, no real friends, no gf, no toothpaste. "
74,God: Hold my beer
75,Harry Potter and the Prisoner of Afghanistan 
76,So the most interesting thing about you is that you eat bananas?
77,When a Picasso painting comes to life 
78,"Only good thing is at least the patients will forget your creepy ass face afterwards, we all have to live with that."
79,"""Youre a faggot, Harry"""
80,too bad the toilet flush isn't strong enough to take you down with the rest of the shit
81,"I said ""jesus christ... well let's look at what people said about shreks autistic cousin"""
82,So would he
83,Obviously its fantasy football
84,"What the fuck do you do all day, examine bobs and vegana? "
85,Snoop Hogg
86,She blends in very well with the trash cans in the back. Had to look twice.
87,Just don't feed her after midnight. 
88,zero
89,"No, I think they are more of a yellowish brown."
90,STILL NO PICKLES!
91,Try brushing your teeth with something other than piss
92,"Of course his name is Jackson. Other acceptable names would be Chad, Ethan, or Blaine. "
93,her eyebrows already escaped
94,Cam Girl. Stripper. Porn.  Interracial porn.  Stripper near the airport. Rehab. Walmart greeter. Morbid Obesity.  Heart attack.  Corpse removed from trailer by crane.  Cremation. Ashes thrown away by the city after nobody comes to collect them.  (Saved you 18 months of following her Reddit)
95,Wow I'd love to see how ugly your girlfriend is 
96,“Condom companies hate her ! “
97,"Like you've destroyed those poor girls locked up in your basement? No thanks, mate."
98,After the censors stop puking 
99,I was gonna say Mr. Meaty
100,"Nah, just use a paint roller and you're done in a few minutes."
101,"https://www.bing.com/images/search?view=detailV2&amp;ccid=nDfVokh2&amp;id=1B7FA37ED561ACC5713F8E9AFB8E55BEFF3A87B7&amp;thid=OIP.nDfVokh25qERmPY5Y5AysAHaJ4&amp;mediaurl=http%3A%2F%2F3.bp.blogspot.com%2F-6bgRe7VrTug%2FUglOgSK5PVI%2FAAAAAAAAtNc%2FBflPClY2X44%2Fs1600%2FAmazing%2Bpictures%2Banimals%2B%2BPhotos%2BZoo%2Bpics%2Bnature%2Bbeautiful%2Bbaby%2BOstrich%2B(Struthio%2Bcamelus)%2Bcute%2Bbird~16.jpg&amp;exph=500&amp;expw=375&amp;q=baby+ostrich&amp;simid=608030796102173471&amp;selectedindex=1&amp;ajaxhist=0&amp;vt=Default

"
102,He looks like the kid that smells like piss every day in class.
103,"Up next on, Chernobyl Babies - Where Are They Now"
104,"Cynthia, Angelica is looking for you."
105,You look like you hide pickles under your tongue
106,Blindsided.
107,There's enough grease on your face and nose to oil up a pan and roast your own self.
108,You don’t need to go to Hogwarts to learn invisibility. 
109,Why Bing why
110,Holy crap its Post Alone
111,She’s probably seeing someone on the side
112,"Let me give you some good life advice. Don't go to college, you could have a very promising career as a pedophile trap. Pedophiles would see your hair and assume it's a little boy. When they get closer the police swoop in and arrest them. The best part is there's no way anyone will ever have sex with you so you aren't actually in any real danger. "
113,"r/roastme...  for when you are desperate for validation from random strangers, but not hot enough to get it on instagram.  "
114,You make me want to donate a chromosome to charity.
115,What is the feeling of having 360 vision all the time?
116,How did you get here from tech support?
117,I didn’t know 7/11 has a nurse office 
118,"The good thing is, you can do all the Meth you want without worrying about 'losing your looks'."
119,Casey neistat after smoking 1 kg of weed
120,Have you touched food recently? I've seen penises thicker than your arms.
121,I think the correct term is bobbies and vagine
122,Congratulations for winning the least challenging post in this subreddit. 
123,Competitive shitting 
124,I'm sorry her family died in the Roswell crash.
125,"I thought there was some dirt on my screen, but thankfully it was just his acne."
126,You look like you could apply to play a live action ‘Where’s Waldo’ if only your mom would drive you to the audition. 
127,So great to see how happy you are in an organization that wouldn’t formally accept you until 2014.
128,"Wow Fortnite and Harry Potter, what a unique person! I'm sure you and all of your friend have some crazy times together."
129,"Yeah, what the hell am I looking at ??"
130,“It’s Reggie but it’s like...good Reggie.” 
131,"Not you, incest is illegal."
132, her post would probably get removed from r/toastme if she tried posting there 
133,You look like someone who would have a picture of an astronaut on their wall.
134,"What's ""Roast Me"" in Klingon?"
135,You look like the type that would wear shoes while on the bed
136,Well he’s no longer gay now 
137,Id that sid from ice age?
138,And a 100% reason to put the tissues away.
139,My mom dropped out of HIGH SCHOOL THANK YOU VERY MUCH 
140,LMFAO! I just snorted a line of cocaine
141,"That big piece of paper doesn’t hide your fucking mess of a room. Also you look like an orange, when you peel that makeup off you’ll probably look like the inside of one. "
142,gold :)))
143,Looks like you can swallow it whole.
144,you look like 3 ugly girls glued together
145,Nigga look like he ate a junior 
146,There's probably a pretty close similarity between what's in that toilet and what's sitting on it.
147,You’re not supposed to use makeup on animals. I’m calling PETA
148,You look like that girl in school who REALLY liked horses
149,He definitely is. 
150,"Yes, no would offend a *special* person.. It's wrong"
151,They’re in a long distance relationship 
152,From vicious to devastating. Good job.
153,"""That's the best you can do?"" I bet every guy you ever slept with has been asked that by his friends."
154,Lmao I feel like every single person who saw this post said the exact same thing to themselves.
155,She looks like Princess Fiona in the middle of transitioning from human to ogre. 
156,Your uncle said otherwise
157,"Dude, you don’t look gay at all. You actually look like you like chicks"
158,Pedophilia isn’t really a disease 
159,"When you wanted a sanskrit tattoo, but the tattoo artist forgot to install the font..."
160,I got a boner. Saw the boxers and long hair and thought you were a dude. I'm gay btw
161,"No no no, a gofundme for the disease so it can get more resources to finally kill this dude."
162,All of its genes are recessive.
163,19 and college dropout sounds like your mom before she had you
164,Cynthia
165,"It’s not a job, it’s a CAREER "
166,"There is nothing in the toilet, take my upvote for the sudden existential dread you’ve just put me through. "
167,"“Heeeey you guuuys!” Wait. Wrong sloth.
No, Wait. Still applies..."
168,Tufat
169,Doubt you chew the banana
170,^More ^of ^a ^what ^then ^a ^who
171,Ok. The next one don’t say cheese
172,You look like a tumbler lesbian with fetal alcohol syndrome. 
173,I can't even roast you man. If you can manage to pull off a girlfriend with a face like that then good on you
174,Michael Clarke Duncan Donuts
175,Ohhh....... Sweetie..... I'm so sorry
176,"You have a mirror in front of your toilet... Daily hemorrhoid checks, or just creepy?"
177,"I'm not sure that's a sir, or a ma'am, or anything.."
178,You’re the type of doctor we will see in court 10 years from now 
179,No you didn’t 
180,"Chernobyl was a hell of a thing, wasn't it?"
181,"Too bad your dream job isn’t looking like a complete pile of dog shit, because you’re a huge success in that department. "
182,If he had spare skins don’t you think he’d be wearing them?
183,At least you save money on Halloween costumes. 
184,This is the face of someone who just learned that any pill at the local GNC could 'techincally' be a suppository.
185,Failed concept art for Gretchen from Recess
186,"Nah, he just sucks dick for the flavor. "
187,How'd you get a camera into jail?
188,Having a really pointless tattoo and some guitars in the photo isn't going to get the band's roadies to fuck you after the show. They have standards.
189,Look at Mr fancy doctor pants getting us on a technicality.
190,She identifies as a fucking pigeon 
191,I know right! She looks like a Nintendo Mii character. I swear OP probably gets roasted everyday in real life why would you come here for additional abuse? 
192,Genetics beat us to it.
193,It's like a sequel to The Blind Side - except in this one the kid never makes it out.
194,How many times did you take this photo before you got her good eye in the picture?
195,This is the type of shit that happens when the ugly marry the poor.
196,The ugly duckling never did grow up huh? 
197,"I see you've posted in the past about having suicidal thoughts. 

There are people that look forward to seeing you every day.  If you off yourself the tormenting assholes that you'll never see again after graduating win and you lose. Boom, roasted. 

You say you don't like that you lie and you feel guilty. Stop lying and people will trust you and want to be around you. Boom, roasted. 

You cut yourself to feel because you like feeling something. When you want to cut, put on your tennis shoes and don't stop running until your lungs burn. Congrats you just hurt yourself in the best possible way. You will have a better body and endorphins. Boom, roasted. 

People will miss you. Boom, roasted. 
"
198,Ouch
199,ME me ...me me me me!
200,"Damn, Tracy Morgan got really fat after that car accident."
201,Now even Alvin from the chipmunks has gone trans 
202,Neither. Just a big nose.
203,I’m sorry I can only upvote once
204,This gave me aids 
205,"In 20 years you'll still be the prettiest cashier at Walmart

The are so many advantages to having a chest like yours. You've never had to say to a guy ""my eyes are up here""






"
206,Why the long face?
207,Those guitar have been fingered more than you
208,50 tons
209,Pat
210,"You can take that astronaut picture down. Unless they start sending chimps back into space, I’m pretty sure you’re not going to need it for motivation. "
211,That’s a her?
212,I have a massive fucking cock btw 
213,Wow. An Indian doctor. Never seen one of those before. 
214,"You're the 2am""Meh, that'll do"" girl"
215,Is that including the times I’ve already overdosed? 
216,It wasn’t a very popular model and it didn’t sell well. 
217,Just tell us where the kids are buried and we will take the death sentence off the table.
218,You look like you should be into your 5th year of junior college by now
219,He looks like the guy that just murdered the guy that wrote that sign and was about post....
220,Your head looks like a light bulb that fell into a box of open markers.
221,Bing? Let's roast this guy instead
222,Your 23andme DNA results just came back.  You share 99% of your genes with the targets from every carnival's [Down the Clown game.](http://97x.com/files/2016/08/Carnival-Game.jpg?w=630&amp;h=422&amp;q=75)
223,What’s your PayPal? I’ll get you a toothbrush. 
224,A locus from gears of war 
225,"The customer replies, ""Just give me my Gordita."""
226,"Hey you've achieved your dream job! Dreams take work but you're there and that's a great first step! Keep at it man!

Edit: The photo and title were so depressing and pathetic I just assumed I was on r/toastme. My B"
227,"Sweetie, being ""Audience Member #142"" in some indie movie's crowd scene because you gave the assistant camera guy some mediocre head, doesn't make you an actress."
228,You look like Gary Busey’s abortion 
229,"Future YouTube/Fortnite/rapist - he's holding up the national sign of ""guess which two"" and YouTube isn't one of them. "
230,M&amp;M
231,You look like you take virginity from boys going trough puberty for a living.
232,I guess paper costs too much in africa.
233,He wasn't talking to you
234,"Jesus Christ, I spat out my coffee!"
235,Are all your teeth made from Werther's Original Butterscotch?
236,New high score
237,...*jesus*
238,"*God looks at her/him*

God: Fuck, just hold *me*"
239,T-Painful arches
240,"""It's complicated"""
241,who the fuck uses bing
242,hahahaha thank you for that
243,*Steam roller. 
244,You can help him for just 22 cents a day!
245,"""Boy"" . No thats a 40 y/o lesbian "
246,Porn.
247,"haha I thought you were kidding, then I looked at the pic..."
248,It’s like an Oreo where the cream looks more disgusting than the cookies 
249,Worst Blacked.com scene ever. 
250,Idk where you are from but we here don’t call chimps prostitutes 
251,I'm assuming by 'untouchable' you mean your parents have never hugged you?
252,It's funny until Elon Musk shows up with his submersible. 
253,Dare your brother to fully commit to the gender transition.
254,"Be honest, you were practicing for your live action part as Jen, the gelfling from the Dark Crystal."
255,Most Alone
256,This is a well constructed burn my friend
257,I’d cast you to play a child predator who attempts to lure a child into his car with a banana in a “Don’t Talk To Strangers” educational video shown to elementary school children.
258,They feign dementia to avoid conversations with him.
259,I've never seen anybody with skin-tone teeth before
260,She looks like a Petrie Dish of multiracial cum and low grade cocaine
261,"Good idea, thanks. I’ve been looking all over for them 😂😂"
262,“Pours in more oregano..” 
263,I actually regained my virginity after I saw OP
264,Feminem
265,You look like a 50 year old lesbian who just got a facelift
266,Big Yachty
267,*slaps forehead* you can fit so many loads on this bad boy!
268,Forgettable is perfect. I was trying to think of a roast and all I thought was how boring and average this person looked. Not even anything to roast. 
269,"I can’t, life has been cruel enough to you"
270,But isn't he burnt already?
271,How many boys were in the group that took yours?
272,Looks like a chia pet with severe down syndrome
273,Keep the acne. Will distract people from some of the ugly. 
274,Can’t wait until she tells her parents that the baby is going to be black 
275,TIMMMAYYY
276,"It looks like you not only dropped out of college, you dropped out of life. Seriously what’s with those panties and t-shirt 🤮"
277,You know what else was non-consensual? When bilbo stole your precious
278,"I was going to say Cynthia, the doll from rugrats."
279,Holy spoiler alert!
280,"yeah, maybe if it was fucked by Beaker. "
281,Appropriate username.
282,My stomach hurts from laughing so hard.
283,Looks like velma with fetal alcohol syndrome
284,Now here’s a guy who knows *exactly* what a dick tastes like.
285,Jimmy neutron called and wants his head back
286,"Keep your chins up, things will work out!"
287,Look! It’s been hiding in “her” hair the whole time!
288,Where can we find your casting couch video? 
289,God damn
290,Busted out laughing - read it in hagrids voice 
291,She should donate her extra one
292,So grateful I’m calling my mum rn
293,LMFAO! I just snorted in line for coffee 
294,Looks like a frightened ostrich.
295,"Horrible photoshop job, that doesn't even remotely look like a real person."
296,"When I was a young boy I would visit my grandfather, who was a real old bastard who would offer cigarettes to local kids and tell us made up war stories we knew weren’t true.

He would take me up to his attic where he kept an enormous travelling suitcase covered in patches and memories that belonged to a kinder soul I presumed. In that suitcase he kept a mermaid, and he would make me have sex with that mermaid whilst he watched and encouraged. 

When the old bastard died I went up to his attic to see if the mermaid was real. Inside the case there was a dead monkey with its legs sewn together.

You remind me of that monkey Jackson. "
297,[deleted]
298,It appears that half of him has already been roasted 
299,"What's the excuse for the face, then?"
300,I auditioned for the part but they just made me go to med school
301,"It did, just stayed ugly."
302,Pug eye syndrome?
303,"I hear the casting couch is always open, and since self worth clearly isn’t an issue for you..."
304,they grew apart over the years 
305,Oh damn!
306,"You look like the initial sketch for the secretary from monsters Inc before the director said ""Jesus, take it down a notch""."
307,condom companies don't know she exists
308,"I can fix my typo, but he cant fix his relationship "
309,You look like backyardscientists retarded son
310,Who let Borat out his cage?
311,[Found your doppelgänger](https://i.imgur.com/WRwJlFH_d.jpg?maxwidth=640&amp;shape=thumb&amp;fidelity=medium)
312,you look like Draco Malfoy if he had british teeth
313,This is a severly underated burn 
314,I feel like you roasted yourself enough already.
315,You are what the dictionary describes as gay 
316,Blaze 
317,"“I’m too pretty and too busy to clean my room.”  No, you’re not."
318,Wrigley's ain't got that much gum. 
319,[deleted]
320,You look like the star of the gay porn version of Forrest Gump
321,I knew this would be the first thing he’d be called out for 💀
322,"I don't know what's dirtier, your heroin needles or that greasy hair "
323,You look like the result if autism were a gender. 
324,http://imgur.com/9s73ZkT
325,Oven roasted peanuts. Get yer’ oven roasted peanuts over here. 
326,"Meep meep meep meep.....oh tinnitus you cruel mistress!
"
327,I see you’re pushing your boobs together to distract people from you face. It’s not working. 
328,"I don’t do it for a living, but I’ve definitely done it."
329,"Harry Potter and the Sorcerers Bone  
Harry Potter and the Chamber of Semen  
Harry Potter and the Prisoner of Asshole Man  
Harry Potter and the Gobbler of Spunk  
Harry Potter and the Hoarder of Penis  
Harry Potter and the Half-Hard Penis  
Harry Potter and the Deepthroat Swallows Parts 1 &amp; 2"
330,Female Dwight Shrute. 
331,Aren't you supposed to lose weight at bootcamp?
332,Were you crying because of your haircut?  
333,Dustin from stranger things has misqito bites on his chest. 
334,You mean a bugs life
335,Mentally handicap Jax Teller
336,Or a dream job
337,Just cause your circumcised dont make you a jew
338,"I rarely upvote comments in here. It’s usually low hanging fruit. But God dammit, I lost my shit reading this. "
339,"Shit, just call him Casey Neistat and that's insult enough lmao"
340,Future GameStop retail associate. 
341,You look like the kind of person who has scheduled masturbation 
342,"Doesn’t matter if you’re board certified, nobody is going to want you near their genitals. "
343,l/loastme
344,Give me your best shot?!! Your picture is the definition of retrograde ejaculation. Even sperm dry heave before touching your face 
345,"Elder Scrolls fan here: No. No, it doesn't. Face randomization fucking _blows._"
346,Vote for Pedro
347,"""Byakugan!"""
348,"Skin bananas , amirite? "
349,Most people have outgrown their goth phase by 50. 
350,"So, Jeebs, still dealing illegal alien weaponry?"
351,Fornite players deserve injuries 
352,Oldest job in the world
353,Hahaha yes 😂
354,"Nah, it’s for her daily “ how bad are my herpes” check. "
355,"""...a degree in broadcasting."" Didn't know they gave them out for posting homemade gang bang videos"
356,"Job interview: McDonald's 

White girlfriend: 250lbs

Standards: Low"
357,Fat Joe
358,Poster boy for conversion therapy.
359,you look like Guillermo Del Toro fucked Bubbles. 
360,Key word “felt”
361,You put an X on the calendar behind you if you contributed anything good to society on that day.
362,Ermahgherd! Rerddert!
363,"So in other words, Macaulay Culkin."
364,I can hear your autism from here. 
365,Superbad 2 looks like shit
366,I hope your birthday present is a trip to the dermatologist and then Great Clips
367,"You look like a makeup brush
"
368,**Jacksfilms forehead**
369,WOULD NEVER BE KIND TO HER
370,So are all of the 167 genders it chose.
371,He sure did too
372,Wow.. this is the first time I cringe at the sight of a human being. 
