,text
0,"Before the meeting tomorrow put the suction cup back on in the same spot and hang a sign that says, ""All Business, All the Time"". That way your tutor won't notice the bruise and they'll know that you're all business, all the time."
1,[Here's the photo ](http://imgur.com/Y9kOJuD) 
2,"LPT: Don't go anywhere near the Eiffel Tower any time there's a big event. 

Source: live in Paris. "
3,That went better than I expected.
4,"&gt; Going to do another this weekend if it drops another 10 degrees

The real TIFU is always in the comments."
5,"That's nothing a tourist could be expected to know. :( ...

In Canada there's a strong culture of the public quickly reporting thugs taking advantage of a riot. I remember the [Stanley Cup riot of Vancouver in 2011](http://globalnews.ca/news/2763636/looking-back-5-years-since-stanley-cup-riot/).

Canadians were absolutely appalled by it. So much so that a web site created by the police for the public to submit pictures and evidence of suspected rioters was inundated by Canadians.

That public cooperation contributed to:

&gt; In the end, 300 alleged rioters, including 54 youths, faced 912 charges. All but 16 of the accused pleaded guilty.

A number of the rioters ended up making public apologies for their behaviour.

Law and order is not just the police's job. Everyone has a duty to expose thuggery, not just because it's the right thing to do, but because it's the only way to avoid down the shitter of indifference toward living in a society where only heavy handed police action controls the festering violence."
6,"'I opted to eat a couple while still standing next to her'

clear priorities. good man."
7,Pretty sure this is just a lesson on how you should never get in a car with a stranger
8,The Uber driver should have had a SIGN in his car: 'DRIVER IS HEARING IMPAIRED'.
9,"Let me reassure you: ""VAG JUICE"" is safe, even when consumed regularly."
10,Sadly a face I see far too often.
11,"Nice TIFU, Mary Poopins."
12,Hahaha you evil bastard haha
13,That's the face of regret. 
14,"Sounds like dude was looking for any reason to fire you if you've worked there for 3.5 years but he's not going to give you a warning for taking one euro. He probably could've taken it out of your next check too. 

Technically speaking you are in the wrong but for one euro? It was an overreaction on his behalf. "
15,"Now, I'm no engineer, or plumber, but that intake seems awfully large...
And it was just the one? That doesn't seem very safe..."
16,"This is probably the most metal TIFU I've ever read. Carrying your girlfriend through a riot in a cloud of tear gas before being robbed and having your nose smashed. Sorry to hear you had to go through that, and I'm glad to hear you guys are safe and sound now!"
17,"Still wondering how the conversation with the roommate went. 

""Hey dude,  I am naked at my office because I wanted to take a picture with a temperature board. Please come help me. ""

Friend - "" lmao. "" *hangs up*"
18,"I know you aren't looking for advice, but go in person and apologize to the Asian chef guy and then your boss.  You'd be surprised how much body language can make a difference and making the effort might at least save your future"
19,"Phone died when it was being taken and the photo was never successfully recorded. I gave it to the guy and had to wait my turn due to the line, which was about 10 minutes. 

When it's that cold, your phone stops working in minutes. My phone will die within a 30-minute Cross Country ski session in my pocket when it's at 50% under 0F.

Going to do another this weekend if it drops another 10 degrees"
20,"I'll be honest, I expected it to be alot worse with the title.

Okay didn't expect this to become my top comment... "
21,Oh God.  Not your sisters tho
22,All I can think of is the episode from Arrested Development where Michael picks up that random Latino woman who doesn't speak English and he keeps making hand gestures like he's going to kill her. 
23,"No kidding, I think dude took blaming the dog to an entirely new level. "
24,Keep going I'm almost there 
25,"It probably broke because she sprayed a fire extinguisher at an electronic device, not because of cookie dough."
26,5 out of 10 Dentist recommend vag juice to fight cum disease.
27,The real LPTs are always in the comments. 
28,...can we see the picture?
29,What are you saying against my sister? She's healthy! She keeps herself clean! Some people. :-(
30,"""It was tremendous, such a large poo. Believe me, it was substantial."" ......I know it, you know it, we ALL know it. lol I read that in Trump's voice. "
31,That makes me love Canadians more than I already do hahha
32,They call that a hot tub? It's a tiny bath!
33,"&gt; I wanted to stay dry so I started hopping down the dirt road in my sleeping bag 

wutface"
34,"I mean, you didn't think to say, ""Oh, no! I accidentally dropped it in the toilet! I wouldn't use it..."" ??"
35,"Holy shit! I was there too: showed up late and got in the midst of the riot, but I was lucky enough to get out of there without any injuries. This just reminds me of what could have happened. O.O Glad you guys are ok now!"
36,"Use your girlfriend's foundation makeup - even if the texture looks a little odd, it should normalize the color"
37,"yes we are still very much together, the fact that she willingly continued with our trip after all of this, hobbling around with a knee brace, still blows my mind."
38,"I had an Uber with a hearing impaired guy a few months back. Uber notified me he was hearing impaired as soon as he was on his way to pick me up. Plus it was pretty obvious once you got into the car. 

After a few drinks though, I could see how you could oversee it. 

But that dude was probably one of my favorite Uber drivers. He was insanely nice and still blared music. He claimed to just like the feel of the beat. "
39,"Yea I know right, there was only 1.
here's the warning and the intake is in the bottom left.
http://imgur.com/a/BKOHE"
40,Holy shit. It looks like I'm the first to comment but I don't know what to say. This is real r/TIFU material. This belongs at the top of all time. Are you okay? What's your current status with everything?
41,A Jacuzzi is a brand name. A hot tub is a type of tub.
42,"Woulda been more exciting if Liam Neeson showed up getting chased by a carnivorous pack of wolves...

But alas... naked man shaking uncontrollably is enough to satisfy my sick mind.  Upvote for you, shriveled penis man."
43,You like that you fucking retard?
44,"Had he used one of his fries to wipe a dab of mustard off of her face and then popped it in his mouth, I'd be bowing to him.."
45,If it makes you feel any better...I did not know what a space cake was until now
46,"Pretty much. My roommate enjoys humor like this, so he gave me shit for a while. The fact that he came out that late with clothes means he's a great friend though."
47,Can't you book another flight? Fly separately if you have to. Meet up at the destination?
48,"Found the guy who punched you, OP! We did it! "
49,that's called Tuesday in Paris.
50,"I would add that if you want to apologize, do it for the right reasons.  Don't go there to apologize hoping it will save you, that is even more selfish and rude, it's also easy to tell when people are only doing something to benefit themselves.  

I would go to your ex-boss first and tell them that you know you fucked up, and explain to them what happened and that you would like to go aplogize in person, and ask for their blessing to go apologize first.  You insulted someone (I'm assuming) you have never actually met before, and there is a chance that going directly to them would only make the situation worse for your boss and his relationship with this other chef.

Don't ask what you can do to make up for it, don't ask for their forgiveness and don't go aplogize on a work level, you hurt this person on a personal level and by association made your boss look terrible.  But most of all, just don't bother if you're only reason for doing it is to get your job back because they will see right through that and it will be obvious."
51,"""And son, this is why you should never trust a stranger."""
52,TIL -40F is -40C
53,"""Oh no! Don't use that I accidentally dropped it in my vagina.""


""whaaaaaaa"""
54,"If you have time in the morning, head to a Sephora and pick up Kat Von D Lock it Tattoo Concealer. Get them to help you apply it. It'll cover it up."
55,Racist
56," You should have hung up the phone and denied getting it. Hell throw your phone out and get a new one, claim it got stolen"
57,"Once I was waiting to pick up a friend at the local light rail station and had some woman I didn't' know climb in back seat.  She kind of glared at me when I didn't immediately take off.  I said ""I think you are in the wrong car,""  she rolled her eyes and jumped out -and slammed the door."
58,"In case your sister ever does anything disgusting to you, you have a hidden card under your sleeve. "
59,"Actually, this is a great example of how even strangers can be trusted.  I mean, OP did apologize and return them immediately! LOL"
60,"..YOU..ARE..GROSS..



*...So gross that I had to use all caps...*  "
61,rip OP
62,"&gt;Out of breath, I stormed inside to find not my troop but a troop of 6-10 year old Girl Scouts, fully exposing them to my muddy dick and ass.

""... Yes, I will take 2 boxes of thin mints please."""
63,Respect the pouch 
64,This story belongs to /nosleep.
65,we're okay! back in the states safe and sound and still very pleased with our trip &amp; experiences in Europe overall. My girlfriend's knee is perfectly fine and my schnozz is still kinda messed up but whatever. I still cope with some anger and anxiety that stems from this experience but what doesn't kill you makes you stronger :)
66,"Well that, in addition to the fact that he cooks every night and is a solid ethical person in general... I'd say that he's a great friend."
67,"Way to think on your feet, not the shitting in the back yard part, the roommate cleaning up part."
68,Yeah you basturd
69,i didnt think of that all the way through reading until i read this comment and she only had like a second probably. youre a smart cookie
70,"Yea haha that's what we said, but it had the jacuzzi branding on the side so I guess it's legit?"
71,My penis was sad
72,"I wish. I looked at every single available flight. It would be 1098 for him to get there in time and we definitely do not have that kind of cash at the moment. 
"
73,"Christ, what an experience. Are you and Emily still together? Hopefully haven't had any experiences that bad since."
74,"""It is -40 degrees outside!""

""-40F or -40C?""

""Yes""

"
75,"Level 1 &gt; *Shit in yard* &gt; Level 2 &gt; *Blame dog* &gt; Level ??? &gt; ???

"
76,Hey it's me ur sister
77,"Not too related but a funny pseudo-similar story a friend told me about a trip to New Orleans.  He was out drinking late and needed to get back to his hotel on the other side of town.  He steps to the curb and goes to flag a taxi, a guy pulls over and he gets in and (pretty buzzed, not paying much attention) he tells them his destination.  They drive, chat, he said the guy was very friendly (my friend is as well) and after 10-15 minute drive they get to his destination.  He goes to get out and asks the guy what he owes him and he tells him nothing.  My buddy chuckles and says something about not being a good way to make money as a taxi driver.  The guy says, ""Ha, I'm not a taxi driver!"" After some confusion he asks the guy why he pulled him over and picked him up.  The guy tells him, ""You just looked like a nice guy that needed a ride."""
78,"Found except from OP's comment history: ""My ex used to love that. I'd offer her a massage every other week when she came home. It helped her sort of de tangle until I ripped off her underwear with my teeth and shoved my face so far up her ass I could almost swear I saw communist China. She was Lil kinkster that one""

I think i see the problem here."
79,An insensitive dick head?
80,You should see Wednesday in Glasgow
81,"Read this as ""blowing him"" at first. I'm going to continue reading it as that "
82,But how are his blowjobs?
83,"""fuck the phone"" pretty much sums up the situation.  Glad you're safe.
"
84,"&gt; Oh God.  Not your sisters tho

Trust me, his sisters juice is safe, tastes like pear juice mmmmmm

"
85,Fucking rude lmao
86,"&gt; apologized to the adult leaders, who understood and gave me blankets to cover up with

At least they understood you made a mistake"
87,"&gt;This is something I will take to my grave.

She said, unironically, to millions of people."
88,"I'm gonna be real here, you deserved it."
89,I'm potty training my 2 year old. After several falling into the toilet incidents I caved and bought one of those little baby potties. She was pooping while my boss came over for coffee to chat about my plans to come back to work (my boss is super nice and came to the house because I have a new baby and couldn't make it in to talk) and I guess when she stood up the dog ate the poop. She came running into the kitchen with her pants around her ankles screaming PUPPY ATE MY POOP over and over and then fell on her face. It was the funniest thing I've seen in weeks
90,"After having visited the city multiple times and reading your story, I'm under the impression that Paris is 30% romance and 70% straight ghetto."
91,"If your ~~fiance~~ girlfriend was expecting you to realise it wasnt her, she would not have arranged the date. Anyway, you were probably too anxious about the proposal to notice"
92,I think you dodged a bullet with this one OP
93,Was referring to the popular practice of blaming farts on the dog.  Dude blamed a SHIT. 
94,"As a counter read up on the Toronto G20 riots. 

EDIT: Not to shit on my country. Especially now Im a pretty proud Canadian. I just hate the storybook image people have of our country. We're not as friendly as we're portrayed! We have problems! We're human beings! I think its healthy to admit when your country does something absolutely terrible."
95,I hope to God she never finds out.
96,This is a genius solution except for the fact that suction cups never work when you need them to.
97,"HE fucked up by not trying to communicate he was deaf, ffs. 
"
98,Your first plan was to use toilet water to wipe your hands?
99,"If I ever write a book, I'm gonna seek your advice on the title."
100,Could be worse. suction cup DILDO
101,"A general tip I've heard for escaping riots is to move away at a perpendicular angle as soon as possible. The crowd generally moves as a blob so it's unlikely it will spill out left or right as opposed to forward, especially if the left or right direction are smaller side streets. Go with the flow from the sidelines until you can break off at an angle -- resist the urge to run directly away, as that's likely just the same direction the riot is moving, which you won't outrun. 

Of course, I imagine all this is much harder if you're getting teargassed and carrying an incapacitated girlfriend over your shoulder!"
102,6 out of 9*
103,"Mormon mecca of US? Utah?

Are you flying from inside America? 1098 seems like a lot..."
104,"Reddit seems to have a large pool of users who think mocking Asian speech is hilarious, but would go absolutely apeshit if you mock a black or middle-eastern person's speech. After having my karma wrecked for pointing this sort of thing out in the past, it actually humors me to see people getting slapped in the real world for it.

Edit: Thank you for the gold kind stranger!
"
105,"My husband had his nose broken and became crooked years ago. It causes chronic health problems for him and it will be thousands of dollars and intense surgery to fix it (and we are not guaranteed the surgery will be successful in fixing the problems). Please get your nose fixed now instead of later. It may just be cosmetic right now, but years from now it might cause you a lot more problems."
106,"...huh, TIL"
107,Why would you just start yelling that down the phone for that long without even waiting to hear a word from the other person? Got to say the perfect storm of coincidences in this makes me a bit sceptical.
108,Can I ask how you managed to witness such a thing
109,Its better and worse at the same time.
110,Also wear dress in their ceremonial clothing so they know you are serious and don't stop bowing.
111,Breast customer service experience ever.
112,Ya I'm sure my VERY religious VERY conservative family would love that. 
113,"Who thinks: ""It would be *hilarious* to not spend Valentine's Day with my boyfriend, and instead send my sister to our date in a fancy restaurant.""

How could this possibly go wrong?"
114,"I'd say it makes him a *good* friend, as not doing it would make him a spectacularly bad friend. Saying that deed made him great is implying he'd still be a good friend if he had left you out to freeze."
115,"What the fuck would he call you over at midnight to have that conversation?

From your account, why did he feel the need to have that conversation at all?

At any rate, I'm sorry that happened to you, that must have hurt."
116,I had a deaf Uber driver the other day and the first thing he told me when he got in the car was that he was deaf. It woulda been really awkward if he would of said nothing. He talked the entire time but he was really nice.
117,"You and /u/reincarn8ed need to start a research group.

https://www.reddit.com/r/tifu/comments/5ipczw/tifu_by_attaching_my_girlfriends_new_dildo_to_my/"
118,"Inb4: ""TIFU by asking a stranger a favor and getting my first facial"""
119,She doesn't. She's never heard of it. 
120,Obligitory name checks out
121,[removed]
122,"On the bus: ""excuse me ma'am, you've got some cum on the back of your dress""

""that's just yoghurt""

""I don't cum yoghurt!"" 

   "
123,You're fucked if she uses reddit.
124,The real comments are always in the LPTs.
125,I'm pretty sure his hindsight was 4/20.
126,"Growing up my best friend's brother was deaf, and he would blast his music because he still liked the feel of the vibrations of the music. "
127,They did that same joke in New Girl where Nick picks up a random Indian lady instead of CeCe's mom. Quite hilarious both times.
128,This pun was quite shitty
129,"&gt;TIFU by exposing myself to a Girl Scout Troop

Oh boy, here we go.

&gt;Wasn't today, but rather when I was about 14. 

Considerably less spicy.   "
130,You are smart my friend.
131,Agree. If she has any tints layer some yellow and green and then skin tone.
132,"i really wonder about these kinds of tifu's. it sounds like you were actually being racist and trying to be funny and were called out by a guy with no sense of humor (and rightly so). and then you cooked up this story about how all that racist shit is just innocent pillow talk with your gf. idk, i mean it seems maybe plausible, but come on. pretty fucking coincidental. anyway if you are lying, you suck at lying. if you're telling the truth, then damn. your truth sucks. "
133,"yesss it was crazy man, you see, we thought that we WERE moving perpendicular, but the combination of not knowing our surroundings well, being disoriented, and not understanding what was really going on, we ended up right in the belly of the beast!"
134,"Color correct underneath to help cover the redness and put powder on top so it doesn't sweat off. Your girlfriend might have something to help as well. Good luck!
Edit: girl's friend &gt; girlfriend "
135,"Did anyone else think of the short story, ""guts"" while reading this? Could certainly have been worse dude!"
136,"For real. And you're telling me he doesn't have his own girlfriend's work number in his fucking phone? Even though she calls 'all the time?' How does he ever call her during the day? 

Im calling bullshit, OP. "
137,"In France, rioting is used more as a past time than for any actual reason."
138,"Were I a Girl Scout leader and a little kid ran into my shelter naked and muddy, I'd just feel bad for the kid. Most leaders that I know are middle aged moms and most fourteen year old boys still seem pretty young and *relatively* innocent to me. 

"
139,"Yes, SLC. It really is a lot sometimes we have awesome deals with alaskaair but Delta was the only one that would have been able to get us there in time for the ceremony....assuming that traffic wasn't a nightmare. I feel like my good girlfriend points are in the shitter with this fuck up. "
140,"My parents just went on their dream trip to Paris and London. My mother has romanticized Paris her whole life. She was horrified. Someone attempted to pickpocket them as soon as they got off the train. Place smelled of urine.  Then a bunch of sign our petition children. Then the hotel was a slum.


On the upside they said London was amazing, cleaner than expected, they thought it would be a slum compared to Paris, but it saved their trip. I think my mother's heart was broken and rebuilt in the span of a few days. "
141,Or color your whole face red so it doesn't stand out
142,I regularly put the cheap shitty chocolate chip biscuits they supply at work into the microwave so the chocolate melts. One time I put some on a piece of paper towel as all the plates were dirty and put it in for 2 minutes by accident instead of the usual 20 seconds. I left the lunch room and when I came back the room was full of smoke and the microwave appeared to be on fire. I opened the door and tipped the microwave over the edge of the bench so that the biscuits and paper towel slid out into the bin below. At this point the bin caught fire as well. I dragged the bin outside but not before several co-workers came in to find out if the lunch room was on fire. My boss was not impressed. They still give me shit about it years later.
143,I think Vapour rub would have been worse than Vaseline that's all I'm going to say 
144,"A Jacuzzi is generally a tub with jets, where a hot tub is meant for multiple people, and not for bathing."
145,"Yup, waiting for reports on the news about this guy's Darwin Award."
146,♪ Somethin'-kinda-filthy-is-excreting-from-my-ass-cheeks ♫
147,What a bitch this girl was. I personally would have found this endearing and would have had two space cakes... The space cake and the... Space Cakes. 
148,Everyone eventually finds reddit.
149,hahahahahaha sorry... after flying delta for years I needed this good hearty laugh. partial refund.. delta.. oh you..
150,Mac told you not to put your butt on it. No matter how good it feels.
151,reminded me of this: https://www.reddit.com/r/tifu/comments/5h7whe/tifu_by_almost_kidnaping_the_wrong_grandma/
152,"Yeah? Let me know how that goes... ""dude, I only perpetuate terrible racist stereotypes in private, away from Asian people, and only to make my girlfriend laugh, honest"".

Nah, this is definitely a ""you fucked up, best you're going to get out of it is a life lesson"" kinda thing."
153,Bet your sister's toothbrush moonlights as a little miss pussy scrubber
154,Welp. She's gay now. You turned her. 
155,"3 consecutive anecdotes isn't enough, we need more! "
156,"A few years ago I was waiting to pick up a friend at a local light rail station around 10pm in my 1994 Toyota Rav4. I see this big dude walking up to my car like he knows it. I act quickly and lock the doors right as he grabs for the handle. He taps on the window and is like ""haha come on dude"" and I roll down the window part-way and say ""uuh, you sure you got the right car?"" He does a double-take and is like ""Woah, I swore you were my friend. He's got this exact same car!""

Probably would have been more awkward had he gotten in!"
157,"::UPDATE:: I did receive a call a few minutes ago. The HR lady asked if I would be attending the training today. I assured her that I was. She asked if I could stay a minute or two afterwards. I said sure, and that I'm pretty sure I know what it's about. She laughed, and said she's sure I'm right. She signed off with ""no worries"", so I think I'm okay."
158,IT IS BEANIE TIME!
159,Answering your SO's calls with a stereotypical Asian accent is pretty racist on its own. All that happened here is you were caught out.
160,"As an Englishman, few things make me happier than people finally realising that London is superior to Paris ;)"
161,"That sounds completely abusive, is there really nothing you can do ?"
162,I felt my dick after reading this to make sure it was OK. Jesus Christ dude.
163,It's not everyday you can say that your vagina was inside someone. 
164,"No, Fairbanksans help each other out often. It's actually illegal to not pick someone up hitchhiking when its -20F or colder.

When I moved up here, my first boss gave me a free place to stay for a month. That's just the kind of people who live up here."
165,shit was crazy man! we just did not appreciate how volatile Paris is until we found out firsthand. 
166,Sigh *unzips*
167,You're a mod?!
168,"Tried imitating anime without doing the training you mean!

One hundred pushups!

One hundred situps!

One hundred squats!

Ten kilometre run!

EVERY DAY!

NO USING THE AIR CONDITIONER EVEN WHEN IT'S REALLY HOT."
169,"&gt;A crowd gathers ogling my girlfriend's knee and staring at me blankly as I shout shit they don't understand like ""911! AMBULANCE!""

The French for ""ambulance"" is ""ambulance."""
170,"yet... 

:O"
171,"""I punched some guy in a riot, AMA!"""
172,Stupid sexy Canadians always doing things right.
173,well maybe i can but I really don't even want to keep working there after the way he treated me.
174,"""-40K""

""Do you know what kelvin is?""

""Yes"""
175,Damn horse cops. http://imgur.com/Awe0oc6
176,I'm Chinese here and I've never heard of a dog paw broth before...is it good?
177,"I don't know why, but all I could think of while imagining this is Mortal Kombat. 

""Relax"" 

your gf: ""FINISH HIM!"""
