,text
0,"Thanks, OP, now chips are also banned by the TSA."
1,Don't feel bad --  I once drove 13 miles home after work to a house I had not lived in for 3 months.
2,"Bad day at the office.

I believe 'Bear Repellent' is also banned. Tragic really, given the number of bear related deaths each year on planes."
3,"&gt;He decided to punish me internally

( ͡° ͜ʖ ͡°)"
4,"My car was rear ended and totaled about two months ago. I have been riding the bus to school and work. I finally got a car Monday morning, drove it to work, did my shift then walked out of work and rode the bus home. I left my car at work. "
5,"i wasn't gonna go to work, but then i got high"
6,"I remember reading on Reddit once about a guy who drove to the bar to hang with some friends. Got drunk and decided to take a cab home instead of driving. The next day he took a cab to go get the car, forgot that's what he was doing, got drunk and took a cab home. "
7,"OP, listen, this is very time sensitive. 

Now we have all heard how call center jobs can be shitty jobs, pun intended. So, the question is, do you like your job, and is your boss a dick?

If you answered no and yes respectively, you need to *shit on your bosses desk*"
8,"I hope you had a second one to roll up after that whole ordeal. 

Hope your Dad feels better by the way, I know those feels."
9,"Haha ouch. Muscle memory really can get you! I woke up this morning, went to work for an early meeting which lasted all of an hour rather than all day. Went to get the train (going back home from customer site), train was delayed so automatically went into the pub and asked for a vodka cranberry, sat down and realised people around me were eating breakfast...was 9.50am rather than the 5pm is assumed , interesting way to start the day"
10,The real fuck up is not eating the donuts but lying to your mom on her death bed. 
11,Settings -&gt; Safari -&gt; clear history and website data 
12,they got these things called curtains
13,Go see a doctor like immediately it sounds like you might be getting an acute infection that is likely to perforate your eardrum very quickly judging by your symptom progression
14,"Hyperinflate to not crush the chips : That's what they say

Hyperinflate to reduce the number of chips : That's what it actually is.

Source : Born and brought up in India."
15,When you're sitting on the crapper and you feel something shatter.... 
16,"All you had to do is remove ""the blunt"" from your sentence.

Don't be so obvious. Talk about it without talking about it.

""Yo, you smoking out back?"" wouldn't have gotten you in trouble. You both already know what you're talking about smoking; you don't have to be so specific. Let other people assume you're talking about cigars or cigarettes."
17,I mean...that just sounds like an enthusiastic drinking problem. 
18,"Should have shouted ""ALOHA SNACKBAR!"" after you found out it was your bag and your chips. lol "
19,Or the beginning of a cab addiction. 
20,"According to the title, I thought it would be the car dealership employee firing story from yesterday, from the (now former) colleague's point of view."
21,http://i.imgur.com/sJqhXmH.jpg
22,Yeah I got lucky with my cell. Fibre optic straight to my door.
23,"The lesson here: whatever you do, donut ever lie to your mother. "
24,Why wouldnt he just say it was nothing to do with him and delete the message? 
25,"Any consequences?

Did you get arrested and handed over to authorities and then write this post out of your lonely cold prison cell as a warning for the world not to repeat your mistake?"
26,"Poop directly into your other ear for comparison first, though."
27,Had a buddy that used to piss in the closet when he got drunk too. Any closet. Lots of piss. :-|
28,"Dude, I used to work for a call center. Go into whatever Aux code you use for emergencies, tell a sup you're feeling ill, go take care of business, then tell the sup you feel better and get back on the phones. Unless your compliance is way fucked you wont get fired for it."
29,"Wow, those customers are a bunch of fucking snitches"
30,"Please don't squat on the toilet. As a maintenance man i can tell you those porcelain fixtures break like the sharpest cutting surface known to man. Severing the artery in your thigh and you bleeding to death.

Please do not do this."
31,Tell me you replaced the oil afterwards.
32,"I work in a dealership too (not in sales) and based on the salespeople I know, reading a text message out loud in front of a customer is playing Russian Roulette at best.  It sounds like he screwed himself on that one."
33,"And if you get fired for a bodily function that has to happen,  labor board.   Fuck them if they bitch. Even in school I never understood this

""no Timmy,  you can't go to the bathroom""  fuck you.  If I ever hear a teacher denied my son the right to the bathroom.. I will shit on their desk"
34,The rael LPT is in the comments.
35,Will you tell the doctor the truth? Or do you need us to concoct an absurd cover story on your behalf? We stand ready. 
36,"Giving me flashbacks.  I knew better than to take any kind of ""chocolate"" off the counters because my grandmother fed 8yr old me full adult doses of it when she decided I hadn't shit enough and it Always resulted in what I fondly remember as ""gravy pants"" for the rest of the day every time.  Serves her right! "
37,Am i the only one that didn't understand what was going on the whole time?
38,Actually in this case he got screwed over by *not* smoking the blunt at work.
39,"Should have been able to play it off as a rude joke, not meant for an audience, just a bit of razzing between coworkers...Rough break."
40,"Haha, I read ""Are you stupid or Catholic?"""
41,http://i.imgur.com/GDd88iY.gif
42,"This. Run to the crystal healer NOW if you haven't already!!!

edit: minor text fixes"
43,"what the fuck? This one kid in the dorm adjacent to mine, my freshman year, got so drunk he shit in his hat. Then stuck the hat in his closet hahahahah"
44,This made me laugh way more than it should have.
45,I feared as much. Chips are basically the 4th base element: air.
46,Urine for a tough conversation when you address the elephant in the room
47,"Right tho? It's more of a ""I fucked up a little bit once, but then SUPER fucked up years later"""
48,"I was hoping this would have something to do with Samsung, but I wasn't disappointed."
49,"Yeah so my contact came up so he just hit the read button, which read the message outloud"
50,"I had a teacher in high school tell me I couldn't go to the bathroom. About 5 minutes later, I started walking toward the corner fumbling with my pants. She asked me what I was doing, so I said, ""well which corner of this room would you like me to piss in?"" 

I got sent to the office. 

Stopped by the bathroom along the way. "
51,You can be jailed for 4 years if you take a Note 7 on a plane now.
52,"Or show them your penis and point at it, this is how I solve most of my problems"
53,"While asking between themselves ""6 or 12 inch subs,"" the worker heard 6 12 inch subs and, since very busy, went through making them. 

At least that's how I understood it."
54,"This is the correct advice. Also, if the boss left it's coffee cup on the desk, you should try to shit in there."
55,"It's a weird elephant in the room now
"
56,Diarrhea....nice to seeee yaaaaa (singing)
57,"Always listen to your gut, or your friends in this case. "
58,Talk about dropping the bass huh?
59,He couldn't bear it anymore.
60,Also by smoking blunt at work.
61,You didn't consider that everytime you send or receive the script your phone crashes. I am really curious about you sending or receiving the Bees movie script multiple times.
62,"38 weeks is not considered premature, it's well within normal bounds of when labour should occur."
63,"Last time I got that drunk, I also left my car and took a cab home. Was super lucky, since there were check points along the way. They just waved the cab through, of course. It was convenient since the next day the cab was already on my lawn so I could drive it back to my car. "
64,"Man, those were the days."
65,That pun made my eyes glaze over.
66,"No need, the only thing in the lighter was oil after all."
67,i regret so much
68,"Naaaa this ain't no accident, you are fully involved now,. It's your path, your destiny and there will be no turning back from this. Now go show them who you really are."
69,"I like this TIFU.  It's not 20 paragraphs and I don't have to look for the tldr.  Simple, to the point, doesn't seem like it's begging for attention.  Gradation A fuckup"
70,It didn't because it's a fake story. /s
71,"Write up a sign that says ""Sorry, I'm peeing and don't know what else to do"" and hang it on your window when you go."
72,Username checks out
73,"Driving into Italy for a holiday with the fam.

&gt; Older brother, 17 year old dude fixated on his inability to grow a beard: you have a moustache.
&gt; 
&gt; Me, a 16 year old insecure girl: Shut up.
&gt; 
&gt; Brother, poking just over my upper lip: I can feel the moustache.
&gt; 
&gt; Me: mum, make him sto-
&gt; 
&gt; Mum: flakeysponge *chill*, he's just jealous you've got a better moustache than him.

Shut us up for the rest of the journey."
74,Of all things why would you use your wallet?
75,"I bet if we undo your turban we'll see Jared's face on the back of your head. 

Protip: sandwiches are horrible horcruxes, and souls taste good with pickles and mayo. "
76,"If she's a single mom, couldn't hurt to check in with her after the police finish their investigation to see if she needs something also?"
77,"How do you explain poop in your ear better than his story? That's probably the least embarassing it's gonna get. It's so not-embarassing it's kind of suspicious, the doctors probably think OP's got a scat fetish."
78,The silent killer
79,"Had a friend get hammered with me and my friends, so hammered he pissed his pants and his crush had to help clean him up and put him to bed. They started dating the day after. I'll never understand some people's luck with the opposite sex. "
80,"LPT #2: Dont buy an iPhone


Edit: No, not a Samsung, I am an Xperia guy"
81,Hindsight is $20/$20
82,"love to break into indian chip bagging facilities and let loose rank, bare-assed farts into the bags before they're sealed"
83,Timely advice.
84,Happens. I once drove to a job I had when I was eighteen. I was twenty six at the time. 
85,When you're climbing up a mountain and its spewing like a fountain...
86,"Curtains in a bathroom, are you stupid or chaotic?"
87,"The worst part of it is the realization that ""this is not where I'm supposed to be."""
88,"I had some guy nearly t bone my car and said something about how that fucking asshole needed to learn to drive. So my 3 year old immediately said ""fucking asshole.""

I told him those were daddy words he can't say, just like he has words I can't say. 

Now I can't say booty-butt. 

It's a fair trade. "
89,"Didn't feel sorry for John in the slightest, and it turned to outright disgust with the way he reacted. If i was him, if I got caught I wouldn't get mad at anyone since thats all on me."
90,"Coach: ""This is what you don't do...""

*Coach screaming in pain*

Kids: *Applauds good acting*"
91,Wu-tang style. Anything less and she is gonna destroy you 
92,She saw what was in his pants...
93,Indian chips are da bomb.
94,Ooooh ooh ooh
95,This deserves its own TIFU post
96,"Running on auto can really fuck you over. I was once so out of it that I nearly took a whizz in my kitchen bin. I caught myself just in time but I was right there with the bin lid up and my dick out. No one saw but I was still mortified, especially since this was when I was younger and still living with my parents. It was so jarring as some part of my brain was just screaming ""ERROR ERROR""."
97,"Yep, I don't get how he ordered extra sandwiches"
98,"you got off easy, I saw pictures a while back of guy that had done exactly this and had a nasty to-the-ass-bone deep gash that ran all the way down his ass and then some. Broken porcelain is incredibly sharp"
99,"Seriously though, I'm also curious how it unfolded from there."
100,And a bit lighter
101,This!!! Like holy shit squatting on a toilet not designed for it is incredibly dangerous and it's not uncommon for people to be cut from thigh to behind the knee to their waist when they break. Toilets are not designed to carry the entirety of your weight on two pressure points on the rim. Google the carnage of squatting accidents when toilets break if you want to see some horrific injuries.
102,"There is always that little fragment of doubt in the criminal's mind - that as soon as he confesses, his mother will jump up out of the hospital bed.  
""Ha! I got you! I don't have cancer at all, and now you're grounded for the rest of the summer!"""
103,Make the Cubs win
104,The ræl LPT is in the comments.
105,OP's dog basically gave birth to a baby 
106,"The worst is when a teacher won't let you go because several other people already went that hour. Like what the hell, It's not my fault that everyone else's bladder is magically in sync with mine."
107,"What piece of shit customers, is all im thinking.

""Ummm... Excuse me? Yeah, uh... Out on the test drive with dave earlier and he got a text message referencing the smoking of a mary-ja-wanna...umm... 'blunt' i believe was the slang that was used? I just wanted you to know that i am quite ups--NAY, APPALLED at my being forcibly subjected to that kind of blatant promotion of illegal shennanigans! Ne'er again shall you ever hope to see me step foot upon this Mazda dealership, this despicable place is obviously not worthy of my medium-sized price range.""

Fuck you, you fucking job-ruining fucks. You knew what you were doing. You got that man fired and you knew you were doing it. "
108,Have you tried clearing cache/history/cookies? Might help.
109,"If this all happened because op had gotten drunk before going to work, people would be calling him an alcoholic and telling him to get help, not saying he should get hammered again when he gets home.  "
110,You did what Hillary couldn't 
111,"Fire on a plane ain't no joke. 

&gt;On 2 June 1983, the McDonnell Douglas DC-9-32 operating the service developed an in-flight fire behind the washroom that spread between the outer skin and the inner decor panels, filling the plane with toxic smoke. The spreading fire also burned through crucial electrical cables that knocked out most of the instrumentation in the cockpit, forcing the plane to divert to an alternative landing field. Ninety seconds after the plane landed and the doors were opened, the heat of the fire and fresh oxygen from the open exit doors created flashover conditions, and the plane's interior immediately became engulfed in flames, killing 23 passengers who had yet to evacuate the aircraft.

https://en.wikipedia.org/wiki/Air_Canada_Flight_797?wprov=sfla1"
112,allahu snackbar!!
113,That piss test though...
114,"Just say some totally fucked up and depraved shit, ODB style.  Then talk about smashing her nuts on the dresser."
115,"I was drawing dicks on on a barrier in Afghanistan with a fire extinguisher sized can of spray from a good 20 feet away. The wind caught it and brought it back to the source. The feeling I endured leads me to believe it would make a bear back away.

Edit: Neat"
116,The fuck? You were gonna look up the lyrics but then you got high?
117,[deleted]
118,Oh piss off
119,"Reminds me of something my buddy did a couple years back. He lived in Montreal, his girlfriend lived in Quebec city ~3 hours away. He'd drive up there every friday night, drive home early monday morning and go straight to work.

One monday morning, it was getting kinda late... 10-11 rolls around and my manager who was sitting right next to me gets a call, chuckles a bit and hangs up. Turns out buddy who left Quebec city took a wrong turn and was half way to New Brunswick before he realized his mistake."
120,snitches get stitches 
121,"When I was around 8 I was constipated so my mom gave me one square of ""chocolate"" and said it would help. Well, aparrently it was the same thing as for you. Too big a dose for little me. I never told my mom again when I was constipated in fear that she would bring out that chocolate. "
122,"It's ok, OP! Eventually this will all be a blast from the past."
123,Unlike a Samsung which just self destructs to save you time.
124,You just can't work with some people yeesh 
125,**WHAT HAPPENED TO POWER LINE BEAR?!**
126,Nobody likes you when you're 23.
127,"I feel ""it's"" is the appropriate pronoun for some bosses. "
128,"When that happens to me (usually while I'm driving) I always ask myself ""how have I never had a car crash while driving so mindlessly?"""
129,10/10 TL;DR
130,Well that makes sense. Fucking narcs.
131,Today I'm Fucking Uwesome???
132,"I anticipated, I laughed, I cried. Amazing story there, such a shame you never got to tell your mom the truth. :( "
133,Humor is a great way to help with the feelings of hurt. Sorry about your wifes lack of humor. 
134,Yes
135,http://m.imgur.com/gallery/p30oQ
136,Don't pair your phone up to an automated message reader if you smoke blunts at work.
137,"SIR, I ALREADY TOLD YOU THAT I AM NOT A SANDWICH PERSON."
138,"My girlfriend worked at his restaurant for a couple years. When she left she never actually ""left"", they just started leaving her name off the schedule. Gotta $100 gift card in the mail the other day from the company that owns the restaurant and a congratulations on being with them for 5 years. "
139,"You work in a job where you're not allowed to go to the bathroom outside of allotted time slots? Even if it's a case of ""I'm going to shit my pants/throw up everywhere"" ? "
140,"To be fair, if he has that severe of an allergy then he should be paying more attention at a restaurant like that. You didn't mention that he told them about his allergy. Did he? Because if he didn't that's a huge mistake right there."
141,"Aha, I went yesterday and I had a story myself. Wasn't anything that happened to me, I was just an amused observer.

&gt;Worth the trip to subway just to hear the woman in front of me fail to understand the difference between 6 and 12 inches. 

&gt;""Ma'am, do you want a six inch, or a foot long?""

&gt;""Excuse me? What?""

&gt;""Sorry, did you want a six inch, or a foot long""

&gt;""I don't know what that means.""

&gt;...

&gt;...

&gt;""Do you want a big sandwich, or a small sandwich?""

&gt;She actually got increasingly infuriating. To the point where, while attempting to make her second sandwich, the man behind the counter decided that he'd had quite enough and walked away.

&gt;Another guy in the back caught him and asked him where he was going - without a response. My eyes were following upset sandwich man, so the new guy exchanged a cursory glance with me while he realised what had happened, and had to come take his place to resume sub-par sandwich production. 

&gt;It was great."
142,"Bear repellent is serious stuff.  It's pepper spray.  The stuff cops use.  Same thing.    In Canada it is considered a prohibited weapon if used against a person, even in self defense.  There are no personal defense pepper spray for civilians here.

anyway... the bear spray stuff is generally better than most ""put in your purse"" type jobbies.  So anyway...  I ended up finding some in the street a year or three ago.  Plastic wrap, orange safety clip still zip-tied down on it and all.  Very grenade like.

On the can it says it has an EFFECTIVE range of 18 feet.    It has 0.857% capsaicin and 0.753% capsaicinoids.  It empties the can (think spray-paint sized) in 8 seconds.  That's a LOT of hot stuff.

Doing this in an enclosed space would be a very very terrible idea.  It would SERIOUSLY endanger the lives of the people on board, no question.

Also they're extremely flamable and explosive.... being aerosol cans and all.

oh and you gotta show ID, and the store you buy it from keeps you on file, how much you bought, address, etc etc..  dunno why but I looked it up when I found the can of spray.  Better me find it than some kids.

"
143,And melted plastic 
144,How many RTs to post video to reddit?
145,That's why you don't do drugs on the clock.
146,"That's hilarious. Not the text, but the fact that the infotainment system even worked. My cx-5 one is garbage."
147,Lots and lots of piss.
148,"fellow unanticipated belly-laugher over here as well, compadre."
149,"He's obviously lying. Each of those sandwiches has different meat, and the guy above is right, they wouldn't just start making sandwiches without confirming bread type, cheese, and meats first. OP is full of shit here.  

ETA: also, three drinks? Why get the extra drink if it was just him and his girlfriend? Lies. All lies."
150,"Don't know about you guys, buy when I pee I'm usually watching down, careful bout the aim. I wish I was that confident not to think about it, man"
151,And a fantastic deal on a new Mazda!
152,"Den virkelige LPT er i kommentarer.

Edit: I studied danish for a whole 8 hours."
153,I'll be honest. When i saw this involved food and an international flight i thought the explosion was going to be bowel-related.
154,I'd kill for a silent ride sometimes
155,"What does that have to do with ""I need to be human, now."" ? What kind of fucking world do we live in when grown adults aren't allowed to shit except for at dedicated times?"
156,Nah that's just a great little kid story. Mom fucked up not hiding the donuts better. But lying to her on her death bed is just bad
157,And sorry about your wife's moustache
158,"Damn, your mum got the entire ""two birds with one stone"" thing down!"
159,"Was walking home from the gym, got caught up in some kind of political demonstration (there seem to be plenty of these around right now), got hit by something, splattered crap all over my clothes.  I think it was a water balloon full of shit that someone was trying to throw at cops.

See, the secret to lying:

- straight face, not too much emotion.  Stay factual
- keep it simple (not too many details)
- keep it convincing - if you can work in a plausible context, it'll be easier to believe"
160,Da ra rhat da dararah
161,"Yep, can confirm, when I was 17 and out on a drunk with the boys, friend found a can of bear spray. Proceeds to spray the handles on cars of ppl who pissed him off that week. Then decided he had to pee. I'll leave the rest to the imagination. 

EDIT: Like every other Redditor that doesn't expect a comment to be their most upvoted, totally didn't expect my top comment to be about buddy bear spraying his dick.... "
162,Your story has a few holes. 
163,Sounds like a cool cat 
164,"Nope nope nope nope, it's the last time I listen to someone telling me to google something."
165,"Instructions unclear, brought a blackberry

why ^is ^^no ^^^one ^^^^on ^^^^bbm?"
166,"Back in High School A large group of my friends went to party in an empty mansion that was on sale (One of my friends' Dad was a Real Estate agent, so he stole the key to this house so we could party in it).  We proceed to get absolutely smashed and everyone passes out on the floor somewhere (no furniture, house was empty).

I wake up to some rustling and this big sigh of relief as I start hearing the piss hit the speaker.

Apparently my buddy thought that a very expensive, built into the wall stereo speaker was a urinal at 3 in the morning.  It no longer worked after that.  My Friend's dad never found out how the speaker broke."
167,"I think OP was at work.

Not sure about the rest of you, but I don't have a pizza oven in my kitchen. Just a regular old oven."
168,"&gt; Grrr...

Found the bear."
169,"Doesn't matter, you can damage the internal blood vessels. Take him to a Doctor, at worst you have a few hundred dollar bill for examinations if it's not needing treatment."
170,Its an iPhone dude...you have to send it Back and let it repair for a fortune
171,"Exactly, its hard to feel too sorry for the guy who's getting high at work and driving cars/customers around. Not a good look."
172,"I taught high school for several years and I always let my students go to the bathroom. The only rule was that they couldn't go in the middle of a test or when I was teaching a new concept. 

It was only a problem one time. A student asked to go to the bathroom and was caught smoking outside by a custodian. He lost his bathroom privileges in my classroom. I told him to go before or after my class."
173,"Yeah I can see it now..

Boss: ""Joe, why do you smell of alcohol at 10am?""

Joe: ""Yeah sorry, because of muscle memory I went to the pub and ordered a vodka cranberry""

Boss: ""Oh that's ok then, carry on"""
174,There's no shame in asserting dominance.  Maybe you should extend the window so your neighbors can see your magnum dong.
175,"Lesson learned. Never use your phone to discuss anything illegal. But how your boss ""Punish you internally""? For some reason I pictured some kind of Frat boy hazing taking place after closing hours with you bent over a Mazda 3 lmfao"
176,DOGOBGYN
177,"Ah, inebriated at work, while working with boiling oils and such. Fair enough, I suppose. "
178,"Since the Earth is not a rectangle (citation needed), depictions of land on maps have some degree of distortion. Thus, it's often most efficient (read: shortest distance) to take a route that isn't a straight line on a map. This is called the great circle distance. "
179,Fuck yeah I did. Forgot to mention it has Tupac's face on it. Anything for Pac fam
180,Would make the next fry crisper 
