,text
181,"Like many unfortunate people, I was bit by a dog when I was very little. The owner was careless and did not recall the dog when I was afraid and started crying, instead he told me the barking dog ""only wants to play"". Every time a dog barks at me, even behind a gate, I still get a huge rush of adrenaline and discomfort and the hair on my arms stands up. My lizard brain is telling me I am about to die, even though I know it's not true. Please keep your dog contained from now on."
182,You give TAKING A TOILET BREAK a whole new meaning!
183,Also on the same thought train
184,"lol, have fun explaining that one to the water dept. when they come knocking. "
185,"""Waiting for gif to load. Reads the title."" NOPEEEEE ""exits back to the safety of reddit."""
186,"Take him with her. 

/s"
187,"If the tone changes, you've already fucked up and it's too late."
188,"You know you don't have to pay the fine if you buy a ticket. You either pay the fine OR pay for a ticket, if the ticket is more than 20 you get the ticket and no fine. 

I know this because I've been to court with the dicks and they ended up having to pay me the £20 fine back because my ticket was £30 something. "
189,"Coach: *crawls off the ice while other coaches crack jokes to keep things light and take over coaching his group while he gets medical attention*

Kids: *pay no attention to the injured guy and are confused when he comes back*"
190,"Shooting, even with an airgun, at another persons house? Geez that is idiotic"
191,"Yep, I did and they said they'd take care of it Monday. I made sure I apologized because I couldn't imagine fishing some idiot's wallet out of an elevator was what they'd like to do with their time."
192,Did they welcome you back? Playing along as if you'd worked there 8 years.
193,It'll never be a plane story though
194,I laughed way too hard at this 
195,"Well, happy 23rd birthday, OP! :D"
196,"Turn it into a teen romcom.  Your last rhyme should be...  
""I'm gonna finish this off it's gettin late.  
I just want to know can we go out on a date?""    


Knowing nothing of your relationship status, sexual orientation make this happen, because I live vicariously through other Redditor's lives. "
197,"Yeah, I once rode my bike to the store, walked home, and then reported my bicycle stolen the next day when it was missing from outside my building.

A few weeks later I went back to the same store and saw a familiar looking bike parked on the rack.  Start heading over there while thinking ""Do I have whatever I need to prove to the police that this is my stolen bike"" until I realize it is locked up with my own lock."
198,It's a meme.
199,Does it count as joining the mile-high club if they got Lay'd?
200,"The people below the locker with my bag in ir heard the bang directly above them, so found it pretty quickly."
201,"""It"" is certainly the appropriate pronoun, but ""its"" is the appropriate possessive form."
202,Blink twice if theyre watching..
203,Hold up.... Why is a flight from Delhi to London above the Atlantic? Other than that I thought OP was gonna share how he caused a bomb scare because of the massive farts caused by Indian food mid flight.
204,"When my grandma pulled me aside to look at my chocolate smudged mouth, I just say: ""this ain't chocolate, it's doodoo baby!"" 

Grandma: ""Gawd damn!"""
205,Bursting with flavor.
206,"Did something like this to one of my friends in high school. He liked to experiment with different drugs, so being the funny man I am, I gave him an herbal laxative while my friends backed me up saying it was a new drug on the streets. About 45 minutes later we're finishing up our dinner at mcdonalds when his flood gates open up. He was on that toilet for almost an hour. "
207,"Squatting?! You crazy fuck, that porcelain can tear your ass up! Just google the injuries you can get from it.

Next time, sing ""Here I Go Again"" whilst rocking back and forth, then cough and bang on the side of the stall whilst doing your best chewbacca impression. This releases the poop into the toilet bowl. Works every time."
208,"No worries dude ive done similar, at my old job we had a locker room so we didnt wear out uniforms coming in. So while walking to work i ran into some friends and stayed to chat for a bit and have a few smokes. We ended up going to the bar for several hours i went home and set my alarm to wake me up for work and then realized what i had just done."
209,She needs some big ole cock in her life
210,And don't forget to record it for cringe and get all those Internet points too! 
211,Damn those customers sound like massive dickheads 
212,"According to all known laws of aviation, there is no way a bee should be able to fly. 

Its wings are too small to get its fat little body off the ground.

The bee, of course, flies anyway.

Because bees don't care what humans think is impossible.

-----------------------------------------------------------------------------------

It is heartbreaking to see the amount of people here that don't know this is the opening narration of the bee movie."
213,What about your boss's boss? You need to go up the chain. Shit on the CEO's desk if it comes to that. Can we count on you?
214,( ͡° ͜ʖ ͡°)
215,the pun is real
216,The food on that flight was so spicy that's not all I was letting out I'll tell you that much
217,"how much careful could he be? Want him to put a giant 
##**/S?**"
218,"My brain is completely switched to the automatic mode. 

Once i was making a dinner with my girlfriend, and we were having a serious conversation. I grab a ""tomato"" and starts washing it. 

I keep washing it until i saw my girlfriend started laughing uncontrollably. 

I was washing a damn slice of cheese.

"
219,"They could have used it to get a great deal on the car. 

""Are you sure that's the best price you can offer? You can't toke, I mean take, any more off?"
220,"Dude, your father will be fine. Stay focused, relax, take things one step at a time. Go see dad, give him a hug, if that's allowed in a British hospital, and don't fire up a joint in his room; there's oxygen and stuff there and rules about that sort of thing. "
221,"Don't feel too bad.  Clock was ticking for a long time on this.  She could have easily hired someone to follow him or put a tracker on his car.  Or even just use ""find my phone.""  In fact, she may well have done some of that before she approached you with an all too plausible story.

In any event, she was clearly suspicious, and rightfully so.  

This is John's fuck up, not yours. 
 "
222,"They're two different drugs.

Cannabis vs Alcohol is a dead debate, it isn't logical to compare them since you behave very differently on them.

**But I totally understand your point and here comes some words to all work smokers**

I live in a place in Europe where it's allowed to smoke weed at home and buy it at dispensaries. It has become quite a bad habit because I've lived here for 5 months and I've probably smoked at least one time everyday except one or two.

While I do enjoy smoking it and I'm aware I smoke way too much but still. I would never, ever in my life come into work stoned and everyone of my friends that smokes would never do that either.

I know you probably don't do this but to everyone else, please do not assume that everyone that smokes is like OP, that we forget everything and smokes before work.

This is a completely unnesserary post but I just feel like the loudest cannabis smokers are often the douchebags who treat it like some miracle medicine and smokes it before work and keeps arguing that ""It's not like alcohol so I can do my job at the same time"".

Well yes you can, but you're not 100% focused and efficient. You do get paid to do your best work after all, so respect your employer and do your job. Smoke when you get home instead.

Also we (me as well) who smoke pot should stop joking around about it as soon as we do stupid shit. Way too many ""I was stoned so I did this"" stories.

It's not interesting, not funny. Quite sad when you think about it. And yes, you do stupid things when you're under the influence of all drugs. But just because it's pot doesn't mean it's OK, cool or funny. It's a drug and if you can't behave without hurting yourself, anyone else or even your wallet then you might have a problem.

Also we who smoke pot have to learn and accept that other people do not like Marijuana for their own personal reasons. Please stop questioning, arguing or even accusing people who don't like it. I mean if someone at work would talk about any other drug it wouldn't be okay at all, what makes pot so ""okay""?

"
223,"Sorry to sound like the resident bore, but you should never put a hot oil fryer on when you're inebriated. It's so easy for you just to fall asleep, forget about it and that'd be that. Used to know people it's happened to. 
Glad you got off without much of a scratch though. "
224,Did you get the hoodie though?
225,"Careful there, almost didn't see the sarcasm tag."
226,The most obvious thing to do now is go 801 days without water. Problem fixed.
227,"And now I've got a promotion and I know why..

*Why, man?*

Hey, heeey..."
228,Lol op is so random \*holds up spork*
229,You may want to take him to the doctor.
230,[deleted]
231,"he was upset, but he laughed about it- i feel bad because he has a little kid"
232,Grrr... have your upvote already.
233,My little sister did the same exact thing when she was 8. She took it off my dresser and ate the entire bar which is multiple doses. My mom just thought she was really sick but I knew the truth.
234,She would have laughed but I panicked.
235,[Here](http://www.ncpoisoncenter.org/images/LLHERSHEYS-EX-LAX2.JPG) is what an Ex Lax bar looks like compared to a Hershey bar.
236,some companies totally would. I went back to a restaurant I used to work at and they kept telling people I'd been with them for over 10 years lol 
237,"OP, look [at this](http://i.imgur.com/K3MTTwE.gif), you'll be fine after the doctors."
238,"A guy once posted [""TIFU by paying $1,608,743.67 to the wrong company""](https://www.reddit.com/r/tifu/comments/4qnu4m/tifu_by_paying_160874367_to_the_wrong_company/). Since s/he was so specific, commenters (and I think a mod) warned that the company would find out. OP was far too smug about it, and the next day posted another TIFU about how s/he lost his/her job as a result of the TIFU. Some chimed in to offer apologies, some mentioned it was coming, and OP again was very smug about it"
239,The way this is worded makes me imagine you cupping his balls for 10 seconds while you stared into his eyes until he told you to go home. 
240,"&gt; in a super-white school

Well, that'll make performing easier, then."
241,"Thought to herself, ""gotta get me some of that."""
242,As someone who has never had a lithium ion fire... uhh... how do you cool literal burning hell?
243,"Call maintenance, they'll fish it out for you :3"
244,The FBI won't send you a warning.  They'll just show up at your door and raid your house.
245,"I was thinking the same thing, he acts like its so casual that he sends the bee script through imessage all the time"
246,"I love the people in here telling you to mind your own business and not call the cops lol. I'm a dispatcher. Yes, we get our fair share of calls that we bitch and moan about, but I think all the guys on my shift would agree when I say we'd rather check and find nothing. 

Sometimes the only reason we even find out about a domestic is because of concerned neighbors. There's nothing at all wrong with calling the police because you're legitimately concerned. You did the right thing. "
247,"I've never understood why teachers do that. Why should John be punished because he had to pee after Christine, Sarah, Bob, and Sue?"
248,"Once you yellow up, there's no....butter...cup...."
