,text
178,every night i try to end on a good post.  I'm getting off reddit for the night. I need to go no further. Thank you
179,alt-write
180,chilling.
181,"Wow. That's seriously awesome of her.
Congrats to you guys on getting out of that and not letting it get you down. "
182,"Not gonna lie, the title made it sound like you ran over someone with a bus."
183,Im there with you. Id much rather have cake with Toy Story decos. That girl missed out. 
184,It sounds like you're a dumbass without the professional skills to work in a world famous restaurant.
185,"Ah, the classics..."
186,Obligatory spelling correction
187,I wish I could wipe it from my memory
188,You should call the air line and see what you can do to change the name. They may do it for a reasonable fee. 
189,Please tell this story at your sisters wedding
190,"that's an interesting question, I guess when I picked her up I just ran away from the trouble, which was away from the police. I think maybe, now that I think of it, had I turned around once the tear gas cleared and made my way towards the police with her in my arms, maybe they would have realized what was happening and helped me.  it just never occurred to me, I didn't trust that the cops, in the chaos, would be able to realize that we were innocents caught up in it. "
191,Totally would have been a rational decision. But I was so in shock.i blanked. 
192,I DJ'd a wedding in which both the bride and groom and much of their families were deaf. Lots of dirty rap and a big ass subwoofer and they loved it. 
193,Exactly. But sometimes you cant come with this kind of solution under pressure :)
194,"Once my friend had her poop taken directly from her bum by a dog.  Didnt even hit the ground.   

Edit: she was squating outside, I was with her because she was frightened of pooping alone in the dark outside. Her dog walked up behind her and took the poop as it was still exiting her bum.  It was odd... "
195,*snackrilegious*
196,"Don't feel as bad buddy, he was probably waiting to find a reason to fire you..."
197,"""Standing in line"" is waiting in your warm car until you get gestured to come out and take the photo. People help take photos and keep mental ""lines"" because it gets hectic.

When it hits -40F or colder, people flood the area all day and photos are always being taken. During work hours (8-5PM), when we have to drive, we avoid the area because it gets way too busy and the traffic jam is massive. "
198,"If you really want to get to know someone:  
1. Be around them when they have a cold  
2. Survive a riot with them in Paris"
199,"This reminds me of the time my friend and I were waiting to be picked up by our friend in his white SUV. The friend we were waiting for always wears a baseball cap, so when we saw a guy in a baseball cap driving a white SUV pull up to the curb, we walked over and got in the car. Once in the car, we looked up and saw a guy we'd never seen before looking at us like he'd seen a ghost. We quickly apologized and got out of the car. The guy driving, obviously spooked, drove off. Then finally after a few more minutes of waiting, our friend pulls up to the curb. We get in the back and I tell him about our mistake, ""You won't believe what just happened, man. We got in the car with some random guy!"" I look over at him, laughing, and quickly realize we just got in the car with THE SAME GUY we'd scared before! As it turns out he'd circled the block and pulled back up to the curb. Without saying anything we awkwardly got back out of the car just as our actual ride pulled up. We told him about what happened and had a good laugh."
200,Name totally checks out. ಠ_ಠ
201,"Just to let you know human poo to dogs is the holy grail of treats. No joke. While potty training my son if he had a number 2 in his pants I always knew from my dogs trailing behind him and snapping at one another over who would get to eat it. 
Many times I had to struggle to get the dogs to let go of his poo filled undies. 
People poo is like doggy Crack. "
202,If you tilt your head to the right your bruise kind of looks like Squidward 
203,"Sorry to hear that, are you and your girlfriend alright now ??"
204,"I'm African and was not bothered by the fact that OP mentioned the guy who punched him was African, he was simply describing his attacker. Why anyone would be bothered by this is beyond me. I'm more bothered that OP and his girlfriend had to go through that simply while trying to watch a football game."
205,"Morning and occasional evening routine.

HAHAHAHAHAHAHA

Send help."
206,"""Guy is a rare living recipient of the Darwin Award after he caused his testicles to implode due to repeated exposure to extreme cold.   According to his best friend, they were always this size and the man just needs to accept his micropenis and learn to use his tongue."" "
207,Ah the joys of Paris. The buildings! The views! The constant sense of mounting tension in the air!
208,That is by far the most.. and only positive thing out of this. 
209,Sounds like you went to the..... DANGER ZONE
210,"The thing is, you probably don't realize it, but what you're doing is offensive. Sure, our 70 year old uncle gets away with this because no one tells them anything since they're days away from croaking anyways. 

But if you're younger than 70 and are doing 1950s type stereotypical racial voices and don't realize it's not an appropriate joke, then you're probably gonna have a lot more TIFU days.   "
211,"Light green definitely looks like it's gonna be your friend here. Find a theater friend with some ""mellow yellow"" "
212,"&gt; your fiancé 

Too soon, man. (Also, it's unclear which one you're referring to.)"
213,"As in behaviour by the authorities? or behaviour by the protesters? Because as a downtown person who got caught up in it while walking home, what the police did was absolutely appalling and a complete violation of our civil liberties (and this coming from a guy whose sympathies initially rested with the police, but almost getting trampled by horse cops at the official protest zone changes a man)"
214,"More like /u/reincarn8ed, /u/ElPresidenteCamacho  and /u/Tronck need to start a research group. That post links to another:

https://www.reddit.com/r/tifu/comments/5ipczw/tifu_by_attaching_my_girlfriends_new_dildo_to_my/

There's more too: https://www.google.com/search?q=site%3Areddit.com+bruise+%22suction+cup%22+dildo&amp;oq=site%3Areddit.com+bruise+%22suction+cup%22+dildo&amp;aqs=chrome..69i57j69i58.10399j0j7&amp;sourceid=chrome&amp;ie=UTF-8#q=site:reddit.com+bruise+%22suction+cup%22+dildo+inurl:%2Fr%2Ftifu

Clearly, this NeedsMoreTests."
215,"Yo at least try to find the dude, pay for for the ride and say...well...write sorry in person."
216,A little concealer should do the trick
217,You say underage in your tl;dr like it would be okay if she were of age.
218,"*Just a spoonful-o-feces, makes the kimchee go dooown...*"
219,"&gt; Lil miss pussy scrubber 

Thanks for this OP."
220,"""whoops, silly sis, how did you manage that! Geez. Tehe tehe"""
221,"Would it surprise you to know that [mustard is rich in vitamin A,C and K, and that it unclogs pores and is great for your skin?](http://www.totalbeauty.com/content/slideshows/homemade-face-mask-150422/page15)

You should've stuck two cucumber slices to her eyes and offered to trim her toenails."
222,"i know right!? i mean, if he had gotten that cellphone charged he could have demanded a considerable ransom money"
223,"I wish my girlfriend made me a racist everytime I had an interaction with her.

Or I wish she existed at all."
224,"Better than nothing I guess, I'd personally just say goodbye to my underwear but I guess we're all different."
225,What if the tornado walks through the door?
226,Also commit ritual suicide.
227,Uber tried to tell him that before the car even arrived.
228,Managed to hold in her laughter until my daughter fell and her tiny (not properly wiped) butt was up in the air
229,"I can't be the only snowflake thinking that, even if there's not a word of a lie in OP's story, he was still pretty racist, cos the whole comedy asian voice thing is really fucking racist. "
230,Give it a blanket and tell it to cover up.
231,You ARE allowed to mock anyone or anything you want. You're not allowed to demand that people think it's not shitty.
232,Dated a girl with a deaf mother for a long time. She did the same.
233,"&gt; ...been really awkward if he would of said nothing

IF HE WOULD HAVE SAID NOTHING. WOULD **HAVE**. FOR THE LOVE OF GOD AND ALL THAT IS HOLY... MY ANUS IS BLEEDING."
234,"Went pretty well for your friend.
Expected another ending of your story ... "
235,[deleted]
236,Absolutely agree here. It's safe and sweet tasting.
237,"Yes, for a reasonable $200 fee Delta will do anything."
238,AMA time?
239,"I had something similar happen during thanksgiving with my family one year. We had it at my sister's apartment (her bf at the time was a pretty big stoner).

There was food everywhere and I had a bunch of turkey and everything and went to the kitchen to put everything away - saw a plate of brownies.

Thinking some desert sounded great, I ate one.

It was so good, I almost grabbed a second, but decided against being a fatass.

About 30 minutes later I was talking to my sister when I stopped mid sentence and asked... ""uh... why do I feel high?""

Turns out those were pot brownies - I hadn't smoked in a year or so at that point so I spent the next few hours blazed as fuck slightly annoyed. The only time in my life I have just randomly been high."
240,The GF in his username stands for gigantic farts
241,*brushing intensifies*
242,"At least he was only 14, not much for u/penguincarnage to show which would explain the not so reaction."
243,Throw the couch out.... 
244,"Can verify.

Friends talked about it for years, blew it off.

Discovered the candyland of reddit a couple months back, now part of my morning and occasional evening routine."
245,Good thing for that chef to find out early enough that his former prospective employee makes asinine racist jokes to his gf.  Sounds like he dodged a bullet there.  
246,yes we are great! thank you for your concern
247,....that should win an award of some kind
248,"Seems like everyone is forgetting the tornado. If there's a tornado, no matter what walks through the door I would understand and welcome it. "
249,Is the pizza ever not okay?
250,"I have no idea where you're flying from. But I'm in Chicago, so I just did a quick search for red-eye flights this morning (18th) from ORD-SLC. Unfortunately, it does indeed look like it's gonna be about four figures.

Hopefully, the bf will realize it's an honest mistake and forgive you rather easily.

Have you thought about going to the airport anyway? Maybe there's a last-minute cancelation and the airline can do something to help? What if someone on the red-eye overslept and missed their flight? I honestly don't know the answer here so please don't take my words as some sort of actual reliable/informed opinion. Just spit balling."
251,There's only one way to make it right. Eat her vag juice.
252,Natural selection was so close ....
253,"Interviewer: *this guy fucks, better hire him*"
254,First thing that popped in my mind also!
255,That is totally the TIFU I expected. 
256,"There's something for everybody on here. I love it.  

*unzips*"
257,Or got slapped with a dick. Either or.
258,"They wouldn't have helped you unfortunately. During riots, the police rarely help civilians, even tourists. And I'm not saying that to say the police sucks or anything, it's just what happens. If you treat an injury they beat you up. If you're moving across the street, they beat you up. It's what they're told to do."
