,text
285,"Proposals are an odd carryover from a time when women were treated as property. 

Marriage is a joint decision, not a proposal from one party to merge their financial assets. 

Talk about it together. Decide if you want to be married, together. It doesn't matter who brings the subject up."
286,"Use your big boy words. Lol. Jk. Just be yourself dont try to impress, be you. It happens when your not trying. "
287,Just talk to them how you would talk to the girls in your family. They are human just like you. Sounds like you may be overthinking it. Just be yourself.
288,too many
289,this is the correct answer. Today I think it's best to agree to take turns treating. 
290,Top executives are the dumbest mothereffers in the world. You would think the CEO of a cloud company that sells amazon web service will have top security in encrypting his dick pics. Or the  CIO loser who runs equifax would not have passwords like admin/admin. 
291,"I’m 24 and have almost 4 years of credible work experience and I networked into my current job making decent money.

I plan on going back to school at night to finish my business degree."
292,Have you watched the Dragon Prince on Netflix yet? 
293,"Your post has been flagged as an overly negative or foreveralone post. **If you think this action was made in error, [message our moderators](http://www.reddit.com/message/compose?to=%2Fr%2FAskMen) with a link to the post for approval.**

*I am a bot, and this action was performed automatically. Please [contact the moderators of this subreddit](/message/compose/?to=/r/AskMen) if you have any questions or concerns.*"
294,"I got sent to the office for wearing LA Kings gear as a 10 year old. My mom had to bring me a change of clothes and everything. I apparently was wear ""gang attire."" I'm reality I'm just a hockey fan. "
295,You could always be a tend set and bring it back. I'm still waiting for fifties clothes and eighties hair to come back.😀
296,"Your question has been removed by a computer. This could be for a number of reasons: (1) your post can be answered in one word, (2) you did not post an actual question in the title, (3) your grammar is so bad that the computer could not recognize your question. IN MOST OF THESE CASES, THE COMPUTER IS RIGHT, AND WE WILL NOT OVERTURN ITS DECISION. If you have re-read your question, re-read the sidebar, and still believe that this is a failure of our automatic filter, message us to appeal WITH AN ACTUAL REASON AS TO WHY THE COMPUTER IS WRONG.

*I am a bot, and this action was performed automatically. Please [contact the moderators of this subreddit](/message/compose/?to=/r/AskMen) if you have any questions or concerns.*"
297,"What currently drives me nuts is to live in someones Else space and all their small solutions that I would have done differently, colors and the like. I m lucky to not rent at the bottom of the barrel, but after retning for 8 years I have just had it. Never been able to Get my own quality furniture etc. So to sum it up I just want something that is mine. 

Cost wise, at least where i live in high cost areas, it is debateble how good of an investment it is to own something yourself. So I will probably rent a few more years before I a) have enough money, b) are ready to settle somewhere for 10 years +. "
298,Off limits.
299,[A self-compassion break. ](https://ggia.berkeley.edu/practice/self_compassion_break)
300,*Moist*
301,Ah ok
302,Twerking! That’s like comparing 🍎 to 🍑
303,"That's their loss, then. Someone who isn't mature enough to reschedule isn't someone you want to be dating anyway."
304,A short nickname of my name. 
305,"Your question has been removed by a computer. This could be for a number of reasons: (1) your post can be answered in one word, (2) you did not post an actual question in the title, (3) your grammar is so bad that the computer could not recognize your question. IN MOST OF THESE CASES, THE COMPUTER IS RIGHT, AND WE WILL NOT OVERTURN ITS DECISION. If you have re-read your question, re-read the sidebar, and still believe that this is a failure of our automatic filter, message us to appeal WITH AN ACTUAL REASON AS TO WHY THE COMPUTER IS WRONG.

*I am a bot, and this action was performed automatically. Please [contact the moderators of this subreddit](/message/compose/?to=/r/AskMen) if you have any questions or concerns.*"
306,I'm not looking to marry so it would indeed feel weird if my girlfriend proposed.
307,Shameless plug for /r/FantasticAss
308,A fantastic ass.
309,"I know you've always tried to be a good mom, and I love you more than I'll ever  allow myself to say. But you aren't. Maybe it's your education, maybe it's living through civil war when you were a kid, but you have no understanding of human emotions and your idea of pushing me to excel was to belittle me so I'd surpass myself trying to show you what I can do.

You got mad at Dad for crying in public at his own father's funeral for fuck's sake. Can you at least hazard a guess at how it makes us feel ?"
310,"There was a TIL about a direct correlation between cost of weddings and divorces. The more a weeding cost, the more likely a divorce."
311,Nothing.
312,[removed]
313,"Your post has been flagged as trying to figure out a specific person's or group of people's actions or thinking. **If you think this action was made in error, [message our moderators](http://www.reddit.com/message/compose?to=%2Fr%2FAskMen) with a link to the post for approval.**

*I am a bot, and this action was performed automatically. Please [contact the moderators of this subreddit](/message/compose/?to=/r/AskMen) if you have any questions or concerns.*"
314,BIGGY :~(
315,what's time in your clock right now?
316,"I work a really labor intensive job which often causes my hands to feel sore and swollen. My fiance will often massage my ""thumb meat"" until her hands get tired. Even if its 30 seconds im forever grateful. "
317,I suggested to my gf that she propose. She said I have to be the instigator.
318,what's time in your clock right now
319,Science-ish!
320,Damn your girlfriend got huge feet
321,Online dating changed the game man. 
322,"I know he wouldnt do that. He would probably lie about the reason, but wouldn’t say things to give me hope (if he were lying) he’d just end it by saying “yeah im depressed” and walk away without giving me hope or agreeing to be friends. I know him too well. I’ll stick through it, happy or unhappy. I’ll try those things! Thanks! "
323,Well this is dark.
324,"To me, it's either pay all of them or none. Being shitty to the guy that bitched about you not paying will just make you look shitty in front of the rest of the group.

If you're done with being friends with the whole group, then don't pay anything and part ways. Alternatively, take the whole amount and divide that in half. Give it to the group for them to divide amongst themselves. If they ask you to the pub again, just politely decline the invitation. "
325,He is tall lol
326,I just think leathery Florida cougar
327,Cos if you don’t know now you know 
328,Old saying ; If you see a woman with words on her arm. No matter what they say it 100 percent translates to drama.
329,"Your boyfriend is awesome. You need to try a paraffin wax bath treatment which is often used at nail salons to soften and pamper your hands. It can really help arthritis. [article about best wax baths](https://www.verywellhealth.com/top-paraffin-baths-189408) You can use them on your feet, too. Really you could also smear some over any area if you make sure the wax isn’t too hot (backs and other areas don’t have as many nerves to detect burning, so be careful.)

The salon I go to for hair color and cut has a complementary paraffin wax treatment. They do it before you go under the dryer to set the color and wrap your hands in plastic gloves. Feels so good and also moisturizes."
330,"I once accidentally punched a girl in the neck when she did something similar

I have really intense dreams often, and if I have a dream where I feel threatened I often actually physically react... so when she put her hand on me my brain created a dream scenario where someone touched my shoulder and in my dream I turned around and punched the person. but in real life she was the person.

It's a legitimate problem for me actually. I'm worried it'll affect my ability to maintain long terms relationships. I also sleep talk a lot, almost every night. sometime's it's pleasant talk and I'm told I was saying something funny. Sometimes I say shit like ""if you don't get out of my house I'm gonna beat your ass"""
331,"Yeah, this is probably the correct answer, it kinda looks like he took it a little far. If I had to pay for my mate more than five nights out in a row and they never paid for my drink/offered, I would probably tell them to fuck off. "
332,The weirdest thing to me would be wearing a ring before I was actually married. 
333,Onomatopeea
334,"Have one, can confirm!"
335,Or passing out on a pile of bud light chelada cans in their backyard. 
336,Where's the part where it becomes obvious why you didn't marry her?
337,#I'MTAKINGBACKTHECROWN
338,Have 2 can confirm.
339,Women’s rights
340,As someone born in Utah I can confirm. 
341,Or a blowjob on a boat?
342,Witch's fingers (long and thin) and half the year I love my resistance to cold temperatures but I damn it in the other half because I'm warmer than everyone else.
343,There is a big difference between trust/vulnerability and not being mentally healthy if not in a romantic relationship.
344,Thanks u/NerveGasJustSayTWord
345,"i would say married with ""a kid"" is one. with ""a couple of kids"" is two. with lots of kids is 3+."
346,Is it really any different than the prevalence of leggings/yoga pants today? We live in the golden age of pants 
347,"I kept bashing the alarm clock with the gun I keep next to my bed. So one day instead of getting up by the alarm, my bitch sucked my cock to wake me up. Now whenever I’m running late to work she sucks my cock. I’ve even started doing something where if she doesn’t wake up before me and makes me late to work I will fuck her mouth to punish her."
348,I don't know how to do it via mobile but if you do it from your computer there's a button to do it! 
349,Find a social hobby.
350,Relevant: [How to Tell if You’re a Basic B*tch](https://m.youtube.com/watch?v=PaghIdSJKvQ) 
351,!remindme 24 hours
352,"Saying I've done a good job. It's difficult for me to hear, due to low self-esteem, but better for me to hear (in the long run)."
353,HHHNNGGGG
354,[removed]
355,"Alternative question: Women who married men who wore JNCO jeans, how did your marriage end up?"
356,"Going Dutch sucks.  In my opinion, it makes a date feel like dinner with an acquaintance.  There's nothing sexy or intimate about doing math.  Just plan the next date yourself, and say you're paying.  Or offer to buy drinks after dinner, or something like that."
357,The pants did say juicy. 
358,"Hmm. I did it. Read what you wrote there. It’s all excuses. 

Enjoy your homelessness. I guess if you people learned, I wouldn’t be getting rental income. 

"
359,"Dating multiple people is super common.  Officially, you're not exclusive until you both agree you are.  But in my experience, what tends to happen is that you end up spending so much time with one of them, that you fall into exclusivity by default, and then make that permanent."
360,"Same thing I wear ever day. Work logo polo, jeans, boots. "
361,It doesn't sound like she's being passive at all. She proposed to him - that's taking action.
362,"How does that turn out though? ""Hey btw I've been dating other people and I think it would be great if we could be exclusive?"" "
363, I'm under the impression that most men who married wemen of that calibre don't use reddit. 
364,What are you anxious about? What has you so worried in life that you feel this way?
365,Have 3 can confirm.
366,Look at me. Look at me! I big spoon now.
367,Ferris Bueller effect?
368,I have friends because i don't go round Vetting people.  
369,r/rimjob_steve
370,"He’s not, he is listening to you but he’s also making his wife feel included. It’s not about boning it’s about making sure the most important person to you is acknowledge. I can also tell you it’s also probably a habit if they have been married for a while. At that point it’s a comfort thing between both of them. 

Your friend is still listening to you so don’t take it personal."
371,Vetting your friends? Your mental health issues are showing.
372,Soaking my finger in my ass 
373,"I’d have to find them attractive to want to have them as a partner ( now, what I find attractive is totally subjective), so it does play a part. However, it’s not the end all because due to personal experiences, personality does have a bigger role."
374,No. Call me a traditionalist but I would feel very emasculated.
375,what the fuck is wrong with you people
376,"He turns the toilet roll around...he always thought our flatmates were putting the toilet paper on the “wrong” way, he’d turn it around thinking this was the way I liked it 💕"
377,Dudeeeee I’m totally gonna tell this to my gf. We have squeezing each other’s hand. Only one phrase tho two short squeezes is “I’m very happy because I’m with you” kinda thing. 
378,A lot of acne. I struggled with acne as a teen and now it just erks me. 
379,so just ask on r/askwomen
380,"Can we add 'accessorized with leg warmers"" to the question?"
381,"Whomever Martin Firrell is, I feel like he is a very weak person who is trying to draw strength from counter-identity. He's foolish and childish. It won't work. He will still be weak."
382,"Well, no. Women aren’t the ones that I pursue relationships with, men are. It doesn’t hurt me when a woman calls me a slut for sleeping with someone, I can just chalk it up to jealousy. When a man calls me a slut for sleeping with someone, it means I’m undateable and unworthy of a relationship and that hurts a lot more.

Also, I’ve never experienced a man “root” for me to sleep with someone. If anything, they are just more pissed that I slept with someone that wasn’t them."
383,"The last girl I broke up with I said something along the lines of that I need to work on myself. You should probably just take the hint, a lot of people don't want to say their real feelings because they don't want to hurt yours."
384,"Used a relative of mine as an excuse for not trying. So for now, I absolutely despise tomboys and people with a certain name."
385,"I nod at males and smile at females. The smile for females is the equivalent of the ""nod"" for guys. "
386,i look for people with the qualities i value. 
387,"For some reason when I read through the first time I interpreted 
&gt;I didn’t marry her for reasons that will become obvious, but my 3^rd grade teacher wore them everyday. 

as, I didn’t marry her for the sweatpants, but for other reasons. It got worse the more I read it until I reread and understood you *didnt* marry her. "
388,"Tipping pictures or looking at it from another angle so I can see underneath skirts.

Yeah, din't work."
389,Hey Amanda.
390,The dishes
391,"Do what now?

There's no application process for being my friend. It just automatically happens when we get along and choose to spend time together."
392,Yes I do live with my wife.
393,first I would like to know how to make friends then I will figure out how to vet them
394,"https://www.wnycstudios.org/story/beauty-puzzle

i’m just going to leave this here."
395,"She just says ""you're cute"" then nudges me with her head. Alternatively, she'll just call me a doughnut ❤️"
396,"I wish I was in a situation like that, but my girlfriend and I live an hour and a half away from eachother, iv'e got a bum leg and she's doing uni studies so there isn't a whole lot of time to spend with each other"
397,"I don't think they are. Either they're genuinely not interested and we aren't supposed to get together, or they're fronting and I don't want that anyway."
398,"When I was sick, hurt, my now ex partner of 17 years did everything opposite from that"
399,"""I really appreciate you paying the last few times we went out. I want to pay the bill because I want to contribute to the relationship too.""

If you can't assertively ask for the bill, how are you going to assertive in the workforce?"
400,therapy
401,More than one is lots
402,Mods fucked up this is H I G H  K O A L I T Y
403,"Keys, wallet, phone."
404,"Your taste buds have developed a lot since then and you probably have nostalgia for what it was like in the past. Remember Lunchables? I thought that pizza was to die for. It now as an adult, it sounds disgusting"
405,[removed]
406,Politics.
407,CAN ANYBODY FIND ME SOMEBOOOODY TO LOOOOVE.
408,"Overall strenght, being able to gain muscle easily and the ability to have a proper full beard"
409,"Sometimes I run upstairs on all fours, it just feels more natural!"
410,My gf and I always have a thumb wrestling match when we hold hands
411,Me tooo! 😂
412,And same for women! 
413,"The first step part is actually very probable. I've never approached someone at a bar or club and it has a lot to do with my personality and emotional relationship to romance. Yes you could argue that women never do the first step but for me it's not because I expect someone to approach me but because I don't have interest in getting to know someone solely for the purpose of 'dating'. 


To be honest I've never went on a 'date' (apart from with my actual boyfriend) in my life. At least never intentionally. The only time I had a date was a time I thought it's just hanging out with a friend. I was kind of naive, going out to eat with a guy I've socialized with at a bar and thinking it's actual friends and buddies stuff. Haha that was awkward when he gave me a really long kiss on the cheek as goodbye. That's when I realized...


My approach to romance is actually knowing a person first as a friend and then developing interest and feelings towards each other. I don't like a romantical relationship with someone if that's the only kind of relationship we have. Going on a date with someone you don't know builds a relationship solely based on romantic interest, zero actual friendship. 


I think this may be similar for a lot of people actually wanting a meaningful relationship. That's why guys like that don't make first steps. Mutual love and attraction actually doesn't really require a first step as both parties just naturally get closer and closer to each other when they know each other well and start falling in love. "
414,"Attempting to show them to a friend who hasn’t been introduced instantly put me off certain anime’s cause I just can’t excuse it. 

7 deadly sins was an instant remove the moment I watched the first episode. I just can’t support the dumb shit anymore. We don’t need to be mainstream but can we have some class. 

It’s getting a little too perverted in the genre, to the point it’s out there publicly consistently where as the niche used to be for people who sought it out. 

No judgements but injecting it randomly where it doesn’t do anything for story or characters is just super odd putting. 

At the very least go full high school of the dead if you’re gonna throw it in randomly. You wanna show off some features, then make it a feature, not some freak side show I have to suddenly feel disturbed while watching my otherwise good show. 

/rant

Just bothers me, I wanna go back to watching but I just felt so turned off. Literally. "
415,"Dude, drop your dorritos and come out of the basement."
416,That’s called a Pickelhaube! Pretty funny name for a pretty funny hat.
417,"Look into love languages. Guys usually keep their distance especially with issues of consent. If you want something, ask for it. He’ll probably snuggle you more. "
418,Not op but you made me feel better :) thanks!
419,"Innit. Say something about your dead grandpa or the social economic situation in Venezuela.

I might marry whoever can do that."
420,"Make sure he knows you want him i guess, hope things pan out for you both"
421,I wish you cared more to see me happy rather than what people think
422,"Ask them first. I did it a few years ago. He was ok with it so I went on a date with her and ended up seeing her for a few months. Didn't last that long for either of us, hah."
423,"Making the 4 day working week a real thing for more people.

The relationship between social media/mobile technlogy use and empathy/compassion.

&amp;#x200B;"
424,"I misread this as ""morning snogs""

Snugs is cuter."
425,"Look, if he is into her and has a crush, nothing will happen, because he will get tired of waiting. If it's some serious in love stuff, then he won't try to insert himself between you two, because he wishes her all of the best and creating a love triangle is the opposite of that. On top of that, even if you don't trust him, trust her. Because if she is with you, she won't cheat on you and if she does cheat, there was nothing you could have done. So trust your woman. "
426,Off limits 
427,Omfg keep her forever. 
428,"So I should go to ""askdouchebags"". With a response like ""you act dense about it"", I feel as though I am already there. So yes, thank you for directing me to the right place, my question is above"
429,Twice is good.  
430,"Well, they could be a stay at home cat mom or something..."
431,Fuck I’m single
432,My gf doesn’t like sitting next to each other generally. But when she randomly pulls her chair next to me and asks me to hug her is just heartwarming. 
433,Shampooing ones hair 
434,"Not on topic but swapping out the heater core would most likely get you a lot more heat, older ones tend to get clogged."
435,Love my Wahl Peanut.
436,"On long car rides, he’ll take my hand, and we just rub and caress each other’s hands. Simple, I know, but it’s so sweet."
437,"Nasty bitten picked at nails or really fucked up dentistry. I just can't look past those things. I don't mind simple unfussy plain nails or normal oral imperfections (insert being used to British teeth stereotype here) but if it's severe, then that does turn me off in a way I can't control :(."
438,[removed]
439,Are you George W. Bush posting from 2009?
440,Cleaning out my garage. 
441,TIL
442,My ex girlfriend was the same. We lived together and have two cats together and we use to always talk about them like they were our kids. I sometimes find myself explaining to them that mom still loves them and it wasn’t their fault that she’s not around.
443,This is the purest way I've heard anyone describe love. 
444,"It was in IT for about 15 years - I didn't have the passion for it really, so never stayed on top of the fast-moving changes.  My colleagues who were more successful used to spend their evening and weekends building networks and studying for MCPs and stuff.  I was earning not-bad money, but unfortunately I live in a very expensive part of the UK so could never quite afford a deposit on a place.

After a life implosion I quit IT and started in a variety of customer service and admin jobs.  I've been trying to break through to the next level (currently a senior administrator but trying to get back into team leadership).  I have no chance of getting on the property ladder though - a small apartment now costs around £300k, and I have a daughter to support.  

My wages now are about 20% higher than when I worked on a helpdesk over 20 years ago, and property prices have increased by around 300% in that time.  That's the bottom line in all of this."
445,[removed]
446,"Plus, I think there is an evolutionary mechanism that makes women not resist fully against a man, even if they should.  


I used to spar and wrestle against women (jiujitsu and judo) and many times women would just ""go soft"" and give up randomly, when they still had a chance to fight back, simply because the wrestling is a bit similar to sex, which involuntarily triggers either sexual response or fear response (or likely both)."
447,Knits things for me. 
448,"I usually check local court records and make a cursory attempt to find a Facebook page. It might also be a good idea to check the sex offender registry, but I've never actually done that.

Anything more than that, if done for personal reasons, would be a little creepy."
449,Take her out for coffee and console her.
450,Ninjas cutting onions.
451,"I was in Myammar a few years ago looking and some old Buddhisty-touristy stuff when I felt this little arm reach around my waist, I turned around and there was this little kid with his arm around me and his parents were taking his picture. 

So me and my friends who'd gone to see this old Buddhist rock ended up spending our day having our pictures taken with Asian kids who'd never met a real life white person before."
452,Not exist 
453,"I threw an absolutely breathtaking touchdown pass to someone while they were tailed by a former NFL player during a beach game.

Glorious."
454,"""Lots"" worries me. When I hear lots I imagine like 15 children."
