,text
146,"I'm in my 30s and not married with kids and the like that I always thought have by now.

I don't think I've done everything right, but I know I haven't done very much wrong except maybe give my love to women who didn't love me back the same way. Depression is a bitch. "
147,"If it's a first date, I'll only do one reschedule before writing t hem off as flakey.  In other words, I will personally only reschedule once. If she makes the effort to schedule, then I'll give another chance. Typically women don't actively schedule in my experience. "
148,"Sometimes I will have really bad zits, occasionally in odd places.  If they look like theyre going to be a pain in the ass I'll shave off the first few layers with a razor and pack it with antibiotics and cover it with a bandaid.  "
149,18 years going. I only love her more and more.
150,"&gt;fella

Hmmm"
151,"If you get relatively good news, you go for it! If not, you get you your own donuts. Mwahahaa"
152,"I love you, but you don't need to come to my house to visit EVERY SINGLE WEEKEND."
153,When they say 6ft theyre thinking of 5'10. Most guys just inflate their height so you get 5'10 and 5'11 guys claiming 6'0
154,"I'm sure the older versions of Counter Strike. I was pretty competetive back in the day, we had one of the best teams in the country apart from the ones on the international scene. We practiced several hours a night 5 days a week.

Great fun, made a lot of friends. No regrets."
155,"Track events, car meetups, cruises, car shows. "
156,"Honestly - this is a great example of how being open can be such a positive thing. You're a good person. You care about how your friends feel. Demanding the same out of the people you surround yourself with is self respect. People can become doormats when they in tune with their emotions enough for them to be able to say ""it's not ok to treat me like that"".  "
157,"She can buy indistinguishable leggings (with or without hideous patterns), that are equally ""buttery soft"" on Amazon for a third of the price. Overpaying is inexcusable. Especially to a shady, manipulative MLM."
158,Agreed....... and I still can't tell the difference
159,"This was from science and history based on humans but I don't have any sources for it.

The fact that a single mother can care alone for offspring is very new and not something that's been possible for thousands of years of our evolution. Another guy could simply kill your kid if you didn't stick around.

So you could play the numbers game. But statistically you would lose until recently when society takes care of your kid for you. And even now it might just lead to abortions. "
160,"While I love the friends I made on it, I spent way too much time on TERA. "
161,"Yep. If they can't understand why you were late, fuck em! They obviously don't care about you. "
162,"Typically, the more material you want (warmer), the price will go up. Check out American Giant, and Reigning Champ.

(Subjective experience) I have a SuperDry hoodie that's *really* warm and thick, but it has graphic designs on it, so maybe not your thing. But, if you don't mind, you can check them out too. "
163,r/FuckYouKaren
164,"Your question has been removed by a computer. This could be for a number of reasons: (1) your post can be answered in one word, (2) you did not post an actual question in the title, (3) your grammar is so bad that the computer could not recognize your question. IN MOST OF THESE CASES, THE COMPUTER IS RIGHT, AND WE WILL NOT OVERTURN ITS DECISION. If you have re-read your question, re-read the sidebar, and still believe that this is a failure of our automatic filter, message us to appeal WITH AN ACTUAL REASON AS TO WHY THE COMPUTER IS WRONG.

*I am a bot, and this action was performed automatically. Please [contact the moderators of this subreddit](/message/compose/?to=/r/AskMen) if you have any questions or concerns.*"
165,"&gt;had a goatee and a nice ass fade.

[https://xkcd.com/37/](https://xkcd.com/37/)"
166,"I played Skyrim for 16 hours straight. I didn’t really even notice, I didn’t eat anything that day and I didn’t have any urge to use the bathroom. I did regret it because not only did I feel bad about wasting so much time, I still felt like I didn’t accomplish anything in the game. "
167,"So leave him?

/rocketscience"
168,As though they were humans 
169,🤦🏻‍♀️
170,"Threatened to fight both guys about to fight. Was my freinds place, and no one was stepping in to break it up. So in my toughest voice i said "" if they didn't take it out side, I was going to beat both of their faces in."" And actually rolled a irl Nat.20. on my intimidation check. lol. And they went quiet and went outside. They were bigger than me but I may have looked super confident right then. Whole party saw me. And was woah we got a bad ass over here lol. I never done that again. Wish i could though."
171,I worked hard in high school so I could go to an ivy league school. I'm currently fly at a community college 
172,what the heck
173,What's a BAHA- may I ask? 
174,"Depends on your location.

Where I'm at, it is super uncommon and will not give you a good reputation."
175,"The girls who wore those here were pretty white trash, was it the same in america?"
176,[Who knows what's good or bad.](https://medium.com/@davidgallan/who-knows-what-s-good-or-bad-my-tedx-talk-transcript-8404344779ce)
177,"Saying she is the one that got away might seem wrong considering I'm still young.

Was 6ish years ago at college, she was in another class and i liked her because she was different (and one of the very few girls in mech eng) and she also liked me (which i found out later)

She sent all the signs but me being the shy dude i was back then (and still am to an extent) didn't make any move. And then she quit college and started an apprenticeship, have no contact with her anymore, for 5 years now.

I mean, one time i was at her place and said i was bored, she teasingly poked me with her foot said ""i mean we could have sex"" and i replied ""haha yeah sure"" and kept watching the movie."
178,"Not everything is worth fitting in to. And yes, as a third party, I absolutely will interpret what that desire to be part of the social hierarchy means. Just because something is naturally human doesn't mean it isn't worth rejecting."
179,"Honestly it just sort of worked out. We originally worked pretty much a road down from one another and we just bought a house, which honestly just happened to be really close by our work places.

The good news is that most of the engineering firms in the city are also pretty close to our home so even if I switch jobs I'll still be living nearby. And her dream job is right down the road so hopefully she'll get that when she finishes her marketing degree."
180,"my height, at 6'7 i get comments about it at least once a day."
181,Best feeling ever!
182,"As I unfortunately have said many times before on this forum, I do tell guys when I like them and check whether they're interested back.  They're not.  It sucks but I have to just deal with it, like everyone else"
183,"A bit of a weird one, but here it goes: my extra tattoos. 

I have tattoos on my arms and one on my left leg (which can easily be covered by long sleeves and jeans/pants). My Mom doesn't like them. Not enough to disown me, but enough to be seriously upset if I got any more that were visible to her and/or that she's aware of.

On my upper body, I have 4 tattoos, and plan to get 2 more. If she ever found out, I would be disowned, and she would most likely never talk to me again for as long as she lives.

On another note, I wish I could tell my Mom I met a nice girl that I want to start a family with. One day!"
184,There’s literally a guy who at the time was the most upvoted comment who threw a fit about how emasculating it is if his girl proposes to him.
185,There’s literally a guy who at the time was the most upvoted comment who threw a fit about how emasculating it is if his girl proposes to him.
186,"**Your post has not been removed, this is just FYI.** AskMen does not moderate for the [Serious] tag like AskReddit. If you are concerned about your question not being taken seriously, you may want to consider removing it and rewording it.

*I am a bot, and this action was performed automatically. Please [contact the moderators of this subreddit](/message/compose/?to=/r/AskMen) if you have any questions or concerns.*"
187,"He sticks by my side as I work on my Anorexia. He never forces me to eat new foods, and understands when I can't finish a meal. He makes me protein shakes and foods I am comfortable with. He drives me to my doctor's appointments and to rehab every morning. I'm so so lucky to have him."
188,"Big upswings tend to help. Raise or promotion at work, life event like wedding, getting a puppy. Vacation, anniversary. A really fun Valentine's Day.

You have to refill your reservoir when you can."
189,My son in a big way. Probably happier than ever.
190,Amazing what happens to your eyelashes when you don’t smother them with chemicals for decades. 
191,"Just be clear that it makes you uncomfortable if he pays all the time and makes you less inclined to want to go out.

If the men are anything like I used to be it wouldn’t have crossed their minds that you not paying would make you feel bad. 

I’m not mega rich but well off and never really think about spending on dinner so I never had an issue with paying. The offer to pay would make me feel like I wasn’t being taken advantage off but i would still just go and pay. 

It wasn’t until my now wife waited until I popped to the loo to then pay that how she felt started to enter my mind. "
192,"The latest I've ever overslept for work was about 3 hours in my first year on the job. I woke up in a massive panic to 5 or so texts/calls from people at work asking if I was alright. I was honest with my boss at the time and told him I was so sorry I just overslept and was so sorry. He then took the brunt of the heat and told everyone else that I had previously told him I would be late and he just forgot. He was a BS'er but he had my back. I always appreciated that.

Furthermore though, that day I slept through a 6AM call with one of our Chinese suppliers. And, icing on the cake, it was my birthday lol. 

Really glad to have lived that one down. "
193,That's good to know. But I've never seen it happen.
194,"My duck blind redhead camo hoddie, my wife took it one night when we first started dating. We have been together 7 years now and married 5 and she still won’t give the damn thing back and hides it so I can’t steal it back"
195,"I can’t  speak to the psychological reasoning behind it but this is definitely common! A few of my female friends have admitted that they’re much more attracted to men in relationships- one literally told me that finding out a guy was “taken” made immediately him ten times hotter. And for myself, I had one guy i casually dated who went from neutral to obsessed as soon as I started to pull back and end our “relationship”   "
196,Focusing on things the mainstream tends to ignore.
197,"Can I get an example? 
"
198,Once I read that could be cause by urinal infection but I haven't confirm this theory
199,My name
200,"In same situation rn, accept i have no one to call or message or anything. 

Dont loose her, dont end up like me "
201,I never said I get women easily. By the way when I was your age I was also a kissless virgin
202,"If your post-breakup mood was anything like the one I had after my first gf dumped me I can understand. The first few months after are probably the most lonely I'd ever felt, and I've always been kind of a loner dude. Even if from the outside things aren't so bad, there's definitely a dramatic experience in the head."
203,Fought Nazi skinheads at a punk rock show in the 90s
204,It's still juicy.
205,So... the chain smoker lady from Futurama? 
206,"My relationship with my dad is comprised of mostly grunts. Mostly mhmm. Or mm. Dad is Asian. Doesn't really speak English fluently so I think that plays a part. I'm 1 Gen Asian American. I understand Cambodian,but cant speak it. I respond mostly In English so I think that may be the reason. He's happy that I got my life sorted out. Recently got a house by myself, married, new(used) truck. Yet I feel inside that I never got his true ""good job son"" response. "
207,"This really hit home man.  My mom worked 6 days a week (nights), I'd go days without seeing her.  The days she'd be home she'd be sleeping, essentially my brother and I raised ourselves to a certain extent (our pops lived out of state).  I grew up really only caring about myself because I felt that's all I could rely on.  I'm working on that now, but its not easy."
208,Overall awesome looks and being one sexy fucker. 
209,"That is what I figured for the 'juicy' pants wearers. They aren't bad people, just kinda basic fashion and want to have several kids."
210,Haha sounds accurate
211,Give my mom a call 
212,"One if my oldest friends is kind of a recluse who still lives with his mom. I reconnected with him a few years ago, and he still wears the same clothes he had in high school from around 2002-03, including jncos. It's quite a nistalgic sight to see."
213,Being single 
214,"No offense but I just don't get why you (or anyone else in your position) still stays in such a marriage.

This has been going on for nearly a decade and from your posting history it seems like you are the only one fighting for your relationship. Why stay in a relationship if the other party simply does not give a fuck?

Also why do you claim that you won't ""be in the picture"" if you left her? No one is telling you to leave the country. You'll still see your children, in fact, men who actually fight for their children or better visitations usually get them. 

Don't let them grow up thinking that such an unhealthy marriage is something they should strive for.

Idk man, all I can say is that you deserve better. You seem like someone who has so much love to give and unfortunately you are stuck with someone who just does not want to receive any love. That's ok, go out and find someone who actually cares about you.

"
215,"environmental destruction
"
216,Yum
217,"I'll reschedule twice.   If she bails after that,  I'll move on.   She's not interested."
218,"You have to remain open. No, nobody will ever write music that touches you like Floyd or Alice in Chains. Its over man. 

Until you see Muse live. 

Food - you like what you like. You've tried it all. 

Until you make you scrambled eggs in a double boiler. It's a life changer. 

Is your bucket list an actual bucket list, or is it just a list of cool shit you're not even trying to achieve?"
219,You could just be a trend setter and bring those back.
220,We fundamentally disagreed on what JUICY means when written on a booty. She's still the best thing that ever happened to me. 
221,"&gt; Are they attention whores? 

Who isn't tbh?"
222,"My hands. 

No matter how much physical labor I do ... My skin just doesn't toughen up! It's almost expected to shake hands with a woman and get the comment, ""Your hands are so soft!  You must not do any work."" "
223,This is awesome. Today I got up a little bit earlier than him to make his lunch for work and left a little thank you note in there. I hope he smiles as big when he finds the note as he did when he saw his lunch ready for him by the door! 
224,The thread is about doing the right thing. The commenter clearly did the wrong thing and is suffering the consequences. 
225,"Marriage is kind of stupid and outdated, but it wouldnt matter to me, fuck gender roles and shit. If a girl wants to marry a person why shouldnt she be able to propose. "
226,baby face lol. i look young for 30.
227,Yes! In the form of human flesh or Chipotle gift cards
228,Oohh man. This. I'm a calm dude and I've never started shit with anyone so I like to pretend how I'd do it
229,Thank you for sharing.
230,"Met my girlfriend on reddit in 2017. Visited each other later that year. Moved in in 2018. It's been the best ""fuck taking things slow"" decisions I've ever made. She and I have grown a lot, both as people and as a couple."
231,Same.
232,I wouldn't be if it wasn't so accurate 
233,"Weight. I know it can be changed, but until you're not heavy, my attraction is zero."
234,Twerking is for whores. Belly dancing is for respectable sexy babes.
235,"Well my comment wasn't so much about you as it is more of the new guy.  Typically (in general), most guys don't want to be friends with a girl/woman.  They are wanting more.  So even though you are looking for one thing, he might not be.  Also, is he single?  That is another red flag to guys in a relationship.  Guys know how guys think.  I have seen relationships end because either party makes a new friend with a single person of opposite sex.  Guys and girls act differently.  If a guy wants you as a gf, he will slowly try talking you into doubting things.  It can be stressful on a relationship."
236,"You won’t believe this, but that somehow didn’t pan out for him.

He does own a couple successful restaurants now though, and he’s a great chef."
237,Found the guy with the juicy wife.
238,5 kids! Jesus christ.. that's way too many mouths to feed.
239,"I had a flip case for my iPad and I hung a strand of yarn from the ceiling that I would flip the cover of the case over. It would hold the iPad at the right height and I was able to watch it without much trouble. Sometimes I would push it, so it would swing back and forth while I was watching"
240,"So I still have one pair of Tripp pants from high school. My kid wants them for Halloween. He's 9 this year and he tries them on every year and they have always been too long for safety, but I think this is the year they'll work out. "
241,"Met my wife online nine years ago. We’ve been married seven years, have a five yo daughter and just bought a house together. So I guess you can say things are going pretty well. "
242,"It's not so much as being chill.  If your bf wanted to be friends with a new girl, would you be ok with it?  Even if he and she as friends get along better than you two?  What if she flirts, etc all the time?"
243,"Usally have dreams about having a SO, just spending time with them and enjoying the company. i feel like shit every time i wake up after one because i wanna go back, and then it sinks in how lonely I am....fun times...."
244,"When I was younger I used to have to take the train to school.  I fell asleep once and woke up in San Francisco, my high school was in Palo Alto"
245,They grew up and it probably went the same place my “Surrender your Booty” pirate shirt and “gimme gimme chicken tendies” T-shirt’s went.
246,"I took a train to a neighboring state to see a concert, got wicked drunk, peed the hotel bed and missed my train home by several hours. 

The train only ran every few days and I needed to be back for work so I had to get a last minute flight with a 7 hour layover on the opposite side of the country."
247,Either non-retarded hair or a bigger frame 
248,That's probably too tall isn't it? People would be asking you to get stuff off high shelfs. Economy flights would be unbearable.
249,"Yes! I have a reoccurring dream of being back in school and getting ready for finals,only to discover that I'm enrolled in a class that I forgot about. The entire dream is me frantically trying to figure out how to pass thd course. "
250,That’s a funny way of saying you don’t like change so you’ll continue suffering. 
251," Crying in single! when i meet my SO, i will do all these beautiful things i am reading on this thread to compensate for my alone time..Love is beautiful for real!"
252,OMG yes the villain who ate cold beans out of the can! 
253,"That's amazing, my man. :')"
254,Fuck. I better not marry my SO. I don’t want to have to get rid of mine. 
255,I wonder if they re attracted to 'men'  who wear OBEY on their caps or shirts
256,Link?
257,For me it’s more like “holy shit I UNDERSLEPT” because I like to get to places on time and freak out if don’t.
258,"Good question.

I committed career suicide and went into management. Hoping a year isn’t too bad for me to escape!

I’m doing some Pluralsight training, specifically Microsoft Azure at the moment."
259,To add - the forks were never found. Guessing I threw them away or something. 
260,Junior non commissioned officer jeans 🤔
261,It's all about practice for you.  You are just going to need to get comfortable talking to random women in random places.  Start with small talk with cashiers at stores when they ring you up.  Go out to random places around town where there are lots of peopleand approach women and start random conversations by commenting on stuff around you and see how far you can take the chat.  The only way to get good at talking to women is by practicing talking to women.
262,"Thick hair, former fat guy legs and calves "
263,I know reddit hates twerking for the most part but I'm a fan of a good flappy ass dance.
264,"From a girls opinion: this right here. Honestly is the best, and being straightforward saves you from saying too much and overthinking it. Just say it in a way that isn’t a big deal. She will feel those vibes from you. Same goes for saying it uncomfortably,if you do so it will be translated"
265,"I had a roommate in college who almost completely overslept his final exam for a class.  I thought I heard his alarm going off, but wasn't sure.  All I know is I heard him flip over to wake up, and then like a bolt of lightning, he jumped down off his top bunk, got dressed, and ran out the door.  I think he passed, but he arrived 15-30min late I believe."
266,"Your question has been removed by a computer. This could be for a number of reasons: (1) your post can be answered in one word, (2) you did not post an actual question in the title, (3) your grammar is so bad that the computer could not recognize your question. IN MOST OF THESE CASES, THE COMPUTER IS RIGHT, AND WE WILL NOT OVERTURN ITS DECISION. If you have re-read your question, re-read the sidebar, and still believe that this is a failure of our automatic filter, message us to appeal WITH AN ACTUAL REASON AS TO WHY THE COMPUTER IS WRONG.

*I am a bot, and this action was performed automatically. Please [contact the moderators of this subreddit](/message/compose/?to=/r/AskMen) if you have any questions or concerns.*"
267,"It was ridiculously expensive. Knew someone who had Juicy purses, they cost $100s each. Not quite as bad as Luis Vuitton, which can cost $1000s, but still stupid. "
268,"Might have been the user name?
MeercatCity is obviously where it’s at"
269,I have a large stuffed animal I sleep with if that counts.
270,Fuck koalas
271,Neither are sexy.
272,I let them see my wife and work the pre selection 
273,"All yours bro, good luck."
274,"(I’m 24 and ugly) Your only problem is self confidence. I went thru a normal school life, never EVER talking to girls until mid high school. They never talked to me until I talked to them. I feigned some self confidence, and well, that’s how you talk to girls; just get over it and do it, but don’t force it. It has to be a casual comment or something, and see how they react. If they strike conversation back, continue it. If they don’t, don’t force it. The worst thing you can do is run up to a girl, and try to squeeze out a convo and make her feel uncomfortable. Keep it casual. For example, at the gym I would’ve said something as simple as “Good job” to a girl I’m familiar with, or something like “That looked tough!” etc And just end it there. See how they react, and work off of that. Never ever ever force it. Hope that helps. "
275,Once in two years. A bit confusing to say snapping does not include yelling or raising voice tho.. I thought thats was the very definition of snapping?
276,Attempted juicy upgrade: failed 
277,"for real, that's such an uncommon attitude for women to have especially im my age rage, im in my 20s"
278,You're being a total wanker around here mate - this is supposed to be a supportive sub.  
279,"Until I'm exclusive, I'm playing the quantity game until I find quality. Having 5 dates setup with 5 different people during the week isn't a horrible thing to do. It's just a date.

But if there's a spark and feelings involved, the discussion of exclusivity should come up."
280,I can smell her from your comment..
281,"I’ll always pay for the first date, I insist. If the date is going well and she offers to pay I’ll suggest that she pays for the next date just for it to be fair but I’ll try to pay for the next date as well. Personally I want my girl to be treated like a queen but if she insists to pay I’ll let her every once and awhile. I show my love and appreciation with gift giving, it’s my love language. I wouldn’t say you’re being rude for asking to pay but I wouldn’t insist on asking to pay more than twice"
282,"Ohio, the trash that eventually moves to Florida."
283,"Hey, how’s the weather up thereHAHAHAHAHAHAAHAHAHAHAHAHA"
284,"I stay on top of new research coming out and try to stay up to date on major policy changes that have implications in my field. My field is mostly theory driven so there are few new skills I need to learn/know. The trick in my field is to keep evaluating, improving, and implementing new approaches that are being developed/supported by new academic findings which takes a significant amount of innovation and creativity. It's a constant thing but luckily my job is literally to stay relevant in my field and ensure my program does the same. "
