,text
0,"This whole thread reminds me of my early 2000s middle school days where everyone named themselves Mz New Booty, Pooh, Baby Gurl, and Tweety on their Myspace."
1,"We don't believe in toxic masculinity- if my male friends need to hug, we hug. lol"
2,A second mortgage? How thoughtful!
3,This whole thread should be on r/lifeprotips....
4,Nowhere near what it deserves
5,"Your post made me send a message to my wife asking if she had.  Her response was ""mine said cowgirl"" and now I don't know if that is better or worse than juicy. "
6,"Definitely a lot of time, like a couple hundred, in games like Skyrim or Fallout. And no, I don't regret it as it was entertaining for me during my down times. It's not like it prevented me from working, or going out with friends. "
7,Trick Question; 'Men' don't bother with such trivial fodder. 
8,My boyfriend loves to massage my back he us so good at it and i love him for it 
9,Better calves than a dairy farm ! 
10,North Face gloves are pretty good and check all of those boxes. 
11,"Just speaking as a gay guy, some of the most attractive guys I know are like 5’6” and it has nothing to do with height. It has to do with their “manliness,” work ethic, self esteem, ability to converse, and sense of humor. Personality is truly 85% of what makes a guy attractive, the other 15% is just not being a greasy fat ass with fat tits"
12,"Well, hang in there ! "
13,"God I need one of these again.

A year after my ex dumped me a regular on a forum I was a member of suggested we meet up for a drink.

So one night we met up at a trashy bar, talked to they closed and she suggested we go back to my place for another drink. I was tired but why not? Less than an hour later she's begging me to fuck her.

We had a strictly FWB situation for almost a year, and I ended up living with her for a couple months. Eventually she started to want more and I didn't see a relationship with her working out since we disagreed on a lot of things. We parted on good terms.

She was the last woman I kissed, that was three years ago. After a string of rejections and one really bad one a few months ago, I need a good fuck to get out of my funk."
14,Tesla - Love Song
15,Alcohol. 
16,Where on earth did you go to school that a non-gym teacher could wear sweatpants to work?
17,Yeah with co-workers your best bet is always assume it’s friendly and let them make whatever moves they want and then sure engage.
18,"It triggers me when people pronounce it this way. I can't watch national sports broadcasts.

Capitalize both letters or spell it out."
19,"""I'm late because I overslept"" kinda says they don't care about the job though."
20,Apparently I have nice lips. I always thought they were mad big and weird but apparently that's a good thing to some people?
21,"As a European, do we have toilet seat covers? I’ve never seen them. I always just wipe the seat with bog roll and the go for it."
22,"My hair. But nobody understands the pain I went through. At one point, it was so dense and thick that none of the combs in my house would fit to comb the hair all the way through. I hated it for the first 17 years of my life atleast and stopped washing the hair frequently. Eventually it thinned out on it's own and it's much better now but still, It never stays the way I want it :|"
23,Even if you KNOW that she is into you the answer is still to stay friends. It will make your life far more complicated than you want it to be to date someone you work with.
24,"Appreciation

Contentment"
25,"6 years difference. There is a noticeable, but not jarring, generation gap. Movies and music that impacted my youth have little bearing on her as she was mostly grown at the time, etc. Likewise the other way around, music and stuff that was 'the thing' when she was young I only heard about later. So as such she identifies slightly more with the  very late baby boomers (or whatever was before Gen X) rather than Gen X like myself.

As for *unforeseen things* the biggest was children. I was late to that party, not wanting them in my life until I was well into my thirties. (some of us just aren't ready until we're ready.) She was burning through her early/mid forties by then, so adoption of an older child 'to make up for lost time' was our only real option. No regrets, though, our adopted daughter is freaking awesome, and we got to skip the messy poopy diaper stages."
26,The vast majority of girls think the same; but the insecure masses of r/askmen refuse to believe it in lieu of self-pity parties 
27,"Other than my height, people seem to like my eyebrows"
28,"I’m usually straight forward and just ask. My friends also know they can vent to me whenever as well, it’s just the relationship I’ve always had with some of them. Either that or I will ask them if they wanna grab a drink at the bar with me and catch up on life."
29,"It depends on the class of venue you're looking at. A place where shit regularly gets out of hand it might be an issue, even if you're built. A place where the bouncer checks IDs 99% of the time, it's not a big deal.

Your age is also an issue. Most places want people with experience in clubs so they know what to spot in order to intervene before it gets bad."
30,"Same, don't even want to think about the combined time I've put in KoTOR across xbox, pc and phone"
31,"Yes, pretty much the antithesis of Fairfield County “preppy.”"
32,I have a baby face and I love it. My dad was the same way and now that he’s in his 70s he can pass for being in his 50s. In his 50s he was passing for being in his 30s. 
33,I encourage you to be a manager at some point. Within about 5 days you'll be laughing at how ridiculous what you just wrote is. 
34,"the meds won't change your life, but they can help change your mood. then it's your job to make the changes for yourself. i didn't want to go down the meds route either because i didn't want my family to look at me as a crazy person. but fuck that. if you need help, go get that help. you'll feel better about yourself just for going and asking someone that you could use a little help. "
35,"yeah.. not dating more than one person at a time has nothing to do with a ""soulmate"" "
36,"Yeah--it's one of those things that you can't do much for--just is what it is.     
Just work on the other angles--how you dress, carry yourself, and work on how you talk to people.       
This stuff will help now and, later, you'll be killer.      
Maybe start off with, ""Hi, I'm mashonem.  Oh, whoops, it looks like I just dropped my 401k card.""      
Sure, maybe she'll know that that isn't really a thing or that it's just a coaster you wrote 401k on but she'll know that you at least have heard the term which means you're not a child.        
Or don't do that at all--what do I know?  Just some idiot on the internet.     
Probably don't do that.  "
37,Yeah I'm definitely considering it. But we live in a shallow world and I don't want the training to be for nothing. 
38,Runescape. It's little more than repetitive grinding and endgame content that takes literally months of solid playing to get to. I regret nothing.
39,"&gt;with someone you work with?

Rule #1, never shit where you eat. Meaning, unless you don't mind the idea of being fired for sexual harassment, never date anyone from work, period. 

Are there exceptions, yes, but they are very few and very specific. Don't assume you are the exception to the rule. Don't let your little head think for your big head. "
40,"I see families with your (pre-teen) daughters wearing ""JUICY"" emblazoned across thier bums. Disgraceful."
41,Seriously. Who uses pens anymore?
42," &gt; I feel like if a guy says it to a girl, it’s the male version of “You’re like a brother to me!”.

Not necessarily. I once said it to a woman I was dating when we were trying to organise our second date. I travel a lot for work during the week but we had talked about meeting up one night after work. She then suggested we meet up on the weekend so I could spend my weeknights resting.

I told her that she was sweet for suggesting that."
43,[removed]
44,"It means you probably have too much sugar and he prefers his coffee black, if you know what I mean. "
45,"My good friend recently said this: ""Dude, I don't mean to sound gay or anything, but you're attractive enough that you seriously could be smashing pussy every day. Why don't you fucking have a girlfriend?"" It's like I don't want to find one. I want it to just happen naturally. I can wait."
46,"I see, but I didn’t break up with him :( He broke up with me and I agreed to make it less painful for him. I just want him to get better. "
47,Then give him the space he needs to work on himself and if you end up getting back together later on then great otherwise it's best if you moved on.
48,#HEAD SCRITCHES
49,"Business owner.

Went to college and started my own business."
50,Enough to where I won't consider anything romantic if it's not present.
51,This is so wholesome. I love it.
52,[removed]
53,No I mean you breaking up with him may be a much needed wake up call that his depression is affecting more than just himself and he needs help.
54,"She lets me turn cricket on even when there's something that she would prefer to watch. Even asks a question or two while we are watching (we're middle-aged, American, caucasian, and live in Oregon)."
55,"I have a girlfriend now so I can answer this!!! She cooks! Basic I know, but for real- to take time and create this menial thing we HAVE to do, and make it delicious and pleasant and creative and not ask for help (until I force her to let me help)... I just feel like I’m being romanced every time. And it’s always delicious. I hate cooking so since she loves it I’m happy :)"
56,I work days and my boyfriend works midnights. He calls me on his way home as I’m on my way to work and we talk every morning for 30 minutes and always wave at each other when we pass on the highway. It’s a really nice start to the day. 
57,"The first one is a girl breaking into an old, abandoned looking house, only to discover there’s an old blind woman living there with a VERY sharp sense of hearing. The girl gets scared and hides when the old woman hears her and starts making threats, bragging that she can zero in on a mouse’s heartbeat. The old lady promises to go easy on the girl if she comes out, but also says the longer she hides the worse it’ll be for her. I always wake up right before the lady finds the girl.

The second is me reading an untagged spoiler on /r/wow that one of my favorite WoW characters will end up getting killed off, which makes me mad until I wake up and realize it was just a dream. "
58,Thanks for the tip
59,[removed]
60,You are not alone in this world my friend
61,"I dont have facebook, he doesnt have insta, and randomly finding people on snap is hard. and unfortunately he's not like 'core' friend group more like friend group twice removed lol. I've only seen him in occasional large gatherings. I appreciate the help though"
62,I mentioned (in passing) one time that I absolutely love fresh flowers. My husband never forgot that and buys me a little bouquet once every two weeks. We've been married 5 and a half years and it still makes me smile every time. 
63,Remember this. It’s so easy to lose touch in the flurry of changes with cohabitation. 
64,I notice this is askmen.... but people are talking about what men do. Are women infiltrating or are these gay men? 
65,"He took the bins out on trash night. He doesn’t live with me, just happened to be over that night. "
66,"This really shouldn't be an unpopular opinion. How you look plays a huge role in how your actions are perceived. I have personally seen cute guys get away with what I would have called objectively creepy behavior, but since they were cute. The only thing I would add is it is more of a gender neutral thing. Guys are less likely to label behavior creepy, but what a girl can get away with also is related to how attractive she is. With girls what they do is labeled gross. Say for example a hot girl takes her top off at a party. It's considered sexy. A fat girl does the same and it's considered gross. A cute/hot guy plays with a girls hair it's being playful. A fat guy does it and it's creepy. Like I said how you look plays a large role in how you are perceived it's just different terminology is used for the genders. "
67,"The first road trip we took. I was driving. My then gf now wife was passenger. She put her arm around my shoulders and scratched my upper back and hairline. 

Whenever she does this now (together for 8+ years), I remember that first time.

Now if she’ll do the other thing, things will be even more perfect :)"
68,Did you ever figure out what your condition is? 
69,"That meaning is different for everybody... for most people it means someone who matches the partners level of sexual promiscuity.

But a girl that is bad in bed is someone who doesn't return any foreplay and just lays there during sex like a dead rag doll and makes no noise. 
Also some women like to start talking during sex, like sexy talk is one thing, but like awkward jokes and off topic subjects are a big turn off during sex.

My personal experience of good sex is a girl who knows how to foreplay. Knows how to exchange oral sex. Knows what arouses them and can communicate it, it makes it possible to help them climax. A girl that can climax multiple times and isn't afraid to squirt. Knows how to talk dirty without it being weird. Also knows how to make me finish and has the ability to finish at the same time.

But keep in mind good sex comes with experience and commmunication. If partners don't communicate what gets them off its doomed. Everybody is different so knowing what the other person likes is 80% of it. Many inexperienced people don't know what they like and just need to figure it out."
70,No
71,"Well, that's a whoops, mate... "
72,"I'd be down for quite a few things. One of the things at the top of my list is get my female SO to dominate me. Not like the who electro shock leather face mask buts but maybe some rope, leather boots and a whip "
73,[removed]
74,All the damn time.
75,Nothing? Come on!
76,"Yeah, luckily we have known each other for near 10 years, all the way through high school and into adulthood. But were making sure to talk about things and stay positive especially before the move down so it's easier when I get there. "
77,"Damn. I miss her for you, bro."
78,"So many ways.  One ex came at a time when I had been single and promiscuous for *way* too long, and honestly felt like I could never trust people again because I had seen so much sketchiness in the hookup scene.  She was so real and pure and trusting that it not only forced me to be a much better person, it showed me that there were good people out there and I could trust people if I just found the right ones.  "
79,"My BF does a similar thing. He doesn’t think he should pay attention to me in a group setting and considers it needy if I tell him how I feel about it. He pushes me to interact with other girls or asks them to interact with me, making me even more uncomfortable and anxious. "
80,She made me think TWICE or more than that before I trust someone ever again.
81,"I have told him. I have begged him. We married in 2015, and were together about a year and a half before. When we were first together I was very up front with my emotional needs, and how I was “emotionally high maintenance, and needed a lot of attention/affection. Sadly, he just doesn’t get it. So... I’ve kinda numbed myself and given up. As a means to survive and self manage the levels of depression I experience. 

I’ve even told him, well, it’s not your fault... you just simply don’t have the ability to move me the way I need to be. I have told him this at least 4 different times. I don’t know why I stay... I guess, honestly... I’m just so damn tired. Hes not abusive. He’s not dangerous or have toxic habits or disrespectful. You know, it’s easy to leave a guy that’s blatantly in the wrong, but him, Every day is the same. Sadly, I just ended up with a guy who isn’t affectionate or even seem to need affection given to him. He seems very content, even knowing that I am broken and lonely and struggle not only with this weird fucked up relationship, but other life shit, on top of fighting a daily battle with depression. Believe me I have left myself very vulnerable to him, put out my best moves and got nothing back. We don’t have a sexual relationship as a result. 

I told myself recently, I can accept this life, as it is... but it doesn’t mean I have to be happy about it. I’m retiring my silly romantic ideas, hopes, dreams, desires that love will find me. I just want to get through the gosh darn day."
82,"I don't know how long I stay in love, but I catch feelings a lot"
83,"He may get the feelings, it doesn’t mean he will ever do anything about it."
84,She goes shopping... realizes she spent too much so she will buy me a few things at Marshall's to make it look like she went shopping for me. 
85,Gotta keep things spicey
86,Don’t do that man. I hope this is a troll post. 
87,At least I get other see happy people here instead of fucking miserable people over in r/relationship_advice 
88,Not quite. Unfortunately she is not Welsh.
89,‘GL’ or ‘really GL’. That’s 95% of the compliments I get. So I’m comfortable with those. 
90,"I agree wholeheartedly. I went through a pretty rough breakup a few months ago that impacted me more than I let myself admit - and although it ended up being exactly the kind of slap in the face I needed to turn my life around and start being better, I miss all the little things. This thread is currently doing a decent job of filling that hole as I at least get to share in other's happiness about their relationships. (That's not meant to be sarcastic or sad sounding, it's genuinely heartwarming to see)"
91,You mean giving him a wake up call? How do I do that? 
92,Just pull a Batman and buy the company. Ezpz. 
93,Puts a new bag in the can when I take out the trash.
94,What beard 
95,"No, we have to spend time together because of a club "
96,Yup. It’s a very... Mom-pliment. 
97,I told my hubby that I want to write down my memories of her every time a different comes to mind.  I know that's a great memory for you. 
98,[removed]
99,"I actually have dreams where I'm in crowds, walking around the city, at concerts, at the park, watching parades, at family parties as a kid. I'm very socially isolated so it actually makes sense. "
100,I like a small kiss on the forehead when we are cuddling. Or when we are cuddled up if she squeezes me really hard and sighs a content little sigh. 
101,"I'm in a long distance relationship and for valentines day, my girlfriend sent me a bottle of her perfume, that she'd previously sprayed on a hoodie she sent me that wore off. Now I can still smell her when I miss her."
102,"Almost 7 years in of dating, and 6 months in engaged. Were both in the restaurant industry and we met in Culinary School. We explore different cultures and cuisines just to understand the world better, together. Especially since I came from a family that didn’t really understand cooking....Lots of peanut butter sandwiches and mac n cheese....Now I’ve learned so many cuisines thanks to us both expanding our horizons. 
But regardless of what cuisine I make for him, he takes his time, will openly make small suggestions(because communication is key! In both this industry and in relationships)...but will always say my cooking tastes like home. And that shit makes me melt. 


"
103,"People who don't travel don't realize how much little ""home things"" mean when you've been living out of a suitcase for a month.

Having left overs specifically saved for me means the world after having restaurant food for what feels like a life time."
104,[removed]
105,Is there a thread similar to this but for r/askwomen ?
106,"No...you leave her alone because LinkedIn is ***NOT*** a dating website. 

You don't love her.

She's not the one for you.

#Leave. Her. ALONE.

You need to spend some time alone and get comfortable with yourself, based on the current information at hand for us. "
107,Hanging out with a child. Being at a playground alone. Pretty much anything related with kids without other people around or it being your kid.
108,"Lmao wowww I wasn't thinking of it in that light at all. When I've been tempted to say this to a guy it's because I want them bad and think they're a cool person, hence why they always look good to me.

Perhaps I shouldn't say it if it could be interpreted in a motherly way :S That's the last thing I need"
109,Morgan Freeman. Because who doesn’t like narrating the actions and thoughts of random people .
110,You make 100k as a stenographer?
111,"Even if you were motivated by the rejection, what's the problem with that? You said it yourself you feel better now than you did then, so take it and build on it."
112,Going in a women's restroom
113,He makes my coffee WITH THE CREAMER in it every morning and leaves it in the microwave for when I wake up. 
114,"...Interesting how you assume I was referring to a specific person.  You're not wrong, though.  And yes"
115,"Happy Cake Day Thumbmusclez! Promise me you'll always remember: You're braver than you believe, and stronger than you seem, and smarter than you think."
116,You'd think the most important person in your life should always be the most important person in the room. 
117,"Thank you. I hold on to those dearly . Every time they go through my mind I always smile, then shed a tear.."
118,"Your question has been removed by a computer. This could be for a number of reasons: (1) your post can be answered in one word, (2) you did not post an actual question in the title, (3) your grammar is so bad that the computer could not recognize your question. IN MOST OF THESE CASES, THE COMPUTER IS RIGHT, AND WE WILL NOT OVERTURN ITS DECISION. If you have re-read your question, re-read the sidebar, and still believe that this is a failure of our automatic filter, message us to appeal WITH AN ACTUAL REASON AS TO WHY THE COMPUTER IS WRONG.

*I am a bot, and this action was performed automatically. Please [contact the moderators of this subreddit](/message/compose/?to=/r/AskMen) if you have any questions or concerns.*"
119,Joe Bonamassa - When She Dances
120,"Was in Vegas for work with 3 other guys.  I had the rental car.

Last night there was a blast, but I overslept the next morning (hadn't packed or anything yet).  I got woken up by them calling me asking why I wasn't in the lobby at the agreed upon time (30 minutes before they called).

We missed the flight.  Couldn't catch another one until late that night and one of the guys missed his daughter's birthday."
121,"Do not flirt in the workplace. I repeat ***DO NOT FLIRT IN THE WORKPLACE.***

No one is worth jeopardizing your job, income, or reputation. "
122,"&gt;Probably not what the original author had in mind, fun still fun to consider 

How positive of that are you?"
123,"Woah, this guy juices!"
124,"I have a really nice butt. My girlfriend is actually envious of my butt. The other day she asked me to get groceries and when I went to the store a lady called me over and says, ""excuse me sir. You're probably my son's age, but you have the cutest behind ever."" "
125,I guess. I just wish it wasn’t such a severe negative right now
126,The date.
127,"He dead.

Before that, we were estranged for a decade."
128,I’m being serious. My whore actually sucks me off to wake me up.
129,So you just prefer to spend a lot of money buying them things. That sounds financially and mentally exhausting..
130,That I'm going to be ok.
131,"Have you told her this/apologized now that you're in a better place, and you have come to know how good she was?
"
132,"If we’re coworkers, it’s ALL friendly."
133,"""The Picture of Dorian Gray"""
134,"My brother married a girl who was wearing pink ""juicy"" sweats when he met her. Not many years later she divorced him for not giving her enough attention and for not letting her spend all his money on stupid things."
135,/r/trashyboners 
136,"It's just oddly uncomfortable. Sure after a few minutes it ain't bad, but still. "
137,"I used to feel that way, then I got married. My wife thinks it's endearing, so I stopped hiding things like that."
138,"[Elder Scrolls games](https://i.imgur.com/IvqnLmY.png).

This doesn't show the over 1,000 hours I dropped into Oblivion, or the nearly 3,000 i put into Morrowind back in the day before I had Steam (have since purchased both for Steam). Or the countless hours I played World of Warcraft back in the day.

"
139,"Or when you marry a girl who buys sweatpants that are $100-200, the rest of your life will probably be pretty expensive...."
140,Maybe he’s not sure how many there are?
141,"I hardly ever get a hungover - even after the hardest partying I'm only somewhat sleepy and slow on the next day. No headaches, muscule pain or anything like that.

What infuriates my friends the most is that this apparent superpower is wasted on someone who hardly drinks at all nowdays."
142,Reach for the stars
143,So? And what is the interest rate today vs when they bought their house?
144,"I'll still playthrough dark souls 1 from time to time and when it came out, I was putting in hundreds of hours into the game. "
145,"It happens when she asks the same question \*over\* and \*over\* even after I've answered it several times. (Ultimately, they do that because they really don't want the answer just a loooong convo) ; but still..."
