,text
618,"I sometimes bring her lunch to work, and she's usually busy enough to where she works through her lunch and I sit with her while we eat at her desk. Sometimes she's on the phone most the time I'm there, and she will play footsies with me to let me know she is glad I'm there. "
619,"*Sorry fir posting on tje comments. My posts got deleted for being ""foreveralone"" posts when I have real problem.*

In case if you don't know what SJS (Steven Johnson's Syndrome) is, it's a very rare (happens to average 3 people in a million) and dangerous skin deseas which either kills you or affects your organs, eyes, lips etc. TEN (Toxic Epidermal Nacrolysis) is the extreme version of SJS, my 85% skin was burnt.

So I was diagnosed with it when I was 6 months old. The doctor gave me a wrong treatment. I survived somehow. But it gave me many problems such as dry eyes, photo phobia, low vision. I spent 6 years in a blind boys hostel because no school wanted to admit me. I came back home when I was 12.

I have gotten bullied ever since. There are normal things that I can't do such as making eye contact (I can only do it when it's dark), crying etc.

Everyone always teases me about my eyes so I have stopped interacting with them. I don't like meeting new people because the first question everyone always asks is what is wrong with my eyes. I have been depressed ever since. I tried suicide when I was 13 but it didn't work out as my mom caught me (my luck lol). Forget about girl friends, I've never had a single female friend in my life (mostly for studying in an all boys hostel then an all boys school. Now I'm in co-ed school though).

I don't know if it's even possible for someone like me to get in a relationship so I don't even see that as a possibility (I'll call myself an asexual in future if someone asks me about It, job done).

So is there any advice you would like to give me? For having a good social life?

Thanks for reading. Sorry for my bad/wrong English, I'm an Indian and English is my 3rd language."
620,We need more details.
621,"Go in there with the mentality of becoming the under dog. You stare at those buff people hard and think to yourself how you will be bigger than them so you can kick their ass. If someone does make fun of you the people at the front desk should prove very useful. If not, train hard to kick ass or find another gym."
622,Is she single?
623,This is indeed beautiful. Good guy
624,"I really can't even begin to imagine what you have been through, and I have very little that will actually help you. All I can say is that in my experience, people get kinder as they get older - not everyone, but enough that I believe more people will accept and love you the further you get away from your teens. Men and women. Especially if you're kind to people you meet, even if you're shy and nervous around new people."
625,Dude. We approved your first post. Stop reposting it.
626,Rub my work feet
627,"I was really suffering with anxiety last year. He dealt with it all amazingly to be honest, but one day stands out for both of us. He was in a great mood and very ""up"", but as soon as I told him I was freaking out, he put some calm music on, I laid on his chest and we just breathed together until my anxiety lowered. I love that man."
628,"AFAIK there are no hairloss in men in my family.

Both my grandfather in my parents side had lot of hair in their 60's, my dad is 50 and barely started receeding.

I might go grey around 25-30 tho, but I'm okay with that."
629,I would never do it
630,6 months with his blessing. 
631,"*Sorry for posting in the comments. My post got flagged as ""foreveralone"" everytime*

In case if you don't know what SJS (Steven Johnson's Syndrome) is, it's a very rare (happens to average 3 people in a million) and dangerous skin deseas which either kills you or affects your organs, eyes, lips etc. TEN (Toxic Epidermal Nacrolysis) is the extreme version of SJS, my 85% skin was burnt.

So I was diagnosed with it when I was 6 months old. The doctor gave me a wrong treatment. I survived somehow. But it gave me many problems such as dry eyes, photo phobia, low vision. I spent 6 years in a blind boys hostel because no school wanted to admit me. I came back home when I was 12.

I have gotten bullied ever since. There are normal things that I can't do such as making eye contact (I can only do it when it's dark), crying etc.

Everyone always teases me about my eyes so I have stopped interacting with them. I don't like meeting new people because the first question everyone always asks is what is wrong with my eyes. I have been depressed ever since. I tried suicide when I was 13 but it didn't work out as my mom caught me (my luck lol). Forget about girl friends, I've never had a single female friend in my life (mostly for studying in an all boys hostel then an all boys school. Now I'm in co-ed school though).

I don't know if it's even possible for someone like me to get in a relationship so I don't even see that as a possibility (I'll call myself an asexual in future if someone asks me about It, job done).

So is there any advice you would like to give me? For having a good social life?

Thanks for reading. Sorry for my bad/wrong English, I'm an Indian and English is my 3rd language."
632,No matter how stressed I am he will always just listen and let me get it all out before thinking of solutions. It makes me feel heard and value his opinions. When we first started dating he helped me leave my extremely toxic home environment and I knew that with him everything was going to be okay. He still reminds me no matter how hard life gets we can do it together 
633,[removed]
634,Holds my hands from across the table when we are at restaurants :)
635,"We both use iFunny, so we both see the exact same featured set every day. He still texts me links to the ones that make him think of me :)"
636,[removed]
637,"You're a good person, thanks.  Funny enough she 100% will try to have sex at 5am before she goes to the gym if I'm awake.  So there's that. But your comment convinced me not to say something stupid first thing I see her.  Orgasms first.  

We do have a habit of oversharing when something bothers us.  Her especially, kinda her thing.  So it's definitely a new dynamic.  

I'll give it some time.  My sleepy head might just be stuck in a dumb loop"
638,We've been 'arguing' over who loves who more since 1998. I still say I'm the winner. 
639,"First hug when we see each other, SO lifts our tops and we rub our bellies together."
640,"I don't mind instagram and twitter, but if you can't survive one day without them we got a problem. Also talking behind other people's back about them together with constant complaining and impatience were the things that made me reconsider asking a girl out that I thought I was interested in."
641,"My partner will put my name randomly into songs, and it makes me so darned happy. He’s often done it alone in another room, and whenever that happens I just can’t help but feel crazy loved. The fact he’s thinking of me, technically singing about me when I’m not every there... it’s just so sweet"
642,"This is so cute! It sounds like hes very emotionally intelligent and you are the sweetest
"
643,"Hi,

Your post has been removed because it is a Frequently Asked Question.  If you haven't already, try these steps to find similar questions:
1.  Search for similar questions on /r/AskMen, using keywords from your request.
2.  Consult the [Frequently Asked Questions](http://www.reddit.com/r/AskMen/wiki/index) page on our sidebar for a collection of a few of the most frequently asked topics here.

Thanks."
644,You're right.  It would absolutely crush her if she knew how much it bothered me.  She really is amazing.  
645,I know nothing about my ex atm but im not interested in his friend im saying i might give it a chance since i've always thought he's a nice guy and he's flirting and things idk if that how he is or it's something but the whole situation is weird
646,"Yeah, talk about passive aggressive. She had to know that would sting. "
647,When my SO drops everything that she's doing just to comfort me whenever I feel down regardless of the reason 😊
648,"It's a shitty thing of her to say but of course she probabaly didn't realise that. Try get to sleep and maybe just talk to her about it tomorrow, get her to reassure you a bit about your own size and it'll make you feel better. "
649,"Your English is brilliant.

How old are you?"
650,That’s awesome that she cares about your sleep and doesn’t threaten you for it
651,Mmmmmm cake
652,Theater? 
653,"Boxers and an open hoodie, still at home eating breakfast."
654,"Just looking for some creative ""hints"" when speaking just to assure her that im a free man.

Actually, im from more passive-aggressive type of culture so i need to make it not obvious."
655,"I've got long beautiful hair, no family history of balding, and I'm considerably attractive. I also love my penis."
656,"Not really.

I do remember all pizza being better then though. I remember Papa John's being the best thing I had ever tasted at 6. Not so great now. I last had Domino's 3 years ago an it was dreadful. And overpriced. And *tiny*. So not worth it."
657,"I'm at work so all black (shirt and trousers), all the time.  Don't have to iron anything or make any decisions at 6am.  Plus, I try and cultivate the air of a miserable bastard so the black clothing helps.
"
658,"sure thing. just know it, also chances are if you people love you, you are amazing or lovely the least"
659,"Okay first off I wouldn't care how ""manly"" you appear to others but I believe confidence is what you are actually trying to build so here's what I'd suggest... 

1) take care of your health. Learn to lift heavy, sleep properly and eat well. No one cares how much you lift (again no one cares how much you lift). However, if you're body is treated right, you'll feel right and will naturally be more confident. No you don't have to be a bro either. Just go to the gym 3-5 days a week

2) try something new that's outside your comfort zone or seek a long time goal. Challenge creates strength and builds confidence. Sign up for that club, start a business, climb a mountain etc... You can do this as a controlled risk (starting small like talking to someone new). 

3) build or fix something. There's something to be said about physically creating something with your own hands. Could be an old bike, a drone, a car or even that squeaky bedpost 

4) find a male mentor or close friend. This is often the hardest part for others but a close friend will do wonders. I have hiking mentors, chruch mentors, triathlon mentors, leadership mentors, etc...they all push me and breed challenge. as mentioned before, challenge conquest creates conquest. 

5) go outside and experience life outside of a screen. I like the wilderness but getting out to park, nature trail or new pub all work 

Best of luck man and you'll fall into your own skin with time! If all else fails, a coffee on the summit of a mountain at sunrise tends to be my go to ;) "
660,"**Warning**: English is not my native language 

&amp;#x200B;

i know it take time but say it to yourself: Fuck it!

i have a friend that told me once:the way to get there is hard but in the end you be licking honey

(it was on his crying in his engineering degree)

in your case it might be little different but think on that  like this:

1. NO ONE going to laugh,and if someone will do that he's or her is piece of shit and you should ignore him
2. you doing it for your own health and people even look at you with admire that you take yourself seriously and improving you being 
3. back to the sentence in the start it will maybe be hard to keep up,you feel down but keep going no matter how you feel (mentally) ,just think of the good outcomes that you will benefit and there is ONLY benefits no bad ""side effects""...and who know maybe you will licking something else then honey (😉)"
661,This is called masala chai in India - chai is black tea grown in Assam/Darjeeling and the stuff you add is masala.
662,Pretty good. He gets on my nerves sometimes but we're close.
663,"My amazing guy comes over and helps me tidy the house, picks up things my kids or i might need, kisses me like crazy, always hugs me and rubs my face... 

Also recently weve been keeping my daughter's car seat in his car."
664,Why don't you want them to be friends with your friends? 
665,[removed]
666,Your guys seems to be awesome and I hope we all strive to be as badass!
667,"Not very much.

My girlfriend thinks I'm a stalker because of not too much of that. 

Well, she's not exactly my girlfriend...

yet..."
668,Second the Duluth underwear! Theyre my boyfriend’s favorite!
669,That is a good man you’ve got!
670,"Have you asked her exactly what she needs when you go out? Ask her to imagine a scenario where you go out with a group and let her tell you how she would want the evening to go in a perfect world. 

In my case, the problem is I want him to occasionally “check in” while we’re out by coming over occasionally to give me a peck, squeeze my hand, just say “hey.” I do not want him attached to my hip, holding my hand the entire time and smothering me. However he cannot differentiate these two. When I ask him to check in, and explicitly state I don’t want him to stick to my side the entire time, he doesn’t get how they are different. And it just makes me sad that when we go out I can’t expect anything akin to the knee squeeze OP mentioned. It feels like I’m going out single. If we go out to dinner and I sit at the end of the table with someone across from me, facing me and him to my side, he will ask one of the girls at the table to switch seats with him, so they are next to me and he isn’t. He does this because he considers me sitting at the end of the table isolating myself. It makes me resentful as time goes on because the behavior makes me feel so disrespected and belittled. "
671,"Generally speaking, people at the gym dont give a shit about what other people are doing. The only way that you'll get any attention at the gym is if you're doing something specifically to GET attention. If you just go in and workout you're just another person at the gym. 

Just start out slow man. Go and walk on the treadmill and just look around. Get yourself comfortable in that environment and gradually move on to exercises that are intimidating. Most people at the gym are also happy to help. Having a gym buddy can help as well. "
672,Dried up?
673,I know the feels. It will be ok. Us lonely fools all got each other.
674,He’ll be dead asleep and he’ll either roll over and put his arm around me or his arms will already be around me and he’ll pull me closer to him. 
675,"From other side of the discussion, the moment I saw his changing heart I stopped giving him advice and lay out what he’s done. Instead, I made him believe he’s perfect and I’m too hurt to continue talking and will always love him. Hopefully he will stay the immature and irresponsible way forever. "
676,"Your question has been removed by a computer. This could be for a number of reasons: (1) your post can be answered in one word, (2) you did not post an actual question in the title, (3) your grammar is so bad that the computer could not recognize your question. IN MOST OF THESE CASES, THE COMPUTER IS RIGHT, AND WE WILL NOT OVERTURN ITS DECISION. If you have re-read your question, re-read the sidebar, and still believe that this is a failure of our automatic filter, message us to appeal WITH AN ACTUAL REASON AS TO WHY THE COMPUTER IS WRONG.

*I am a bot, and this action was performed automatically. Please [contact the moderators of this subreddit](/message/compose/?to=/r/AskMen) if you have any questions or concerns.*"
677,Daily
678,Anytime im doing my makeup i can slightly see him out of the corner of my eye smiling and just gazing at me and its absolutely amazing.
679,"Whenever I sleep over at my boyfriend's I have to leave earlier than him the next morning. He always hold me down and give me cuddles and kisses before I'm allowed to get up and get ready. 

That made me feel so wanted and loved."
680,"Envy.

Jealousy is the feeling inspired when someone seems to be taking something that was yours.

Envy is the feeling inspired when you see someone with something you want."
681,Congrats!
682,"Head scratches, my god do I love it when she scratches my head."
683,"I think you should talk to him about it, he probably gets upset because he doesn't know why you're not comfortable, and he might think that it's because of something he's done. It would be really good for your relationship if you just have an open, honest discussion. You can tell him why you feel insecure about it, and he can assure you that he doesn't mind. I know it can be hard, but talking about things that bother you, always makes it better."
684,"Koalas.

Here’s the copypasta:
&gt; Koalas are fucking horrible animals. They have one of the smallest brain to body ratios of any mammal, additionally - their brains are smooth. A brain is folded to increase the surface area for neurons. If you present a koala with leaves plucked from a branch, laid on a flat surface, the koala will not recognise it as food. They are too thick to adapt their feeding behaviour to cope with change. In a room full of potential food, they can literally starve to death. This is not the token of an animal that is winning at life. Speaking of stupidity and food, one of the likely reasons for their primitive brains is the fact that additionally to being poisonous, eucalyptus leaves (the only thing they eat) have almost no nutritional value. They can't afford the extra energy to think, they sleep more than 80% of their fucking lives. When they are awake all they do is eat, shit and occasionally scream like fucking satan. Because eucalyptus leaves hold such little nutritional value, koalas have to ferment the leaves in their guts for days on end. Unlike their brains, they have the largest hind gut to body ratio of any mammal. Many herbivorous mammals have adaptations to cope with harsh plant life taking its toll on their teeth, rodents for instance have teeth that never stop growing, some animals only have teeth on their lower jaw, grinding plant matter on bony plates in the tops of their mouths, others have enlarged molars that distribute the wear and break down plant matter more efficiently... Koalas are no exception, when their teeth erode down to nothing, they resolve the situation by starving to death, because they're fucking terrible animals. Being mammals, koalas raise their joeys on milk (admittedly, one of the lowest milk yields to body ratio... There's a trend here). When the young joey needs to transition from rich, nourishing substances like milk, to eucalyptus (a plant that seems to be making it abundantly clear that it doesn't want to be eaten), it finds it does not have the necessary gut flora to digest the leaves. To remedy this, the young joey begins nuzzling its mother's anus until she leaks a little diarrhoea (actually fecal pap, slightly less digested), which he then proceeds to slurp on. This partially digested plant matter gives him just what he needs to start developing his digestive system. Of course, he may not even have needed to bother nuzzling his mother. She may have been suffering from incontinence. Why? Because koalas are riddled with chlamydia. In some areas the infection rate is 80% or higher. This statistic isn't helped by the fact that one of the few other activities koalas will spend their precious energy on is rape. Despite being seasonal breeders, males seem to either not know or care, and will simply overpower a female regardless of whether she is ovulating. If she fights back, he may drag them both out of the tree, which brings us full circle back to the brain: Koalas have a higher than average quantity of cerebrospinal fluid in their brains. This is to protect their brains from injury... should they fall from a tree. An animal so thick it has its own little built in special ed helmet. I fucking hate them.

&gt; Tldr; Koalas are stupid, leaky, STI riddled sex offenders. But, hey. They look cute. If you ignore the terrifying snake eyes and terrifying feet.

"
685,"Civil engineer working in land development design. 

I find myself noticing little things while driving around that relate to my work. Like a road near my house has something about 10 curb inlets all right next to each other. So I stop and wonder why it was designed like that. what kind of drainage problems did they run into that stopped them from having one low spot where all the water would go to. 

Little stuff like that. Every time I see something kind of wonky in the design of a site I try to think about why it was made that way. "
686,wow all of these are heartbreaking :(
687,[removed]
688,[removed]
689,Today is the present
690,No. He wanted a large wedding. I wanted to have a small destination wedding. We compromised and had a medium wedding. 
691,"I’m so sorry. With all the pain all the pain and disappointment she’s caused you, you still begin by saying, “I love you mom.” This makes me weep for your mother’s loss."
692,"They can be. 

They can also just be a kick-ass way to get high. "
693,I always showed interest in one girl at a time. I felt dating more then one girl at a time was mean or dishonest. I am 30 years old with a wonderful SO i wish to marry. So maybe things are different with younger people but IMO its just respectful to date and show interests in one person.
694,"When I was little my mom wanted me to pretend that I was sick and she lied to the cop, saying that she's going to take me to the doctor. That's how she avoided getting a ticket "
695,This. This is how you get friend zoned
696,Hahahaha!!! This is the best post I've seen in a while. Kudos. 
697,Treat myself to dinner
698,No one gives a fuck. It annoys people. 
699,This is shooped 
700,"Divorced, no kids. She was an entitled spoiled piece of shit who used to love treating service staff like they were beneath her. 

I’m now dating a 20yo model while she lives with her parents. 🤷🏼‍♂️"
701,Does she have the joosy busey?
702,"I feel that. 

It does make it easier to put in the work, but if you expect to just pop pills and make a lasting effect then they probably won't work for you"
703,Juiced and Flavoured 
704,"Are you me? My mom practically worked all week managing two stores on her own. This is after she became the top manager of her business. Either way, it came to a point that I never saw her and my dad was too busy doing stuff in the basement. I would go a few days without dinner and whatnot. Basically the reason I learned to cook on my own. Didn't want to starve. 

It's not that my mom or even my dad are bad people. They aren't, it's just they were the worst parents. I had to grow up without them, or even their help. Went through college all on my own. Never really got the parental check up and ask how I'm doing until WELL after. It's sad and it makes me sad. I know we are all supposed to rely on ourselves, but I just wish my parents had been there to teach me exactly how. "
705,Yup
706,r/beetlejuicing 
707,"It's also a game with some guys so we've gotten really good at picking up the tab. I'm friends with some people where we always try to pay for each others stuff. I'll position myself in front of a friend and tell the bartender I'm buying both beers. My one buddy is a fucking ninja with paying for lunch so I've been ducking his attempts to pay me back for other things. 

When you see the bill come have your wallet ready and grab the bill as soon as it hits the table. Don't ask the guy to let you pay, just do it before he gets the chance."
708,"Depends on what is going on in my brain of or people are walking around my area.

If something is moving around me, I have to look at it. I am not sure if it is primitive ""look for threats"" brain or I am just hyper aware.  

Even if I hear something I have to look."
709,"6', 215"
710,I finally got a new job after 3 long months. I lost 40 pounds and plan to gain it back asap
711,I’m not saying it’s an everyday thing. But once in a while …
712,"Not sure exactly what ""police foundations"" is, I'm in the United States. I do have a bachelor's degree in criminal justice though. So yeah that helped get the job as loss prevention but that was a part-time job. I could have just been a random kid in college and got it probably. But if you wanted to move up in that line of work (manager, regional manager, etc) then you'll probably want some higher education.

I now work for a private investigation company, which listed a criminal justice degree as a requirement. "
713,i have over 25 years of watching porn under my belt and no anxiety around women. So i don't feel this is the case. 
714,I feel you man I am the same way
