,text
0,"It's wishful thinking. I've never had a single urge to do anything sexual with another woman. But people who claim there are ""no truly straight women"" will argue against that and say I don't know my own feelings or something like that, and it's hard to counter those kind of arguments because it will always come back to ""but you don't know your own feelings, you're repressed"" or something silly like that. Like a stranger would somehow know me better than I know myself."
1,"For being left handed. 

For the record this was an adult I was romantically involved with. He heard and believed that left handed people are demonic or something. 

I devoured his soul shortly after."
2,"When playing the ""Life"" boardgame, you **must** go to college.  Starting your career immediately wasn't an option.  (When my sister and I played this with friends, we realized that my friends were far more successful in the game than us because they started a career immediately)."
3,When I moved in with my SO I had to start washing my bras more often so he didn't think I was a filth goblin.
4,"- I don't want the additional expenses that come with dog ownership  
- I don't want to pick up poop  
- I don't want to go for a walk everyday"
5,"My mom taxed my allowance and made me divide it up into three different funds (needs/wants/charity) which I then had to keep track of in Excel spreadsheets. 

I'm grateful now, but man was I the saltiest of 8 year olds.

Also wasn't allowed to drink soda or get my ears pierced until 13, at which point I was no longer interested in either. "
6,"For aborting a dead fetus. And to be clear, they knew the fetus had died. "
7,"I was absolutely *not* allowed to play The Sims. I can kind of understand my mom's reasoning, she was worried it would teach me that money would buy happiness and I would spend too much time playing a fake life instead of living a real one.

So, instead of The Sims, my parents let me play Diablo II. "
8,"Non-American here. I'm not that worried about Trump for the USA, the president in the USA does not have THAT much power to totally ruin things in politics, the crazy laws Trump wants to pass would probably not pass anyway. 

I'm far more worried what the Trump supporters, racist, misogynistic people will do if Trump gets in charge. Such people get louder and bolder when they believe they have the majority (and the president!) on their side. There have been too many examples in the world throughout the years."
9,"My mom did sooo much research on black hair because she didn't want me to walk around ""looking like I had a white mom"" 

I was born before the internet was really a thing (the mid 90's) so she would just ask random friendly looking black women in the supermarket what to do!  "
10,I'm more worried about his supporters than I am about him being elected. The fact that those people exist in such huge numbers is both worrisome and embarrassing.
11,"I am already exhausted from the people erasing the fact that this was a fucking targeted attack against queer people and not just another mass shooting.

My heart is broken. Homophobia is real and raw and this is about so much more than guns."
12,"Sometimes he'll turn to a stranger and tell them that he loves me. It mortifies me, but he finds it amusing."
13,"I was sitting on a bench at a train station. There are two empty seats next to me, and three other completely empty benches nearby because it's early morning and hardly anyone is there.  This bench is in the middle of the platform, so the furthest from any entrance. An older man with a cane walks up to me. He tells me I need to move so he can sit down. I tell him there's a spot next to me but apparently he wants me exact seat. He's not a regular at this train station, at least I've never seen him at that time, so it's not like it's ""his"" seat. He gets visibly upset and tells me to move again, so I'm like, ""Whatever, fine,"" pick up all my stuff and move to the empty bench two feet away. 

I was telling this story and apparently I'm an entitled millennial with no respect for elders or the disabled. "
14,"But then on the flip side, any lesbian or bi woman hasn't found the ""right dick"" to be straight. We just can't win. "
15,"You have to identify the type of hair and take care of it properly with the correct products. I use Shea Moisture for my shampoo and conditioner and it does wonders for my curls! Check out reddit.com/r/curlyhair for more information on which ingredients and products actually damage curlier hairs. This goes for a boy or girl child! Mostly important for girls as their hair will most likely be longer and need a lot of maintenance.

When I was younger, I was so jealous of girls who would simply wash their hair and dry it. It would come out straight and shiny naturally. If I left my hair wet and let it dry naturally, there would be a huge tangled bush. (Can't tell you how many times I've had combs broken in it) It takes a lot of patience and maintenance! Let me know if you need any more tips on this kind of advice!"
16,My MIL got me a gift certificate to a tanning salon 4 months after I was diagnosed with melanoma. 
17,"He cannot answer a simple yes or no question with yes or no. It's always every feeling, thought and emotion behind it without actually ANSWERING the question.

i.e. ""Hey cuddlenoodle SO, would you like some bread?""

Cuddlenoodle SO: ""I love bread. I had bread yesterday but it wasn't as good as the bread here, but I am looking at my macros lately. But this bread looks amazing!""

Other person: ""Uhhh...?"" *looks to cuddlenoodle for answers.*

Cuddlenoodle: ""Give him bread."""
18,"Don't impulse-buy. Go shopping only when you need something and have a list of what you need, i.e. I want a maxi dress, ankle pants for work, and a couple work-appropriate short sleeve shirts. 

Buy pieces that work with multiple outfits. Take inventory of what you have at home before you go shopping.

Accessorize! I used to be bad at this, but I'm getting better. A scarf, necklace, belt, etc. can change a whole outfit. 

Clean out your closet a couple times a year (I do this in the Spring and Fall). If you haven't worn it in the last year, get rid of it! Unless, of course, it's a special occasion dress or something. 

Finally, don't be afraid to experiment. Sometimes you never know what will look good together until you try it on! Mix and match what you already have!"
19,"1) I wasn't ever allowed out. All I got to do on week nights / weekends was stay locked in my room with SAT prep books. This started when I was in 7th grade.

2) No tampons.

3) ""You can only trust your family, everyone else is lying to you."""
20,As is tradition. 
21,"After my rapist raped me, he was furious that I didn't want to be friends with him anymore (or go to prom with him..wtf?) and upset that ""now people think I'm a rapist"" (yeah that's what happens when you go into someone's home and fuck them when they're running a 102 fever, on their period, and repeatedly pushing you away). He called me every name under the sun, would send me pages of rants detailing why I was an awful person, posted statuses on facebook about how I was a gold-digging slut because he bought me gifts (that I didn't want or ask for).

Every year for years he will send me a message trying to get me to talk to him. Last time I got one that said ""I'm sorry we're not friends anymore, I just wasn't ready at the time,"" like it was his decision to cut contact and I was the one pining over it. The year before that I got a ""I'm sorry but I don't even remember why we don't talk anymore."" I can't even lol. "
22,"I was born with an underdeveloped nerve in the brain that limits some facial movement. I can't smile with my teeth showing, but because of the limited movement I'm a really good liar and can deliver sarcastic humor well. My doctor said I won't get typical face wrinkles from this. I love my ""perpetual poker face.""


Edit: not sure if it's related but I can stick my whole fist in my mouth.
"
23,Dunno if this counts but I find my voice when I have a cold really sexy ðŸ™ˆ ( I have no idea why pls don't judge)
24,"My mom refused to let me shave my legs, because she was afraid to shave *her* legs because she had cut herself enough to bleed a lot once, when she was younger. This was a longterm fight between us for quite some time, and she didn't back down until we were packing for a trip to Florida in high school, and I was only packing pants because I said I'd rather get heat stroke than have to flaunt hairy legs.

I mean, *now* I only shave my legs intermittently and don't care, but as a teenager? It seemed even MORE important because she wouldn't let me, because she wasn't making the conversation about beauty standards or peer pressure, but about her own fear, heh.

(Once I did start shaving and didn't die, funnily enough, she started shaving her legs again, too. Weirdo.)"
25,"No going out anywhere where there would be people around my age without a chaperone, because there would be boys or corrupting ideas. 

I wasn't allowed to read books, watch shows or movies or listen to music without getting the okay from her that I was allowed to consume that media. I was not allowed privacy in order to better enforce this. 

I was not allowed to make a phone call unless she got to listen in on the other end of the line. 

I was not allowed to express any outrage or discomfort when she combed through every scrap of paper I had written on (that she could find) in order to make sure that I did not write any sinful things or have friends who had written any bad things. 

If she disagreed with a school subject, I was not allowed to answer the questions correctly. She would look at the homework and tests to make sure. "
26,"i think its unfair that someone who has gone thru male puberty can compete against those who haven't. like the whole point of gender segregated sports is to prevent this, i assumed. but i also just don't care about high school sports, so."
27,fucking cannot take a smiling photo. it always looks super forced or like a weird grimace. i'm pretty naturally always smiling and it always looks like i'm forcing him to take photos/be with me. hahah.
28,"I feel like I ran out of emotions to give over shootings.  I feel like I stopped being able to be horrified because it just happens so often that the helplessness and despair was too overwhelming.

It's not like I think it's ok.  I think it's utterly awful.  But I'm not watching the news or paying attention, because it feels pointless.  Nothing's going to change.  It's just going to be the same internet arguments and empty statements from politicians and the next shooting will be in a few days.

I guess a lot of people feel this way, and that's really sad.  That's it's so commonplace we don't get too fussed about it.  When Columbine occurred everyone was bowled over by the horror of it.  We were paralyzed as a nation with shock and disgust. But this shooting we'll forget about soon.  "
29,"I don't like the thought of being pregnant, labour, raising children, being a parent or any of the compromises that come with that.

I also don't really like children. 

So, it wasn't a super conscious decision. It's just how I feel. I'm only 19 so it's not caused any impact yet.

Oh, overpopulation also. I ain't contributing to it."
30,"&gt; I'm grateful now, but man was I the saltiest of 8 year olds.

Haha I love this. My mom drew up a formal contract with us about how much allowance we were to expect each week, and what items we would be responsible for (lunch money, clothing, entertainment) that she would *not* help with if we ran out of money.

My friends found it super weird, but I think it taught us financial responsibility. Once I didn't eat lunch for a month because I blew $60 on a hamster."
31,"Realizing I didn't have to have kids is what caused me to decide I wasn't having any.  Growing up it seemed like I had to have kids, which I had kind of admitted to myself, ""Well this will be a miserable time in my life, but I'll get through it"".  When I realized having kids was optional, I decided I wasn't going to.

How has it impacted my life?  I feel much happier, not having pressure from something I don't want to do.

How has it impacted my relationships?  I only date people who also do not want children."
32,"We went to the supermarket yesterday, and when I turned around he had two melons in his shirt and shouted ""HEY, LOOK AT ME! I'M MSSTARK!""

I didn't know whether to laugh or cry."
33,"My grandmother gave me a pair of used underwear for my 16th birthday.  She'd had someone my size staying at her house and the girl had just left, so they got passed on to me wrapped in a nice little gift bag."
34,"That the USA is so painfully behind on this issue that I don't really find it all that worth talking about. 


Like - it shouldn't even be an issue. It should be normal for women to be considered viable presidential candidates. Wtf is wrong with America where this is so unusual and remarkable that it's actually worth discussion? "
35,"Oh man the US would legit lose a shitload of respect globally.

As a non-American - it was mad hilarious at the start. But now there's an actual chance, and it's like ***""SERIOUSLY GUYS?! HAVE NONE OF YOU SEEN IDIOCRACY?!""***.

"
36,"Be honest with them and don't hide racial problems. 

Example; a white women with a black child likely wouldn't have issues with police or too many random occurrences of racism. If that child ventures out alone, it's a completely different story. 

Learn to do their hair.

If possible make friends with black women who have experience raising black children. Make sure your child is connected to their roots and has multicultural friends. "
37,"Very deep back dimples. I'm not alone in liking them, though - ex used to call them his thumb grips hahaha ugh"
38,One year I threw myself a party because I thought it would be fun. The only ones that showed were two of my SOs friends and one of mine. Out of thirty people. I know it's not a present but that stung. 
39,"He doesn't care what he wears. Usually if we're headed out together, he can tell by my face that something needs to be changed. Hint: it's probably the (literally) holey shirt you have on. 

I've learned to just laugh if we're meeting somewhere. Example: Last week we met for lunch, he had a long sleeve, button up, red plaid shirt. I was mildly impressed. He got out of his truck.... in grey basketball shirts with a blue stripe, long black socks, and old cowboy boots. It was hilarious!"
40,"My mom was/is also anti-tampon. She believed tampons stole your virginity (anything that penetrated, really) and virginity was Very Important. (After the loss of virginity, which should happen only with your husband, then tampons should not be used because that place is only for your husband.) She only bought me these giant overnight pads that were thick like diapers, not even pantyliners. I bought my own tampons once I started babysitting at 13. 

To say my mom's ideas on gender roles are problematic is a massive understatement. "
41,I used to work on roller coasters and would frequently have to tell small children that they were too small to ride. Apparently I ruined so many lives? 
42,"My now-ex husband didn't say a word about my birthday all day, until about 11:30 that night. He handed me a card, unsigned, with the envelope, still in the bag, with the receipt in it too.  He said happy birthday and acted like I was supposed to be thrilled with his thoughtfulness. The next day he took me shopping so I could watch him buy himself $600.00 worth of clothes; nothing at all for me. But hey, I got a card, right? "
43,"Whenever ""The Circle of Life"" plays at the football game and people lift up their babies like Rafiki did Simba, he lifts me up.

We are the only adults in the entire stadium to do that.

I actually love it."
44,Florist or someone who does stuff with flowers. Botany.
45,"I once asked why Ronda Rousey wasn't matched against men her own size, and some of the answers were very thorough.  A few Redditors explained to me how (due to bone density and other physiological differences) a match against a same-sized male opponent would still be unfair against Rousey.

Like it or not, there *are* differences in men's and women's bodies.  It doesn't mean we should discriminate, but it makes it extremely difficult to figure out what is a fair match.

It's definitely an interesting and complex issue."
46,"Look, I'll give it to you straight...us beautiful black women are usually more expensive until we go natural then we're only expensive when we re-up on ingredients.

1) Lotion the baby...even if you think the baby doesn't need anymore lotion, lotion it one more time.

2) When the baby's hair grows out, start a youtube account and just wild out on youtube natural haircare videos. If, once the baby's hair grows out, you don't know what to do...open your wallet and pay someone to do it for you.There is no shame in it!  If its a little black boy...find the flyest black man you've seen in a while and ask him who is barber is...then take your child to that barber. There is only shame in having your daughter/son looking crazy.

Things that stand out: Moisture is the special ingredient to black girl/boy magic. Our hair needs moisture, our skin needs moisture, our bodies need moisture! They were lucky enough to adopt/be raising this child during a strong revival of the natural hair movement so the internet is just flush with natural hair care and body care topics. They need to become acquainted with youtube."
47,"I am very concerned about the state of the Supreme Court. I fear that Obama's nominee will not get confirmed and that Trump will get to make that appointment. The conservative Supreme Court we've had for the last few decades has been responsible for Citizens United and the gutting of the Voting Rights Act. The conservative court has also been responsible for numerous decisions that weaken the rights of employees and consumers when dealing with large corporations. In the next four to eight years, we can expect that Ruth Bader Ginsburg (age 83) and Anthony Kennedy (age 79) will both retire. Stephen Breyer (age 77) might also retire. We do not want a radical, right-wing Republican, but especially not Donald Trump, making the appointments to the US Supreme Court. If Trump wins, the US might as well kiss a progressive, egalitarian future good-bye."
48,"They're expensive, smelly, and require vast amounts of time and attention. If you have one -- or heaven forfend, multiples -- kiss a lot of the nicer things in your life goodbye: furniture, shoes, ""whenever"" sex, disposable income, sleeping comfortably. You're beholden to their eating, sleeping, and elimination habits. Every meal you eat, you'll either have to share or feel guilty about. 

...Come to think of it, it's pretty much the same list as the list of reasons why I never had kids. "
49,"My brother owns his own business. His wife was doing the accounting and I had the suspicion that she was stealing from it. I asked my brother to let me look at the books, showed him the evidence, he fired her and got a divorce. She had stolen over $100,000 in just one year. She claims I am a bad person and have ruined her life and I'm the reason she is broke now. Yeah, I'm the bad one because I refuse to allow her to steal anything else from him."
50,"This actually really makes me want to go to a Pride event, to stand in solidarity with the community. I rarely attend Pride because, as a bisexual woman, I often feel unwelcome and excluded in queer spaces, but right now I really want to feel more a part of my community."
51,"I was adopted from India when I was 6. I just want to say I absolutely love my mother and the opportunities she gave me. If I was still in India, I do not think I would even be alive. I'm moments away from graduating college and am just so grateful for her and all that I have. If you have the ability to adopt, you should. "
52,"I have this weird fantasy of being a pimp.

I'd make sure my ladies and gentlemen were always healthy and in safe environments. They'd get free STD and health checks frequently. Our clients would be background checked beforehand (so my babes don't end up dead or something). I'd use my riches to buy a mansion that is a safe haven for my babes and they can stay there as long as they need/want. And nobody would be forced into anything. We'd also have an on-site therapist for my babes. Also I'd wear a big purple zebra print hat with feathers.

But of course that's insane. And a little illegal...

Edit: TIL a lot of you weirdos support this. I love you all."
53,I'd love to be the person who decorates the show rooms in IKEA. 
54,"I flirt with everyone, and if they flirt back I take it as a sign. Usually straight girls pull out really early and just say they're straight.  

In other words, I assume everyone is into me until proven otherwise"
55,"Because my boyfriend cheated on me with her.

Yeah, you read that right. She was angry with me and thought I was a terrible person for being with my (then) boyfriend because *she* wanted him.

The mental gymnastics from them both were astounding."
56,When I was 12 my dad's (expletive) ex-girlfriend gave me a Weight Watchers starter kit for my birthday. At my party. In front of my friends and family. It was mortifying. I never had any body dysphoria issues until then. It seriously screwed with me for years. I wasn't even fat!
57,"I personally have not adopted a child, but I was a child who was adopted at the age of 12. I don't know if you would like to hear about it from the other side or not?"
58,"After reading through these responses, I'm incredibly thankful for my open-minded and laid back mother. I can't honestly think of anything strange or controlling that she enforced at home. There were the obvious ""Come home when the street lights come on. Call if you're not going to make it home on time so I know where you are. Wear your helmet when you're biking."" type things but... That's about it?"
59,"Talking about things that happen in my country, when I don't mention I'm not from the US.

Also, I always get downvoted when I talk about how sex trafficking is a very big issue where I live, that many sex workers here aren't doing it because they want to. I was also downvoted for saying strip clubs here are shady as all fuck and many times also work as brothels, sometimes with - you guessed it! - trafficked women and girls. Do people really think this shit doesn't happen? It probably happens in developed countries too."
60,"I think sometimes we forget how hard won Pride really is. People died for the right to March in a pride parade.  People rioted, people were shot People have been disowned by their families, fired from their jobs,  even murdered because they dare identify as Lgbtq+.  

Pride isn't about pretty boys wearing nothing but a loin cloth dancing.  It's about the other 364 days where you glance over your shoulder before you take your partners hand because you've tasted pavement before and you have no desire to do it again.  

So yes I'm going to pride but it's the things you do the rest of the year that really makes the difference. "
61,My mom was a hardcore drug addict and we regularly saw her shooting up heroin. BUT we weren't allowed to watch the Simpsons or Beavis and Butthead. 
62,"For the the shape of my eyebrows. He said I was arrogant because obviously I was always plucking them. Which I wasn't, they just grow like that"
63,Free a young black kid in prison for weed possession and replace him with Brock Turner
64,"Not wanting to be more than friends, and subsequently getting sexually assaulted. Apparently that made me a bad person.

This all happened when I was ~16. At one time T and I were great friends, best friends even - but there was this constant undertone of 'unrequited desire' that kept rearing up and making the friendship extremely frustrating. He would make advances, I would maintain that I just wanted to be friends.

When I told him I needed space from him, he turned up at my parents' house with flowers. I again asked him to give me space, and the next day he turned up sat in the car with my Dad who was collecting me from work. He'd given my Dad this sob story about needing to talk to me, that he had some important things he needed to say and I was dodging him. You can imagine how weird that car journey was.

I told my Dad afterwards that I was worried T was getting too much, and told him I wasn't comfortable with his advances. My Dad apologised for allowing him in the car, but he had apparently walked all the way to their house from the other side of the city (?!) and he felt sorry for him.

I cut ties with T after that. A few months later he reached out to me and I stupidly agreed to try being friends again. I went to his parents' house and we were chilling watching TV and eating, when he started asking me really private questions about myself, my sex life, whether I shave...then he started pushing me to show him my body. I was really uncomfortable at this point and wanted to leave, but he would not stop pushing - bringing out every reason, complaint, plea you can imagine.

Long story short, he assaulted me in that room. I called my Dad sobbing and he rushed over to get me, I was sat outside on the front step feeling completely lost and betrayed.

We shared the same large circle of friends at the time, and they all took his side, insisting I had always led him on and I deserved to feel ashamed. That he was in his right to touch me because I'd 'led him on for years', and that I had 'bewitched him' and played him for my own benefit.

Safe to say I lost a lot of friends that day.

I really needed to share that...I carry it around with me a lot of the time and I've never really shared it with anyone before."
