,text
60,"Remember that the girl being harassed will probably also be suspicious of you, so don't do anything like encourage her to come with you to get away from the harasser, or try to hug her to comfort her, etc. Even if you're a good guy, she doesn't know that, and unfortunately there are dudes out there who think by 'saving' a 'damsel in distress' they're then free to make a move on her themselves. So bear in mind that in a situation like this, she's gonna be suspicious and a little panicked, so don't rely on her trusting you. If you're with a female friend / girlfriend things are a little different, as she'll probably feel more comfortable around another woman. 

Also, don't make her feel embarrassed or patronised. For example, by saying to the harasser, 'look how terrified you're making her!'. Don't speak for her, or draw attention to her vulnerability. When being harassed by a stranger in public, the last thing you want is even more eyes on you. Plus it's just embarrassing, and just drives home the point that she's unable to defend herself. 

De-escalate the situation. Don't start a physical fight or something like that, 1. because violence is bad, 2. because she's gonna feel way responsible if someone gets hurt defending her, and 3. she's just gonna want things over as soon as possible. 

So basically, the best thing to do is to draw attention away from her, without escalating the situation. "
61,"Well, last summer I was on a date with one girl. We were on a bench talking drinking beers when another one sat close by.  she started to enter the conversation. 

Which was odd. But hey, i never back down from a conversation. She told us there was a weird guy following her so we reseated to make it a 3 person group. I didnt know what to do so I gave her the last remaining beer. 

She usually waits there for her bf but he was running late and she was still freaked out from before. She was very happy with the beer. Later the creepy dude found her/us sitting there. 

We reseated. I sat next to her. My date across from us. And we ignored him. I did pay attention to the guy and noticed he was mostly mentally not all there. So I couldn't get in a conversation with him and distract him. 
Soon the bf walked up. Surprised by the two strangers with his gf. luckily they are made for each other and with a few words we all went on our well planned double date. 

The date and I didn't work out. But we all remained friends.

So I say beer and conversation is a solution sometimes. "
62,"I have three sons.  

At the age of 8, they had to start changing their own sheets.

At the age of 10, they had to do dishes every night, and vacuum, dust and bathrooms once a week. 

At the age of 14, they had to start making one meal a week.

At the age of 16, they had to do their own laundry and help with grocery shopping.

I remember someone visiting us gasping when the boys started to clear the table and do dishes.  ""How do you get them to do that?"" they marveled.

""We live here,"" the youngest responded.

They're good boys."
63,"This is really minor compared to other comments, but I was in a LDR and felt like I was doing all of the emotional work in the relationship. We usually talked on the phone every night, if only for a few minutes, but I was always the one to coordinate this. One day I just didn't call or text and decided to wait to see how long it would take for him to reach out to me... it took a week. When he did finally call he was surprised I was upset with him.

I definitely could have handled that situation better, as I essentially set up a trap for him, but it was very revealing and the relationship ended shortly after."
64,"Workout more, save more money, keep working hard because you'll be fine in 8 years!"
65,"Usually Arab people on TV or in movies are depicted as terrorists (which is obviously annoying), but I've noticed a few ""surprisingly virtuous Muslim"" roles as well. Like, there's a Middle Eastern woman who wears a hijab, and at the beginning you're supposed to think she is a terrorist but at some point, PLOT TWIST, she's actually a good person! Whoa!!

I'm not even remotely Muslim, but I still find it annoying."
66,Number of paid holiday days I can take!
67,Contouring way too much. 
68,"Me and my bf got in a fight. Afterwards we were still angry but now sitting on the couch watching tv. Out of nowhere I wound up catching a horrible case of the hiccups.

When I get the hiccups they last forever and are really loud unless I keep my mouth closed. Rather than running to the kitchen to get a glass of water to cure them, I just sat there hiccuping my butt off with the sole purpose of annoying my bf. I kept my mouth open the entire time so my boyfriend couldnt really even hear the tv, just my nonstop squeaking. After about 20 minutes of this I could feel the tension in the air and I could tell my bf was getting pissed ""but baby, I cant help it!"". So i went to the kitchen pretending I was getting a glass of water for my hiccups. Instead I chugged some soda, making the hiccups even worse. After another 20 minutes they went away and my petty revenge was over.     "
69,that he only thinks attractive women exist and only makes friends with women he wants to fuck. red flag.
70,"Two Latina main characters in Brooklyn 99, and both of them have very different personalities. "
71,"Calling women females.

Trucker hats with huge hashtags saying dumb shit on them.

Parties for literally everything child or wedding related.

Metallic shoes."
72,"* When the person refuses to see help for it

* When the person cannot function in everyday life without constant assistance (AKA can't work, drive, interact with friends)

* When they cannot provide support for my own mental hangups and issues

* When it escalates normal discussions to a mental breakdown every time

* When violence is included

Most importantly, it is when we cannot find a workaround these things."
73,"To create diversity, one or two of every random group of extras is a person of colour, but the actual cast remains mostly white. 

"
74,"6 months into the relationship, I was really upset because I missed my sister who was away for school. Neither of us could afford the plane ticket. He surprised me and got her fly here. I was living with roommates back then and didn't have any room for my sister. He insisted us to stay at his studio, he went to his friend's house for the week. I love that man so much."
75,"This is so so true that even as a white girl it annoys me. Master of None's ""Indians on TV"" episode was one of my favorites. It brings light to everything this post is about. I miss that show."
76,Jenson Ackles. That man is a genetic freak. 
77,"Years and years ago we were fighting and I knew he'd worry about me so I opened the door and made it sound like I left, then hid in the house. He went outside looking for me like I knew he would, and I reclaimed the bedroom. 



He was not amused as he was certain I'd been abducted "
78,"Well, it's been a bit more awkward since this past weekend when my 11 year old, whose chore it is to pick up the dog poo from the back yard, found one of our condoms sticking half way out of a turd. ""You should probably dispose of those better."" he said with a straight face. "
79,when he kisses your shoulder and slowly goes up to your neck HhhGGUU
80,"My SO's hands look much sexier while he's driving, and I have no idea why..  

I was watching him do the the gear changing the other day (usually I look outside) and it really turned me on for some reason. I still don't understand. "
81,My hands and feet are always ice cold.  My husband warms them on his stomach or between his legs.  That's true love if you ask me.  
82,"""Calm down.""     

I submit that there is virtually *never* a good time to say this."
83,"Career-focused business woman has to Learn The Hard Way that family and love is more important, ends up quitting her job to get married/raise a child.

This was basically a whole film genre in the 1940's-60s, but it's still around, it just tries to be slightly more subtle in messaging."
84,For me it's when he parallel parks his truck into a tight space....OMG panties dropping tonight. No clue why. 
85,The understanding of and capacity for emotional labour.
86,"I find that some men tend to ignore the whole ""ranting makes you feel better"" thing when it doesn't apply to them. They rant about their problems and I listen, throwing in an occasional ""Wow, that sucks!"" or ""Jeez, that dude's an idiot!"" but when I have a problem that I need to rant about, they go on and on about how I can solve the problem. Dude. I'm an adult. I can solve my own problems. What I need is for you to listen to me rant, like I do you, and agree. Don't try to treat me like I'm a child who can't handle difficulties and problems. 

Makes them seem selfish and like they're sitting on some high horse with their (imagined) patience."
87,"Dated a guy for about 9 months. He made a big deal about introducing me to his family, told me he loved me, the whole deal. One day he called me on the phone and said he wanted to break up. That he never loved me after all. That he had lied every time he had said it. That he did it on purpose, and that he had used me to get over a girl he was crazy about. He told me that he wasn't attracted to me and gave me a very specific reason (read:  physical flaw) as reasoning why. Then he hung up. 

That fucked me up. In the moment I asked him how and why he could do something like this. How did it start? And he responded ""it just started out as usage"". Usage. Usage is something you do to a shampoo bottle or milk carton, not a person. 

How did I move on? It was hard, not because of missing him or mourning the relationship, because it was clear after that that he was basically satan. The hard part was not letting his words get to me. I had to fight every day not to believe that he was right and that I really was not good enough. The hard part was looking in the mirror and fighting back that voice that tells me that I'm less-than. Humiliation like that doesn't wash off in the shower the next day. It seeps into your skin and gets down deep and it has to be *worn* off. Over time. Somehow I made it."
88,"A common ""hair hack"" on Pinterest recommends spraying a mixture of brown sugar and water on your hair to straighten it without heat. YOU'RE JUST GOING TO MAKE YOUR HAIR REALLY STICKY AND CRUNCHY THAT SOUNDS SO GROSS.

Well, expand that to pretty much all LPTs and ""hacks"" on Pinterest. Most of them are bogus."
89,[deleted]
90,"Strawberry daiquiris, all the time. 

Tequila... never. "
91,"I hate Life Pro Baking Tips that include cake mixes.

Make simple cookies with 3 ingredients! - no, that's many ingredients in one package.

Easy two step pancakes! - you're right. It is literally a cake in a pan. And it's rotting my teeth.

Homemade crumble! - NO THAT'S A CAKE MIX POURED OVER CANNED PEACHES"
92,I hate those super pointy fake nails. 
93,"The Kylie Jenner look. I have nothing against the Kardashians-Jenners; just don't really get why so many girls are trying to emulate Kylie, especially the over-filled/lined brown lips. We live in a time where diverse beauty is celebrated more than ever before yet so many people are aiming for the exact same look. "
94,"You piss me off, you get the not-as-pretty plate for dinner! Or, I... enhance (spread out?) the starfish position that I am known to sleep in."
95,"Aw, you cut out my favorite part.

&gt;Do you hate washing your bowls? Do you hate not washing your saw?"
96,"Jennifer Lawrence. I don't think she's hideous or anything, but I think if she wasn't famous and guys saw her walking around the mall, nobody would look twice at her. 

I think Charlie Day is incredibly hot. "
97,"You can love someone a lot,  but that doesn't mean you're compatible in other ways and should be married/ in a relationship. "
98,When men wear henleys.
99,"I only compare hands with guys I want to bang. Tbh it wouldn't even matter if he had small hands, big hands, whatever, it's some bizarre primal thing that I just *love* doing. On the date last night, he initiated the hand-comparing and I was in heaven."
100,"This is really useful, thank you. I've only always thought of confrontation but this seems awfully pragmatic. "
101,"Yep. My state just passed a ridiculous fucking anti-abortion bill, so obviously it's still necessary."
102,I found my boyfriend. He talks about Star Wars and space just like he does at home. 
103,"Now that I think about it, nearly every woman I've been with has wanted to ""compare hands"" at some point. Got to admit that I really like it too"
104,"&gt;metallic shoes

Whoa.  Let's not get carried away here."
105,"Never have I ever seen the Godfather or any other ""classic"" film, because immigrant parents."
106,"I'm very obsessed with men's hands. My boyfriend has the most perfect hands I've ever seen. They're huge and he has long, slender fingers. I could get turned on if I just stare at them. "
107,"Kindness. The older I get the more important this is to me. You can be as smart, funny, educated, sporty, and whatnot as you want, if you're not kind, you're not the guy I wanna be with."
108,Someone who truly loves you isn't going to break your heart all the damn time. Yes. Relationships are hard work and require effort and dedication but someone who makes you cry for the same reasons over and over again loves themselves way more than they love you.
109,"I'm half East Asian, and I remember how much the character Glen from the Walking Dead stood out to me the first few seasons of the show. Yeah, he's very clearly East Asian, but like that's it. He's also shown as sexually attractive (and gets the hot girl), important to the group, a hero without being some sort of ninja, and has a skill set that has nothing to do with math or science. I think his race was mentioned like one time (Merle the racist refers to him as 'Chinaman' and Darryl says: ""He's Korean""). And having a racist insult hurled at you isn't an unrealistic experience.

I just remember being shocked at how surprised I was by his character and its development because I realized how rare it was."
110,"* I wish I'd started applying sunscreen in my teens.

* I wish I'd saved my money instead of spending it on stupid stuff I didn't need 

* I wish I'd realized then that I don't have an expiration date on my ass like a jug of milk and that I'm going to be beautiful and wonderful and capable of forming relationships my entire life long, so there's no need to get married now or stay put in a dead end relationship. 

* And I wish I'd told every woman I know that time never runs out until you've stopped having a pulse."
111,"Nagging mum, hapless dad. It's revolting."
112,Over at /r/SkincareAddiction the running joke is Pinterest skincare LPTs...like lemon as a exfoliator or even (oh god) a sunscreen replacement
113,"&gt;  don't think this really answers your question but, it irks me to no end when I am watching a movie and they show a Black woman going to bed with no scarf on her head... -_-

THIS SO MUCH! Olivia Pope does this to no end, it annoys me so much. Like girl, really? You've been in bed for three days but you didn't bother to wrap your hair? Ok. black-ish does a pretty good job with showing them wrap their hair. 

I also agree with your second point, but the first comment got me heated. "
114,"She came over, planning to break up with me, and brought with her a shirt that I used to borrow a lot and gave it to me, because even though we weren't going to be together, she knew I really liked it and wanted me to have it. I think I had managed to hold back the tears until then, because that's when it really hit me what a sweet, thoughtful person I was losing. "
115,"This might not be a thing in every country, but it became a trend among Turkish online stores as well as some bloggers to conduct a drawing for a prize on Instagram. They post the picture of whatever the prize is, you need to follow their account, repost the picture on your own profile with a hashtag to enter. My Instagram home page is becoming a product catalog in between animal pictures. "
116,"I would definitely still drink margaritas. 

I would definitely never have gin again."
117,"Whenever I see Cece in New Girl wear a lehenga or sari cause she has a family function. I had no idea she was Indian until a random episode, and it made me really excited! I love that her Indian-ness never overshadows her American-ness. It's so relatable to me and most American desi women I know."
118,"&gt; Even better if those arms are wrapped around me from behind and I'm looking down at those forearms

The. absolute. best."
119,"For me it's the Smurfette Principle. It's so difficult to watch movies with maybe half a dozen guys and one woman. My favourite films are Star Wars but damn they are so bad with this. There is allowed to be more than one woman in the galaxy at a time!! 

Closely followed by the hypercompetent female sidekick. You know, the woman who has trained her whole life but then this average guy comes along who just needs to learn to ~believe in himself~ so he can save the day. "
120,"Why the fuck does every female main character need a stupid romance plot?  Guys do not, so why do women?"
121,"Even worse, the hot woman is seen as a ""prize"" for the ugly guy once he's learnt to accept himself and gain a bit of confidence, as if that would happen if it were the other way around "
122,"This is the perfect time to introduce you all to your [Lord and Savior, Snack Man.](https://www.youtube.com/watch?v=Erlw-ODVZxU&amp;feature=youtu.be)"
123,Gripping the wheel flexes his forearms. The shifter is his dick. 
124,My fiance coming inside from having a smoke. She stated she was dizzy and the fell to the ground seizing. She went brain dead and died a week later. The experience wakes me up most nights.
125,Married 10 years...  Now that our kids are old enough to mind themselves for a bit and play video games things are good!  Lots of mid-afternoon sneaky times for us.  We average a little over 3 times a week.  When they were infants and toddlers though... it did suffer some.  But at that point you'll be too tired to care!
126,"Men with armpit hair that doesn't look like pubes. It's less curly, less bunched up, more straight and clean looking. I dunno, I'm into it."
127,The year I die.
128,"Men in a shirt, sleeves rolled up to elbows showing forearms and hands! Anything those hands/arms do have me mesmerised. Especially when the muscles flex "
129,"When he trivializes my complaints about my job by comparing it to the problems at his, and then the whole conversation becomes about *his job.* He has a really fast paced, high pressure job and works a ton of hours on high stakes projects. My job is slower pace, less pressure, but the environment (government) can be really frustrating. My work problems are not ground breaking compared to his work problems, but they're still *my problems* and sometimes I need to vent about them because they still ruin my day. 

I've expressed my frustration and my need to be listened to without being one-upped and he's working on it.  "
130,I totally agree. The fact that we even genderized food is really stupid. Like what makes bacon manly? I know some guys that won't even eat tofu or hummus because supposedly only women eat it.
131,"One PoC in a group of white friends....like...you know PoC hang out with each other, right? (Same goes with queer people.)

Accents on characters who spent most of their life in the US. "
132,My friend Kyle. Had the biggest crush on him when I was 13. He was pretty then and smelled like a god. 10 years later when we reconnected again he still smelled like a god and looked even prettier. 
133,"Vocabulary and wit. Both used appropriately. 

Interestingly, this is also how one tells that women are intelligent. "
134,"There's actually [a really good interview](http://neatoday.org/2016/07/18/chris-emdin/) about this phenomenon in real schools. 

Young white teachers can often only get jobs in inner city schools, and you see a lot of young teachers with this ""savior"" complex.. when the reality is that they rarely stick around more than a couple years once they can land a ""better"" school. "
135,"Lupita Nyong'o is like from another world, I can't take my eyes off her when she's on the screen, she's flawless. Also Jennifer Aniston and Gwyneth Paltrow but sometimes it's because I really love their fashion and make-up style, too."
136,"Hug your dad and start recording his voice.  Ask him questions and tell him you love him.  He won't be around for forever.

Get yourself into therapy."
137,I'm currently single and using the no-penis method.
138,"He was really into magic the gathering and had thousands of cards organized, alphabetized, color coded etc. Well one weekend, he chose to go to a magic the gathering tournament instead of help me move. I was new to town and didn't have any help. He frequently chose magic over me. So, when he wasn't looking, I shuffled random stacks of magic cards and put them throughout the collection. I also deleted all the save files from a final fantasy game he had played over 15 hours on and still hadn't beat but was near the end. "
139,We had gotten into a fight and he thought that he would just run off and lock himself in the office with his computer to ignore me. I turned the wifi off and he spent an hour restarting his computer and calling the IT tech line before he realized it was just unplugged. Bwa ha ha. 
140,"Ooh, this is a good one. It makes you feel like you're in on it with them."
141,How come no one has mentioned Jon Hamm
142,"So I've been severely sick with the flu on and off for about a month now. I don't have health insurance so I've been holding out on going to the ER/walk-in because im broke as shit. But, after a few restless nights this week I finally decided to go and dish out $130 for the visit. Severe Bronchitis/dehydration/sinus infection. Happy I can get better before Christmas. Not so happy part- the medications came out to $200 total. I broke down at the pharmacy because I had literally $60 to my name and I was delirious from driving myself around all day. So I called my SO crying just to vent and boom- he left work, drove 30 minutes out to me, and paid for my medications. Knight in fucking shining armor. Now I won't be sick when I go home for Christmas.



Tl;dr: sick as fuck, broke as fuck. couldn't afford medications, SO paid for them. 

Edit: we've only been seeing each other for about 4 months. I think he's a keeper"
143,"This is pretty much us too. We have two daughters ages 7 and 16. We are a pretty close/open family. My daughters never shut their bedroom door, unless they're changing of course, nor do my husband and I. So, now I feel like anytime I shut and lock the door they must know what we're doing. It's very hard to get in the mood. I agree with you, a lot of late-night sex for us too. We've been together 16 years. You just find ways to get creative. Too bad for my husband though, I hate shower sex.

All that being said, we don't hide affection or the fact that we have a sex life from our children. We obviously don't do anything inappropriate in front of them, but I think it's important for them to know that sex is not a dirty or taboo thing when done responsibly."
144,"The ability to admit they don't know.  One of our first dates with my husband, my car was having trouble.  I asked him if he could look at it.  He said, ""I can open the hood and stare at it and tell you it's an engine, if that's what you mean.  But I haven't a clue what would be wrong with it.""

I've been with SO MANY MEN (dad and brothers included) who feel they have to solve it even if they don't know.  I love a man who can admit they don't.  And then go out and get the learning to know in the future."
145,I wear them to escape my feelies.
146,That I don't have to feel obligated to stay if I'm unhappy just because I've put a lot of time into it.
147,Not saying it's good to portray a gay character like that but openly gay character on tv in the early 90s...progressive for its time.
148,"&gt; who puts on a fake Indian accent

They missed a great 4-wall joke there: He could drop the accent in the later parts of the movie, and throw a line about the accent being 'for the camera' and 'ignorant american audiences'. "
149,"I want you to know that i've been laughing at ""penis shoulders"" intermittently throughout the day."
150,When a man unbuttons his suit jacket before he sits and rebuttons it after he stands. Woof. 
151,"How much weight I can lift. Heck yeah, thousand pound bench presses!!

Also, how many calories I can eat without gaining weight. YESSSSSSSS!!!

Ok, how do I make this happen?"
152,"Yes it does and yes I am a feminist because sexism still exists.  

Just the other day, I had a cashier make a ""joke"" about how I ""wear the pants"" in the relationship and ""obviously"" have my SO on a short leash just because I was the one paying for our groceries.  

Also, just this weekend, I had a man come up behind me in a thrift store and try to reach under my arm and grope me. 

And that's just this past week in a fairly liberal part of the US."
