,text
65,"It's dismissive. And inaccurate.

I think a lot of it comes from the social acceptance of physical closeness in female friendships. It is considered acceptable for girls to do thinks like dance closely with each other or for teens to have sleepovers and sleep in the same bed. From my experiences, it is not considered ""acceptable"" for boys to do the same. Because society is more accepting of ""closeness"" in female friendships, the perceived potential ""non straightness"" is a self fulfilling prophecy."
66,"I like being unattached. 


Allowing myself to feel vulnerable and sacrificing my sense of security is tough. "
67,"My only thoughts are that it's completely horrible, and it's tough not to feel helpless.

Actually, I have another thought.  Mr. Rogers is right:

*""My mother would say to me, 'Look for the helpers. You will always find people who are helping.' To this day, especially in times of disaster, I remember my mother's words, and I am always comforted by realizing that there are still so many helpers â€” so many caring people in this world.""*

"
68,I have a beauty mark right next to my butthole.  It's been confused for poo :(
69,He has an inability to whisper.
70,"When my daughter was about three she wanted something in the grocery store, but refused to say please.  I didn't give it to her anyway and for this I was called a bad parent.

This is frustrating because there are so many *valid* reasons why I'm a bad parent."
71,This is the sweetest thing I've read all day.
72,"I've never *used* it incorrectly as it's not the kind of thing that comes up in casual conversation, but I always vaguely had an impression that a kumquat was some kind of small tropical mammal, like a fat little tree shrew or something. Then when I was about 14, I saw a bottle of kumquat-scented shampoo and I quietly asked Jeeves what a kumquat actually was."
73,This is really funny
74,"Morena Baccarin.  She is just incredibly lovely. I've always been stunned by her grace, on top of her obvious physical beauty. "
75,I fart really loud
76,"When I broke up with my abusive ex fiancÃ©, I lost loads of weight (through stress, but whatever), got a whole new wardrobe (because I needed it after the weight loss), got a new haircut, got the tattoo I wanted (that my ex said would make me look like a man), changed career, got a great job, almost doubled my salary, got several promotions, bought myself a car and a piano (he hated me having hobbies), took up dancing and got a mortgage by myself on a house in London. 
He got unemployed and a horrendous haircut so awful that when I bumped into him I actually couldn't help doubling over with laughter. "
77,Phoebe on Friends called it the sexy phlegm voice. 
78,"Okay. I did grow up with my parents and their rules and how they structured the house, which would be different from a child from foster care. When I first moved in with my adoptive mother (she was taking this on all by herself) I was very hesitant to do anything. I was afraid to touch anything in the house, to get food when I was hungry, or to even ask questions. She really helped with my adjustment period by telling me it was okay to do this or to not do that (I went from living in the middle of a city to out in the country; it's amazing the differences in how to do even the simplest of things). Middle school was a blur, I remember not having many problem between me and my adoptive mother; however, that changed in high school. I became really ""rebellious"" as a teenager and was quite hard headed about wanting to have a life like I had with my birth parents again. This made things difficult, and of course as the child I didn't agree with how my adoptive mother handled certain situations. As an adult now I understand why she did the things she did. 

If you have an specific questions about anything, I'm all open to answer."
79,"There were a lot of rules about what I was allowed to wear and when. I never got to do the typical (pre)teen thing of trying out different makeup and clothes as a way of trying out identities because I got so much pushback. Generally, if she didn't approve she wouldn't buy it, and if I found a way to experiment with the approved clothes then the rules changed.

But the weirdest rule to me was always my curfew. My mom had been a wild child and a runaway as a teen, so she let me know when I was 13 that my curfew was always going to be *midnight*.

But, I wasn't a wild child. Other than all girl sleepovers, I didn't go anywhere after 9 PM. After a few years of that, my mom started trying to tempt me out, pushing my curfew back to 1 AM, 2 AM, and finally it changed to **no curfew**... but I still never went out at all.

Finally, my senior year, I went out to see a friend's band play. My mom drove us to the show, and then we called her a couple hours later and let her know we'd be riding to the afterparty with friends.

Then, around 12:30, I checked my phone to find around 8 missed calls from my mother, *flipping her shit* that I wasn't home and it was past my curfew (which, again, I didn't have). Since I didn't drive, I had to go around and find a friend willing to leave the party and drive me home, and that was how my one attempt at attending a real high school party went - I got to hang out with people for about 30 minutes, with no alcohol, and then I had to beg a guy I barely new for a ride back to my house because my mom had suddenly changed the rules again."
80,[deleted]
81,There's just something about Rachel McAdams that makes me drawn to her. She's gorgeous!
82,"Alternatively, though, I think that people on reddit often underestimate the powers that the President *does* have, as well as how influential that ""figurehead"" status can really be. In addition to being, you know, Commander-in-Chief of the US Military, the President also has immense influence over our political discourse, the agenda of Congress, our standing in the world, etc.

[This very recent NYTimes article](http://www.nytimes.com/2016/06/04/opinion/campaign-stops/and-if-elected-what-president-trump-could-or-couldnt-do.html) breaks down some of the stuff that Trump would probably be able to do as President (spoiler: a lot)."
83,WE'RE SORRY WE DON'T WANT HIM EITHER.
84,"I'm worried about racist/sexist violence &amp; discrimination being MORE generally accepted and normalized, along with hateful &amp; ignorant right-wing talking points. "
85,I think you have to be more thoughtful and less selfish. 
86,"Endlessly stupid.

I am a 100% straight woman. Send whomever the idiot is my way, and I'll have a few words with them about denying my existence."
87,"My husband got wasted and then told his grandmother that he was afraid he was too drunk to consummate the marriage. 

She just patted him on the head and said, ""okay dear."" "
88,Margot Robbie is so beautiful I want to cry.
89,"I have really high arches, which I think look elegant, and in general my feet are very cute."
90,"Make sure to have black role models and stories in your child's life. This includes story books, movies, cartoons, and toys. Make sure your child grows up seeing people who look like her/him succeeding.

Go out of your way to make sure your child is able to interact with other children of her/his race and other minority groups. 

Talk about racism and racial justice in an age-appropriate way. From an early age engage in critical thinking with your child to look at a variety of situations (not just ones about race) and analyze them, and understand how different kinds of privilege come into play. 

"
91,"This isn't so much a sacrifice as it was a necessary change. I was an intensely private person, didn't like telling anyone anything about myself. But you can't expect people to want any kind of relationship with you if they don't know who you are. So now I share more about myself."
92,"For being close friends with guys who ended up sexually assaulting me. As in, ""you're just as bad for being friends with them to begin with"". Pardon me for not peering into my crystal ball and foreseeing what would happen."
93,"Oh man, that's ridiculous. There is a clear difference in being respectful and not allowing someone to walk all over you just based solely on their age. Entitlement is such a cancer. 

I also probably would have spitefully only moved over a tad and made sure that he had the most awkward experience of his whole life. "
94,"I had to end a relationship that wasn't going anywhere in order to move on and find one that was. Now, it seems like a no-brainer but at the time, it really hurt."
95,"Hey, something I know a little bit about. I'm trans (male to female), and a competitive athlete.  
  
I'm rather fond of the International Olympic Committee's policy, which requires a minimum time spent on hormone therapy before competing, because respect for one's gender aside, there *is* a decided advantage to having built-in testosterone pumps running unimpeded 24/7.  
  
As far as trans women in general competing against cis women goes, I'm all in favor. Obviously I have a stake in this argument, but I can say with perfect honesty that after a few years of HRT, the strength advantages of previously having male anatomy are *gone without a trace*. The playing field is quite level. (It's quite shocking, really. I was athletic before transition, through it, and afterwards, and even years on, I still boggle at how physically weak I have become and how hard it is to maintain or build strength and endurance. Testosterone is a hell of a drug.) I have competed in a few different sports post-transition, and my scores, times, and such are commensurate with my peers."
96,"When I first met my SO, he was working on making 1,000 paper cranes. He made an extra one and gave it to me. During an office move, I lost it and was really upset about it because it was the first gift I ever got from him. When I told him, he just said, ""Don't worry about it. I can just make you 1,000 more.""

A few months later, he gave me 1,000 paper cranes for my birthday. I ugly cried so hard."
97,"Stop being so fiercely independent. I can't count the number of times I think, ""...but *why* are you doing this for me?!"".

It has very little to do with self esteem/worth for me. It really is just me being puzzled when someone else does something for me since I do *everything* myself."
98,"For not being vegan. It happened on this sub actually. And this was after I mentioned I have some digestive problems that makes it very difficult for me to eat vegetables and grains in large amounts + it's a trouble for me to gain weight. She called me spoiled, selfish, and that I can't be an animal lover."
99,What did they expect you to do? Wait until it's a serious risk for your health if you keep it?
100,"Disappointment and lies.

I was spending the day with my now-ex, and at one point he ""jokingly"" had me put out my hands and close my eyes, claiming that he had a gift for me. It was just something of his that he wanted me to hold for a minute while he was busy with something else. When he saw the look on my face, he claimed that he had some gifts for me for later that day. He did not."
101,"I think Eva Green is gorgeous - I mean, that sultry voice, those green eyes. But I'm also a big fan of Olivia Wilde."
102,"I caught a younger family friend of mine in her bedroom dry shaving her legs with a rusty single-blade razor. She was bleeding from cuts and had terrible razor burn. I stopped her and said fuck this I'm showing her how to shave properly. 

When her mom brought it up I took the heat. I said she needed to let her do it the right way or she was going to find a way to do it the wrong way. Might as well back off and not have to deal with tetanus. Thinking about it now makes my legs itch. "
103,"It's a sort of typical thing she always did - say one thing over and over until I take her up on the offer, then retract her statement and claim she never said that.

According to her, she never pushed my curfew back later than midnight. She never said it was okay for me to be queer. She never told me it was okay to change my mind about religion, or that if I wanted she'd buy me a new prom dress instead of the thrift store one, and she certainly never hit me or screamed at me or called me horrible names like all those times I remember. That's just how she operates, even now that I'm an adult."
104,"I feel like if she has not gone through HRT, then she should not be allowed to compete against cis girls. "
105,"Usually people find it odd that on the ground floor of the house you had to be completely dressed, hair done and makeup on at all times.  There was no lounging around in the living room, if you wanted to wear clothes that you wouldn't wear to leave the house you'd have to be in your bedroom.

No food or drinks were allowed upstairs at any time at all whatsoever except plastic cups with water, another odd one"
106,"Ugh. I know those pads that you're talking about, they're the *worst*. My mother isn't religious, but yeah, her view on gender roles is ridiculous as well. She still always tells me how I should only marry a rich dude and it doesn't matter if I love him or not because money will make me happy.

K lemme go see if my school will give me a refund on that engineering degree. (She tried so hard to convince me to drop BC calculus in my senior year of HS because ""you're too stupid for it anyways"" - I got the highest grade in the class out of 200+ people)."
107,"He has a disorder and can't hold his farts. Couple this with medication that induces farting and you have a very embarrassed wife. 

Also he's not good at social cues and if I quietly kick him under a table he'll shout Owwwwww, why'd you kick me???? "
108,People hate it when you interfere with their fantasy of sexually liberated sex workers who are just doing it for the love of sex.
109,"There's a book called The Opposite of Spoiled that advocates this! It sets artificial limits for children of well off families so that the kids don't turn out entiltled, spoiled brats who are used to getting M whatever they want simply because mom and dad can afford it. I plan on implementing it with my own children. I was a spoiled brat until I joined the military when I was 19 (before I graduated college) and consequently got cut off. It was a real wake up call and I'm still learning how to manage money now as an adult at 30. 

I'm jealous that you learned that responsibility so young. "
110,"Good people can be and are racist.



Good people can be and are racist!



GOOD PEOPLE CAN BE AND ARE RACIST!!!!!



Also don't compliment women on their race. Or do if you want to send the signal that they shouldn't associate with you"
111,"Toxic masculinity is real, provable, and it has a higher death count than almost anything else in the world. "
112,"My place doesn't allow dogs. I have solution to the common problem of not having enough time for your dog.

The solution: get an old dog. Like, one that will die in a couple years. This is not for most. I can accept mortality and the end of the bond I think. Old dog will just want to lie around all day and hopefully cuddle or lie next to me so I can pet 'em. Maybe a walk in the evening. I make enough that I can cover the medical expenses I think"
113,Lol at the unexpected fist in mouth 
114,I can see why he's your ex
115,"Just never wanted to.  I'm the last of 8 kids, and I have always known that kids are a LOT of work and possibly not all that much reward.  Never felt the urge, never had them, pretty darn happy about that.  Married a guy who didn't want kids either.  My family never pressured us, though his family did."
116,Fine. We had a female prime minister here and none of the reasons she wasn't great were related to or because of her gender. 
117,I started dating emotionally available people and that fixed the problem.
118,"The world has always been shitty. You realize it more as you get older, and especially as social media becomes more prevalent and Facebook politicians come out of the woodwork. BUT GUESS WHAT!!! The world is also amazing. There are people who work to make the world better every day. Focus on those people, and HELP those people. "
119,"Imagine working roller coasters and having to tell kids they were too fat to ride because the lap bar wouldn't go down :( 

I mean, I didn't tell them they were too fat, just that I couldn't get the bar to latch down and it was unsafe, I'm so sorry, I feel really awful, and, oh god, where's your mother? She's going to hit me, isn't she? "
120,I guess so. I always explain the serious health effects of not aborting dead tissue. But that has never swayed one of these people.
121,Freelance assassin.
122,Being a PI. I just want to be a moody alcoholic who follows people around all day. Or a crime scene photographer.
123,"Not a bad person, but a mean one. I kinda have RBF so I usually look unapproachable when I'm concentrating or thinking about something. My RBF would flare up when I was at work because, you know, I was busy with work and that job was physically demanding. A co-worker decided that I'm a mean person because I was not smiling all the time. 

One time I was carrying a very heavy load of wet towels to throw down the laundry shoot and he had the audacity to tell me to smile. Wtf guy!? That job was not fun so I was not going to be smiling all the time! 

When I was around other people at work and I was not busy I was actually quite friendly and bubbly. Fuck that guy. "
124,"Amen, this is what the Bernie or bust crowd needs to understand. I am a Bernie supporter and voted for him in the primary, but I will absolutely be supporting Clinton in the general election because there is no progressive revolution without a liberal Supreme Court. This election is not about moving forward, it's about not taking a huge step back."
125,"I live about 10 minutes away from Pulse, one of my regular (comes in every day) customers WORKS at Pulse.  I'm just at a loss for words right now.  The only thing that has made me feel good was waiting in line to give blood.  Target employees were going up and down the line, handing out bottles of water, sunscreen, umbrellas and fruits to the HUNDREDS of people waiting in line.  California Pizza Kitchen was handing out pizzas, Walgreens gave out iron supplements, it was just an amazing out showing of support and love.



I'm still terrified for my regular guy.  I really hope he's okay."
126,I know that factory farms are the fucking terrible but I can't stop eating meat
127,"My husband and I adopted a sibling group from foster care ten years ago. The oldest at the time was 5 1/2. The others were 2, 3, and 4. I can tell you that the first year is very rough. When you get them the love isn't instant, and at times you will not even like them very much (and they won't like you, either). I used to keep a chair in my closet so I could have a private place to cry, which I did every day. Things slowly got better after the first year, and we could not love them any more if they were our bio kids. Now they are all teenagers, and at times I wonder what the fuck I was thinking, just like my friends with bio teenage kids.

My advice to you if you decide to do it: Find a good counselor with experience in older adoption and bonding issues. They will be an invaluable resource.
    
 Know that it isn't going to go like you think it is; your child will be entirely different than the kid you read about in the case file once he or she settles in. My 'shy' child became my most outgoing, and my 'aggressive' child my most loving and gentle. 
     
Know that at times you will feel lonely and isolated from parents with bio kids, and at times your child's behavior will be confusing and troubling. Find other parents in similar circumstances for support. As much as they try, most people with bio kids will be horrified when you tell them about your child's circumstances, and will think of your child as damaged goods.  And that leads me to my last piece of advice: Do not overshare your child's history. People will judge her for her past. 

Edit: All in all, I would definitely do it again, and the reward of seeing neglected and terrified children blossom into happy and confident kids is sooo worth it. "
128,"Yes, $60 bought a nice cage, and cleaning supplies, food &amp; bedding. I think the hamster itself cost $5."
129,"People can be so aggressively against abortion that they refuse to accept that it is a medical procedure that benefits women in situations like this.. 

I'm sorry that this happened to you. *internet hugs from a friend*"
130,"Most crime in general is committed by men. So nothing new really. The only king of murder women commit almost as often as men is killing their families. 

I studied criminology in grad school so I can be a bit wonky on this, but it's really easier to look at it from the perspective of why don't women commit crime as much. Those reasons range from women not having the time or means to commit crime because they were tied to their homes and families (historically speaking), because women are socialized to deal with problems differently than men are (it's ok for men to be violent, etc), social pressures on men and women have historically been different with men being the ""protectors"" and ""bread winners"" so when 'strain' (social or economical) is introduced it's men that resort to crime in response, etc, etc. As women become equal to men and have access to the same opportunity and freedoms who see them increasingly committing the same crimes men do. Though I think it would be a long, long while before they reach the same levels. "
131,"We were on our way to go for a hike and got lost on the drive there (1 hour became 3), his car was on E, and our phones died. In the middle of nowhere. We got to where we thought we were supposed to be, couldn't find the trail after walking about an hour, got back to the car and....he locked his keys in the car. Reminder, our phones are dead. He had to throw a huge rock at his window to break it and get to the keys.

It's dark out at this point, we go to drive off, terrified that his car was going to run out of gas, and he ran over his backpack that he left outside. At this point I just couldn't stop laughing at our lives (while he was quite obviously pissed off), so we just parked the car and made out for a little bit even though we were certain we would die at this point. We didn't have GPS or anything so we had to pull over to someone's random house in the middle of nowhere (eek) and ask how to get to the nearest gas station. I thought the kid would never talk to me again after this date and he later admitted the same thing to me. The way he handled everything that day made me feel so protected and safe even though we clearly weren't...we became official a few weeks later. We've been together a year and we both love talking about this story every once in a while now hahaha"
132,"I would appreciate it greatly, but I'd also be curious as to why. That particular phrase almost reminds me of a suicide note, and I'd be worried."
133,"Gotta say Mila Kunis. She memorizes me.

Edit: Yep, definitely meant ""mesmerizes""!"
134,[Lupita Nyong'o](https://www.google.com/search?espv=2&amp;biw=1070&amp;bih=684&amp;tbm=isch&amp;sa=1&amp;q=lupita+nyong%27o&amp;oq=lupita+nyong%27o&amp;gs_l=img.3...22967.25709.0.26105.0.0.0.0.0.0.0.0..0.0....0...1c.1.64.img..0.0.0.sbGnOFBch6Y) is one of the most beautiful women I've ever seen. Also [Kikuchi Rinko](https://www.google.com/search?q=kikuchi+rinko&amp;espv=2&amp;source=lnms&amp;tbm=isch&amp;sa=X&amp;ved=0ahUKEwjtrofT0qzNAhUS-2MKHQ5fDAQQ_AUICCgB&amp;biw=1070&amp;bih=684). 
135,"I am 29 and these are my reasons too - let me tell you, once you get to the age people think you should want them, they get really aggressive if you say you don't. Really aggressive. Yuck."
136,"Oh my god I adore this question!

I don't have a dog right now because I know that no matter how much I would love to share my home and family with a pooch, I cannot take on that responsibility at the moment. We foster, which means sometimes we get to share our home with puppies and pooches for a limited time, but we won't adopt a forever-pup until we're more stable. At the moment we have three kittens who rule the roost."
137,"If the shooting-up of an elementary school in Newtown taught us anything, it's that there is no mass shooting sufficiently depraved to cause America to have a sane and serious look at gun violence.  
  
We have capitulated to the gun nuts, and these routine massacres are the price we pay."
138,"You know what I face this every day I am a young adult with an ""invisable disability"" so no I will not be giving you my seat and no I am not sat in the ""accsessability"" seating out of spite. 

Toomany people assume young = healthy and old = frail."
139,"I think people are unable or unwilling to understand that just because he was being watched for terrorism and that it's a terrorist attack doesn't mean that it can't also be a huge blow to a particular community. 


Terrorist attacks can also be specific to certain groups. I don't know why people feel so inclined to cherry pick. "
140,"I have no fucking clue. Sometimes I look him up.. He finally did end up going to UC Berkeley and getting his physics degree, like he wanted to do to impress me (my boyfriend at the time was going to an Ivy League and this guy wanted to prove he was of the same ""caliber""). He now spends his days on FB posting science articles, links on the news and different social causes (strangely silent during the Stanford rape verdict of this week though.....), and stupid spiritual quotes about being a good person. 

 Still seethe with rage when I think about him but at least I'm living the life he's always wanted. They say the best revenge is living well so I must be doing something right. Thanks for listening. "
