,text
141,I am definitely against it because it is unfair to cis women. 
142,"My younger sibling and I weren't allowed to eat bananas because, according to my mom, they're ""the candy bar of fruit"". Aaaaand now both of us are getting over having eating disorders. 

I also wasn't allowed to have any money that she didn't know about and until I moved out of her house she would keep track of my bank account. I had to ask her if I was allowed to spend any of the money I earned, even in high school. 

While I was planning my wedding (which I didn't want to have but ended up doing because her and my in-laws twisted our arms into having one) she tried to make a rule that I couldn't have a hand-fasting ceremony because our family is Catholic. I told her if it bugs her that much then she can just not come. She was not happy, but we ended up having the ceremony we wanted.

There were others, she's pretty abusive so rules were kind of her thing since she always had to have the power/control over us. "
143,"* No secular music. Only christian worship music.
* No movies or TV shows that contained magic or super powers. (RIP Power Rangers)
* No Batman because he represents satan. 
* No Pokemon because they are pocket demons.
* No Smurfs because they are devils.
* Only E rated games.

I'm sure there were others but these are the ones that come to mind.

Edit: OH! Also no junk food breakfast cereals like chocolate or marshmallows even though poptarts were ok and I showed her that the cereal she usually got me was way worse in sugar than the chocolate cereals I so desperately craved... but alas. "
144,"Q: What does your kid do that makes you laugh?

A: I don't have a kid.

Instant downvote so they will go down on the page and we can actually read real answers. "
145,"I have fairly long thumbs. My left thumb is a particularly nice shape. I like the way it looks on my steering wheel... but, it can be distracting! "
146,"Ok so I hope I can do this story justice.

TL;DR: Bride wanted a Tupac style hologram of her father at the wedding.


I work in event management but more on the concert side of things, although we do all kind of events like debutante balls and graduations and corporate functions too. We work closely with a couple of wedding planners who sometimes sub-hire our equipment etc. 

Anyways, one day I am sent to a client meeting with the wedding planner to help plan things on our end. It's usually a speaker system, some lights for the dance floor sometimes helping with a band or a string quartet etc.

So this bride says to me, with sadness in her voice, that her father has recently passed away and that it was very upsetting he wouldn't be able to walk her down the aisle or do the father/ daughter dance with her. I can sympathize, and it's unfortunately not unusual to hear these kind of stories. She's talking about how her mum could walk her down the isle, or an uncle, but it wouldn't be the same. I'm sort of nodding along with her, not sure where she's heading.

Then she looks me right in the eyes and says 'So what I'd really like to do is get a hologram, you know, like Tupac.'
My first thought was 'Ok, she's about to follow this up with the real question, smile politely.'
So I did.
And she was just looking back and forth from me, to the wedding planner. Raising her eyebrows and enthusiastically nodding.

The wedding planner just kind of looked at me and said 'um...' and I could feel her searching for the words. I helped her out.

'Well, holograms are VERY complicated technology. It's not really something that's possible for this kind of application. If you had a home video you wanted us to project on a wall at the reception or something...'

She interrupts me.
'No like, I want him to walk me down the aisle. I want to do the daddy daughter dance with him.' She keeps looking me right in the eyes. She's not getting it. I'm trying to say it politely but I don't think she actually understands how holograms work.

I spend probably half an hour explaining about how complicated it is to create an image to project as a hologram, and how much expensive equipment is involved, and how long it would take to achieve something like that. She pulls her phone out on more than one occasion to show me the hologram videos of MJ and Tupac as if I'm the one who doesn't understand. I keep repeating, trying to be polite, that I know what she's referring to but that's not achievable in a wedding environment and the cost (even if it were possible) would be astronomical etc. after a while the wedding planner sees I'm getting flustered and tries to back me up but it doesn't help. This woman is also starting to get upset because obviously it's something she really wanted and it never crossed her mind how ridiculous it was. I offered all the alternatives I could think of but nothing was good enough. In the end I just sighed and said 'Well I'm really sorry but this just isn't something that can be done. I don't know how else to communicate that.' And I sort of lean back from the table hoping she understands my body language.

She's kind of looking at the pile of paperwork she has in front of her and she says, completely seriously, 'well I have the name of the company that did Tupac, maybe you can call them?'

No.
No lady I can't.
You are insane.
You're the dumbest person I've ever had to deal with in my 8 years at this job.
Your grief has rendered you mentally incompetent.

I had no choice. I just said 'I'm sorry but we can't do it. It's impossible.'

She finally got the message (or at least decided to move on) and turned to the wedding planner and started chit-chatting about centerpieces as if we hadn't just had the worlds most idiotic conversation -and I spent the remainder of the meeting essentially staring out of the window."
147,"It feels awful. It can feel physically painful, like a huge weight on your chest. It can affect your appetite and your ability to sleep, as well as your mood. 
In a lot of ways it is similar to a bereavement - when you get your heart broken by someone it can feel like you're in mourning for the relationship, and your hopes for what it could have been. "
148,Romance novelist. I write corporate swill all day. I'd just like to try my hand at a couple chapters of bodice ripping. 
149,bai
150,"&gt; Go shopping only when you need something and have a list of what you need

&gt;Take inventory of what you have at home before you go shopping.

This has been so helpful for me. I keep a running list of (1) things that need to be replaced ad (2) things that keep coming up/I wish I had.

When I impulse shop, I buy 5-inch heels in fun colors, and then I get home and remember that what I actually needed was a lightweight black cardigan.  

It's also helped me overcome the ""oh look! Sale!"" problem."
151,I love how you are essentially a translator.
152,"On my 15th birthday, my grandma was terminally ill and had been on medications which made her forget everything. I went to the hospital to see her and she not only remembered my name, but that it was my birthday as well. I've had seven birthdays since, and nothing will compare to that."
153,"The worst swear word you could say (I mean, couldn't say) was ""suck"". As in ""this place sucks!"". Any other 4 letter word would get you in less trouble. My mom's reason was ""sucks"" means ""sucks penis"", lol."
154,"I think it is terrible. Killing people because you don't like their lifestyle is the most moronic thing. 

I'm Muslim and it kills me to see that the shooter's religion is on the forefront, rather than he targeted a gay nightclub. 

Also, the backlash that Muslims will get terrifies me. After 9/11, someone tried to burn down my father's place of business."
155,"We will lose (even more) respect globally.

Women and other minorities will take some giant steps back in terms of equality. 

Republicans will realize pretty quickly what they've done. "
156,"I hate drama that involves me.

I love watching drama and sipping my tea from a distance."
157,Lottery Winner
158,"I think any civilized society based on true equality will have leaders of all shapes and colors, and to not have that demonstrates that equality hasn't happened yet. 

That said, I'm not going to vote for a woman just because she's a woman. Michelle Bachman's a woman. I would not vote for her. "
159,"&gt; Whenever ""The Circle of Life"" plays at the football game and people lift up their babies

What? That's a thing?"
160,"When downvote fairies enter really innocent question threads.  I remember there was a question like ""What's your favorite sandwich"".  I said what my favorite sandwich was and at the end of the day, my answer had like -4 votes.

I GUESS YOU HATERS DON'T LIKE THAT MY FAVORITE SANDWICH IS PEANUT BUTTER AND JELLY. "
161,"Give in to sexual acts I don't enjoy or want to participate in. 


Dudes, if you are pissed because your GF did anal with her ex but won't with you - it's likely because she feels safe saying no to you, and because you *aren't* a douchebag. Don't be a douchebag about it. "
162,More threads like this! I love reading women loving themselves. You're all beautiful â™¡
163,My family's had dogs my entire life and even when I moved out on my own for a bit I took a dog with me. Our last dog died recently and we just never talked about getting a new one. I've come to realize how much easier life is now.
164,"""*No boyfriend til you're married*"""
165,What is wrong with these people that they no only act like that but put the blame on the other person. Really hope you are doing better now.
166,"I moved out when I got married (I was in the sort of culture where you stay with family until you get married). I married young and it was an unhealthy relationship that did not end well. Out of the frying pan, into the flame. "
167,"He dances stupidly in public. How much we both hate dancing was a topic of conversation when we first started dating so the joke about how horrible we are at it has continued. At first, I just watched and laughed but while we were on vacation, we were walking down a street with a burning out light and treated it as a strobe light and started having a dance competition. Now whenever he starts in public, I treat it as a challenge. He always goes harder than me though. "
168,"I was addicted to The Sims in 5th grade and my mom begrudgingly let me spend all my free time on the computer but she would NOT buy me the Hot Date expansion pack, because well...it was called Hot Date. Finally I borrowed it from a friend and my dad helped me install it haha"
169,"My grandmother was a lefty as well. Her mother used to tie down her left arm for the entire day to force her to learn to do everything with her right hand because she as so ashamed of having a left-handed child. She even told her that ""being left-handed is extremely rude to everyone around you"". 

Just... what. "
170,"It's way too close to home from me, I have friends in Orlando and the shooter is from my hometown. Like, his house is 9 minutes away from me. I just can't believe any of this, what a terrible thing to wake up to.

Idk what's going to happen from here. Considering the shooter was Muslim I have a feeling Donald Trump just won Florida. I would hope it would help the argument for stronger gun laws, but if the people who need to care didn't change anything when a bunch of first graders were shot I doubt they're gonna care about gay people. 

Also, it's very frustrating to read Facebook comments on my local news page saying shit like ""thanks Obama for securing our borders!"" THE GUY WAS BORN HERE. "
171,"It can be:

* A self fulfilling prophesy.
* A way to abdicate personal responsibility.
* Panic in the face of other people hitting milestones, or culturally dictated notions of life/age/relationships/gender.
* Self-depreciating humour (Like, *hyyyypothetically* you bring a cardboard cutout to your sister's wedding. Hypothetically.)
* The expression of genuine and not insignificant struggles for which platitudes are frustrating and unhelpful."
172,Kate Beckinsale. Truly an English rose.
173,"In general, it decreases to almost zero unless they don't realize that the guy and I are together. Yes, it's very frustrating that *my displeasure* with being catcalled is clearly less important to them than *a man's potential displeasure* at having his companion catcalled. "
174,"It's not a secret, but Raptor (Bird of Prey) trainer.

Alas I'm a lawyer.  But I get to volunteer training raptors.  :)"
175,My thighs are incredibly thick but i like em that way :) 
176,It's beyond embarrassing for those of us who don't though :(
177,"Depression era thinking dies hard. She didn't want to waste a perfectly good pair of undies. 

"
178,Send him to prison for the actual appropriate sentence length for his crimes. Require him to attend daily counseling sessions to understand the depth of what he has done. Require him to do service work in the survivor network for sexual abuse. Require him to listen to/watch victim statements from people who have been raped about how it affects their lives. 
179,"Yes. I would feel for them, be concerned for their mental and physical well-being, but could not stay in a relationship with them, as I'm heterosexual. "
180,my parents had the same rule. they think they're for married women who don't have to worry about their virginity anymore and had some weird phobia about us ''getting ideas'' sticking things up there
181,"When we'd hang out and they'd spend the whole time talking about themselves &amp; not a take a minute to even say, ""So what's up with you?"" Seriously if you only text me to talk about yourself, best believe you're getting a one worded response."
182,"It isn't so much that I decided not to, and more that I've literally never wanted to. I have no desire for it. I could come up with a looooooong list of reasons that I've retroactively realized are all things I would hate/fear about pregnancy and raising children, but all of those came after being like... 3 and knowing that wasn't something I wanted. "
183,"OOOH! I worked in the wedding industry at a tuxedo shop for 10+ years. I've seen some shit! Some notable weddings:

* Groom was a recovering alcoholic; bride insisted on an open bar.

* As they were booking tuxedos, there was a very obvious and awkward discussion of children - he mentioned that [boss's name] would be cute for a son, she was like ""children?! I don't want that!"" Unbelievable.

* A couple that seethed resentment, anger, and rudeness. Remember the couple that shared a birthing suite with Ross and Rachel, and had some choice names for each other?? Yeah. That.

* The groom that kept saying in a non-joking way that she was ""making him get married."" She thought it was a cute joke, it did not seem that way to me or my coworkers

* The bridesmaid that continually was hitting on me. I was flattered, but, alas, am not gay

* The couple that wanted a bucks-deluxe wedding for under $5K (in ~2000). They did NOT like when I pointed out the constraints on that budget for their expectations

* The bride that was ~5 months along and didn't fit into her chosen gown, but wouldn't acknowledge the bump or concede on changing the gown, insisting that we alter it more. That was a tough one to navigate.

* The couple that didn't want food at their wedding, which was an all-day event. Just wanted cake and punch from 2PM-10PM. Eek.


That was an enlightening job... will add more if I think of them and happy to answer any questions"
184,"After seeing Hannibal and The Fall (highly recommend both, btw), I'm definitely in love with Gillian Anderson.  Her voice, her perfect face, her hair, dat errythang."
185,"Not the person you responded to, but the OP says that having gone through hormone treatment is not a requirement so while they may both be women in terms of gender identification there are biological differences. "
186,"Rosario Dawson is my dream wife. Artist, activist, speaks fluent Klingon. ðŸ˜

Sophie Turner looks like a literal goddess to me. She's so beautiful that she goes beyond attraction into pure aesthetic appeal. She's like a living sculpture.

Eva Green is mesmerizing in every role I've seen her in. If anyone here has read the Kushiel's Legacy books, I've always thought she would be the perfect Melisande."
187,"Thanks, that's really sweet... Are you ok?"
188,"She's running against other girls, none of which have gone through male puberty. Unfair advantage."
189,"Sooo many rules. Southern Baptist family. My parents were terrible. 

Clothes rules:

- No ""short shorts"", only Bermuda shorts 
- No necklines that are lower than 3"" from the top of the collarbone 
- All skirts must have Bermuda shorts under them
- No sleeves shorter than the elbow 
- Ankles must always be covered (ie, shorts/skirts required tall socks) 
- Bathing suits must consist of a tankini top with knee-length shorts 
- Full coverage white briefs and white full coverage bras only 

Other rules: 

- No tampons. 
- No shaving above the knee. 
- If you leave the house (even to the backyard), you must be wearing makeup and have styled hair 
- But no eyeliner or dark lipstick ever allowed 
- You are not allowed to be barefoot unless you are in the shower 
- If a man asks you for water, you must retrieve water for him 
- No soda allowed
- No PG13 or R movies ever, no television prod 
- No cursing ever (not even crap or sucks or stupid)
- Women must never ask men to cook, but they must praise his cooking if he offers it 
- No books about science or American history "
190,"If you're dating a guy, you're straight. If you're dating a woman, you're gay. If you dated a man but then later dated a woman, you were gay the whole time and none of your relationships previous to the one that apparently made you gay meant anything. If you then date a guy again, you were straight the whole time but had a phase. 

Basically, bisexuality doesn't exist except for sometimes villains. Even then it's used for manipulation. "
191,"This is ME

So many clothes, hate them all, get stressed out thinking about shopping."
192,"STOP ""strong black women""-ing black women.

Black females are stereotyped as difficult, angry, combative, masculine. The ""positive"" side to that stereotype is that black females are independent, perpetually confident and unshakeable to the point we ""can't"" be vulnerable like other women. Our worries are not seen as equally understandable, deserving of as much TLC, or offers for a helping hand, because we ""should"" be able to handle it on our own.

Took me years to realize how common this is."
193,Kate Winslet has always had my heart.
194,"Thanks for continually repeating what we all know, but as is discussed further downthread, women who haven't transitioned do tend to get a physical advantage, and that's what some people are opposed to."
195,Us bi women really like women until That Special Guy comes into our lives and reminds us that what we really wanted all a long was a man.
196,"He tips really poorly. I know everyone's got an opinion about what a ""good"" tip is, but his is pretty objectively bad and I get nervous about being associated with that. Usually I offer to pay for dinner mostly so I can know the server's not going to be insulted."
197,Sometimes when we are driving together locally he honks the car horn and starts waving to people as if he knows them. 
198,My emotionally abusive ex called me a bad person for not being emotionally crippled when I had an abortion. I was already emotionally crippled from years of being with him; the abortion was the best thing I have ever done for my own safety and I have *never* regretted it for a second. 
199,I'm black. I'll let you think. 
200,Presence over presents.
201,It is known
202,"Non-American here.

**1.  Worried that all the good work Obama has done for climate change will be chucked in the bin.**  
I'm a farmer and Agriculture has been proven to be one of the leading causes of pollution in many countries. Obama got many countries to sign on at his climate change summit which was definitely needed.   
If America re-negs on this - if they continue to let Agriculture proceed unchecked by environmental policies, the rest of the world will suffer as a result.  
To decrease Agricultural pollution, some serious R&amp;D is needed, which equals some serious funding. Currently we are all on an even(ish) economic footing as we have all agreed to work towards decreasing Agricultural emissions. If America re-negs they will get an economic advantage, they will win global trade price competitions as there agricultural industry is not funding environmental R&amp;D so they can supply food cheaper. The whole thing will fall apart, just like the Kyoto protocol did when America dropped out.

**2. Worried about your women.**  
Many gender inequality things seem to be going on in America at the moment. 
 
* The abortion debate seems to surreal to me, the closing down of PPs insane. Women are losing their rights, not gaining them. Doctors are the experts, not politicians. If a doctor deems a procedure necessary, how can a politician come along and rule against a doctor? You are going backwards, this was all debated and settled many decades ago. Donald Trump can only make this worse. Even if he is only ""playing a part"" to get votes, what's he going to tell all the crazies that voted for him, ""Nah, I'm not going there."" - like hell!  

* The ridiculous punishments for rape, and the people who stand up for the rapists. An ongoing issue that I can't see Trump helping with his misogynistic views.

**3. Worried about your people's health.**  
For a long time America has been lacking a national health service, something that nearly all other western countries have managed to develop. Americans have died because they can't afford health care. The amount of corruption within the US health service seems absurd, ie the markups on products and services etc. Obama finally started something, that could eventually develop into something good, and Trump wants to take it away.

Those are my three main concerns anyway. There are many, many more."
203,"I live in SF and I'm definitely going to pride. I'm hoping this is the best one we've ever had. 


Fear be damned. "
204,"When I was about 10, I heard the song Abortion is murder by P.O.D. at my friend's house. I didn't really know what abortion was, but I assumed it was true since they sang it. So when I came home that day, I told my mum, all matter-of-factly that abortion was kind of like murder, hoping she'd be impressed by my new knowledge.

She said that some people think so, and maybe it is, but sometimes it is necessary. She then told me she had an abortion when she was 17, and although it was difficult, it was the right thing to do for her. She also told me that when I got older it might make more sense. I was so incredibly embarrassed, and after that I read up on it and that's pretty much the day I became pro-choice.

I still cringe when I think about it though. "
205,"Not really. Here ""white"" just means ""inexperienced and lacking proper skill"". I'm sure a black mother raising a white child would also want that child to look like she had a mom who was familiar with white hair textures."
206,"I have a brown spot (don't think it's a mole since it isn't raised) inside my outer labia at the top left, it's a beauty mark!!!!!"
207,"I definitely went through most of my twenties (I'm 28) thinking I wouldn't ever find love because my standards were too high/I was unattractive/I'm shy/etc. However, I never let myself be one of those depressed ""foreveralone"" kind of people. Whatever romantic void I felt I had in my life, I filled it with other things - ballroom dancing, volunteering, doing colour runs and tough mudders, learning to fly planes, etc.

A year ago I met and fell in love with a guy who blew my standards out of the water, made me feel gorgeous, and has really helped me come out of my shell and be more comfortable being social. But I think a big part of why my dream-guy was even interested in me was that I had focused on enjoying my life rather than worrying about finding love.

I definitely know how you feel, but just keep doing your thing and don't worry too much about finding The One. If you're busy enough enjoying life, you'll probably just trip over him/her someday when he/she meanders into your life."
208,Ugh. She was gaslighting you. Not cool. Compounding abuse with more abuse. 
209,"I don't kill spiders. I love them, and where I live, the only dangerous to humans spider is the Black Widow. I refused to kill a wolf spider in my house and my friend that was visiting threatened to call CPS because i was forcing my daughter to live with venomous animals. I asked her to leave, and me and the spider hung out. It was a much more pleasant house guest."
210,I'm imagining you as a (hopefully more successful) female Jonny Bravo.
211,"I don't know...I'm a terrible flirt, and even worse at identifying girls into girls.  So like...i need to either date online or be set up.

Otherwise, it's like ""hey you know that girl that was licking your neck?  She was gay you know""

""No she was just being friendly"""
212,"Bye, Bye, Bye"
213,"""Thumb grips...why in the world woul..oh"" O.O"
214,Everyone else has already mentioned this but just make sure to reinforce the idea that she's just as beautiful as white women. Don't ever let her think that bleaching her skin will fix all of her problems. 
