,text
309,"I used to teach and train at an MMA gym.  I was one of 2 female trainers we had on staff there which meant I had to occasionally be put into the ring as a sparring partner or punching dummy or whatnot.  Nothing ever competition wise, but just for practice.  Well, I could and would occasionally get a few of the guys down on the mat.  Do I think that was because I was stronger or faster than them?  Nope, it was because I have been doing this for almost 20 fucking years and have seen more than them.  

And yet, I still would not want to go up against the majority of men in a straight fight.  For me, it takes skill and hyper awareness to win.  It takes them getting one lucky punch.  "
310,"Panda caretaker. Apparently this is a thing in China, and your job is to cuddle pandas so their emotional needs are met.  
  
Seriously, anything to do with animals. I looked it up but my qualifications are not even remotely related to the field generally listed as an eligibility requirement by places like zoos and national parks.  
  
I hope one day I can afford to run an animal shelter. "
311,"5""11 and it pains me a lot. I don't believe all the bs that people want to be tall or that guys are into tall girls, and I feel like a man standing next to half of my friends. Talking with a girl that's particularly small just makes me feel like a mountain. As a tall girl you are ""big"" in at least that aspect so I find it hard to feel delicate an feminine sometimes like I want to :("
312,"Things from around the apartment (""as a joke""), a hastily made card, and an awkward speech.  This was after a horrible Xmas (he got me a discount bin One Direction throw pillow) and several months in couples therapy where I made it very clear that thoughtful gift giving was important to me."
313,"BAHA. I'm sorry but honestly.

My mother was similar except she believes only people who have had sex are able to use tampons. If you are a virgin its impossible for it to go in. When I was 16 she asked me about her missing tampons, and if my brothers girlfriend had been taking some. I had heard her musings on what being able to use a tampon meant, but didn't think she was actually dumb enough to believe that. So I shrugged and said,


""I am.""


THE LOOK ON HER FACE. Her eyes went wide and she raised her index finger to the air and said:


""Now I know about you _bananas, now I KNOW.""


I was like, what? o.O Had to spend time convincing her that was the most ridiculous thing ever, and give her some birds and the bees talk haha."
314,"So many decisions are made at the state level, though. A Trump presidency indicates Trump support. Trump supporters may try harder to push legislation through in their own state, and Trump won't do shit about it. For instance, Obama is threatening to withhold federal education funding for states that do not accept the new bathroom policies. The reverse could happen under Trump.

The federal aspect is not my only concern. "
315,"Heartfelt thank-you's are great. We spend so much time with your child and really care for their well-being, so some kind words mean much more than a bag full of dollar-store junk or a ""#1 teacher"" mug. If you're looking for something other than that, I think gift cards are fantastic; coffee, manicure, restaurant, etc. This year I got a really cute ""cheesy"" poem about being a ""grate"" teacher. It came with some gourmet cheese, a grater, jam, and nice crackers. I appreciated it."
316,"Don't tell me I look ""exotic."""
317,"I think it's an idea perpetuated by idiots that think just because (most) women don't recoil in revulsion at the sight of a naked woman's body or scream ""no homo"" when they actually do something that could possibly be perceived as ""gay"", it means they must not be straight."
318,"* Don't like the smell
* Prefer cats
* Too high maintenance for my lifestyle
* Much harder to find rental properties with one

Hasn't had any impact. 
"
319,"It's because they're afraid of getting beat.

That's why dudes saying that street harassment is ""just a compliment!"" is silly and incorrect. If it were just a compliment they would do it in front of other men."
320,"""....I agree that young middle-class white guys are the most oppressed group in society."""
321,"For being friends with their husband. 

Yes there's backstory. I've been friends with this guy since we were 4 years old! Our families are very close, and often vacation together, our sisters are best friends, etc. Basically I don't have many life memories that don't include him. He's basically family, he's a brother to me. 

Well, he met a girl fell in love, and married her. I was super excited for him! He asked me to be one of his ""groomsmen"" (groomspeople?). His fiancÃ© at the time didn't talk much to me, but she seemed mostly neutral to my presence. Not long after the wedding though, the claws came out. And one day she confronted me, told me how inappropriate it was for a single girl like me to be friends with a married man, and how I was obviously trying to steal her husband from her, and how only a low-life scumbag would act like that, etc. Yeah...she's not my favorite person. And my friend is playing Switzerland in this, saying he doesn't want to get involved. So I just avoid her. But our friendship has definitely suffered for it. "
322,"Trimming the claws of my indoor cats. Not declawing, just trimming once a month or so.

Apparently ""normal people"" don't do that, and it's animal abuse."
323,"Yeah, actually, I really like the [yagasuri](http://bcome.jp/wp-content/uploads/2014/05/BCOME_PATTERN_yagasuri-02.jpg) pattern - it was popular in 1920s Japan, and I've always liked the aesthetic of that era."
324,From a cold outsider's perspective it would make the next 5 years of Daily Show &amp; Last Week Tonight *really good*.
325,"[""No way to prevent this,"" says only nation where this regularly happens.](http://www.theonion.com/article/no-way-to-prevent-this-says-only-nation-where-this-36131)"
326,"Not a birthday gift, but a Christmas gift. My grandmother re gifted me a necklace I had given her the year prior. A necklace I saved up for and put a lot of thought into getting for her. "
327,"No thanks, though you may want to take a moment to educate yourself about science."
328,"My mother has never given me a birthday present. That, it itself, doesn't bother me. What bothers me is that she always makes a big deal about telling me (and others) what she's supposedly getting me. It's also frustrating when someone asks how much I ended up liking whatever she said she was getting me."
329,"For some reason Kristen Stewart is just magnetic to me.

But imma give it to Sophie Turner for most beautiful. She looks like a Renaissance painting."
330,"I was running about 15 minutes late meeting this guy at some swanky LA bar. It was packed, but I found one stool at the counter and made my way there to order a drink. I texted my date that I was there, but didn't hear back right away. Fine, I'll get a drink and relax for a minute. So while I waited for my drink this couple next to me starts making out aggressively. I mean like horizontal on the bar stool. So horizontal that the woman ended up with her head on my shoulder mid slobber fest. People were starting to stare and I was getting super uncomfortable, so I thought I'd try to reach out again, I text my date asking him to please rescue me from the obnoxious couple making out next to me, but no text back. I figured I would give it another few minutes before I decided to bail. A couple minutes later the making out stops and I get a text back saying ""oh shit! That was actually me, but if you come over to the restroom I'll explain"". I flagged down the bartender as quickly as I could to sign out my tab, but right as I was walking away he came up and tried to explain that his behavior was okay because they were old friends. He even texted me later saying ""it was nice to meet you ðŸ˜‰"". I haven't been on Tinder since."
331,"You've yet to hear anything about Trump supporters attacking people? Please google the phrase ""Trump supporters attacking people"""
332,"I don't want to potentially destroy my sex life, my career, my body, my marriage, my savings and be stuck with the tedium of the 0 to 5 years of raising a child. Pregnancy, birth and breast feeding disgusts me also. 

I've got step kids (raised from 7 to 16yo) so feel I've gotten the benefits of kids without the costs. I am 31 so my friends have babies now and it's only made me more sure of my decision. It is so much more work than you imagine. "
333,"Idk how unique it is but my one cat buries his face in my hand or hair or neck when he's scared. It's adorable. Also he's scared a lot, haha. He likes to attack ants but freaks out if they crawl on him.

Oh wait! The actual unique thing I just thought of. We like to hide around corners and scare eachother, haha. Like I'll wait for him around a corner and jump out and say boo and he'll meow at me or make that chirping noise and then like five minutes or less later he'll come jumping around a corner meowing at me. It's really funny. We play hide and go seek a lot. Also he plays fetch but the only toy he'll play fetch with is one of those mice on a stick things so he'll come running up with a mouse in his mouth that's attached to a stick by a string dragging along behind him."
334,"As an outsider, living in a country that said NEVER AGAIN after a man walked into a school and murdered a bunch of kids, my thoughts are: America, as a collective, needs to pull its head out of its ass and stop the rhetoric that guns aren't the problem.  They are.  

That's not to say that there aren't other problems.  There is a whole litany of of social problems that need to be addressed but guns are the tool through which a lot of these issues get expressed.  Take that tool away and lives will be saved.  It's not a maybe, it's a fact.

IT IS TIME TO MAKE IT HARDER TO KILL PEOPLE.

"
335,"I moved across the country with my parents when I was 16, and absolutely hated life. I saved every penny I got and went back home to visit as often as possible. 

 Right before I turned 18, my dad inherited some money when his parents sold their house. So for my birthday, my parents flew my 3 best friends from home to the East coast and we all went to see my favorite band together. They also made us little gift bags with disposable cameras, metro cards, and Starbucks gift cards. It was AMAZING. "
336,[deleted]
337,"I always thought that ""bemused"" meant amused and slightly baffled, but it just means confused. I'm going to blame fan fiction for that one!"
338,Snorting cocaine - will never do again because I loved it soooooo much. That's a quick downward spiral that I need to avoid.
339,"Yes. Do this. Adopt a senior dog. They are THE BEST.

We just adopted an 11 year old dog from the shelter where she was dumped. She's heartworm positive and overweight, so being blunt, I don't expect that she has more than 2 maybe 3 years left in her. But she is so wonderful I can't even put it into words. She sleeps 20 hours a day, and is content to do so. We both work and are out of the house for 10+ hours, so a neighborhood girl comes over to take her for a little walk around lunchtime. Other than that, we take a mile walk in the morning and another in the evening....after that, it's time for another nap.  All she wants is food, snuggles, and a soft place to nap. "
340,"I had to come out as gay and get temporarily disowned by my dad. But it was so worth it. Dating in the closet, I just never felt like I could be myself fully."
341,Same. Just feels like painful back-and-forth pooping.
342,"I'm still clingy. I try not to be clingy to the point where I blow up his phone if I feel like he doesn't respond quickly enough; but I get all stressy about it and I get all sad when I feel he's being distant, I try to combat this by trying to not show any outward signs of being clingy and needy, which is fucking difficult. Honestly though, I think this also ties in with my anxiety; so I'm trying to work on my anxiety, so hopefully this will eventually ease up."
343,"What some men really think of women or how it's the norm for them to cheat or how they treat women based on body type and how certain women should have no standards at all or deserve to be respected. 

I knew some men were shitty but didn't realize just how many. "
344,When I first read that people were carrying the wounded out of the club I was amazed. Most people tend to help themselves first in my experience.
345,"""No, I'm not secretly in love with you. I don't even fucking like you. I tolerate you and I'm not going to do that anymore, either.""

The context was a guy in my friend group had been hounding me for two years &amp; asked me out for at least the 10th time, and then argued with my ""no"" saying I was just rejecting him because I was afraid of my feelings. Fuuuuck him. Looking back I wasn't even brutal and heartbreaking enough. Up until I got serious with the guy I was going to marry (another few years later) he would tell me I ""ruined"" dating for him and that now he's only attracted to women who are mean to him. ðŸ˜’ðŸ™„"
346,"No shaving.  

No make up (including nail polish).  

No tampons, because I would lose my virginity (lol).  

No jewelry.  

No tank tops, no bikinis.  

No going out, ever.  I came home from school, did chores, did homework, practiced piano.

No closing the bedroom door.  Bathroom door should be left open as well.

"
347,"That I'm comfortable behaving like an idiot to try and get a laugh.

I have no idea why I would think this is sexy, there's just something about willfully making myself look foolish that makes me feel great about myself, and kind of powerful, I suppose? Which is something that I associated with sex appeal. There are so many contradictions in there..."
348,"People make it difficult for me to discuss sexism in my culture because anything I say is used by racists to ""prove"" that my people are savage and backwards. 
"
349,"I was also only allowed to shave up to my knees because it ""wasn't really necessary to shave all the way up...and once you did, you could never stop."" Ok mother."
350,"""Because you'll get TSS and die."" This woman is a fucking nurse."
351,"[Nana (Im Jin-ah)](https://pp.vk.me/c627823/v627823879/4500b/QXbWxENx8mU.jpg) is a model and kpop star and probably the most objectively attractive person I've ever seen (well... still subjectively, but there are people I'm more attracted to but I wouldn't say are as beautiful, if that makes sense.)"
352,Charlize Theron. 
353,This is cute!
354,"The game doesn't exactly give you points for enjoying college years, though. I'm having a great time, suspect *that* is winning at life."
355,"One of my mom's friend's husband was the hippie type and our reception was on the beach with stairs leading up to a big deck from the sand.  The caterer told our planner that they had asked a homeless man that wandered up from the beach to leave the buffet, and he was super angry, saying he was invited.  Very embarrassing. "
356,[deleted]
357,"My mother in law hates me. It started because she was angry that my SO and I were hyphenating our names (his choice) and the end result was her being hella petty and going out of her way to sabotage whatever small shit she could at our wedding reception. Since then I bought her house for more than fair asking price, cared for her pets (which aren't house-trained!) for a month, emptied most of her junk out of the house, and she's moved to FL. She's altogether been really awful.

The house was a wreck. I'll post some pics of the kitchen if there's any interest, but altogether I've never seen a house so disgusting and broken and still being lived in. Her big dreams were to fix it up and she just never followed through.

I'm fixing it. I completely replaced the kitchen, replaced the 106-year-old heater (and ductwork!), replaced all the plumbing, tore out the carpets, and my SO and I are slowly renovating the rest of the house bit by bit. I'm so excited about our progress for a number of reasons but there's a small petty part of me that is overjoyed every time my SO sends a progress pic to his parents."
358,"I think the Ghostbusters would have been no match against all the demons Buffy came up against.

Buffy never really fought ghosts (unless you count Marcy Ross who went invisible), but she had Willow's powers and Giles' knowledge at her disposal. If they switch while Anya is still around, I'm sure she could use her thousands of years of experience to help out. In short, the Scoobies would have definitely figured it out.

ETA: Besides, there's nothing they can't face...except for bunnies.

ETA (again): And everyone reminded of all the ghosts the Scoobies fought (I can't believe I forgot!). So, the answer is obviously Buffy."
359,"Some guy called me a feminazi because he said in AW that he likes going to strip clubs because he likes being around ""like-minded"" ""sexually liberated"" and ""free"" people and I pointed out that paying a woman to take off her clothes for you is the literal opposite of free. Like, by all means, go to strip clubs. Whatever. But there should be no doubt that it is transactional, that the women working there by and large consider it a job and would most likely not be doing it if they didn't get paid."
360,No taking a bath/shower during a thunderstorm. The lightening would travel through the pipes and electrocute me. I still won't shower during a storm. 
361,"Ex florist. Bride really wanted flowers that were red and white but her groom forbid it because they were the colours of his rival supporting football team. Made her have blue and white instead. 

Not sure if it counts but wanted us to order her flowers for her wedding but, for free, show her how to construct her bouquet, buttonholes, corsages etc so she could do it at home and avoid the cost of time and skill. We said no."
362,"I've been trying to teach Tofu to cover his damn shit for months now. Fucker just sits in the cat litter making the covering gesture with his paw on all sides of the litter box, on the wall, fucking everything except the actual litter that has the potential to cover his shit."
363,"It's not 100% granteed that I'll downvote your comment if you mention ""SJW,"" but the forecast looks cloudy for you."
364,"Yes. Basically any comment even mildly critical of third-wave ""fun"" feminism will be heavily downvoted."
365,Bisexual women are just straight women who want attention from guys in bars. 
366,"I don't know if sacrifice is  the right word, but my time is a big one. I need a lot of alone time and I have to give up a lot of it for a relationship. 

Making an effort to look good. Although I make most of that effort anyway, because presenting yourself well helps in many aspects of your life, not just finding someone.

Being less selfish. Doing things that aren't that exciting because my SO likes it. Hanging out with his family. That sort of thing. "
367,"I'm biracial, and a lot of white moms to mixed children at the store ask me what I use in my hair! I am always more than happy to talk to them :)"
368,I tried hummus like once a year from the ages of 15 to 22 before I finally started liking it. Now I can polish off an entire tub if I'm not careful.
369,"This is mine, too. *Especially* if it's with an air of arrogance or soapboxiness. ""Women who have cheated..."" and the reply is ""I would never cheat, I guess I just have too strong a moral compass."" Um. Okay. "
370,"For not wanting to date them.


Sorry bout it?"
371,"My dad has given me some outdated doozies when it comes to the job search. My personally favorite was that I should go ""knock on some doors"" and physically approach the companies I was applying to, which was hilarious when immediately follows up with, ""and you shouldn't be satisfied with that government contract job! Apply to the FBI or CIA!"" 

Okay dad, lemme just take my 18 months of accounting clerk work and *knock on some doors* in the FBI. 

I swear, old people giving job-seeking advice is like listening to a fish trying to give CPR instructions. "
372,"Stalking the social media of someone you used to know who wasn't a good person ir treated you badly, and feeling smug when their life isn't going very well.

Anyone who says they don't do this even occasionally is straight up lying."
373,"Rosamund Pike is lovely, also Alice Eve. I love Emma Stone and Scarlett Johannsen as well."
374,"If straight/gay is a spectrum, then I am pretty solidly on the straight end, but I have been told I'm ""bi-sensual"" because I enjoy drawing sexy women and look at boobs.

But I don't want to do anything with the boobs! I especially don't like the thought of below the belt. Doesn't interest me at all. I love dicks, and hairy men, and beards. I even tried kissing a girl and it was like kissing family, felt nothing. 

But no. I'm secretly harboring naughty thoughts or something. Couldn't possibly be that I'm an open-minded artist."
375,"For suggesting that maybe instead of peeing all over the public toilet seat when they hover, people should either lift the seat or use the seat covers/toilet paper provided as a barrier. A downvote accompanied by a, ""Urine is sterile"", came my way shortly after.

I mean. Yeah? Ok?"
376,"I'm not too worried about him abolishing means for abortions. He used to be pro-choice and I don't think he'll bother with it. He may defund planned parenthood which would be a great disservice to women of low economic status. 

I am more worried about the success of his healthcare plan. I doubt it will work. The free market does not work the same when the thing they are selling is a necessity, people will pay anything for healthcare because they have no other choice. 

I am also afraid of any brash actions foreign affair related. I do not want to declare war on ISIS and I want to come back from the middle east and let them be. 

I am afraid of his view on encryption laws and net neutrality. He is strongly against net neutrality which is a huge problem for me. 

Lastly I am afraid Trump will act the same way he did in hiss bussiness. As long as he comes out on top, fuck what happens to everyone else. I am worried he will worry more about the reputation and overall prosperity of the country rather than the prosperity of the people living in it (as in he will allow corporations to thrive at the cost of the workers). 
"
377,"Whenever I see comments in good faith downvoted I always upvote them

TIRED OF THE DOWNVOTE FAIRIES"
378,"Are you planning to do a national or international adoption? This is rather important given the conditions of some of the orphanages in most developing countries with severe attachment deficiencies; and as the other therapist in the thread might corroborate, the first couple of years (or even the first few months) of a child's life are absolutely decisive for their mental health.

I'm absolutely biased in that due to my profession I deal with  the adoptions that go seriously wrong rather than those that go OK, but these are things that you need to keep in mind. 

On a more abstracted note, I guess it also boils down to your reasons for wanting to adopt. If your aim is to provide the kid with as good a life as they'll be able to have despite whatever happens, then that's extremely generous; but if you're expecting to have a ""normal"" family, that'll be much harder to achieve with an older child adoption, but I'll let the therapist specialised in that talk about it, as I'm not specialised in child development."
379,Yeah there was a huge turning point in my belief system once I realized that holding choice as the center of my values isn't super helpful when many people have far fewer options than others.
380,For not sharing my weed with them(anymore) because they habitually never had any of their own. 
381,"Testosterone and mostly socialization. Men are socialized differently, more encouraged to be violent, bond less through feelings than women. They don't get as much mental health support and don't have as many friends to vent to. I know it's all generalization but there are clear differences in how men are allowed to express themselves versus women. Women are supposedly the ""emotional ones"", and the only emotion that a man is allowed to really express is anger. It's not even seen as emotion when men express it. "
382,"My partner died a while ago, I nursed him, I found out all about the disease, medication and diet and did my best, sometimes I failed, sometimes I was angry, sometimes now I feel a bit guilty.Its all normal thoughts."
383,How did you escape? 
384,I don't feel like I've decided NOT to have kids... it's more like I just haven't decided TO have kids. I'm 32 so I thought I'd be more decided one way or the other by now but I'm still on the fence.
385,"If this isn't too personal, how did you end up with your adopted mother to begin with?  Do you have a relationship with your birth parents now as an adult?  I'm not the OP but your story is interesting. "
386,"I am 100% supportive of healthy body image no matter what your size/shape, but if I got fat I would be really unhappy."
387,"Catcalling is a dominance display. These harassers do it to whom they see as easier to dominate, typically unaccompanied young women. Those who harass women in this way are pretty much shut down by the presence of another man."
388,Kitten cuddler 
