,text
260,"I look *very* young, like I'm nearly 21 and I get mistaken for a high school freshman very regularly. I've had men who are probably in their late forties try to hit on me that have only targeted me because they think I'm young and impressionable. There was one that even yelled at me for lying about my age because there was no way that I wasn't 16. It's a very gross feeling. Men that age who go after such young girls are predators and it's scary to be targeted by them."
261,"Give yourself an extra few minutes to do all the things you need to get ready, and be realistic about how much time it takes you. I'm super punctual, my brother is ALWAYS late. Some differences I notice: 

He always shorts himself on time. He thinks it'll take him 10 minutes to shower, another 5 to get ready, and 15 minutes to get somewhere. So he starts getting ready 30 minutes before he needs to be there. The reality is, he takes 20 minute showers, 10-15 minutes to get ready, and it's a 20 minute drive, so he's automatically late. If anything comes up (traffic, etc) he's even more late. 

Me on the other hand - I'm honest with myself about how long it takes me to do those things, then still give myself extra time just in case. I take 10 minute showers so I give myself 15. Takes me another 10 to get ready, so I give myself another 15. If it's a 20 minute drive, I give myself 25 minutes. So I start getting ready basically 55 minutes before I have to be there. I'm often early, but that's preferable. 

Funnily enough, I'm typing this while sitting in my car at work because I don't have to be in for another 6 minutes. I got here 8 minutes ago. :P"
262,"We have a 2.5 yo boy and 1 yo twins. We are tired and sex has to wait until kids are asleep but we average to about 3 times a week. 

I also feel much sexier and more horny after I started exercising 3 times a week. It gives me more energy and my knees don't give in too quickly. We also experiment more than we did before kids. 

Edit: we also never co-slept. It's difficult first month and then kids got used to sleeping 8 + 4 hours. Even the twins. It was one of the best decisions we made. Now they are on a 11-12 hour sleep through the night and we have lovely evenings."
263,"I don't understand the hype about Kate Upton. I just.... Really don't get it. 

Charlize Theron might be one of the most beautiful women on the planet. "
264,"THIS. No idea why, but watching any man tie a tie is so incredibly hot. Even in movies, I need to divert my eyes because it gets me so hot and bothered. "
265,Mojitos man. I could drink a pitcher for breakfast. Probably margaritas too. All beer.
266,Lol thats kinda adorable.
267,I would get 300 days a year! Hahahah! I approve of this plan. 
268,"I'm a graduate student in Logic, Computation, and Methodology! I was given my own computer at the age of eight and I learned HTML and CSS. Then I started working at fourteen doing web development for real estate companies all over the US. I used this money to switch to private school. In college I changed my major every week freshman year before deciding to make my own. I had to petition an academic board and work closely with faculty to design my major, but it was approved! I graduated in May, and now I'm at Carnegie Mellon concentrating on modal logic to diagram technical systems. :D"
269,"I'm more comfortable with people who don't see me as something to fuck. Their sexuality has nothing to do with it, their shittiness vs not-shittiness does."
270,The irony is real.
271,"Definitely do sunscreen. I've been wearing it daily since I was 16-17 and now I'm 38 I've only just got the beginning hint of a wrinkle on my forehead, and I've really got to look for it. 
Keep on top of debt as much as possible. Save as much as you can. Travel while you're still fairly unfettered by life. Have fun too. "
272,Aziz Ansari in everything he does
273,Or worse when the male-female dynamics of Muslim people are nice quiet lady in a hijab who only nods when her overbearing husband speaks. Most hijabis I know would probably never put up with a guy like that in real life.
274,"My dad would have considered bringing me into the family business in a leadership position instead of hiring me as a receptionist and holding out for my only brother, who is fourteen years younger than me and presently ten."
275,"Matt Bomer is weird for me. Like, he is objectively very attractive but I personally don't find him attractive? Does that even make sense?"
276,"Yup, I gave up drinking and still love a Virgin Mary (or, as the barman insists on calling it, a 'Bloody Shame')"
277,It would also be underwhelming for the people who get 0.
278,[deleted]
279,"When she gently brushes my hair out of my face when I'm kissing her, or... y'know. I melt!"
280,That short pause before answering a serious question. 
281,"I don't like Robin from how I met your mother. It's nothing about specific interactions, I just hate her overall character.  She's bitter and rude. "
282,"I think it also depends on the ex. Like if they were married and share custody, I'd hope they were friendly. If it was someone who mistreated them, I'd worry. If it was an ex who they dated in high school and it fizzled out, that's hardly worth jealousy. If it was someone who they were very recently serious with and they only hang exclusively, that's something to suspect."
283,"Background: we prank each other a lot, and he particularly likes to prank me by startling me as he presses something very cold to my back/neck/whatever. I have terrible temperature management. Sometimes I'll be terribly hot, sometimes terribly cold. It's just my feet though, the rest of my body is usually fine. He does not understand this at all but I don't either so that makes two.

So one evening I was lying on the couch and my feet were BURNING. Legitimately, they felt scorching hot. I tried watering them under the tap but nothing would help. He asked me if I was having hot feet again and I said yes. He sighed, got up, walked to the bed and got a huge bottle filled with frozen water out from under the bed. Him: ""I was going to prank you with this, but anyway, here."" He wrapped it up in a towel so my feet wouldn't freeze to the bottle and positioned it under my feet so I could cool them. 

He forfeited a prank to keep me comfortable and that was just the sweetest thing."
284,I used to turn on my read receipts whenever my ex was pissing me off so he knew I read his text but wasn't responding. 
285,"&gt;Calling women females.


The way some people use it (particularly online) has this weird 'othering' effect. You know the type of people I mean ఠ_ఠ"
286,"A couple of years ago, my ex and I had these massive fights about money. He got a new job that required him to travel a lot and basically supported both of us. I had just lost my job, so I was looking for a new one, working a minimum wage job, and keeping busy on my own projects. 

At one point, he was gone for about a month. During this time, he decided he needed a new piece of equipment that was very expensive. I told him we couldn't afford it, laid out the facts, and he bought it anyway. 

When he got back, he checked our bank account and found that we had less money than he thought. He immediately accused me of ""spending all of his money,"" told me I ""chose the dumbest career path ever,"" and that he was tired of having to always support me financially (I called my mother that day, sobbing, and my mother, who is an accountant and did both of our taxes every year, straight up pulled out our tax returns and confirmed this was not true).

He even told his dad, right in front of me, that I ""hadn't been contributing."" 

It was one of the lowest points of my life. I have always been a very independent and hard-working person, so to be made to feel like I was mooching on the man I loved when I was in a difficult transitionary period with my career was devastating. "
287,"The number of friends and family I have who will have happy, healthy, enjoyable lives.  "
288,THIS THIS THIS! THIS is (one reason) why women hate dick pics. I want to see the whole thing not just the wiener or the arm or the whatever. 
289,"I have a friend, well we met on COD on PSN lol but he lived nearby and we became friends, anyways, he had this long term girlfriend before that he was telling me about, she moved for college for a year and they stopped talking for over three months before he finally reached out to her, thats exactly what she was doing waiting to see how long it took him to call cause she was always calling. Three freaking months. And he was surprised she considered them broken up!! I dont talk to someone for three months Im gonna consider us broken up lol"
290,"I don't call that emotional intelligence.  I call that emotional control.  Emotional intelligence to me is reading and knowing emotions based on a person's behavior, and then usually responding in an appropriate way that will cause them to feel better or whatever.  It's being aware of what's going on with a person's emotions. "
291,Yup! Can you imagine what it is like to be a teenager now? How do we expect them to grow into well-rounded people when every mistake they make can be photographed and posted to shame them.
292,"While I can't speak to his actual capacity for emotional labor, (as I am not in a relationship with him) I have a friend who I frequently describe as ""the nicest guy ever"" because he's demonstrably thoughtful, and I have to assume thoughtfulness translates to being capable in emotional labor kinds of ways. My husband is great at both. 

Examples being: friend always is the one to ask about or suggest meal options if he thinks a get together will run long into a typical eating time. He remembers people's allergies. He reached out to me last weekend before a snow storm came through to offer that my husband and I stay at his house because I was past my due date and he lives only five minutes from the hospital. He wishes people happy birthday by reaching out personally instead of just a Facebook post. When someone makes a vague suggestion (""let's all go to GenCon next year"") he's the one creating a group to communicate about actually making plans.

Tl;dr: my guess is that people who demonstrate empathy are probably good at emotional labor."
293,"&gt; Being able to admit when they don't know something

This is it for me."
294,"One time I got really ill from an infection. We made an emergency trip to the after-hours doctor. I asked if he could give me something for the pain I was in and the doctor gave me paracetamol but in a suppository form because that's apparently more effective.

Went home, boyfriend at the time (now husband!) tucked me in, got me ready and then I was like ""omg I've never taken a suppository before...do I just put it in my butt?"" and in the sweetest, most earnest tone he just looked at me and asked ""Do you need help?"" The man was going to stick a pill in my butt for me. I mean, he didn't, but it was the completely honest way he asked, like no problem I will stick that in your butt for you to make you feel better. 

Right now our cat is super sick and I've been sleeping on the couch to look after her in the night. She's incontinent, AND a cuddler, so I'm getting peed on a lot. I woke husband up at 6am and and just PASSED out in our bed. He took over taking care of kitty. When I woke up, he'd ordered a kid's play pen from Amazon Prime, set it up, and had kitty in her own little fortress so that now I can sleep better.

Yeah, he's a keeper.

He's not romantic in the flowers and jewelry sense, and that's fine with me, because goddamnit he is there when I need him and he's just a big stupid face.

"
295,Don't go to law school. Do something you actually like.
296,"friendships are going to shift, and you will probably lose some people you never thought you would. adult friendships are so different from the friendships you form as children, and even in college. 

life comes in stages, and you won't always be at the same stage as the other people your age. yes yes, we know, everyone around you is having babies and you're just binge-watching whatever on Netflix. but where you might throw yourself headfirst into your career and be making the big bucks, your friend might hit 28 and still not know what to do with their life. it's all normal."
297,Googling Matt Bomer as a straight man makes me question my sexuality. 
298,i appreciate the hell outta this whole diatribe
299,"It's amusing that all of the ""it's still pretty great"" posts have been upvoted to the top, and then you get lower down the thread and you start to find all of the ""never"" and ""what sex life after the kids?"" posts."
300,"Yes, and that you're on their mind even when they're engaging with somebody else. "
301,"On the other hand I think skinny jeans suit pretty much everyone, as long as they fit."
302,"Yes, yes, yes.


Because here in the good ole US of A I've been told point blank by employers that I won't be hired because I'm a woman and they didn't believe I could do the job.  It's a common attitude in my field, every woman I know has a similar story.



Feminism is still very much a necessity.  "
303,"I find that a lot of stuff on pinterest is bogus. From shitty recipes to oh yeah you can totally make a dining room table from an old door; IF YOU HAVE ADEQUATE EXPERIENCE IN WOOKWORKING otherwise your just creating a splintery unstable firehazard! 

I've come to the conclusion that if I can't see all the parts in the picture and make it from that,  it's probably too complicated to try. "
304,*drinks entire handle of vodka*
305,"I can't rely on motivation to maintain my workout routine tbh. Motivation is a fickle, exhaustible resource, and some days it really just isn't there. I have to tell myself it's another responsibility, just like going to work every day, or brushing my teeth.  

To me, dragging myself to the gym is like a second job that I get paid for in confidence instead of money. Thinking about it that way has gotten me to stick to it better than anything else has."
306,insisting on ''discussion'' of the ''facts'' to clear the air and pave the way for reconciliation when the problem is the fact that they're an insufferable jackass incapable of empathy.
307,"Never have I ever done any winter sports, like skiing or snowboarding. "
308,"Sometimes I can't help wondering whether the LPT thing isn't just some collaborative performance art project, because it seems like half really obvious things any normal adult should know; and half stupid/irresponsible/inefficient things that yes, I guess you could do, but why would you when you could just use the thing that's meant for that purpose?

(I don't really want to say what the worst one I've seen is because whenever/wherever I've seen it posted, other folks chime in with how great it is, and I don't want to offend anybody in case someone here does it)"
309,"I like the long shirt with leggings trend. I actually never wear leggings, but I have a really long torso and it's really nice to be able to find a wide selection of long shirts for a change."
310,Good god I'm sorry. 
311,"Mine was what I call my ""4 year long one night stand"". 

He said the right things. We connected in all the right ways. We passionately agreed (and disagreed) with the same parts of life. **WE GOT EACH OTHER**. Sometimes we swore we heard the others thoughts in our heads, despite never being spoken out loud. It was weird and crazy and unreal, and we were both drawn to each other over and over again, no matter the distance or time passing. He would leave relationships to come back to me. We could never stay away from each other, and constantly sought each other out over the years.  

One day I thought to myself, ""we only talk when he gets ahold of me"".   

I resisted the thought, I made excuses, I came up with all sorts of reasons (that he supported) for why I was there for him when he wanted me to be and not the other way around. Any time I wanted him, I was brushed off - made fun of or demeaned, left hanging and waiting for a glimmer of acknowledgement. But I kept trying, and agreeing with his reasons and suppressing my own feelings about it.  

The tipping point was after an 8 or 12 month disengagement by him, can't remember the exact time. He called me out of the blue in the evening, around 11pm IIRC. We chatted for a bit, and then I tried to say that I was hurt by him not staying in touch, and that I really cared for him and would like it if we could talk more regularly and stay in contact. He said I was out of line and putting limits on him, creating things in my mind that didn't exist, and needed to respect his individuality. We went back and forth for a bit, then he hung up on me. When I called him back, he yelled at me for calling back so late and potentially waking his family (mother and brothers that he was staying with), and then called me ""a hater"". I told him he called me first, and I wasn't ""a hater"", I was expressing my own feelings about us, not judging. He kept name-calling and taunting, and I eventually hung up. He then called me over and over for half an hour, until I unplugged my phone for several hours (this was in the landline-only days).  

To be fair, yeah, I WAS creating things that didn't exist. What didn't exist was our relationship. He knew that all along, unfortunately. 

He got ahold of me a couple years later, on IM/chat. He approached me by saying ""whats up"". That's it, that's all. I responded by saying he acted like a piece-of-shit in our last conversation by pretending nothing ever existed between us, but I forgave him. I understood he was going through things in his own life and couldn't properly respect me, and while I didn't appreciate how he basically treated me like an on-call whore, it was OK now. That was then, and this is now. I no longer wanted to be with him or communicate in any way, but I still loved him and wished him well in wherever his life would take him, and best of luck.   

His response? ""Get lost loser, OMG, I knew you had issues before but clearly you're still a mess now. Wow, get a life"".  

I consider it a win in the end. "
312,The same ones I drink now... Moscow Mules and Bloody Marys 
313,I hate Ross from friends. I hate him.
314,"A look on my mom's face when we had the ""fall-out"" fight that basically ended our relationship.

Laying in my tent in North Dakota, surrounded by buffalo with my boyfriend's head on my hip. That's when I knew we'd get married and that he was my guy.
"
315,"As a white girl with fine, curly hair (think [Bernadette Peters](http://bloximages.chicago2.vip.townnews.com/journalstar.com/content/tncms/assets/v3/editorial/4/4f/44fe3812-784b-5033-b5c9-83e309a9375f/4efb9d2e29c19.image.jpg)) I am eternally grateful to one of the ladies at my gym who introduced me to hair wrapping. Using a satin scarf/bonnet at night has totally changed my hair and it looks so much better now. I can't believe I never knew about this until recently, and I grew up in a fairly diverse area!"
316,"A great sense of humor. 

You can't be really funny if you aren't also pretty smart. 

Edit: Change *man* to *person.* It's true of everyone."
317,"She wasn't. A crazy thing though: a doctor showed up at my house a couple weeks later. He said he was tasked to review the situation for the hospital. After weeks of guilt he just had to tell me that when the surgeon attempted to stop the seizing he botched it, that she should still be alive and that we should hire a lawyer. Since we were only engaged there was nothing I could do about it and her parents chose to do nothing as well. "
318,Isnt that the point?? Fucking space is awesome.
319,"Call out the harasser, don't bother the person who was harassed. "
320,Usually just wallow in repetitive self-hating thoughts. Eat something bad for me. Drink something bad for me. Fuck someone bad for me. Wake up feeling better. 
321,Challenges. Please just stop.
322,"We've been together since 2002. He knows my birthday means a lot to me. I don't ask for extravagant things or dinner at some 5 star restaurant. This year he, and our children (who are younger than 12) didn't do anything. I thought they were pulling my leg. Nope. I didn't even get a card. If I hadn't said it was my birthday they wouldn't have even wished me a happy birthday. He took me out for breakfast because we hadn't eaten, so it was just another day.

It sounds stupid. But it hurt more than anything over the last 14 years with him. "
323,"My wife was approached by 3 men in a car who were making her feel very uncomfortable. She was walking our dog with out 6 month old baby. And they wanted to know the dogs breed and then said they wanted the dog. She said at first she thought they were joking but then it became apparent they wanted to actually take our dog (she's a gorgeous pit bull). 

A man walked by and asked her if everything was all right. She said she was just leaving and he walked with her a while. 

Simply adding yourself to the equation, regardless of what you say, gives the woman the opportunity to leave and changes the dynamic enough that the man may back off. "
324,I would not have ruined so much underwear with period blood. 
325,"I was asked to wear more makeup to work. ""Like Amy does"" 

I asked him to cover the associated costs. 

He never mentioned it again.  "
326,Faux freckles.
327,"Coconut oil against pimples T_T So many people recommend this all the time, I just don't understand it. There are so many other oils that aren't problematic, but no, has to be coconut. 

It's comedogenic folks, use a different oil! "
328,Mad Max: Fury Road did a good job with showcasing different women of different ages and attractiveness 
329,"The coat got me. I'm currently 22 and my mom buys me SO MANY THINGS I DON'T NEED. 

And she's been sick for awhile. Fuck this hurt."
330,"I can't believe no one has said this before, but there is actually some great existing protocol for this type of situation.

The Four D's:

1. **Distract**

2. **Delay**

3. **Delegate**

4. **Direct**

Please see this link for further information: https://wellness.uchicago.edu/page/bystander-intervention#4Ds "
331,And the bulk of the interesting plot goes to the white cast.
332,"Something from when I was 5 years old. I was on the bus waving goodbye to teachers and friends and 2 older boys stopped and looked at me and one said ""What a horrible face"" and the other laughed. I've always suffered with insecurities since then. When I look at myself in the mirror I sometimes hear it repeated, especially if I am feeling pretty awful thathe day. I'm 22 and it still bothers me."
333,The useless father who has no idea what he's doing 80% of the time
334,While I was gone to work he went into makeup bag and took pics of all my favorite brands. He then went to the store and picked out all new makeup in those brands in colors that would be perfect for me and put them all in a Christmas stocking. That was our first year together. Blew me away. .no one had ever put that much effort into a gift for me. 
335,[deleted]
336,"Watching him work. He's in construction, and watching his brain work the math and then his muscles moving to make it happen is sexy as all get out. "
337,"Having the sassy loud black girl or hood black guy.

Having black people speak in slang or Ebonics or in a way they would never have a white character speak. I feel like I haven't seen 1 show or movie where a black actor doesn't speak in some sort of broken English or like they just left the hood. And if they do its portrayed like they're ""acting white"" for comedy.

The very obvious token black friend who has no character development and is only there to further a white characters story.

Asians as super meek/submissive or always having an accent(same w/ latinos). 

Absolutely hate the white saviour complex.

Only having a huge number of black and Hispanic actors when it has to do with prison or crime or violence.

Black/latino characters always have some sort of struggle.. poverty, racism, crime etc. Why cant they be some middle class/well off person living their life or various other roles that are given to white people.

I feel like I barely see asians in roles at all, especially as the main character, except to play the nerd, cute girl, or in a karate movie. "
338,"This is just a personal reflection but, you really do change a lot in your 20s... I was with a guy from age 19-22 and I committed so fast without really knowing myself fully. I found myself changing and what i wanted out of a relationship changing.

It's so cliche to say but really, don't hurry into a commitment so early!"
339,My boyfriend is in regular contact with his ex because they have a kid together and have to make arrangements regarding her. I'm fine with that. I'd also be fine with him casually keeping in touch with other exes. 
340,"I just saw Rogue One last night and had the exact same feeling! Like it's great that Jyn is the hero, but why are none of the background characters women? Just why not? There's no reason for it. I counted maybe two women who were part of the rebellion, and both of them were attractive. Why can't we have rugged older female soldiers? Why can't women be human in films?"
341,Ezra Miller is inhumanly gorgeous. Everything about his bone structure is amazing. 
342,Rape of a tertiary female character as the motivation for the male protagonist
343,Guy in suit and tie commuting to work on a bicycle with a messenger bag slung behind his back. Eco friendly and well dressed. P:
344,"This bothers me so much. It basically ruins movies for me now, whereas I used to not really notice. Like, no, Emma Stone is not an appropriate love interest for *Colin Firth*. Jesus Christ, Hollywood. "
345,I don't have to leave the couch when I need more wine.
346,[deleted]
