,text
0,"When he's driving &amp; I'm in passenger seat, I get weirdly turned on when he puts his hand on my seat and looks back over his shoulder while reversing the car.

Don't quite understand what that one's about.."
1,"Oh you misspelled ""heelys"" "
2,"The best advice I've ever heard on this situation is just to distract the guy, by asking him if the bus just passed, or whether the shop down the road is open, whatever. It's less risky for the guy stepping in, but gives the woman a chance to get out of there. "
3,"When he moved from his town to my town in his new house, we had a celebratory supper of pizza and champagne in Dixie cups after unpacking all his stuff from the uhaul. 

When I went to grab a Dixie cup from the stack to pour some in, the cup had ""Move in?"" written on it. I think my jaw immediately dropped and I got goosebumps. 

*Turns out he wrote it on all the cups because he wasn't sure which one I would take!"
4,Half-boners in sweatpants with no underwear.
5,When a person who normally isn't very smooth or flirtatious winks at you. Especially if it's done after they've said something or made a joke to someone else. 
6,"Those fucking huge, boxy drawn-on eyebrows"
7,"You WILL gain a shit ton of weight from all the beer and fast food you consume.

You DO NOT have a ""really good metabolism"". "
8,"I don't think this really answers your question but, it irks me to no end when I am watching a movie and they show a Black woman going to bed with no scarf on her head... -_-

Something that answers your question better. I hate when people re-write classic movies just to replace white people with POC. Like, no that's not what we want. We want to write our OWN stories that are true to us. And to create new characters. The point is not to replace white people on TV. The point is that there is more than enough room for different races/religions/etc to be represented on TV."
9,"Seeing a man's forearms flex a bit so the muscles in them are defined and visible.

Even better if those arms are wrapped around me from behind and I'm looking down at his forearms."
10,I was angry at my boyfriend on my way home from work so I bought a snack just for me and ate it in the car so I wouldn't have to share or get him one. 
11,"Honestly sometimes I worry that my husband doesn't stack up to the expectation of what makes someone an incredible spouse. He's kind of clumsy when trying to take care of me because no one ever taught him how to be nurturing. He's loud and a little too rough with our dog because he never learned how to be gentle. He gets too angry over video games and when he's upset his language center shuts down and he can't tell me if he's hungry or sad or frustrated because his whole life people told him he wasn't allowed to have feelings, let alone express them. So he messes up sometimes and says hurtful things and I doubt I'll ever have the kind of husband that would show his love for me by fixing my dead father's watch or hand feeding me his grandmother's chicken soup or by writing me a poem about my eyes.  


But I did marry the guy that told me it was okay that I had scars from self harm and that it was okay that I didn't want to have sex and that it was okay that I had a panic attack and that it was okay that I am too scared to drive on the highway until I stubbornly decide I need to prove to myself that I can and then that's okay too.


So to answer your question, the nicest thing an SO has ever done for me is say ""that's okay"".   


Edit: thank you all for your heartfelt comments and for sharing similar stories, and especially thank you to the very kind person who gilded this comment.
"
12,"I was on my way to his, but we'd just had an argument over the phone and it was kind of my fault. So, I decided to buy us dinner and stormed into a thai takeaway and angrily ordered our favourites but I ordered his black bean   curry extra spicy because he can't handle too much spice. 

To cut a long story short, I felt absolutely awful and couldn't tell him so I gave him my order and swallowed his extra spicy his order instead. He asked why I was crying over my meal and I told him I felt terrible for arguing over the phone, it was only half a lie. "
13,"I got stranded in the US during a snowstorm and was stuck for 3 days. Absolute travel chaos. My SO picked my dog up from the boarder (so I wouldn't be stuck paying even more fees) and took care of him for that time, then drove across town to shovel out my parking spot and tidied up my apartment so I could just collapse when I got back. After an incredibly stressful trip we weren't even in touch for most of, I got home to everything just *handled* and it made me melt. "
14,"It is like being a teenager again, except instead of trying to find a place where my parents won't catch me, I'm trying to hide from my children.  "
15,Have intense and draining anxiety if you're not on time.  Allow your feelings of discomfort and fear overwhelm you and rule your life.
16,The number of languages I can speak
17,"Showed up at my house late one night while I was deathly ill with an arm load of groceries and a fuzzy blanket. Banished me to the couch while he made me soup and tidied my apartment. 

I cried. I'm used to being on my own, and having someone take care of me was a very new experience. 


- The time he fed me tea and nausea meds and made his apartment chilly so I could be a little more comfortable while my migraine medicine kicked in. 


- Or the time he sat with me in court for a domestic violence hearing against my ex. He held my hand the entire time, then bought me the best breakfast you can find in this city. 

"
18,"Glorifying things associated with men, while degrading things associated with women. Example: Bacon = manly and good, but pumpkin spice lattes = girly and ""basic."" I don't see why these things are even associated with gender at all in the first place, let alone why those associated with men should be considered superior. "
19,"When you compare hands with someone and they just have *big* hands 😍 did it last night on a date and he was like wow you're so small, and proceeded to see if he could fit his fingers around my wrist. Swoon."
20,"I'm not a big fan of throwing the token ""ethnic"" person into the show who is super 2D. And worse, when they try to show either exaggerated versions of them in either direction  (either they're the super stereotypical version of that ethnicity or they're the polar opposite like so unbelievably ""white"" it's too much).

Is that what you were asking for?"
21,"I don't know if this counts, but about 12 years ago, I was looking up cheat codes for Sonic 3 online, and one of them was called ""Make Sonic Have A Really Big Afro,"" and it was literally just to stand next to the goal sign in the right position to make Sonic's head look giant."
22,"hip V also know as penis shoulders
"
23,"My husband wears sweats and basketball shorts as his around the house clothes all the time. 

It's near impossible to not just stare at the outline of his penis. It's been like this for 11 years. 

Then...he goes and reaches for something, and his shirt rides up a bit exposing his hip V.....insta-sploosh."
24,"If any of you are familiar with Cheryl Strayed, author of *Wild*, she used to have an anonymous column on the Rumpus. This is one of her most beautiful letters.

Dear Sugar,

I read your column religiously. I’m 22. From what I can tell by your writing, you’re in your early 40s. My question is short and sweet: what would you tell your 20-something self if you could talk to her now?

Love,
Seeking Wisdom


Dear Seeking Wisdom,

Stop worrying about whether you’re fat. You’re not fat. Or rather, you’re sometimes a little bit fat, but who gives a shit? There is nothing more boring and fruitless than a woman lamenting the fact that her stomach is round. Feed yourself. Literally. The sort of people worthy of your love will love you more for this, sweet pea.

In the middle of the night in the middle of your twenties when your best woman friend crawls naked into your bed, straddles you, and says, You should run away from me before I devour you, believe her.

You are not a terrible person for wanting to break up with someone you love. You don’t need a reason to leave. Wanting to leave is enough. Leaving doesn’t mean you’re incapable of real love or that you’ll never love anyone else again. It doesn’t mean you’re morally bankrupt or psychologically demented or a nymphomaniac. It means you wish to change the terms of one particular relationship. That’s all. Be brave enough to break your own heart.

When that really sweet but fucked up gay couple invites you over to their cool apartment to do ecstasy with them, say no.

There are some things you can’t understand yet. Your life will be a great and continuous unfolding. It’s good you’ve worked hard to resolve childhood issues while in your twenties, but understand that what you resolve will need to be resolved again. And again. You will come to know things that can only be known with the wisdom of age and the grace of years. Most of those things will have to do with forgiveness.

One evening you will be rolling around on the wooden floor of your apartment with a man who will tell you he doesn’t have a condom. You will smile in this spunky way that you think is hot and tell him to fuck you anyway. This will be a mistake for which you alone will pay.

Don’t lament so much about how your career is going to turn out. You don’t have a career. You have a life. Do the work. Keep the faith. Be true blue. You are a writer because you write. Keep writing and quit your bitching. Your book has a birthday. You don’t know what it is yet.

You cannot convince people to love you. This is an absolute rule. No one will ever give you love because you want him or her to give it. Real love moves freely in both directions. Don’t waste your time on anything else.

Most things will be okay eventually, but not everything will be. Sometimes you’ll put up a good fight and lose. Sometimes you’ll hold on really hard and realize there is no choice but to let go. Acceptance is a small, quiet room.

One hot afternoon during the era in which you’ve gotten yourself ridiculously tangled up with heroin you will be riding the bus and thinking what a worthless piece of crap you are when a little girl will get on the bus holding the strings of two purple balloons. She’ll offer you one of the balloons, but you won’t take it because you believe you no longer have a right to such tiny beautiful things. You’re wrong. You do.

Your assumptions about the lives of others are in direct relation to your naïve pomposity. Many people you believe to be rich are not rich. Many people you think have it easy worked hard for what they got. Many people who seem to be gliding right along have suffered and are suffering. Many people who appear to you to be old and stupidly saddled down with kids and cars and houses were once every bit as hip and pompous as you.

When you meet a man in the doorway of a Mexican restaurant who later kisses you while explaining that this kiss doesn’t “mean anything” because, much as he likes you, he is not interested in having a relationship with you or anyone right now, just laugh and kiss him back. Your daughter will have his sense of humor. Your son will have his eyes.

The useless days will add up to something. The shitty waitressing jobs. The hours writing in your journal. The long meandering walks. The hours reading poetry and story collections and novels and dead people’s diaries and wondering about sex and God and whether you should shave under your arms or not. These things are your becoming.

One Christmas at the very beginning of your twenties when your mother gives you a warm coat that she saved for months to buy, don’t look at her skeptically after she tells you she thought the coat was perfect for you. Don’t hold it up and say it’s longer than you like your coats to be and too puffy and possibly even too warm. Your mother will be dead by spring. That coat will be the last gift she gave you. You will regret the small thing you didn’t say for the rest of your life.

Say thank you.

http://therumpus.net/2011/02/dear-sugar-the-rumpus-advice-column-64/"
25,Put the label on the duvet on his side of the bed. It makes a crinkly noise. 
26,"[Use a reusable CD-R/W case to store bagels on the go!](http://imgur.com/a/pUVsg)  

Because 

 A) I wanna keep my old CD-R/W cases around for bagel transport purposes 

and 

 B) What is wrong with a sandwich bag or a piece of tupperware?  

Am I so obsessed with filling a void in my life that I have to fill the hole of my bagel when stored, too?  What if my bagel has ham, or cheese, or any addition that doesn't give way to a stupid CD spindle?  Why should my sandwich conform to such an archaic and outdated mode of transport for CD's, much less sandwiches?

These, are the LPT's I do not need or want.  
"
27,Surreptitiously taken photos posted on the internet and meant to shame people. Mind your own business and don't be an asshole. 
28,"Depends on their relationship now, if he lets me meet her, if he's weird or secretive about it, and just the general vibe of the situation. "
29,"&gt; *Turns out he wrote it on all the cups because he wasn't sure which one I would take!

D'aw. This makes the story so much sweeter. "
30,I like watching him tie a tie. Cause he knows how. And it's my favorite thing. 
31,"We have to lock doors. 

Also we tend to only have sex when it's late at night or early morning when the kids are in their beds or down stairs watching cartoons. It's a mood killer having some great sex when you get a knock on your bedroom door from your kid asking for something to eat/tell on their sibling etc. It's easier now that they're older. 

We tend to do it in the shower a lot more though which for the husband is a bonus. For me, ehh. 

We haven't had a day in bed having sex in...I can't even remember. I miss that. A lot. My parents are moving to my town in a few months and I cannot wait for some husband and wife time while the kids are with nanny!! 

We've been together something like 15 years and our sex life is still awesome kids or no kids. 

"
32,"I'll always be grateful for a stranger that helped me in this situation. I was young, like 18 I think, taking the subway. He was probably mentally ill but my default is still ""be polite, be quiet, hope he goes away."" He was saying sexual things to me in English and swearing at me in French (Montreal) as I stood on the platform trying to ignore him. Train arrives, and even through he'd been several meters away he moves to get on the same car as me. I sit in a half empty car, he proceeds to sit next to me and continues harassing me. I try to change seats a few times, he follows each time. Finally a friendly guy offers me the seat by the window, and sits next to me to block my harasser, who tries to talk over him nonetheless. Friendly guy then starts talking to harasser, and gently takes him by the elbow to another set of seats. At the next stop I get up to hurry off and when harasser tries to follow, friendly guy gently says ""She doesn't want to talk to you"" and blocks his way, trying to distract him with conversation.

It's been over ten years and I'll always appreciate friendly guy's smooth reaction. "
33,[deleted]
34,Matt Bomer because how??? Nobody can convince me two imperfect humans did that. It's not possible.
35,Sweatshirts tied around the waist in middle/high school. Sooooo many accidents with heavy periods were safely hidden!
36,"I personally don't like that really uncomfortable white savior story line that they use in feel good movies. Like...the whole school was failing and all it took was one (usually white female) teacher to see the good in that inner city thug classroom to turn it around and get them into Harvard?

Why is that acceptable? It's annoying, overdone, and insulting. "
37,"As someone who was homeless for a few years I'll try to help out here. First and foremost: WATER. A reusable water bottle (I like the collapsible kind like the Platypus), some of those water cleaning tabs maybe, or just a damn jug of clean water.

Small soaps, soap is heavy, but sanitizer doesn't do a great job. Wipes are alright too. *I really like the tiny bottles of doctor bronners, you can use it on everything.

Long lasting, lightweight food. Think dried goods; dried fruit, granola, nuts, jerky.

Since it's winter I'd also say those little hand warming packets and some serious socks would be good. Also maybe a poncho.

Bandaids, toilet paper and Aquaphor/Vaseline are also good. The Aquaphor works as lotion, lip balm and salve for wounds, it's pretty great.

We have clothes, we can get clothes easily, don't waste your time on clothes, please.

I'm sure I could go on and on, feel free to ask me. I was homeless for about 2.5 years in the Chicago suburbs (read: really fucking cold) edit: adding a few little things, taking out one apparently dangerous mistake. "
38,"LET'S GET DOWN TO BUSINESS  

TO DEFEAT  

THE HUUUNNNNSSS"
39,Watching a man shave. Something about how masculine it looks. 
40,"When my fiance does these ridiculous math calculations out loud, correctly. Like, 87304 x 46 then divided by 7. I am a very history/English oriented person and math has always been my weakness. 

Also, when he hugs me before he goes to work every day, he always hugs me like it's the last time he will ever wrap his arms around me. I can literally feel how much he loves me. 

Everything he does turns me on in some way. I have never been so in love with someone. It's ridiculous."
41,"Having an open mind.  Curiosity.  Listening skills.  Being able to admit when they don't know something.  Also, most of the really brainy people that I know are humble and appreciate intelligence in others."
42,"[One of my favorite bad lifehacks.](http://memeguy.com/photos/images/-lifehack-59415.png)

On the subject of ice cream, any food lifehack that's basically, [""eat thing with other thing!""](https://www.reddit.com/r/lifehacks/comments/2ne809/to_get_the_last_out_of_your_jar_of_nutella_fill/)"
43,I was mad at him and we ran into the grocery store for just a few things so he grabbed a basket. I decided we needed a 5lb bag of apples that day.
44,"They're not worth the calories to me if they aren't intoxicating. I mostly drink water when I'm not drinking alcohol. And the only alcohol I drink these days are IPAs, vodka, and alcoholic ginger ale. I like the taste of IPAs and ginger ale, but I probably still wouldn't drink them if they weren't alcoholic (and I know I already don't drink non-alcoholic ginger ale even though it's readily available)."
45,"My last manic phase:

I started going on mega shopping sprees. I spent $12000 on a necklace, and two weeks later I lost it at the beach and didn't even blink. I just went ""oh well, easy come easy go"". But it wasn't, because I'd signed up for a new credit card and maxed it out buying that necklace. I couldn't even tell you now what it looked like or which bank the credit card belonged to.

I spent hours wandering around the supermarket, trying to find the perfect onions and potatoes and then I left with nothing because nothing came up to standard. I drove insanely recklessly, I started parting really hard. I drove 15 hours across the state to go to a party and drove home straight after.

I started repainting my house, a mural in every room. Then I stopped and decided to paint the fences instead, stopped halfway through and built a chook run.

Then I began feeling like someone was following me. Then I could see them, always moving out of my vision when I turned to look. So I started double and triple checking all the locks in my house. Then I stopped going out, because I could hear this person calling my name across crowded rooms.

I'd wake up in the middle of the night and smell smoke, then have to search every nook and cranny thinking there was a fire somewhere in my house. I'd wake up thinking I was having a heart attack because my heart was racing so much. I couldn't focus on anything, every time I looked at something it moved.

I started cutting, because it was the only thing that seemed to slow my heart rate down and make me actually able to focus.

Then I woke up in hospital."
46,"I just confessed this to him in case he creeps me on Reddit and he said ""oh good, I hope you had a nice snack"" and gave me a hug. Then he asked how my vengeance tasted and I said delicious. "
47,"Love is a verb, too. Sometimes you have to do it, not just be in it."
48,Beautiful women partnered with Adam Sandler/Kevin James/Seth Rogan/someone who'd never have a chance with them in real life. You never see the opposite; I want a movie where an ugly woman is paired with Ryan Gosling/Michael Fassbender/Chris Hemsworth etc. where it's just accepted and not a major plot point. 
49,"Not quite what you asked, but my mother found me on here. She was in /r/raisedbynarcissists and saw one of my posts. She knew it was one of her kids, and I'm the only redditor in the family so she figured out it was me.

She printed off my posts and showed them to everyone that we know. It was horrible. In the end, I decided not to start a new account. If she wanted me to tell nicer stories about her, she should have treated me better. "
50,"Right now he's obsessed with ""come on and slam"" Space Jam remixes. So he's listening to them on Youtube ALL EVENING LONG. "
51,"When he takes his sweater off and his shirt gets stuck to the sweater, so both pull up for a few seconds. Omf it's no wonder we have a baby crawling around. "
52,"It's happened a few times but I really appreciate when he is so patient with me when I'm clearly upset over something. As a child, I hid away and cried and never let people know my real feelings. I often cried myself to sleep. I was convinced if I told anyone they wouldn't care, I'd just be burdening them, it was a waste of everyone's time etc. I think I became that way because the few times I opened up to my mum (my only parental figure) she would make it all about herself. So I gave up telling anyone at all. Clearly not the healthiest coping mechanism.

But with my SO, he recognised when that was happening with me. I'd be upset and he wouldn't accept 'I'm fine, it's silly, it's nothing...' as an answer and kept saying that if it upset me then it clearly did matter. He would sit with me in silence, just holding me, letting me know he was ready for me and would listen to me and cared for me. He wouldn't try to fix the problems, he'd just...hold me. Really tight. And he'd check I was okay before he let go, and even when I'd try to fool him and say I was fine now, he'd double check and look into my eyes so I couldn't lie convincingly.

I guess what astounded me though is the lengths he'll go to stay with me when I'm feeling that way. It doesn't matter what time it is. How inconvenient it might be. Doesn't matter if it's 3am and he has to be up early for work or if it's 6pm and he's starving. He puts me first. And that's how I know how much he cares."
53,"My first HS boyfriend: He was a little controlling about image and spent an hour telling me that he thought my makeup was boring. He wanted me to wear more colors.  The next day, I decided to show him!  I went into my makeup collection and turned my face into a rainbow of color.  Multiple bright and contrasting shades of eyeshadow (extending out to my temples), teal mascara, bright blush, 2 shades of lipstick.  He looked quite shocked when he showed up for our date.  He also never tried to tell me how to wear my makeup again.

My husband: Sometimes, when I'm really annoyed with him, I will watch and delete things off the DVR that he has said he wants to watch.  Not his favorite shows, just random movies or something that have been on there for a while.  He usually doesn't even notice, but I know."
54,"I wish I'd understood the colossal amounts of change I'd experience. I'm almost 28 and I'm not *remotely* the same person I was at 20. I don't want any of the same things, a lot of my worldview has shifted, my social circle has changed drastically. I'm more confident, I have way more money, I feel like I have a direction and control over my life, and the future doesn't freak me out nearly as much. 

Your twenties aren't when you get ""old."" Your twenties are when you do a lot of growing up (which is not the same as becoming all serious and not having fun -- I have tons of fun and plan to continue). And it's been a little scary but mostly exciting so far. 

Also, yes, sunscreen. And try not to dig yourself into any financial holes.  "
55,"Margot Robbie honestly looks like someone made her in a lab, unreal. I'm not even really attracted TO her because she looks so perfect, like a painting or a doll"
56,"Push presents, gender reveal parties."
57,"[under breath] ""I'm literally eating a physical representation of my anger towards you.""

""What?""

""Nothing..."""
58,"When a guy has really sharp canines and he runs his tongue over them.

Edit: Oh, and when my SO takes his watch off. But that's more like a Pavlov's dog kind of thing (the only time I see him take it off is before we're about to have sex).

 ^^^^^^^^^^^^Also, ^^^^^^^^^^^^one  ^^^^^^^^^^^^of ^^^^^^^^^^^^my  ^^^^^^^^^^^^professors  ^^^^^^^^^^^^hahahahaha  ^^^^^^^^^^^^:(
"
59,The ice soap life hack that recommended freezing liquid soap in a block of ice and washing yourself with it. I think I cried laughing so hard the first time I read the comments on that thread. 
