,text
153,"I guess the second rape. 

I was raped early 2015 (didn't know that's what it was), and was really uneasy about dating. I met someone who was good about my boundaries and encouraged me to open up to him about what I had been through, and we swapped personal details and whatnot over a period of quite a few months. We met up once, but nothing happened and he left quite abruptly. He apologized and we went back to talking. 

Anyway, he did something similar to what the first rapist did, only that time, I ended up getting pregnant, because he didn't use a condom. It came out during that whole awful ordeal that he had lied about everything. His age, where he was from, his mother being dead, his father being in a nursing home, everything that he had told me had been a lie. He apparently just thought I was an easy lay, and acted accordingly. He was repulsed by me, and hated every second of his raping me. 

I'm in therapy now, but I've withdrawn from dating and sex altogether. I'm going to be alone for the rest of my short years (except the cats and dogs), and that's fine with me. I don't trust anyone, and I don't want to go through the process of trying and failing to trust someone again. Im quite content-ish with my lot. "
154,Body glitter and ALL the glittery makeup and nail polish I could get my hands on. I regret nothing. Glittery and shimmery eyeshadows are still my favorite but I don't wear glittery lotion anymore.
155,"The carefully upturned neck and chin, the delicate upward drag of the razor, the eyes examining the clean shaven trail... mmm."
156,"When I'm trying to tell him about how I feel about something (and it's like upsetting and I need to process it), and he'll interrupt to tell me how he feels something similarly or once did before, and suddenly I'm consoling him and I still haven't gotten to even voice what's really bothering me."
157,"When discussing a legitimate problem: ""you'll feel better when your period is over."""
158,"I'm East Asian. As much as I'm glad there are shows that are finally giving us a voice (eg. Fresh off the Boat, Kim's Convenience), their portrayals of Asians are limited and even borderline offensive. I'd like to think that we as a society are finally getting past using the played-out ""Tiger mom/dad"", ""emasculated Asian man"" and ""hyper-sexual or submissive Asian woman"" tropes, but with every new TV show or movie release starring Asians, apparently not. "
159,"Or that he doesn't consider unattractive women, well, women. 

Like, they don't count. "
160,The number of hours I can stay awake consecutively without feeling the need to sleep. Right now it's about 16 hours so 160 hours of staying awake!!! Imagine how productive I'll be!!....... At the very least I'll have more time to get my procrastinating done lol
161,Definitely!  As a white girl I had no idea that this was the norm until I got to college and lived in dorms.  I cannot think of a single instance where I saw that portrayed anywhere.
162,"I actually look better at someone if they are friends or at least civil with their exes. To me it shows that they are able to end things in a mature civil manner. Sure everyone may have one or two crazy exes, but if every single one of someone's exes are the devil then it makes me question the one thing they have in common, the SO. "
163,"There's a guy at my climbing gym who I see around and refer to in my head as my boyfriend, e.g. ""Oh look my boyfriend's here."" I'm currently trying to seduce him by walking past him all the time but not making eye contact."
164,"No, but it's how many women are raised to behave. And in a situation like that it's frightening to consider angering the creep into physical rather than just verbal abuse."
165,Material goods exchanged for tearing your perineum.
166,"Overlook in *themselves*? Possibly social grace. I think being able to carry a conversation well, adapt to and recognize body language, moderate their speech and behaviour, and genuinely *enjoy* other people translates into a person others find enjoyable to be around and who can attract people into their life.  
  
Charisma, basically."
167,The whole making fun of people who are just living their lives and not hurting anyone thing.
168,This one sticks out to me because it is so silly and sweet. I had this hamster that I LOVED but he died and I was heartbroken. Everyone who knows me knows I was obsessed with that little fucker. After he died I was pretty depressed and then one day I got an email saying my hamster had been accepted into the hamster astronaut program. He had signed him up for it without telling me so it would be a surprise. It was such a small thing to do but was totally sweet and unexpected. I just imagine this big tough man on his laptop signing up a little dwarf hamster to be a hamsternaut to make a girl smile. It worked.
169,"Tops with shoulder cut outs. They look good on basically no one.

Also, forever and always, Instagram make up. Heavy brows, over the top contouring, all that jazz. Hate it. "
170,brb buying a beard
171,"I don't know if this counts but ""you're not like other girls"". Yeah, thanks, you're dissing my whole gender to pick me up..."
172,"I'm a bi girl, but some girls are so attractive that my brain skips past the whole attraction part and just goes straight to jealousy and anger..."
173,"Guys pairing with much younger women. Average age gap between couples is 3 years, including in the USA. In Hollywood movies women are almost always much younger than just 3 years, some of them are even ""young enough to be his daughter"" young."
174,"When Roseanne was first airing I remember thinking it was cool that one of her best friend's was black.  Rewatching it as an adult, I realized that the black friends are only there when everyone is there (like for a Mother's Day BBQ) or when issues of race come up (""Our son doesn't want to kiss a black girl in the school play, have we done something wrong in our parenting?"").  

Same with gay characters to some extent.  I remember being happy that they even had gay characters and even one whose sexuality wasn't his #1 personality trait.  But rewatching it, the gay characters are super stereotypical and their sexuality is the butt of the joke more often than not."
175,Everything that is rose gold/copper. Give it to me!
176,"Ohhh I was going to say number of orgasms per sex session, but now I kinda want this. "
177,"Oh, and never have I ever had anal sex. That hole is for exit purposes ONLY."
178,"After this election with a pussy grabbing president elect and a bunch of ridiculous abortion regulations passing, yes."
179,"Aside from knocks on the door ""moooooommmm, what are you doing in there?"" 
Sex is better than ever before. I never imagined that banging the same dude for ten years could ever be this great."
180,Voting Trump.
181,"Like I have to narrow it down? To just one??? Is that possible????



^^itsnotichecked"
182,"Shortly after seeing that episode, I watched Deadpool.

Guess who drives a taxi in that movie. Karan Soni, an Indian American actor, who puts on a fake Indian accent. "
183,"&gt; Do you believe feminism has a place in modern society?

Yes, because ""modern society"" has not transcended sexism (or racism, homophobia, etc.)

&gt; Are you a feminist?

Yes.

"
184,"""For the love of all that is good in this world, listen to Mom when she gives you advice about guys because SHE HAS NEVER BEEN WRONG ABOUT A SINGLE MAN YOU BRING HOME.""

Currently 24 (almost 25) and about to get engaged to the man that she said ""Elle, you're gonna marry that one,"" AFTER THE FIRST DAMN PHONE CONVERSATION.

Also, start lifting weights sooner. "
185,Stand up dude. How they take care of you when you're sick says so much. 
186,"In middle school, I got my period in class once and bled through my jeans. When class was over, I did the typical sweatshirt around the waist and started for the batbroom. One of the super popular girls comes up next to me and asks if I need a tampon. I was ready to cry with how nice and discreet she was being. Since then I never gone anywhere without one. "
187,"When faced with any mundane decision - ""I don't care, I'll let you decide"". Like it's a favor to me to have to choose dinner, date location, movie, etc. every single time. To be fair I'm sure this isn't a man specific thing. "
188,"Aw, I found that a little disappointing. Just pics of forearms? I like to see them as part of the whole package. It's like seeing a closeup pic of a dick. It's just there looking veiny and dumb. 

"
189,Just out of the shower gets me going pretty easily.
190,"The DIY waterproof phone case using a balloon.

It literally was blowing up a balloon, placing the phone on top, deflating the balloon, and having it ""shrink wrap"" the back of the phone.

So not only is it nowhere near waterproof, it also covered up your speakers/headphone jack/charger jack/etc., probably made your phone overheat, and finally, *you have a damn balloon on your phone and you're calling it a phone case.*"
191,"Extracted the fortunes from fortune cookies and inserted his own custom written just for me.     

It's now 28 years later and I still have them."
192,Also the greatest gay black captain ever
193,"I kinda love that the 90s are back, but with a more modern flair. I'm so freaking excited that I can find red plaid *everything*. I live for the tight black pants, tight black shirt, combat boots, baggy red plaid over shirt look. I even recently bought red plaid sheets for my otherwise black bed. "
194,"Well, my story has a happy ending that is in progress. 

I was crushing pretty hard on a guy who caught my train on the daily. We also caught the same bus home in the afternoons. I was new to the city but he caught my eye in that first week. Weeks went passed with me trying no to stare but to try and get the same carriage with letting him feel like he had a stalker (fine line :/) and then I was gonna move houses. To the other side of the city. So I made a move, I tapped him on the shoulder, as he turned slowly, my heart felt like it was going to implode and the thumping in me ears was deafening... I stammered out some incoherent words and gave him my business card with my private mobile number on it. I thought that my poorly articulated stalker moment wouldn't yield results...

Well, we have been together for almost 2 years now. Apparently, I was his commute crush too!

It has been the best relationship I have had and even though I get embarrassed to admit that I made the first and somewhat awkward first move, I can't argue with a ""happily ever after"". 

Shout out to Melbourne Metro Trains... for making love happen!"
195,When a guy is writing something and sort of leans into the table. Not the best example but something like [this](http://il6.picdn.net/shutterstock/videos/4588538/thumb/1.jpg).
196,"A man laying on the couch in just sweatpants, no shirt. When they do the one arm up and one across their stomach omg uuuuunnnnnhhhhh. I could stare for an hour! 

Or, when a guy ha strong hands and arms. I don't need or lust over a six pack, a little squishy in the middle is cool with me, but nice arms make me swoon. As I tell my friends, I like a man who could kill me with his bare hands lol"
197,When a guy is taking off his belt and he has to pull it tightly for just a second to get the metal thingy out of the belt hole. Idk why but something about the motion really...stirs me. 
198,[deleted]
199,"Scarlett Johansson. Don't get me wrong - the girl isn't ugly. I just don't see the big ""WOW"" factor in her.

Most of the women I think are stunning are already seen that way by the majority - Margot Robbie, Olivia Wilde, etc."
200,"I have lost 40 pounds on purpose. I never get sick of people reacting to it!

What I do get sick of, honestly, is when people begin making unsolicited excuses for themselves. ""Oh, I could never do that! My metabolism is too slow/I love beer and pizza too much/I hate sweating. etc.""

I worked hard to lose and maintain my weight loss, and I resent the idea that I'm somehow less fun, eat gross food, or partake in inhuman levels of exercise. 
"
201,"Is Dabbing still a trend?

Because the car commercial I saw sure as hell thinks it still is.  Freaking 9 year olds dabbing because they're car elves or something."
202,I had an ex rip my car window out with his bare hands. His hands were all bloody.... scariest shit ever. I gtfo of there fast 
203,"Yeah, and then you should lie down on a great big sheet of aluminum foil while tanning. Make sure to turn around every 15 minutes to get an even tan.  Also, did you know that fresh rosemary and thyme are really good at absorbing the good sunrays while helping to block the bad ones? You should try it!"
204,[deleted]
205,"I got tired of washing his huge ugly dirty dish pile that he would leave on the computer desk. Normally dishes would pile higher and higher until I got tired of it and washed them. 

But then I realized he was leaving them there *because* I was washing him and his ass was being lazy. Wtf dude.

Seriously, every day I was cleaning up this guys ridiculous mess from basically all his collective meals from the day literally stacked one on top of the other- plates, bowls, cups and all, in front of the computer. I hate doing dishes to begin with.

I know my SO. He picks up after himself once he gets sick of looking at a mess...but it takes a while for him to get to that point once he gets set in his ways.

So I let his dish pile grow. I wouldnt touch it. I let it grow until he had to reach around his dishes in order to play computer games. Oh and he did there for a while, stubbornly. I watched it bother him, wordlessly,......snickering on the inside, marveling in his discomfort. 

I let this happen again and again, each time he gave up and washed his dishes the next pile would get smaller before he gave up and did it again.

And thats how I got him to start doing his dishes again. 

Pretty passive aggressive of me but I have no regrets. "
206,"Don't stop running - you will get fat and unfit and it's easier to carry on running than start it up again! 
"
207,Definitely! How could I not? 
208,"The first one....seems not bad?

I'm sure I'm not the only desi girl who appreciates this trend...we've been thinking that our eyebrows are ugly for years."
209,"I had a kind of opposite experience. 

There was a professor in my masters program who was so fucking hot. 

I never took a class with him but we crossed paths in a few contexts and the chemistry was palpable. 

I asked him to be on my thesis committee and he declined. 

I was so completely shocked that I almost burst into tears sitting in the chair across from his desk. My face was just burning hot with shame. 

He handed me my outline and there were was scribbling all over it - typical academic stuff. I didn't read anything there. I just thanked him for his time and excused myself as quickly as possible. 

I sat in the parking garage and cried until I felt able to drive. I called my mom, hysterical, and told her everything. We tried to figure out why he wouldn't want to be part of my team. I blew off a lot of steam. 

After a rest, I sat down and read his notes. They were smart and helpful. Then, buried on page 3 was a post it note; actually, it was two post it notes - the top one was blank. 

When I lifted the blank one, I saw a note hidden underneath. ""I'd really like to talk to you in a personal context,"" and a phone number. 

I called a FWB and worked off my excitement, so as not to seem to eager. 

I called him the next day and he immediately told me that he was so sorry that I was hurt by his unwillingness to serve on my committee. 

He told me that he would love to explain, in person, but that I needed to consider this a personal matter, not a professional one. 

We met for drinks the next day. He was on his second cocktail when I arrived. Half way through his third, he told me about how he was wildly attracted to me and had been working hard to suppress it and couldn't possibly be professional toward me on my committee. 

We fucked on the regular until I came back as faculty and it would have been kinda a mess. Nobody has ever spent more time giving me head in my life than him. The dude like really, really liked going down. 

God bless him. 

"
210,"When he let our more easily scared daughter go into her school's haunted house for halloween because she assured him she wouldn't get scared. spoiler alert, she was fucking terrified and cried for the next two hours. I made him sleep in their bedroom that night. ""You deserve this"" I said as I tucked them all in. ""I know"" he replied."
211,When your broken bits match up with kindness. 
212,"New fitted plain white tshirt with jeans

But not dingy white or baggy.  "
213,"Seconded on Instagram style makeup. Like I love makeup, but it seems the look of the moment is very heavy handed and stylised. Everyone kind of looks the same and a little uncanny valley. All highlighter, eyebrows, contour, and overlined matte lips. When you're being that heavy handed with makeup, you gotta know what you're doing or else it looks like you've been shot with homer's makeup gun."
214,"Even in a forum full of women talking about their experiences with misogyny, there will still be dudes who deny it happens. "
215,"Couple weeks ago I got out of the shower to find my boyfriend silently sitting still in my living room, visibly upset. I sat down, put my arm around him and asked what was wrong. He shrugged, started tearing up and said, ""They just sound so sad."" 

His ex didn't show up after promising his kids a fun event, no call no show. (She got wasted instead, and lied about it.)  The kids were with grandma who called to tell him what happened while I was washing my hair. 

Seeing how helpless, sad, protective and loving he was in that moment just wrecked me."
216,"I hate it when people (especially men) call women females. It has seriously become a pet peeve. It makes me feel like I'm on the animal planet when someone uses that term about women.

"
217,"Call out sexism when you can, but you shouldn't always have to put yourself at risk to do so. "
218,"&gt; Also, one of my professors hahahahaha :(

Been there."
219,"Fresh off the Boat.

I know some of the plot points may seem crazy or exaggerated to some people, but holy fuck I can relate to pretty much 99% of it as a first generation Chinese kid who grew up in the US in the 90s."
220,"This drives me nuts.  Jennifer Lawrence is 26, and her recent movie pairs have been Chris Pratt (37), Bradley Cooper (41), Christian Bale (42), and Micheal Fassbender (39).  

Like.  Good lord."
221,"Right now it's Chris Evans. He isn't even that striking... I mean he's really just a generic white guy with blond hair and blue. Not usually my type. But every time I see him on screen ... I just lose my mind a little. I have seen those goddamn Captain America movies WAY to many times. 

As for women Halle Berry circa 2001 or whenever she has that super cute pixie cut makes me stop in my tracks. She has been my crush since I was a wee lass. To me she is incredibly beautiful. "
222,"I think this is going to be pretty unique to every relationship. Some people make it work out just fine, some don't. For both my SO and I....we kind of don't see the point. Our exes were parts of our past that are no longer relevant to our future. So I can't see a time where I'd feel the need to talk to my ex of all people vs either my SO or my other friends. Same with my SO."
223,"He's sexist and immature. There are no excuses, women make up 50% of the population. "
224,"Ugh my work crush did this yesterday. Nice dude, jokes a lot, but isn't flirtatious at all (strict boundaries with coworkers that I obviously respect). He made a joke at the expense of another coworker and then turned to me and winked and my heart stopped."
225,"I was down for almost a month with this unshakeable respiratory infection. This dude... Took my grocery list while I wasn't paying attention and went shopping for me so I didn't have to try to breathe in the cold. 

I cried a little, he made vegan tacos.  Yes, this is like two weeks after the soup incident (which raised me from the dead, he is indeed a culinary necromancer). 

I think I got a good one. "
226,When he is fast asleep and I have insomnia. SO JEALOUS
227,"Mmm, with rolled up sleeves!"
228,"God I hate those kinds of recipes. Enchilada recipe:

1 jar enchilada sauce.  
1 package frozen enchiladas

"
229,"1-pick a wine you can afford, preferably one that you can afford copious amounts of.

2-drink the wine until you think it's good


But seriously, this probably isn't the best place to ask this. Try /r/wine "
230,"I still own a hair crimper. Used it today, as a matter of fact, for a test run for an 80s look I'm wearing for a party next weekend. Don't care what anybody thinks, crimped hair was awesome then and awesome now."
231,"Yeah, I hate that there's this idea that men never rant or blow off steam or whatever.  ""Men are problem solvers, women just want to be listened to!""  Okay, so you really think my dad five states away is complaining about his co-worker being unsafe because he thinks I can offer some kind of solution?  Of course not, he just wants to complain to someone.  It's cool, everybody does it.  "
232,"That communication and responsiveness are a minimum standards, not excessively high expectations.  "
233,"I loved that Russell in Up was asian, though it wasn't a movie about asian people and his asian-ness wasn't necessary to the plot an any way. 

I also loved that in Star Trek Beyond, there's a scene of Sulu with his husband as an homage to George Takei. "
234,"Dumb/useless dad, nagging and smarter wife

Ugly guy gets hot girl 

Girl with a rough past opens up and falls in love with her savior  

Guys constantly treating their wives terribly"
235,I did this when I was 5 and my mom almost beat me
236,"The weight thing really gets me. I'm in my early 20's now and I'm noticing people after college really starting to accumulate mass. It's not a problem for me yet, but we all need to take care of our health."
237,"Don't sit on that dumb dick, go home and masturbate instead."
238,"I really dig gin, I think it's pretty refreshing and not as heavy a drink as whiskey usually is. Gin and tonics are my summer drink of choice."
239,I met him once and he hugged me and called me sweetheart. I almost died. 
240,"Jared Leto. He's not even my 'type' but he has this piercing look and such sharp, yet delicate features. He's mesmerising. "
241,"I think he's an idiot.  I'm bisexual, am I not allowed to be friends with anyone?"
242,"You can still dislike something, but still believe that people should do as they wish. "
243,My boyfriend was pissing himself laughing when I told him about it months later. And then we broke up. 
244,Some girls at school were pretty nasty to me about my thick eyebrows in the era you're talking about so I took a tweezer to mine and didn't do a good job at first. So many bad photos exist of me with really obviously uneven brows! I managed to get them a lot neater but idk I feel kind of resentful now that people are falling over themselves to have really thick eyebrows when I had a lovely natural pair - that I can't get back because over a decade of plucking means they don't grow back neat like they once were. So I have to keep plucking them or else I have a load of random messy black hairs above my eyelids.
245,"I do not want to date anybody who works in the military or for the police. It's shallow, and I know that, but in general they have a set of beliefs that I know do not align with my own."
246,I Won't Say I'm In Love
247,Here's [the original ice soap post!](https://www.reddit.com/r/pics/comments/jinex/shower_to_go/)
248,"

My best friend is white. I go with her to events, and I'm the only black person. But she also goes with me to events where she is the only white person. we share in each others lives, I'm not just an accessory in hers!

So many tv shows paint it like we are just accessories that show up as like a condiment in the white lead character's lives, but you never get to see the white characters be an accessory or condiment in the black friend's life."
249,My girlfriend does this. She's only seen me shave twice and both times she looks like a cat gazing into a Christmas tree... only hornier. 
250,I still do that when I have a sweater but don't feel like carrying it. 
251,"Emma Watson. Maybe it's just that a huge amount of men grew up watching her in the Harry Potter movies, and those teenage crushes have carried over into adulthood? She seems like a nice enough person, though."
252,Cillian Murphy.
253,Pretending to know another girl who is alone on the train when some weirdo tries to harass her. 
254,"I'm a lesbian so it's a constant internal struggle like... do I want to BE her or be ON her???

The answer is yes."
255,"When we were in high school, my boyfriend told me he didn't like me wearing short shorts because he didn't want other guys to look at me. The next day, I put on my shortest, cutest pair of pink shorts that were guaranteed attention. 

He knows better than to make suggestions about my looks now!  

Quick edit: not abusive, good heavens. We were teenagers. He's over the jealousy thing. "
256,I once gave a SO basketball shorts in a Victoria's Secret box.
257,"And fucking yogurt commercials! I've seen ONE with a man in it and the whole joke was that he thought it was pudding, so their yogurt is so delicious even a *man* would eat it. "
258,Don't get in a relationship until you're in a healthy relationship with yourself. 
259,"I'm friends with both of my exes. As long as it's a real friendship and they can set their boundaries, it would be fine."
