,text
0,Tbh it sounds like something I would do
1,"Because I was being sarcastic, rather than legitimately condescending like you."
2,"I'm honestly not sure what you stand to gain from spreading blatant lies. 

With the exception of the retarded ""don't drive while black"" and ""don't carry cash"", everything else was true. I don't know if you're just anti cop, a lame troll, or someone that seriously has no clue how the Fourth Amendment works, but there's no reason to be this dishonest."
3,"I've heard of some sick fucks basically making lolicon ""which is completely illegal and considered child porn"" but making a small backstory saying the character is older to avoid legal repercussions / scrutiny, disgusting stuff honestly and i wish the worst to people who genuinely get a kick out of it."
4,"Imagine the worst possible political debates (ignorant yet certain, assume anyone with different opinion is the 'other side'/bot/fox news viewer, personality cult, think that grand policies can happen immediately, conspiracy theories)."
5,"Chinese people aren't creative.

QED"
6,Bisexual vixen
7,"Him: When is winter?

Me: June to August (southern hemisphere)

Him: But when is the first day?

Me: the first if June

Him: That's ridiculous. It should start on the 16th of June or something

He was 30 🤦🏽‍♀️"
8,/r/unexpectedthanos
9,Trumps election.
10,Practicing...what? Do I want to know?
11,"Abortions. More than 100,000 occur each day, and they count for ~41% of all deaths. Don’t want a debate about it rn."
12,"Sure will keep one from bitching about lesser agitations though, that's the point at least. Nobody wants to raise a whiny little shit."
13,"I'm sorry, did you just assume your gender?"
14,"I still believe that air conditioners cause colds. Makes sense in my head, due to the sudden temp changes when going outside."
15,"And verse...?

Fuck yeah, I'm lazy. No way I'm going to do their job of proving their claims for them. They can provide the information or fuck off. No skin off my back."
16,Read up Larry Silverstein
17,"No, the 3rd world is just fucking terribly organised. Shit like that would never happen in a developed country. Even among developed countries, places like America seem rather disorderly and chaotic.

I'd say the most ""adult"" societies are Northern European ones."
18,"Never call a lady a girl. If she’s not a lady, there’s better words than girl..."
19,"“Israel just grew 10%”

We didn’t grow at all. We’ve had that land since 67’. Nothing changed except the United States recognized it. Israelis have been living there for 52 years already.

And yes, we are disproportionate but that has nothing to do with a conspiracy. Jews are just raised in a very strong community that has historically been forced to work as Bankers, Doctors, Merchants, w.e. Because no one allowed us to own land. However when capitalism took off, these roles became extremely powerful. 

Same could be said that Blacks, Mexicans, Muslims, Eastern-Europeans hold a disproportionate little amount of power given their population too."
20,Am I the only one not taking “the CIA feeds drugs into the Bay Area to lower banana prices” at face value?
21,"Maybe we have, and don't know it. Maybe their cities are under water or consumed by forests now. Hell, most of the Aztec empire is jungle now and we didn't even know it was there until recently. Same with ancient civilizations in India."
22,Fuck Lost.  That show was the biggest disapointment to watch live. They promised us it wasn't Purgatory for 6 years only for it to be essentially purgatory in different words.  Most annoying 6 years of my life.
23,God cause I was born into religion
24,"The double standard and hypocrisy of the left, which is in large the media."
25,"All criminals are black, since we're doing generalisations."
26,"But what fucking difference does it make? Cops in the USA are killing people for no reason and no one does anything, they're assaulting people and no one does anything, I feel for the OP, I really do, but it's just an insignificant speck in the grand scheme of things... nothing will happen

which, imo, is more fucked than it happening in the first place."
27,Lol and then you have Seal Team 6 outside your house the next night.  Oops you just got Gaddafi'd
28,Except it fucking doesn’t: https://www.nytimes.com/interactive/2016/12/10/business/media/pizzagate.html
29,Getting reddit gold/platinum. If any of you want to gild this post go ahead and I will describe the feeling to  you.
30,r/religion
31,"Did you even read his reply? The answer to all those question is no. It's a fucking random thing absolutely random that has no point in being suggested, especially with such timing. Devices are listening."
32,r/ElizabethWarren
33,Who gives a fuck. Damn snowflakes.
34,Lol.
35,Gay
36,"Impractical jokers is four, shitty, failed standup comedians who rock dad bods, and douche bag goatees, who think that invading peoples personal space is cool. Its like youtube ""pranks"" for middle aged, out of touch dillholes who have a set of trucknutz on their mid 90's Ranger. 

I know somebody that thinks its the best show ever and can't understand why his wife thinks he's stupid."
37,"I’ve seen plenty of worse shit, manbaby. I just didn’t let it turn me into a creep."
38,The thing people should know is SQUIRREL 🐿
39,"Do you want to get shot? Because that's how you get shot!

Assuming OP lives in the USA of course."
40,"&gt; cardinality 

We can intuitively tell this is false and a fault of our understanding of number systems.  Every number from 0-1 exists in 0-2.  Additional numbers exist 1-2 that do not exist 0-1."
41,F in the chat for 5 downvotes
42,HOpe you get to attend a bunch of funerals this year.
43,lol
44,how do you brown bag a joint? Do you mean a dutch wrap?
45,"I'm of the firm opinion that it's better not owning a weapon, if nothing else so there are just one weapon less around.. but with this, if I ever live in a state where they are more common, I might get a ccw without actually getting a gun."
46,How is it fucked up to spank your kid?
47,Cool dude did you get to like touch dead foxes and shit? You must be a cool 12 year old
48,Feeling guilt your whole life as perpetrator or not learning to forgive as the victim or sure ways to regress mentally and not be able to move forward. It's useless.
49,Eww
50,"Bring me your arm and lemme put this mystery crap in your blood. It only killed the last 5 people I tried, who knows, maybe you're the lucky one ;D"
51,"Okay so I can't point out that a lot of men have failed their families? I would have said the same thing if the majority of the posts were about evil mothers but they weren't. 

Are you one of those ""not all men"" ""all lives"" people who flip out at any sign of a generalisation?"
52,Someone already told me could you not.
53,I feel the need to fabricate events? Didn't you guys paint the Meuller report out to be a bombshell that was gonna tear down the presidency?
54,Traumatized by making birdhouses? Fuck you.
55,"It's the only way to truly move on, for both of them. You know I'm right."
56,"Exactly. And votes don't matter, as long as the truth is known."
57,You can definitely drink more
58,My mum had to have an abortion because of accutane
59,Didn't realize dad's are more than a paycheck
60,"This is the conclusion I've come to myself, as a layman. Now I'm expecting my first child and deciding whether or not to my child any vaccinations is turning into one of the most agonizing decisions of my life."
61,"cAn ADmIns gIvE fREe gOlD oR PlATinUm??1???1?111? AlwAyS hAd ThIs qUEStIon!!1!!1!


//ecks dee"
62,Probably stole someone else's username. Admins like u/bro are like cops they can do whatever the fuck they want. I'm probably gonna get banned for calling them out.
63,Anne Frankly I did Nazi that coming
64,Bruh moment
65,You did not just put Friends and Two and a Half Men on the same level
66,These days I don’t think parents need to pay for their kids education thankfully
67,holocaust
68,Stop editing to give thanks nobody rechecks comments smh
69,"Because usually, the people being racist are white towards other races"
70,This is one of the most retarded things I have ever read
71,That’s just blatantly false. Soft sciences and liberal arts are taught by people who are pushing an agenda. The fact that you even said that shows that you are just believing what some irrelevant newscaster or teacher told you.
72,"Yeah I mean I agree that he is definitely important to her, but I just felt the ""daddy"" line was a bit forced"
73,"A lot of /r/iamverysmart people defending the ending saying only the very intelligent could ever appreciate the genius of the ending, apparently."
74,Only half the people I know joined the service to pay for school the other half wanted to kill/have sex with brown people.
75,Npwl I sknt hate livesral but Left politic givesmore money in schaols
76,"I will provide evidence if this gets attention. But a few I believe in are: JFK was more than reported, Something shady there. 9/11 was shady, I dont believe it was purely government but I do think they had a part. Obama wasn't born In the US(this one is just fact not really conspiracy) and some shit surrounding the moon landing is fake. I think the original moon landing was real, but I do think some thing the us GOVT said wasn't real"
77,Yeah but that last midterm was like a week or two after some right winger shot up a Synagogue.
78,"Holocaust contains numerous lies.

Here are a few key reasons why:

1. Only ""death camps"" were found outside Germany and were coincidentally liberated by the Soviets. All camps liberated by Americans had no ""gas chambers"". Why wouldn't Germans have these camps in their own country?

2. The logistics are scientifically impossible. It is literally impossible to cremate thousands of bodies a day with the technology they had back then, even the cremation tech today couldn't pull it off. Aside from that, if you look at the ""gas chamber"" doors, they were made of wood and had large gaps underneath. Zylkon b is an extremely toxic substance and if it was released without an airtight seal it would have killed every other person inside the buildings.

3.  The facilities had leisure activities and even medical care on site. You can even see the remnants of swimming pools etc. at the camps today. The prisoners were also allowed to participate in things like theatre, and were served beer. There are countless videos on YouTube of real survivors stating these things.

4. Hitler literally signed an agreement allowing Jews to be transferred to Israel. Seems odd that a man so hell bent on extermination would allow this, no?

5. The actual German military had several Jewish officers in it. Google it.

6. Many fabrications about the holocaust have already been debunked quite thoroughly, such as the lamps made of human skin. The official number has also be revised several times.

7. Jews weren't the only ones put in work camps. The populations of the camps contained gypsies and many other non-jews.

8. No plans found. The Nazis were extremely thorough in regards to documentation and what their plans were. They were meticulous in every other aspect, yet we are supposed to accept that an extremely complex and dangerous process was merely carried out by word of mouth? Right.

So now you might be thinking, ""wow this guy is a Nazi"" or ""I can't believe you think that Auschwitz is fake"". Well, the Germans most definitely put jews in camps. I merely refuse to believe that they were systematically exterminated. They died of starvation due to allies bombing supply lines, as well as typhus. Typhus was the reason their clothing and hair were removed, and was the reasourn zyklon b was used to delouse said clothing. This is why we can find traces of zyklon b in the camps.

Of course, this post will be met with ad hominem attacks or be removed entirely, which will simply just strengthen by beliefs."
79,"I don't believe, I know."
80,We know of\* nothing else that will do. Pretty big statement to say nothing in the universe might share characteristics of glass.
81,"I believe in the pizzagate conspiracy i strongly believe that there is a worldwide elite pedophile ring and has satanic undertones, wikileaks letters from podesta and obama and Hillary clinton talking about cheese pizza and all that stuff. I believe the pizza parlor comet pizza has alot to do with it."
82,"Maybe they have but just not in a form we can understand. 


(oh I like this topic!!  😁)"
83,"I would probably commit suicide in a week if I had to live life the way you think it should be lived.

For me, it’s essential to be away from people - from their stenchy horrific perfume smells, from their annoying voices, from the music they force onto you 24/7 (and wouldn’t the world be so much nicer if music had never been invented and we could live in SILENCE?) - and by myself to really feel human. I am incapable of understanding how a relationship can be “meaningful” when you have to grit your teeth to be in the same room as someone else for an hour.

As for “experiences”, if you mean travel? Fuck you. Travel is horror on top of horror on top of horror. Leave me alone in a comfortable apartment with nobody to bother me and let me get on to really, truly living!"
84,These comments reveal a scary truth about our public safety officers...
85,What is with the shaming of people who are in long term relationships for wanting to have sex that is going on here??
86,"It can't be that fucking hard. Outward has a crew of 10 people or some shit and yet, they managed online and split screen coop for an RPG. All anyone wanted at the very least was coop tacked on halo 1 style. But no. Had to make a whole game based around micro transactions. I used to be a Bethesda shill. Now I can't stand them."
87,"Boy, he clearly did his research 🙄"
88,"Ooh, our weekly dose of copaganda.  How’d they fuck up this weekend?"
89,"Holy shit, a whole decade and no violent crime even commited. Justice system is fucked."
90,Not a misconception. It's unhealthy because the body needs meats and proteins. Humans are omnivores not herbivores. Quit being delusional!
91,Gehjenthsiji8juiuuehhjiujnwiueurishfbrudurjnr.    Eirjrjjrieieje.  Ueejenenen. Ejjdjendnnrjej
92,"Thanks Mr Reddit psychologist lmao how pathetic is your life that you think you can weigh in with any meaningful comment whatsoever because someone upset you? 

I’d imagine pretty sadly pathetic."
93,Have they ruled out Lou Gehrigs?
94,...yeah I'm not sure you understood what the conversation was about.  No one is talking about mental illness or professional help.
95,The feminism i have seen today to be honest is pure crap.i have seen far more feminazis than true feminists. I feel like slapping across the face women who call themselves feminists yet refuse to do certain things because they are convinently a mans job.beware i am a pacifist and i believe in equal oportunity for men and women.
96,#F
97,"The only wet towel here is you. Cisman didn't need to be brought up in the first place since it could be advice for any man. No matter what fairytale you want to personify, if you got a dick and a bleeding ass, heres your advice. Take your hissyfit to some depression riddled corner of the internet where someone will care."
98,u/slaem36 I reported your comment. I urge everyone else to do the same.
99,"When have they ever ""taught"" personal hygiene. Your parents show you that."
100,"I believe you're the one who doesn't ""get it"" otherwise you wouldn't be so visibly angry. That shit gets me hard, keep going slut."
101,Hating ANYONE.
102,American guys are pigs.
103,Fucking claptrap.
104,Never stop being original mate.
105,Yall people make me sick
106,"Anti Vaxers, most republicans."
107,No there’s not..
108,Black people 😡
109,"Yeah, I'd love to date a guy who would literally kill for me."
110,Empathy
111,"She was a normal kid in high school but I was her friend not her parent. She was larger than the other students by atleast a few feet. Before everything happened one could say we had perfect lifes. The summers were hot, the winters mild and everyone was involved in the community. Many a nights were spent at her house by the firepit with a cold one in my hands. 

That was until see started looking into Criptids and Folk lore. Sophomore year I think it was when she claimed the first one. Of course none of us knew what she had become.

That was until she reached out to me tired, broken, and hopeless. Telling me she needs about tree fiddy then I saw the monster she became."
112,I'll take that over the disinformation campaign that is Fox.
113,90%+ pedophiles never act on their urges. I think he's saying why force therapy on people who are already managing just fine.
114,I don't know a definition just wanted to reply to something
115,"&gt; No amount of trauma or daddy issues is going to make you put someone through the kind of misery he inflicted upon his child's mother.

Do you have a source for this claim? How could you know the extent of what trauma could and could not prompt you to do?

And before the accusation comes, no, this is not to excuse his behavior. ""This was not caused by mental illness"" is a very specific and bold claim to make, however."
116,Not really the point but okay
117,Low-rise jeans. They were a travesty best left in the 90s
118,"""Easter worshippers"" Isn't saying that they worship Easter, it's saying they were worshiping in church on Easter, it's a common turn of phrase. If someone was at a Christmas service, they would have been called Christmas worshipers."
119,"Okay fine, I understand your point and will edit my post"
120,Shut up
121,/rsubsifellfor
122,"Yes yes, separate parents from their children! Excellent plan!"
123,I think the minimum age to fuck children in Australia should be lower than twelve
124,"I agree. It's XX and XY.

You can't turn XX into XY."
125,"Arya Stark is a fictional character, and I'm autistic."
126,"Jesus christ man, go fuck yourself"
127,I go to a big SEC school and the only time I do anything remotely against somebody’s car is if a fan of a rival has their car decked out in their schools stuff parked in the area where most students live off campus and it’s during a week we aren’t playing them. At that point I will take the sticker or flag that they have on their car off and throw it in the nearest trash can
128,Are you suggesting Holtzclaw is the blueprint for cops? Plenty of decent cops out there
129,Fuck all pigs
130,i love efficient callouts
131,"why none of you can pronounce the word ""bald"" or the name ""craig""

or ""herbs"" for that matter"
132,"This is entrapment and it would get thrown out.

Note: If the cop gives you drugs and say they are drugs, it's not entrapment, you are just stupid."
133,I will never understand why it’s the governments right to fine me for my own stupidity. I’m not endangering anybody else but me.
134,I didn’t realize I was promoting not wearing a seatbelt. That’s actually why I didn’t mention it’s happened to her twice. She needs to stop getting t boned and maybe wear her seatbelt. If she would have taken 2 seconds to put it on she might have been 2 seconds away from an accident instead of in one.
