,text
175,"He moved into my house. In fact, a lot of stuff hasn’t been unpacked, so hopefully he’ll be able to move out quickly. I’m totally in shock right now, and of course struggling with a little bit of denial, but I know deep down it won’t be worth it to stay with a cheater. Someone who could cheat and lie for months all while deciding to make the commitment of moving in together. "
176,"I didn’t leave a guy at the altar but I did break off an engagement. Feel free to discount this story, since it doesn’t qualify. It’s also long.

We had been together for over four years and the wedding was being planned. I felt a very strong connection to him, but he had peter pan syndrome really bad and it was looking like my future was going to be very bleak. He dropped out of school (but so did I, so I couldn’t judge) and had trouble keeping a job. He managed to always afford his WoW subscription (before it was free) and played for hours every day. I played, too, but it was just a game and low on my priorities. More and more things began to be like that - a high priority for me was low for him, and vice versa. I was cleaning, cooking, paying the bills, doing all of our laundry, caring for our cat and dog, doing all of the dog training only to have him undo a lot of it...I started taking my engagement ring off before I even realized I was *really* jaded. I was burnt out. I stopped trying to have a sex life and he stopped initiating and we didn’t have sex for over two months, despite being healthy people in our early 20s. I was also dealing with our alcoholic roommate, whom we wouldn’t have needed to help pay the rent if my fiancee had been able to keep a job.

I won’t lie, another guy came into the picture and that had a great influence on my circumstances. I had very low self-esteem and didn’t think I could do much better than my fiancee until a new guy got hired at work and took an interest in me. We began a friendship and nothing happened that was more than just friends hanging out, but it was clear that this guy who was kind and interesting (and had a job, a car, and a college degree) actually liked me. It helped me realize that I could do better than my fiancee, so I had several long conversations with my fiancee about our status. I gave him some ultimatums for an upcoming trip, and I think I already knew he would fail at that point but hadn’t accepted it. During the trip to go to my mom’s wedding, at which my fiancee told anyone who would listen about our upcoming nuptials, I continued to have heartfelt conversations with my new friend via text while my fiancee basically mooched off of my mom for a week (she had to buy him clothes to wear to the wedding because he didn’t have the money). After returning home, my fiancee and I discussed how he did not do a single thing I requested (things like pack his own clothes for the trip) so I put my ring (which had been my mom’s, since my fiancee actually couldn’t afford one, and had gotten help from my mom on that, too) in my lockbox and told my fiancee we were on a break until further notice. I then drove to my new friend’s house and we fucked our brains out. It was the best sex I’d ever had to date, and I spent every night after that with that guy while I worked out the break-up. My (ex)fiancee found out about my new beau and went out and revenge-fucked some girl from the club, and that was that. We disentangled our lives over the next three months, and now I am married to the other guy. We just celebrated our four-year anniversary and we have one child together and I am really, really happy, despite many struggles we have had. The sex is still mind-blowing, but more importantly, we are growing and becoming better people together. My ex moved on but apparently never changed his lifestyle, so I feel good about my decision."
177,"The abortion. I think the cheating wasn’t as much of a big deal somehow because often those listed as missing were dead, so that was often the assumption when you got a telegram that your husband was missing. My colleague’s grandfather was listed as missing, and came home after the war (he’d been a POW it turned out) to find that his wife had remarried and had another kid!"
178,I'm the first in my family to not be pregnant or married by 19
179,"As a guy I can say that when it comes to talking about feelings it is way less looked down on once you get past your early 20s.  Once you hit your 30s most of guy talk becomes a lot of taking care of yourself, shared hobbies, chicks, more taking care of yourself, and how our bodies have changed in the last decade.  "
180,I once overheard a mom chastise her toddler for only behaving during the holiday season. This was in January. She told him Santa was watching him all year round.
181,"It’s my preferred way to sleep, unless I’m cold or on my period. I’m sure I read somewhere sleeping nude/being comfortable with being nude in generally helps with confidence, but that could be coincidence."
182,"A week or so. I switch bras but since they’re black unless they smell, they don’t get washed until laundry day which is once a week "
183,[deleted]
184,"Dad bods are in, mom bods aren’t a thing. "
185,"After my grandpa died, found out that he and my grandma would have a glass of champagne together every night. Apparently there was always an open bottle in the fridge with a spoon in it. I have no idea how I missed it.

When my dad's mom died, we found a bunch of birth certificates listing great grandparents AND grandparents as negro. We're white but we always suspected at least my great-gma was black. Turns out everyone was black."
186,"Short answer - yes.

Long answer - if there is anything else you could imagine doing and being happy, do that. I'm a 4th year med student applying for residency right now and I've honestly never once regretted choosing this path. Part of that may be due to the fact that I've wanted to be a doctor since I was a little kid and I mentally prepared myself for a long, difficult education. I had such terrible expectations (4 years confined to the library/hospital, never getting to see friends or go to family events) that the reality of medical school wasn't so bad. I work very hard, use my time well and don't get much sleep but I rarely miss out on things that are truly important to me. Don't get me wrong, there are many times in the past three years that I've felt isolated and stretched unbelievably thin but I've always known that I'd make it through. My support system has been the difference maker in that. I'm close with my parents who live nearby and I have a (non-medical student) SO who I live with. They are extremely supportive and all have their own way of helping me handle the stress and pressure of med school. 

My advice to anyone considering a career in medicine is to get as much exposure to different careers in the medical field as possible. Know exactly why you want to be a doctor vs. nurse/NP vs. PA. They are all vital parts of healthcare but with very different roles and responsibilities. Ultimately, I feel very excited about my future as a doctor and the opportunity to save lives and create positive change in the world. 

I'd be happy to answer any questions or clarify anything I wrote. "
187,"Wearing the same outfit EVERY day in a professional setting. Like seriously there are so many men who have 1 or 2 suits and that's perfectly fine. There are even newscasters who wear THE SAME suit EVERY day. Even Prince Harry I think basically has one suit he wears all the time, or if he has more than one they look pretty similar."
188,The oreos have gone stale. 
189,"My grandmother just passed away. I didn't really know what she did for work because she was always ""grandma"" and I didn't associate her with having a job when I was a kid, lol. Turns out, she did laundry service for the hospital. Not overly exciting in and of itself, but apparently it was one of the best paid positions at the time - and government, too! Dollar for dollar she made a touch more than what that position currently pays! I couldn't imagine what $21/h in the 50's would equal out today.

She also has a son no one knew about back home."
190,Not too bad. I had made sure he was good and moved in to the state I was supposed to meet him in to get married so it took him 6 months to be able to move again. He did call all my friends and family non stop until I finally got on the phone and told him I never wanted to be with him again. Then he tried sending me a bunch of letters (this was before email and text messages) to my parents house. I gave them permission to read them and then throw them away in case any contained important information I needed. They said it was just a bunch of manipulative BS. 
191,"I used to work for an estate sale company where we would go in and do all the digging &amp; dirty work for the family then sell valuable items for them. One of our crews was assigned to a house that had clear directions: Do Not Go In The Basement

Our manager is required to check every room of a house, including those that are banned, for safety issues - cuz what if there was a meth lab or black mold covering a room. Well, she later told us what was in the basement... a full blown BDSM den. "
192,"My son's birth was long and very rough, but afterwards the small things made all the difference.

Like having my own bodywash and shampoo. And a mug to have tea in instead of the Styrofoam cups from the hospital. Warm socks and a robe, so I didn't have to wear a hospital gown."
193,[deleted]
194,That's so sad. I'm sorry for your dad. Did you/he ever find out why?
195,"this has happened twice for me and both times, i think it was just a shift to *oh, i actually quite like you*. wasn't a moment or anything either of us did, just the fluttering of butterflies or seeing each other in a different light; people would comment about the two of us and our ""energy"" together (my best friend still doesn't believe i never liked him from the beginning, she thinks i was in denial). or in the case of the first, even thought we were a couple when we were just really close. it didn't even hit me when we'd spent a whole summer day hanging out up to the earliest hours in the morning, laying head-to-head on the grass looking up at sky, just talking. it was just one day, i saw them differently.

edit:  decided to illustrate head-to-head since i figured it made no sense how i'd written it lol so here. &gt;--o o--&lt;

edit 2: we have arms now! thank you u/CrUsTyMuFfIn123 for giving more-than-friend-feeling me arms \&gt;-|o o|-&lt; "
196,Don't care. Just cut your goddamn toe nails. 
197,Holy crap. That is a smart woman. I’m sure it was very hard for her to make that decision at that moment. 
198,"Really enjoy a magical or precocious girl child in the 9-11 range. Think Matilda, Harriet the Spy, Lyra from His Dark Materials, the main character in Donna Tartt’s The Little Friend, Chihiro of Spirited Away.

I think it’s because that’s how I felt at that age—kind of magical. I think I lived in my own inner universe where I did feel wild and powerful, far away from the rest of the world, like I might be capable of anything. Also adults started to treat me with more respect, but I also still had moments of not being great at distinguishing fantasy from reality. I’ve never really felt that way since—dropping off into puberty was such a bummer—so I love a book that hypes the expansiveness of girlhood. I also enjoyed reading Swamplandia, even though the book turns that trope right on its head."
199,[removed]
200,"If me not responding as quick as they would like to a message or text causes them to send passive or outright aggressive followup messages.

Im an adult who is sometimes off doing things. I turn my phone off at the theater. I dont check it when Im out with family/friends. Maybe Im engrossed in a video game or book. If you cant wait even an *hour* without sending me something passive aggressive... big nope.

And I even do the ""nice"" thing by saying Im going to be busy for a couple hours. Still not good enough."
201,"Yep, people say men age better than women, but really its just that men are criticized less for aging. A woman shows one sign of aging and ""her beauty is fading"" whereas men like George Clooney show obvious signs of aging and are considered just as attractive. "
202,"Yeah I'm glad I never have to worry about squishing the 2 things between my legs.

Edit: Yes, I am aware they are not directly between the legs. You would not be able to walk otherwise."
203,"1.  The first year is deceptively easy.
2.  You can not judge if a field is for you by 100 level classes
3.  It is okay to take fewer classes and do better at them, nobody will care that you finished college a year or two later.
"
204,"I ended a relationship when my ex-boyfriend cheated, but then got back together with him after a little while. It was absolutely not worth it. He was genuinely remorseful and never cheated again, but he still treated me badly in a lot of other ways, compared me to other girls a lot, and made me believe that his infidelity was my fault. If someone disrespects you in one way, they will disrespect you in others."
205,"I think these tips are great, especially making yourself busy! But, I just wanted to say that if someone finds you too clingy then maybe they aren't the right one for you. I tend to find people who say their SO is ""clingy"" isn't because theres a problem with their SO, but a problem with themselves (they are immature, they're not ready for an exclusive relationship, they are bored with the relationship, etc). "
206,"Awww I was babysitting and the little guy used the toilet and washed his hands, and I made a big deal about it because he was just starting potty training. I said ""I'm so proud of you!"" Later I went to the bathroom and when I came out he goes, ""I'm so PROUD of you!!!"" Lol it was too cute  "
207,"Oh wow, I hope that guy stays the fuck away from actual trans people if that's how he treats people he thinks are trans. "
208,"A Niceguy^^Tm was nice to me in high school. He was my friend and we hung out among other friends and borrowed books and video games from each other. We watched movies together and played PnP RPGs together with the group and he even came to my HS graduation(I was a year behind the rest of my friend group) even though he had moved a state away by that time.

Later, after I was getting ready to join the military, he came to me and confessed his eternal love and that I should move to OK to be with him. I told him no and I had already signed up to join the military and he blew up at me.

He told me that he had ""wasted all that time with me"" and ""how ungrateful I was"". I was so surprised. I thought we had actually been friends. Apparently not.

A few years later, he sent me an invitation to his wedding as part of his wedding party and asked me to be a ""groomslady"". I never responded.

"
209,"First lawyer.

First to be in a same sex marraige.

First to leave Florida permanently.

First woman to graduate college.

First to get a tattoo.

"
210,He thinks he should be able to hook up if he’s out of town. I don’t think so. We broke up. It’s all good now. 
211,"I was getting my kids ready for school when I noticed my son putting on his old worn out shoes (he was an avid skater so there were actual holes in them). Upon asking where all of his new shoes went, he says ""I gave them to the new kid in my class because people were making fun of his"". He said it like it was just a normal thing that everyone does. I knew at that moment that he was a very special human. He's 20 now and about to go to Airborne School, then to Army Ranger School.  I'm not surprised he's given his future to serve others. "
212,My clingy cat won't stop scream-meowing at me and I have a bad headache. I locked her out of my bedroom so now she's jamming her mouth under the door and meowing at me that way.
213,"Line full of drunken, Southern concert goers discussing under what conditions they would kick Bon Jovi ""out the bed."" For most, there were NO circumstances where they would do this, but some drew the line at short hair. "
214,"When my son was three I took the training wheels off of his little bicycle so I could teach him to balance it. When I turned to put away the training wheels, he jumped on his bike, wobbled out of the garage, rolled down the driveway, turned left onto the sidewalk and was gone. I didn't even have time to slap a helmet on him. "
215,"I've been doing lots of projects out in my yard and my neighbor's 6 year old girl loves coming to the fence and talking to me while I work. I can tell she just wants to talk to someone who won't be annoyed with her, I hear her mom yelling and dismissing her constantly.

 She just tells me about her favorite animals and her friend's birthday party, how her cat had kittens, etc. But it makes me a little uncomfortable, and I worry that her parents or other neighbors might think something is up. I know how people are any time a grown man interacts with a little girl, no matter how wrong they are, I don't want anyone thinking about me like that."
216,[deleted]
217,"No more casual hunting camo.  Save that shit for the woods, this is a city."
218,Body hair. Wrinkles. Dad bod. Baldness. Lack of body grooming. Lack of skin care. Grey hair. 
219,"I stopped doing that because of this exact reason. Even when I have my own kid with me and I see a baby or another kid looking at us, I smile at them but the looks I get from the parents...ugh."
220,"Hahaha. Once when I was potty training age I shouted to my mom who was coming back from the bathroom at an airport ""Mom did you go number 1 or number 2?"" I've been told she just kept walking down the terminal and didn't acknowledge it."
221,My son battled leukemia twice! He is now 22 and healthy....pretty bad ass to me :) 🤷🏽‍♀️
222,"I hate to say it, but I'm getting increasingly impatient with them.

9 times out of 10, they're asking the same question that's been asked 85,000 times before.

The other 1 time, they're asking a Q that is so specific and hinges on one person's preferences, that it's impossible for us internet strangers to answer."
223,"Body image and shaming.

I know that it's generally more of a woman issue that you have to look a certain way to be beautiful (up until a few years ago it was the stick thin look of models) but I think that lately there's a lot of talk about this and a wider range of body types became acceptable. Magazines and advertising are frequently criticised for using models with unrealistic bodies.

Meanwhile men's magazines and ads keep telling men that they're not real men without six pack abs, biceps larger than women's thighs and a body fat percentage over 5. And for some reason nobody is talking about that. Seems a bit unfair. "
224,"Yo, I would’ve gave up way before you lol"
225,my daughter is three and is my bathroom buddy at home still. STILL. can confirm this happens every month. 
226,I didn't consider my feelings for my male friend to be anything more than platonic. Until another friend asked me how I'd feel if he told me he was interested in someone else. Which I realized wouldn't sit well with me and so the wheels to us becoming more than friends were set in motion.
227,"Amazon Prime Next  Day delivery not arriving on the next day.   


I ordered a few things for a friend's wedding last minute and needed them to arrive yesterday. Delivery didn't arrive so now I'm just praying it arrives in the next few hours before I have to leave. "
228,Being expected to make the first move. I've never been the asker-outer and the thought of it stresses me out.
229,"I recently went to my first professional conference, and as an introvert with mild social anxiety, I was a deer in the headlights. I realized that being a young female in this instance worked to my advantage. The older men treated me like their daughter and would be helpful and welcoming and the women were being supportive. I couldn't help but feel that if I were male that the help and support I got just wouldn't have been there. I would have been on my own, as I feel like an overwhelmed 28 yo male with social anxiety is looked upon very differently than a 28 yo female. 

ETA: spelling"
230,"when my son was about 3 he was attacked by a big mutha of a Male goose.
he screamed at it and then grabbed its beak. and held on tight until we came and saved him about 30 seconds later. 
this thing was still flapping its wings and shaking trying to get loose and attack him again. "
231,*clap clap clap clap*
232,"No parents, **even if the child is older or an adult**.

I feel that it's less justifiable than saying I don't want someone who wants kids. It also seems unfair to exclude an entire demographic based on a decision they made far before meeting me.

But I really don't want kids in my life, even if they're older. I don't want to have to deal with my partner being a parent. I don't want to have to deal with being seen as a step-parent.

And adult children go on to have their own children, and grandparents hang out with grandbabies a lot."
233,"Wow- I feel like this story struck me the most. To be raped, in front of your children no less, and to survive that. Then she lost her life to being murdered. "
234,"I felt ridiculous.  The makeover didn't take my personal style or preferences into account at all, and I felt socially pressured to pretend that I was happy with a ""new look"" that made me look like a middle aged yuppie mom."
235,"We were both 24, and we were both virgins and well...  it was our first... DIVORCE.  "
236,"I love how almost all the characters in Studio Ghibli films have strong female characters (Totoro, Spirited Away, Princess Mononoke, Kiki’s Delivery Service). I love this quote from him:

“Many of my movies have strong female leads- brave, self-sufficient girls that don't think twice about fighting for what they believe with all their heart. They'll need a friend, or a supporter, but never a savior. Any woman is just as capable of being a hero as any man.” - Hayao Miyazaki"
237,"I'm that silver-haired retiree (63F) who wears Birkenstocks and drives a Prius C, shops the farmer's markets, and always takes a canvas bag to the grocery or liquor store.  

Life is good.  I love my life.  "
238,"Not at the altar  but, my friend  was dating this woman and they had  planned the wedding a week before the  weding she canceled everything without explaining him anything.  Two months later she married another man. 

Edit: weeding to weding..."
239,"This is where you say, ""Oh don't mind me... just keep on keepin' on..."", then sit in the stall next to hem and hum Celine Dion tunes until they leave."
240,"The way I stopped being ""clingy"" was to stop thinking about it in those terms. Someone who likes/loves me isn't going to be upset I want to spend time with them. If one of us needs more time apart, that's just what we need and isn't a flaw in the other person. Just as if one of us needs more time together, that's what we need and it's not a flaw in the other person either. It's a thing to be communicated about and negotiated so that we both get what we need from our relationship, and if we are unable to find a way to meet both our needs, then we should break up. It still doesn't reflect a flaw in either person, just an incompatibility. 

I very very strongly believe that if you're having to keep busy to avoid scaring away a person you're dating, that person doesn't like you as much as you like them. If it continues more than a few weeks it's probably time to move on. People love to be appreciated, especially by those they admire and value the opinion of. 

On the other hand, if you find that EVERYONE you date finds you too clingy, then maybe you might need some therapy to find out why it keeps happening. Because if everyone thinks you're too clingy, then you either keep dating people who don't want to be around you, or you are unable to negotiate and respect boundaries. Either one is an issue. "
241,"I wish no one ever had to have one, that birth control never fails, that there is no rape, no abusive homes, no people so poor they would be unable to feed another mouth, no diseases which cause the child to be so ill it would never survive life outside the womb, and so on.

But sadly we don’t live in that world, and therefore it needs to be legally and safely available. "
242,I probably wear them 2-3 times before washing them. Sports bras get washed immediately after wearing 
243,"I knew he was cheating, but he hadn't admitted it and I didn't have concrete proof that he'd actually done it, just that he tried to/had the intentions of cheating (now, I consider this enough... wanting to cheat is cheating, end of story). 

I tried to ignore my gut feeling and the evidence that I *did* have, and then I caught him out with his friends when he said he was sleeping. I blew a gasket and lost my shit, not because of the friends, but because of the nonstop lying and manipulation. This just happened to be the straw that broke this camel's back, lol. 

We broke up and it was revealed a day or two afterwards that he'd been sleeping with his ex (and probably others) for awhile. 

He married the ex he'd cheated on me with a few months later, and a year after they got married, they divorced because she slept with his best friend (hi karma). "
244,"I’m a native Spanish speaker and Argentinian and Uruguayan accents are just ❤️ it’s just such a different way of speaking from ours.

In English I find southern accents very charming, specially in women. I like Australian accents a lot too, but I don’t understand about 95% of what they’re saying"
