,text
245,I totally agree but lol isn’t it sad that the standard for being good in bed for men is basically “don’t be a selfish tool” because it’s so common? Yikes.
246,"The expectation that if something needs fixing in a group scenario, you’ll be the one to handle it. Like if you’re camping and the hammock needs hanging, or the tire needs changing during a road trip. 

Of course women can and do fix these things themselves, but the expectation is still that men do it as the default. I am no good at fixing anything. I’m glad when I do, it’s a welcome surprise. "
247,"I don't think it's specific to men, but everyone should wear clothing that fits. No matter your size, you will ALWAYS look better in clothing that is your size. Even if that size is a XXXL, you're going to look infinitely better in a XXXL shirt than trying to squeeze into an XL because you're in denial or going for 4X because you're embarrassed about your size and you think it will hide it."
248,"Together at 16, kid 1 at 17 kid 2 at 20 married at 23 separated at 25 and hopefully divorced by 30 

I think at those ages you don't even know who you are yet let alone ready for a serious long term commitment like marriage or kids 

Edit: should add am not in USA so 16 is perfectly legal here"
249,Reading people and anticipating what they want. 
250,Someone told me they liked my shoes 2 years ago.  Still riding the high from that one.
251,"I think both sexes are being pressured to self-sacrifice.

Men sacrifice their humanity, their ability to open up about and connect with their emotions. Men sacrifice anything related to a weaker masculinity.

Women sacrifice their individuality, to juggle the multiplicity of roles that are sold to us. Woman, mother, caretaker, planner/organizer, career girl, sexy babe. 

"
252,"In a bathroom in a college town bar, I heard a girl talking about a guy she liked she was going to “brand him with her menstrual blood” "
253,He stole the ice sculpture from the company holiday party. 
254,"See what makes them react and keep doing that. Then when they stop reacting to it as much switch to something else. 
And for gods’ sake, if they say “don’t stop!” then keep doing exactly what you’re doing. Don’t change the pace, the rhythm, don’t change whatever it is. Then if they stop having the same level of excitement over it, only then do you change it up.
That’s pretty much it. There is no one thing that works the same for every woman.
"
255,Wow I hate this image 
256,"Bad teeth.

I feel awful about it because it's not just the normal ""no bad hygiene"" and I know dental care, especially cosmetic dental care, can be cost-prohibitive to a lot of people and they may not be able to help it. It's not their fault. I just can't deal with severely crooked teeth, it really bothers me. I'm an asshole. :/"
257,Did you save them??
258,"I'm a guy but I have a story I'd like to share. When I was a kid a had that one great aunt. You know the kind. She would hug you and coddle all the kids in the extended family. Always giving small gifts that you accepted and thanked her for but they weren't really what you liked to play with so it was a little weird. She just really loved me and all my cousins.

At her funeral it all became clear why she was so over the top with all of us. When she was younger she and her husband really wanted children but life dealt them a bad hand. She had been through 15+ pregnancies, none of which she was able to carry successfully to term. This was in the fifties before science had advanced to help them. Me, my sister, and all our cousins were floored, not having known this all our childhood. It explained everything, and it was heartbreaking. The strength and sheer willpower with which she must have desired a child ... incredible.

Yall women amaze me."
259,"As an Irish person, waking up to a thread about people liking our accents makes me very happy 😂"
260,"“Oh my god, there’s a little boy in there!”

I was the little boy.  I had to go so bad I didn’t look at the door sign, jammed into a stall and got to business.  Didn’t note the conspicuous lack of urinals.  I wanted to disappear down the toilet like my pooz."
261,"The fear is the worst part.  I was out with my daughter (she was four) eating lunch while we were out running around one day.  She said she had to pee so, not thinking anything of it, I took her to the bathroom.  

Barely had her on the toilet when a security guard busted in yelling for me to get away from her.  Someone called security because they same me take her into the bathroom and her screaming and crying ""daddy"" wasn't enough for the guy and he called the cops while trying to get between her and me.  

Dude kept trying to get in between us and pushing me away from her until I lost my shit.  I'm a big dude too (6'3 and 230) and as soon as I realized what he was doing I started yelling for help because I honestly thought he was trying to take her.  Cops were no help either.  I got cuffed and held until they could verify with my Ex wife (who isn't even allowed to see my daughter) that the papers I had weren't forged. 

So thanks to random person I was almost arrested for having my daughter not piss her pants.  I got an apology letter from the mall we were in and was told I was lucky no one pressed charges.  I have panic attacks now when I have to take her out in public.  "
262,"Tincels 

Oh no "
263,"Except for living in the weather equivalent of the 9th circle of hell, I'm also having a massive breakout. My period's about to start and I just started using the Pixi Glow Tonic, which has led to something called ""the Purge"" (thanks to /r/SkincareAddiction for teaching me that!) And I can't use makeup to cover it, because I'm not fooling anyone, so I'm just...full goblin right now. Sweaty, spotty, bloated, my hair is shit.   


And I've also got a massive breakout on my fucking thighs???? HOW? WHY? "
264,"I probably wouldn't date a man who is involved in sex industry - not only necessarily as a perfomer, but also if he's working in management/production."
265,You’re supposed to wash your bras?
266,"- blasé attitude towards other women in general, but *you’re* somehow special and unique.
- poor little me stories about his previous relationships.
- been out of a relationship for less then 6 months but super into you already.
- obviously checks out other women in front of you.
- when they cross a boundary or make you uncomfortable, you communicate it and they don’t respect it.
- drink too much on a first date. 
- over familiar touching on a first date.
- and when you get to the fun stuff! *You* have to remind him to wear a condom because lover boy here hasn’t heard of chlamydia. Probably couldn’t spell it either.
- puts down your interests or aspects of your personality/ appearance.

I’m sure I could think of more."
267,"* Guys who don't drink or drink rarely. I'm in the wine and spirits industry so drinking is a huge part of my life and one of my greatest passions and I want to be able to share it with a SO.

* Guys who are on a strict diet or who aren't adventurous eaters.

* It's never come up yet but I don't know how I'd feel about dating someone with the same name as my most serious ex. I'd get over it I'm sure but it's a little weird."
268,"Their percent compatibility with me. 

I want to be able to hunt down future dates and bffs."
269,"I was in a school bathroom when I heard one person say ""You can only have good food or good sex for the rest of your life. What would you pick?"" and her friend instantly replies with ""Damn I'm really gonna miss burritos."""
270,"My grandma passed away a couple years ago, in her mid 80s. Her husband, my grandfather, passed away 25+ years before her. In going through her things, we found that she had kept his wallet, with all its contents, in her nightstand all those years. She had never remarried or even considered it - he was the only one for her. "
271,You can't stop me from laughing at something that's legitimately funny 
272,"My thoughts exactly. Men are pressured to sacrifice in the form of feeling pressured to provide for their family to their point their mental health often suffers, because they are overworked or truly hate the job, or what have you. And they are expected to do all of this without having any negative feelings about it at all. If they struggle with anxiety or depression, they are expected to just pretend it doesn't exist, because any mental health issues are seen as a flaw or weak in men. 

Women are made to sacrifice in that (for the most part) they are often the default child minder, so their careers don't progress as quickly, or they stall, or it even backtracks because it makes more sense for them to be a stay at home parent for the time being, and now while dad's career is blossoming and growing, mom's is set back because her first priority is her kids. Women are pressured to make their entire identity their children, and if they try to have a life or hobbies outside of their kids, they're made to feel selfish. 

There are lots of other ways that both sexes make sacrifices, with varying levels of intensity, but I think both have their problems. Thankfully I think the stigma around mental health (even for men) is starting to go away, and women are being encouraged more not to halt their whole lives and to take care of themselves too, but it's probably going to be an issue for a long long time still."
273,"I did save them! They both seemed grateful, it was quite hard to contain my laughter honestly "
274,"I looked at your post history and I'm sorry, but your jobs a joke, you're broke, your love life's DOA."
275,"That I was an introvert, and therefore would not enjoy dorm life. 

That the value of going to university is actually the networking. 

...Don’t have a third one. 
"
276,"I was having a rough night because I had an important phone interview the next morning. I was afraid to fall asleep because I know that when I'm stressed I have horrible nightmares and flashbacks. So I asked him to sit on the floor of our living room with me and started to fall asleep on his shoulder. He asked me what was going on and after explaining my situation he invited me to sleep in his bed that night so I wouldn't have to be alone. He respectfully slept as close to the wall as possible so as to not touch me (hard to do on a double bed, haha). Next morning, the interviewer never calls and I'm in a full panic because I fear that I'll never get a job. He came and gave me the closest and warmest hug as I sobbed in the kitchen. This was our first time touching (intentionally) and I just felt so safe and so loved. A few weeks later we started dating. Two years later we are still together after having spent the first year of dating apart and this last year together. His hugs still calm me when I'm not feeling well. Like a little battery boost :)"
277,"I love Jessica Jones.  She is damaged and she is starting to become isolated because of it.  That is how real life is rather some romantic BS where some guy is tripping over themselves to “rescue” her.

Source:  am damaged"
278,"First to go to college, first to go to grad school."
279,[removed]
280,Until it starts to smell
281,"Yeah, this is exactly why I generally don't comment on anyone's weight unless I know they've actively been trying/they've talked about it before. If I'm going to compliment someone's appearance (which is rare anyway) I try to keep it to neutral topics like haircut/fashion choices/new glasses or whatever. "
282,"Recently I was at brunch with my husband and was pretty tipsy. Went to the bathroom and there were three women who were clearly brunching professionals. All dolled up, make up, jewelry, the works.  As I’m in the stall they are telling each other how they hide their Botox from their husbands.  

One tells him she has migraines, the other tells her’s that the bill is from the dermatologist for “the rashes I get” and “he’s too stupid to ever actually look at the bill” and the last one is all about “if he wants a trophy wife he’s going to pay the bills and shut up”.  I walked out of the stall and my face must have given me away and one said “you’ll see someday honey, how old are you?” Ummm, 45? Silence. I usually get assumed 37ish, but mostly because I have a 17 year old. I just left because it was so fucking weird. "
283,"I always want to correct people when they're having a conversation in the toilets. It's a curse.

Recently after the Stephen Hawking death, two people were having a conversation in adjacent cubicles at school and I was in another cubicle. 

Person #1: Did you hear Stephen Hawking died?

Person #2: Yes. He was the actor, right?

Person #1: I think so. 

Made me want to scream but I said nothing. "
284,"I really dislike it when people get invested in explaining to you why you shouldn't like something. Let people like what they like. If listening to ""trash"" music is something that makes me happy, your long-winded tirades about how wrong I am will only make me not want to talk to you anymore. "
285,Best advice I read somewhere: “Don’t cling to a mistake just because you spent a long time making it.”
286,10% spent out awesome fun stuff and 90% puttering around the house. But weeding the garden or doing laundry isn’t Instagram worthy.
287,"The heat, it’s been 30°C + for over two weeks here now and it’s killing me."
288,I kinda bunch up my sheets between my legs so parts of my patterned sheets would be ruined by the raw acidity of the splooge. 
289,"I wouldn't shave all of it, because that's cumbersome and I get ingrown hairs like crazy. I'd trim it though, if it made someone else more comfortable. That's a pretty small compromise to make imo."
290,"I think that the pressure to lead in every aspect, from dancing til giving the first kiss. I'd feel a little self conscious about it."
291,"That's also amazing on your parents' part, to act as an emotional buffer with the letters. People like your ex are masters at finding out a person's vulnerabilities, laying them bare and using rusty pliers on them.

Your parents saved you from having to read some extremely painful lies, I guarantee it.

I'm glad you dodged that bullet."
292,"Was never close to my step grandfather but found old documents and learned he was adopted after his parents died in a car fire. Among other surprising facts regarding him and my own father. Luckily he was saved in time. 

Also learned he was my godfather and he bought me a lot of stuff I owned growing up. I wish I was told this so I could thank him."
293,"I once had a really casual pizza and movie date with a guy I thought to be a friend. He stopped at a liquor store to get beer (I live in Utah, weird liquor laws...) to have with his pizza on the way home, and then asked what kind of beer I wanted. When I said no thanks, none for me, not much of a beer drinker he INSISTED that I pick a beer. It was so bizarre, and in retrospect a huge red flag."
294,"Honestly? How much they are hated.  I get it. A lot of men are terrible humans, but so are lots of women. Not all men are horrible humans. "
295,Love this. Stealing this.
296,Boyfriends visiting and being sure they don’t end up living there without paying rent. I’ve had it start slowly where they come over once a week. Then every weekend. Then every day. Living there basically and when I mentioned that he should start helping with bills she got furious. Discuss that now and have rules set that no one will bring in someone to live there without your consent and agreement upon payments. 
297,"I picked the skin around my thumbs for almost my entire life. I would make myself bleed. People would always point it out and I would feel so embarrassed. Sometimes I wouldn’t even realize I’m doing it. But the pain would ground me. The only thing that made me cut back was to get regular manicures with an acrylic overlay so that it is now difficult to pick my skin and if I somehow still do it, it damages my nails and renders my manicure a big waste of money and I feel like a failure."
298,I don’t why I envisioned this as a start to an amazing wattpad book 😂😂😂
299,"Facial scars

Having alligator skin. Use some fucking lotion 
Crusty McAshen."
300,[removed]
301,It's still a Blockbuster! The last one in the US.
302,"God, fuck mandatory work functions with a cactus. We do 'team bulding' activities every couple months and while they're not *technically* mandatory, it wouldn't look very good to skip them. The worst part is it's never something chill like grabbing a beer after work or something like that, it's always some 'fun' activity that we all have to pretend to be super psyched about. Why do we have to have fun together? Why can't we just have a professional relationship and leave it at that? "
303,"Computer accents.   'Your call is very important to us'

Liar, No it's not."
304,"My crush was in astronomy club with me a few years ago. One of the things we did in this club was take turns giving ‘lectures’ on related topics. I gave a serious lecture about how the moon landing was fake. I don’t actually believe that, but I pretended like I was super serious about it. He thought it was hilarious and asked my on a date (where he spent two hours telling me his favorite conspiracy theories). We’ve been dating for almost two years and just moved in together. "
305,So sick of these cheeses coming in here asking their cheese questions. 
306,"As someone who just went through this, it sucks bad. I used to love my hair so much because it’s one of the main things that compliments looks and features... alas I went bald at 23. I guess it works out though. I feel like I look okay. Not as great as I once did tho"
307,"Mowing the yard last week in 95 degree weather. I was finishing up the backyard when my 4 year old comes out on the patio and gets my attention. I shut the mower off (so I could hear him) and asked what he needed (assuming PJ Masks had shut off or something). He said, ""Mommy, you look hot, can I bring you your water bottle out here?""

It's the first time he's done something like that. And both the cold water and the knowledge that I'm obviously doing something right raising him were exactly what I needed!"
308,"Expecting me to be interested in his ""manly"" interests like sports or cars, and then showing absolutely no interest in any of my ""girly"" interests. Bonus points if he calls my interests shallow or stupid."
309,Respectful. Responsible about birth control and the like. Excellent communication and active listening skills. Doesn't violate boundaries or wheedle their partner(s) into things the partner(s) are unsure or nervous about. No body shaming.
310,"The ""pro life"" movement has a lot of dead women in it."
311,"Anything that requires them to travel for long periods of time. If I’m with someone I want a partner, not just someone that helps pay the bills. "
312,"Before I had a kid, I wish someone would have told me that I would be getting kicked in the balls on a daily basis. I refuse to push my toddler the shopping cart anymore."
313,"I don't care for a lot of popular men's attire, but that's really none of my business. That being said, I don't think most men understand how versatile and attractive a simple button down shirt with rolled up sleeves is. "
314,"She did everything for her kids. My dad was a lot younger than her (age difference of ~15 years) and she basically raised him after their parents died. He was so hurt when he found out what happened and it was the first time I ever saw him cry. I'm glad that he shared with us all these stories about how badass she was though, she was an amazing person. "
315,Asked a customer service person for something once and he screamed at me “do you want me to lick your balls for you too?!” He was shaking he was so furious. Obviously having a meltdown that had nothing to do with me. Also I don’t have balls. 
316,[deleted]
317,"I had a guy who tried to follow me to Europe and told all our friends we were in a relationship when we weren't.  I told him repeatedly that we were never going to be in such a relationship, but it took him almost three years for it to finally sink in.  I knew he finally heard what I was saying when I got a nearly incoherent stream of drunken texts from him saying that he's a great guy because he never raped me while I was drunk but also threatening to come over right then to rape me to show me that he's a ""real man."""
318,"I'm a pilot and I wouldn't date another pilot. Been there, done that, didn't work out. It's hard enough when one person in the relationship is in aviation, let alone both."
319,I’ve heard of higher chances of experiencing spousal abuse with men in those professions too
320,"I think he was ""negging"" her into sending him nudes"
321,"&gt; a boner for whatever reason

Like in middle/high school when the teacher calls on you to write something on the board."
322,"Using a racial slur against someone of a different race is racist.

This has caused a lot of tension and still does when it's dug up. "
323,Interesting— leela is a badass but I’ve always disliked her because she’s also the stereotypical female killjoy/nag. The mom cleaning up everyone’s messes. That’s why I like Linda Belcher on Bob’s Burgers— finally a maternal protagonist who is lighthearted and fun/funny.
324,"Some anti-anxiety medications have been shown to have a suppressing effect on this behavior for some people, so if yours is pretty bad that might be something to look into. I have trichitillomania (the hair pulling one) And to be honest, the most effective mitigating thing I found is to transfer my hair pulling from the hairs on my head to my pubic hair, because at least I don’t have the stress of other people seeing the impact of my disorder. Also, once that becomes your preferred pulling area, you don’t end up doing it as much because you have to be in a private place.

I am aware that these are pretty  dysfunctional answers, but they are my experience."
325,I don’t really like blondes. I didn’t realize I felt bad about it until my friends tried to set me up on a date with one and I just wasn’t attracted... but I felt shallow so I gave it a try anyway. We ended up making out for 20 minutes and yet my panties were bone dry. Just wasn’t feeling it.
326,"I bottle things up until I get really upset and then I withdraw so that he senses something is wrong and then he withdraws until it blows up into a breakup discussion. We always talk through it, but it sucks and is emotionally draining for both of us. "
327,[removed]
328,"generally speaking, a man has to be morbidly obese to get any negative comments about his weight. women might get them already at the end of the normal BMI scale to slightly overweight."
329,It sure does sugarbuns. 
330,"The pressure to be ""one of the guys"" and socialize with men that they personally consider to be a\*\*holes.  The fear of being perceived as ""weak"" if they don't suppress their feelings of depression, insecurity or vulnerability."
331,"Yes I didn't know how to work that in there, that the likelihood of needing to lay down your life is fairly low, whereas women are expected to sacrifice constantly"
332,"Doesn’t stop my 3 year old lol.

Seriously after she has an accident I try to get her on the potty. The other day she responds.

“Uhhgg mommy I already had the accident”

Like I was inconveniencing her by making her go through the motions. I swear that girl loves her diapers."
333,"Okay, this thread has made me feel MUCH better about my bra washing habits 😂 I’m right there with you guys! 💞

Edit: for those of you grossed out bear in mind that most of us only wear a bra while out and about! They might not get washed super often, but it’s not like they’re typically being worn 24/7 "
334,"""you would look better if / you should (change something about your looks/personality/job/hobbies). 

If a guy looks at you and can't appreciate you as you are but wants you to change to fit his 'ideal you' he isn't worth it. You are his accessory and he will treat you as such. I purposely wear my peircings on a first date to weed these guys out. Yeah you might think I will look prettier but I don't think so. And only I have a say over what I do with my body. "
335,"""Ew, Mommy! It stinks in here!""

""Well,  sweetie,  that's a public bathroom for you."" 

That, or the time I was trying to take care of business in the ladies room at work &amp; a couple came in &amp; started to get busy in the handicap stall.  They had no idea I was there. When I finished,  I loudly cleared my throat,  flushed &amp; exited after washing up.  They got reeeeaaalll quiet when they realized someone else was in there! 

Sex in public bathrooms: just no,  guys.  Everyone else just wants to poo in peace! "
336,That’s when you apologize for being a mammal and not some humanoid reptile like them. 
337,"My angelic daughter was in prep (five  years old). She hardly spoke at all at that age. There were some grade two boys who weren't supposed to be playing in the prep area. Her older sister told us that something happened at school that day. After some prompting, I got the story. 

""One of them tried to kick my friend.""
""So what did you do?""
""I punched him in the nose... and he cried""

The teacher wouldn't believe the boy."
