,text
0,"When my grandma died we found out that she had bought rings when each of her children and grandchildren were born. The rings had their birthstones and she would wear the rings at every special event for that person. 

She did this so when she passed we would have something that reminded us of all the great memories we had with her instead of all the memories we would never make. We would be able to wear these rings and know she was with us. 

There are many pictures of her at my birth wearing my ring, at my heart surgery, my birthdays, my graduation, and no one thought anything of it because grandma looooved her jewelry."
1,"Men have many struggles, but a very small thing that I noticed is that they rarely get complimented, especially on their looks or the way they dress/present themselves. Usually when I compliment a man, they just look so flattered that I can tell they don't get enough positive reinforcement like that in their lives."
2,"I went through a horrible breakup (first relationship, lasted five years and wrecked us both). My ""friend"" was there for me when I was recovering. He'd drop by when I was at work to make sure I was okay and would message me constantly. 

After a few months, he encouraged me to pursue a mutual acquaintance (who he said was into me). It turned out the mutual friend had no interest in me and rejected me on a night out. 

My ""friend"" was sleeping on the couch at my place that night. I was drunk. He cornered me in my apartment, told me that he loved me and forced himself on me. My dog, God rest her soul, saw I was in distress and bit him. I got away from him, locked myself in my room and just waited until he left the next morning. 

After that, he tried to pretend nothing had happened. I completely avoided him. Years later, after I was married, we were both celebrating a mutual friend's birthday and he followed me home. I didn't know what to do so I asked my husband to come and meet us. My ""friend"" got the message and left.

Later on, I got an abusive message on social media saying that I was just with my husband for his money and that I'd regret choosing him over my ""friend"". 

A few years later, he got married and he sent me photos of him on his wedding day with the message ""look what you are missing out on, bitch"" (I paraphrase). Recently, he tracked me down on Twitter and sent me a link to him masturbating.  I contacted his wife but they've split up, hence the renewed interest in me."
3,The limit does not exist.
4,He had been abusive and was an alcoholic. He cheated on me and blamed it on my family and tackled me when I tried to leave. So I played along and agreed we'd get married in and move to another state away from my family. I was supposed to meet him there and get married the day I arrived. I never got on the plane and changed my phone number and quit my job. 
5,"What are you doing this weekend?

Ohhhh, gurl.  Imma get my hickey redone."
6,"KIND OF overheard in the women's bathroom but...One time my friend and I were in the women's bathroom and she was talking about how she only dates tall guys.  I was telling her that some short guys can be pretty hot and she'd do better to expand her horizons and then we heard a guy's voice from the AC vent that went between the womens and mens bathrooms: ""I'm 5'6"" and I would rock your world!"""
7,"Not me, a friend.

The day of the wedding we were with her at a beauty centre. She had her wedding ring on. But when we were out she didn't have it. Don't know if it was lost or stolen She was definitely sad but not breaking the wedding sad.

When her fiancé found out he went on full beast mode that made her cry. And accused her mother of stealing the ring. He and her mother had troubles before. But no way her mother stole it.

He apologized and the wedding went on. But at the alter he joked about it or something and she couldn't take it anymore and just walked away. She knew he'd never let it go."
8,I lost over 30 pounds. The only person to say anything was a very nice trans woman at work. Not even my wife.   
9,"Well, I spent the past decade looking for a woman and then fell in love with a man, so... not very much. Though he's 5'3"" with long hair and gets catcalled by confused drunk guys all the time, so that's not actually that different."
10,"If it doesnt have sweat, 4-5 weeks hA HAHAHA IM SO FUCKING SORRY"
11,"I think the most succinct way I’ve heard someone describe it was: “men are disposable, women are exploitable” "
12,"I overheard a little girl in the bathroom with her mom gasp and cry ""mommy, you're bleeding!!"""
13,"Sensitive badasses, such as Leela (Futurama) and Katara (ATLA). They're some of the toughest ladies around but that doesn't mean they aren't in touch with their sentimental side. Better still, they aren't even ashamed of it. It's an asset. Hell yeah."
14,"I was helping to pack up the estate of my sister-in-law’s mother who had recently passed away (colon cancer at 55, a fucking tragedy). She was super nice and proper, worked in accounting her whole life.

Anyway, she has an absolute arsenal of sex toys. Just about every kind you can think of. Makes me smile to this day. RIP, you freaky badass woman."
15,"It was something super small. My friend was getting dressed for an interview- he was putting on a tie and for some reason he was having a really hard time straightening it. So I volunteered to help him out. He stood there, constantly ruffling his hair, and grumbling about how I was ""the mum"" while I asked him to shut up and stand still. Something changed for me at that moment in the friendship, maybe it was the combination of the easy camaraderie and a sudden rush of intimacy. I was never able to simply think of him as a friend since. "
16,"My mom loves to tell the story about this one time she took me in the stall of a crowded department store bathroom with her when I was of potty training age. Apparently, she had to drop a deuce and when I detected what was going on I started gushing, ""Good job, Mommy! You did a good poop!!"" Since that's what would happen when I was seated on the throne, I thought it was only natural that my mother get the same treatment. The whole ladies' room had a chuckle at that one."
17,"Keep doing the things you did before you met them. Don’t neglect your other friends, make it a point to meet up with them a few times a month without the new SO. Keep doing hobbies and activities you enjoy. Some of those you can invite the new SO to join you in, if you’d like, some you should do on your own. Encourage your SO to do the same, both with friends and hobbies. It’s HEALTHY to have separate lives. 

If you need to, limit the amount of time you spend together. You don’t have to be with your new person every day; too much time together too quickly can backfire and become grating rather than enjoyable. "
18,days???? I am way past measuring it in days 
19,"Based on these comments I need some self reflection on my bra washing habits, or lack there of."
20,Communication. Paying attention to their partner and how they respond. 
21,The willingness to show concern over the big things and laugh off the small ones. I don’t want to have sex if it’s not both an intimate bonding experience and just a whole lot of fun at the same time. 
22,Because he was an orthodontist named Barry
23,"Apparently, my paternal grandfather showered a lot more attention on my dad's sisters and random people from my grandfather's church than he ever did to my father. He would regularly write letters, call them up on the phone, and have lunch or dinner with them, even when my grandfather was in the hospital for months at a time.

My grandfather *never* called my dad, even on his birthday. Any communication with my dad's parents started with my dad. We didn't think too much of it because we assumed this was how my grandfather was, since my dad said often that his parents weren't very emotionally connected to him and his sisters even when they were young.

Let's just say that my dad was *livid* when he found out about this at the funeral, having to hear many, many people get up and talk about how my grandfather mentored them and kept frequent contact with them."
24,Testicles. 
25,You can't be emotional without being criticized. Rarely being capable of talking to your friends openly about your feelings. 
26,"My “ideal” was always the on-the-go powerful businessperson with many degrees, the “life of the party” person who owns a room the moment they walk in. I dated a lot of them probably because I grew up around a lot of them.

My SO never went to college, is happy with his life, and would rather cook with me and have people over for dinner than be out at the fanciest restaurants. He’s amazing. 

It turns out I needed a sweet nurturer more than a powerful leader."
27,My grandfather never talked about his WW2 service. I found out after he died that's because he survived the Bataan Death March. 
28,"not so much a conversation but this poor girl was wayyyyyy too fucking drunk to get her body suit done back up. her more sober friend had to go into the stall and was like talking to her the whole time, saying things like “okay i have to put my hands *down there* to do up the snaps okay?” she pulled up her friends shorts. she was just full mom at this point. like it was so PURE honestly. and i was drunk too so i was just like dang... i wish this girl was my friend too. "
29,"I was 22, he was 23. We’ll celebrate 30 years of mostly wedded bliss in March. It’s been amazing and I can’t imagine any other life. "
30,"I love when female characters are smart and perceiving - like Skylar in Good Will Hunting. She is caring, but not overly sensitive. And she is smart, but not judgemental.

I often think female characters are either completely controlled by emotions, or completely emotionless. "
31,"My mom left my dad at the altar. I guess she got to the parking lot and just realized what a mistake the whole thing was. I guess he was a super controlling alcoholic, and despite having a good paying job was super cheap. So she'd paid for her own wedding ring and the entire wedding herself without him contributing anything. She realized it was one thing to put up with that shit herself, but she didn't want a kid to grow up around that. 

She told her best friend to tell everyone to enjoy the catering and the party she'd paid for but she wasn't going to be there and drove off. "
32,"In eighth grade, depression hit me really hard. I cried myself to sleep most nights, and when I wasn't crying myself to sleep, I was passively hoping I just wouldn't wake up.

Every once in a while during that time, I would dream about being in a relationship with one person or another. Those dreams were characterized by this warm, safe, calm feeling of being loved and protected. The man I'm about to marry makes me feel exactly the same way. I guess you could say he's my ~dream guy. "
33,"I had a big realization in my life about this. It all boils down to the person you date will never meet all of your needs, so don't rely on them to do so.

Lots of posts saying the symptoms (keep contact with friends, stay busy) but the problem for me was relying entirely on my SO for my entire happiness.

For example, my current SO is not into sports and I love them, so I made sure that I didn't rely on her to play soccer with me and instead joined as an individual onto a league so that I wasn't reliant on her to meet that need. "
34,"What. The. Actual. Fuck?

I am so sorry you had to go through something like this.. damn.. 

Does he still try contacting you? You should get a restraining order and file a case against him for harassment, if you haven’t done it already."
35,"If you're suffering from acne, blackheads, or any other skin issues, then wearing foundation to cover it can be a bit of a minefield. If someone notices you're wearing foundation as a man you could end up getting made fun of/criticised even more than you would have had you just gone without.

Additionally, I wouldn't say this is unique to being a man (because in my experience most women who are considered ugly or even just plain go through this too) but since reading Reddit I've come to feel that a lot of men feel like they're inherently unwanted and undesireable to women. Women, particularly attractive women, are objectified and bombarded with sexual harassment, told daily that their only worth is how attractive they are to men, that they'll ""expire"" and be useless after a certain age (25, 30, 35... even 18 in some particularly psychotic circles). Men, on the other hand, seem to get the message that they are purely functional beings with no attractiveness or desirability whatsoever. That seems to lead to a lot of men desperately seeking some confirmation that it's possible for women to actually desire men physically. It can't be a nice feeling to have."
36,"Baldness. It's just the luck of the genetic draw. Guys I know, who in school had gorgeous, thick manes of hair, are now receding and having to either shave it all off or cover with hats. It sucks that something which was once part of your identity can be snatched away like that. Products aimed at artificially creating hair (toupees, sprays) seem to have tragic results."
37,"My friend did this.

We were all in undergrad together. She had a colossal crush on a classmate. He was meh about it, but they were really good friends. She seemed to move on and dated someone else junior and senior year. 

Then everyone moved on to grad school, some in different countries, including her crush. She met someone else there and fell in love, they shared hobbies, even had a photography page on Facebook together... The works. They dated for four years and finally decided to get married. 

Two months before the wedding, she decides to take a trip all by herself to the US, where her crush was. We find it weird, but her fiance is cool with that, what's our problem. I meet up with her, she's tense about the wedding. Having never been anywhere close to an altar, I thought that was what people felt pre-wedding. She leaves on a camping trip with the ex and her college roommate for a week. The next day I'm walking around town and run into the college roommate and I'm like wtf. She was apparently never part of the plan. But the fiance's cool with it, who am I to judge.

She comes back from the trip and is a little weird and tense. We go shopping for some stuff, and I notice she's paying with the crush's credit card. I remember thinking 'what a nice guy he is, but she's an investment banker, doesn't she have her own money?'. 

Anyway. She goes back home, posts all the pictures on Facebook, then is posting wedding countdown pictures.... 

Then one day I want to clip one of the pictures for my tinder profile and look for it on Facebook. It isn't there. Heck, I can't even find her on Facebook. 

Then I hear from someone else that she walked out on the groom because she was still in love with the crush guy, and he finally reciprocated two days before the wedding. 

Now she and crush guy are married and have kids. I really can't get over the shittiness of stringing the fiance along and publicly embarrassing him by walking out on the wedding day. But well, it's better than being married to someone and being in love with someone else, I guess. "
38,I got divorced young. 
39,"We were laying on a dock at night, stargazing. I realized “wow, this is romantic as hell” and started to think about who I could bring to the dock with me next time. Only person I could think of was him. "
40,"I collapsed, fell unconscious, and stopped breathing, and she was able to call 911 and get an adult to start CPR. At age 9, she saved my life. "
41,"how much more difficult it seems for many of them to find women to date. i think my partner is a total catch, but i'm also his only-ever girlfriend where i've had several.

also boners seem really damn inconvienent and embarrassing. at least if i get turned on randomly, no one has to see it."
42,"I went to the restroom during my little cousins B'nai Mitzvah. (I hope i used the correct term, my boy and girl cousin were both celebrating) .. So the party was pretty ""lit"" the kids were going nuts and I was around 22 years old at the time. I had done my little cousins make up before the party, she wanted eye liner and smokey eyes so I went in hard and made her look like a rock star!  I was finishing up in the restroom and a group of about 6 girls were all fighting about who knew my little cousin longer. 13 year old girls were going at it hard. ""Well I've been going to camp with her since we were 5"", ""well she's my neighbor"" ""I slept in her hotel room with her last night"" ""We've known each other since we were in diapers so I obviously win"" .. I was cracking up. I washed my hands and turned to them and said, ""I was there when she was born and I got to do her make up for her today"" .. got em! Their eyes lit up, the leader of the pack immediately wanted eye liner and one girl asked how old I was, when I told her I was 22 she was shocked and wanted to know more and if I was drinking alcohol. They all agreed that I knew her the longest and the most. Kids are so cute. "
43,"I had a casual friend, someone who was just part of the group I hung with, started flirting with me. I told him I was flattered but as he knew, I had a boyfriend (we were long distance at the time). He cooled it and I thought it was done. My Bf and I lived in cities about an hour by plane apart so it was pretty common for us to hop a flight one way or the other to visit each other overnight or for the weekend and we are both soccer fans. So anyway one weekend my Bf flew in and we were going to the local soccer bar to watch his team and then my team play because they were back to back and then figured we'd take a walk or hit a museum in town before I had to drop him back at the airport. 

So casual friend asks if he can also meet us for soccer. It's in a public place so I was like ""it's a free country, I guess."" He shows up 20 minutes into the game and throws a fit because bf and I are sitting on a booth seat and there's ""no room for him"" although we had saved him a chair. He then proceeded to grill my Bf. ""You came here just to watch soccer with her?"" ""Yep"" ""You must loooooooove soccer"" ""something like that"" ""don't you have places in your city to watch soccer?"" ""Somehow the experience is just better here"" etc

After the games I was like ""ok well we're off"" and he threw a fit saying he thought I was spending the day with him and told my boyfriend I'd promised him on the phone a whole day to which he responded ""I was there and she literally didn't.""

I didn't see him again for a few months until I ran into him at a group dinner and he said he'd parked near me and could he walk me back to my car. He then proceeded to look around at lights on in office buildings and wondered if anyone was having sex in any of them, then asked me if I would want to have sex in an office because he'd be more than happy to.

I got to my car, blocked him on all social media and told my friends not to include me in any event he was invited to.

To this day he tells people he let his guard down with me and I trampled his heart like so many women had before me. 

Although I now live in the bf's city and we're getting married in November so there's that."
44,"on dating sites the first thing is using pet names like sweetheart, honey ect straight away. "
45,"Men don't seem to be allowed to like children and babies how women do. My husband loves kids, but sometimes he gets these looks when he smiles back at one like at the grocery store. Some people just have to think there's something creepy going on when a guy is kind to children."
46,I think it’s fine. Better than some poor girl irl experiencing whatever it is they’re asking about if it’s something cringey or rude 
47,"My great aunt had a back street abortion in WW2. Her husband was at war, reported missing, and she didn’t hear any more news. She feared the worst. She then hooked up with a passing Canadian soldier and got pregnant. She already had two small kids so it wasn’t really ideal. Then she got word that her husband was coming back, so she got an abortion. My grandmother pretty much shunned her for life after this. My great aunt’s husband never found out. "
48,"I love female characters that are not traditionally feminine but still have traits like compassion and emotional intelligence rather than just acting like a male action hero. Imperator Fusiosa, Ripley from Alien, Yara Greyjoy, etc.

I also like small, irreverent girls who act a bit basic sometimes but are actually strong and dangerous as hell, like Buffy Summers."
49,"The pressure a lot of them seem to feel not to show any ""weakness"". 

Anecdotally, it seems to just end up manifesting as resentment or anger instead which isn't any better than just showing that ""weakness"" in the first place.

Sure some people might think I'm a ""hysterical woman"" if I cry but at least there's no stigma about me leaning other people for emotional support. "
50,"75% communication/willingness to please and 25% technique. A lot of guys are ""good"" in that they know how to thrust properly and have decent stamina but could care less about how it feels for me and are just trying to get off themselves. I've even been in relationships where the dude would just hop off me as soon as he came, then would roll over and fall asleep without even considering my orgasm. Not being able to make a girl cum in 2 minutes is fine, but not caring about her pleasure at all is not. Poor technique can be made up for with good communication and enthusiasm, and will hopefully evolve into improved form. Lack of respect for one's partner is a whole nother story.

Honestly as long as a guy displays a desire to fuck me and make it good for me rather than only thinking about himself, I'd consider him ""good in bed."""
51,"Not the greatest I guess but. In Junior High my daughter was being harassed by a guy. School never did anything about it. The last straw was when he started to call her a whore in the lunch room. She freaked on him, punched him and knocked him down. He got back up and went after her, she stood her ground and when he went to hit her a teacher broke it up. They ended up in court and the Judge freaked on the guy and her charges were dismissed. They both received a 10 day suspension. I know fighting is wrong, but no one else would do anything about the sexual bullying etc. She was much smaller than this guy and she put him in his place. It wasn't right but it ended it."
52,"This is how I feel about Hermione Granger -- she's the brilliant bookworm, but she's also the most emotionally intelligent of the HP trio, by a *mile*. "
53,"Almost all variations of Scottish, Welsh and Irish accents.

ps Midwest accents are very cute!"
54,"Fashion is my main hobby, and I love the options that are available to me. Men have fewer options, and the options aren't as diverse or interesting. I think it would be much harder to have fun with fashion as a man while still adhering to gender norms.  "
55,[removed]
56,"We we're 22 and it was hard. We have very little support of our marriage and we had to endure growing and changing a lot! 
After 5 years of marriage and a toddler in tow we separated for a year and a half. I had PPD and PPA really bad, we lived far from family and had no support system. I needed more than he could give at the time.
As a result we co-parented and went to family therapy so we could do better. Ended up building a friendship that we didn't have before and moved forward with living together again. We are celebrating 10 years of marriage and I can honestly say I am married to my best friend. "
57,"Everything related to aging. Wrinkles, grey hair, etc all make a man look ""wise"" and ""dignified"" and they get to be ""silver foxes"" while women are just called old hags if they dare to have a wrinkle or a strand of grey. "
58,"I know this is the “AskWomen” subreddit, but I love this story so much. One time at the movie theaters I was washing my hands and these two guys doing their business on the toilet we’re having a small conversation. Nothing weird or hilarious until the end, one of the guys goes “Ope, there’s no toilet paper in here. Have any you can spare in there” and the other guy follows up with “Of course I have.. oh dear god.” Neither had toilet paper, to this day I still crack up hearing the terrifying realization of “Oh dear god” "
59,"Girl 1: so I’m allergic to nuts but not peanuts. 

Girl 2: how is that possible?

Girl 1: so like, they said peanuts aren’t real nuts.

Girl 2: that’s insane.

I wanted to pop out of the stall and say “it’s a legume!!!” But decides against it. They should stay amazed. "
60,[deleted]
61,"My aunt became a huge feminist when her children were toddlers. She had apparently been raped at a bus stop in front of them and that moment completely changed her life. Unfortunately for her, she was killed by her husband, my uncle, in a murder-suicide. She was gone way too soon and I wish I knew her as an adult since she died when I was in middle school. I feel that I could have learned a lot from her. "
