,text
123,"Men are required to sacrifice their literal lives, women are required to sacrifice their figurative lives.  As in, once you become a mother, you sacrifice who you were before. Once you get married, you sacrifice your identity.  Or expected to, very pressured by society. 


One of my cousins had a kid a few months ago.  *On her birthday* her birthday card inside said ""Happy Birthday mother of [child]!""   She literally no longer has a name, and even on the day of her birth is just called a mother.  


Her husband? Still gets his name.  He's not dad.  He's allowed to be a human.  


But break in to their home? He has to go investigate and potentially die."
124,"My eight year old daughter was being called fat at school on a regular basis (she's a lil chunky. we're working on it). I had no idea it was happening, she hadn't told me or come home upset or anything, until one day my son told me he was being called a midget by a group of peers. She overheard the conversation and hugged my son and said, ""It's okay. Girl1 and Girl2 call me names everyday, but I don't pay them any mind. They are just being sassy and they aren't good people! As long as you try hard to be a good person, it doesnt matter what others call you."" 

My heart melted. It was a piece of amazing wisdom from my young daughter....I bragged so much. "
125,"When my grandmother died, we learned that she and my late grandfather were never married, because he never divorced his first wife. "
126,"Being uninhibited and in the moment, and just doing what they think will make the other person feel good without being pensive or hesitating.  Asking for what they need, and being receptive when asked for something in return.  Noticing nonverbal feedback.  And finally, putting a little motion in the ocean.  No one wants to be stabbed with a penis for 15 mins straight.  Mix it up, move your hips, find some different angles, and make it interesting.  "
127,Anything that requires significantly more than 40 hours per week. I grew up with a dad obsessed with work and while I love him to death we missed him so much as kids and so did my mom. We wanted time with him more than anything. It's important to me not to replicate that in my own marriage.
128,"Ruthless, scheming women (both villains and heroes). Bonus points if their ruthlessness isn't necessarily portrayed as a bad or repulsive thing. I'm playing Witcher 3 right now and I feel like Yennefer (and to a lesser extent Triss) is a great example of this.

Women who appear to be sweet, caring, saintly ""ideal wife"" type figures... but are actually secretly still ruthless and scheming. Amy from Gone Girl, for example. The pettier they are the better.

Basically I just like female characters who would stab you for a dollar."
129,"I freaking love Legally Blond. It shows that women can be very feminine and extremely smart. I mean, she last minute got into Harvard, defended herself against sexual harassment, solved a legal case by herself, was supportive to other women even if they didn't like her. So many awesome things about Elle, and she was into makeup, staying fit, and looking pretty. I'm always happy to see women as multidimensional."
130,"Wait wait wait.. we need this on blast: 

**&gt;Not just trying to emulate what they see in porn.**"
131,"What temperature you like to keep the ac at! I had arguments with a roommate over this.

Willingness to share items and food.

How often they clean and how you will split chores. If they never sweep their current place they won’t help you sweep when you move in.

You should also have a discussion about sexual partners coming over and boundaries.
"
132,"I refuse to date anyone who is in the military or who works in law enforcement. I feel bad about it because I'm sure there's loads of nice men out there who work in those fields. I'm grateful for what they do for our country and I commend their bravery but I just don't want to deal with the possible baggage that comes with their work.

Also, I have heard some not so nice rumors about men who work in those fields and how they are more often than not unfaithful in relationships. I'm not sure if that's true or not but I'd rather not take my chances. "
133,"This may come as odd, but boners are a completely separate thing to being turned on. They'd overlap pretty heavily on a Venn diagram, but there's always that area where you just get a boner for whatever reason, and that area where you *are* excited, but it just won't pump up on its own.
"
134,"""Hey, nice weather we're seeing. Speaking of seeing, are you seeing anyone?"""
135,"I am Indian, and for the longest time the guys I had dated fell into the same pattern-  smart, well-read guys who sang well, wrote poetry and were artistic overall. Also, I have always found eloquent guys attractive- nothing impresses me more than a guy who can hold his own while debating with me. I always thought I would end up with an Indian guy who had these qualities.

Instead, my current SO is European. He is uproariously funny, he played the piano as a kid but hates it. As per my childhood ideals, he is smart and well-read but certainly not an artist. We argue in jest about everything quite passionately, and that is a major aphrodisiac.

Edit: 10/10 would recommend dating a funny guy. A fun, light-hearted relationship where both people can laugh at each other is all kinds of awesome."
136,"I wish they'd drop the act and post their own situation to askwomenadvice.

""I'm balding. Should I attempt a hair transplant at my age for (reasons), or shave it
for (reasons)?"" will get my non-snarky answer so much fucking faster than ""Beauteous glamazons of AskWomen, do you find bald guys hot?"""
137,"May I ask, how is your friendship today?

My wife and I were friends for quite some time, then something just changed one day. 12 years, a wedding, and a baby later, things are still pretty great. I can't imagine that would have been the case if we hadn't forged a friendship first."
138,"Wow, that must have been a very tough and difficult situation. Good on you for getting out of it though!"
139,"We don't argue very often, but when we do, I feel like I'm the one who makes sure we get everything out on the table and work things out so we can make things better. His family never really talked about anything important (ignored problems, suffered in silence) so after 3 years together, he's still learning that arguing is okay and I'm totally fine with him calling me out on my bullshit."
140,"I’m part way through my residency in emergency medicine. I love what I do and couldn’t see myself doing anything else, but I’m not sure I would make the same decision if I had to go back and choose my career path again. 

At this point, I think I’m just really tired. Medical school and residency is such a long path. All of my friends are married, have children, and have started their lives. I have an outrageous amount of student loan debt and I feel like I missed the early part of my life as I’ll be 30 when I finish residency. I was engaged at the start of medical school, but that fell apart after I started my clinical rotations in third year and was at the hospital more than home. I’ve found it difficult to find time to date in residency, and have been single for almost 4 years now. On a more positive note, I get tremendous satisfaction from my job and it’s helped with my social anxiety. "
141,"I have guesses. Part of it is that my dad hasn't lived in the same city as them since he graduated high school, whereas both his sisters lived in the same city for most their adult lives. Part of it is because they didn't really approve of my mother.

It's funny, when my dad casually mentioned to his mother that he would have liked to get a letter or a phone call from his father sometime, my grandmother looked astonished and said something to the effect of, 'We didn't know you wanted one.'

That was the straw that broke the camel's back with my dad and his family. My grandmother has not called my dad nor emailed him since the funeral. I don't think they've communicated at all since the night of the funeral, I think.

My dad's sisters obviously blame my mother and are shaming my father for treating his mother like that when she had just lost her husband.

Personally, I have not had one iota of desire to have any sort of relationship with my dad's family since I was eighteen years old, and I'm happier for it. The only thing they left me with was a fear of dogs that I'm still getting over."
142,Please don't laugh off my penis
143,"He usually just winks and lets them figure out their mistake

I think my favorite was someone else's reaction: my boyfriend just raised his eyebrows at these guys and one dude went, ""Aw shit, that's just a little n*gga in a peacoat"" and the other dude just nodded and said, ""Yeah, I saw him and was like, 'I'd smash'""

Edit: typo"
144,"I don't know if 24 is really all that young, but it seems younger than average for my generation. It's great, we are almost to our 8 year anniversary. I think it's worked so well because we both went in 100% dedicated to making it work, and we were both ready. We also have a lot in common, and have good communication skills and similar communication styles. Well matched libidos don't hurt either. We share similar goals. The ways that we differ tend to compliment each other, not grate on each other.  Lots and lots of reasons why it works well to be honest."
145,"I'd been friends with this guy ""A"" for like 6 years. He was one of a group of dudes I hung out with at the time - all nerdy game devs that I'd met in college. I'd been to a ton of parties and conventions with these guys and trusted them all implicitly.

I went to yet another party one night at someone's house, and everyone was there, as usual. Had a couple beers, talked to some of the guys including A, then had to pee. Went down the hall to the bathroom and did my thing.

When I opened the door, A was standing right outside, and as I tried to leave he suddenly kissed me. I was shocked. Most of the 6 years I'd known A, he had been dating other girls, and we never so much as flirted.

He tried to shove me back into the bathroom as I told him, ""No, no!"" but he wasn't listening. I finally managed to get around him and get out.

I was shaken, but I assumed it was a simple misunderstanding. But I felt unsafe, so I sat down with another one of the guys I knew and asked him to keep an eye on me because A had just thrown himself at me and I was in a weird place. This guy agreed, put his arm around me, and then decided it was a good time to let me know that he and his girlfriend were looking for a third.

Well, that was a sign it was time for me to leave. I got up and told the host - another of my friends! - what was happening. He responded that I must have just misunderstood what A was doing. I decided to just go.

When I walked out the door, A followed me. He got in front of me and blocked me from my car, refusing to move away from my car door unless I agreed to go on a date with him. To get away, I said yes, he could ask me out *tomorrow* when he was sober.

He apparently took this as enthusiastic consent because he grabbed me and pushed me up against the car to kiss me again. 

I honestly don't remember what I said to get him to back off - probably something about needing to let my dog out - but I got away and got into my car at last.

""A"" never called me again. The other guys couldn't understand why I no longer wanted to hang out with A, even when I told them why. I stopped going to their parties, and then finally I just stopped talking to them at all.

Even now that I'm married I would say I no longer have any straight male friends."
146,"Was minding my own business at work when a woman went into the stall beside me and said ""Hey! How are you doing?"". I didn't know who it was or how she knew it was me. Did she recognize my shoes? Anyway, I go ""Uh... Not too bad, you?"" She goes ""I'm great! Really good. So do you have plans for the weekend?"" I go ""Uh... nothing special I guess"". Then she goes ""Hang on, the chick in the next stall thinks I'm talking to her..."" "
147,"Yes, and here we are 8 years later."
148,"High level, strategic sales positions, especially in finance. Men I’ve met who do this work have impossible huge and concrete egos, incredible manipulation skills, and are not afraid to count someone they love as collateral damage to get something else they want. "
149,"Thank you. I still remember the day I fully realized I was free. The feeling was indescribable. Violent Femmes song ""I'm Free"" became my anthem. "
150,Why in the world would you date if you don't want to? Just live your life.
151,"I love to learn. I try to fill the niches at work that others haven't and be the 'expert' in a given area. For example in my current role, I have become a de facto graphic designer. I have no experience with graphic design, but I'm willing to tinker around in Adobe Illustrator and come up with stuff that is passable for our purposes, saving us tons of money from not having to hire an outside designer. I created new branding and marketing materials for some of the projects I'm involved in. These are really visual, concrete things that I can point to as being ""my"" accomplishments."
152,"Congratulations! It seems like you have found a wonderful thing.

We are still figuring things out. He has had to move, possibly permanently, so things are a bit of on hold. We intend to revisit the relationship once the timing is a bit better. Meanwhile, we are as close as ever. "
153,"It is really hard to explain to my female friends that I'm desperate for validation on my looks. I always thought putting a lot of effort into working out, running, wearing best clothes for my figure and practicing good hygiene and skincare would result in some validation. I know you'll say that I should be doing all that stuff for myself and I do, otherwise I'd have stopped a while ago. But I want to feel beautiful and when even your girlfriend isn't forthcoming with positive reinforcement you start questioning yourself."
154,"Women blame themselves and yet other men absolve their friends.  Whenever someone posts one of those ""what can I do to help women or to be a better male feminist?"" posts... I want to link this comment and say ""DON'T BE LIKE THESE FRIENDS.  If your friend is a creep, fucking call him out for it!"""
155,"Now, the only problem is: men are almost never in the situation where they'd have to sacrifice their literal lives and women are almost always in the situation where they have to sacrifice their figurative lives."
156,Your mom is a badass.
157,"Soldiers. Every single one I’ve been involved with turned out to be an asshole and hurting me deeply. The only exceptions are my brother and best friend. I won’t do that to myself ever again.

Soccer fans. Just no. I won’t deal with this boring crap every single week."
158,"Their natural skin/no makeup! I once read a comment on bgc asking why men look fine without foundation and the answer is that we’re trained to just accept men as they are, but we hyper analyze women’s face and any “””flaws””” they may have. 

Like. Foundation, concealer , countour/highlight , eyeshadow, a big ol cat eye and falsies are just...... common. Like it’s really crazy how much makeup can go into a no makeup look , and can just be expected.  If you don’t wear any makeup dating/ in the working world you can be penalized. "
159,"- They way people immediately don't trust men around kids, especially for something as little as having long hair
- How much less support and encouragement they get for seeking out help for mental health
- The fact that a lot of real men's issues don't get taken seriously because the people pretending to advocate them are mostly just misogynists using men's issues as a cover
"
160,"My 5 year old asked “who the hell is it?” when someone knocked on our screen door. 

He was big into Home Alone at the time and had just watched the part where Kevin used “Angels with Filthy Souls” to scare away Harry.  The character in the movie asks the same question when someone knocks on his door. 

We had to explain to him that that was not an appropriate way to greet someone. "
161,"Too many, I only have one good bra right now. "
162,We moved in together 28 days ago. I found out last night.
163,"It's such a catch-22. I definitely think men need more reinforcement in their lives, and would love to compliment more men when they're looking good--but because compliments are so rare from women towards men, they're usually taken as a sign of interest, instead of as just a compliment (see also: how men usually only compliment women they find attractive). The only way to get rid of that association is to compliment more, but I don't want to invite unwanted interest just to try to compliment strangers."
164,"Yeah that’s a tough pill to swallow. I hope her ex fiancé is doing well since that’s something close to devastating, especially when he trusted her so much."
165,"I brought my 3yo son to play practice. The other actor on stage (over 6ft tall man) wrestled me to the ground while I’m screaming at him to get his hands off me. My son ran on stage, stood as tall as he could, and screamed “leave my mommy alone!!” Kid was red-faced, shaking, and really mad. I was so proud of him for being brave enough to stand up for me when he was so small. "
166,I always felt bad for male teachers especially in primary or elementary. Being a teacher AND combating assumptions about your personal life and negative stereotypes just seems like way too much bullshit for me to handle. 
167,"My youngest daughter is innately a badass.

The first time I realized it: I was disciplining her older sister and her older sister started to cry. She stepped in front of her weeping older sister and me and admonished me for making her sister cry. She was 3.

She routinely sticks up for herself and other kids.

Another example: There was a boy in her preschool —- she was 4 at the time —- who routinely bullied and hit kids. One day he turned his attention to her but the teacher broke it up before it could escalate. The kids were separated and the teacher returned to the lesson. According to the teacher, when she turned her back to write on the board, my daughter stood up, walked over to the boy and punched him right in the stomach. The teacher said “I guess she felt that we didn’t do enough to deal with the situation and she needed to make sure he knew that she wasn’t a target.” Not only did that boy leave her alone from then on but they were able to convince the school to get another aid in the class to help the boy with his bullying.

She’s 10 now and still sticks up for kids. She has no fear of or tolerance for bullying. "
168,"Dude was actually one of my best friends.  We had been hanging out regularly for a good 3 years before he revealed that he was in love with me.  I made it very clear that I wasn't interested in him, as nicely as possible.  He accepted it, we talked later and he said the feelings are fading/gone because he knew he couldn't pursue it. 

Every time I dated someone and we broke up, he would profess his love again.  His sister disliked me for leading him on, she told me so, I told her that I explicitly told him on multiple occasions that I would never have any interest in dating him.  Every time, I told him that I was still not interested in him.  Same thing, he would come back, he's sorry, there are no feelings, he wants to stay my friend.  This happened multiple times and since he was one of my best friends I kept him in my life.  

The last break up I had while we were friends, this happened again.  We were very drunk.  I remember asking him at one point if he understood that I just wanted to be friends.  I told him (hypothetically) would you rather have me knowing that I'd never love him or have any sort of feelings for him and he said he would rather have me.  Which hurt, a lot.  The same night I came to with him in me, I started begging him to stop which he did.  I can't really remember what happened, so I can't say that I didn't reciprocate with whatever he was doing.  So I blame myself a lot.  When I woke up I had a lot of hickeys all over my neck, I felt disgusting.  I had to drive him home that morning (he crashed on the couch) and he said that it wasn't what he imagined.  

I drove to the next town over where no one knew me to guy buy cover up for my neck and cried in my car.  The following weeks I tried to forgive him and still be friends with him even though I was really fucked up about the whole thing.   A few months later, I had started seeing another guy and I became pregnant.   We all went out on new years, and my friend drunkenly joked that his sister was asking if it was his.  It really fucked me up that he told his sister when I couldn't talk to anyone about it, and that he would laugh about my situation.  That he found anything about the situation at all positive.  We left. 

I moved in with my boyfriend so that we could raise our son together, and since I moved so far away, and he couldn't drive, it just worked out that we drifted apart.  For the better.  Once I was out of his life, he finally got a girlfriend.  We had been friends for 6 years and while he kinda screwed around with 1 or 2 girls, he never dated anyone, even though I constantly urged him to. I saw him and her once at a comic book store a year or so later, and he said hi to me, went in for a hug and I just kinda turned around.  My boyfriend said it was the most awkward exchange for two people who used to be best friends. 

This whole thing gave me nightmares for years.  I couldn't talk about it with anyone and I feel like I still can't.  I still don't.   My boyfriend knows, but I don't think he realized the effect it fucked with me.   I still remember how it felt, how horrible it felt, and there's nothing that will remove that thought from my head even though I want it gone.  I honestly think I just put myself in a bad position.  This whole thing was my fault so there is nothing to talk about, and I don't think I could confidently have a support network if I tried without feeling like I'm getting everyone to feel bad for me about something that is my fault.  

I'm still with my boyfriend, our son is turning 6 this year.  My Former friend just had a baby with the girl he started dating after we stopped hanging out.  I don't know the sex or it's name.  Years ago I would have been ecstatic to be a part of that child's life as an aunt.  I don't even know if they're married or engaged to be honest.  I don't really care.  There's not really a part of me that misses him at all.  I hate him.  The whole friendship was a ruse.  He just wanted to get with me for 6 years.  He never cared about me.  "
169,"In English? New Zealand.

Colombian accent when speaking French. Oh yes.

"
170,"I really like bisexual or Latinx women who aren't portrayed as overly sexual, loud and emotional, or evil.

So the only character type of women I really like universally is pretty much Rosa Diaz."
171,"Sometimes they’re actually good, thought provoking questions. Some of them have made me think about what my dating dealbreakers would be.

But other times it’s very clear that these posts are looking for a very specific answer, either to silence insecurities or to prove some idea they have about women in general. And that gets really exhausting. "
172,"My grandfather was almost 7ft, very strong and so quiet and gentle. He spent his retirement keeping his garden and would always cook my favourite foods when I visited. My grandmother - his wife - was barely 5ft and an extremely strict Catholic (some of their siblings were nuns &amp; priests).
My grandfather shocked me the most. He used to be a Financial Advisor and made a lot of his cases personal, or personally helped family friends in secret (he was able to as he was very wealthy). Funerals are 3 days, and his public one went on for hours because hundreds of people kept filtering in, each wanting to tell their story about how he had stepped in and helped them, everyone from his clients, to my Dad's friends and the homeless, all in secret. The one story I remember is one of my Dad's college friends saying that she was a homeless single mother at 19, and my Grandfather bought her a flat near college, a computer (I think) to be able to do college work and helped provide for her until she was able to get a job once her baby was old enough. I found out a few months ago (3 years after his death) that he actually died of cancer and had refused all treatment. Needless to say, he is the person I now respect the most because of his unwavering kindness and humbleness.

I always found the marriage between him and my grandmother strange, since she was so strict and just completely the opposire, and I know I still don't know the full story. However, after she died a year later, I learnt that she actually dropped out of school at 15 to look after the home and ensure all her siblings (my grandparents had 4-7 each) had a proper education and were well-fed. I think this is my grandparents' common ground. She went through her 'rebellious stage' 4 years later, getting all her teeth removed in the fad of dentures ""never worry about yellow teeth again!"" and heavily smoking for decades. However I still don't know how she went from that to such another extreme, but I look forward to finding more out"
173,"well my idea was of him existing, so I'd say it's a pretty drastic difference."
174,So much this.  Pet names are earned over time.  To use them immediately comes off as super possessive and objectifying.
