,text
95,"Sounds like you work at the wrong place, time to move and let HR know the reasons on the exit interview.

I wonder what your manager will think in his/hers last days. ""Oh man, I wish I had done more with my life... All those long hours at the office for nothing..."""
96,"&gt; I didn't show up

Good work ethics."
97,"He started beating me with a paddle (2x4) when I was four. Anything and everything was punishable by paddle, including blowing my nose within ear shot of him and using the restroom in the middle of the night. Some of his pet names for me were ""bitch"" and ""cunt""... Those names started when I was six-ish. He wouldn't let me go on hormones (birth control) when I started passing out from my periods as a teenager. I was grounded for being sick or passing out on my period because I was being ""lazy."" He tried to sell me to an Amish man when I was 20. I had to give him full body rubs every night after dinner. He now like to gaslight me, by either denying anything ever happened or by telling me I'm too sensitive. "
98,"I've been meaning to watch that documentary. 

I understand that legally I am Morgan. I understand that most people see me as Morgan and I see myself as playing the role of Morgan, like an actor in a play. 

Dissociative Identity Disorder is a traumagenic disorder, usually caused by severe abuse in early childhood. I don't personally have any memories of that abuse, but I'm aware that it happened. "
99,"a. Female

b. We have various sexual orientations in the group. I saw a joke once where someone says, ""Oh that TV character is LGBT"" and the other person says, ""LGBT? What, all at once?"". So yeah, we're LGBT all at once.

c. No. Funny story, I recently started taking a mood stabilizer that had the unintended consequence of eliminating all the others and leaving me alone in complete silence. It was the worst month of my life. I'm in the process of weaning myself off that medication right now. "
100,"That's a good question, and there's a complicated answer. 

I am currently the ""main"" identity in that I am the one here and in control most of the time. I handle our day-to-day tasks and I have the most comprehensive memory and skill set. 

However, I am not the original identity and I haven't always been the main identity. I was sort of thrust into this position and I'm handling it as well as I can. "
101,"I've seen her several times, the family and I get together every couple of years. I know there's the father's DNA in there too, but DAMN, does she look so much like me at that age! It's wonderful and fascinating, and I really got a great couple to do this with. 
She's too young to know all the exact details of her conception, but they plan to tell her everything once she starts learning more about the subject. (Right now I'm just a ""family friend"" to her). Usually we go out for dinner or something like that, and last summer I went to see a play she was in, it's a great relationship."
102,I always heard it called a Coney Island Whitefish when I lived in NYC. 
103,"I have a point of use filter system.  But that's because of the lead solder in my houses pipes.  

I like Lake Michigan water, planning on swimming in it tomorrow "
104,"No particular opinion tbh. Not thrilled with the recent election because as a consequence the rights of a lot of people are undermined. 

Mostly, it's the land of entertainment where a lot of tv entertainment comes from. I would not move there though. Too much violence. "
105,LOL
106,he did an interview and said the only reason he hadn't invited Drake is because they hadn't talked in 3 years. 
107,"Lots of places expect you to break your back for their objectives. I did it as a funeral director, in the Army, as a teacher, it's everywhere. Now I chuck bags into airplanes and get told to take breaks, days off, and my supervisors like to talk about all the ways you can game the system to get paid more for taking hours on my regular days off and putting up my regular hours for other people to take. Mandatory vacation days and union protection, not too shabby. I'm not entirely sure how to get a negative eval around here, I'm not entirely sure anybody is paying attention to what I'm doing."
