,text
0,Looks like you cut your own hair.
1,How many times have you been kidnapped by a CPR instructor?
2,"Damn dude, grow a pair... of anything. "
3,You should work for McDonald's as a guide for the chicken nugget shapes 
4,"Reported - the rules clearly state you must be holding the sign, and it must be handwritten, not written by toe."
5,The issue with you is that we have no way to know for sure if you agreed to do this
6,How do you shit? Does someone just hold you up and squeeze you?
7,You look like an off brand Pillow Pet. 
8,That wheelchair must have cost you an arm and a leg......and another arm.....and another leg.....
9,What's the point of the cup holder?
10,"First off, cut your hair, you look like a woman with that haircut. Most girls aren't attracted to that look. 2nd, delete facebook and hit the gym. You look like a twig, you got no chest and your arms are small as hell. It'll take a while, but I'm rooting for you bro. We're all gonna make it."
11,"I'm pretty sure you're meant to fry nuggets, not roast them."
12,"Taking a selfie in your office, I see."
13,"Like your eyes, you and your therapist just grew apart"
14,"Glad you quit while you were a head.
"
15,Interesting for people to see where your porn career once started
16,World's Grumpiest Twister Player 2017.
17,The alternate reality where Wolverine spends his whole life in his mother's basement and never discovers his healing powers beyond his virginity being left entirely indestructible.
18,Is that a toe thumb in your pocket or are you just happy to see me? 
19,At first I thought the picture hadn't finished loading
20,That's what gold is for.
21,"When you drop to your knees, it's not to pray."
22,Mirrors don't count.
23,Is lesbian another word for a girl who cant be bothered with her personal appearance 
24,"Blink ones for yes

Edit: Dammit! My top rated comment it me making fun of a disabled person. 😖"
25,Mr Beans oops child.
26,You are a walking argument for Japanese isolationism.
27,did bethesa design his face?
28,How many pregnancies have you terminated in that bathroom?
29,"Why did OP fall of the swing.
He had no arms

Why didn't OP get up?
He had no legs

Why didn't anyone help him?
He had no friends."
30,"As an employee, I can verify we do not use Stephen Hawkins stunt double as a 'nugget guide'."
31,I can't do worse to you than birth already has.
32,*googles plainest city in America*
33,This is why you never skip leg day. 
34,"Well, he HAS cups. At least B."
35,This is why you don't mess with the eye distance sliders in video games.
36,i should be able to up vote more than once for something this brutal
37,How is it possible to look 16 and 87 at the same time?
38,Do you roast vegetables or steam them? 
39,You guys should look into the gay route because let's be honest the straight path isn't going to work out in your favor.
40,Living proof that not all women with big tits are attractive.
41,he's probably upset because he doesn't have limbs.
42,[Reminds me of the training dummy from The Office](https://i.ytimg.com/vi/qdB-bvMRXr0/hqdefault.jpg)
43,Who needs a hat when your forehead can cast a shadow over your face
44,If you're happy and you know it clap your hands...
45,Let us know when the gonewild posts start. I'm assuming it will be sometime around when you figure out that the Anthropology degree you get is completely useless in modern society. 
46,"You look like the punch line to a ""Your mom had sex with a camel"" joke"
47,Your hair looks like a baseball cap of autism 
48,Tis but a flesh wound!
49,I feel like you haven't been kissed because everyone around you is usually trying to avoid a lecture. 
50,Twos for no.
51,"Nothing quite says ""We're a gay couple, everyone knows it, but we aren't open about it"" quite like announcing that you're not a gay couple to a couple hundred strangers that don't give a fuck."
52,[deleted]
53,"Knock, knock.
Who's there?
Not OP"
54,That hooker cost an arm and a leg but those were the two best nights of my life.
55,You look like you started a cult and no one showed up so you didnt bother poisoning the refreshments and it turned into you eating chips ahoy cookies by yourself.
56,"&gt;""Underrated comment""

&gt;is top rated comment   "
57,"Never been kissed? Thats so unfair, after all the hard work you did helping santa get through the storm. "
58,"When you eat, does it all go straight to your knees? 
Are they that thick for padding?"
59,I think she just died from reading your comment.
60,You look like you think 9gag is hilarious
61,when you play world of warcraft so much you become a race.
62,http://www.slate.com/content/dam/slate/archive/2001/10/52000_52487_toothpasteani.gif.CROP.original-original.gif
63,What did you tell your barber? Make me look like a retarded Ace Ventura?
64,"World's Best Bowling Pin, 2017. "
65,"Title says 18, face says 16, tits say 10"
66,"Well to be fair, he isn't *holding* the sign. "
67,Please Stop before it gets out of hand.
68,Trump *is* your President.
69,You look like the kind of person who'd stick that sign in front of a quadraplegic because he can't do anything to stop you. 
70,i'm still alive but i'm barely breathing 
71,Im pretty sure we could find someone hotter at the animal shelter.
72,"So, do you ride your horse to your harp lessons, or do you like to keep your passions separate?"
73,You have man hands
74,Going to a party and making all the girls disappear doesn't make you a magician.
75,Are we roasting him or Bethesda here?
76,"1.  Ginger
2.  Acne
3.  glasses
4.  Dresses like a douche
5.  Gay

you are every parent's worst nightmare"
77,Did Moses part your eyebrows?
78,[deleted]
79,I can't think of anything. I'm stumped. Oh wait no. You are.
80,"That skirt isn't four fingers from your knees, but we all know you're way past four fingers already."
81,they were just on different levels
82,It looks like you paused halfway into making a Larry King cosplay. Good job on the hairline.
83,"*Teen african and muslim born and raised,  
On youporn and tube8 was where I spent most of my days,  
Spankin' and wankin', fappin'  all cool,  
Just shooting some jizz up outside of the school*"
84,That's the oral office 
85,"Suuuure.  You're ""straight"".  And so was the Scout Master who gave you your first kiss. "
86,"He never skips leg day.

Hell, he never skips AT ALL"
87,A girl has no mirror
88,and started. 
89,"Sure tells him she's in church  
But she doesn't go  
Still she's on her knees  
And Scotty doesn't know  

Edit: Thanks for the gold.  
I'd like to take this opportunity to thank /u/MattDamon_ for doing Fiona every Sunday in his van, in Scotty's front lawn in the snow, and most importantly on Scotty's birthday. The dedication you put into the song about Scotty's girlfriend is only exceeded by the dedication you showed her when told Scotty she was out shopping. In actuality she was under you and you were not stopping. Thank you once again. Without you, this comment would not exist. Also I'd like to give a shout out to Scotty, but he doesn't know why.

Edit 2: I'd like to thank /u/MattDamon_ for the second guild. It says ""an anonymous redditor"" but I know it's you Matt. I know."
90,Yes yes....  Well boys looks like it's fair game
91,It's not a crime to wax your upper lip.
92,"I feel like I could unscrew and remove your hair in one piece, tie it to a rope, and use it as bait to catch lonely business men."
93,It's nice that you invite the homeless guy in from the cold to have lunch with you.
94,You know it's bad when you're home schooled and your teacher thinks you're autistic. 
95,Underrated comment.
96,You look like the dad from The Oblongs. 
97,"&gt;Just broke up with gf

So you threw your pillow away? "
98,"You should be proud. You are a real life Picasso!
"
99,"""I have no actual accomplishments worth mentioning, so instead please let me tell you about my ethnic background and about how important my father is. Also I'm quite tall...and heavy."""
100,You look like a warning label for incest
101,Those eyebrows are not natural. She bothered and she failed.
102,You think a porn addict would have bigger arms... so I'll assume you use your lips. 
103,Holy shit hahahhaha
104,Arnold from the magic school bus was so much cuter as a kid...
105,You should try figuring out a magic trick that will get rid of your man tits. 
106,That awkward phase when you look like both a child and a pedophile at the same time. 
107,Look behind you to see another thing you have an affinity for.
108,I bet you only have Snapchat to send post blowjob selfies
109,"dude i laughed so hard i lost my breath

this kid idk what hed do..."
110,"I'm concerned that if I roast you, you will detonate."
111,"Because as much as you wish it were Gender studies isn't a real career and for the record a 4.0 is easily achievable when it's revolved around basic core classes centered around opinions.

P.S. You look like micheal jackson "
112,Delivered:  http://i.imgur.com/KxdhsBv.jpg
113,"Eh, his uncle isn't much better looking."
114,So the testosterone injections seem to be working...
115,Ha. Specky four eyes whata nerd
116,Do you starve yourself to avoid getting curves and becoming unappealing to your priest?
117,Picture loaded fine. OP.... Not so much.
118,"&gt;Stephen Hawking's stunt double

please tell me that was original"
119,You are hot enough to have a very good life but you will probably achieve nothing by yourself 
120,"I'm neither of them. I got both of their consent about this. The first one, the one in this picture, agreed twice because we had to upload this a second time (the first one didn't have the paper on his chair so we violated the ""must hold the paper"" rule.) As for the one with the girl in it, she thought it would be fun to do it. No one was forced. And to why he looks so upset in the picture above, maybe he just doesn't like to smile in pictures."
121,"Classic ""I hate my super conservative rapey step dad so I'm gonna get some piercings and a tattoo"" 

Allow me to give you some advice. When you get to community college, try not to flunk out like your mother did. Otherwise you'll likely marry that smooth talking wife beating alcoholic you met at the Brew and Cue. Coming to the realization a few years later that you've completely fucked your life up and that this is no environment to raise a daughter. Eventually you'll marry some conservative asshole and tell everyone how blessed you are to have Jesus in your life. Meanwhile he'll likely molest your daughter and she'll grow up hating her step father and resenting you. Around the age of 17, with a myriad of daddy issues, she'll get some piercings and a tattoo bc....well you know. 


Anyways, hope this helps."
122,You look like if Clark Kent went into a phone both and changed into a retard.
123,He has a semi-colon.
124,"TBH you are hard to roast because you have absolutely zero distinguishing features. You're just neither here nor there. I bet you are constantly having to tell people your name, despite having met them multiple times. The only unique thing about you is your social security number."
125,"Population: 12, only 2 white women in the town and the other one is in her 70s. OP won by default."
126,Could have a future in porn featuring the younger donald trump haircut.  
127,"If you're not gay, prove it, suck his dick without getting a boner"
128,You look like your about to end up frozen on Mt. Everest because your Sherpa is retarded
129,"I'm pretty sure you're meant to eat nuggets, not raise them."
130,you're the type of girl that human traffickers put on clearance
131,"""Some assembly required"""
132,Your Town must have pretty low Standards.
133,I heard he became one of the prominent members of the Unfuckables. 
134,The No Breakfast Club.
135,/r/thathappened
136,"It's Abraham Linkin Park..
"
137,I think it is worth repeating that you are fat and have a weird circle head.
138,Fuck this is too real
139,Holy shit! Great R2-D2 cosplay!
140,"""Hold me cards while I make this sheep's virginity disappear"""
141,How do you recognize a lesbian? they'll tell you.
142,It looks like a Lego minifig piece that isn't snapped all the way on.
143,You look like the kid who turns into a monkey from Jumanji
144,"&gt;18

checks out to me "
145,Bethesda roasted themselves
146,Women?
147,Jesus Christ! A 7 foot tall Arab?!? You must scare the fuck out of the goats in your harem
148,this is my favorite so far lol 
149,What do you call a dude with no arms or legs laying on the floor?  Matt.
150,He's a lot easier to fit in an oven than most people who post here. 
151,Best comment hands off
152,The only difference between you and someone in hospice care is that there's really no hope left for you to have any sort of romantic involvement before you die. 
153,Probably the same reason your ornimental bird can't stand the sight you.
154,Does the carpet match the drapes? Will any girl find out? 
155,"All the ""Rudulph the red-nosed reindeer"" fetishists get their fix elsewhere these days, sorry."
156,"Future Walmart cashier. I can smell the pungent odor of desperation, regret, and menthols."
157,"Lol you're 17, you're just a high school student not a 'physics student'.

You shouldn't give yourself fake labels such as 'physics student' and 'straight'"
158,Lesbihonest
159,What's black and sits at the top of the stairs? You after a house fire. 
160,"And let me guess, you're a ""virgin"" too. "
161,That's why she quit after 3 days. 
162,African Muslim Jaden Smith is that you? 
163,You look pretty comfortable in your surroundings. I guess you've got used to being bent over in the bathroom stalls.
164,If your eyes had any more baggage you'd probably use the excess for a decent boob job
165,"&gt; You are a real life Picasso!

I think those are supposed to be worth something. 
"
166,Starting a GoFundMe to stop your parents from getting deported doesn't count as starting a nonprofit.
167,"I'm here.
"
168,If you were hot you wouldn't be getting roasted for attention 
169,Have an Anthropology degree can confirm
170,You're assuming it didn't start before this...
171,The 2 of hearts is your magic card and also the number of transplants you'll have before age 35.
172,"I dont think your therapist knew he was ""dating"" you."
173,"You can't? Fine, stomp your feet then."
174,You know that there is gluten in cum right?
175,She is responding to the comments referencing blowjobs 😂😂
176,"""...Put down ugly...""


That is what your parents should've done on the day you were born."
177,That's what they all say... 
178,You three will grow up to be wonderful single angry feminists.
179,That report is the funniest part of this thread.
180,Best comment hands down. 
181,Are we allowed to roast him? It seems against some sort of humanitarian policy.
182,"Separate. 

Like her eyes."
183,well done lol
184,Your face just screams that you fantasize about your dad 
185,"Catholic? Well, now I know who gave you that hickey..."
186,You look like the cheerleader for a bowling team
187,"Well, her vagina is. 

Because everyone knows that sex in the ass is the sex that god can't see."
188,Yours makes up for it.
189,Negan didn't finish the job. 
190,Judging by your shitty messy apartment and cheap furniture your father must be the mayor of a refugee camp.
191,Your face looks like what happens when you fuck with the sliders in the face-customization of an RPG.
192,Everyone can tell when it's that time of the month because it reeks of formaldehyde 
193,I've never been able to literally count the frames in a gif before
194,You look 50 from the neck up
195,and what he might've looked like
196,"You're a loser, Harry."
197,"His mum, like everyone else, says nice things because they don't want to be murdered by this guy"
198,"Clarice...
"
199,Needlessly brutal as the god who misplaced her chromosome.  
200,That country isn't the only thing that needs to be closed.
201,The reason he can't get a girl is cause he looks like one of those duck cartoons
202,David Plaine
203,I guess they didn't see eye to eye
204,First off...maybe tell people if you're male or female
205,"Of course you have a crush on a video game, your controller is the only thing non-sentient enough to fuck you."
206,I saw John Belushi fucking a fistful of grease.
207,You should fuck the chicken nugget guy. It's your best shot.
208,The two of you prove that ugly knows no race.
209,Sorry about the breakup. Im sure you'll still be pretty close cousins
210,Dam. I thought I was the master of knowing 10 year olds tits but you got me beat
211,"World's Shortest Scuba Trip, 2017"
212,***ಠ_ಠ***
213,You are wearing the shoes of a homeless transgender hipster from portland
214,Do you often get people requesting that you make yourself disappear? 
215,"World's worst guitar player, 2017.  

"
216,With a head that size im surprised the lightning didnt hit more than once.
217,and here we see the neckbeard in its larval state. 
218,"&gt; grew up potato farming

Bit of an offensive name for your special needs education, innit?"
219,"As a cisgender, straight male..."
220,Let's give this man a hand for his bravery. Maybe even a standing ovation!
221,"Holy crap kid, does your dad know you are gluing his pubes on you face? "
222,I can see why she binge drinks
223,"I wouldn't worry about 'im too much, he's 'armless."
224,"https://www.reddit.com/r/birthcontrol/comments/4boxw2/is_the_time_you_take_the_pill_everyday_very/?st=J0IKXCGU&amp;sh=7a74ecbb

Starting porn career early?

"
225,"Hitler Youth Application has a big red **REJECTED** stamp at top.  With the note ""Too dorky"""
226,It already has.  Someone's getting a foot in their ass.
227,"The Geneva Convention only applies to *armed* conflict, so I think we'll be okay.

"
228,You got lunch lady jugs
229,"You look like John Belushi in a dress, pretending to be retarded."
230,I don't know I thought it was pretty obvious that he can't hold a fucking cup himself
231,Your 35 year old boyfriend must love that skirt. 
232,Sticky this post and you still won't get the attention you want
233,I've never felt so bad about laughing before. Idk whether to thank or curse you
234,"Hahahajbahaba...
We're going to hell"
235,"""Not holding sign""

Lol"
236,"No, extra crispy"
237,"If my mother was naked and dead in the street I would not cover her body with ""that"" jacket. "
238,What am I looking at?  It's just a basement filled with broken down junk
239,http://imgur.com/abSYbzI
240,I think it's nice that the four girls on the right hang out with the retarded one on the left. 
241,He just said he wanted an Ace Ventura. The retarded is automatically assumed with him. 
242,"*Blinks twice*

That's ""Yes, yes."" He's alright everyone, carry on !"
243,A fucking dumpster. 
244,His face surely isn't showing it
245,They're fucking massive lol...And she must be from a small town in Idaho if that's their best. I can smell her plug holes through the screen. Looks like all she does is snort ketamine and listen to vaporwave
246,*lukewarm-est bitch in town
247,What happens when you use a default face on dark souls 
248,First off the band is Smash Mouth. Secondly you look like your favorite television program is the cctv footage from your local elementary school.
249,He looks like a professional salesman for a cheap off-brand dish soap.
250,If you haven't already been fucked by a 23 year old college student who uses poetry to pick up gullible high schoolers at shitty parties I'll eat my hat.
251,I feel like the other side of that paper is your list of people you're going to kill at school. 
252,"I see you're already making good use of your local free clinic.
"
253,You look like you're each constantly worried that everyone else in the group secretly hates you
254,Harry Potter and the Botched Sex Change 
255,y=-1/2x hairline
256,You look like someone who uses an abortion clinic more often than the library.
257,Overused useless comment.
258,"&gt;""Underrated comment""

&gt;7k upvotes"
259,Your eyes don't share the same area code
260,That chair looks pretty cool though. I wish it was just a picture of the chair.
261,"You look like you're in a shitty, all-female-cast reboot of Wayne's World"
262,You were in the parking lot earlier! That’s how I know you!
263,You're just a neckbeard away from your final form.
264,[deleted]
265,Straight as a curly fry.
266,"Stay tuned for previews of next week's episode of ""Not a Fucking Chance!"""
267,Pretty light for a 7 footer.
268,That was.. original..?
269,"Going for that Robbie Rotten look, huh?"
270,"&gt; Is there a porn fetish for [...]

The answer is always ""Yes""."
271,You must find it very easy to make pretty girls disappear.
272,He's probably a VIP member to Celebjihad 
273,"&gt;You **may** post on behalf of other people

This is right in the rules. Try reading them next time.

EDIT: [Whoever did this, thank you](http://puu.sh/uMmny.png)."
274,http://imgur.com/vpBS5M1
275,You have the perfect look for a poster reminding gay men to get checked for aids.
276,"""And for my next trick..."" (pulls gun out from bag)"
277,cycle of life . Ingonyama nengw' enamabaal !
278,Was this photo taken at your most recent child molestation hearing?
279,"Yeah, her tubes"
280,I'll tell you what I tell every aspiring art student: I'll have a coffee please.
281,Oof.
282,Can't find your gonewild posts :|
283,You're both in an acapella group called the skinflutes.
284,Well you got me there.
285,But who knew the caveman from the geico commercials was gay? I wouldn't have guessed.
286,Not from a Jedi. 
287,"She's got nothing on my man [Bolbi](https://pbs.twimg.com/profile_images/378800000377462388/e18fcb63ab48b4d3e4c804780e58c485.jpeg)
"
288,Hard to roast you when it looks like your face is already melting
289,Goto the clinique counter and ask for help. Love yourself and someone will love you back even more. That beind said. Your teeth shouldnt match your hair color. I really cant be mean to you. 
290,you look like Dog the Bounty Hunter before he found out sun exists
291,"Hmmmm....Career choices. Papa Johns or Pornhub. Either way, you're fucked."
292,Best comment no hands at all
293,"Just because you can buy Mexicans at Home Depot, doesn't mean you have friends."
294,"hobby?
"
295,Or her entire face.
296,They look like a broken pair of Oakley sunglasses. She might be able to get into their marketing department... to get coffee
297,"It's a tough call as to who's fucked more boys, you or the priests. "
298,"Where do i start? Looks like part of both your eyebrows are falling off cliffs, and your head got crushed in a vise."
299,"Your lips say Michael Jackson, but the way you hold that sign says Amanda Todd. "
300,"OP account has posted before about dressing in female cosplay (and another ""r/roastme"" post featuring a female) and is probably not this kid..."
301,This time you hid your fucked up teeth and accentuated your tits. B+ for effort.
302,You look like you're struggling to hold that sign up 
303,"Because STRAWS
"
304,"I have never before seen two straight guys friendzone each other, but now that it's happened, I understand."
305,"actually not a hickey, I just have sensitive skin :/"
306,If you blow-dried your hair you'd look like one of those cute little trolls everyone owned in the 90s. but ugly.
307,A more boyish appearance would likely have the opposite effect.
308,and 70 from the neck down.
309,Is it possible to learn this power?
310,"""sassy"" and ""chemical loving"" sound like code words for ""drug abuser"" and ""slut""."
311,"A slutty schoolgirl outfit and pigtails... Wouldn't it be easier to just wear a sign that says ""I have daddy issues?"""
312,/r/wholesomeniggashutthefuckup 
313,"You are 17 going on 70

Black hairy tongue would be better than those eyebrows."
314,"If you look close, you can see the lipstick on the one behind him."
315,I'm going to go with boil then mash.  Because that thing in the picture is clearly a potato
316,Where do you think they found her? 
317,*phffft* *phffft* *phffft* *phffft* 
318,Is everyone going to ignore his top button what are you fucking gay?
319,It's a lifestyle.
320,Jesus Christ man. It's r/RoastMe not r/VivisectMeAndBroilMyOrgansIndividually
321,Don't worry when you rape a girl you can say you didn't know the law.
322,"OMG look at that sign!  Look at that room!  
  
Are you the person who stuck a ""Roast Me"" sign in front of [this guy](https://www.reddit.com/r/RoastMe/comments/5zs3sn/do_your_worst/) just for laughs?  
  
That is fuking brutal."
323,wow that one got me lol 
324,I can see *that* her mother binge-drank.
325,My soul whimpered when it read this. 
326,He's like a mix between an orc and a gnome 
327,Pretty sure this roast would violate the Geneva Convention. 
328,"Nice man, magicians don't get enough respect. Good luck with the career, it's a tough road, takes balls out confidence, and is all about projecting an image. So big props for having the cojones to publicly post a pic that shows where the magic doesn't happen."
329,"Let's just put it this way, she doesn't have a lot of clothes, but her closet has a lot of hangers..."
