,text
0,Well we know it wasn't because you cheated on him 
1,"Nice angle, but we can still tell you're fat. "
2,literally the only time a dude has left a chick because of too much head lol
3,"Sure, just send us her picture. "
4,If Mia Khalifa chose crack over cock
5,There's 3 assholes in this picture
6,It's pretty rare to see a Pilonidal cyst located on the face. 
7,"It's not your fault, man. She's probably just one of those stuck up bitches that's into good looking guys."
8,"http://i.imgur.com/VsyPQwX.jpg
"
9,"A drawing for you:

http://imgur.com/xligZ21"
10,"You're 5'8"" normally but 6' when you look surprised.
"
11,You look like you use the same bowl for Cheetos and haircuts.
12,"Sure is, you lost 14 lbs in that sketch."
13,Your family wasn't thrilled with you leaving the religion but dropping to your knees just five times a day wasn't enough
14,"A drawing for you:

http://imgur.com/SU3JdYf"
15,Where are you in this picture though? I only see the Greek whore.
16,Maybe cus you still have your name on your door. 
17,Future Housewives of Xanax and Chardonnay season 1 right here. 
18,You kind of look like one of those kids who never use to smoke cigarettes but started vaping as a hobby because it doesn't involve any physical activity. 
19,Is that an Android? Your little cousins would be so disappointed you don't use the iPhone they made for you.
20,I bet even your vibrator wants to just be friends
21,At least she can't cheat.
22,If the government worked as hard at fixing the economy as you do at trying to look attractive we'd all be rich next week.
23,You must be the Trump daughter that's running his steak business 
24,"You look slightly like my [dog](http://imgur.com/gallery/xEykh)

I think it's the eyes"
25,"If you truly want to know what disappointment feels like, start looking from the bottom of the picture and scroll up."
26,"If ""quiet during sex"" was a person."
27,1 upvote for each time she was fucked in college  
28,"You may be Swedish, but it looks like you're expecting some finish on your face..."
29,"Usually girls obsess about having nice eyebrows, I'm glad you don't care as much as every other woman. "
30,"Your father must have a very rich man, most whores won't do beastiality "
31,Just show us your tits.  It's the only reason I clicked. 
32,I'll be honest and keep it short. You're going to age horribly. 
33,Maybe she wasn't into having sex in your childhood bedroom
34,"""Reddit losers"" - says the transexual arab man..."
35,WiFi lag. Face hasn't finished loading. 
36,Help you figure out why he left?!? I'm trying to figure out why he got with you in the first place.
37,So which school did you pick for revenge?
38,You're the before picture of a pro active commercial 
39,You should take those manly hands of yours and try to re-sculpt that pile of mashed potatoes you have for a face.
40,"Man, that sucks...hope you can afford a new goat soon."
41,"Good, cause no one could ever love you. 

"
42,Didn't I see your bros drinking milk and wearing bathrobes on It's Always Sunny in Philadelphia?
43,Did the whore fuck you in both of your anuses or just the main one?
44,"I mean I can't really roast you, you seem like find upstanding young man. Clearly your Grandma has done a heck of a job raising you."
45,"It's like Jafar and Jasmine had a kid, and that kid started smoking heavily at age 8."
46,shield doesn't work when there's a chink in the armor
47,Look at them arms
48,Looks like you been carrying all your emotions in those bags under your eyes. 
49,The only thing that'll collapse quicker than your lungs &amp; arteries is that chair you're sitting on. 
50,Because he finally finished his map of the great expanse known as your forehead. 
51,"I had surgery for a pilonidal cyst two years ago. Before the surgery it was an absolute nightmare with it getting infected and then drained constantly. 


The surgery wasn't bad, but the recovery was long and awful. It was like 50 days of daily packing changes. But I haven't had any issues since!


I don't know if you need surgery or have already had it, but good luck. I know it sucks. 


Faggot. "
52,This is amazing 😂😂
53,Why do you want us to do our best when you clearly haven't?
54,You're the douche that never deployed but still managed to get PTSD and you yell at your neighbors about being insensitive when they light fireworks on the 4th
55,Sucking somebody off on a one night stand doesn't make them your boyfriend
56,http://imgur.com/vVppzlB
57,Except that OP settled for both. Gotta get that crack money some how.
58,"that wholehead

http://imgur.com/a/f2XzC"
59,nice camel toe
60,"You look like the kind of woman who is going to quit giving blow jobs after tricking a guy into marrying you by lying about being on birth control in your early twenties and sell body wraps on Facebook for a ""career""."
61,You seem to be an off brand meg from Family Guy that learned to use makeup.
62,Instead of posting it here I just yelled my roast out loud. You heard me.
63,At least her tits have tits.
64,A wild Jynx appears!
65,"if there were six more clones of you, your dad could upgrade for a goat."
66,"Forget about your boyfriend, it looks like your eyes are trying to leave each other. "
67,That's a bit harsh on your dog
68,"A drawing for you:

http://imgur.com/RebWZvH"
69,"The papers not hiding anything, we all know your tits are just as flat as your nose"
70,Yeah she could be into athletes! Or people with a personality. Or confidence. Or basically anything.
71,"Rub your face on my door hinge, it's squeaking."
72,You're the reason the burka was invented.
73,"I love giger but I'm not here to compliment your wall hangings. 

I'll leave this here. http://imgur.com/1nkj4q4"
74,"Update, Amelia is his her name, his name is Justin.  He came home to find the name ""Ben"" on the door, and his clothes in a box outside it. Thats how he got the news."
75,"Game. Set. Match.

Unfortunately we got the photo of the ugliest of the 3.

"
76,First time I've seen someone wearing their anal beads like a bracelet. 
77,Like an A-bomb
78,0_o
79,You look like a Taxidermist stuffed a dead burn victim. 
80,So you decided to hide the only thing that is not massive behind that tiny piece of paper?
81,He only vapes because they're flavored.
82,You must be OP's ex. Do you have any more pics of her?
83,"Based on your facial features, I'd say your family has been using ancestry.com as a dating website for far too long and I applaud your sister for trying to finally break the cycle."
84,Please show us the raptor eggs again. 
85,A good day? So the abortion took?
86,"You're one of those girls who say ""dont say I look like Lucy Liu"" when absolutely no one was thinking it. "
87,How fucked is your autocorrect that it goes from Aspergers to Aryan 
88,Yeesh...better get used to it...
89,Your face looks like an uncomfortable itch that can't be scratched
90,You look like Robert De Niro's Pilonidal cyst 
91,Looks like you fell off the meth wagon face first.
92,Fucking hell even geometry thinks you're ugly 
93,"You're what's known as a trophy fuck.  

But just a participation trophy. "
94,The 'quirky' decor and 2007 bowlcut didn't help distract from your serial killer eyes
95,I didn't know they made KFC flavor for vapes
96,"If you're gonna pay 50 bucks to have brows waxed back from their Neanderthal proportions, then why spend 12 bucks on that strip mall  hair cut that screams ""I want to be a stay at home mom after I let myself go completely."""
97,Looks like your eyes got a divorce
98,Wow imagine being that ginger fella. Putting all that effort into making his body more aesthetically pleasing and his face still looks like an inside out jack-o'-lantern.
99,Maybe it's because I can visibly see the self-loathing in your eyes
100,I can't put my finger on it. Because it would burst.
101,"If this it the girlfriend I wonder how bad the boyfriend looks. 
"
102,It's been a rough few weeks fam
103,Your own mother made you pay for sex? Shameful. 
104,"After not being able to discern your biological sex from your picture, I went back to the post but you used the gender/sex-neutral pronoun ""person"" so I'm still confused as to what you actually are. Once I determine your gender, then I can try to properly roast you."
105,I didn't know Lloyd Christmas had a fat sister
106,Is this the future?  Unidentifiable genders.
107,"No amount of pretty blue eyes or DSLs are going to change the fact that your going to be a single mother right into college.   

Did you finally get that eating disorder in check?"
108,"Has been saying she is ""just one of the guys"" since you started dating huh?"
109,A year is a long time.  How much longer until you decide which sex you want to be?
110,Lol you wrote it on your arm before realizing that people in Auschwitz had bigger arms.
111,"So to cope you decide to post to r/roastme...

"
112,"You have this whole ""midday stripper"" glow about you"
113,"not sure if the tit job or the ""I need to see your manager"" haircut was the midlife crisis "
114,Wow. I guess even narcissists can have low standards.
115,The US stopped roasting Asians in 1945.
116,"Hey, you accidentally posted this twice.

http://www.reddit.com/r/RoastMe/comments/4vgxso/we_all_know_the_game_roast_me/"
117,Your girlfriends father cringed a little bit when he found out you were asian 
118,This sub doesn't have nearly enough subscribers to pull that off.
119,"What eating disorder? You mean when she eats dis order of pizza, and dat order of fries, with a side order of a milkshake? "
120,you could have used a much smaller plate to hide what are most likely mosquito bite titties
121,of course there is jizz on your shirt.
122,"Yeah, you're about as Chinese as a chimichanga is Mexican"
123,You must be new here
124,"You're definitely the kid at every vape store that sits around all day talking about your ""sick rig"", ""testing"" all of the flavors, bothering the poor guy just trying to do his job. Bro, you don't even look old enough to grow hair on your ballsack. Hitting the vape pen isn't going to help that acne ridden face of yours, try taking a shower and going to the gym because it looks like your gut hangs so far, you probably can't see your own penis when you're taking a piss. Damn son, I can smell the Doritos from here. "
125,Show me a picture of the babe and I'll let you know 
126,"Tattoo? Bald? Tight shirt? Casio digital watch?

Save some tail for the rest of us, man."
127,You look like a stock inmate in any video game scene that takes place in prison.
128,It somehow helps
129,"I don't know about unroastable, but he's definitely unemployable"
130,Maybe she just wasn't keen on you keeping tabs on everyone that's ever touched you on your door
131,"The first instance of ""my face is up here"" being used as a jump scare."
132,You look like the retarded version of Christiano Ronaldo and Wayne Rooney 
133,Unfortunately the only thing that got roasted was your dog.
134,"you look just like ygritte from game of thrones





After john snow lit her on fire. "
135,[deleted]
136,This is so passive aggressive that it's beautiful 
137,You look like mr. Clean got cancer
138,Her eyebrows make a full circle around her eyes once a month
139,I love it
140,"That smile says ""I never get laid."" 

Being good at math isn't the only reason he knows what 3 inches is in cm. "
141,http://imgur.com/hCC049u
142,"&gt;Good game, well played"
143,"Mods, please flag this as child pornography. That poor little girl is being exploited. "
144,"Those shorts are on borrowed time, but that's what happens when you're too short for Big &amp; Tall, but too fat for Boy's Husky."
145,Start by making out with a toothbrush first
146,Nice ass-cyst!
147,"If someone told me there were pictures of children in your house, I would not have expected clothed ones."
148,It was the best one a few months back too
149,http://i.imgur.com/07tWWP5.gif
150,"Not masculine enough to be handsome, not pretty enough to be a girl. You're fucked.
"
151,Megamind
152,"Guys, stop being mean. This guy has a lot on his plate. Like cats and dogs."
153,It's just nice to laugh at myself today I guess 
154,I need to catch a flight just to go from your left eye to your right eye
155,"You look like a 14 year old who face swapped a 40 year old.
"
156,"""Local woman who kept 28 dead cats in her freezer arrested after meth deal goes bad"""
157,I want to post a picture just to get a drawing from you
158,A flatso. The worst of both worlds.
159,That is actually a...compliment. 
160,Did that experience bring you ONE STEP CLOSER TO THE EDGE? 
161,Gyms have mirrors too ya know...
162,Bet your family's already preparing the honour killing.
163,You can't go on /r/roastme and actively try to defend yourself you dumbass dickhead
164,Gives a whole new meaning to *Virgin Airlines*
165,A year? Wow. It seems like just yesterday that your father passed.
166,"Eh, a rural 10 is a city 7 at most."
167,"Your eyes say meth, but your stringy ass hair says... oh wait you know what? Meth. The hair says meth too."
168,Some brow
169,"Your U/ should be ""I am called Jennifer now"""
170,The baby was more relieved. 
171,"ah good to know so you're probably going to stop by a harbor and then a school 
"
172,So can her hair
173,What flavor is that? Ham?
174,You should have been on the titanic. Spotting icebergs like that is a true talent.
175,"Lemme guess.  You are the guy in the military who even on his days off wears his tan undershirt, tucked into his jeans, and combat boots.   Douche "
176,"I would roast you, but I'm afraid of causing a grease fire."
177,Don't tell me what to do
178,You realize your head is now literally the shape of a penis right?
179,All I see is great value Kim Kardashin
180,Ow piss off. We are here to roast HIM. Not ME also.
181,/r/iamverysmart
182,"i don't want that to be the first thing i see when i wake up, ever."
183,a wild snorlax appeared!
184,And the mattress is on the floor
185,Didn't realize the crimson chin was getting a live action TV show . 
186,On the plus side she still said he will always be her big brother.
187,You look like a sex doll designed by someone who has but a vague idea what an attractive human female might look like.
188,"""Give me the [Lloyd Christmas.](http://www.comicbookreligion.com/img/l/l/Lloyd_Christmas.jpg)"""
189,"Hope you had fun in Hawaii for 4 years, cunt"
190,[Maybe it's because you're batshit crazy.] (https://www.reddit.com/r/bipolar/comments/4uaae9/my_boyfriend_left_me_two_months_after_my_bipolar/)
191,Incestry.com
192,"I'm fine with all that, but please take the wig off, bro."
193,What kind of props? Chair and a rope?
194,Pelvic exams don't count as sex. 
195,[your teeth](http://vignette2.wikia.nocookie.net/familyguy/images/b/b0/Bacx21_611_03a-0104_hires2.jpg)
196,http://cdn1.images.videobash.com/photos/000/107/959/107959.jpg
197,Had a good day? Did the child support come in today? 
198,"It's like feeling Hungover, and slamming fireball for half an hour.
"
199,"A drawing for you:

http://imgur.com/Wa9vXZQ"
200,"Yeah, I mean...I'd *definitely* fuck the dog...

...OP, not so much."
201,"judging by your face, you're gonna need wayyyy more bracelets to successfully hide all your cutting scars"
202,No ring on your finger? Your parent must feel great dishonour 
203,Maybe now you'll stop trying to fuck your cousins. There's been too much of that with your family already. 
204,"So, instead of whacking each other off you just lay next to each other and masterbate?"
205,[There it is](http://i.imgur.com/u3y25YV.jpg)
206,If Peter Dinklage had a less successful normal sized brother
207,"Lemme guess, head turned like that so we don't see your Swastika neck tattoo?"
208,http://m.imgur.com/gallery/9ocIeh2
209,"and just like little caesars, she costs $5.00."
210,"Everyone can go home, this is the only post on the account."
211,Funny... most women wear their camel toe in their underwear...  not on their chin.
212,Future Participation Trophy Wife. 
213,"I like your setup. Each morning when you wake up you get to see everyone you know looking down on you, just like in real life."
214,You probably said sorry unnecessarily too many times.  
215,I suddenly want to vote Trump 
216,"Going with the ""blur the camera so I don't have to see how ugly I am in high definition"" look, I see"
217,you look like the kind of girl whose only accomplishment in life will be giving 31 guys the second best blowjob they ever had.
218,Put your hands together for this years Caitlin Jenner everyone! 
219,Oohhhhhh I can feel the burn from here
220,you bastard 
221,whoriental
222,Your body looks like it's made out of raw chicken skin. 
223,I put on a shield every time you get behind the wheel of a car.
224,Why are you asking got to get burned on reddit?  There are groups who would gladly do so in real life. 
225,"Great. Now those protesters have to change the signs to ""Most Black Lives Matter"""
226,"Trust me, your cleavage and the red glasses won't distract us from these ugly finger tattoos you got in 7th grade."
227,"If we roast you, world hunger would be solved."
228,Kinda small tits for a fat girl...
229,"Just lost his virginity and is already able to sit down, what a trooper"
230,"I don't usually comment, eye just brows. "
231,you smile like you're being held hostage 
232,"Blind kids that stutter, thats how it happened twice."
233,No amount of makeup and fancy camera angles can disguise that you really look like Kermit the Frog's pig wife.
234,You look like every other Asian person. 
235,You look like Voldemort with cancer.
236,"I know this interaction is via the internet, but I'm still checking my wallet."
237,always keep them on hand!
238,"That sign should say "" Mother of two , Any thing helps , God Bless"""
239,"A drawing for you:

http://imgur.com/zVEXcix"
240,"Trust me, I believe you've heard it all"
241,"You're supposed to roast the kid, not try and give him a life changing wake up call."
242,You look like Benedict Cumberbatchs' illegitimate bitch. 
243,This is what all those moms were scared of in Target bathrooms.
244,"""Born Loser"" neck tat?   Check   
   
Blurry finger tats?  Check   
   
Gay shirt?   Check     
   
Hanging out by the help wanted board?  Check    
      
This guy is scoring higher on the douche-meter than anyone I've ever met in person.  
   
"
245,You're grasping at straws
246,"Or just ask the OP, as she slowly realizes that it's only the attractive girls who get successful threads. "
247,"A drawing for you:

http://imgur.com/jU6r4Ge"
248,Loved your work on Reading Rainbow.
249,You get a B in math or something?
250,This is a roast. Your comment is not roast material.
251,"1)harbor
2)school
3)noose"
252,Just need a fedora and you're good to go
253,For a second I thought you were going to be nice 
254,"So what's the plan now? Stalking, kidnapping, trying to secretly live in her closet or ceiling? "
255,":D

Just make sure somebody else hangs it."
256,Maybe you will have better luck after her baby teeth come in.
257,If you grew a beard you could easily pass as a garden gnome 
258,"Whoa man, keep it friendly "
259,"I can tell you've plucked facial hair recently, but damn does your afternoon shadow grow back fast. Monobrow included."
260,"Pink shirt, two assholes, big hair, green apple to wipe the taste of cum out of your mouth...i think we all know who the faggot is here."
261,"I flipped a coin for you, /u/DaveTheDevilsFanDeux The result was: tails
***
^^Don't ^^want ^^me ^^replying ^^on ^^your ^^comments ^^again? ^^Respond ^^to ^^this ^^comment ^^with ^^'leave ^^me ^^alone'"
262,Massive? No. Massively insecure? There we go.
263,If this is what the 99 virgins look like I actually feel bad for the suicide bombers......
264,Like an anthropomorphized fart. 
265,How many hours of flight do you have logged?
266,Rejected because she doesn't want to be seen dating Gilbert Gotfried's son. 
267,"This is your seventh roast.  Are you going to keep posting until you White Knight shows up and sticks up for you to fill that void your father left?  You are not special, you are not a snowflake.  I am sure your parents are really proud of you when they tell everyone about the car wreck that you died in. "
268,Just the right amount of hot and really unfortunate...you'll be showing your asshole on gonewild inside of 3 months.
269,https://s-media-cache-ak0.pinimg.com/564x/cc/49/6e/cc496eb9217642a1c5c674f806d592d6.jpg
