,text
361,You look dead on the outside too
362,Maybe one of these days people will stop co-signing.
363,"Hila swapped faces with Michael Jackson, and Ethan swapped faces with a butt cheek. "
364,He sure won't reach his fifties if he tries to reach the top shelf
365,Fuck you
366,Well at least he'd fit in the oven.
367,"No point in hiding that fupa with the sign, we can already tell that you are one chin away from a heart attack. "
368,Your face has more foundation than your house 
369,"##This is what u/whirledworldwereold said with almost 100 downvotes


WOW😄THAT WAS CRAZY😆😂 GOOD😇 OOOOO😮 DAMN😤 THEY NEED SOME🌊💧💦💦💦🌊TO CALM🛀 DOWN↘⬇↙ AFTER🔜 THAT!!!

MAYBE GET THEM TO 💯 DEGREES TO 💥BLOW💥 OFF📴 STEAM💨💨

IM THE 😄EMOJI😄 MASTER😬 PM💬 ME😊 FOR TIPS😋 BUT NOT AT 🎑MIDNIGHT🕛 OR ⌛LATER⏳ CAUSE IM😊 SLEEPING💤💤💤💤

edit: lol ↘downvoted↙ for a 😂funny😂 😮creative😮 compliment???💌 you guys are 😈😈😈😈! and im 😡😠

edit2: 20 ↘downvotes↙??? you are crazy 😠😈😠😬😠 im just a good 😇 person😁 complimenting😥........

edit 3: im going to bed💤💤💤 this better be ↖⬆↗voted when i ⏰wake up🔝
"
370,"""Intensive care"" isn't a type of lotion, it's where your parents wished you ended as a baby. "
371,You need a second carer for your doublechin 
372,I thought he was bragging about his IQ
373,"You're the cook that says ""HOOAH SERGEANT"" and ""TOO EASY"" at the top o your lungs and still calls everyone your ""battle buddy"" even though you've been out of basic for 3 years "
