,text
0,"""yeah..."""
1,10 minutes into listening to Christian rock and chill and he gives you this look...
2,She used the calculator on her phone for 8 x 7. Her high horse needs to trot her ass back to remedial math. 
3,Pedro Dinklage
4,"Heeeeeeey Vsauce, ISIS here."
5,You look like what Stephanie from Lazytown would like if she grew up being a crack addict 
6,"Last time I saw a face like that, it was getting ready to defend Mordor."
7,Amir Fudd
8,"Somehow there's simultaneously too much make up and not enough.

"
9,I see you've engineered a bridge between your eyebrows 
10,M'pussy and m'crack
11,"""I love working out, hockey, and date rape."""
12,Not being Indian sucks for you. An arranged marriage was your only hope...
13,Syrian Lannister
14,You look like the cam girl I didn't want to jerk off to last night 
15,Ethan trying to justify the holocaust was so fucking funny
16,Why do you have 2 hairlines?
17,"I've never seen someone with a bald spot on the side of their head before...

Have you learned how to make fire yet?"
18,15 thousand years into hunter/gatherer and chill and he gives you this look
19,"So uh, did you choose hard mode before you started life?"
20,You look like you clench your fist when a teacher asks you to read out loud.  
21,She's a 10!   On the pH scale.  Fuckin' basic. 
22,"&gt;I can't say Hitler was wrong, we only met because Hitler was right"
23,"Guys, stop brow-beating her. "
24,You may actually look better bald.
25,"Delete this comment in a few minutes, once the one above it is decently high. I want to see comments on their youtube videos where people actually believed you."
26,"I really liked your geico commercials! What was the catch phrase, ""so easy a caveman can do it?"" Sorry your show was so short lived.  "
27,Bet it's just hard to sleep chained to a water heater in a massage parlor with the truckers coming in at all hours of the night.
28,Error 404 - gender not found 
29,You look like [Stewie Griffin](http://imgur.com/Svmoohp.jpg) before he hit his head on the ceiling. 
30,The prisoners at Auschwitz looked healthier 
31,I like this one. I like it a lot
32,That's what ethan says in school zones
33,Your hair says pornstar but your face says tech support
34,"You look like you were breast fed until you were 8. 
"
35,Your dad has this saved on his phone.
36,Dis bitch look like a store mannequin 
37,It will take more than that to burn off that neck fat.
38,Someone tell me why this girl look 60 and 16 at the same time. 
39,Tear down what ego? You know you're a 6.
40,"You're the physical embodiment of ""peaked in high school"""
41,You look like domesticated Sasquatch.
42,You'd make a great megamind cosplay
43,"If you can get past the broad shoulders and flat ass, gravelly-voiced soccer chicks will fuck you harder than you want to be fucked.  "
44,Which is amazing because he has extra of both
45,She looks like that drunk girl that everyone fucks  but no one  remembers 
46,"I feel like no matter what I say, you'll try to check my privilege. "
47,A Visa is a visa...
48,"We Are Number One but every time they say ""One"" Stephanie smokes crack"
49,"Thank God for arranged marriage, amirite?"
50,You look like Janet Jackson fell asleep on a solar panel
51,"She looks so happy when they are making a video. No wonder, it is the only time he takes the leash off her.
"
52,You'll make a fine addition to someone else's 72 virgins.
53,Weren't you the lead singer of a boy band?
54,The unsuccessful one
55,"Could you take a closer pic? Not that I like your face, I just wanna see less of your body"
56,Jimmy Neutron wasn't the fuck doll for ISIS. 
57,When you're 38 and still not over your rebellious teen angst phase
58,"Looking at those cheeks, I see where all the guys store their nuts for the winter. "
59,"Don't worry buddy, no one actually cares about you."
60,"Only way I play, man."
61,In 20 years you're going to be a 40 year old virgin Indian engineer.
62,"I think you messed up the photo.  
I see the horse... where's the girl?"
63,"I used to think there was someone for everyone. 

Now I just feel lied to. "
64,[Kill the halflings!](http://imgur.com/QUqyRoj)
65,**just like his chin**
66,wearing a size too small doesn't mean you're swole
67,"No, you crave attention. You just think taking dick is the only way to get it. Good luck with that."
68,He really doubled and then trippled down on it lol
69,"This is /r/RoastMe, you might as well replace googled with binged
"
70,"All those gay thoughts must be piling up, you'd better let them loose before you explode"
71,You are the girl he fucks until something better comes along.
72,Your eyebrows have a better connection than you do with women. 
73,This guy looks like the dummy from self defense classes for women. It's good to know that they based it off of a real rapist.
74,"""He's... He's saying you lived in a stable...""

Come on Ethan, give her the full scope of the joke.

""He's saying you look like a horse...""

Damn right man, damn right."
75,"One time, at band camp, she was mistaken for a Hanson brother"
76,"Being utterly repellent to cock is not the same thing as being a lesbian, Cruella."
77,"I bet you've always wanted to play the classic twin ""switcheroo"" on a double date but you *both* have to get a fucking date first."
78,[Yo I'm famous now ahaha](https://i.redd.it/sji5lbxrl4by.png)
79,When your K/D is better than your GPA
80,"No bizarre hair color is going to make up for the fact you are easily the least attractive girl among your friends and colleagues.   Hair like this just screams 'Look at me, look at me!', but pink hair isn't going to make your bland, vanilla personality more interesting, nor will it change your destiny of dying alone and unloved : /"
81,Have you tried covering your eyes? That usually helps me sleep. I have a shoelace you can borrow.
82,"Its called ambiguous anamoly, Just like OPs gender."
83,I don't because the ads are the best part.
84,"You know the Mannequin Challenge isn't a lifestyle choice, right?"
85,Lips like those got your mum out of Saigon.
86,"If you ever need a job, you can model for Fetal Alcohol Syndrome pamphlets."
87,But now you have to delete your comment so that people will believe him.
88,http://i.imgur.com/Gu6DPLX.jpg
89,yeah
90,We should be roasting your barber for that fade 
91,Not Indian? But every relationship you've ever had has been a Trail of Tears.
92,"The Man Of Steal

"
93,I would get more substance in a conversation with an Asian sex doll
94,Reddit confuses me sometimes. The guy that clearly thought of the joke got less upvotes than the guy who just saw it to its inevitable conclusion.
95,"""I want to look like a crazy irrational lesbian.""

Barber:  ""Say no more"""
96,"Now that you can't skip town, will you stop skipping leg day?"
97,You could play Chewbacca in a low-budget porn parody.
98,You would've fit in perfectly in the Third Reich
99,And here I thought people were gonna start comparing me to Jimmy Neutron.
100,I never knew I looked so Arab
101,r/swordorsheath
102,"You play Canadian college sports, the only roasting you'll get is spit-roasted when you inevitably go gay4pay."
103,this i already knew. 
104,"Fattest meth addict I've ever seen, must have been a good cafeteria in rehab."
105,When her collar bone has more depth than her personality... 
106,"Damn! The last time something hit that hard, Hiroshima was gone!"
107,"Nickname in school was ""Jellybean""."
108,But not a lasso for that runaway tooth
109,this i already knew. 
110,Your eyebrows are larger than my dad's prostate
111,The only thing smaller than those penny nips is that tic tac bulge 
112,You look angry like someone just walked in with better everything.
113,Showing this to my kids to explain the difference between cocaine and weed
114,Just because you have a bath tub full of guts from the neighborhood strays you killed doesn't mean you're drowning in pussy.
115,It's okay she'll be back... just like her boomerang eyebrows
116,TIL: Katie Perry has a retarded sister
117,And my axe!
118,Gotta feel a little bad for idubbbz though. Poor guy has osteoporosis and crippling depression as well as being gay and retarded...
119,I thought you guys just used bomber vests?
120,"Ooooh Hila that's right this guy called me a pimp! (Jump cut) that's right Hila I'm yo Pimp (stands up and does an autistic dance)

There I saved you 20 seconds out of your next video."
121,Is Neil Patrick Harris starring in a movie about a blonde girl from a trailer park?
122,[deleted]
123,"* has cupped own boob while masturbating

* has masturbated with cheeto dust on fingers, creating an orange foam, and eaten said foam

* is turned on by being told how fat and disgusting he is"
124,"""I don't like labels.""

10 seconds later:
""I'm a lesbian."""
125,"It's drunk Zach Galifianakis and Ke$ha at their high school party and she still looks as slutty, trashy, and irrelevant as today."
126,Too many chins
127,"Not to mention all the pen corrections on her homework. 
I bet even she could figure out the probability of her saying ""do you want fries with that?"" for the rest of her foreseeable future. "
128,"This is /r/RoastMe not 'Nam.

There are rules."
129,Thank you for removing yourself from the gene pool
130,You look like you cosplayed as a Deviantart image.
131,I can smell you through my screen.
132,shut up meg.
133,"To be fair there are a lot of actual ""celebrities"" that I don't even know about who sometime's get news coverage and I'm like, ""who the fuck is this."" I don't think just because they're on youtube means that they don't deserve the ""celebrity"" tag, because they are famous in a completely different outlet. "
134,Strange place for a nipple
135,You look like a terrorist version of Key and Peele.
136,Translation : Instead of riding on carpets you're cleaning them.
137,*unsheathes oven*
138,Teleports behind Jew
139,I have a feeling thats not the first time you've said that to a bunch of strange men 
140,Looks like your head did a 180 with the chin
141,"You could support a skyscraper with that much foundation. What are you trying to hold up? Your emotional distress that your significant other left you a decade ago, yet you still hold that ring like Gollum?"
142,"I'm 14 and I'm drowning in Cum
FTFY"
143,*reins
144,And now yours. When will it end?
145,You look like you review chimichangas for BuzzFeed
146,yeah that was a good video
147,A face made for frat house glory hole's
148,nothing better then ur hair color being way brighter than your future
149,You look like you should have joined The Woman's March because you look easily offended and  you need to walk a little too
150,Those bangs are almost as bad as your attempt to do makeup. 
151,"Is this better?  
The only way for you to fit into BMI table is to average your weights. "
152,You look like you smell like hotdog water.
153,"Haha!  I saw that too.  I hate stereotypes, but she personifies the ""dumb blonde"".  That would explain why she hangs out with this guy though..."
154,"The tits in this photo are the only pair you're going to see for a very, very long time. 
The good news is they're fucking huge. "
155,"Shitty music taste - Check
Generic Haircut - Check
Dri-Fit ""Sport"" shirt - Check 
High School Varsity ""Athlete"" - Check
Cocky Tough Guy attitude - Check 

Most of the prerequisites to being a forgettable high school life-peak. You will attend a state university and join an average fraternity. You and all the people you surround yourself with will be carbon copies of you. You will live a narrow, ignorant lifestyle. You will learn nothing but to indulge in your own desires, never considering life for what it is. Your friendships are all surface level and don't last past college. Alone, you will find a decently attractive girl. Your first marriage will inevitably fail. Second marriage is happier, she indulges in your sexual urges still lingering from college. You'll have some piece of shit kid will grow up to be just like you. He will play JV sports before realizing how sad and pointless his father's life was. He will resent you and your insecurities. You will grow old in a loveless marriage. Alcohol will always be your vice. Then, without warning and without anyone's care in the world, you will die. "
156,"Like /u/GallowBoob needs another 10.4k karma and gold. This is why we need Karma Kommunism!

"
157,"I'm not really into the roasting thing, but thanks for assembling my iPhone."
158,The amount of preparation you made to present a photo of yourself to strangers on the internet is extremely indicative of how much of a disappointment you'd be in bed. 
159,[They followed through on GallowBoob's request :^)] (https://gyazo.com/61405ac52d57e7e74a55290dc1ab0141)
160,How can you look like both the molester AND the molestee? 
161,"The body says 18 and in school, but the face says 48 and smoking unfiltered Camels in the casino. "
162,It looks like she's almost swallowed enough DNA to clone a father figure. 
163,Because he's head is fucking huge. 
164,"To be fair,  so does my ironing board. "
165,"&gt; I'm not Indian.

If my entire family was gathering a posse to stone my ass for being the cheapest whore in Mumbai, I'd be in hiding and denying my ethnicity too.
"
166,"Do you pay royalties to Tim Burton for using the scrawny-with-ridiculously-oversized-head look, or are you just advertising for him?"
167,Tell me why this dude look like a fuckboy G.I. joe doll.
168,"That white eye make-up doesn't make your eyes look any bigger or you any less Asian.

And don't be ashamed of who you are, be ashamed because your parents got an F on the gender of their child"
169,"""Validate my insecurities"". I assume she already nose what her worst trait is. "
170,I can smell the scent of Cheetos and cigarettes trapped in your hair thru the photo
171,"Your parents are rich, you're just a freeloading asshole in skinny jeans."
172,Her writing looks as sloppy as her blowjobs
173,Which one 
174,"Wow, just... I'm sorry "
175,Did you just assume my biological mother's gender
176,She looks like she rides every black guy at school too.
177,Too late for a roast... this is already burning.
178,😂 
179,FTFY - In 20 years you're going to be a 40 year old virgin Indian *telemarketer.*
180,"This photo makes Sharia Law seem like a ""viable alternative."""
181,"&gt; labor camp

The only thing that would make Ethan actually work."
182,"You're already an attention whore, not giving you anymore."
183,When your K/D is higher than the amount of parents that actually wanted you. 
184,Mein Gott!!!
185,The classic reddit alley-oop
186,Those eyebrows look like they were drawn on using a turd.
187,Starving kids in Africa are sending you their cheques. 
188,"Eh, neither one of you could do better."
189,"Right, the roast here is that you immediately know that's not what he's saying. In order to be a normal sized couple, they'd *have* to average their weights. "
190,One day a man will love you for your body.
191,"Trust me, you didn't need to tell us you are a virgin"
192,"Jesus, this comment chain was painful to read."
193,"Your clear lack of self respect and desperate need for attention makes me want to high five your uncle. 
"
194,"Don't let these guys get you down, you're going to be a great interracial single mother."
195,Are you not Arab you look Arab I'm Arab
196,His fade looks great the barber had plenty of space to work with 
197,Pushing 30 and still working at Enterprise rent-a-car. Your mom must be so proud. 
198,"You were voted ""most likely to marry a woman with no ass""

You attract more basic bitches than a pumpkin spice dildo at a Taylor Swift concert sponsored by UGG boots"
199,Roast you? I thought we already did back in 1945?
200,Maybe you can use that graph paper to finally have some curves. 
201,"Houston, you have a problem"
202,The only real privileged people at your school are the blind kids
203,livin' up to the name
204,Cooking [Meth] By The Book
205,She can barely understands?
206,"Oh no, I'm totally Arab"
207,I don't think anyone is gonna top this
208,Next time get fake tits not fake eyebrows.
209,Could have just said 20 year old Indian. 
210,Dr. Who Cosplay is NOT a gender.
211,How do I swipe left on Reddit?
212,You look like the sort of couple that brags about going to Red Lobster 
213,"Hila going along with the roasts is the best part.
"
214,Awesome Chewbacca cosplay. 10/10
215,"For those of you out of the loop or just want to see the roast, you can find it here: 

https://www.reddit.com/r/RoastMe/comments/5nkbyc/we_are_h3h3productions_professional_complainers/"
216,I'll take the downvotes. The rest of the roasts were weak as fuck. 
217,"&gt;Buddy

Nice, he finally made a friend."
218,With that egg-head you can at least say you got laid once.
219,Wait. This isn't a sex doll?
220,I have a feeling that this is true
221,You look like you have a horse t shirt collection and reek of mayonnaise. 
222,Smoking meth once and never getting cock doesn't make you an addict or gay...please stop trying so hard 
223,"
brow-weight: bold;"
224,"I'm guessing ""midget-head"" isn't the worst thing you've been called?"
225,"You look like Gus Gus, the mouse from Cinderella. "
226,I bet the football team loves that they can all rest their beers on your forehead when you're on your back.
227,"""Yeah....."""
228,*Oh dang*
229,YOU DONE FUCKED UP NOW A-A-RAB!
230,I'm pretty sure honey boo boo isn't old enough to be posting shirtless pictures online yet.
231,"He better not bring his teacher a disassembled clock, that's what got him booted out of the States in the first place."
232, he's never met a girl with the same catch phrase. 
233,Middle Eastern and Gay? Well don't worry about being insecure for much longer.
234,That's not Patrick Kane
235,Bitch's mouth looks like a papercut. 
236,You look like the illegitimate crack baby of Steve Buscemi and a tortilla.
237,"No, that's not true. In order to become a moderator you have to visit the moderators page and click ""Accept""."
238,You can read them off the air too. Just as many people will hear it.
239,"How many languages can you yell ""Rape"" in?"
240,Take off your beer goggles she's a solid 4.5
241,You look like every girl in a movie when they go incognito as a guy.
242,Jacne Chan
243,"I don't think you know what ""emo"" means. They don't sell it at Hollister or show it on the E Channel.
Your outfit says more ""white trash that doesn't realize she's white trash"" than ""emo""."
244,Definitely not a dentist's kid.
245,"Too bad for you, once you're 18, the pedophiles won't be into you anymore."
246,CeeLo Blue.
247,"Huh, that's weird. My mom isn't a sexy Asian nurse ready to give me a prostate exam."
248,"Instead of learning the US history on the board, he should start with the neanderthals: the history of his people."
249,"&gt;16 yr old female I crave dick

Yeah, but it really doesn't crave you...."
250,The couch can't even look at you
251,Sad!
252,You look like the real life old lady filter on Snapchat 
253,Pretty trashy background for a wax museum. 2/10.
254,looks like gender studies class got out early 
255,"Good thing you landed the boobs, otherwise it's going to be a lonely adulthood "
256,The only sides he sees are fries and shakes.
257,"i can see why
"
258,"This is the guy that still shows up to high school parties, years after he graduates."
259,Porn Title: **A Cockwork Orange**
260,that's why he proudly keeps his mother's green bra on display behind him.
261,"What's the opposite of ""can I watch?"""
262,She's probably also at week 3 in her pregnancy with the back-up Quarterback's baby
263,Kinda odd to be wearing safety coats over your suicide vests.
264,"Must be difficult playing with a penis other than your own, then."
265,Wonder if you can mine through your chin and find a neck?
266,How is your face the most repulsive thing in this photo??
267,You need a cauldron for a helmet.
268,Are you an engineer for technical support at the call center?
269,Roasting you could end world hunger 
270,Oh yeah?! Well stop arguing with strangers on the internet and let's settle this with our fists. Meet my at your nearest local bar and... oh wait you can't.
271,Fucking hell.
272,thatsthejoke 
273,"I like he she looked away every time she answered ""this isn't a visa marriage, right?"""
274,Oh Summer... You are the .00000000001% of Americans who fall for the Nigerian scams each year. [post](https://www.reddit.com/r/AskReddit/comments/4wzo4u/what_scams_have_you_fallen_for/d6be9w6/)
275,Not really a burn
276,"You can pay for sex using your parents money, but it's never going to fill the void left by the fact that they don't love you."
277,that may be in the future considering her hair looks as if she has some form of cancer
278,"""Hitler was right"" -Ethan"
279,he runs in yelling Gotta blast instead of allahuakbar
280,This is 2017 I don't find it necessary to roast a gay couple. 
281,"I think I found your glasses!

http://thumbs1.ebaystatic.com/d/l225/m/mj2TmDlCZ9pXqWmSIbYv_YA.jpg"
282,If Mr. Potato Head stopped shaving his pubes
283,you look like offbrand transgender Michael Cera
284,The instagram filter didn't know how to handle that much forehead.
285,You remind me of Walmart.
286,"&gt;Seriously, I've never seen a vagina. 

That's because your mother didn't birth you.  She shat you."
287,Not that they'd recall
288,Banging your many cats at your single mom's house doesn't count as drowning in pussy.
289,Really?  I thought they killed the gays and mentally handicapped.
290,you look like a child sex doll
291,I bet you pay for everything in wet one dollar bills.
292,Brothers for 27 years? Does that include your time in the Muslim Brotherhood?
293,"Rule number 1. Of r/RoastMe, never compliment a roast. Rule number 2. Never compliment the roast."
294,"What would I rather do, her or math homework.. Probably the homework. It'd be satisfying to finish a challenge. "
295,Snakes on a plain. 
296,He does her maths homework for a blowjob
297,"If you think about it, my life would probably be (slightly) different if it wasn't for Hitler, and I love my life... Thanks Hitler?..."
298,Agreeing with me still won't get me to watch your cam show tonight
299,"You ""I'll do ANYTHING to pass this class""

Teacher ""Yeah... I'm good... Also this is gym..."""
300,Up until today I didn't know beards were sexually transmittable.
301,If only the fat would go to your tits instead of your waists.
302,That's the fucking point of this sub dumbass
303,"you added an unnecessary ""S"" to the end of ""nut"" "
304,"To me, it's cringey in the way that The Office is. Ethan never takes himself seriously, and he's fully aware when he's doing some ridiculous shit that it is, in fact, ridiculous. He's also been pretty adamant about calling out various YouTubers gaming the system and doing shady shit: FineBros, JoeySalad, ETHAN BRADBERRY, etc.

Wow, I've watched more H3H3 than I thought. I've never even been to his channel. But yeah, that's just my take on it. These videos don't make me laugh nearly as much as his ""more serious"" videos. The ones aimed at the people I listed above. But to each their own! I understand why some wouldn't like him."
305,I feel bad for the hat bill considering it's the straightest thing in the picture.
306,I'd fuck Kesha just saying
307,"A more fitting name would be ""Down Syndrome"""
308,"Coincidentally, high horse is a pretty accurate description     "
309,Guys stop making fun of this dude. He seems nice.
310,She likes barley?
311,Burned. 
312,You look like someone who watches a tutorial on how to make a pocket pussy out of household items and then when your mum finds it you try to pass it off as a science project 
313,LMAOO Those two stripes on your shirt tried to go the whole way but got tired 
314,"Clowns to the left, jokers to the right, stuck in the middle is Yu"
315,"All of your teeth look like sumo wrestlers.They're ugly,yellow, and they push other around around until there's one left."
316,"Hi, my name is Melissa. I like Ellen,  #TeamEdward, painting one fingernail and giving road head for a ride to school to the backup quarterback. "
317,Lies.  You saw this picture before you uploaded it.
318,Goddamnit Ethan I was calling you a pedophile.
319,Judging by the size of your feet I bet your cock is huge
320,"When you flash someone it's not with your tiny titties, it's with your big, shiny, greasy forehead."
321,I guess they're deep fat frying meth now. Interesting. 
322,"Your face says ""I like to kill animals"" your hair says ""I have a crush on the guy behind me"" "
323,Take off the makeup and she's a weak 3 at best
324,"""Yeah cheddabob Jr on the beat bitch, my uncle is my father momma dont believe in condoms, got pregnant with a tard even if he was on bottom"""
325,Her face says food stamps... her body says... food stamps.
326,Underrated roast 
327,Enjoy being on a list
328,"I know, even he wouldn't fuck you"
329,It is if you're brave enough.
330,If you shave the guy I bet they have the same jawline. 
331,...yes
332,"How many ""one more time's"" did it take until you made it to University?"
333,This is the worst cosplay of Hermione Granger and Ron Weasley I've ever seen. 
334,"I see you had to write the sign twice. Don't worry, your parents made a mistake once too."
335,The best of both worlds! Porn support!
336,The store brand Rick Ross
337,No parent would arrange their son's marriage to her face
338,"I mean honestly your both fucking sad, the person taking the picture is also in this lame knitting class for senior citizens."
339,You put on t shirts like a pair of pants so it doesn't stretch the neck as much
340,"I think its one of those optical illusions where if you turn it upside down the young woman turns into an old lady.

... Or maybe she's just an old lady..."
