,text
0,13 years from now your daughter will be posting the very same pic.
1," ""It took me like three hours to finish the shading on your upper lip. It's probably the best drawing I've ever done"""
2,Holy fuck that complete blackout though.
3,You look way too young to start going bald.
4,I don't know if you're 16 or 46.
5,"From left to right.  

You look like that ""leave Britney alone"" dude. With your ol' ""let me speak to your manager"" lookin ass haircut. You look wild annoying, you probably start all your sentences with ""as a woman....""  

Look at Miss Heavy Flow over here with her period sweats on. You look like a rejected fluffer from a low budget porn set.  

You have potential..... Sike, sit your ass down, lookin like a throwback Thursday edition of Khloe Kardashian  ! If you were Native American your name would be LongBack, because you have no ass!

Edit: first gold. Feels good. *drops mic*"
6,Sad that your baby reveal party cake came down to either chocolate or vanilla rather than blue or pink. 
7,"It's sad that you took more time getting ready for this pic, than you will ever spend actually playing with your kid."
8,Charlie's White Trash Angels. 
9,"Look on the bright side - your online dating profile can still proudly proclaim, ""total sum of fingers + nipples = 12"""
10,The father won't be around but Im sure his mix-tape is fire
11,"If Harry Potter had been made by Walmart, they would've casted you as Hermione Granger. "
12,Who's going to be the shift manager at the Dairy Queen while you're out on maternity leave? 
13,The chick in the middle keeps the other two around so she looks better. 
14,"""Two in the pink, one in the, 'OMG that's my taint, why can't you reach....'"""
15,"most likely to be the only single chick in her 30's at a friend-of-a-friend's garden party, carrying a glass of franzia that's never more than half empty, shout-whispering ""i am SO BAD"" while going for thirds at the dessert table"
16,"I guess that nose ring and choker is cheaper than tattooing ""I swallow"" on your forehead. "
17,Which is a shame because you two would probably have the same interests. Getting high and fucked by your Mom's boyfriends.
18,If Shrek wanted to speak to the manager....
19,If I cover the right side of your face you look like a smug cunt but if I cover the left side of your face you look somewhat neutral however if I cover the entirety of your face I found my eyes stopped hurting
20,It annoys me how good you three think you look.
21,Which way are you transitioning?
22,Even with a pink cast no one is going to give you the attention you so desperately crave.
23,Have you considered doing an AMA as a child of incest? 
24,"I'd like you to come over one night, lay down, close your eyes and relax for an hour or so... That way I could get in my nightly jog by running from your eyebrows to your hairline and back. "
25,"Hey. These girls aren't garbage.

Garbage gets taken out."
26,If you combined all of your GPA's you would get a High School dropout
27,"Damn son, you got some balls. Probably three of them, if past trends are any indicator. "
28,"I lost it when I saw ""Marvelous Dentures"" instead of Marvel's Avengers on the hat"
29,"Tina eat the food, you fat lard!"
30,What wall of your house did you have to use to make that sign 
31,That's a child support baby if I've ever seen one
32,Back in 1692 the people of Salem would've roasted her for us.
33,"""I could have put on makeup, but instead ill just use a 4 megapixel camera."""
34,These are funnier than 98% of the comments I've read in this sub. Well done. 
35,"For some reason, this picture reminded me that it's garbage night."
36,You're the kind of 5 that hangs out with 3s so you can feel like a seven.
37,Didn't know Instagram had an STD filter.
38,"The only reason you didn't put on make up or do your hair is because you were scared that if someone managed to truly hurt you, you'd know that you still had room to improve."
39,You look like Danearys if she wasn't fire proof.
40,Wears bright pink nail polish to forget she's 29
41,Are you going to let her breast feed or will your step-dad be jealous?
42,That's the face you make every Christmas when your father tells you he wishes he had a son.
43,You look like the girl who tries to stay in Girl Scouts after college 
44,"That's a lovely sweater, I'm sure it'll look great in 5 years when it's covered in cat hair and Chef Boyardee"
45,"If America had as much oil as on your face, it wouldn't have invaded Iraq"
46,"Hahaha, this one has happened."
47,I've never seen a Special Olympic thumb-wrestler before.
48,"Girl makes an account on Reddit, then on Imgur just to get roasted. Takes what she believes is a good picture that includes the only curve her body has and will ever see. Yet still gets no attention.. Best roast ever. 

"
49,Live from the Bollywood casting couch
50,"I bet your leg isn't even broken. You're the creepy guy trying to hit on girls at the mall with your ""sports injury."""
51,"46! If she removes her bra, her tits will reach her belly button."
52,Looks more like a cage dancer at the gay bar
53,Classic fat girl camera angles. 
54,Looks like your brother already did.
55,"Can there be a roast a commenter thing that we do for people that try the whole ""funny"" thing and wind up making themselves look autistic."
56,More filler than a mid-nineties Metallica album.
57,Thanks for doing these! They're all awesome.
58,Human to pig it seems.
59,"Your picture came up on Tinder, so I swiped ""Uninstall""
"
60,Traction alopecia. It happens when you regularly tie your hair back tighter than a flea's asshole.
61,I am gonna say you are in love with your married professor.  
62,That's what they all think about themselves. 
63,"I should delete that. My mistake, even the baby wouldn't put its mouth on those 12 year old boy titties."
64,You look like the annoying girl that gets fired from chili's for a made up reason after the married assistant manager gets tired of fucking you.
65,SketchyCrab deserves his own custom flair
66,The only thing it protects is your virginity
67,Single mom in scrubs at work. Scrubs in a single mom after work. 
68,That last one is well done
69,I bet your mum can't wait to get Alzheimer's and forget who you are
70,The Stranger Things girl didn't grow up to be as successful as I thought she would. 
71,"You're not a person, you're spare parts"
72,Did your parents fuck at chernobyl when the plant exploded?
73,"Damn, the Powerpuff girls let themselves go."
74,You look like understudies for Auschwitz on Ice
75,"OkCupid profile: 

- Hard workin single mama looking for her partner in crime! 
- Interests include hiking, camping, fishing! 
- Trying to find my redneck romeo!
- Live! Laugh! Love! :)
- Must love dogs! "
76,The only thing this guy fights is his sexuality.
77,You look like you cry about everything except the things that really matter.
78,"I believe that hairstyle is called ""Hagrid's armpit""."
79,Week 1 here: http://sketchycrab.com/portfolio/reddit-roastme/
80,Your face looks like it was assembled by someone who doesn't have thumbs.
81,I didn't realize chia pets came in gay.
82,Your hairline goes further back than slavery
83,I wish I were your uncle. I would shower you in gold.
84,"A drawing for you:

http://imgur.com/gallery/bEXXQs3"
85,"How many times have you put "" I'm a nightmare dressed like a daydream"" on your Instagram photos?"
86,your boobs are jealous of your shoulders
87,Does your uncle know you're letting other guys roast you?
88,"You should have kept your first roast submission up, your horse like teeth provided more material to work with. "
89,/r/unexpectedfactorial 
90,The scrubs say staff. The face says patient.
91,Now its time to roast you.
92,"Its called WORKING the corner, sweet heart. Not butt hugging the sidewalk. Get your ass up."
93,The only reason you get laid is because it's illegal to fuck a 12 year old boy.
94,Bob Ross' unholy offspring.
95,These are amazing! It's like you're able to tell what someone is most self-conscious about and just lampoon them. Good work
96,"You are what they called ""practice girl"" in high school."
97,"You look exactly like matt lucas in drag

http://static.tvtome.com/images/genie_images/uk_topslots/UK_Hub/ComeFlyWithMe_Hub.jpg"
98,The only thing more beat-up and broken than your leg is your asshole.
99,"I honestly can't tell what sex you are.  If I woke up naked next to you after a night of blackout drinking I would be equally horrified with either answer.

You look like someone's cringy middle school photo."
100,"Should've had an abortion.  Your mom, I mean."
101,Geez man. Take it down a notch. These are supposed to be funny not send her into Ben and Jerry's induced killing spree.
102,"From left to right:

Utterly fucking useless."
103,I'm supposed to be a female.
104,That is nothing at all like I pictured u/gallowboob 
105,You look like you're in a christian LMFAO cover band
106,Does flipping the camera also add 5 inches to your forehead? 
107,There's tension between the two guys cause you both like the girl but when it comes down to it she's not gonna want either of you
108,Soon
109,"Looking at the length of that face I bet your father was a horse, and your mother was also a horse."
110,"You look like your catchphrase is ""You don't have to wear a condom"" "
111,You're the guy that tells girls on gonewild that they're beautiful.
112,"I didn't know Instagram had a ""jaundice"" filter"
113,you cant see but her eyebrows connect in the back
114,[deleted]
115,"List of things to lose:

-glasses 

-top button 

-attitude 

-virginity

-bangs 

-your footing if ever on roof"
116,"Holy shit these are great. I felt like you went extra hard on /u/marinuushash, poor girl  :p"
117,Conveniently left out the bit about your belly button looking like a crackwhore's prolapsed anus.
118,Jesus fucking Christ. Blew that shit out of the park.
119,I recognize [you](http://3.bp.blogspot.com/-cAK140ctqUI/UybEa51cGHI/AAAAAAAABI8/ywYxj5xcUGo/s1600/Kenny+We%2527re+The+Millers.jpg)!
120,But the white guy with a face on his wart killed it for me. 
121,That only works if she knows who the father is 
122,Like every roast you've ever had you might just throw it right back up. 
123,"You should name your child Charity, because that's what you'll need to support it."
124,"Oh look, the second round of clap someone got from you today. "
125,You made an account just so you could find out if you were pretty. That tells me all I need to know about your personality 
126,"Your sex life is a lot like the Olympic 200M race. 


8 black men, a gun and a crowd. "
127,they roasted witches not bitches
128,"Middle's looking smug because she thinks if she stands between a ten year old boy in a blonde wig and a rooster attempting to pass as a human woman, we won't notice her wonky fucking eyes."
129,"After 30 or 40 attempts, you finally were able to get that picture just right so you can get strangers to heap more attention on you.  I just feel bad for when that attention is eventually not enough and you start pooping out kids, hoping they fill that emotional void in your life.  And I would bet the house those kids will be named Sawyer and/or Quinn."
130,"Showing off your acne-ridden cleavage wasn't getting you enough attention, so you thought /r/RoastMe was a better option? I understand stripping probably isn't an option for someone with your looks, but there are other options for girls with daddy issues. "
131,[deleted]
132,"I would say you only deserve 9/10ths of a roast, but the extra nipple makes up for it."
133,Melanoma Trump
134,Spot. On. 
135,"You look like the lovechild between the fat kid from sandlot and Skrillex.

ps. Buy a better fucking camera."
136,"If you wanted to get laid, should have broken your arms"
137,"""Why doesnt he like me"" *looks in mirror at horse teeth*"
138,Climbing trees to look through windows isn't even a sport man!
139,Hah she actually messaged me through my sketchyCrab Facebook page and said she liked it. Glutton for punishment.
140,"At least the jaundice doesn't need to get much worse before you can move to Springfield.
"
141,"Long hair, long fingernails, lip ring, 5'2"", and wearing a cartoonish jui jitsu shirt.

The only cage fighting he does is in the ball pit at Burger King. "
142,duuuude the lopsided eye girl KILLED ME 
143,I see the radiation is still fucking you guys up. 
144,"You know, a lot of girls try way to hard to spruce themselves up for this sub, like they're going to be the ONE girl that is unroastable. I have a certain amount of respect in your total and utter lack of effort."
145,Get a new one so she can take a picture from far enough away to fit your whole head.
146,"Khaleesi, Mother of foreheads and Breaker of mirrors."
147,She? 
148,Here we see a 9gag user in the wild 
149,"A drawing for you:

http://imgur.com/gallery/CVCWZ37"
150,"I'm still trying to find the pretty friend.

People at /r/Waldo would love this."
151,You all look like future vagasil success stories.
152,[deleted]
153,"Somewhere, there's a Starbucks missing a washed up English major staring into a laptop."
154,and then deleted her account.
155,"I heard that your city is honouring you with your own swimming pool, built based upon your personality. Completely shallow."
156,Meet Drake after his first round of feminine conversion therapy.
157,I've fucked enough generic white bitches to know the type.  Give me a call next time you want to have choke sex while listening to Coldplay.
158,My condolences to the wingmen who have had to fuck you
159,"That's where you take it in stride, turn the hand over and say, ""Get ready for the flipper!"""
160,"The fuck kind of doctor tells the patient that there ""very little correlation between weight and health"" it's like he's saying ""go eat that cheese cake and get that heart attack so I never have to see you again you dumb bitch. "
161,"Yeah my parents are rich and I live in the suburbs; but, I have a nose ring. I'm like... super edgy bruh."
162,You look like your own caricature 
163,You look like Ramsay Bolton's bastard.
164,Charlie's Angel Dust. 
165,"Let's play ""what gender do you identify as today?"".  Whichever one gives you the most attention."
166,I wish all my decisions were as good as your ex-girlfriend's.
167,It's hard to tell if you're an attention whore or just a whore whore.
168,Hollistear was a great touch. These are amazing! 
169,"Look, it's Walmart brand Miranda Cosgrove."
170,You keep me out of this. 
171,This is the one time I'm gonna have to choose Star Trek.
172,"If you look closely, you can see a piece of the coat hanger in his forehead.  Sadly, it broke mid-abortion."
173,What tits?
174,It's a $40 uber ride from your eyebrows to your forehead.
175,I think I've seen this chick being used as a toilet in a fetish video.
176,"That's because a true roast has to go deeper than just burns about your looks, and that's all /r/roastme really have to go off. 

But these are fantastic, great work. "
177,"Honestly, you two were probably the last to know."
178,"You're gonna get used to including ""aspiring""."
179,*How you gonna breast feed me mom? You ain't got no tits.*
180,"Just so she knows, 2 dudes making her look like she's on a rotisserie doesn't count as ""being roasted""."
181,I love a girl that doesn't wear a lot of makeup. Just brush on some olive oil and you're ready to go.
182,You look like the fun type of niece who doesn't shy away from butt stuff. 
183,Her cries for attention are so loud that even her parents can hear them.
184,Definitely screamin' semen demon
185,You should look in to becoming a muppet. You have the looks and I'm sure you're no stranger to having a fist up your ass.
186,"Between your heavily airbrushed, extremely unremarkable features, your Abbey Road poster, and the flea market ceiling rug, you seem exactly like the type of basic that gets forgotten by boys and family members, alike"
187,Forehead makes Vegeta's hairline look reasonable. 
188,"Skin as greasy as a Burger King fryer...
"
189,Nice try Walt Jr. Put on a fake cast to hide your cerebral palsy; you ar-ar-ar-aren't fooling anyone
190,"A drawing for you:

http://imgur.com/gallery/IwGLT7g"
191,I don't think he can make you look any worse if he tried. 
192,"Slut, Slut, Goose.
"
193,If you ran the distance between your eyebrows and hairline you wouldn't have such a beer gut.
194,"The classic, I'm fat so I better show cleavage picture. "
195,Shouldn't you be using the end of your toothbrush as a dildo on Fapchat right now
196,[deleted]
197,Next time instead of dumping the bleach bottle into your hair just do humanity a favor and drink it.
198,Dreams of curing cancer. Becomes part time veterinarians assistant.
199,13 Porn Stars without the makeup.  #9 will scare you away!
200,"You have a very active tumblr about feminism, but call him daddy."
201,You look like you dont even want to hang out with you.
202,You look like the Donald Glover impersonator you hire when you can't really afford a Donald Glover impersonator
203,"When did this sub turn into /r/InsecureGirls? 

For fucks sake every other post is some girl wanting everyone to point out her flaws in the hopes for that one comment that says ""OMG You're perfect.""

**Just stop it.**"
204,"The human embodiment of the ""Of course size matters. Nobody wants a small... Glass of wine!"" joke. Because she's *such* a wild thing."
205,Looks like she already crushed a couple Big Macs with those fucking meat hooks she calls hands
206,Should have chosen gynecology as a career as it would have given you a chance to actually see a pussy.
207,His genes already brought him downs
208,I read your terrible roasts to help me puke.
209,"I put a lot of effort into my sign, and getting out of bed"
210,"""I could've put makeup on and done my hair but I want your worst"" the exact words your mother used before going to the battered dog's shelter where she found your father"
211,Reduces what? Honestly I would have loved to say more if you weren't so damn bland. You can't even muster enough personality to smile. You're the human version of off brand freezer burned vanilla ice-cream. 
212,How can you be 18 and look like a 47 year old alcoholic with kidney failure???
213,[deleted]
214,"Both are greasy, cheap and don't leave you satisfied"
215,"Gosh you're pretty, even with your right eye that wanders off to the side ever so slightly. I'd say it's almost romantic, the way you can look at me and still keep an eye on the kitchen. You're amazing, can I buy you some Plan B?"
216,I think you're looking for /r/honorkillme.
217,"That response only means one thing, the comment to you is accurate."
218,In fact she will be celebrating 5th anniversary of her 29th birthday!
219,White boy gang signs are about as hood as a whole foods
220,Stop. Just stop. You're not funny. 
221,Lesbian Bobby Hill
222,She looks about as interested in being in this picture as I would be in having sex with her
223,Iffy Azalea
224,"Somehow despite being young you have that ""oh Jesus Christ she's half plastic"" look going on, a la Joan Rivers. And just like her you're probably dead inside. Also please consider a wig, ive never seen a woman with a hairline like that."
225,You're a dumb motherfucker you know that carl
226,I'm 99% sure that you're 99% unsure who the father to that baby is...
227,Hit me up when you get that training bra off. 
228,Lol why do we need to make your cry? Don't the kids at school do that enough as it is?
229,"Voted ""Most likely to peak in highschool"". "
230,Why you looking in the distance like that? There's no future for you there.
231,..and has the stupid Live Laugh Love decoration in her 1 bedroom apartment on the 3rd floor
232,"Sorry guys but I can't roast you. Your friend in the long sleeve white shirt is making me very uncomfortable.
Look at the way he stares into that camera with his dead eyed expression his duck bill mouth. Why the fuck would you roll up your Jean shorts then wear long sleeves? Is it hot? Is it cold? Make up your fucking mind!

Most importantly look at how all you are standing. Now look at creepy face.
Do you see how close together his legs are? That's not natural! You guys are chilling out and then creeper is sadisticly crushing his own nuts.

He will murder you all in your sleep"
233,I'm not sure you know how this commenting thing works. You only reply if you're clever.
234,That's because she's tired.  From having sex with everyone else.
235,My mum has standards 
236,She'll be half black though so nobody will see the correlation 
237,"Thanks, I think?"
238,I see you're drinking 1%. Is that 'cause you think you're fat? 'Cause you're not. You could be drinking whole if you wanted to.
239,"You look ten. Don't do this, you'll have plenty of chances to be disappointed with yourself later in life."
240,I should try that with my next dick pic.
241,"I really enjoy that /u/Mr_fluffypants has over exaggerated features in his caricature, but overall still looks pretty decent! "
242,How are Beldar and the rest of the Coneheads doing on your home planet?
243,Your girlfriend has fat tits. Because she's fat. 
244,The only bang you'll hear is the sound of your gf getting pounded by the football team. 
245,I can't tell if you're going to serve me a dish of low self esteem or Lo mein. 
246,Good job. You gave the Kool-aid Man cheekbones.
247,"""Quaid, start the reactor!"" "
248,You look like a shameful tinder meetup that would give a blowjob for a 10.82$ IHOP meal and a cig
249,Do we really want to see this face in HD?
250,Don't you mean FTL (Female to Lego) http://imgur.com/a/0ya5T
251,Looking forward to you trying to make money drawing caricatures at a carnival!!
252,"""She""? Picture looks like some young farm boy looking to join WW2 but ain't cut out for it"
253,I'm sure your extra chromosome makes you do a lot of stupid shit.
254,Roast you? Have you even invented fire yet?
255,How many people are you currently catfishing?
256,"Your face is so bland, generic and forgettable it's like social camouflage.

I bet your high school nickname was ""Who?"""
257,Your pink cast is the manliest thing about you. 
258,You'll have to post here and hope you're hideous enough.
259,"What do you and Padme have in common? Both your kids daddys are absent, big black men. "
260,"Hey look, it's ""one of the guys."""
261,"You just came out, and the guy behind you just came in. "
262,"In 20 years, the way you seek attention here you'll seek it by giving a 55 year old unshaved, divorced construction worker a handjob underneath the table of a shitty bar where you'll get a little bit of self worth because he bought you a Bud Light during happy hour, got semi hard and didn't beat you."
263,Even though I don't know your ex I respect her decision making processes 
264,"They're called caricatures, take someone's defining features and exaggerate them. It's perfect for this sub "
265,With some kind of overkill blur filter. Or maybe she's just too stupid to figure that out and smeared Vaseline on the lens 
266,[deleted]
267,Or it's a side effect from the Botox 
268,I can smell your Virginia slim ultra light cigarette smoke from here. Drink another Pepsi. 
269,"r/trashy

That's all that needs to be said."
270,http://i.imgur.com/XeEc3N1.gifv
271,You look like you've got about a pound of chewing tobacco stuck in your bottom lip. 
272,You look like you would fake being pregnant 
273,More like the girl likes one of them but there's tension because they're both gay for each other.
274,"No their stage names are Sugar, Spice and Candy"
275,http://imgur.com/a/jr2IW
276,You've still got about 3/4 of a bowl cut to go.
277,"It's ""African Americaned out."" "
278,This brother/sister inbreeding thing is getting out of hand.
279,"""I would like to speak to your manager please."""
280,"A drawing for you:

http://imgur.com/gallery/8XdSZz2"
281,Is it the bike that makes you feel good or is it the sex with your sister?
282,"Hooters doesn't require College degrees, save your money. "
283,I'd bet a lot of money that just out of frame are two half black kids. 
284,Seriously? people think about you?
285,"Barber: What you want?  
Him: Ever seen the tip of an onion fam?  
Barber: Say no more"
286,The paper bag they put over my head did a number on my hair
287,[deleted]
288,"It looks so, so much weirder when it's not a cartoon"
289,What the fuck do you model? ponchos?
290,I bet you got kicked out of your local Wiccan group
291,You look like the kid in high school that was treated was worse than the gay kids 
292,"Wrap it up boys, we're done here."
293,Funnier than most of the actual roasts. 
294,I feel like you're going to hold onto high school memories for an uncomfortably long time 
295,i have an idea [what it'll look like](http://2.bp.blogspot.com/-Riq9QfIpntw/UECiL4DgH0I/AAAAAAAAKLI/PNVguBvBEFg/s1600/Spanish-grandmothers-restoration-fail-gets-an-unlikely-fan-following.jpg)
296,Or 1...
297,Where's your roast me thread? Mods should have to go through hazing.
298,You look like you could be both parties in a pedophilia case.
299,I think that last facial you took left a dent.
300,Don't shoot my school up. 
301,nice contribution
302,*laid
303,Griff. What are you doing moderating roastme. You traitor.
304,You look like an amalgam of every fucked up former child star.
305,"Jesus, I would but it looks like the truck already did. "
306,2 cocks on your chest is the only way you'll have double D's.
307,*Sells vegan tampons etsy*
308,"What's sad is that your eyebrows are freshly done. That means you walked out of the salon and said ""yes, these rectangular masculine eyebrows look just great."""
309,"Let me guess, part time writer, full time alcoholic asshole? "
310,"Oh honey, your arranged husband will make you cry plenty."
311,"You'll be in the yearbook as ""Shockingly didn't shoot up the school"""
312,"Some day soon, you are going to be a fantastic single mother."
313,Why the long face?
