,text
314,"While probably accurate, Rotten Bunny is probably not a great nickname for your vagina."
315,"This may be the first case of a ""Resting Molested Face"""
316,Gallowboob looks like he owns a vespa.
317,The two of you look like you seriously think black people are fictional.
318,"The choker suggests that you aren't the only boyfriend 
and you look like you're okay with that "
319,My favorite character is Plaque Widow.
320,You have the look of one who smugly corrects people who recite inaccurate information about The Beatles.
321,"I thought you weren't allowed online, or within 300 yards of a school."
322,"The first few months of the transition are the hardest, I've heard. Don't worry, you'll get there."
323,[removed]
324,you look like the bait boy for how to catch a predator with Chris Hansen 
325,If she had a soul then that would have hurt. 
326,"You are like the children of the Sitcom ""Roseanne""
The face of Darlene. The Body of DJ. And I want to replace you with a more attractive actress like Becky"
327,this girl gets a freckle everytime she sucks a dudes dick and he never texts her again. 
328,Low budget remake of Dexter. 
329,I bet it takes you 2 hours to watch 60 minutes.
330, Do tiny men keep trying to put a saddle on your back? 
331,"No longer sugar, spice, or anything nice."
332,I like how you felt like you actually had to tell us that you're gay.
333,The main difference between you and Abbey Road is people still want to visit Abbey Road after 4 dudes were on top of it.
334,"You don't do Netflix and chill, you do Food Network and heart failure. "
335,"I call this look ""signing the divorce papers."""
336,"Your line work is almost as thin and misguided as your flaccid penis.



Jk!  Awesome caricatures."
337,More like the Hound 
