,text
341,"Yep. And women typically subconsciously favor men like their fathers. I've actually seen pretty solid evidence for it in my own life

I'm pretty sure it's due to them being your first comprehension of the opposite sex, so subconsciously that makes anyone like them a ""real"" man or woman"
342,The hardest thing about incest is telling your parents. 
343,"&gt;ASSUMING    
&gt;&gt;2017    
&gt;&gt;CHECKYOURPRIVILEGE"
344,"&gt;a 17 year old aspiring art student with no prospects

Maybe she can get a prospects-augmentation operation."
345,Sure am! Only had to repeat my test 17 times :)
346,They even sound as retarded as they look
347,Speak for yourself 
348,You're the only English teacher I've seen that requires teeth to be double spaced as well. 
349,You look like a cheap blow up doll
350,"You thought you were slick, but you ain't fooling anyone with that 10 head of yours, we all know that you're actually a thumb with hair "
351,You're that one girl that every desperate/horny guy on omegle skips 
352,"Don't look now, but I think you popped a bra strap"
353,"[Here's the runner up](https://images.moviepilot.com/image/upload/c_fill,h_470,q_auto:good,w_620/njbve8nj7tf7fngraxy9.jpg)."
354,I'll give you 3/5ths the normal rate.
355,"With a face like that, it must be real easy to break the ice. "
356,"Actually, it was Nagasaki."
357,"Hair of Jesus, eyes of his cross."
358,"If all Jews looked like you, no one would deny the holocaust.  Or regret it."
359,AltaVista
360,"You legitimately believe your comment (and by extension, this general class of insults) will cause serious pyschological harm, but in reality it reads like it was written by an edgy 14 year old narcicisst who watches too much Mr. Robot."
361,I am ALL GallowBoob on this blessed day. :)
362,"Your hair says 20, your face says 70.  Either way, you've been gang banged in all holes more than there are days in the year."
363,I appreciate the way you made me read this in Trump's voice.
364,"based on the dumb-as-fuck doe look in your eyes, intelligence wise you are running on a Pentium II, 128 MB RAM, no swap space, and a 24.6k modem for comms. does that compute or have you run out of storage space"
365,I just came here to read the eyebrow jokes and watch people pretend that they wouldn't fuck you. 
366,So is your dad a hammerhead shark or something?
367,She's the one who starts crying partway through her strip routine.
368,You look like a racist cartoon from ww2
369,"""This guy's toast"" "
370,Oh cool it's Kylo Ren and Jabba the Hutt.
371,"What are you looking over there for?

He isn't coming back."
372,Apparently oompa loompas come in brown now.
373,It was nice of you to give guys a cross target of where exactly you like them to shoot their load after you are done giving them a blowjob in a back alley. 
374,"..in my 1 bedroom apartment on the 3rd floor. Where I have 'live laugh love' wall art, drive a 2001 Pontiac Sunfire, smoke mentnols, and get into Facebook fights with my 2 year old's dad"
375,Man you had me for a second there
376,Oh dang 
377,"Lol, don't be ridiculous. He doesn't get a blow job, he gets a cutesy smile and ""You're such a good friend!"" "
378,Username checks out 
379,Fitting he's wearing a cowboys sweatshirt since they're both massive losers 
380,So all of them?
381,"Got out of gender studies early, eh?"
382,Didn't know they had feminists on Vulcan. 
383,"From ""Mother Of Dragons"" to ""Chasing The Dragon"""
384,She's up for bagel bites and an interracial gang bang
385,I thought Neanderthals died out...
386,"It's like the modern equivalent of being ""big in Japan""."
387,"No need to destroy her, looks like her drug dealer has already done a good job of it."
388,"Inb4 ""this I already knew"""
389,"Yep, that's called med school pussy. Definitely not practicing doctor pussy."
390,I died at the adblock overlay.
391,That knife is pointed the wrong way to make this an actually satisfying photo.
392,You look like one of Sandusky's lost boys 
393,Being a hermaphrodite doesn't count.
394,The only thing you'd likely drown in is your father's tears of disappointment. 
395,Actually it was both
396,Just because guys wont fuck you doesn't mean you're a lesbian. 
397,Slightly turning your head doesn't hide that wide forehead. It's about a $6 cab ride from eyebrow to eyebrow.
398,See everyone?  Sometimes a truck-stop hooker does get her act together and finishes high school.  #inspiring
399,Generic basic white girl #5278 to post a selfie on RoastMe.
400,"No Michael, I've already rebooted my computer. "
401,This photo single-handedly dropped unicef donations by about 60%.
402,"No joke, rumors of the midget sniper were rampant in Iraq in 2005/6. It was mostly a joke but also kind of terrifying because he could literally hide in any crowd.  "
403,"No, fuck *you* sir."
404,Get the fuck outta here faggot
405,When your K/D is a tenth of the cock you suck daily.
406,Nice that you added the uno cards to make us think you have people willing to spend face to face time with you
407,What a guy
408,This isn't even my roast and I feel roasted.
409,I'm so terribly sorry :( Your family must be gutted you made it out.
410,"Don't listen to these people, you're a handsome young man!"
411,More like Amy Poehler
412,"You have the hair of a 20 year old, the face size of an 10 year old, and the facial features of a 60 year old. Together you're just one really dissapointing 30 year old."
413,I like your hair.  It would be pretty on a girl.
414,"Her parents recall though, I mean it takes immense amounts of radiation to create something like that."
415,"Wah wah my fucking feelings are hurt, I wanted people to get roasted in an inclusive way that caters to my sensitivity!

Shut up, faggot."
416,You look like a roadie for Christian rock band 
417,"Huh, interesting.

I would argue that you look like you were less ""born"" and more ""discharged"", however"
418,"Right? 

When she said ""it'll take a lot more than that to burn off the calories"" talking about his chin, I lost it! "
419,ohhh it's a 'she'
420,"Did the surgery go wrong, or...

I'm just not sure what I'm looking at."
421,bro you don't get this sub man
422,You're the argument for school shootings.
423,(backup quarterback drops her off a half a mile from school so no one sees)
424,I see you're holding the box that your head arrived in.
425,I bet you're a great driver.
426,"I wanna be clear for OP, who may end up taking this as a compliment. Nobody wants to sleep with you. You just look like you'd yell rape at any chance you get for the attention and to ""stick it to the patriarchy"". "
427,"Sounds like my dream man...he better have a mad fedora collection or I will be disappointed 
"
428,Who does she let him blow?
429,... he was talking about you.
430,"No man will ever live up to the best fuck you've already had, and you'll be bored with every relationship you have until you're a single middle aged alcoholic without her looks any more. "
431,Trying to drift off /u/h3h3productions karma train I see
432,"And their pubes, apparently."
433,Taking dick won't make her feel any less empty inside. 
434,You spell homosexual funny. 
435,NO CLOTHES DADDY DAY CARE ANAL PRANK
436,'I want everyone to know that I'm offended by everything'
437,"So I'm guessing you posted here as a kind of bonding exercise, an 'us against the world' kind of thing. I wonder what will happen when you stop coming up with imaginary hurdles and are forced to really sit down and stare into each other's souls a little bit-- or even worse, stare into your own soul. 

Which one of you will be the first to realize your own emptiness, to understand the reason why you cling to your partner so? Codependence is a repulsive quality in a mate. Either one of you will realize it first, or you'll both marinate in a puddle of collective fear until you both become old and bitter and filled with all the things you never did, never said, never fucked.

Good luck with that."
438,"&gt;Guess who's the man in our relationship.

Her mom.
"
439,She doesn't look like she has enough self esteem to wear a shirt with her face on it
440,"In battle, did you ever have to retreat as far as your hairline?"
441,This is the most underrated comment.  Holy fuck it's so accurate.
442,Turn downs for what?
443,You'll make a great step mom one day. 
444,"http://imgur.com/99eZwHt
What lies above? 
Always wonder this when I see such dramatic croping x"
445,Fuucked the sheep. Killed the sheep. Made the jacket. 
446,At least they got soup and bread.
447,You look like you have one night stands with skeezy men to increase your stolen hoody/flannel/DVD collection.
448,"He looks like he drags girls into fields of corn and rapes them, then wears their skin"
449,You look like Chief Keef's transgender sister 
450,"Face says ""I'm gonna rape you...""

Anklet says ""...Mom"""
451,"The Adventures of Rape Case and Teen Stripper Mom, coming to a Bing search near you."
452,"I think OP picked ""Hot Topic Mannequin"" as a new gender."
453,Possible autism is being generous. 
454,"This did not use to be the case, celebs would be added to random porn subreddits so they implemented a accept/deny prompt to combat this."
455,You look like you sell Mary Kay and have become your own best customer 
456,"I wouldn't be here if it wasn't for Hitler and the Germans. My grandfather was taken as a slave and put to work on a nice German farm, the farm owners treated him well, except when Nazi officials came he would have to sleep in the barn. When the war was ending/over they helped him escape to what was West Germany from there he immigrated to Canada on a working contract."
457,Refusing to pay prostitutes isn't turning women down
458,You look like a burned out Velma in a VH1 where are they now episode. 
