,text
188,"Yeah I’m on team always-bra. But I have big knockers and a small frame, so it’s *super* obvious when I’m not wearing one. I even wear one under my tank top when my in-laws stay over."
189,"That’s weird. We’re taught in nursing school that it’s good for laboring women to sit on a ball, walk around, and otherwise position themselves to facilitate the baby moving down via gravity and opening of the pelvis. However, once the patient is given pain meds, it’s a different story. We can’t have patients who’ve gotten epidurals or pain meds moving around as much, because of the increased risk for falls. "
190,Pretty much! Supposedly it's because women have more body variables but like... Isn't that why it should be researched more? They're still going to be taking the medication!
191,"Ted and Robin in How I Met Your Mother, and then Robin and Barney. In fact, with time and maturity I’ve come to realise in HIMYM in general was a misogynistic dumpster fire."
192,"Tattoos on a woman's body, or at least, many tattoos such that they cover a majority of one's body. Not necessarily Western society, but old-fashioned societies in which tattoos were related to criminals, syndicates, or manly men (see: sailors). However, despite being trendy in today's society, there are also a surprising amount of people who wrinkle their noses at me, and have made assumptions about my ""marrying abilities,"" future mothering skills, and femininity. My favorite is when they ask me what my tattoos are going to look like in the future. 

Answer: Saggy, like my butt. If it bothers you less, stare at that instead."
193,floss your teeth BEFORE you brush them 
194,"[A political party in Hong Kong](https://coconuts.co/hongkong/news/lawmaker-warns-women-citys-worst-upskirting-spots/) has been publishing a list of these kinds of 'upskirting' spots for the past eight years. It's really changed nothing – like, what, women should just avoid all of these public spaces?"
195,"Curly hair,  I have beautiful (to me) curls and spend good money on specialized hair cuts, colour and hair treatments, so I flaunt them but I've lost count of the number of times I've been asked why don't I straighten my hair."
196,That's a difficult transition to make - cats can be challenging. But don't let anyone tell you that you don't deserve a cat! You do!
197,"Since there was no penis-vaginal penetration (he assaulted me in other ways) I have always had a hard time calling it rape, even though by definition what happened to me is legally considered rape. I’ve always felt that it somehow takes away the significance of the word for other survivors (yes I know this is so not true). I still call it a sexual assault, it’s what I’m most comfortable with, although I rarely talk about it "
198,Women also are less listened to when in pain and don’t have their pain adequately managed! https://www.theatlantic.com/health/archive/2015/10/emergency-room-wait-times-sexism/410515/ great article that touches on MIs and how they aren’t adequately treated as well
199,Literally anything meant to keep warm. Sweaters? Either paper thin or thick but loosely knit so it does NOTHING. Hence why I prefer many male articles of clothing.
200,"Fieldwork PPE too! Rain gear, high-viz wear, cruising vests... Even the smallest sizes can fit way too big. Kind of a safety issue in dangerous environments.

And also just workwear in general for people who women who work on the more traditionally male trades or careers (construction, field research, forestry, fisheries, etc.) When I went into my local workwear store and asked for the women's section all there was were nursing scrubs.

&amp;#x200B;"
201,"Yo though please keep in mind that coconut oil is very heavy and comodogenic for a lot of folks (ie pore clogging &amp; acne-causing). Your mileage may vary. I love oils for face and body and I usually use lightweight oils like argan, rose hip, seabuckthorn, grape seed, etc. The Ordinary has very reasonable prices for face oil."
202,"""don't do that""

He never did it again"
203,That we are all bad in someone else’s story. Regardless of whether it’s a mistake on our part or not.
204,"My boyfriend is South Indian, so pretty dark skin. I've had Indians tell me I should dump him and date someone fairer because I'm so fair and our babies won't come out nice if I'm with him. Totally wtf. "
205,block them and move on. Don't let yourself get drawn back. They want the fun parts of a relationship without the responsibility and they're hoping that you feel like this and give in.
206,My office card is designed like that and you're supposed to wear it in a way that it can be seen at all times. If you're wearing a longish shirt or anything that covers your pants a bit (blazers!!!) putting it on your pant pockets is not an option. This is why most women have resorted to awkwardly holding it in their hand
207,"Lots of women deliver on their knees or on all fours. The doctor doesn’t really NEED to be all up in there, unless of course there are complications. 

There are many women who argue that doctors have too much of a role in labor and delivery, not allowing the mother to be the one in control of the whole thing."
208,"If I'm not wearing a top with pockets, I put mine on my pants pocket. You could also clip it into the top of your skirt's/pants' waistband."
209,"Is your hisband....single?
"
210,"My favorite thing to do is take info from their dating profile and respond with something about that.

“Your profile says you’re a Christian. If you send that to your pastor and he says it’s okay for you to do that, I’ll go on a date with you.”

“Your profile says that your 6-year-old daughter is your entire world. How would you feel if someone sent that to her?”

“You realize you put your Instagram handle on your profile, right? What would (insert the handle from someone recently tagged in his pictures) think about this?”

And when there’s nothing interesting... “you realize this is a form of sexual harassment, right?”"
211,"Make sure you have ""me"" time. I know that everything feels like me-time when you're single and lonely, but if you start doing things that you enjoy, like taking yourself to a winery, or taking yourself to dinner, it helps some people build confidence in themselves."
212,"And even at stores for outdoor equipment, if you have big breasts and wide hips you then have to search in men's sizing... which end up too long in the arms! "
213,I kept mine. I couldn't think of a compelling enough reason to go through the administrative bother. 
214,LOL “yup. That’s basic human anatomy. You learned this in third grade y’all.” 
215,"This is the most annoying and harmful trope in movies. It's like every teen movie is about pining for a girl he can't have, and if he just does xyz she'll fall for him. And it eventually works! Except this sets a terrible precedent for guys to keep trying, because girls can be won over. This normalizes this creepy stalker behavior some guys develop, and it is not ok."
216,People can change. But only if they want to and put in the work to do so. Not if they say they will and keep doing the same thing. Listen to actions not just words
217,"I'm assuming by issue you mean a significant other having a problem with our closeness. 

My two close guy friends have always been respectful towards my partners and know where the line is in terms of appropriate behaviour. If they didn't we wouldn't be friends. 

As for my partners, I don't expect them to drop friendships for me and in turn I expect the same respect/courtesy."
218,When I discussed alternate birthing positions with my young female Dr. she said she didn't see any need for any of that. I was shocked at her negative  attitude on any of my thoughts opposite of just laying on my back hooked up to things for my daughters birth. 
219,"1. Sends me funny links, websites, tweets, etc. all day. No matter how annoyed we are with each other when we part in the mornings, we can always patch it up with a funny gif.

2. Makes my coffee in the mornings. Honestly, this may be self-preservation on his part, but I love him for it.

3. Never blinks when I bring home a new pile of fabric, yarn, plants or books. If it makes me happy, he loves it already. 

I'm not here to tell you our lives are perfect and bubblegum saccharine sweet. We have too much going on (3 kids and  17+ years of marriage) for that. But we're still hanging in there, so we're doing something right?"
220,"I'm like this and the people in our office just enjoy being around each other and we hang out a lot naturally for happy hours. Our company encourages us to get to know each other. We spend all day joking with each other and working, eating with, or helping each other, so it seems only natural to me that eventually you're gonna get friendly with people. I work with a lot of smart, funny people. :)

I have 2 tiers of office friends - those who I hang out with mostly during happy hours and other fun work related events, and those who I also hang out with in a more close friend setting, like going to yoga or brunch. I invite a lot of them to important things like my birthday party if it makes sense."
221,"Kinda related, but I get really annoyed now when there are two single toilet bathrooms, but they're still gendered. The only real difference (sometimes) is a urinal. Why even bother. "
222,"Bro if it means I get to live, LET THE TITTIES BREATH."
223,"As a normal guy who never sends Duck pics, I can say that this is a very effective way to leverage Duck pic guy into never contacting you again."
224,Laying on your back to give birth. Imagine laying down to try to poop.
225,"I am 5' and yes. Also, I cannot sit on a chair with my back supported and my feet flat on  the floor, and if a chair DOES adjust that low then I cannot reach my keyboard comfortably."
226,"- A cup of tea at night, or in the morning, or even in your water bottle. Green tea (I like mine with peppermint!) is soooo good for you. 
- Lighting tiny tea lights (so cheap) and turning all the lights off. Listening to your favorite album, reading a book, or meditating. 
- Yoga — there are absolutely free community classes basically everywhere. But there’s also YouTube and r/yoga.
- Going to the park, or getting fresh air in any capacity. Getting that vitamin D! 
- Cooking yourself a nutritious, but delicious meal. Allowing yourself to make mistakes if you don’t know how to cook yet. 
- Taking a walk &amp; listening to your favorite music. 

I picked these things because they’re all wellness oriented with grounding techniques - or they’re things that help you be happy. There’s nothing more radiant than joy 💜

And finding your right selfie angle."
227,"Pants in general. The male default has width and length, but women’s pants (esp. jeans) have one number and it is NOT consistent across companies/styles. "
228,Crazy horse girl here! You're not lying. I buy all of my work gloves from tack stores. They're the only place that sells well made gloves small enough for my tiny hands.
229,You're crushing me with that confident exit
230,"I'm sorry your colleagues are idiots. You design for the reality that exists, not some utopia in your head.

&amp;#x200B;

And in reality, lots of women wear skirts."
231,I go back and read from years ago. And I finally learned that time does dull a lot of things. Lost relationships that used to bring me to tears won’t anymore. I feel like it gives you perspective as to what the big feelings are that have stuck with you. And it tells you what was just situational small stuff. Also my memory is crap. I really don’t remember things I apparently experienced. 
232,I can't do it. I'm a 38 G and my boobs have no perk to them. I feel way too self-conscious to go out. Plus if it's warmer the boob sweat would be even more unbearable I think. I am definitely envious of the smaller chested women out there who can go braless and still look great in clothes.
233,ALSO. What to do with ‘sanitary items’ when I’m at a friend’s house and they don’t have a bin in the toilet... and I have to wrap it and take it to another bin.. usually in the kitchen... near all the other people... like... what?
234,"""Call your mother right now and apologize for being even more of a disappointment than your dick is"""
235,Own that shit! A *sexy* board with nipples.
236,There's no point in forgiving someone who has no respect for you. You should have the self-respect to be with someone who won't do horrible things to you.
237,"I've literally never even thought about removing my arm hair, which is really dark black against my tan skintone. A friend told me they shaved her arms and it actually shocked me. I just assumed other women were hairless or blond. "
238,"My Best Friend's Wedding didn't age well for most 2019 sensibilities. Cameron Diaz is a college junior who is dropping out to marry a 28 year old? Are we supposed to  want a ""cat fight"" over this mediocre man?"
239,I used to get on Omegle and sext with people when I was 14.
240,Every time I encounter a stall door without a hook I fantasize about putting one of those 3M sticky hooks up. I need to start carrying them in my purse!
241,"For what it's worth, India loves pale (or ""fair"") skin. They WORSHIP pale skin. To the point of racism/colorism. 

It's not good, obviously, and not that you need the reassurance, but it just goes to show how deeply ingrained perceptions vary drastically in different cultures."
242,"oh HELLO has someone said Default Health apps on most smart phones?? THE last four I've had don't have a period tracking option. Hello, why can't I track my heartrate and my period in the same phone?? why can't I use the same app that tracks EVERYTHING ELSE by default and add period stuff?????? it is one of the few things about my phone's design that infuriates me- it was so obviously created by a team of men who didn't bother to ask a single woman about what her needs might be. "
243,My large feet.  Lol
244,During summertime it’s pretty much my go to option because of the heat and sweat. I do however more often than not wear pasties to prevent pokies.
245,"No matter how much you love him, you need to have a life and identity outside of him"
246,"Being given permission to feel the way you feel about a situation is all you need to move forward and grow instead of wallowing in a continuous circle of sadness and self-loathing. Talk to someone outside of the situation. 

Asking for help doesn’t make you weak, it makes you stronger in the long run."
247,"I don’t follow you tubers and instagrammers, but in my area Botox is very popular for women starting in their mid twenties, even ten years ago when I started hearing from my peers that they weren’t looking forward to needing injections, as if that was a sure thing they *have* to do. Then again I lived in one of those Hollywood suburbs and the girls who said this were upper middle class, so there’s a certain expectation there. "
248,"If your skin is oily, try to moisturize your skin more and use oils. Your skin may be producing oil because it’s so dry. Grew up with terrible oily skin and it took me way to long to realize that. "
249,"I wish I'd known that uni wasn't my only option, I was absolutely not ready for that amount of freedom and the beginning of all of my real life issues. Don't get me wrong, I'm sure some of them would have surfaced eventually but that time in my life was a catalyst"
250,"Whenever I'm feeling kind of frumpy, I take a shower and then spend forever in the bathroom getting ready for bed. 
I wipe my face off with a damp washcloth- cold water if I just took a shower and warm if I didnt.
Then I put lotion on and use vaseline on my lips. 
Then I brush my hair and spend a while braiding it. If I take a shower I wrap my hair up in a tshirt instead of a towel to let it dry a bit before braiding it.

This is all very generic stuff, but I do it very carefully and concisely. It makes me feel like I'm glowing afterwards, and I wake up feeling prettier. I so find that spending just a couple more seconds shampooing, brushing my teeth, or whatever, it's a much more effective routine.

I find that if I rush or if I dont spend this time to focus on making my basic routine more enjoyable and worthwhile then I just start feeling gross or ugly during the day.

So in a nutshell, my advice is to spend more time on the things you are already doing. You dont have to buy fancy products, or invest in some medical procedure. Just take more time for yourself at night (or in the morning), and that might help. 

It certainly helped me, it has definite helped my skin clear up and my hair is cleaner for longer. And I feel better most days."
251,"God knows that I tried so much, but they're not very interested -\_-"
252,"Same. Unless I’m wearing a really flowy shirt that would literally expose my boobs if I wasn’t wearing a bra, then I don’t. It’s way more comfortable for me since I don’t really need any support from bras."
253,"Hard hats and safety vests. I work in an office but sometimes have meetings on construction sites where I am required to wear hard hats and safety boots and vests. The hard hats don’t fit me at all. I have to leave my hair down which then proceeds to get covered in concrete and whatever other particles of materials are in the air (including aluminum shavings). If I put my hair up like I want to the hard hat doesn’t fit. 

Safety vests suck too. It’s more like a safety dress. "
254,Not sure if this counts since a movie adaptation of a book but Edward and Bella in Twilight
255,Don’t expect a BJ unless your D is fresh and clean. 
256,"A guy that I had never talked to before dm’d me a dick pic on Insta. 
Me: “That was brave.”
Him: “So you like it?”
Me: “I’m honestly indifferent. Nothing about a stranger’s unsolicited erection does it for me. You may want to strike up a conversation and feel a vibe before putting yourself out there in the future. The next person may not be as patient or kind.”"
257,"I mean, just pretty much any safety equipment or tools. Also, the giant ass inconvenient size of phones, ya know, since guys tend to have larger hands, so it's not a problem for them. Apparently speech recognition is also more likely to understand when men say something than women. There's also the thing in real life that I've faced of barely being able to reach the rail on the bus to steady myself while guys can pmuch just grab it comfortably."
258,"The lockers in the *women*'s locker room at my gym. All lockers are half lockers. The top row is so high up, I (5'5"" so not even short for a woman) have to stand on tip toes to reach the lock, and there's no way I can ever reach the hook on top. No one uses them. They could all just be full-length lockers instead. Also, we have enough counters/sinks/blowdriers for 15 women (compared to maybe 6 in the men's), but only three small benches to sit on or put bags on. The designers must honestly believe we spend 2 minutes changing and 55 minutes doing makeup.  "
259,Even though heart disease is one of the leading killers of women in the U.S.
260,"Whether or not I am Turkish. I am not, and as far as I know, nor is anyone in my family. Didn’t stop a complete stranger arguing with me about it though. Very odd."
261,"""Oohh, yeees, but not as smalls as yours!"" 🤣"
262,"In my culture it’s common for unmarried adults to live with parents, making age appropriate contributions to the household, and I don’t believe there’s a “too old.” There’s only a “too old” for being taken care of like a child. "
263,"Sleep! So important.

When I lived in an area with very hard water (i.e. mineral-rich), I had to use a dilute vinegar rinse every time I washed my hair or else it would be dull, ratty, and tangly. I just kept a bottle of cheap white vinegar in the shower and had an old yogurt tub to dilute it in...😅 You could definitely come up with a more elegant solution!"
264,"I didn't even know that I had anything ""wrong"" with my body until I saw an increasing number of people/ads on social media recommending ways to get rid of them. 

I never once noticed them or had any problem with them at all. 

Of course, now I notice them and I can see why some might find them unappealing. I don't care enough about them to try and ""fix"" it anyways. 

"
265,I wish you could put the pedals closer so I'm not sat 3 inches from an airbag that will most definitely kill me if it releases in an accident...
266,What's your workplace like? How does this dynamic happen?
267,So so so many cuddles
268,"If my chair is high enough to comfortably reach my desk, my feet can't touch the floor."
269,"When you’re pushing your baby out, push like your pooping. No one just said it plain like that and I was struggling for awhile before I accidentally pushed like I had to shit and everyone got so excited “YES! Like that!”  DUDE! Why didn’t you just say that! All this “bearing down” shit. Just say it-POOP! Ugh. We’re all trying to be “proper” and not wanting to offend anyone. I struggled so much more than I had to."
270,"“WTF why would you send me that?!”

Now say that again, but slowly "
271,"I don't think it would be harmful if you categorized yourself with them - it would show that rape victims aren't always complete shadows of their former selves, the problem of rape is so insidious that it very well could have happened to the well-recovered and adjusted woman next to you. Kind of like you had been in a terrible road accident that would leave a lot of people crippled but you walked away. By clearly categorizing yourself as a victim/survivor you can also be one more voice that the roads can be crazy dangerous and should be made safer."
272,The Phantom &amp; Christine Daae
273,"And on the other side of that coin, the ""bad boy"" who falls for the ""good girl,"" and she patiently teaches him how to be the perfect man, which he does! Thus teaching us that if we are only patient and loving enough, eventually that devilish man will see that we deserve for him to become his best self."
274,"Can we just talk about speculums. . .

&gt;&lt;"
275,The world will not treat you any better just because you're a good person with a good heart.
276,I never realised how common they are.  Not just on women but men as well. 
277,"""Teener peener lmaooooo"" usually annoys the fuck out of them."
278,He turned out to be a total tool and a horrible partner. A bunch of time wasted on that. 
279,"It must be hard to argue with you braless, when you already make two outstanding points."
280,"Me too.  I’ve actually considered breast reduction.  My cousin had breast cancer and she had both her breasts removed and “designer” ones (her words) put on.  She picked small breasts and she couldn’t be happier (and cancer free!!!). Her surgeon tried to talk her into breasts the same size as her old ones, but she wanted to be able to go bra-less and wear cute backless tops and really celebrate her new found health and outlook on life.  She caught her cancer early and battled it aggressively and won, and she deserves her cute boobs! "
281,So....hips?? I just looked it up and still don't know what that is. 
282,"Cleaning without being asked. Co-parenting our dogs. Making me dinner before I get home from work. Always being around when I need a kiss/hug/butt touch. Being respectful and encouraging of my habits/space/hobbies. 

I moved in in October and it's been wonderful. I've lived with two SOs previously, and had numerous roommates in my life. But this has been the best living situation by far aside from living by myself. It might even be better than that, because when I have bad anxiety weeks he at least does the dishes and cleans the house which I wouldn't have the drive to do on my own. "
283,"I read somewhere that they respond with, “omg is that a child’s penis?! I’m reporting you, you sick fuck.” "
284,"Oooof. May I ask, what was ‘the moment’ you first started realising / learning this?"
285,"My long labia.

Apparently it's supposed to mean I ride the *cock carosel* but I've had these awesome flaps all my life and I've never thought I should care about what they look like. They just are what they are."
286,"That if I could meet myself 10 years ago, I would be so excited to tell him who they get to marry. I'd never tell my wife though because that's cornball as shit."
287,"when i was a teen my mum would joke that the size of one of my thighs was the size of what my waistline should be.

i've got a whole heap of insecurities on my weight, but i've always been weirdly proud of my big thighs... i got lightning bolts tattooed on them now too, so they're officially thunderthighs :)"
288,*yep*. there's a big flight of open stairs to my workplace and i find myself scuttling like a beetle when i go up because I don't want the world to see my butt any more than it has to
289,They need to offer lanyards as an option as standard
290,"My nose is small and thin, I always thought it was cute. I broke it when I was little so it has a bump. 

My aunt was married to a renowned plastic surgeon and when I was 14 he told me he was going to fix my face when I was 18. I was like “what are you talking about?” 

“Your nose. I’m going to fix that monstrosity.  Also going to fix your lips. Your cheekbones are ok thought “ 

I had NEVER been self conscious before that! And since then I began to hate how i looked in photos 

I’m 41 now, said uncle is no longer married to my aunt and I’m very happy with my crooked nose thank you very much. He can keep his cocaine snorting nose out of all our lives for the remainder of times "
