,text
291,"It's not for me. I'm not against marriage, I just don't see the point in it.

Yes, there are legality issues that marriage comes with, but nothing that can be worked around. 

There are wills, power of attorneys, and other legal documents that can be arranged with a lawyer. 

I find the ceremony to be beautiful sometimes. But you can always have a ""ceremony"" to celebrate the commitment two people have.

I was kind of a loser in high school,  and I accepted that I would be alone forever. 

I have a boyfriend who isn't against marriage, just isn't in a rush to go down the altar. We have been together 6 years, and while we love each other and we have built our lives together. We both don't feel like getting married is going to improve on anything. "
292,"Let me add on the mature addendum to that.  ""If someone tries to leave, talk things over and see if you can resolve differences.  If they still want to leave, let them.""  

It takes two willing parties to make a relationship.  At any time for any reason either party can decide to end it."
293,"I've had this exact issue. My husband thought I'd be able to walk into a Wal-Mart and buy work gloves in my size. I tried not to laugh, really I did. 

He's also been surprised that they don't have women's thermal socks, packs of cheap shirts, and warm boots that aren't fur lined. "
294,"exactly haha it's hips, yet social media seems to think that the natural shape of a womans hip is incorrect and needs to be fixed. "
295,"They should offer hats, which sit on the seat and below for you to urinate in, then pour into the cup. "
296,"If someone says they dont want to have kids or get married, believe them the first time. They will not grow out of it and you will waste years of your life waiting."
297,Respect in the workplace. 
298,"This is so true. I used to wear heels quite a bit and just dealt with it. Then I broke my foot one day (I was bare foot, not heels related!) and after hobbling along on crutches and in a walking cast, I got so sick of not being able to move properly and be free, or walk a proper speed. I realized how limiting heels are, how we have to walk so much slower or it can be quite taxing, how difficult it actually can be to walk properly when surfaces change, slippery, grates, stairs, loose gravel on a side walk ... now I'm like fuck it and just wear flats. I can also run to catch a train or easily cross the street now. So much freer and I don't give a damn if I look less dressy. My feet need to carry me through life and dammit I'm going to treat them better so that they can. 

&amp;#x200B;"
299,"No such thing as too old to live at home - disabled folk may need to live at home, people go through unexpected problems in their life so may need to move back home, the economy sucks so a lot of people have no choice but to stay at home or move back while they save for a home. "
300,I kept my own name.  It’s me.  
301,Calories are a thing
302,"I'll get into a phase of enjoying painting my nails as a restful, fun activity and then a phase of being annoyed because it chips and leaving the polish off for months."
303,"A good way to to keep this going (and an overall good thing for both of you to get in the habit of) is expressing appreciation to your spouse when they do something thoughtful or kind. It can be as small as saying thank you when they’ve emptied the dishwasher without being asked. It fosters good feelings all around, and people will continue to do more if they know it’s appreciated. "
304,"When I learned CPR we had to practice finding the right spot on each other, men and women. Slightly awkward but I mean you've got to get over it if you ever need to do CPR on a woman, so it's probably best to figure out in a less stressful situation anyway. "
305,"The majority of public restrooms were obviously designed, or at least detailed, by men. Some examples: do NOT put the waste bin outside of the stall! Or in the case of standalone restrooms-- where they put them all the way across the fucking room! We need to dispose of sanitary items that are best dumped in a bin (with a lid!) within arms reach of the toilet. Same goes for bad location of toilet paper rolls-- I ain't tryna go-go gadget just to get some two ply. Sensored paper towel roll dispensers located next to a toilet, that we ladiez have to sit on, triggering endless dispenses of paper towels while you just tryna do your business. No hooks to hang purses,nursing/changing bags, or coats. Sure! Let me hold all my things on my lap while I wipe my cooch? Restrooms without mirrors (bad design for all genders imo). Restrooms without proper changing tables for infants. Bad lighting. Terrible circulation i.e. door opening inward while there's a line of people who are waiting to wash their hands but there's a hold-up because there is only one mirror and someone needs to adjust their make-up, and the trash bin to throw away your used paper towels is back behind the other people waiting so you are all shuffling around and there's a jam and nobody can go in either direction. :end rant: 

TL;DR For the love of God, hire a female to design your public restroom!"
306,Get a cat. 
307,"My feelings exactly. Friendly, but not friends."
308,"Functional summer and winter work boots for women!!! I am an engineer and I work in construction in Canada, finding winter work boots was an absolute nightmare"
309,"It’s ok char-less, everyone is welcome here"
310,"A woman wearing men's clothing is ""gender neutral"" or ""androgynous"" while a man wearing women's clothing is ""deviant."" It's infuriating. "
311,"My husband and I got dollar shave club, and I’m never going back. I’ve never used a sharper blade, they send them to me and I don’t have to think about it, and there’s no pink tax."
312,"Let me save you SOOOOOO much time and tears, dear friend - if it was worth it, \*both\* people would be fighting for the relationship. A ""relationship"" where one person is fighting to save it = inherently not worth it."
313,"Medicines. Male is default, women are a much less-researched subset. Pregnant women basically don't exist. "
314,You’re right but what happens if the person that doesn’t want to relationship keep contacting the person that does and wanting to spend time with them and be with him in every way possible but doesn’t want to be in a relationship and that other person is trying to MoveOn and keeps getting drawn back it’s hurtful
315,YES. I want something that doesn’t require large straps and a 3 hook closure too!
316,"Delivering on your back, the one you see in any popular depiction of childbirth. Just think about it: it narrows the pelvic opening by putting pressure on the tailbone, puts unnecessary stress on the perineum (which can lead to tearing). You're sort of delivering ""uphill,"" against gravity. 

Better positions are basically...anything else. Delivering on your side, or on all fours, or squatting.

But, the supine position is easier for doctors... sooo... here we are."
317,Mario?
318,I was thinking about this recently as I'm taking part in a few scientific trials. The amount that exclude anyone on hormonal birth control is astounding. I totally understand they don't want to risk any other variables that could contribute to their results but it blew my mind thinking of all this migraine/cancer/eating disorder research (those just being ones I've taken part in) that exclude a HUGE number of women under 30/35 because of birth control
319,"My brown skin. For living in a country where white, ""gluta"" skin is worshipped, I could care less about conforming to that beauty standard. I love being brown."
320,Sometimes you arent prepared to take the hard way. And that is okay. The easy way exists.
321,"When I worked at a grocery store near 2011, I actually remember someone came in without a bra and everyone was staring at her chest. I felt so upset for her. It was a lot more uncommon then, but I just don't get the point of staring."
322,"When I was younger and stupid and had no self esteem, I tried. He still cheated on me. For four years.


Now? *Fuck* no! Why would I waste my time on someone who doesn't respect me?"
323,"Wear sunscreen. 
On your face, every day, every time you leave the house, no matter the season or weather, no matter how old you are or if you are only going to be out “from the house to the car.” Make it a habit. 

Seriously. Wear sunscreen."
324,Ah I would love to feel this way but instead I'm Cellulite Sally look at my badonkadonk
325,"Osprey is an expensive brand but does phenomenal backpacks that not only actually freaking fit women but were designed for women. Their bags were the first time I realized a backpack should sit above your ass, not on it. Mind was blown."
326,I need to go to work to earn money to pay bills to finance my cat's lifestyle.
327,"I didn't have trouble calling it rape, but I did have a lot of trouble feeling sad about it. I was just violated and *angry*.


So I learned to fight.


I do have nightmares sometimes, and I will fight someone if they grab me by the wrist or touch me when I can't see them, but overall, I'm fine. 


I don't know any women in my social circles who *haven't* been raped, so it's not like my story or experience or trauma is special in any way. I'm glad I'm at least tough enough and mean enough to deal with it. A lot of women aren't. "
328,"Been married 10 years. Going great. I love being his wife .

I feel fortunate that I met my husband and for us, it’s been a great decade. And many more to come."
329,"Wash your ears. You can do it with shampoo while you're washing your hair. For some reason, it never occurred to me until I overheard a conversation about it. I still feel kinda dumb for having the common sense to figure it out. "
330,[removed]
331,"&gt; Most importantly, a building should accommodate the people who use it, not the other way around.

Some architects need to learn this rule *in general*. Tattoo it on the back of their hand or something. Designs that look cool but have no functionality and are a waste of floor space or usable area are so frustrating.
"
332,"Somewhere around my mid-30s, I ran out of fucks to give and I haven't replenished the supply since then so... :: shrug ::"
333,I stopped dating guys who had an issue with me having guy best friends. If a guy can't/won't give me the benefit of the doubt in the beginning then there isn't a path to something more which requires full trust.
334,Same boat here. I also find that I prefer to wear one anyways for support reasons unless I'm essentially not moving. The bounce is not fun if you have to jog a few steps or run up some stairs.
335,I got this to happen in my office. There are 5 ladies and 7 men that sit on our floor. 3 of the men run cold. The ladies of the floor once blew the breaker 4x in one day so they took away our space heaters. I started a campaign to raise the thermostat. The clencher was when safety  deemed it unacceptable that 3 people's fingers were turning blue from the cold. They changed the temp from 61F to 68F. It is soooooo much better now!
336,"They’re my closest friends. We didn’t start off this way but over the years various internal moves at work brought us all together and we’ve worked together now for 11 years as a core group (but a few of us have worked together longer) and each year our friendship has grown. It’s not been perfect and there was drama in the early years but now we’ve all settled in and we’re really good, really close friends. We have a work chat group that’s very active 24/7 so we don’t ever go a day without talking to each other, even when on vacation or off sick etc. They’re the first ones to offer support or sing praises. They’ve been more supportive towards me through difficult times than my own family or friends I’ve known way longer. I’d be lost without them.

Whenever we’ve had temps help us out they’ve always commented on the friendship and said how rare and lovely it is working in a team like ours. They make an otherwise unexciting job a pleasure to go to."
337,the pronunciation of my name. It's Charles and he kept saying Char-less. I corrected him and he told me I was pronouncing it wrong.
338,Seatbelts are a big one actually. Women a have a higher injury rate in crashes because they are designed and optimized for an average male height
339,"Boobs, most of the time I have no problem with my flat chest. But I have seen so many ""clothes for real women"" or other ""real women"" (with ass and boobs) stuff. What am I then if not a woman? A cucumber?"
340,Yes! My lab coat is too small to fit over my hips sitting down so I can't even button the bottom and our one pair of liquid nitrogen gloves are size  large.... I wear extra small glove size normally.
341,"The same happened to me. It started consensual, and then I started saying no and he didn't listen. Also wouldn't let me leave his house, had to basically break out and run away. 

I still consider it rape. I reported it as rape, even though when I reported it I remember saying ""I don't know if this counts"" but the wonderful woman who took my report said that of course it counts, and made me feel so comfortable and safe.

It affects me sometimes. Like if someone does or says something that reminds me of that night or of him. One time I saw him while I was on the bus and it passed by the store he works for and I shut down.

I honestly think the only reason it doesn't affect me THAT much anymore, or even right after the event, is because I went through horrible trauma when I was a teenager, so in my mind I just was like, if I could survive that then I can survive this. And from then on I would just avoid men that reminded me of him. If I'm with someone or dating someone that reminds me of him, I consider it a red flag and distance myself.

&amp;#x200B;

I hope this helps"
342,It's really hard to not look. Like I actively have to force myself to look away. Boobs are just so... Amazing.
343,Let their mother have a spare key. 
344,"I don't notice or care what other people do. Never found it lewd when someone was entirely covered. A slightly different shaped lump on their body. Sure, they move more visibly, but so does my arm fat.

I personally however am never without a bra. I'm current a 32GG and it would be a tripping hazard at best."
345,"""Oh it's so romantic that Snape never stopped loving Lily."" No. No it isn't. It's creepy AF. She was nice to him for about 10 minutes when they were children and 20 years later he's so obsessed over her that he's a jerk to her child because Harry reminds him that she chose someone else over his racist ass. Plus the whole ""you can murder James and the baby IDGAF but make sure you let Lily live so I can take another crack at her"" thing when he was a death eater. It's gross and creepy and awful. I mean yeah James wasn't exactly king of the awesomes when he was a kid, but he obviously got over the whole I'm Super Cool Guy thing. Shit he's the only one that really grew among the gang - Snape and Sirius were the same folks they were in high school. And that's fucking sad"
346,"A guy asked me to visit him, sent me pictures, asked me for pictures, and talked to me every day for a little over a week about how much he liked me...then he just disappeared. Won't answer messages, doesn't talk to me, and the few times I've hung out with him since he seemed completely uninterested. I'm not great with people, and have a lot of trouble even making friends, so it's kinda fucked up my sense of self worth/confidence to know how easily someone can just drop me like that. "
347,"&gt;Easier for the doctor,

That's exactly why the (mostly male) obstetricians started saying that was best practice, when obstetrics started becoming an actual medical specialty."
348,"That couple from the notebook. I watched it with friends who adored it when I was 14. Over the years I realised just how sexist and harmful it was because the movie was basically saying that it's ok for a woman to hit, scream and punch a man for breaking up with her who isn't even fighting back."
349,"Don’t shave my legs. I haven’t for years, and if I’m honest I only did it before because there was that *thought* of it being mandatory, it never did anything to make me good or even better"
350,"In this same vein though, if you’re not sure, take some time off if you need to. I’ve seen a few people pick a major they end up hating before dropping out altogether, and never going back. Or starting and stopping several programs before finally finding one they like or are ok with. 

I decided on a gap year after high school for several reasons but it turned into 12 years *somehow*. Now I’m 31 and in my freshman year of college, while also raising a family-the kids are all in school, so I am too now. I don’t recommend this particular route but I know what I want to do with my life, I know how to get there and I’m motivated to do well. 18 year old me wouldn’t have done as well as I am now."
351,"This is true for autism as well - a lot of autistic women aren't diagnosed well into adulthood, myself included. We're often initially misdiagnosed with borderline personality disorder."
352,"These are all great tips! 


Remember that cost does not necessarily equate to quality. 

Coconut oil works wonders for my skin and hair! I put it on my face, in my hair, on my legs, my hands, lips, everything. It’s like $10 for a jar and lasts sooo long. 

I do spend money on organic or all natural hand soaps, though. (Like Ms. Meyers.) A lot of stuff just dries me out like crazy. 

As for a nail care kit... I bought a cheap UV light off of Amazon for $15, crystal nail file, and 6 different gel polishes in addition to the top and bottom coat. I had the polished shipped from China, so it was super super super cheap. Doing my nails makes me feel so beautiful and well put together. What a great suggestion!"
353,"A read quite often of this ""love language"". Is it actually insightful? How does one find what is theirs?

I'm curious because i never heard or read of that outside reddit! "
354,"Knowledge is not a shortcut for experience. I’m a tad of a control freak so I like to read ahead and inform myself on things but I’ve found that knowing something is happening to me or around me, why it’s happening, what the best course of action is, etc. intellectually just doesn’t stop me from having to steer myself through the feelings, the situation, the sensations... In essence, knowing something is very different from actually experiencing it."
355,"So my boyfriend's ex girlfriend, right.. She took the breakup very hard (they dated for 5 months). When we got together 6 months later, it sent her into a whirlwind of emotional turmoil. She tried to be everywhere he was by stalking through social media and at one point tried to convince a friend of ours who was watching his dog that he said she could have her for a day (she believes they adopted the dog ""together""... honey no, it was his dog), would use his family to get closer to him, beg for phone calls for closure, etc. So he felt it was best to go no contact with her and avoid the outings with their mutual friends where she was there.

Fast forward to now, a year and a half later. It's been long enough that we're kind of over it and aren't going out of our way to avoid her anymore. She's been making more and more appearances at social gatherings and although she's for the most part pleasant and we get along, every so often she gets.. a little too drunk and has a weird breakdown, overshares about how much she's cried over us in the past, and clings onto me really hard as though we're best friends. It's a little weird, but it's... it's fine. This is fine.

The real wake up call was the other night. Everything started out fine. We were like, wow Erica is really on her best behavior today! And then when we left a BBQ at a mutual friend's house, she coincidentally left at the same time because ""her cab was downstairs."" There was no cab. She walked home with us (sure, she lives in the same direction.. this is normal right?).

And before we parted ways she begged us to let her come up to our apartment to see the dog. Girl this ain't healthy tho."
356,I’m a normal sized woman who struggles to find pants that fit. Skirts/dresses are comfortable af. 
357,"Yes.

Things I need to do, things I want to do, things I've said, things I want to say."
358,"""You should probably get that checked out by a doctor. It doesn't look normal..."""
359,"Similar to ""hangs out with me in the shower.""

One of my favorite things that my fiance does is to sit with me when I'm getting ready for a big event in the bathroom. It gets lonely, that hour spent on hair and makeup! So he always comes in and just talks to me. 

Legitimately some of our best conversations have happened with him on the toilet and me with a curling iron in my hand lol"
360,"Ugh yes! I had a project where I had to point this out to multiple men multiple times. 
“Why would they be wearing dresses?” Oh, I don’t know, because it’s the VIP Event room of an upscale winery? 
“Who would even see?” 
It literally cantilevers over the production space. Anyone working will see. 
On the flip side, I did have to have a guy point out that I shouldn’t have urinals and lavatories on opposite walls because then you just see dudes peeing in the mirror. "
361,How about this dude gets the small bed. It doesn’t have to be separate though as no one should have the misfortune of marrying that asshat.
362,Same with those highly reflective floors.
363,I agree with that. I’ve gotten strange looks from trainers when I’m climbing the machines. Like at least have a stool so I can change the different bars on the machines. 
364,"After a few years of this trend on Instagram, I still react with total shock to the extreme lip fillers every time I see it. I mean, do what makes you feel good! But whoa. They just seem so inconvenient for like.... eating. Drinking. Talking? I dunno. Anyone have them and love them?"
365,[Consensual duck pic ](http://www.fanpop.com/clubs/birds/images/36091652/title/such-pretty-duck-photo) 
366,"Kelly Redwing 40litre comes in a teal or dark green option designed specifically for women, notably a higher chest strap, curved and padded waist strap, and a lil bit of cushioning on the lower back so it doesn’t bang into your butt!"
367,"Male heart attack symptoms are ""normal"" 🙄"
368,[removed]
369,"For a hot second, Blair and Chuck were fun.

Then the writers decided to assassinate both of their characters, and everything just turned weird and abusive-y. The fact that this pairing remains an ~OTP~ for many people just... doesn't bewilder me, exactly, but kind of makes me sad."
370,"I totally get this. If I’m going to be alone and lonely, I’d prefer it to be in the comforts on my cozy house. Being out in a coffee shop or a park mostly worsens my mood as there’s so many people having a great time together and it just reminds me of what I’m missing out on. 

Plus my cat is at home 🐈"
371,The countertop too! If the countertop were several inches lower I could get proper leverage for cutting things and have an easier time using large mixing bowls.
372,"How to pronounce my name. I said, it (proper pronunciation) then they said, “you mean (different pronunciation)”. I laughed it off, restating what the proper pronunciation, but they didn’t find it funny at all, and proceeded to call me by the incorrect name during the rest of our interaction."
373,"You're not the dumbest person in the room.

This is something that I'm still learning."
374,I had a former 'friend' refuse to try to date one of my guy friends despite her obvious crush on him because I 'had dibs' on him which was so patently ridiculous.  Gotta love it when people make their social ineptitude your fault somehow.
375,I needed this 20 years ago so badly
376,At some point turning the thermostat up makes sense. 
377,That scene where he’s dangles off the Ferris wheel unless she says yes to a date. They REALLY tried teaching us that that’s “romantic”. I can’t.
378,The Gillette Mach3 (and Target knock-off) heads fit on the Venus handle. Better blade but still get to keep the non slippery handle. If you want more blades the other ones may work as they seem to try to use the same connection to minimize that part of the design/production process. 
379,What it is like to run while on your period. And it was a man arguing with me
380,"I'm a paramedic, my partner can't get boots that fit her because she wears a women's size 4. They don't make proper boots that small. She trips a lot because her boots are too big "
381,Hope I get there soon. I hate that it shows every bruise/sunburn/imperfection. I’m constantly wanting to tan my skin (even though I can’t bc I burn). 
