,text
76,At first I thought you meant there was a product out there made to scratch your genitals and let me tell you I was confused
77,"Tights- scratchy. 
Pantyhose-a pain to get on, often get runs, a bit scratchy but not terrible.
Leggings--amazing. Comfortable. I wear them to bed. They're super soft."
78,"I cry way too much.  When it comes to serious conversations where I need to talk about a problem or how I feel about something, I instantly cry.  It's always been a problem for me and makes it hard for my partner to have a constructive conversation with me :/"
79,Yes! So nice to see this!
80,"I have beautiful soft curly hair because I don’t ever use heat. The trick is to wash it less (every 2 days), shampoo probably 1-2 times a week and condition it more than you shampoo your hair basically


I use coconut herbal essences conditioner. You won’t regret using it, amazing product. Your hair will be so soft after the first use. As a person with curls, it worked wonders for me. Lots of people started complimenting my hair after I started using it and still do

 I also let my hair naturally dry and it forms into perfect curls. Blow drying it makes it puffy and damages your hair"
81,"Thank you for posting to /r/AskWomen. In order to give all users an equal opportunity to have their questions answered, we restrict submissions to once a day (24 hours). Please wait 24 hours before submitting a new post. If you believe your post has been removed by mistake or you are submitting again after a removal by the moderators, please **[CLICK HERE!](http://www.reddit.com/message/compose/?to=/r/AskWomen&amp;subject=Why+was+this+removed?&amp;message=\My+submission+was+removed+due+to+the+frequency+limit+and+I+would+like+to+appeal+the+decision.)** [AskWomen rules](/r/askwomen/w/rules) | [AskWomen FAQ](/r/askwomen/w/index) [reddit rules](http://www.reddit.com/rules/) | [reddiquette](http://www.reddit.com/wiki/reddiquette)

-------------------------------------------------

 ^^I ^^am ^^a ^^bot. ^^Please ^^address ^^concerns ^^about ^^this ^^action ^^to  ^^[/r/AskWomen](https://www.reddit.com/message/compose?to=%2Fr%2FAskWomen;subject=problem%20with%20bot)  ^^or ^^about ^^me ^^to ^^[/r/moderatelyhelpfulbot](https://www.reddit.com/message/compose?to=%2Fr%2FModeratelyHelpfulBot;subject=problem%20with%20bot)."
82,"They are not comfy but you should try them anyways, it sounds like you want to"
83,"Honestly same, I have strawberry blonde hair and I don’t dye my hair because I’m afraid of loosing the color"
84,[removed]
85,"This comment or post has been removed for derailing. 

Derailing includes but is not limited to:

* Changing the topic from OP's question
* Making someone else's response about yourself
* Asking unrelated follow-up questions
* Branching into unrelated topics
* ""What-about""-ism
* Arguments, slap-fighting, or debating
* Judging or rating other responses
* Meta comments about other responses
* Responding to comments to tell us how your dick feels. No one cares.

If you have any questions about this moderation action, please message the moderators through the link on the sidebar or [here](https://reddit.com/message/compose?to=/r/AskWomen). If you are messaging about your removed comment or post, please include a link to the removed content for review."
86,"So a related question, since several responses mentioned separate beds or separate rooms - is it possible to not share a bed in the long run, without it impacting your physical intimacy?"
87,wanna trade hair? my hair is pretty curly I prefer straight hair.
88,yeah not a good friend
89,"If you're wary of being a dude and wanting to try pantyhose, you can comfort yourself with the knowledge that Navy Seals wear them instead of wetsuits in warm water. Anyway, I don't think they're comfortable because they're always awkwardly sized. Either the legs fit and the hips/butt/waist don't fit, or the legs are two feet too long and everything else fits."
90,Grab a pair and try em out.
91,not crying from feeling overwhelmed
92,I meant more of a habit I guess.
93,[removed]
94,"Tights are really comfortable, pantyhose is severely uncomfortable, and stockings are OK but you have to pull them up quite often.

Seriously just buy some and try them on."
95,Tell him I’m married and to do better
96,"I stopped using heat on my hair except for really fancy occasions... when I was emo though, I straightened my hair daily and my hair ended up looking like straw so I stopped..."
97,"I'm too blunt. I don't know how to ease into things. I get emotionally overwhelmed and think about myself, until I can see his point of view."
98,What ratio do you use?
99,The Last Man On Earth deserves all the credit for this though 😂
100,"My boyfriend and I have separate blankets. It works out even better for us because I like a thicker one and it's too hot for him, so he prefers a thinner one."
101,Following through on the you're not actually hungry you're just bored and you don't need to eat thing
102,"To control my emotions, it keeps me from making things a bigger deal."
103,That's a good point. I've told him that I feel like we have an expiration date bc it just seems like I'm always putting the effort in to keep us afloat and now I'm just tired. I'm not even mad anymore. It's messy and our relationship is rocky at the moment.
104,"I kind of just eyeball it these days but I have a 32oz spray bottle. Id say 28oz vinegar and 4oz dish liquid. Dawn is preferred but whatever you have works fine! Adjust the ratios to your liking. Add more dish liquid if you want more foaming action. 

That said, the first time I followed an original recipe where it was 1:1 and I do not recommend it for cleaning large surfaces because you'll be rinsing FOR DAYS lol, especially since Dawn is so damn concentrated."
105,"I know he's seen it all it's just the fact that we've hung out outside of the tattoo situation. That said he is very respectful and has asked plenty of times if I'd rather he get somebody else to do it, but I think he would do the style best. Droop sisters - that works, I'll probably wear a spots bra then. None of the tattoo is actually on the boob flesh so we should be good. And yours is still visible even if your boobs are out and you're standing normally? That's reassuring. Although most of the people who see it will probably be my friends seeing it while I have a bra on, so I'm not that worried"
106,do you still love them when they arent giving you attention?
107,"When you don't have their attention are you thinking about them, missing them, or just thinking about where else you could get attention?

When they're feeling down, sad, or stressed do you want to help and make them feel better or are you just going through the motions until they're focused on you again?

Infatuation, lust, and attention-seeking are selfish feelings, focused on you. Love isn't selfish, love is wanting a partnership, and wanting the best for your person even when it means sacrifices on your part."
108,"When I've said a need a few times, like affection outside of sex, and still am not getting it.

Like I feel like a needy idiot for asking for hugs and kisses.

So now I've stopped."
109,"I fell off a horse onto a cattle grid then the horse fell on me, tried to get up and fell on me twice more. I felt my bones break. Funny thing is that I must have been half conscious but I remember everything going lime green for some reason."
110,Nope just slosh it around in the bottle until the dish liquid is dissolved :)
111,I just bought that last night.  Do you use it for the shower?
112,"No, it's not. Because you aren't his mother, and he has to be adult enough to do that. If they've done things so egregious that you have cut them off entirely, it's not realistic to avoid them the rest of your lives together unless both of you do, and he has no interest in doing that. It means he doesn't actually understand why you did that, and still chooses them, or rather, himself, over you in the long run. 

It starts with small stuff, but if you already have issues with his parents, it WILL become bigger and bigger the longer you are together.  When there is unresolved dysfunction in a family, you marry the ENTIRE ball of dysfunction unless it's resolved."
113,As long as he is aware I'm sure he'll make it comfortable for you. Yes mine is noticeable when I stand straight. You can kinda see the top I have cleavage but I love having my little secret. That's why he had me stand normal so it could be placed right. I think it's my fav tattoo. Pain sucks but I would do it again. And sports bras were a savior during the healing
114,"Clitoral 16

Gspot 23"
115,Thank you for the kind words
116,27
117,"Happened this year., she ghosted me the day before my 21st birthday. She started to talk and hang out with this girl a lot more lately which made me feel fomo so I told her that and how petty it was of me, but we planned on going out to celebrate my birthday once I was on spring break (I'm in school she isn't). I remember her saying how she didn't like this girl and how she would come visit unannounced or just come over to do her hair/makeup. The last text I got from my friend was something a long the lines of ""I don't wanna do this right before your birthday."" Didn't get a happy birthday message or anything.

A week goes by and still nothing so I unadd her on some social media. That resulted in me being blocked on everything. I sent her one last text apologizing that I didn't mean to take it this far and so on. No reply and it's been four months so safe to assume we are not best friends anymore."
118,"I'd stop visiting this friend at home, and avoid seeing her at all in potential company of her sister."
119,[removed]
120,"Hello arcticfox_12. Thank you for participating in /r/AskWomen. However, your submission has been removed, because we do not allow personal advice or evaluation submissions. 

You can always go to /r/askwomenadvice, /r/relationships for romantic/non-romantic relationship advice, /r/legaladvice for legal advice, /r/femalefashionadvice for fashion advice, /r/skincareaddiction for skin care advice, or /r/findareddit if you dont know where else to go.  Please remember to read the rules of any subreddit you go to.  

If you think you received this message in error, please [message the moderators (CLICK HERE)](http://www.reddit.com/message/compose?to=%2Fr%2FAskWomen&amp;subject=""My post was removed for personal advice""&amp;message=). Thanks.

*I am a bot, and this action was performed automatically. Please [contact the moderators of this subreddit](/message/compose/?to=/r/AskWomen) if you have any questions or concerns.*"
121,"Having all this doesnt mean everything. Consider yourself fortunate that you aren;t predisposed to all the trivial shit that everyone thinks life is. When everything  and everyone is stripped of all these trivial things - that is where being a human being and life begins. There is a saying about this in the bible,  I cant remember right now. Something in the bible - when you have nothing you know what being a human being  is and its the purest thing you can have. I think its jobs."
122,"Straighteners never, but I sometimes blow dry with a diffuser on low heat only if I am really in a hurry though"
123,I love that... sounds like something I'd do XD
124,Attached by Amir Levine!
125,Stardew Valley
126,Cry myself to sleep
127,Ole E. Dump out half and add 1/4 part OJ.
128, [https://media1.tenor.com/images/106aee7f4d803c18ae08cbbce5f72ebe/tenor.gif?itemid=11111340](https://media1.tenor.com/images/106aee7f4d803c18ae08cbbce5f72ebe/tenor.gif?itemid=11111340)
129,18.
130,"once every three or four months. i got comfy with less-styled hair, and as a result my hair is healthy enough to bleach and dye blue as often as i want"
131,"I posted this to a similar question a little while ago, but I think it's relevant here.

I constantly check in with myself, my support system, and my partner.

I am often comparing myself in my relationship to my single self: am I as happy? Do I still do the things *I* want to do? How am I spending my time? What have I given up to accomodate the time and effort put into my relationship? Am I okay with those sacrifices? Have I completely let go of certain hobbies or aspects of myself? Am I okay with that? How has my mindset changed about the rest of my life due to influences from my partner?

I make sure my friends and family meet my partner and mesh well enough. I also check in with friends one on one to get truthful answers. My support system is honest and open with me because I am with them and there have been times when they say ""he's got the mindset of a highschool boy about sex"" (which shattered the glass on a potential partner and made me rethink things) or ""you haven't seen us in 3 months, I get this is new but comm'on man"" (which pointed out that I wasn't keeping a healthy balance with that new partner). My best friend put it very well once: whoever is in the relationship has their judgement compromised due to feelings, so friends step in with their judgement to make sure those feelings aren't blinding us to red flags.

Finally I check in with my partner: when something bugs me I mention it. I don't sweep my issues under the rug despite that being my main tactic in my last relationship (spoiler: 7 years of unmet needs can't fit under the rug). I always try to use these talks to open the discussion to everything about our relationship so that he can mention things that he might be holding back on too. We are both people-pleasers who have natural tendencies to martyr ourselves for our relationships, knowing that- I combat it with efforts to bring out any negative feelings early so we can manage them together.

Listen, being in any bad relationship for long trains you into toxic behavior and mindsets. It takes active thought and energy to untrain yourself and I'll be doing this ""proper training"" for the rest of my life I think, but it is so worth it to have a healthy and happy relationship. If you're not willing to do the work to untrain yourself out of your own toxicity then you have no business partaking in partnership."
132,"Red stripe, pbr, or natty boh."
133,Good choices!
134,"I was 20. And it didn't happen frequently afterward, not for years. By 25, I was finally able to come pretty easily and regularly with partners. Some of it was getting partners who'd listen, some of it was changing how I masturbated so that my body would ""know how"" to come with a partner."
135,I do the same but with a strong mousse
136,[removed]
137,I drink.
138,Zero comfort.
139,Act badass when they are not
140,"Well, I'm a woman and I play mostly RPGs. Fallout, The Witcher, Elder Scrolls series, Monster Hunter, Quantum Dream games. I like open world, or deep story games."
141,"You stop dating for at least half of the time period that you were in that relationship. If you were in an abusive relationship for 1yr, take at least 6mo where you go on zero dates and focus on your recovery, you friends, your family, your health, and your job. 

If you were in a super long relationship, like 20yrs, you don't need to take 10yrs off, but take at least a year to really focus on your life outside of romantic relationships."
142,"I moved to another country. 

Social media is a miracle in cases like this but we both have families now and it's been 7 years. We miss each other and still chat once in a while but life drives you apart unfortunately. Planning on moving back to my country for a year with hubby and daughter and can't wait for evening walks with her and her son."
143,Getting as much back as I put in - be that the occasional grand gesture or small things like refilling your SOs drink when yih see it's empty on the way past.
144,[removed]
145,When they give you cute Nick names like who are you how did you get in my house dont touch me ow that hurts please stop shes just so silly
146,"I also enjoy that my boyfriend texts me multiple times a day every day. Even if it's just a quick ""I love you"" before he gets back to work"
147,Overheard her talking about me in the bathroom in grade 8.
148,"yeah you need to just leave him then. I've been involved with a narcissist, this won't change. I mean a real true, disordered narcissist. It will not get better, and if it hasn't already started will certainly lead to abuse."
149,"Best friend for 14 years, as soon as I got engaged it's like she made the decision I was no longer to be an important part of her life. We had been completely fine before that (we've been close forever) and as soon as I texted her the news, it's like she decided to become completely indifferent to it and to me. She barely responded. Despite that I kept making an effort, I told her it would make me the happiest person ever if she was to be at my wedding, I offered to switch around the dates (if that was the issue), but she just didn't care. I thought I'd give up after that, but I invited her to my bridal shower (as a sort of last attempt) and she completely ghosted. 

I went through the whole thing without her, and we haven't spoken since. I don't understand how you can throw away that many years of friendship for nothing. It's heartbreaking"
150,"I have thickish hair and I have a lot of it. Like an obscene amount apparently because I have to let hair stylists know when I book appointments because I take longer than people with a normal amount of hair. Right now it's long. It's wavy if I let it air dry.

Right now because it's summer and hot as fuck I'm not using any heat because I don't need to make myself sweat more. I usually just put it in braids to dry and then it's wavy/curly and it's cute."
151,And hows it all turning out? I'm so sorry to hear about your dog x
152,"Autonomy (remastered) by Perspective, a Lovely Hand to Hold

A friend played it on repeat the summer that I got to know him, and got involved with him haha. It was a really great time in my life, and that album was very different from what I usually listen to. It just left a very strong impression, when I hear it I just get taken back to that time and those feelings I had at that time."
153,"Insecure how? Financially? Emotionally? About their height or size of their dick? 

Are you saying women are insecure? I have so many questions."
154,"You say: NEXT! A failed situation is  making room for your true love, (someeone deserving of your love, a.k.a someone who can actually recognize how precious your love is) to come and fill their rightful position. 

Giving your heart is a privilege that only certain candidates will experience and with each candidate, you'll learn, and it'll help you streamline the admission process until you find the true and  ideal one, who is meant to have that position; one who is qualified to recognize it's value, and the only movement for you both is upward and higher, promoting each other to the great level of love, commitment, trust, peace, sacrifice, and all the true greatness of true love. 

Every disappoint is a blessing.  You pick which perspective you want to lead you! Because your thoughts become actions, actions become character, and character makes destiny. 😊"
155,Old spice deodorant
156,"This comment or post has been removed as it contains graceless generalizations based on gender or speaking for others of a gender. 

- Women are not a hive mind.
- Do not speak for all people of a gender.
- Do not generalize across all people of a gender.
- Do not ask for mind reading.
- Do not ask for us to defend or justify other women’s behaviors.
- Do not assume that all women do or think something.
- Do not ask for ""male equivalent""/""female equivalent"" as these would not exist for most things due to different cultural processes.
- Exceptions: Discussion of cultural norms; Quotations
  - Contact the moderators if you feel your comment/post should fall under an exception.

Speak for yourself and your own personal experiences. Don't generalize your personal opinions, experiences, prejudices, stereotypes, or preferences across an entire gender.

If you have any questions about this moderation action, please message the moderators through the link on the sidebar or [here](https://reddit.com/message/compose?to=/r/AskWomen). If you are messaging about your removed comment or post, please include a link to the removed content for review."
157,"If it's not hurting anyone and everyone consents, I say let it be."
158,"Busch Light and PBR! And for very special occasions, Hamm’s. I love craft beer and craft whisky, but there’s a soft spot in my heart for shitty American lagers."
159,[removed]
160,"It dissolves it.  You do need a scrubby though because it won't just rinse off. No major elbow grease.  If you let the oven cleaner dry, though, you'll have to scrub.  Let it sit for five to ten minutes, use a scrubby to loosen everything, rinse."
161,"I pack way more than I need and still don't have anything to wear. Or, I forget a key component of my outfit...like matching shoes."
162,I finally found myself after moving out of my parents house. Didn't realize it till it hit me that my life is turning out far better than I could ever imagined it would
163,I tend to ramble and not make sense of what I'm trying to express. My partner is always trying to get to the root of what I'm trying to say. I tend to drift off mumble something &amp; move on. He gets so frustrated but I finally had an light bulb moment when he said he is genuinely trying to figure out what I'm saying or perhaps what he said that I misinterpreted so theres better communication. All my life if I didnt say things accurately I was criticized so I assumed hed do the same. As a result Id never explain but he has good intentions as is ultimately just trying to understand my perspective.
164,Dos Equis with lime juice or Yuengling
165,"....where am I going? what's the weather like? what will I be doing? 

Can't know how to pack without that information, aside from the basics which is always packing 3 more pairs of socks and underwear than I think I'll need, plus toiletries and such. 

I use a suitcase + my regular handbag"
166,"LMAO I'm like this too!! So for me, it helps to compare how I felt around other people. When I just like the attention, it doesn't really matter where that attention is coming from. I like you because you're the one giving me that attention, but if you weren't around, it wouldn't be that big a deal as long as someone else was around to step up and take your place. 

When I like YOU, it doesn't really matter who else is around or how much attention other people are/aren't giving me, I want YOU to notice me"
167,"I don't really care for wearing perfume based on season. I like Flowerbomb and Philosophy Nude Grace, year-round."
168,I think so. And it doesn’t put too fine a point on it. I’m open to a variety of ways that might play out.
169,He would don’t worry! Enjoy the roller coaster of feelings you have now and move on when you are ready! Later on you will realize ah that’s why this doesn’t work out! You will be grateful that you dodge a bullet. Even though he might be nice but he might not be the best person for you!
170,"I clam up horribly and I forget my words, making it a lot harder to talk"
171,Showering daily.
172,"Take a step back from the bigger picture, and focus on grinding through life day to day. I also like to think of things I've accomplished rather than places I failed. Sure, it's a lot harder than it sounds, but it's what I do when I feel depressed or unhappy with where I am."
173,"Thank you for posting to /r/AskWomen. In order to give all users an equal opportunity to have their questions answered, we restrict submissions to once a day (24 hours). Please wait 24 hours before submitting a new post. If you believe your post has been removed by mistake or you are submitting again after a removal by the moderators, please **[CLICK HERE!](http://www.reddit.com/message/compose/?to=/r/AskWomen&amp;subject=Why+was+this+removed?&amp;message=\My+submission+was+removed+due+to+the+frequency+limit+and+I+would+like+to+appeal+the+decision.)** [AskWomen rules](/r/askwomen/w/rules) | [AskWomen FAQ](/r/askwomen/w/index) [reddit rules](http://www.reddit.com/rules/) | [reddiquette](http://www.reddit.com/wiki/reddiquette)

-------------------------------------------------

 ^^I ^^am ^^a ^^bot. ^^Please ^^address ^^concerns ^^about ^^this ^^action ^^to  ^^[/r/AskWomen](https://www.reddit.com/message/compose?to=%2Fr%2FAskWomen;subject=problem%20with%20bot)  ^^or ^^about ^^me ^^to ^^[/r/moderatelyhelpfulbot](https://www.reddit.com/message/compose?to=%2Fr%2FModeratelyHelpfulBot;subject=problem%20with%20bot)."
174,I knew because when we would make the exact same jokes at the exact same time. It’s hard to ignore something like that
175,"I tried to drink a PBR once, because I was desperately dehydrated and thirsty at a hipster house show that was sweaty and hot and overcrowded, and there was nothing else... and I couldn't."
176,True it really is their loss
177,"I don't have any advice, but I'm there right now too."
178,Who cares
179,we are all so hurt
180,"Hygiene and clean clothing, with a hint of cologne"
181,"Going through something similar too.. A thing I observed is that, they do know their cowardice. Their egos usually don’t allow them to accept and work on it"
182,"Heartburn! I had a week of heartburn, which is rare for me, and it finally clicked in my head to take a pregnancy test. I was only three weeks along at that point and didn’t get any other symptoms for at least a month (and then I got ALL the symptoms)."
