,text
0,People who put glass floors or walkways in buildings don't take into account that some people might have to walk across them while wearing skirts and dresses.
1,People will treat you the way you let them.
2,"You cannot convince someone to be with you if they don't want to be. Cut your losses, move on."
3,"21 years later, and he's just as thoughtful as year 1. We have a high school freshman and a 6th grader as as children as well. We both work full time.

*  Greets me at the door with coffee and ibuprofen if I text him about a bad day at work. (I work 12+ hour shifts and always get home later than him, but I have more days off.)

* Makes dinner without me asking if I had a bad day, even if it's my night to cook. Doesn't ask for me to make it up.

* Randomly texts me pictures of things he finds beautiful...sunrises, flowers art, woodworking...

* Is supportive with poor mental health days and treats it as kindly as he would a physical illness, like bringing me food, doing chores, or dealing with the kids. Never issues a judgement, even if the mental slump is a long one.

* Never holds a grudge. If I mess up and we address and settle it, I never hear about it again, even if in a future fight, the past may be relevant.

* No matter how busy he is, if I tell him I want to talk, even if it's just venting, he stops and focuses on the conversation.

* He has always pulled his weight around the house and with childcare. I never had to ask...babies got changed and fed while I slept, vomit gets cleaned up, floor get vacuumed, laundry gets done...we both carry the weight, but he just does it without asking.

* He has always fought fair, and because of how proactive he is, we actually rarely fight. I honestly cannot remember our last fight, and it's not because we are perfect, it's because we communicate before things can get big.

* He believes in growth and change, which is why we are still together. We met at age 14, so if we both had not firmly believed that growth and change are important values, we wouldn't have lasted past the first few years (together since 17, married since 21)."
4,"As an architect, this is something that frustrates me, since some of my colleagues don’t get it. 

When I point this out, a common response is “why don’t they just wear pants then?” Failing to realise that:

1. Someone might not know that there is a glass floor if they’ve never been there before.

2. Some women don’t wear pants due to religious reasons, and some very large women struggle to find pants that fit.

3. Most importantly, a building should accommodate the people who use it, not the other way around. That includes the women who use the building. "
5,Those visitor badges with clips that are meant to fit perfectly on a suit jacket’s front pocket and basically nowhere else. I never know where to put it and it drives me freaking nuts. 
6,"Backpacks with straps at the front. They are exactly at breast hight.

&amp;#x200B;

People who learn CPR only learn it on a male dummy, so people don't know where to put their hands for women because they don't want to touch the breasts."
7,"If someone wants to make you their villain, just say yikes and move tf on."
8,"No matter how much you trust someone or what kind of relationship you have with them, you should never lend money unless you're prepared to never get it back."
9,"-Use cold water on your hair when you wash it-it really does make a difference. I used to think it was BS until I tried it.

-Doing an occasional Apple cider Vinegar rinse (2 parts ACV, 1 part water) can add wonderful shine and volume to your hair, in addition to cleansing your scalp. Don't do this more than once a week though.

-Sleep! It really does make a difference in your skin quality. Not quick, but cheap :).

-Working out-lots of free videos on youtube. When you feel confident with your body, you'll instantly look better no matter what you're wearing or how your styled.

-Hydrogen peroxide mixed with water makes for mouthwash that whitens your teeth. Whiter and brighter teeth instantly make anyone look more put together. Just be careful with getting the proportions right so you don't screw up the enamel of your teeth.

-Leave yourself 10 extra minutes to get ready in the morning if you can, no matter your morning routine you'll always look more put together if you don't start out your day being rushed.

-If you can afford it, pick up a nail care kit at your local drugstore and do polish free manicures and pedicures at home.

-If you can invest in anything beauty wise, go for the best quality moisturizer you can afford and purchase a lip balm, eyebrow pencil and concealer or foundation. Having hydrated skin, a ""good base"" and groomed eyebrows is your best bet for minimal products to achieve a ""put together"" look. Only buy products from places with good return policies and try to get samples before buying if possible.

-Check out the frugal subreddit, I'll bet they have some tips."
10,"Seats and head rests in cars. They are meant for larger people who never put their hair in ponytails. It results in a lot of back and neck discomfort for me, as I drive 2.5 hours round trip daily. "
11,"I have a larger nose. Not horrible but definitely bigger than the cute noses most girls have. Was bullied a lot for it growing up, told I should get a nose job, etc

Not once in my adult life has anyone mentioned it to me nor has it stopped men from finding me attractive. Used to be something I was extremely self conscious about when taking pictures — barely pay any mind to it now."
12,I'm friends with my coworkers to the point that I had to go out of my way to invite non-work friends to my birthday so it wouldn't just turn into a staff meeting with cake.
13,"Pay attention to warning signs and red flags. Don’t be afraid to cancel or postpone a wedding to give yourself more time. 

Being married to the wrong person is miserable. Being married to the right person is amazing. "
14,"PPE. 

&amp;#x200B;

Labcoats do not close properly overbust, and are usually too broad in the shoulder and waist, creating safety hazard. Using them when pregnant is impossible. 

&amp;#x200B;

Disposable gloves are theoretically available in smaller sizes, just routinely not present in the lab/stores.  


Glovebox gloves are one-size-fits-no-one, are way too big and placed too high for most women (I'm tall, no issue with height for me, but my students often use step-stools, which isn't 100% safe).  


Breathing apparatus and other types of face masks have rubbers straps not suited when you have long hair - you can't tie the hair underneath, as the strap needs to fit snugly, you can't have the hair loose, as it's not safe to work like that.  


Shared cleanroom overalls and overboots are from men-medium size up.  


Unless you're a frequent user of any of those things and you order your customised equipment for yourself, using the shared stuff is either impossible or not safe."
15,Your comment reminded me of this article from last year: [Wanted: male architect willing to navigate his own building in a skirt](https://www.latimes.com/entertainment/arts/miranda/la-et-cam-male-design-in-architecture-20180714-story.html)
16,And not the way you treat them.
17,"Reading all these comments about how it's more socially acceptable now, and that's what I thought too, and then last year I went out with my friend and wore a new shirt for the first time, one of those that you can't really wear a bra with. Well we went into this restaurant and it was rather cold, and I have never been ogled so badly in my life. I felt so uncomfortable, I couldn't talk to anyone without them staring directly at my chest, not me. I made it just through the meal and then rushed home and changed. 

I wish I had the ""I don't care if people stare"" mentality, but I just don't, it makes me too uncomfortable, so for now I still wear at least a bralette to cover up a little bit more. I was so discouraged after that though, it was awful."
18,There was a case of this in the UK a while ago where a paramedic didn't administer first aid and/or shock the woman to 'protect her modesty' cause he didn't want to touch or expose her breasts. She died.
19,"I'm like a board with nipples, so as long as I'm wearing a thick top I'm good."
20,"To never ever take my health for granted. Exercise, eat your veggies, sleep enough, learn to manage stress. Stress can really ruin your health. If you don't have time to take care of yourself all the more reason to. Make time, no matter what.   
Work is always there to do, but your health may not always be there. And what will you do if your health runs out and you can't work anymore?"
21,Be more diligent about researching majors/fields of education in high school
22,"Small boobs. 

I love them, they love me. 

And I don't give a fuck, 
if they aren't your cup of tea."
23,You are the only common denominator in your own repeated problems.
24,"I send back explicit gay porn.

The response is always, ""WTF why would you send me that?!"""
25,Winter coats. Apparently I'm supposed to prefer looking cute over freezing to death. 
26,Certain pieces of gym equipment smash the hell out of my breasts and it's very uncomfortable.
27,"I frequently lay in bed and agonize over stupid shit I've done. 

Or I get too excited about fun things coming up that I can't sleep."
28,"I'm a pretty solitary person, but do get lonely sometimes  and it can be tough. Today I'm having a bit of a lonely day, Sundays can usually be tough as this is the day I have the most downtime and will think about it. I go on Reddit and talk to people, try to immerse myself in something that will make me not dwell on it like reading, go for a walk and listen to a podcast, or just get out of my place for a bit."
29,"My answer: stretch marks. They seem to be near-universally reviled, but I can confidently, honestly say mine don't bother me. 

I have them everywhere in varying degrees: arms, waist, hips, thighs...

I dunno. I feel like they tell a story. I just don't mind.

Some I even LIKE because they came about due to gained muscle tone."
30,"I've gone to home improvement stores many time to look for heavier-duty work gloves, like Mechanix. All of the gloves were men's, unless they were specifically gardening gloves. The smallest sizes were way too big for women with smaller hands. I guess we don't work with our hands? "
31,Sent a pic of my cat’s asshole back one time. Asked him if he liked my pussy. Never heard from him again. 
32,"We’re friendly, but not friends. I prefer to keep work and home lives separate."
33,"I don’t know about the general population but I’ve certainly seen a lot of youtubers and instagram posters (who are already young and beautiful) getting Botox, fillers and other cosmetic procedures. It seems like it is pretty much expected for them at this point. It’s disconcerting."
34,"Not necessarily an everyday object, but pretty significant: Western Labor and Delivery practices. 

The supine position—what genius thought that should be standard? Easier for the doctor, sure, but compresses everything that desperately needs to be open."
35,"I have trouble calling it rape because it barely affected me. Technically yes I was raped but i don’t feel like other rape victims, so I just kinda moved on. "
36,"I immerse myself in learning. A nice side-effect: As you become good in something, you inevitably begin to connect with other people who are also doing this ""something""."
37,"***MEDICINE*** 

&amp;#x200B;

Not including women in medical trials for decades has biased medicine, medical treatments, and outcomes against women. Even female complaints of pain are frequently overlooked by male doctors. We as a society are struggling to catch up to treating women effectively. 

&amp;#x200B;

Sources: 

 [https://endpoints.elysiumhealth.com/why-women-are-underrepresented-in-clinical-trials-398c9e0735a](https://endpoints.elysiumhealth.com/why-women-are-underrepresented-in-clinical-trials-398c9e0735a)   
 [https://orwh.od.nih.gov/toolkit/recruitment/history](https://orwh.od.nih.gov/toolkit/recruitment/history) "
38,Being pale. Lots of ways to temporary change it and now I just own it 
39,"Also, if you have to convince someone to be with you in the first place, you shouldn't be with them. You should both want each other mutually."
40,"""you must have confused me with someone who won't show this to everyone.""  

Oh he suddenly became very aware of boundaries and respect when it was about him. Didn't give a thought when it was about mine though....hmm..... (I didn't send it to everyone but it made him squirm and be uncomfortable and that is a valuable experience). "
41,I don't even feel like I qualify to post here because I *still* have trouble calling it rape or sexual assault.
42,"Cellulite.

I have it on my upper legs and butt. Couldn’t care less. "
43,"I have big boobs and my nipples get hard at the drop of a hat, so I only go out bra less if I’m in a baggy hoodie/sweatshirt, or if I’m wearing a bathing suit under my clothes to go to the beach or whatever."
44,"Well, an ex, but I still think of it fondly. I bought a shelf for my nail polish and hadn’t had time to hang it or organize them. Completely unprompted when I was gone one weekend, he hung the shelf and lined them up, organizing them by color. My love language is acts of service, and this just blew me away.

Unfortunately the good was few and far between... but that memory is still a nice one :) "
45,"How controlling people can be. If you feel like you have to watch every little thing you say because that person will dump you in a heartbeat just for disagreeing with them, that’s not your friend. That’s a thought police warden. Leave those people behind."
46,Exactly! There are some conservative fields like law in which many women are strongly discouraged from wearing pants in lieu of skirt suits - and one of the real examples someone mentioned here is a *courthouse*! 
47,uhhmmm.. are we not going to talk about pockets? 
48,"Guys will think you're a prude, easy, or stay interested whether you sleep with them or not. Make sure you make that decision for yourself, not what they could think of you."
49,"So I was in Trader Joes picking up a few things and it was the hottest part of the summer. I was wearing an Old Navy tank top -- the brand is important because if you've ever owned an Old Navy tank top, you'll know they are nearly transparent the fabric is so thin. I do not care. It's Sunday, I just need wine, and I am not putting on a bra to drive three miles to buy wine. 

Turns out, Trader Joes is the coldest place in Florida. It's colder than Macy's or AMC theaters. LOL. Still don't care, I'm at the checkout and the guy cashier says to me, ""It sure is cold in here."" And I said, ""Yep, I can't wait to get outside to thaw out."" And he chuckles and says no more. Just as I'm finishing my transaction, I realize what he is getting at. Both nips -- even the inverted one -- are standing at high attention because of course, you could hang meat inside a Trader Joes. Finally, I glance down at my chest, wink at him, and say, ""You're welcome. Have a great afternoon!"" And then I turn and flounce out of TJs like it's my job. 

I still think that story is hilarious."
50,Friendly at work but otherwise no. It's like at work we can talk about anything. But once we're outside of work they can only talk about work. I hate that place. Please do not bring it up on my free time. I hate staff parties and anything where there will be too many of my coworkers.
51,"Hip Dips! I'm seeing an increasing number of fitspos recommending exercises to get rid of hip dips, despite the fact that it's a physiology issue that can't be fixed!

I quite like mine :)"
52,I’ve never done this but one of my favorites is to freak out and ask why they send you a child’s penis. 
53,"my boobs are way too big for that. even when i was smaller chested i wore some kind of undergarment just to protect the nipples from chafing

idc what other people do"
54,There are studies showing offices are generally kept at temperatures that are comfortable for men but cold for women.
55,"If someone tries to leave, let them."
56,The ballistic or bullet proof vests the military uses do not keep breasts and wider hips in mind for women so they are extremely uncomfortable and don’t fit safely in my opinion. 
57,"Arm hair.  Unlike other types of body hair, arm hair is so soft and unproblematic.  Why complicate things with trying to remove it?"
58,"Artificial hearts were only able to be used in men (and some models still say they fit all men and like 50% of women) because they were too big to fit in women’s chests 

The original designs were made with pretty much only men in mind 
"
59,"I have difficulty calling it rape because it started out consensual. And while it very quickly turned into me saying no and him doing stuff anyways (followed by violence and not letting me leave), I have a hard time. Nor did it necessarily affect me. I have moments, but nothing debilitating. 


I also kinda just went along with everything he did, as a means of self preservation. So in my head, because I wasn’t resisting, I can’t really wrap my head around the victim mentally"
60,"I don't care if other people do it, but I won't. My clothing fits better when I wear the expected undergarments, and I wear a large enough cup size that wandering around without a bra is uncomfortable."
61,"I've never read anything more true than something to this effect: ""A relationship isn't always 50/50. Sometimes you feel like a 20, so your partner should pull 80. Sometimes your partner feels 20 and then it's your turn to pull 80."" Something like that.

There's something special about hearing each other and understanding each other. I had a long, busy day yesterday, and my fiance made dinner, did the chores, cleaned up. I didn't even ask him. I didn't even say thank you until this morning when I realized, and I just told him how much I appreciate him. He heard me and responded in such a caring way. I try my best to do the same."
62,"I'm gonna say shaving supplies. All the ""women's"" razors are designed for fine/thin/easy body hair and leaves us ladies with thick/tough hair frustrated. I use the women's Schick Quattro which has 4 blades and while it works, I can feel it struggling to cut the hair.  

I also have sensitive skin and all the women's shaving creams I've tried irritated it. I switched to the Nivea Men Sensitive Shaving Gel and it made a complete difference."
63,"Ugh and I hate ""women's"" graphic tees. They are essentially lower quality fabric (ie: see through) with those stupid baby doll sleeves. Just give me a normal tshirt."
64,Marriage is one of the decisions I’ve made that I’m most happy about. Been married just over 6 years now and although a lot has happened during that time I love my husband now more than I did when we first said “I do”. Our wedding was wonderful but the best part has been our relationship growing as we’ve navigated through life together.
65,i make up stories in my head with people that don't exist and i create worlds and situations and challenges for those characters and i can easily do that for 5 hours straight non stop
66,I’m a huge nerd and I like wearing nerdy shirts. The problem is I’m a DD so any shirt I wear the pattern is stretched unless it’s for women. But all the woman’s shorts don’t have any shounen (manga/anime targeted to men) characters and just the female characters. Not that I don’t like the female characters but usually the boy characters are written better and more likable. 
67,I know a woman who gave birth on all fours and a woman who did it squatting. They had different docs and were suggested to do that by both docs (both male) after having difficulty on their backs. Hopefully this means that they’re moving away from the standard position.
68,Seat-belts.  The inventor of the seat belt is an asshole.  They never accounted for breasts.  So uncomfortable. 
69,What. The. Actual. FUCK. 
70,Your pants have pockets??
71,"Well at least she died with her modesty in tact! Priorities. /s

That is so messed up and sad. "
72,"I felt like that recently when I went to the grocery store braless. It wasn't the nips, I had a thick t-shirt on, it was the jiggling. But the stares were excruciating."
73,There are still judges in this country who will chastise a woman lawyer for wearing pants in their courtroom. Not to mention the school dress codes that require girls’ uniforms be skirt-only
74,Medication
75,Urine specimen tubes at the doctor's. It's so hard trying to aim whilst you're sitting and not piss all over your hand at the same time. They were definitely designed for men.
76,"I like being married to the person I am married to.  You don't marry ""marriage"".    


Marriage is not a one size fits all institution.  Marriages are as unique as the two people who enter into them.  Your marriage does not have to follow a pattern or fit into anyone else's definition of marriage.  It is like water...it takes on the shape of the container you give it and your container is up to you.  


It's important you understand the legal rights and obligations you enter into....because those practical applications do have an effect on love.  


A marriage may start with a wedding but a wedding is not the marriage.  You do not need any expense to start a marriage.  If being married to the right person meant wearing burlap and saying ""I do"" in a pig barn, you'd be glad to do it.  The right wedding doesn't validate love or marriage."
77,Some I can't even adjust for my height :( It's like they don't think short people want to use machines too!
78,"Making sure I hang/fold/put away my clothes fast enough after washing, so they avoid wrinkles. 

Finding the right shade of lipstick or gloss. 

Learning a few quick easy hairstyles on YouTube."
79,Somehow it's been decided that women can only appear dressed up if they are wearing torture devices on their feet.
80,"holy shit you're right, we only work on male dummies."
81,"Listen to your gut, the little voice nagging you that you don't want to listen to. Most of the time that instinct is going to lead you to the correct place and avoid hardships."
82,I honestly wish I'd taken a gap year or something instead of jumping right in.
83,"Here are some things my s/o does that I greatly appreciate:

* Cleaning and tidying up without being asked
* Does roughly half of the cooking
* Rubs my butt while I fall asleep
* Hangs out with me in the shower 
* Lets me peep on him when he showers (it's cuter than it sounds, I promise)
* Brings my coffee/tea to me in bed when I'm having trouble getting up
* Whenever I forget something in the car, he jumps up to get it
* Gives me little shoulder rubs when I seem tense
* Waits on me hand and foot when I'm sick or having a bad period
* Puts his phone calls on speaker if he's talking to someone funny so I don't miss any jokes"
84,"Bathroom stalls that must be designed by men,  where you have to straddle the toilet just to close the stall door.  Double whammy when there is no hook in the stall to hang your purse on. "
85,"My office uses magnetic nametags, which I love."
86,"I definitely feel weird doing it unless I'm in a ton of layers. I might run out on a quick errand bra-less in a sweatshirt, but that's about it.

Don't care if other people do, though. Wear (or don't wear) what makes you comfortable."
87,"It feels like most tools aren't designed for women. I'm hardly queen of DIY, but when something breaks I like to try fixing it myself if it seems relatively simple, it helps me learn. But trying to use like my ratchet set or screwdriver is difficult, because the handles are just thick enough to make them uncomfortable to use. And forget my drill, I pretty much have to hold that in two hands to feel safe with it.

And then when you look at the \~for ladies\~ delicate prissy baby pink tool sets, they're all flimsy nonsense that fall apart after half a use. "
88,"My sister was once flashed. Her smart comeback that made the creep run away?

“Oh, poor boy!  It’s deformed!”"
89,"I did. It was my then-boyfriend, it wasn’t violent, and I didn’t verbally say no even though I obviously did not want to (I kept saying no every other time he wanted to have sex and this time he essentially stood by the door saying I had to have sex with him because I was his gf). So I let him got on top of me and I just laid there crying. I still have a hard time calling it that even though two previous therapists have told me it was. I mean, it was, I just can’t get myself to say it because I think people would think I’m lying or that it was my fault because I technically didn’t say “no.”"
90,"Basic office furniture. Unless you have adjustable ergonomic equipment to supplement it, desks are generally too high, which cause the keyboard and mouse to be too high and there for you'll probably make your chair higher than it should be to reach it, etc."
91,Send them random penis pics back that I find on the net
92,"When I was in EMT school we were lucky enough to have an instructor that brought his super pregnant wife in on various occasions to practice stuff on. All the guys got really flustered and our instructor would just say, “Yup, those are breasts, as discussed in the anatomy unit” and we were able to learn finding intercostal spaces etc on a pregnant woman. "
