,text
270,"We were both super young and self-centered (we met in Junior high.) 

I think I idealized the friendship tbh and made it out to be more than it was. I struggled to keep connections growing up (a combination of social awkwardness and a lack of ambition during puberty made it hard for me to keep a conversation going) so when I became friends with her I really latched onto the friendship and tried everything I could to please her and hype her up so she wouldn’t get “bored” of me. 

Thinking back on it now though, she doted on me (And vice versa) and we were inseparable for a good portion of our friendship but while I was overly open with her in a bid to never have any sort of misunderstanding (Cringe I know 😭) she often would withhold things from me (small little things) that weren’t supposed to mean anything but ended up snowballing. 

There were a ton of warning signs on both of parts. I was becoming increasingly emotional at every slight against me on her part and she stopped talking to me about any serious subjects (relationships, health, family) or would lie instead of just telling me she didn’t want to talk about it. She stopped inviting me out places and went with her other friends instead but would only hang out with me while at school etc. 

During our freshmen year of college I finally dropped her as a friend. 

She had asked me what I wanted to do for my birthday about two months in advance and I told her exactly what I wanted to do- to go and see my favorite artist in concert. On my birthday two months later she posted an Insta pic of herself with one of her friends AT said concert that she had never mentioned getting tickets to. 

She’d forgotten my birthday as well. 

It just made me realize that we weren’t in a place where our friendship made either of us happy. I feel bad for ghosting her because she tried to reach me quite a few times (which surprised me) but I always felt it was moreso the idea that she never figured I would end the friendship (she was very obviously my only close friend at the time while she had several other friends.)"
271,"It sure would be nice if that's how things worked. It would have saved me a lot of stress in my early 20s as I discovered that you go through toilet paper a lot faster when you're the one paying for it and what do you mean I can't play WoW for 10 hours a day anymore that's bullshit!

And then I bought a house last year and at 37 I feel like I'm entering a brand new stage of Adult. like I leveled up because now there's no landlord to call if something breaks. Now I have to call. I've learned how to do some very minor plumbing stuff though in the last year! So that's been cool."
272,She conspired with my husband to leave their spouses so they could be together.
273,If you’re paying god no.
274,"I'm 36 and I met my current best friends when I was 32-33! Friendships morph and change over time, but my core community has been around for four years or so. I'm so so grateful, because these are some of the best people I've ever met.  They accept me just as I am and love me for me. And I love them for them. It's beautiful."
275,[removed]
276,"Met my primary best friend at 16. We had a falling out for 2 years around 26-28 but became even better friends again. My second best friend I met when I was 26, worked together for years and our relationship really blossomed moreso after we stopped working together. There’s hope. I think it’s all circumstantial, then the ones that are really good stick around or find a way to persist beyond convenience."
277,"It's not important to me. Although I think having kids with someone with my eye color would be cool. Mine are hazel but mostly green, and I love all eye colors. Mostly green and hazel though."
278,"Let's Rock, mmh, i've been loving it. But i'm a huge fan of them anyways..
Tranquility Base Hotel and Casino, takes me places and i love being taken.
Atom Heart Mother will forever be my favorite trip away from reality, in a way."
279,"I don’t put myself out there to meet people.  Social anxiety, low confidence, still getting over someone."
280,Thank you!
281,Feeling guilty about my feelings
282,"The day I came home from class in mid-afternoon and just sat in my living room, unable to will myself to do anything, not even turn on the light once the sun went down."
283,"A guy I knew that worked at a bar I would go to regularly.  At the time just a friend. I was thinking one night stand let’s get this shit over with. ( I was 22).  

It turned into a 7 year involvement. 🙄"
284,17
285,[removed]
286,Doing things that increased my self esteem.
287,No.  All my life I wanted to be a mother.
288,why would it be different?
289,"He's chronically late (showed up almost an hour late to our first date.) I am compulsively early (was there twenty minutes early, and waited.) (Turned out to be totally worth it and it was pretty much love at first sight, but we still joke about it occasionally.) We have yet to really find a middle ground, but tbh most things he does don't bother me the way they do when other people do them. And even when they do, I have never found it as easy to forgive anyone as I do him. But it does lowkey drive me insane that he is never anywhere on time."
290,"This post has been removed for specifying a majority demographic. Posts for this sub should use [inclusive phrasing](https://www.reddit.com/r/AskWomen/wiki/inclusivephrasing).



Questions that explicitly request responses from a major majority demographic will be removed (eg “straight women” “White women”)

&gt;Majority demographics include but may not be limited to:

&gt;* Caucasian/white people
&gt;* Heterosexual people
&gt;* Cisgender People
&gt;* Americans (while not the majority in the world, they are by far on Reddit)
&gt;* 20-30 year olds

&gt;It's okay to ask in the body of your post that people specify their location/age/sexuality/gender etc (which they can opt not to provide). However specifying that you're only looking for/interested in a particular majority demographic would be grounds for removal.

&gt;You're welcome to ask questions explicitly aimed at minority demographics - there's value in the specific discussion of their opinions and experiences.

If you have any questions about this moderation action, please message the moderators through the link on the sidebar or [here](https://reddit.com/message/compose?to=/r/AskWomen). If you are messaging about your removed comment or post, please include a link to the removed content for review."
291,"I notice I poop more during my period. It doesn’t really feel different it’s just more stuff to clean up down there.  Blood, piss, shit... it’s a bit of a pain in the ass cleaning yourself up.  You feel yucky, want to keep taking a shower."
292,"Usually weekly. My hair hair is naturally curly and I have always hated it.  I’ve been straightening it regularly since I was 17 and I’m 31 now. 

In the summer less because there’s no point in straightening it the heat and humidity will just curl it back up as soon as I go outside.  So most of the time I’m just wearing it in a bun.  I protect it as best I can but it’s definitely damaged. Thinned out a lot and doesn’t grow past a certain length.  

I always wanted to just be able to wash my hair or get it wet and let it dry straight and long.    But no that’ll never happen."
293,"I think it’s stupid.  It’s always been the 31st and people have found ways to make it work as far as their parents have to rush, “too stressful” reasoning.   They also want to make it during the day which I think is dumb because it takes away the spookiness &amp; scary fun of it. 
I think they’re being way too uptight about it.  

Unfortunately though not many people seem to be as enthusiastic about Halloween anymore and do close up earlier and earlier. With less and less people participating.  It’s sad to me I love Halloween it’s always been my favorite holiday.  When I was a kid the streets were full of kids, almost every house giving... you could fill bag after bag up.   It’s so not the same anymore."
294,"The first year or two of the baby vortex can fuck you up. You are in survival mode. Once you get your groove back, take time to care for yourself and listen to loud music in the car with f words on your way to do something alone.  When your kid(s) are able to go to school, especially full day elementary, you are living life instead of surviving. Also, something happens at some point where you become entirely confident in your ability to parent and you no longer compare or explain yourself to others."
295,"Love is when you see something funny and immediately want to tell them. Love is when you smile when you think of them. Love is when you fight with each other but still make up because you love each other.

Loving attention is when you don’t *really* care what they’re up to. You just ask because you’re supposed to, not because you genuinely care. When you can’t be bothered having to listen to them whine. When you wouldn’t be there for them on their bad days."
296,"I had a few different episodes of what I call ""spiraling,"" like uncontrollable crying for hours into the night. It had nothing to do with my fiance, but nothing he said or did helped. After a few episodes of that over the span of a couple of weeks, and realizing how lonely and unhappy I felt, I realized I really needed help."
297,The anxious attachment style can lead a smart person to believe someone could be more than they are. Learning to not love someone for who we think they could be but for who they really are is really difficult. It’s easy to look back in hindsight and see those realities are wildly different but to preempt it is a skill.
298,Yep. This exactly.
299,"Your submission has been removed:

It means she didn't want the rest of her ramen and you ate her leftovers.

**[Have questions about this moderator action? CLICK HERE!](http://www.reddit.com/message/compose/?to=/r/AskWomen&amp;subject=Why+was+this+removed?&amp;message=\[My+submission\]\(https://old.reddit.com/r/AskWomen/comments/ckj1zi/-/\)+was+removed+and+I+do+not+understand+the+reason+given+by+the+mod+who+acted upon+it.)**

If you are messaging about your removed comment or post, **please include a link** to the removed content for review.   


[AskWomen rules](http://www.reddit.com/r/askwomen/w/rules) | [AskWomen FAQ](http://www.reddit.com/r/askwomen/w/index)  
[reddit rules](http://www.reddit.com/rules/) | [reddiquette](http://www.reddit.com/wiki/reddiquette)"
300,"When I was on apps, I didn’t use it for casual sex but I didn’t specify on my bio what I was looking for. When I did match with someone, we would normally express what we were looking for before even meeting."
301,"Really enjoying devacurl wavemaker right now. You just run a quarter size amount through soaking wet hair and scrunch up to your head, then get a towel and scrunch it in more. Then air dry. Gives me great results for sexy beach hair"
302,"Hello the-boy-67826286. Thank you for participating in /r/AskWomen. However, your submission has been removed, because we do not allow personal advice or evaluation submissions. 

You can always go to /r/askwomenadvice, /r/relationships for romantic/non-romantic relationship advice, /r/legaladvice for legal advice, /r/femalefashionadvice for fashion advice, /r/skincareaddiction for skin care advice, or /r/findareddit if you dont know where else to go.  Please remember to read the rules of any subreddit you go to.  

If you think you received this message in error, please [message the moderators (CLICK HERE)](http://www.reddit.com/message/compose?to=%2Fr%2FAskWomen&amp;subject=""My post was removed for personal advice""&amp;message=). Thanks.

*I am a bot, and this action was performed automatically. Please [contact the moderators of this subreddit](/message/compose/?to=/r/AskWomen) if you have any questions or concerns.*"
303,"2 months after flirting, 1 month after the first date, same day we made it official. No sex, just cuddles"
304,"I had to accept that I was a big reason why my life didn't turn out how I wanted to. Messing around and just dropping classes because I didn't feel like taking them is why I had to take a break from school and why at 27, I still don't have my degree (but am now currently working on it). Once I realized that I was the thing standing in my way, it was easier to accept even if I didn't like to hear it."
305,"I’m 23 and I don’t know which, if any, of my friends I would consider my “best friend”. 

Most of my closest friends I met through university between the ages of 17 and 22. 

The friend I likely spend the most time with I met at work two years ago."
306,"Having someone that's considerate of me and our lives. This has been a struggle lately because I don't feel my husband is very considerate. I literally would be so happy if he just didn't make things harder for me (ex. washing out a glass that had milk so at least when I wash it it's not crusted on) which I feel is asking so little. Adding onto that, actions speak soooo much louder than words. You can say you love me 50x a day but if you're not showing it in your actions it's meaningless."
307,"We were 9 or 10 when we met.

Started dating at 16."
308,Heartburn!!  Bah. It reared it's ugly head right around the 4 week mark and never went away.
309,"Hotel shampoo, hotel conditioner, hotel body wash"
310,[removed]
311,So... no tips on the subject of my post? Thanks anyway.
312,"the definition of feminine is subjective so i dont think there is a true image of a ""feminine woman"" :)"
313,"I don't drink anymore, but if I wanted cheap beer I only had to go as far as the Red, White, and Blue. (My father preferred Schlitz, though I don't know if they make that anymore.)"
314,"When we broke up and he told me that he only tolerated many of my personality traits and truly saw the absolute worst in me. Automatically assumed I did things for malicious reasons rather than by accident/unknowingly for years without ever talking to me about it. Hard to learn that someone you love and thought loved you actually thought you were an ugly person.

Right now we're still talking, but it's hard to be friends with someone who only looks for the bad in you (and makes some up) and has for years. 

Sorry for venting!!"
315,Learned when I was 7 or 8 because it was part of my ensemble for horseback riding competitions --- lol
316,"Please don’t give up. I don’t know you. I don’t know what you’ve been through, but discomfort is only ever temporary. Please hang on now to feel better later. It’s there."
317,Have you met someone new yet?
318,Irish Death...its a dark ale and it is delicious.
319,He farts all the time on purpose. After 15 years together I’m pretty tired of it. That’s it though. Nothing else bothers me about him.
320,ever thought of getting back out there?
321,"4, 24 &amp; 48"
322,"31,   Survive."
323,"Going without, like adapting in situations where you don’t have everything you need.  

Having to push through some sort of adversity every step of the way."
324,"Middle school was really bad.  I went through a lot... death of a loved one, struggled with severe emotional and mental problems. Was expelled from 2 schools.  Going to a total of 4 in 3 years.. bad times.   Never did go to highschool but I can just imagine how horrible that would have been given my mental state, home life and school I would have been attending."
325,"He eats like a slob. He used to lick plates when he was done with them (thankfully that seems to have stopped) and when he eats he just makes a mess all over his mouth and clothes. It's off putting. He says it's because he has a small mouth, but I think he just needs to take smaller bites and slow down.

Other than that, he's great!"
326,Bold of you to assume I have one.
327,"I have been in two long distance relationships. The first one was with someone who didn't think we would ever meet up (and never bothered to tell me that), so we were stuck from the beginning. I was more of a giver and he was more of a taker and it never evolved past that. I was really inexperienced in relationships at that point, but I like what I learned from it because it helped me with my second long distance relationship.

My current situation turned out great. I met my husband on reddit and we just didn't stop talking. It was a long two years of us being long distance with only two visits, but now he is sleeping next to me, snoring, right now. It worked out. We broke up once (to answer the question) because the distance sucked, but we got back together. I am so glad we did."
328,By knowing that it may not have turned out how I wanted and unexpected things may have happened but the options for what it can be are endless and lead me to figure out what I want and to take little steps and focus on one thing at a time to get to where I want it to be.
329,"Thank you for posting this question and all the responses.  Been feeling out of it for a while now that it has affected my job,  husband,  and relationships.  I have a few days in September where I will take a self holiday to get my shit together.  I rarely get alone time and so much has changed,  I can't keep up and feel pretty lost. I can't even fit in therapy, but I like the idea of journaling.  That I can do at night when the kids are asleep and I can have that little time before I have to sleep and get up so damn early to start all over again."
330,I'm approaching the point of wanting to look younger
331,Either at the age of like 7 or 17/18. I have bfs who I've known forever or bffs I've made in college. Anyone in between is nonexistent in my life now.
332,"as a member of the scrub team, i gotta admit that's a tricky one. still tho, it could have been made gender neutral by asking about sudden violent diarrhea."
333,"All reasons are valid, real reasons.  Trust that your partner is being honest with you and don't nit pick their reasons.  No excuses or reasons are even really needed-- ""I don't want to"" is a perfectly good reason.  You aren't entitled to their body."
334,"Your submission has been removed:

Common questions can be answered via search bar or FAQ ( /r/askwomen/w/index ).



**[Have questions about this moderator action? CLICK HERE!](http://www.reddit.com/message/compose/?to=/r/AskWomen&amp;subject=Why+was+this+removed?&amp;message=\[My+submission\]\(https://www.reddit.com/r/AskWomen/comments/ckotww/-/\)+was+removed+and+I+do+not+understand+the+reason+given+by+the+mod+who+acted upon+it.)**

If you are messaging about your removed comment or post, **please include a link** to the removed content for review.   


[AskWomen rules](http://www.reddit.com/r/askwomen/w/rules) | [AskWomen FAQ](http://www.reddit.com/r/askwomen/w/index)  
[reddit rules](http://www.reddit.com/rules/) | [reddiquette](http://www.reddit.com/wiki/reddiquette)"
335,"My best friend of 3 years was absolutely phenomenal, she let me vent about my husband and children, she was always there when I needed help and even ordered pizza delivery for me often so I could catch a break -she was seriously the best and I tried to return the favor when I could by making her things she used for her psoriasis, researching natural things to help with that and her other health conditions and she always appreciated that and my children loved her and she was also close to my husband and was a great female friend to him   


Then... she found a guy who was interested in her and I had some reservations about him because of some home issues and I expressed my concerns but also really wanted to meet him to see him for myself because you can only learn so much about someone online and our first online experience was bad (I asked if he would like to borrow a book about toxic parents as my bestie had an extremely toxic mother) and he responded with ""F you... it's not your place to offer books to me"" -a huge red flag but thats why I wanted to see him in person so he could not hide behind the computer   


Well, everytime I was in the area (two hours from me) they always had an excuse as to why we can't meet... then bestie blows off my husband when he asked if she wanted to come celebrate his birthday with us and she said sure... she will let us know when we can pick her up and there was never a response, so the husband asked her what happened and she acted like she never got the message and I did not know this had all happened so I was hearing two different stories until husband showed me the screenshot of the conversation   


So I confronted her, basically telling her she and my husband need to sit and talk this out and I really miss spending time with her - she responded by blocking me and ghosting me on all social media and blocking my phone and when I asked our mutual friend what happened, I was told ""You need to ask people permission before you say things like that""   


I was crushed, hurt, embarrassed and I just can't understand why this happened   


I hope the ""bestie"" has dry boring sex with her boyfriend for the rest of their relationship"
336,if we're tired or sick when not wearing makeup.
337,"I don't want to, which is super related to hormones and where I am in my cycle. My desire isn't a constant thing like it seems to be in a lot of men. 

He's asking me for sex every damn day. It's never happened, so why would you think it's going to start?

He's being a cranky a-hole, then expecting me to want to have sex with him. 

He's picking apart my sexual enthusiasm."
338,"I’m not even sure I finished the book in high school (which was like 7 years ago for me), but this quote has stood the rest of time in my memory because I find it simple yet profound. It hints at the harsh realities of sexism in our world.

Honestly, as a child, more often told I was smart than pretty, I often longed to be prettier instead of smarter (or smart at all). As a woman, I sometimes still feel this way if I’m being real.

I usually feel this way after a confrontation with sexism and racism as a black woman in th"
339,Someone once told me life isn’t all cupcakes and fairytales. I don’t accept that. I’m a writer with an aspiration to make that my career one day and I also would love to open a bakery that focuses on cupcakes and donuts
340,"Assuming he knows how to wash properly, I don’t care."
341,"It began with selecting from the few styles of clothing that fit my body type and then I've generally preferred darker colors as well so that's about all there is to my ""style"""
342,Damn y'all all out here with these brand name scents meanwhile I just buy whatever bottle of white musk I can find
343,Still worried about it. I lost my body and my career too.
344,"Deleted my Twitter four months ago. It was just so toxic on there and I was starting to inhabit traits I don't like. I rejoined recently but feel weird about it, but I'm in a new mindset/don't follow the people I do now."
345,Because they're super cute and usually very comfortable
346,"Bleach, Thieves, Gloves, paper towels, sponge with scratch pad, window cleaner, microfiber cloth, disposable toilet brush pads, my vacuum, my Swiffer, and on occasion, magic eraser."
347,"First baby: Shooting pains down one leg?!  Completely flummoxed my GP until I took a test later that week. 

Second baby:  I just KNEW.  I tried to figure out what I was feeling that would subconsciously tell me I was pregnant, but I could never figure it out.  Took a test and I was right.  (I've never had that feeling of knowing before or since.  Even when my period was late and I would start freaking out, this was completely unique.)"
348,Aww thanks! 😊
349,"About a month. We didn't have sex for about another month but we slept over with each other around 3 says a week, every week."
350,Miller Lite.
351,"It's about 4x a week. He also works a swing shift (3-11) and likes to spend most of his day during the late hours. I also work a similar schedule and get it, but I can only pull 2am or 3am. We've talked about it and definitely are working to get him in bed a little sooner than sunrise lol."
352,"This comment or post has been removed for containing gendered slurs that do not meet the [gendered slurs guidelines](https://www.reddit.com/r/askwomen/w/genderedslurs) for /r/AskWomen. If you edit to meet these guidelines, please let us know and your item can be reviewed for reinstatement.

Gendered slurs are not permitted unless they are part of a quote, being used in a discussion of the term itself, to refer to the actual body part referenced, or as part of a specific set of irreplaceable common terms. For more detail, review the linked guidelines.

If you have any questions about this moderation action, please message the moderators through the link on the sidebar or [here](https://reddit.com/message/compose?to=/r/AskWomen). If you are messaging about your removed comment or post, please include a link to the removed content for review."
353,"Damn. I'm sorry. The machine does suck, but it helps so much. DH can't sleep without it now, plus the overall health benefits are worth the annoyance.   
I hope yours changes his mind soon- for your sake and his."
354,Can you share what was violated? What if a question is for specific women? Seems a bit of a PC rule? If i want ask gay women a question that cant be asked?
355,Yes
356,I couldn’t care less about eye color.
357,29
358,"I have 3 friends I consider “best” for different reasons. One I’ve known since 2nd grade, one I met at a high school prep class I took before Freshman year and the other I met 3 years ago when I started my current job."
359,"I have been trying to self direct by just being more mindful but it slips away sometimes, reading self help books and finding new ways to practice on this is a great idea. 

Do you have any book suggestions?"
