,text
183,"Me and my best Friend (we slept together for about 4/5 months) she has a BF now) always seem to fight over the smallest things and when we do start talking about our feelings we always think the person venting them self out is trying to start an argument. 
I have no idea why this happens or why we do it, it happened before we slept together and we blamed it on caring so much about each other.
I want to say there's still something relationship wise, but that's more down to I want there to be something"
184,Very sensitive sense of smell!  I walked into a GameStop and had to run out from the overwhelming smell of teenage boy!
185,I don't think about it
186,"Sore boobs were the first clue, they don’t get sore during my period. Then food aversions, I wasn’t nauseous but everything was disgusting to me. Then bone deep, all-consuming exhaustion. And just a gut feeling that’s hard to describe— I took a test before I even missed my period because I just knew."
187,"Not important enough to make a decision based on it.

It's more of an interesting factoid"
188,"Most of them, if not all.  I feel like they all have their place and positive applications.

For example, social media gets a bad rap for many good reasons, but it's a fantastic way to keep in touch with people you would otherwise lose contact with.  Along those same lines: carrying around decent cameras in our mobile devices.  Some people overdo it, but it's amazing we're able to catalog so much about our lives, from our specific appearance one day to once-in-a-lifetime events."
189,"Probably not the kind of intimate you were going for, but...

Sharing fears and anxieties, being completely vulnerable with the other person."
190,"Yes. You broke the rules, you get called on it. 


Follow them or don’t post here."
191,"Didn't really have a honeymoon, just a vacation a few months after we got married.  I don't recall how much sex we had on that trip.  We average once per day on vacations with a day or two off throughout."
192,"My ex came out as gay after 5 years. 

That took a minute to sink in. Relationship was great and he doesnt hate me and we are still good friends but it definitely sucks. Its given me freedom to come and go as I please and allowed me to learn some things about myself. I dont find it embarrassing because it is what it is. I'm just grateful we didn't get married before he figured things out. 

People would probably say I should be embarrassed but I cant change things I can't control and there is no reason to get bent out of shape over it."
193,"Bold enough to be shamed for? 

A sentence can be reconfigured to fit someone’s story. Just as men follow askwomen and can share their story and change up the pronoun to fit their life. Whether it’s man finds the one with man or woman to woman."
194,I got the Pacifica Hawaiian Rose Guava and it smells amazing. And you use so little of it! I bought my bottle months ago and it’s still 9/10 full.
195,Pantyhose is the literal worst.  Tights/leggings are alright and pretty much a necessity around here during winter.
196,"I don't really wear them, haven't worn any in years. I much prefer bare legs"
197,"The fever thing is weird. My bf smells so sweet when he’s sick, I wonder if there’s a biological reason for it."
198,Your submission has been removed because:  Common questions can be answered via search bar or FAQ ( /r/askwomen/w/index ).   **[Have questions about this moderator action? CLICK HERE!](http://www.reddit.com/message/compose/?to=/r/AskWomen&amp;subject=Why+was+this+removed?&amp;message=\[My+submission\]\(https://old.reddit.com/r/AskWomen/comments/9xnjse/-/\)+was+removed+and+I+do+not+understand+the+reason+given+by+the+mod+who+acted upon+it.)**       [AskWomen rules](/r/askwomen/w/rules) | [AskWomen FAQ](/r/askwomen/w/index)   [reddit rules](http://www.reddit.com/rules/) | [reddiquette](http://www.reddit.com/wiki/reddiquette)
199,Was passing out.  Thought I had the flu. Then morning sickness while commuting by train.   Not a good mix.   Sore breasts.
200,Leave. No one is worth putting up with that.
201,"When you describe them to others, what words do you use? 

Are the descriptions about what they do for you (good listener, thoughtful, good cook) or are they descriptions of characteristics that don’t benefit you (creative, intelligent, hardworking)?"
202,"Corona with lime baby 

Or a pbr"
203,"Tights aren't gender specific in the way that our underwear and bras are, and the only meaningful difference between pantyhose and tights is the hose has the gusset so we don't have to wear underwear under them.

By all means your welcome to try them."
204,"I was in my early 30's. We'd been together 10 years. He went down on me unexpectedly. He'd tried to do that when we first started dating and I'd stopped him because it was uncomfortable. Those first 10 years, taking care of myself while he ""helped"" was part of our foreplay. After that, oral happened almost every time. Game changer."
205,"When you're willing to make sacrifices just to make their life a little bit better, that's when you love them."
206,It's really not important.
207,"Son of a bitch slept w my gf, gave me an std"
208,"Star Trek, because I can already talk about it for hours if I get the chance, so one hour is a walk in the park"
209,I was ravenously hungry all the time. I could eat a massive meal and be absolutely starving an hour later. I was insatiable. I was also exhausted all the time.
210,Mine is similar. I rarely blow dry and once in a blue moon use a flat iron (to deal with frizz or a dress up thing). Curls never last and def feel you on styles. Keratin treatments and similar things sound nice in theory for flyaways but don't have the volume of hair for it. Oh well. Have changed some products and am growing it out again; we'll see.
211,I don’t think I know this song.
212,"Sometimes things turn out better than you realized. Imagine if you had that life you wish you had. Knowing what you know now, how has your current life been affected. For example, if you didn’t land your dream job but you found a different job, it’s possible you met one of your closest friends there, which wouldn’t have happened if you got your dream job"
213,Miller Lite now and forever
214,It becomes more about them and less about you.
215,Me neither! I put all the remixes as well
216,Anything by John Gottman.
217,"Exactly! I hope you can find happy companionship after this, whether it be near or far! This internet stranger is rooting for you :) And I hope you realize the good that can come of putting your all into love."
218,23 - is that normal or late? I was 18 when I first started having sex with this partner but after we got married and moved in together I guess we have had more time to make sex even better.
219,"Planning a future ahead that includes some aspects of what I wasn't able to do before, but at the same time concentrating on something new. Get a new dream and follow it."
220,I think there is a reason it's popular with children
221,"Pregnancy #1: sore boobs that lasted longer than a week, then ravenous hunger

Pregnancy #2: ravenous hunger, then feeling tired and needing a nap every afternoon"
222,"BIGGEST FEAR. but. What id tell myself. Growth. It comes when your at your lowest. Or when you stop to take a break at the boulder on the hike. Get it? YOU ONLY GO UP. PROCCESSS. YOUR. EMOTIONS. Give your all everyday. Stop letting people prevent you from being fully happy. If anything you giving your all and them saying that you arent what they want. Means. LISTEN CAREFULLY YO. This isn't like any situation. Its love. Its lust. When they say you arent the one! YOU DID WELL JUST NOT FOR THAT PERSON. Guess what. You can trust other people. So  I WILL YELL THIS FOR THE BITCHES IN THE BACK. Dont not give your all. Someone one day will give it back. Thats their test to handle all of it vs just some shitty person tryna actually work for the same shit. 

Love you. And i hope you feel better"
223,"Flag things, check all emails, schedule time for myself to complete tasks, keep a to do list when anything out of my ordinary tasks comes up"
224,Oh my gosh this is me. I have a new partner and things are going great and I’m just SO worried about seeming perfect. I don’t want things to end and I know that if I let down my guard he wouldn’t stay around. Who would?
225,I'm curious how old he is and why he's dating someone 8 years younger. Is this the reason why he isn't dating someone closer to his age?
226,"Not important. I think blue eyes can be striking, but I like all colors."
227,Sometimes what you want isn’t what you need.
228,"I don't like the original. I LOVE the remix with just Billy Ray. The recent remix that came out with Young Thug and Mason Ramsey, I'm not totally into it, but the line ""if you ain't got no giddy up then giddy out my way"" is fantastic and I will love it forever."
229,&lt;3
230,"We go on 2 7 day trips a year one to the beach and one to either a city or a mountain location. I take a medium suitcase and a canvas overnight bag. The suitcase holds my clothes. Overnight bag holds shoes and hygiene bag. I also carry my purse. 

The canvas overnight bag then doubles as a bag to take to the beach, snack bag (I have 3 kids), holds everyone's jackets, etc. during the trip. 

Clothes are folded shirts are stacked together and bottoms are stacked together. Swimsuits and undergarments go in the netted area."
231,"Put it on my latest Spotify playlist, and I ain’t sorry bout that."
232,"I was 16, almost 17 years old (my first and only partner, still with him today)"
233,"Try not to feel bad that you feel. Feelings are important and help guide you to better clarity, in this case, the type of parnership you want. Acknowledge that feeling embarassed is you paying attention to your guidance system. The feeling will then naturally move on and you can get back to the matter at hand. Repeat as necessary. If you use it, your guidance system will keep working perfectly. Good luck!"
234,"Communicating them at all. My current partner has worn my trust down and made me feel like I'm crazy for having feelings at all. I can't tell you how many times I've heard ""But I'm a guy, we just can't help [thirsting after girls on Instagram]"" / ""I really don't think your feelings are valid"" / ""You're just overthinking things"" / ""You need to relax"" / ""I think you take your job too seriously [therefore I'm not sorry about telling other people work things that you told me to keep private]"". I pretty much don't tell him anything anymore and I have gotten pretty resentful."
235,What do you think of the fourth remix with RM from BTS?
236,"Waistlines.  As I was growing up, clothing was made to emphasize waistlines, and I still like seeing that."
237,"As much as possible, I ignore it and them.  Usually that's easy, because they don't approach me directly with it."
238,"You just do. Things are more different when you're older. The world doesn't seem so easy anymore. You mature more because the more you see the more you know. The jaded you feel. 

The ""once I want to be older"" mentality is way different, little girls want to grow up but don't know how the world works. Especially people who live in bubbles HAVE NO IDEA. *Reminder to self* let them be in their bubble. Do not attempt to burst."
239,"3 year anniversary of my dad’s death.  I still have a ton of anger towards his widow.  After my mom died (I’m more at peace losing her) he went crazy.  He hooked up with someone he knew from high school and moved 800 miles away.  He began being very short with us. Always rushing off the phone.  I ended up just very pissed at him for abandoning me so soon after my mom died.  

He suddenly died from complications from a surgery. Found out he gave some of my mom’s possessions to his wife. I was hurt.  I have so much guilt and depression over this. Finally talked to my psychiatrist about wanting therapy.  Here’s hoping I stick with it."
240,Thanks! First one ever.
241,"Thank you for posting to /r/AskWomen. In order to give all users an equal opportunity to have their questions answered, we restrict submissions to once a day (24 hours). Please wait 24 hours before submitting a new post. If you believe your post has been removed by mistake or you are submitting again after a removal by the moderators, please **[CLICK HERE!](http://www.reddit.com/message/compose/?to=/r/AskWomen&amp;subject=Why+was+this+removed?&amp;message=\My+submission+was+removed+due+to+the+frequency+limit+and+I+would+like+to+appeal+the+decision.)** [AskWomen rules](/r/askwomen/w/rules) | [AskWomen FAQ](/r/askwomen/w/index) [reddit rules](http://www.reddit.com/rules/) | [reddiquette](http://www.reddit.com/wiki/reddiquette)

-------------------------------------------------

 ^^I ^^am ^^a ^^bot. ^^Please ^^address ^^concerns ^^about ^^this ^^action ^^to  ^^[/r/AskWomen](https://www.reddit.com/message/compose?to=%2Fr%2FAskWomen;subject=problem%20with%20bot)  ^^or ^^about ^^me ^^to ^^[/r/moderatelyhelpfulbot](https://www.reddit.com/message/compose?to=%2Fr%2FModeratelyHelpfulBot;subject=problem%20with%20bot)."
242,"Your submission has been removed:

Common questions can be answered via search bar or FAQ ( /r/askwomen/w/index ).



**[Have questions about this moderator action? CLICK HERE!](http://www.reddit.com/message/compose/?to=/r/AskWomen&amp;subject=Why+was+this+removed?&amp;message=\[My+submission\]\(https://www.reddit.com/r/AskWomen/comments/ckp0mj/-/\)+was+removed+and+I+do+not+understand+the+reason+given+by+the+mod+who+acted upon+it.)**

If you are messaging about your removed comment or post, **please include a link** to the removed content for review.   


[AskWomen rules](http://www.reddit.com/r/askwomen/w/rules) | [AskWomen FAQ](http://www.reddit.com/r/askwomen/w/index)  
[reddit rules](http://www.reddit.com/rules/) | [reddiquette](http://www.reddit.com/wiki/reddiquette)"
243,"I'm not sure what you mean. 

I worked. I went to school. I paid my bills. I aged until these things were all my responsibility, then I was an adult."
244,"This comment or post has been removed for seeking advice about a specific person or personal situation. Askwomen is about receiving answers from the community about their own opinions and experiences rather than seeking input on specific personal situations.

* Personal/Life Advice: Try /r/askwomenadvice or /r/thegirlsurvivalguide.

* Dating/Relationship Advice: Try /r/dating_advice or /r/relationships.

* Personal Pictures or Social Media: Try r/firstimpressions or r/tindr.

* Medical Advice: If you are seeking medical advice, please consult a physician or try /r/askdocs.

* Legal Advice: Try /r/legaladvice.

* Makeup or Skincare Advice: Try /r/makeupaddiction or /r/skincareaddiction.

* Hair Advice: Try /r/hair or /r/fancyfollicles.

* Fashion Advice: Try /r/femalefashionadvice or /r/malefashionadvice.

* Birth Control Advice: Try /r/birthcontrol or /r/askdocs.

* Gift Advice: Try /r/gifts.

* Sex Advice: Try /r/sex.

* Parenting/Pregnancy Advice: Try /r/babybumps, /r/beyondthebump,  or /r/askparents.

* Debate About Your Views: Try /r/changemyview

* Still Trying to Find the Right Sub: Try /r/findareddit can help for safe-for-work posts or /r/nsfw411 for nsfw posts

**Please review the rules of any sub before you post there.**

If you have any questions about this moderation action, please message the moderators through the link on the sidebar or [here](https://reddit.com/message/compose?to=/r/AskWomen). If you are messaging about your removed comment or post, please include a link to the removed content for review."
245,Ignore! They do that for attention. If enough people ignore them they eventually shut up.
246,"The key is to not have any expectations. Focus on taking the opportunities right in front of you.

You need to master living in the now.

You need to be self aware and live your life according to what you are, not your ideal of yourself.

I guess I'm just a naturally happy person because I'm content with whatever I get in my life."
247,RIP my keyboard this was amazing
248,"This comment or post has been removed for seeking advice about a specific person or personal situation. Askwomen is about receiving answers from the community about their own opinions and experiences rather than seeking input on specific personal situations.

* Personal/Life Advice: Try /r/askwomenadvice or /r/thegirlsurvivalguide.

* Dating/Relationship Advice: Try /r/dating_advice or /r/relationships.

* Personal Pictures or Social Media: Try r/firstimpressions or r/tindr.

* Medical Advice: If you are seeking medical advice, please consult a physician or try /r/askdocs.

* Legal Advice: Try /r/legaladvice.

* Makeup or Skincare Advice: Try /r/makeupaddiction or /r/skincareaddiction.

* Hair Advice: Try /r/hair or /r/fancyfollicles.

* Fashion Advice: Try /r/femalefashionadvice or /r/malefashionadvice.

* Birth Control Advice: Try /r/birthcontrol or /r/askdocs.

* Gift Advice: Try /r/gifts.

* Sex Advice: Try /r/sex.

* Parenting/Pregnancy Advice: Try /r/babybumps, /r/beyondthebump,  or /r/askparents.

* Debate About Your Views: Try /r/changemyview

* Still Trying to Find the Right Sub: Try /r/findareddit can help for safe-for-work posts or /r/nsfw411 for nsfw posts

**Please review the rules of any sub before you post there.**

If you have any questions about this moderation action, please message the moderators through the link on the sidebar or [here](https://reddit.com/message/compose?to=/r/AskWomen). If you are messaging about your removed comment or post, please include a link to the removed content for review."
249,"Hello tepitothrowaway. Thank you for participating in /r/AskWomen. However, your submission has been removed, because we do not allow personal advice or evaluation submissions. 

You can always go to /r/askwomenadvice, /r/relationships for romantic/non-romantic relationship advice, /r/legaladvice for legal advice, /r/femalefashionadvice for fashion advice, /r/skincareaddiction for skin care advice, or /r/findareddit if you dont know where else to go.  Please remember to read the rules of any subreddit you go to.  

If you think you received this message in error, please [message the moderators (CLICK HERE)](http://www.reddit.com/message/compose?to=%2Fr%2FAskWomen&amp;subject=""My post was removed for personal advice""&amp;message=). Thanks.

*I am a bot, and this action was performed automatically. Please [contact the moderators of this subreddit](/message/compose/?to=/r/AskWomen) if you have any questions or concerns.*"
250,Tell myself that God has a different plan for me
251,[removed]
252,"I just have a different perspective. I don't want ""things"" or accomplishments necessarily. I want to be a person with good character. As long as that is who I am and I am trying my best I can sleep well at night. Everything else is a temporary  state and as long as you get up in the morning everything can be changed. Life is a journey."
253,"God did I. I overcame it by making sure that I had time for me and my interests. Same goes for my husband. We were excited to be parents, but we didn't want to JUST be parents. We are a relatively young couple with a ton of interests and hobbies and a big social circle. We didn't want to lose that, so we made sure we didn't. We still got together for D&amp;D every week. We found childcare when the new movies came out that we wanted to see. We have a bedtime firmly set for our child so that we get adequate amounts of time to ourselves to do what we want to do. My husband and I still stay caught up on the latest video games, movies, and TV shows (that one is harder). We still see our friends weekly. We manage to do this and still eat dinner as a family every night. It is hard, but we wanted to make sure our identities as individuals were protected first and foremost."
254,"I lose myself every now and then. I become too committed to my relationship sometimes that I forget to live or act for myself. 
The first thing is to just take in your settings and try to calm down if you are getting anxious. Don’t think of it as “oh my god. Who am I. I’m not who I want to be. Oh my god.” Instead, think of it as “okay. I’m lost obviously. But, now that I found out I’m going to take a journey to get back to who I really am”. 
What I usually do to get back to being me is by first just sitting down and calmly thinking about what it is that I think is different about me. If I lost myself, what did I lose? It could be something small or big. Just think of the specifics. After that I think about the things I used to do that made me feel the way I did. What am I doing now that’s different than what made me feel good back then? Think of them or write them down and if your past hobbies are no longer interesting to you, find new ones. The best thing I can recommend is try something old and try something new. 
And if it’s about an S/O, explain what’s going on. They should be there to support you, not bring you down. If you tell them, they should be okay with most (if not all) the points you make because they care about you because of who you are. When I told mine I needed more space and to remember what my hobbies are and do things for myself and on my own, they agreed that it would be a good thing to do and wished me luck. This doesn’t have to be the end of a relationship, just the transformation of one."
255,"Fatigue and stress are the most common reasons I’d turn down sex, so that would be the truth. Those and being sick. If this were happening frequently (and “frequently” is a subjective term), my partner and I would hopefully discuss ways to help alleviate said issues. If it were occasional I’d expect them to just understand, just as I do/would when the reverse occasionally occurs. We’re (he and I) humans, not sex dolls."
256,No
257,"I’m in my late 20s and at this point and have no qualms or anxieties about it. My sister got married at 25 and has two young daughters, so I get to enjoy my nieces. However, seeing her go through pregnancy and motherhood has only reaffirmed my choice. 

First off, the first pregnancy was a whole ordeal. She got preeclampsia which was scary, and then they ended up having to do emergency C-section the first time. So they strapped her down to a table while she was convulsing, did local anesthesia and then sliced her belly open while she was still awake and conscious so they could pull my niece out. My brother-in-law was in the room and almost fainted.

So she had to recover from major surgery while caring for a newborn and she quit her job to stay at home with her kids. Her body still hasn’t fully recovered from the two labors and she still gets very tired doing any physical activity.

She’s had a lot of trouble making friends because she’s always with the kids. She and her husband can’t travel or have a date night without a lot of hassle. Overseas destinations are pretty much off the table. No quiet evenings in anymore either. No Netflix or games after work. 

Don’t get me wrong, I LOVE my niece and I can only imagine how much love my sister has for her kids and how that makes everything worth it. But I’m not ready to transition to that lifestyle yet. I want to be able to go to concerts, or music festivals, or out at night with friends. I want my quiet evenings in and trips abroad for a while longer."
258,I relate so deeply to this. I don't know how many times I've leaned into the bathroom counter only to come back with a wet spot on my shirt.
259,“Don’t you want a job with flexible hours for when you have kids?”
260,Where did you get your outfit? Who is the designer?
261,"Pretty good, I did what I wanted to do instead of what I didn't want to do."
262,[removed]
263,"Where I am now may not be where I intended to be, but it's where I need to be."
264,Get him checked for apnea. A CPAP is so much more tolerable than the snoring that wakes the dead.
265,"God fricking dammit this made me tear up. He sounds like a fantastic man. 

I am so glad you have these romantic memories of him ♥️♥️♥️"
266,"This comment or post has been removed for derailing. 

Derailing includes but is not limited to:

* Changing the topic from OP's question
* Making someone else's response about yourself
* Asking unrelated follow-up questions
* Branching into unrelated topics
* ""What-about""-ism
* Arguments, slap-fighting, or debating
* Judging or rating other responses
* Meta comments about other responses
* Responding to comments to tell us how your dick feels. No one cares.

If you have any questions about this moderation action, please message the moderators through the link on the sidebar or [here](https://reddit.com/message/compose?to=/r/AskWomen). If you are messaging about your removed comment or post, please include a link to the removed content for review."
267,"Who's watching the kid(s)?

If my husband (the one who works) is at his job, our with friends, anywhere but home, he never ever gets asked this. 

If I even run to the store for milk and see someone I know, or if I visit friends/family without my toddler, everyone asks where he is."
268,Happy cake day!
269,No anything natural looking does not have that effect
