,text
93,"This this this. Double if it's family, because the more you try to collect, other family members get involved and start trying to convince you to let it go, because faaaaamily.  ""You know how she is..."" and yeah, I guess I did. I was just hoping for better. But hope doesn't get you paid back. 

This also goes for favorite books.  I rebought the same book three times before I stopped lending it out, and just recommending it."
94,We're 9-5 friends. We chat and have lunch together but we won't stay in touch after we leave the company.
95,"Same here. I remember seeing him once, while I was at work, and totally unexpectedly started panicking.

I confided in my coworker (waitress) and she didn’t seem bothered so I pulled myself together pretty quickly. 

As I was drunk I only remember snapshots and that doesn’t affect me. Whereas other rape victims have a horrendous time. I wouldn’t want to categorise myself with them and act like I understand any of their pain. "
96,Pubes. 
97,"You would probably like r/Instagramreality it really addresses this head on. 

Im a new mom and have several mom support groups I am involved with on various social media platforms. I started to notice women posting pictures of their weight loss after giving birth and it was pretty drastic. I gained about 70 unforgiving pounds during my pregnancy and breastfeeding feeding. I was a mess over it. One girl who I was close to was posting pictures of herself a month after giving birth skinnier than her already petite pre pregnancy size. I started researching everything from crazy drastic diets to liposuction, desperate to fix my body. 

One day something in me clicked, I started to forgive myself for being fat and let go of the anger and started looking for positive body affirmations when I found Instagram realities. I spent about 3 days of looking at the sub and evaluating all of the photoshopped and facetuned people. Then I went back to the pictures and really looked at them. It was so obvious in retrospect, the warped walls, pencil thin noses, super white teeth, and blurred complexions. It made my heart hurt so much to see these women for what they were, hurting, just like me. Im still fat but I'm working on it. I sort of got off on a tangent but I hope this helps answer your question."
98,"When you're upset, it's easy to react with anger, but that rarely will get you the results you want. So take a moment to breathe before reacting when you feel like lashing out."
99,"After the second guy I dated after the man who tried to kill me started hitting me as well. I didn't cause their bahaviour, but I am not a passive character in my own life. 

I took some time to be alone and assess what made me vulnerable. I worked on my self esteem. I continued therapy. 

I cleansed my dating palate, I suppose. I realised we lost the art of dating along the way and 'do steady' too easily and my picker was off. I began to said yes to any coffee date from any kind person regardless of my interest to expose myself to more types of people and healthy connections. Even when there was no chemistry, the next time I met someone I did click, I'd remember something like how much more respectful the other person had been and realise there was a better option out there."
100,"To piggyback on this — descriptions of illness can be biased towards men, too. Off of the top of my head, women experience both heart attacks and ADHD differently than men do. With the former, many women have died after being misdiagnosed because they’re not showing the “classic” (male) symptoms of a myocardial infarction. With ADHD, many women struggle to get a clear diagnosis and treatment plan for the same reason! I am sure there are other instances, too."
101,"In line with that, most sofas/couches are uncomfortable for me. My head hits on the area where the neck support is, thus forcing my head forward. It’s so uncomfortable and I have to shift around a lot. Buying a new sofa was such a pain."
102,Check equine stores. You can always trust crazy horse girls to have the good stuff.
103,"I'm baffled at the idea people push that it's unhygienic. How, exactly? And how come pubic and armpit hair are only unhygienic for women?"
104,"Now, I'm a government employee with a house, a car and a cat.

I used to be a stripper."
105,Man here: \*furiously scribbles notes\*
106,"If you catch yourself googling signs of emotional abuse, tell him/her “goodbye”."
107,A cup here who has been going bra less for 2 years: it’s great! It helps with my back pain and I don’t care if people can see my nipples through my shirt. I think it’s great that it’s becoming more socially acceptable!
108,"He battles our kitty every morning to make the bed because I told him when we first started dating that I love crawling into a made bed at the end of the day. He also makes me coffee every morning while I get ready for work, and stays until I'm done so we can chat and leave for work at the same time."
109,"I've heard that they apparently don't do medication trials on women at all. It was a problem with Ambien because they just calculated a women's dose as ""smaller men's dose"" which lead to many women having too high of a dose because women are not just small men. "
110,"Might be controversial given its current status, but Friends. It’s still hilarious but now that I’m older I realize holy cow these people are big time enablers/toxic as hell to each other."
111,"To be honest, probably most of them. If it isn't considered a woman-specific use object, it was not likely designed based on the ""average human"" metrics which have traditionally (and often still currently) been based on men. "
112,I’m so fair that you can see my veins all through my body and I don’t mind. The backs of my knees are mostly a jumble of blue and green veins and I used to be so self-conscious but now IDGAF. My colleagues nicknamed me “gecko” which I think is cute now
113,"Holding onto anger is like drinking poison and expecting the other person to die. 

Also

Life becomes easier when you learn to accept an apology you never got."
114,"I'm pretty newly married, but this is how my husband has been since I met him and I hope he never changes. It's amazing to always feel loved, supported, and thought about. In a lot of my relationships I've felt like I was the one who had to put in all the work, and with him, I feel like I'm the one who has to try to keep up! lol. I appreciate him so much. "
115,"And then when I, as a hairy gorilla male, wear a skirt, it's all ""that's disgusting"" and ""no one wants to see that"".

Skirts and pants for all, I say. "
116,"Freakin' kitchen cabinets!  I can use the first shelf and the front of the second, but the rest is useless.  Definitely not designed for those of us who are vertically-challenged, and women tend to be shorter than men.

It's especially weird because ""a woman's place is in the kitchen,"" but they build cabinets we can barely use."
117,"I wish that going braless wasn’t considered a “small boob” option. Just because i have big boobs, its considered obscene or really sexual if I don’t wear a bra. But also fuck it, because bras are terrible and I’m not wearing one unless I’m running."
118,"""Thanks, but I'm into thicker dicks.""

Granted, the dude spent the next 3 days arguing on and off that his dick was plenty thick enough, which somehow led to me asking if he was also a ""purveyor of dicks with the same hands-on experience as me"", but at least the pics stopped."
119,"I hate how bathrooms for women always have just as many stalls as the men's, despite the fact that women usually take longer and there is always a queue outside the women's, but not the men's."
120,"Recently there was workspace safety inspection at work.   Among the potential fire hazards that were noted in the report was all the use of space heaters (used exclusively by women, as it turns out).  The \[all male\] operations and facility folks declared no one could use space heaters anymore, and this led to workplace version of a riot: the women were *not* happy and they let it be known.

(Keep in mind that these women are also using blankets to cover their legs, wearing cardigans/jackets at their desks, and gloves, too....they're doing everything they can to stay warm.)

Long story short: the highest-ranking women intervened, and the space heaters were allowed to stay."
121,[removed]
122,I was in the bathing suit area at Target last week and one of the marketing signs showed a woman in a bathing suit and they didn’t airbrush the cellulite! It was like a real person was wearing a bathing suit and still confident af about it. I was so happy.
123,"This... car seats are made for the average man, which means they are too deep. If I sit with my back flush to the chair's back, my head tilts forward and my knees are too far back to bend. "
124,"I actually think there's something wrong with highly religious people. Like, *actually wrong.* It's not just a ""I disagree with them."" thing. I think people who are willing to do things like harming others (including their own children) for religious reasons are inhuman."
125,unpainted fingernails. i find that having my nails done all the time is not only inconvenient but also very expensive.
126,I just finished a giant backpack hunt and the front boob straps problem was the worst. I was frustrated and furious and when I found one that lets you adjust the height of those straps (so they can go above the boobs) the store only carried it in pink. I decided to just be a pink hiker and roll with it. 
127,"My Mum always told me, ""you can't make someone love you, you can only make them respect you"". This advice really helped me when my partner asked for space early in our relationship. It meant that I hadn't embarrassed myself when we eventually came back together after working through some personal stuff, and he still had respect for me."
128,"Cars in general. Standard crash test dummies are modeled after an average man, there were no dummies based on women until the early 2000s and even now i don't think they are widely used because their use in tests even as a passenger drop car safety ratings sharply.

Women mostly drive in an ""unideal"" position so we can see mirrors, each pedals, etc because we otherwise can't. "
129,"1. Maybe an unpopular opinion, but **lay off the alcohol**. Booze does your appearance no favors, let alone your overall wellbeing... or your pocketbook. Fun story: I will forever have a nasty scar right between my eyebrows because of an unfortunate drunken run-in (literally) with a wall. :-( Also, hangovers are just the worst. Talk about feeling haggard. 

2. Stay hydrated! It makes SUCH a difference in your physical appearance, energy level, mental clarity, etc. I'm going to get myself another glass of water right now, in fact. 

3. Homemade face masks and other spa-day DIYs to pamper yourself. I've been using aloe vera gel, yogurt, and a little grapeseed oil, but you can look up recipes online and cater them to your skin type. (I'm really loving aloe vera gel for my skin. I just get the cheap drugstore stuff--but look for minimal extra ingredients. I even make a DIY lotion just by mixing aloe vera gel with a little oil--it mixes up nice and creamy.) 

4. Learn how to groom your brows. Tidying up my brows makes a big difference in how put-together I think I look. 

5. Exercise. 

6. Posture."
130,"I did this thinking it was no big deal but yes, I had 3 separate men tell me I'm beautiful. I had just woken up, my hair was a rats nest, and my mascara from the night before was atrocious. It was so different from a regular trip to the grocery store and  made me soooo uncomfortable"
131,"Not techhhhnically a movie but Snape's obsession with Lily was weird and not the slightest bit romantic. I cringe whenever I see people with ""always"" tattoos or using that reference in their engagements/weddings/whatever."
132,"Good for you for not giving in. Not that I'm shaming people for having nose jobs, but it's awesome that you personally were able to accept it. "
133,Every negative situation is an opportunity for you to grow and learn.
134,It’s a big reason diversity in the workplace is so important. We all have blind spots! It’s good to be surrounded by a team that can help you find yours.
135,"That's what I did the only time it's happened! I went ""OMG that's sick, you know child porn is illegal right?!"""
136,"""I'm not like other girls!""

Nah, I'm 100% like other girls and it is awesome!"
137,"I think you should have whatever name you want. I'm estranged from my parents and didn't have much of an emotional connection to my name, so I preferred to take my husband's. "
138,Hoes before Bros doesn’t have to apply if your friend is a manipulative jerk face.  Don’t ever feel like a bad person for choosing a relationship that makes you happy and healthy.
139,"Pretty much everything. I admit, I hardly notice it because I'm used to things being uncomfortable or difficult. When I read that article, it was eye opening realizing that I've just learned to ignore these daily issues. "
140,"I'm a male architect. When I was first starting out, I worked on a building where we had called for a perforated metal tread, open riser stair in a pretty public area. That got nixed when the female PM brought up exactly this concern. I never would have even considered it. Now I think about it on every project I work on."
141,One time I sent dick pics back to the guy and he just spammed me with a ton more saying “ooooohhhhh you like dick a lot!”. 
142,"Nights. Nights are difficult. The time when the world is quiet. No one to discuss the day and share meaningful conversation at days end. 

I really don’t have a solution for that. There are 1,000 ways to distract, I suppose but it’s still there. I figure there is a lesson always and eventually it will present itself if I’m willing to see."
143,"I have large boobs, they have never been perky. No fucks given about my lightly saggy boobs. "
144,"I have extremely thick and long natural afro hair. I've always worn it out, didn't feel like myself with it straightened and I actually think my hair is pretty.

I was viciously mocked for it for years, adults would point and laugh at me as a kid. People would reach out and yank it cause they thought it was a wig. 
Was told recently by a colleague that I'd never be pretty until I relaxed it or cut it off.

I don't care. I think it's great and I'm lucky to have such interesting hair, even if it is a shit show to take care of."
145,"A guy sent me a pic of his dick when i was like 16 and then asked for pics of me, I told him I was 11 and needed to ask my mum if it was okay first. He freaked the fuck out "
146,"I do actually prefer the softer fabrics and different necklines of women's t-shirts, but I'm totally with you on the babydoll sleeves. Who likes those?? They cut into your arm, they get all bunched up into your armpit and thus soaked in deodorant, and they don't even look good!"
147,I want people to send me Duck pics
148,I sleep with my arms and legs off the side of the bed and don't fear the boogeyman.
149,"For me personally, I can’t stand the feeling of pubes. Discharge and period blood stick to pubes and get all matted and gross. It’s not so bad clean shaven. Of course you wash daily, but in between washing it still feels icky. 

That being said, I definitely don’t think women should *have* to shave. Do what you want with your own body. 

Some people even tell me I can’t be a feminist because I shave. Lol."
150,"I'm very small-framed: skinny with little boobs, little waist, and little butt. I've heard many an ""only dogs go for bones"" and ""men like *meat""* directed at me throughout my life by well-meaning people, and I don't care.

Finding clothes that fit me is a pain and it's easier to get things custom-made, but I was made this way and I don't feel like getting implants or a Brazilian butt lift to change that."
151,"The US is hung up about this.

In other countries it's fairly common for three generations to live under the same roof."
152,"I've heard it's because they wouldn't want to risk harm to a fetus if any of the women on a drug trial got pregnant. Which I get that if the woman wanted to keep the baby that would be tragic; but it ignores that there are sterile women, IUD's exist, and some women don't want babies and also perpetuates the idea that the wellbeing of a fetus is more important than the wellbeing of adult women."
153,"Yup. It’s totally rooted in sexism and yet so many women buy into it - “I just feel *cleaner* with no pubes!” But they’re there to protect your vag, they’re not dirty or gross. I mean, each to their own, but I think we gotta admit that the pre-pubescent look is costly, irritating, and definitely not how nature intended it. "
154,"“I don’t know who had this number last, but you sent this to my 13 year old daughter.”"
155,Jealous of smaller bra designs :(
156,"This!! I've been doing research at my university for years now and I have never, ever found a lab coat that could button comfortably over my bust but still had sleeves short enough so that I'm not knocking things over. I've started just wearing barrier coats regularly because they're the only ones that will at least button most of the way. Also the respirators I use can be awkward or uncomfortable to wear because of my hair and I feel like they don't sit properly half the time :/ Honesty if I had a dollar for every time my lab coat spontaneously unbuttoned at my bust when I sat down at my desk or bench, I'd have enough money to buy custom-sized coats and respirators lol "
157,It's honestly ridiculous that they decided to keep the hazards instead of just turning down the goddamn AC a little bit.
158,"Also seat belts, aka boob stranglers."
159,Top loading washing machines. I have always smashed my boobs trying to get in there. Ugh. 
160,"I really feel this because in my office, the men are always 'fine' and our male boss keeps it super cold while all of the women have heaters and wear sweaters and complain about the cold. "
161,"Agree with this wholeheartedly, as someone who married on the younger side, never planned to get divorced at 28, if ever... But it happened. I think the single most important part of any marriage or relationship is _to know yourself fully_ before making a commitment to someone else.

I haven't remarried since-- but I'm in a committed relationship and we have a seven-month-old baby. I have interesting feelings regarding marriage now because I never want to go through a divorce again, not because it was a difficult process since we didn't have children or property together, but because I felt embarrassed about telling the world I found 'the one' only to have it all crumble. In fact, I told myself I'd never marry again because of that experience. 

My thoughts on that have shifted because I gave myself the time to figure out who I am for a year or two by myself before stepping into another relationship. My first marriage was centered around beliefs that I've now learned aren't true to my core. My best friend who is now a relationship counselor (I've known her since I was five, so she knows me VERY well) eased my feelings about everything by simply letting me know that a marriage can be within your own parameters. So instead of feeling like I lost myself trying to fit into an old school tradition of marriage, my partner and I can commit to each other and decide together what that looks like to us.

And to be honest, unlike the first time, I'd probably bawl like a baby if my partner proposed because I'm truly happy with myself, with him and what we have together."
162,"Or for shorties like me, they just cut into my neck 😠"
163,"I raged when my boyfriend was able to fit 3 full sized 5-6 inch phones HORIZONTALLY in one pocket of his jeans, while my phone has half of it sticking out normally.

Tbh, the pockets and phone problems also make women targets for theft, it's easier to swipe someone's phone if it's already halfway out

It's ridiculous

&amp;#x200B;"
164,Arguing with a dude who said women should always get a small separate bed to sleep in when they are on period because they cannot sleep in main bed with their husband or boyfriend. Life wtf.
165,"I hate my mother. 

Everyone thinks that “you should always love your mother no matter what.” 

Years of emotional abuse and manipulation, and I’m finally ready to admit that I hate her."
166,"If it's comfortable, go for it.

Visible pokies are socially acceptable these days, at least among women my age (ie, college students.)"
167,"This hurts and is something I struggle to internalize. I am a nice person: I help out when I can (and sometimes when I cannot), am always there to lend a sympathetic ear, and practice active listening when speaking with others. It's only natural to expect the same of others right? Well apparently not. I havent had an actual friend in the longest time, but have had one sided acquaintanceships where I'm pretty much a sounding board for their problems.

This happens to much I'm beginning to think that either I am the problem (I'm a bit weird) or the world is full of selfish assholes."
168,"I move to upvote this multiple times. 
SECONDED. 
Upheld."
169,"Seriously. The metaphorical glass ceiling is bad enough, guys! Don't add glass floors too."
170,Working with partners/friends to improve a relationship is worth it. Chasing and begging is not. There must be some form of effort on both sides.
171,Thrift stores are full of great stuff right now thanks to Marie Kondo.
172,"Geeky t-shirts. Sounds weird but they so often don't offer a curvy style. They just have a ""unisex"" option that's just a size down from the ""we sell to boxes with legs"" style. 

I'm not a rectangle! I want a cool geeky shirt that has inny-outty curvy bits!
"
173,"Hotel bathrooms. 

The lighting is always horrible. I travel almost constantly for work, and I have maybe been in two that weren’t obviously designed by men for men. Major complains include: dim lighting, the plug right next to the sink for electric shavers with not enough space for hot hair styling tools that need a little bit of counter space. "
174,"We just moved in together and I got these two tiny cacti that I think are really cute but he doesn't, so he keeps hiding them and I keep putting them back. I never notice when he's moved them until I find them in weird places. I started doing it too so now it's a constant game of 'hide or find the cacti'. I'm currently waiting for him to notice the one I put next to his craft beer.
"
175,"If the seats in the front of a vehicle aren't fully adjustable, I can't drive it.  I need it to be up-down adjustable, not just forward-backward, and that includes passenger seats as well.  We rented a car on our honeymoon that had seats so low that not only was it impossible for me to drive, I could barely see over the dash just sitting in the passenger seat.  I'm 5'1, I'm short but I'm not \*unusually\* short.  I ended up stealing a huge cushion from our Airbnb just so I could sit comfortably in the passenger seat, and fully removing the headrest."
176,"It definitely throws me a bit. I have a very “continental” nose...aquiline I guess? I definitely feel self conscious of it at times. I’m a bit self conscious of my eyelids because they’re more deep set.  

Overall though, I really do feel we’re moving away from the Kim K copycats and back towards celebrating “uniquely pretty” people. Kind of like in the 80s, I’ve noticed that women from that era could be non-conventionally pretty but still seen as beautiful.  

But the KKW copycat train has to end...I’m totally fine with plastic surgery, but soooo many girls are obviously attempting to look exactly like her.   

The pic Sephora posted of the Lily Lashes owner is a good example. It was *awful*. She is trying so hard to look like KKW but it doesn’t work. KKW looks good as KKW because she *is* her. "
177,Bigger ones tho
178,"The first time I ever got a dick pic (I was like 12....) my response to it was ""oh my god, what the fuck?! It looks like a deformed mushroom, is it okay??""

I'm still proud of 12 year old me. :) "
179,"Take actual care of your beard if you’re gonna let it grow. 

The amount of men I know that have a long beard because beards are now fashionable but don’t actually wash them or trim them properly is astounding. It’s not the length of the beard, it’s how you care for it. "
180,"Yep, same.  If I start to feel lonely I'll go to a coffee shop or mall and people watch and window shop.  I may still only interact with the cashiers but it seems to be enough for me."
181,"Every time I try to do this, it just makes me feel more lonely... I'm interacting with people but not connecting with anyone, and it just feels isolating."
182,"Well, the one and only time I had a guy sending me dick pics I got my dad to call him and threaten to call the cops if he didn't stop sending them to his 16 year old daughter. That worked

I was actually 16 at the time, some woman had given this guy my number at a bar and he wouldn't believe I wasn't her and just kept sending them. Keep in mind this what back when picture messaging was really expensive too. "
183,I fucking hate cheap tools painted pretty for women.  They are dangerous.
184,"I come across so many YouTubers (like Tana Tana Mongeau for example) and I'm always so shocked that they're only 2-4 years older than me, because they've gotten so much work done. "
185,There is such thing as over washing your face! Too much scrubbing can cause micro tears in your skin which can create more acne &amp; disrupt the healing process of old acne.
186,[removed]
187,That's the exact article I had in mind!
