,text
0,"You can look at it from this angle:

**Positive traits for the person being ""rejected"":**

* \- Has a better understanding of what they want.
* \- Are more confident in relationships when they do decide to get into them.
* \- Will likely have a easier time finding another healthy relationship after a breakup. Because you know what you want.
* \- Find it easier to trust people.
* \- People find it easier to trust you.
* \- Have higher emotional intelligence.
* \- Are a better communicator.
* \- Doesn't emotionally hold back and keeps it 100 with people.
* \- Has clear goals in other areas of life.
* \- Tends to be more content and happy with life

**Now think of the downside the person doing the ""rejecting"" has to go through:**

* \- Has to reevaluate what they do want.
* \- Might go through some soul searching after which isn't always the most pleasant thing to do.
* \- Might later on regret the decision.
* \- Aren't as confident in their own skin.
* \- Feels unsure about their future.
* \- Will have some form of guilt manifest as a result of not being open before.
* \- They will have reflect if the reason really was they weren't into you OR was it caused by another insecurity but this was the way it was projected?
* \- Will have to face their own set backs as the next person they are with may bring them to light.
* \- Might have internal struggles in being able to identify what happiness is. (i.e. repeating statements such as I wont be happy unless I have XYZ) This can be a problem with people who aren't comfortable in their own skin and seek happiness externally rather than internally

I hope this approach of seeing the situation helped you!"
1,I much prefer bare legs over tights or pantyhose.
2,I look like trash so I don't care.
3,Stare them down and hope they like what they see
4,"Unless you’re unusually tall, you can find out for yourself by spending a few bucks at a drugstore. I doubt anyone will care. Tights are more expensive, but just imagine your pantyhose being less itchy and softer."
5,"This comment or post has been removed for seeking advice about a specific person or personal situation. Askwomen is about receiving answers from the community about their own opinions and experiences rather than seeking input on specific personal situations.  * Personal/Life Advice: Try /r/askwomenadvice or /r/thegirlsurvivalguide.  * Dating/Relationship Advice: Try /r/dating_advice or /r/relationships.  * Personal Pictures or Social Media: Try r/firstimpressions or r/tindr.  * Medical Advice: If you are seeking medical advice, please consult a physician or try /r/askdocs.  * Legal Advice: Try /r/legaladvice.  * Makeup or Skincare Advice: Try /r/makeupaddiction or /r/skincareaddiction.  * Hair Advice: Try /r/hair or /r/fancyfollicles.  * Fashion Advice: Try /r/femalefashionadvice or /r/malefashionadvice.  * Birth Control Advice: Try /r/birthcontrol or /r/askdocs.  * Gift Advice: Try /r/gifts.  * Sex Advice: Try /r/sex.  * Debate About Your Views: Try /r/changemyview  * Still Trying to Find the Right Sub: Try /r/findareddit can help for safe-for-work posts or /r/nsfw411 for nsfw posts  **Please review the rules of any sub before you post there.**  If you have any questions about this moderation action, please message the moderators through the link on the sidebar or [here](https://reddit.com/message/compose?to=/r/AskWomen). If you are messaging about your removed comment or post, please include a link to the removed content for review."
6,"🤷🏼‍♀️ they’re not uncomfortable to me , and I love how smooth they make my legs look &amp; feel. If you’re wearing the right size they feel like nothing . If they’re too small they’re gonna feel weird and itchy."
7,When we started hanging around the same people and I realized the venting we did with one another didn't stay between us from her side. Being put on the back burner until she needs money. Wonders why I don't open up to her but never makes me feel as though my feelings are valid. We're still friends but I'm definitely more distant.
8,"Bad Blood by Bastille, it's been six years and still the only album I know word for word."
9,"I do a wet set at night--put it in sponge or twisty spiral rollers or pin curls or even rag curls. (I love retro). Most often, I do the spiral curls. I take out the curlers in the morning, use my fingers to comb through gently, and then brush them out. They stay all day. I don't like to use heat on my hair and I suck at using tools.

I am not a hairdresser, but you might want to ask yours next time you go if he/she can recommend any type of product or curling method that will work well with your type of hair."
10,Very true. He wasn’t a good communicator period. And when I’d bring stuff up that bothered me he would turn it around on me and then I’d end up feeling bad.
11,"You make a good point about not worrying about them being friends. I’ve never had an ex I would want to spend any alone time with since we’ve broken up, I guess I felt like our friendship ended with our relationship. I don’t want to be a toxic monogamist with the new person I’m seeing but I think they’re wanting to try salvaging a friendship with their recent ex and it makes me just a little uncomfortable. It’s pretty recent and they were very serious so I guess to me it just sounds like a recipe to get cheated on, but you’re right about it either happening or not happening, it doesn’t matter if I try and control the situation."
12,22
13,"I was 18, it was the morning before our senior skip day."
14,Time. Its as simple as that.
15,[removed]
16,"Thank you so much for the message and sharing your experience. Life is tough, I am sure I will be fine soon. And I am super happy for you to find your prince! I wish you all the happiness in life."
17,"Embarrassed, eh. Disappointed."
18,Anything in my inbox is to be completed. Anything I have finished gets moved to a separate folder (and organized into subfolders based on what they're about). I also leave post-its on my computer screen if I have to leave for a meeting or for the day so i remember to complete something I was halfway through. I get interrupted a *lot* so post-its save my sanity.
19,No way it suckkkkkks. No freaken way!!!
20,This is exactly why I'm staying single until my kid is off to uni. I don't want to even have to wonder about it - it's better for everyone.
21,"I did two things. A) I changed what I wanted to be more in line with my life today. B) I realized that what I wanted from my life would make me sad/alone in the end. My mom is very fond of saying that ""Who you are when you are 10 isnt who you are when you are 25."" Don't let who you were define who you should be."
22,"Tights can be uncomfortable only because I don’t like anything restrictive around my waist.  I prefer holdups in black or nude.  They’re warm, super comfy and a lovely velvety or silky feeling against your legs.  The only time they’re annoying is when your legs need shaved or waxed and the hairs get caught in between the material."
23,"No social life. I live far from all my family so I have no support or way to have a ''day off'' (when I lived near them I had no issues with this).  
  
Also I dread being sick or getting into an accident and, say, have a long stay at the hospital. I have no idea how we'd cope.  
  
Enforcing certain rules. I really struggle with not falling into a roommates situation with my kid. Teenagers are tricky."
24,That quote is amazing and I didn't know how badly I needed to see that.
25,"I was heading to Europe from Australia on a solo backpacking trip of 3 months. We had tentatively played with the idea of her meeting me in Spain later on in the trip (Spain being the starting point of my travels, and Iceland the end) When I told her I couldn't fit my travel plans around her holiday -which she had not yet booked- she lost her shit and told me I was ""dead to her"""
26,"I had a bf who financially supported nothing. He wouldnt even support the small amount of rent I asked him to pay when I was having a hard time. And at one point I asked myself- how is this guy helping me? The only thing good about the relationship is that he listened to me. He never even took me to dinner he was so cheap and I found myself feeling sorry for myself when I saw other guys saying they were taking their gfs out for their bdays. That was the saddest part.  I cooked for him, I paid for everything, I gave him sex. How was he helping me in return? It needs to be a give and take relationship, if not get out of it."
27,Armani Si for winter and evenings and Chloe for summer and daytime
28,"&gt;When I'm upset or angry with my SO I ask him to leave me alone. But I do not want him to REALLY follow through with that though!

Would you stay if this were someone else?

&gt;It makes me angrier that he'll leave

""Wow I am so pissed off he listened to me and respected my boundaries."" - You"
29,Do it for yourself and nobody else. Dont listen to negative people. Be proud of yourself and your accomplishments - love has to come from within first.
30,There wouldn't be a relationship between me and that person. Sounds like they have a lot to work out on their own. It also raises some flags about them possibly not being able to be alone. It just seems like a huge emotional mess.
31,"Lots of therapy. It really helped. Still things linger from the abused years, but all in all I went on to have a very healthy relationship afterwards. I still have triggers all these years later, but without therapy I would be in a much worse condition."
32,"I think it would depend on how ""together"" this current partner and I are.  If we were in a serious relationship, I wouldn't mind talking to them about their previous experience/helping them work through it. If we had only just gotten together I would feel inclined to think it was none of my business/I'd prefer not to know about it.

&amp;#x200B;

Also if they want to be friends with their ex, that's fine. The way I see it, if they're going to cheat on me it's going to happen whether I try to control their social interactions or not. Cross that bridge if/when I come to it. I don't really think cheating is ""preventable"" in the case of new/young relationships, if you're with a cheater they'll cheat on you, if you're not with a cheater then they won't."
33,"Tights are generally opaque and made out of thicker material. Pantyhose are much thinner and usually sheer. Tights can often be different colors (black is popular but I have seen a lot of colors) whereas pantyhouse tends to be some shade of tan, beige, or occasionally off-black. Tights are more durable. You can also get more patterns with tights."
34,Not keeping my mouth shut- reacting without thinking it through.
35,"He was I thought my soul mate . I was convinced because I used to have this fantasy about a guy named andrew would be my soul mate in high school. I did drawings of how he would look and his hairdo. My first bfs name was Robert. His name was Robert Andrew and he had the exact hairdo Ive always dreamed of. I even had run into him earlier at jury duty and thought OMG hes so hot but he would never go for a girl like me...and then he turned up later on eharmony! And I realized he was the guy I saw! Maybe I was trying too hard when I met him because there were high hopes he was the one with all the ""signs"". We dated but he treated me badly so he had to go. It was disappointing. It was only me that thought he was the ""one"". His personality was bad so it was a no go and he was an a-hole."
36,"If I love someone I want to retribute that attention and love in the same level. I would also envision doing things with that person in the long run.  
  
If not, I'm probably just getting caught up in the attention and we're all better off staying friends."
37,"I was 18, it was the morning before our senior skip day."
38,"She would abuse me (verbally and physically) ""for my own good"" or ""because she has depression and needed an outlet"", always followed by ""im sorry"". I would say I want out of the friendship, she would threaten to harm or kill herself if i did so. She would make fake accounts to cyberbully me and make me feel like shit. She would abuse and humiliate me in front of guys for their attention, and if the guy fell bad for me and wanted to help me or god forbid he had a crush on me instead of her, i would get beatings from her. she threatened to harm my family if i got them involved and when i tried to tell the school security, she went to the guidance and reported that i had depression (when i didnt) and she pretended to be worried about me and as a result the school didn't take me seriously. this went on for about two years before a guy that i am friends with and a group of ghetto kids i would tutor/help pass the class beat her up and got me out of this. right after this, my mental and physical health, family relationships, outlook on life and everything got better. people like her scare me for what toxic relationships others might be stuck in and i pray that my kids never deal with this."
39,It's by Jay Shetty. I highly recommend his YouTube videos if you're getting out of a relationship
40,Yes I do
41,"This comment or post has been removed for seeking advice about a specific person or personal situation. Askwomen is about receiving answers from the community about their own opinions and experiences rather than seeking input on specific personal situations.  * Personal/Life Advice: Try /r/askwomenadvice or /r/thegirlsurvivalguide.  * Dating/Relationship Advice: Try /r/dating_advice or /r/relationships.  * Personal Pictures or Social Media: Try r/firstimpressions or r/tindr.  * Medical Advice: If you are seeking medical advice, please consult a physician or try /r/askdocs.  * Legal Advice: Try /r/legaladvice.  * Makeup or Skincare Advice: Try /r/makeupaddiction or /r/skincareaddiction.  * Hair Advice: Try /r/hair or /r/fancyfollicles.  * Fashion Advice: Try /r/femalefashionadvice or /r/malefashionadvice.  * Birth Control Advice: Try /r/birthcontrol or /r/askdocs.  * Gift Advice: Try /r/gifts.  * Sex Advice: Try /r/sex.  * Debate About Your Views: Try /r/changemyview  * Still Trying to Find the Right Sub: Try /r/findareddit can help for safe-for-work posts or /r/nsfw411 for nsfw posts  **Please review the rules of any sub before you post there.**  If you have any questions about this moderation action, please message the moderators through the link on the sidebar or [here](https://reddit.com/message/compose?to=/r/AskWomen). If you are messaging about your removed comment or post, please include a link to the removed content for review."
42,"There definitely will be another one. After seeing how he is after the breakup, the only thing I can say is what goes around comes around."
43,Good point! I know I gave him a gift by loving him so much. He should’ve felt lucky to have it but now it’s gone. Hopefully he recognizes that one day.
44,"This post has been removed for specifying a majority demographic. Posts for this sub should use [inclusive phrasing](https://www.reddit.com/r/AskWomen/wiki/inclusivephrasing).   &gt;Questions that explicitly request responses from a major majority demographic will be removed (eg “straight women” “White women”)  &gt;Majority demographics include but may not be limited to:  &gt;* Caucasian/white people &gt;* Heterosexual people &gt;* Cisgender People &gt;* Americans (while not the majority in the world, they are by far on Reddit) &gt;* 20-30 year olds  &gt;It’s okay to ask in the body of your post that people specify their location/age/sexuality/gender etc (which they can opt not to provide). However specifying that you’re only looking for/interested in a particular majority demographic would be grounds for removal.  &gt;You’re welcome to ask questions explicitly aimed at minority demographics - there’s value in the specific discussion of their opinions and experiences.  If you have any questions about this moderation action, please message the moderators through the link on the sidebar or [here](https://reddit.com/message/compose?to=/r/AskWomen)"
45,I agree with this
46,"Every day or every other day. My hair was unhealthy until I switched salons &amp; stylists, shampoo, conditioner, and all other styling products to a new routine about three years ago. Turns out it wasn't the heat that was hurting it."
47,that i feel no emotion and im absolutely dead inside. not sure how i get out of it.
48,"I would discuss the importance of revamping our educational system. How we teach young children the importance of hands on learning but then they sit in classes as they are older and work out of workbooks. They lose interest because the work is boring and they aren't stimulated enough. All classes would be concrete with hands on learning. They would learn through project based lessons and be able to learn at a pace that doesn't put pressure on them to succeed. They also would do group assignments that foster working with other students and how everyone has a role. Field trips and guest speakers would come into the classrooms and help them learn about each lesson. 
This of course is if we had more budget."
49,"Your submission has been removed because your title does not include a question mark. Please ensure your title is properly formatted to be a descriptive, open-ended question. 

If you think you have received this message in error, please [message the moderators (CLICK HERE)](http://www.reddit.com/message/compose?to=%2Fr%2FAskWomen&amp;subject=""My post was removed for lacking a question mark""&amp;message=). Thanks.


*I am a bot, and this action was performed automatically. Please [contact the moderators of this subreddit](/message/compose/?to=/r/AskWomen) if you have any questions or concerns.*"
50,Are you willing to give just as much as they give to you?
51,"Been a little while for me, too—for me it’s How Did We Get So Dark? by Royal Blood. It was also the first album I saw the marketing buildup for and was actually able to anticipate coming out—I discovered many of the artists I listen to after they’d released a large part of their discography, if not all of it."
52,"I think what you're doing is trying to create boundaries *for* him, when only he can do that himself. You made your own, but he's not fully grasping that in this situation specifically they really should be mutual and he needs to be willing to see why you made those boundaries. 

Parents like that are not going to get any better as long as they and their children are still involved. If you two got married it would be even worse for yuo."
53,[removed]
54,"My life mainly consists of work and school, I don't go out much. I'm an introvert, socially awkward and it's really difficult for me to get to know people."
55,"For Emma, Forever Ago by Bon Iver."
56,"This post has been removed for specifying a majority demographic. Posts for this sub should use [inclusive phrasing](https://www.reddit.com/r/AskWomen/wiki/inclusivephrasing).



Questions that explicitly request responses from a major majority demographic will be removed (eg “straight women” “White women”)

&gt;Majority demographics include but may not be limited to:

&gt;* Caucasian/white people
&gt;* Heterosexual people
&gt;* Cisgender People
&gt;* Americans (while not the majority in the world, they are by far on Reddit)
&gt;* 20-30 year olds

&gt;It's okay to ask in the body of your post that people specify their location/age/sexuality/gender etc (which they can opt not to provide). However specifying that you're only looking for/interested in a particular majority demographic would be grounds for removal.

&gt;You're welcome to ask questions explicitly aimed at minority demographics - there's value in the specific discussion of their opinions and experiences.

If you have any questions about this moderation action, please message the moderators through the link on the sidebar or [here](https://reddit.com/message/compose?to=/r/AskWomen). If you are messaging about your removed comment or post, please include a link to the removed content for review."
57,"Golden Hour, Kacey Musgraves"
58,"Never. After a wash I towel and air dry. It takes hours but I dont mind since I shower in the evening. I have long, thick, naturally wavy hair, but I brush it straight and it tends to stay that way unless its humid.

After I dye it (I use semi-permenant stuff every few months or so) I blow dry it, but that's it."
59,Barkeeper's Friend! Works great for the kitchen as well (including cookware)
60,"I really needed this for my current relationship. I'm sometimes so scared of things going wrong, when there are no signs. So I sit there and try to hyper-analyze every situation if there are signs. And there never are. I just need to be more brave. And love without fear."
61,"The weekend I got engaged she started dating a new guy from out of town. We made plans the following weekend to hang out, I told her that if she wanted to hang with new guy just let me know and I’ll stay home. She assured me she wanted to get together. Day of she doesn’t answer my calls/texts for hours. Eventually tells me new guy surprised her and they have been out shopping but she wanted me to meet him so we could all meet for dinner and she’ll call me later to tell me when and where. That was 3 years ago and I literally have not heard from her since. Nothing. Completely ghosted. We had been best friends for over 10 years. I had checked her roommate’s Snapchat that night and they were out drinking and partying so it’s not like anything bad happened to her. It was after that that I began to realize that over the previous number of years she never invited me to anything and would always ditch out on anything I invited her to. I wouldn’t say she was a frenemy, but she was a very absent friend if you weren’t directly in front of her all the time."
62,"Hell yeah, Hozier is the man. Whole discography is amazing"
63,oh but i do
64,Products before drying! Using a mouse and a styling product can help hair that doesn’t like to stay styled!
65,"Haha I was thinking exactly that- except edible, and with chocolate chips 🍫🍪🍪😋😋"
66,"This comment or post has been removed as it contains graceless generalizations based on gender or speaking for others of a gender. 

- Women are not a hive mind.
- Do not speak for all people of a gender.
- Do not generalize across all people of a gender.
- Do not ask for mind reading.
- Do not ask for us to defend or justify other women’s behaviors.
- Do not assume that all women do or think something.
- Do not ask for ""male equivalent""/""female equivalent"" as these would not exist for most things due to different cultural processes.
- Exceptions: Discussion of cultural norms; Quotations
  - Contact the moderators if you feel your comment/post should fall under an exception.

Speak for yourself and your own personal experiences. Don't generalize your personal opinions, experiences, prejudices, stereotypes, or preferences across an entire gender.

If you have any questions about this moderation action, please message the moderators through the link on the sidebar or [here](https://reddit.com/message/compose?to=/r/AskWomen). If you are messaging about your removed comment or post, please include a link to the removed content for review."
67,When she told me she voted for trump.
68,"I start with “I have a story in my head about ....” and then say it because maybe it is a little irrational, but the trigger was there regardless and sometimes if you just get it out you can dig a bit and see what the root of the issue is (if there is one)"
69,"I never had a technique.. whenever I had crushes as a kid I would just be like ""hey I like you date me"" and everyone would always be like ""Ew no"". But eventually I found my soulmate so don't worry too much about being good at flirting."
70,"I don't think I'd be able to travel by myself without a GPS, tbh.

'cause the other option is attempting to manually map it and that sounds horrifying."
71,Except can't a person not orgasm until they are of a certain age like 10-11?
72,Which products do you use?
73,[removed]
74,"I had a best friend in high school. To this day she was the longest lasting female friendship I had. Knew her almost all of my HS career. 

In retrospect we weren't really best friends but we were both the closest friends we had. Even she couldn't stand me, lol.  But we we both were outcasts in a cliquey school. I really loved her and her company even though I sucked at showing it, and knowing how I was as a teenager I don't blame her for wanting to sever contact

One summer she stopped replying to my texts. I messaged her on Facebook, nothing. When I asked her about it on the first day of school, she said gave me a BS answer lol.
 

We had short exchanges and when high school was over we never spoke after that. Sometimes I still check her social media lol whats wrong with me? Sometimes I think about messaging her and rekindling but 1) I don't want to make her uncomfortable or feel obligated and 2) I am in the same position in life I was in when I was 17 and she has an office job, tons of friends, and has a life lol."
75,"You aren't a toxic monogamist if these are your only worries. If you're in a committed relationship with this person (or trying to be), it sounds like your hesitation is valid and you should try to move on. It sounds like this person can't manage their emotions or relationships appropriately and, aside from the potential for you to be screwed over, this is a huge red flag in itself. Just leave man, stop wasting time. Any further time wasted in this relationship is really just time you could be spending on actually moving on and looking for someone else."
