,text
111,"Completely unnecessary in 99.9% of cases and utterly disgusting as a result. Arguments of hygiene don't stand up, because washing your dick isn't fucking rocket science.

I'm obviously against it regardless of the gender of the victim, but the doublethink going on between male vs female from some people is amazing. People will condemn female genital mutilation one moment and turn around and use the exact same arguments they just criticised to justify circumcision."
112,yes daddy
113,"Life protip: if there's something you haven't tried and it doesn't hurt to try it, then try it."
114,"As someone in an open relationship in which both of us have watched the other get fucked, I will say this: do not do this if you simply are not comfortable with the idea. The poly lifestyle is simply not for everyone.

That said, if you're curious, and it's something you could picture yourself enjoying, then I recommend you start small and work your way from there. For example, for your first encounter with another guy, there would be no fucking. Perhaps just making out with someone in front of your partner. Then afterwards have a discussion with him about how that made him feel, how it made you feel, if you're willing to try more, and anything else you think is relevant.

#COMMUNICATION IS PARAMOUNT TO MAKING SURE YOUR RELATIONSHIP SURVIVES EXPERIMENTING WITH OTHER MEN. I CANNOT STRESS THIS ENOUGH.

Anyway, if you both enjoyed that, work your way up from there. Invite a guy over to blow him. Have a threeway. Something like that. You get the idea.

Feel free to PM me if you have any questions, OP. I'm well-versed in the poly lifestyle and have been in a successful open relationship for well over a year now."
115,"Yes! I was 31, he was 33. Both of us had stop trying to find ""the one""... yet we ended up finding each other.  
We've been together 19 years this January. He is my best friend and my true love, and I am his. It's amazing that you can love someone so much, yet still find new ways to fall even deeper in love each day. 
If I were to offer any advice or observation, it would be this. Don't set a goal to find ""the one"". Instead, just make an effort to meet new people and be open to possibilities, even if your first impression doesn't scream ""omg he's perfect!"""
116,"Gurl... life is too short to be worrying about what people are gonna say. If you wanna scream YAS MAWMAW,  YASS GAWD, YAAAAASSSSSS GAGA, BOOTS THE HOUSE DOWN, OKURRRRRR..... \*tonguepop* go for it. It's stressfull to have to pretend you're someone else. It's exhausting and mind draining. It's not worth it."
117,"The budget is merely a formality, darling.

*sips champaign and grabs a handful of Fabergé panini presses on the way out*"
118,"More so an action. At my high school prom I spritzed my cologne into the air and walked through it.

Holding back tears, my mom told me that was by far the gayest thing she's ever seen."
119,"This is called paruresis 


The trick is to get into the idea of WANTING to pee in front of people. This can be done with a form of  ""graduated exposure therapy""


One technique is to go into the stall and try to be as loud as possible when people are around. Pee into the water and make sure everyone can hear you. Keep doing this and eventually you will train your mind to not associate peeing with fear of people. That's because you're training yourself to be confortable peeing around others"
120,"- A laundry basket, with laundry in it rather than on the floor

- Tidiness/Cleanliness generally - I'm not a prude but reasonable living conditions are nice. If I walk in and it smells --&gt; red flag. Bathrooms are especially important. 

- Clean towels for drying hands in kitchen/bathroom

- Books

- Glasses intended for various drinks (nothing worse than drinking wine from a plastic cup)

- Art (or character generally speaking)"
121,Doesn't he want to be able to visit you if you were in the hospital for some reason? 
122,You know how to make him go away? Make him completely irrelevant by ignoring him. He will go away on his own when he can't stir up any more shit.
123,We don't all have wonderful fashion sense. 
124,Maybe he's taking on being the man in your relationship because you won't be a man for yourself and speak up for yourself. Man up and tell him how you feel about his plans instead of to strangers on Reddit like it's gossip.
125,"He seems like he's a handful to deal with. I mean, I'm glad you guys worked it out but he seems really... sensitive about *everything*. 

&gt;This might sound ridiculous but if he weren't my boyfriend I don't know if I would ever sleep with him again only because this whole thing really made me feel that sad and guilty and predatory.

That's the thing, he's making you feel all guilty and weird and I honestly think he's doing the most. Waking up drunk can be disorienting but I don't know if his reaction is proportional to the circumstances. 

"
126,"I leak like crazy...  I wore dark jeans when I went out with my new bf to a club the first time, but by the end of it, I had a solid 4"" diameter splotch of wetness on my jeans that was the unmistakable mark of precum.  It was so embarrassing but he thought it was cute, so I went with it.. "
127,Who?
128,"Mike Pence was nominated as his VP. That was everyone's first clue, except it wasn't even a clue. It was direct evidence that this thing was off the rails."
129,"&gt;/r/SuicideWatch /r/amiugly /r/ForeverAlone /r/depression

(づ˘ ˘)づ Come and hug me, friends."
130,"I give that society a year before it self destructs, probably taking half the planet with it in the process. Will I be there for the end of days orgy? Absolutely."
131,"Well, your username checks out"
132,"I wonder how many gay men go with their female friend(s) and then when they get hit on by someone they're not attracted to, they say they're straight or in a relationship with the girl."
133,"Pretty sure I just gave them my parent's credit card info. Lmao.
I just remember them finding out very quickly and making me show them all my AIM logs. Fun times."
134,"&gt; The gay bar is the one place where you can reasonably assume that the handsome stranger at the end of the bar is gay and hit on him without fear of being beaten up by a violent homophobe.

Never had this fear. So glad I live in a country where it's the homophobe who gets beaten up. "
135,The fact that you know who she is is why that's so incredibly gay.
136,"This is the furthest thing from crazy stalker. I mean following him from work every day might be stalker, but say waiting at his place for him to come back home is just someone who wants the respect to hear the truth. Ghosting in general is pretty rude, but ghosting after over 2 years is fucked. You deserve an explanation "
137,"Forgot to add something - we also discussed the dinner convo about marriage that started this whole thing.  

So he was genuinely oblivious before that that I was planning to propose. I asked him why he was so adamant about not getting married and he says he really wasn't, he was just venting about it in general but that it occurred to him that I might have been asking because I wanted to get married at some point. So he said that when I said (lied) that I didn't want to either he felt better because he thought he had hurt my feelings. Anyway, hopefully that fills in some gaps for people who wanted to know.  "
138,"I'm sort of the opposite.

I like a guy that's strong but I have to be stronger. There's something really sexy about a guy that is actually pretty strong and a little cocky about it and *thinks* he can take me down, but ultimately has to submit to me. And then get fucked by me because he lost. And then he squirms in pleasure as I pound away while his eyes roll back into his head... 

...Uh...is it getting hot in here or is it just me"
139,"Aww man thanks so much for sharing this - lord knows we have all felt this way at some point. Most of us just wouldn't have the guts to post it! 
 
Shine on you crazy diamond."
140,I dont know but i know what im doing later tonight with my bf.
141,I dont usually see good advice tbh
142,"""When are you going to find a nice man to get married to?""

Like, come on, MOM! I'll find someone eventually!"
143,Welcome to the [LGBTQ](http://img.pandawhale.com/post-27034-Monica-Rachel-friends-gif-Welc-jTFE.gif) community! It sucks. You're gonna love it!
144,"Do your bf has history of depression? I have a friend who would avoid social interaction and lock himself in his house for days when he is depressed. He appeared to be fine when he had it under control but would disappear from the radar the next day when he had an episode. He refused to pick up the phone or replied any messages during the period. 

Try contact his workplace is possible. "
145,"LGBT sex-ed in my schools solely consisted of ""Gays are more likely to get AIDs""."
146,"Why don't you try a dating website? Places like Okcupid are more dating oriented.

&gt;Grindr seems like a place to get HIV. 

Grindr is a social app that has a huge userbase. There are plenty of guys there looking for relationships. 

&gt;I miss the dick too, but mostly the mushy stuff.

Don't we all. 
"
147,"Not turned off, just not turned on"
148,"&gt; How do I get a girl to do anal?

Buy her a strap-on and google pegging."
149,"Omg yes, I like seeing everything, not just close ups of orifices "
150,"&gt; just because I'm gay, doesn't mean I can't also be racist.

Yup, just take /r/askgaybros, for example."
151,"The first time I went to a gay bar I was really nervous so I brought my straight friends, both straight guys. They both got hit on before they ever entered the club. They were both super nice about it but it continued more and more as the night went on. 

What I did not appreciate was how over the top some of these guys got, such as trying to convince them that they weren't actually straight if they were at a gay bar or offering to pay them to go out back and give them a blow job; some guys just could not take no for an answer. They were really good sports about the whole thing though and I really commend them for going with me at all."
152,Ah. You must be reaching your mid-20s. There's definitely a coming-of-age moment that involves beds becoming more proper.
153,"So, you dated a guy with Niagara Falls in his pants? Kudos!"
154,He was talking about his friends and the stuff they did over the weekend at a gay club. I said I wonder what it would be like to sleep with a guy. He then asked me if I wanted to try it with him and get it out of my system. I was a bit hesitant since we're friends and I didn't want to make it weird between us. But he reassured me that if I liked it or if I didn't it would be cool between us no matter what. About half an hour later we were doing the deed.
155,"I'll give her the not wanting attention, but the attitude she gave my roommate for being there and straight was appalling. Like she flat out said he shouldn't be there at all, when she was straight and there at the same time. "
156,Yes but he doesn't know I'm his s/o yet.
157,"Maybe if he were ten years younger and didn't have hollow, soulless eyes. Also him not being an asshole would help a lot."
158,bussy
159,"Yeah, I'm very tempted but I decided against it. He clearly changed his phone number and tried to cut off any form of communication I have with him. I'm not going to be that crazy guy that shows up at someone's house. He also doesn't live alone so I really don't want to cause a scene. "
160,"At least now you know that he really does love you. Because even after telling you that he's not crazy about the concept of marriage and seeing you at your worst, he still wants to marry you. I think everyone should propose this way. Don't make it all beautiful and romantic, because that's not how your entire life together is going to always be. Relationships are hard and take work. So get hammered, give them the ring in some overly dramatic and slightly passive aggressive way, throw up on them, and if they still say yes after all that, you know you'll be together forever."
161,"Lol, the responses would be sooo different if this was posted on r/gayincest"
162,I didn't ask. I guess I could. I moreso wanted him to be excited about marriage because he loved me rather than because of practical benefits like that
163,your difficulty finding a date is the least interesting aspect of this number.
164,Look at your life. Is being a D tier troll on the internet what you want to be doing with it?
165,"Yeah, neither of us consciously noticed until that moment. He's a good man, but he was a little oblivious. I once asked a probing question about when he was getting engaged soon; previously, he had mentioned in a throwaway comment that he would pop the question to her after his baseball team won the World Series. After that team won the Series, I asked if he was getting engaged soon while we were working out at the gym. He had a pained, slightly irritated expression on his face and he dodged the question.

I know what I was doing now. There was a small part of me, buried deep in the subconscious, that was hoping that it wasn't going to work out between them, that I could have the stable, long-term relationship they had.

In the meantime, I was busy preparing ""to make it work"" with ""the right girl, once she came along."" I was so deep in denial that I probably was able to convince other people that I was straight too. But I still craved for male intimacy, and that distorted the male friendships that I had. And I'd say I fooled probably only 80-90% of people, at the most.

And don't feel sad; if I hadn't done that supremely stupid thing, I might have remained stuck in my self-deluded closet. In the short term, yeah, I felt like shit and sunk deeper into depression. But I finally crawled my way to a therapist, marked ""bisexual"" on the intake questionare for the first time and began the path to healing my self-inflicted wounds."
166,"No, but i'll be masturbating tonight."
167,"Where did you get that idea? Scotland is very often ranked one of the best countries in Europe for LGBT rights. As a 31 year old gay Scot, that has spent my life in various rural and urban areas, I have had almost zero issues and nothing even remotely serious - just an occasional overhears transphobic comment here and there. "
168,I get *tons* of it...  make sure your dick isn't in one place in your pants for too long or wear jeans or dark pants.  I have had it where I put a folded up paper towel in front of my underwear before because of that.
169,Oh no!  I have heard that when that happens the only way to get it back is suck lots of cock! :-(
170,Pretty shitty.  I'm 29 now and still don't have a good group of friends and have never been in a relationship.  I feel pretty alone and it seems like it'll be like this for the next 50+ years.
171,"Any movement to remove a condition from a mental disorder list will be political.  

1.  Labeling homosexuality as a mental disorder doesn't account for other sexualities.  Do bi/pan people have a mental disorder?  What about asexual people? 

2.  We've learned that regardless of your sexuality, you can be a fully engrained functioning member of society; socially, mentally, physically, and professionally.  There are no mental inhibitions.    

3.  Sexuality has been found to be as varied and as meaningless to your mental capacity as your eye color or type of ear lobe.  People are straight, gay, bi just like how people have green, blue, and brown eyes.

4.  Our society is currently evolving to not be dependent on Christianity or religion like it has in the past.  The reason homosexuality was ever a mental disorder in the first place is because when western society was established, society's leaders were also religious leaders and considered borderline holy.  Western society was ruled for centuries by the Catholic Church.  Even monarchies in different nations were subject to the Church to an extent.  While not as impactful as centuries ago, in recent centuries, the laws of nations are still derived from religious texts and doctrine.  ""America was founded on Christian values.""  This says it right here.  Science and secular politics having control over law is still relatively new.  Science and secular politics have zero case to consider homosexuality a mental disorder.  The entire mindset that it was ever a disorder in the first place comes from religion.

5.  Your sexuality does not determine your physical ability to reproduce, which many say is essential to life.  Whether you're gay or not does not determine your ability to reproduce.  While probably not mentally comfortable or pleasurable, a gay man is still physically able to impregnate, and a gay woman is still physically able to get pregnant.  Other factors contribute to infertility; sexuality is not one of them.    

6.  The needs homosexual people need to be happy and healthy are the same as anyone else.  They don't need any extra treatment, medication, or attention.  They need what all people: Family, friends, support, acceptance, etc.

7. EDIT: There is simply nothing diseased or medically ""abnormal"" about being homosexual.  
  


"
172,username checks out!
173,he looks like he doesn't have a soul
174,"This whole place is full of trolls. 

Just ban everyone here, and delete the subreddit."
175,"* When a guy sits on a couch, relaxes his feet on a table or whatever and his feet are fondling each other. Extra points for socks.
* Wiping sweat from forehead.
* Playing with little animals.
* Shaving, showering, making hair.
* **Sleeping**.
* When he spreads his legs on a couch, taking much more space than he needs.
* Playful harrasing."
176,Psychologically yeah probably. Just because you cheated doesn't necessarily mean you're not in love. It just means you're an extremely selfish piece of shit. 
177,"When I was in high school I had a huge crush on the captain of the wrestling and baseball team (one guy, two sports) for pretty much all four years. Our sophomore year, I'd worked up the courage to actually talk to him and he was a nice guy - clearly not interested, but he at least entertained the possibility that we might be friends. 

Fast forward to middle of the year when he's getting D's in English class. We had a big mid-year paper due that was 40% of the year's grade, and a day before it's due he hasn't even read his book (we all had different book assigned). 

I literally read his book that afternoon (I took speedreading classes as a kid), explained it to him, and talked him through writing the paper. I ended up feeding him the essay sentence by sentence because he just didn't really care enough to try.

A week or so later we got our papers back, and he had an A with a note from the teacher that said, ""This didn't sound like your writing."" I got a note on my paper to see the teacher. He could tell I ""helped"" my crush, and he sat me down after school to tell me that this boy wasn't going to like me just because I did his homework for him. 

I died from embarrassment. Every once in a while I think about that moment and still turn beet red in the face."
178,I drank nasty beer to try and look more manly instead of what I wanted to drink. 
179,"I think he just wanted a one night stand. If you're prone to getting sad because a hook up has different intentions than you, try and ascertain his intentions before sex. "
180,"I briefly dated a narcissist because he was handsome, incredibly intelligent, and French (sexy accent). It was weird though because he didn't want to kiss me (even though we'd do other things). It's not like he was in the closet, we went out for coffee, dinner, concerts etc.

Turns out that he didn't want to kiss me because he thought that I am 'neurotic' and that if he did I'd 'fall in too much love' and 'become obsessed with' him. He then prompted to tell me that I'm not smart enough for the job I wanted to get after graduating (He was 5 years older in the field/role that I am pursuing). I'm pretty competitive/ambitious so that really pissed me off. He went through a laundry list of my apparent character flaws and treated me like an emotionally weak bitch. All prompted because I was annoyed he wouldn't kiss me. 

After he verbally shit on me for 5-10 minutes, I asked him ""Are you finished now?"". He said ""yes"" and expected me to not do anything, or maybe to cry. I then said, ""Get out of my house, and if you message me again, it better be to apologize"". He predicted that I'd be crawling back to him in no time. 

Truthfully, his words got to me, I was pretty shattered for a couple days/weeks. But I refused to message him again, and refused to give him the satisfaction of being right. Thankfully, I'm stubborn. 

He messaged me a month later asking to go for coffee. I went, but then he refused to apologize. So I just left. He messaged me a couple other times but I just ignored him and then he stopped.

Fast forward a half year. I got a job offers from multiple firms, including his. I chose to go to a better one. The immature part of me wants to tell him to rub it in his face. But I won't lol. 

I guess it's not a great answer to the question, but he was just irrationally cruel to me for no good reason. Don't date a narcissist. 




"
181,Scotland. 
182,"Recently went to a gay bar with my partner and his two straight male friends. Within a couple of minutes both of the friends were upset and wanted to leave because no guys had hit on them yet.

(I didn't have the heart to tell them it was because they looked like they were rather obviously a couple.)"
183,"You would have to lower those standards a lot for someone like me mate.
But thanks for the answer :)"
184,"You draw a penis on your forehead and you burst in through the front door and exclaim 'I've arrived!' Then all the guys line up and ejaculate on the floor and you dive into a slip and slide.

The same as any other bar with the only difference that if you find a guy there attractive the chances are he might be gay."
185,"The main one is that we aren't the stereotype as a group. Yes, there are some stereotypical gay guys. That's ok, there are stereotypes of all groups of people. 

Just realize not all of us are that obvious type. You are probably friends with some of us and don't even realize it. 

And though you might see it here more often than in the wild, we aren't all crushing or hot for you. Just as you aren't hot for all women you see."
186,"Oh lord where to begin

- 3some with a couple I met at a gay bar in New Orleans about 5 
minutes after meeting them.
- Sex in a car behind a cemetery
- Juggled 3 FWBs for a few months straight and rarely went a night without
- Banged in a bed that had another guy passed out on the other side of me.
- Fucked my BF on the side of a house during a party

Probably a few more but I've calmed down the last 5 years and some memories have faded. 
"
187,"He's complaining because his only place to flirt or talk to other gays is invaded by a guy who would rather rudely reject him knowing it's a gay bar

He went to the bar to escape that, yet now he has to worry about some fragile st8 ego in his one ""safe space"" where he just wants to let loose"
188,okay tbh my thighs are naturally big and i used to hate them a lot and still do sometimes. like they're not even muscular! THEYRE JUST FAT!! but i got a booty tho so i guess that's good but still /:
189,So... He was right? 
190,I want you to fuck me
191,"Not finding ""the one"" "
192,"Again, context. If my long-term partner comes into my room drunk and hops onto my dick, I'm not going to sit there and wonder if he's consenting. I'm going to fuck him. Hard."
193,that *was* the goal
194,I hope you know that jizz probably landed on a nun or a grammy.  
195,"&gt;For actually having sex in the shower, I even bought a pair of suction handles, but this is another story.... 

This guy fucks!

"
196,"As terrible as it sounds, that's pretty clever lol"
