,text
197,"Three months in, assuming you've been seeing each other regularly.

I'm not completely serious. There's no real rule about this and my three-month answer is somewhat arbitrary, but here's why I'm saying that based on personal experience.

Years ago I dated a guy and I was ridiculously infatuated. I was also a mid-twenties guy with very limited dating experience, so I didn't handle myself well. I could make an exhaustive list of my mistakes, but the common thread in all of them was that I was trying way too hard to turn this guy into my boyfriend. This included having ""the talk"" only a few weeks in, which was awkward and clearly was not something he wanted to talk about. I didn't recognize all the mistakes I made at the time, but after an honest postmortem (he did ""let's be friends"" after three months and never talked to me again) I saw how clingy, annoying, and thirsty I was. It was a huge bummer getting dumped by this guy and took a good year to get over it, so I decided to prevent the same situation in the future, I would stop trying so hard, embrace the be-yourself cliche, and let the chips fall.

Not long after, I met another great guy. I didn't stress out about our status, I didn't try to be cooler than I was, I just let myself be with him for whatever length of time I'd be with him. Focused less on the future and where we were headed than on where we were in the moment. Roughly three months in we went to NYC for a concert, and on our way to the venue he asked, ""so are we like, boyfriends now?"" I said yes, and that was it. We're married now.

I'd better get to the point since this is way longer than intended. I say three months because that is a reasonable length of time in which to get to know someone and to know if you fit together at a basic level. But really what you should try to do is get to a point where your relationship status is sort of a foregone conclusion. Like I said, with my husband I didn't make an effort to turn our relationship serious. I let it turn serious on its own. I didn't tell him how much I liked him, I showed him instead. At first it's simple. I asked for a second date, which isn't something you do unless you like the person. He said yes to a second date which told me the same thing. We made each other laugh a lot. We kept inviting each other to hang out, to go places, to do things. We had fun. We shared personal details of our lives. We talked about our life goals and our relationship goals. At no point did I worry about when he would be my boyfriend. I didn't try to force the issue and neither did he. And we didn't need to. If he didn't like me, he wouldn't be asking me to hang out all the time. If it wasn't going well, we wouldn't laugh so much when we were together. By the time he asked the question, the answer was obvious.

No doubt there will be many opinions, but that's my answer. You have the talk when you feel reasonably certain of what the response will be."
198,"Yeah, everybody in this story sounds like an asshole lol."
199,"There's a New Zealand safe sex site do you mean like this?

http://www.loveyourcondom.co.nz/great-sex-safe-sex"
200,"Not a faking it, but I get somewhat apprehensive about public restrooms when I happen to be using one at the same time as guys that know I'm gay. 

I'm not using it as an opportunity to be a perv, just the opposite- I'm so hyperconcious of the possibility that they *think I am* that I feel uncomfortable because besides not doing the thing that they think you might be capable of doing, there's nothing you can do to put their mind to ease. 

And frankly, it's probably all in my head... They probably *don't* think that far into it, and I never have this issue with strangers, it just comes down to people that *know*. 

I dunno... Carryover shame? Apologizing for the possibility that other people still equate gay = deviant? Or just paranoid, who knows... "
201,"No, the law does not remove LGBTQ protections. It simply removes the requirement for these companies to show that they haven't done any of this stuff, I assume, with records with employment pay and whatnot. 

""Hey, prove to us you HAVEN'T discriminated against gay people!"" - This is a bad law. I disagree with it being removed completely, and not instead reworked to help protect gay people instead. "
202,"Yes, I don't have this in locker rooms but in general conversation settings. I almost exclusively prefer talking/interacting with women. I can be honest, genuine, and comfortable with them. 

When it comes to a guy, i immediately change my tone of voice, body language, and facial mannerisms. I feel so intimidated if i don't. It's so weird. 

I work as a corrections officer and i don't feel nervous around the guys incarcerated though. Weird right? I can't explain it either. "
203,Omg maybe he's not into op...😟
204,"Yes.  I didnt really think in terms of ""the one"".  It wasnt like i was trying a key in every lock i saw in order to find a fortune inside.

It was more like trying the key, some times in locks here and there, expecting to find the occasional mini treasure like lost favorite sunglasses or nice pens that had gone missing over the years, being told that behind some few of them were real treasure chests but not really thinking i would happen upon one and being fairly satisfied with just getting my stuff back sometimes.  And then one time i turned the key and behind the door it unlocked stood Bruce, a little skinny fuzzy freckled guy in glasses and khakis, telling me to follow him.

I felt distracted from my business, but he had pulled me inside with his big grin and his warm, soft touch.

By the time i noticed that the door had locked itself again, Bruce had put the key into his back pocket and i didnt really want it anymore.  The room was expansive, fully automatically sunlit or subdued according to mood, furnished beautifully and comfortably with everything i needed.  There wasnt any reason to leave."
205,"Yes, prostate massages are a thing...The male g-spot is in his ass."
206,OMG. can you post the song ? 
207,I'm in tears. He never noticed? 
208,"I'm 20 and I do all the fucking time. I'm afraid to do any gay stuff cause I'm afraid of someone finding out. I fear for my safety all the time. I have to finish college first. Unfortunately that means waiting until I'm 25 for me to be financially independent. 

I wish I could do stupid shit, make mistakes, feel hurt, feel in love, talk about crushes, party, fuck around...I mean do shit any regular young person does. Build experience basically. But I can't because of who I am, not even because I'm afraid of my parents being angry. That's the worst feeling. Fuck this shit.

Also the fact that you're never a hundred percent your real self when you're in the closet. Any moment of happiness I tend to question (""would I be here laughing with my friends/family if they knew I was gay?"")

Finally I'm constantly afraid of making new friends cause I'm like ""why for? they're homophobic anyway what's the point of having another person leave me once I come out?"""
209,"&gt;  I was assured again and again in this sub

by whom? The majority of people here are liberals who hate Trump. 
Also, Trump supporters are not a monolith, so anecdotal evidence from a random person on r/askgaybros means nothing. 
Also, as others have mentioned, gay people...wait for it....can actually think outside the gay realm, not everything important to them is gay issues. I know. Some gay people are 3D voters, they are actually humans....SHOCKER"
210,"If you like a person enough, you figure out a way to make it work.  This community needs to get over this whole top/bttm shit and realize you should love a person for who they are not whether they are a top or bottom.  Yes, sex is a big part of a relationship but there is so much more to one than sex.  Gays always obsess over ridiculous things. SMH. "
211,"The problem is not this crazy ex, it's that your boyfriend doesn't want to completely let go of him. You said he even cheated with him ? And he makes up bullshit excuses not to break off contact ? 
Give him the choice : it's either you or his younger bitch. If he chooses the latter, you leave. Don't let people take advantage of you like this.

And of course if the ex does anything completely out of line beat the shit out him, but if your boyfriend's cuts him out of his life for good you won't need to."
212,"Oh my god you sound like an amazing parent!!

Best way is to let him approach you in his own terms , do not force it.

At the same time though, make sure he knows you are lgbt supportive, make random comments about some piece of news concerning lgbt and how supportive you are of all lgbt, etc..."
213,"Don't be afraid to make eye contact and say ""what's up""

If it's a dance bar don't be afraid to dance

Don't go into the dark rooms in back without being at least a Level 50 Whore with ""Condom"" or ""Prep"" spells equipped"
214,Good god Lemon.
