,text
95,"First of all the flag he held was upside down with the writing thereby being upside down.   I will let that sink in for a minute.

Red is the top of the Pride flag.  Seriously, if he or his advisers actually cared or were actually a part of the LGBT community that just would not of happened."
96,"That's sweet, thank you"
97,Do people still say that? I haven't heard that term in a while. 
98,Because I wanted to wake up in the morning knowing that the person in the bed next to me likes me for who I am instead of how well I can take a dick. 
99,"I went home with a guy who seemed cool and who had a nice house very well-decorated with fine furniture, etc... We started fooling around, and that's when he started getting unpleasantly rough with me. I thought it was just for show at first, but then it appeared that he was very serious about dominating me. Red alerts started going off in my head. He started talking about wanting to tie me up, which was not going to happen. He'd hidden my glasses from me, which I needed to drive, and was refusing to give them back to me. He kept trying to talk me into staying and letting him tie me up. I finally had to pick up an expensive lamp and tell him I was going to smash it and that I would continue breaking things until he gave me my glasses back. He did, and I got the fuck out of there. "
100,Banged lots of waiters.
101,This is such a gay sentence I love it
102,"Are the nerves in your asshole broken?

Rimming makes people believe in Jesus"
103,"OP has literally posted this thread four times and he keeps replying with the same thing or nothing at all.

Check his post history."
104,"Three years ago I used to live in an immigrant area. It was a very poor place, with lots of Muslims from the middle east. Mostly from Syria and Iran. 

I found a guy on one of the apps, he was brown and was definitely not ""ethnically swedish"" so to speak. We decided to meet up and I asked where. 

He told me that he wanted to do it in the middle of this immigrant area and I was apprehensive of that for numerous reasons. Asking if we could meet inside this specific garage, since, obviously he didn't want his parents knowing about any of this. I agreed but I found it very strange that he kept rejecting my offers to come over to my place. 

So I went there and stood on a hill not too far away from that garage. Eventually he came. But not alone. He came with what I assume was his friends. I counted 8 of them in total. 

Now call me paranoid, but if I hadn't been careful, who knows what would've happened. It taught me a very good lesson on being gay in immigrant areas. 
"
105,"You have to get your shit in order and rather sooner than later, because the worse it gets, the harder it will be to get out of it again. Deal with it NOW. 

First, depending on you situation, your parents might be legally obligated to financially support you. This is definitely the case if you're a student or in your first apprenticeship. In many ways, this is a very good time to lawyer up. 

You won't even have to pay for that lawyer. Courts usually offer free legal advice a couple of times per month. Do that ASAP. There's a ton of possibilities from BAföG to Wohngeld to ALG2 to suing your parents. All of that if for free if you're willing to accept help and your income is low. (If you're eligible for BAföG, which is not only the case if you're a university student, they'll even do that for you!) If you're a student or at least living in a university town, the AStA and/or Studierendenwerk should have a Sozialberatung and maybe even a Rechtsberatung that can and will help you.

What your parents did was despicable. Courts, lawyers, law and basically everyone you will ask for help will agree on that. Don't hesitate to reach out. If you have more specific questions, PM me. 

Edit: Somehow missed that you wrote that you're a student. Go to the Studierendenwerk today. Explain that you're homeless and without finances because your parents are major cunts. It's their job to help you. "
106,"Honestly, my advice:  
  
Let go. You are 21 years old. First and foremost, the biggest relationship you should be concerned about is with yourself and how happy you are.  
  
Stop looking at statistics because they are irrelevant when it comes down to love.  
  
Don't demonize people who are promiscuous. That is the climate of our culture, and they are free to live their lives that way. Yes, men are sexual beings and there is a lot of hardship trying to find serious, monogamous relationships in the community...but that doesn't mean there aren't people like you out there. You just have to be true to yourself and let others be true to who they are.
  
You should use this time to build yourself, and date guys so you can find out what qualities you like, and what qualities are definite no-no's in a relationship.  
  
I know you are a hopeless romantic. I am one as well. Being out for about 9 years now (I'm 26 now) has taught me that even though I crave love, the relationships I have had failed because either me or my partner, or both us, didn't take the time to get to know who we were and what we wanted.  
  
The better you get to know yourself, the more you will be able to follow your instincts when it comes down to what guys to chase and what guys to let go. "
107,"Moral of the story: do not tell straight guys you like them. If you think he might not be straight even though he says he is, it is purely wishful thinking on your part. If he claims to be straight, that's it. He's off limits. Don't be an asshole and confess your inability to accept reality. "
108,"If he's hot, hell yeah. "
109,"Well I would say you overreacted with your dad. 21 years old is an appropriate age to be told something like that. Plus, he's supporting and loving. 

As for your mom, well.......u don't have to cut her out but you don't have to take shit from her either. "
110,Decent sentiment. Unless you're no one else's type either....
111,That last paragraph summed up the ideal gay life.
112,"We used to start out in the same bed every single night, then whichever one of us was in the other's bed would go to his own.  I am all over the place when I sleep and need it ice cold in the room, and he was always hot and his snoring would set off a seismograph.  So that's how we did it.  Kind of like saying *we wished we could spend all night together, but we can't*.  

We also *never* once used each other's bathroom or shower.

When we traveled, we would get 2 bedroom/2 bathroom suites so our regular patterns could continue uninterrupted.  "
113,"My SO and I have emoji pillows of the emojis we use for each other when we text. When one of us has to travel we take the pillow representing the other and use it as a surrogate cuddle buddy when sleeping. We are in our mid-20s. :) 

For those curious: 
http://i.imgur.com/vlg0UKK.jpg"
114,I have 95 percent straight guy friends and I talk about gay shit all the time. 
115,"Damn man, you got rid of a lot of fun stuff..."
116,"&gt;he's kinda traumatized

oh please.

*eyeroll*

Tell him to stop fucking guys then. This may be the first time it happens to him, but it will not be the last. Even the most meticulous bottoms have an accident every now and then, and the ones who say they don't are lying like hell.

You'll get the usual spill here from guys about dieting a certain way, blah blah blah...but it all comes down to knowing your body, and trying to do your best to minimize accidents from happening (not engaging in spontaneous sex unless you're sure you're in the clear, taking a good dump and washing up, and in some cases, douching). It is what it is. "
117,"Thank God you said you've been dating 6 months. I had a feeling you were going to say you two had been dating two weeks. 😂 

I'm really excited for you op, keep enjoying what you have!"
118,Like five of my friends were all napping and cuddling on a bed after brunch yesterday. 
119,"You gave someone up because you didn't like them physically in spite of the fact that they treated you well and you were compatible in every other way. (Even family, now wtf that is a rare thing to hear.) Did you even take them to the gym or give them tips/pointers?

1000 people will tell me I am wrong, and I hope they do. But I'm here to tell you that you made one of the dumbest decisions you ever could have. There are tons of attractive guys out there, but how many will ever get along with you at the same level? Looks fade, guys get into their 30s and most nosedive into oblivion looks wise at that age. Open up scruff, grindr, etc. Hot isn't a commodity anymore, at least it never has been for me.

#Me? I can find hot ANYWHERE. I can walk down the street on a sunny day and pass by so many. But how many will I form a deep and meaningful bond with? I'd doubt less than 5%. 

^^ Yeah I'm gonna bold that because I think a lot of guys here think with their dick and forget in the real world looks mean boo-all in a stable happy relationship. Moderate level of attraction is fine, but that super hot 10/10 working at Arbys? Not so hot when you realize he ain't got shit. (That's why so many hot guys get into porn, because they can't even pay their rent. BAM real world for you.)

But a man that respects me (authentically), has a spine, someone I ENJOY talking to, and someone I can feel open/safe/stable with, someone who has a career going, someone who is a responsible adult, etc? HOOOO boy, wow that list of potential candidates just got axed down to about 10% if I am lucky-- and I'm not lucky this way so let's be real and out of 100 guys maybe 5 get along with me on THIS level that.

I can't even talk on a reasonable adult level with 50% of them because they're too busy talking about sex, past boyfriends and other garbage during our first meet up / ""date"". Let alone anything deep/personal, dare I not go down that dark path.

Good to fuck and then throw to the street. I don't expect them to know jack squat, because 90% of them don't.

To me? I think this is really hollow and vapid. But hey, you will ultimately (it will happen) find some hot guy and he'll walk into your life and treat you like shit. I mean, that's what you're after right. Long as he's hot, fuck the rest?

And before people tell me I am a pessimist/wrong, go ahead tell me that, but at the end of the day most people on this sub with any  experience in real life know I'm being real."
120,"He didn't make a scene, and at least acted like he accepted the ""video games"" excuse, so it's probably cool.  Relax and go on like nothing happened.  Chances are, even if he knew what was happening he understands that things like this aren't unusual with friends."
121,"Went to a store once run by a gay couple that was filled with large, ceramic roosters.  I realized that they had a collection on display of huge, hard cocks."
122,"Eh...I dunno. What's that saying? Don't shit where you eat. 

3somes are fun, but probably not best to do it with someone your boyfriend is going to see all the time."
123,"Thiiiiiiis is adorable. Reminds me of being a kid and ""camping out"" with my little sis in other parts of the house on weekends. Sleeping bags, snacks, and forts made out of sheets and couch cushions."
124,[deleted]
125,"Go to an LGBT shelter, apply for college then move on campus."
126,"My brother (also gay) snuck me into a gay bar at 17 since he slept with the bouncer. I walk in, trailing behind them (I'm sure my eyes were saucers, taking it all in) and this tall, buff dude steps in front of me and tells me how cute I am. I said thanks and try to step past him to catch up and instead all of a sudden I'm looking at the floor. He had picked me up in a firemans carry and started walking off with me like friggin' King Kong. Luckily the same bouncer spotted what was going on, got me down and he kicked the dude out while I booked it to find my brother. Turns out dude was super wasted and had been kicked out for being aggressive before. 

It was long enough ago that I tell the story with a light heart, but I definitely didn't bother stepping foot into a club until I was 21."
127,"Some older man takes advantage of my bussy and then deposits millions into my bank account.


What? It's only dirty because he's older."
128,"It isn't *uniquely* strange in that other couples do it, but our ability to communicate using words/sounds in a way that no one else can understand will make question marks appear over our friends heads often. 

When intoxicated it becomes worse and we will go a while before realizing that no one else has any idea what the two of us are taking about. "
129,"It is genuinely stupid.

There seems to be this new idea that PrEP grants people immunity to infection, and thus condoms are obsolete. Which is false.

The guy you liked clearly did not like you enough to actually care about your safety and use condoms. That is shitty.

And the whole ""i can't get hard while wearing a condom"" thing is a load of crap because A) they should already be hard B) they have special condoms with all sorts of extra goodies that make it feel about the same as bareback C) unless the dude's dick was large enough that the condoms he used restricted bloodflow, it's a load of shit.

Guys can be reckless idiots. Even moreso lately. 

Keep being careful and forget about the jackasses that are encouraging you to put yourself in danger of contracting stuff like HIV."
130,[deleted]
131,Nope. They are perfect. Nice legs too ;)!
132,"""Remember when you called me faggot?"""
133,"I still think - ask yourself, now that it's ""out there"" how bad is it really for you just to own up to being gay.

Super shitty he said stuff to remove your ability to do it on your own terms but rather than just allowing rumors to keep going maybe take it as the opportunity it is and be the cool gay guy now.

It's who you are after all, and there's nothing wrong with that.

Sorry it happened this way though - but try and find the positive in it. You'll be fine ☺️☺️"
134,"I think it's a face issue. They sort of turn the tables around so they aren't the ones in the ""shameful"" position. "
135,That search for the ultimate MASC guy...
136,No teeth. Use your hand too. Lick his balls. Tease his head. Swallow. 
137,"Reading to each other in bed, sometimes to the exclusion of sex on the rare occasion we get hold of something which is a *real* page turner. This can also interfere with sleep.

Also, probably some of the more involved massage techniques we've learned would be considered unusual by people who aren't familiar with them. We've had a couple people assume our basalt stone warmer was some sort of BDSM contraption."
138,"You guys were right, he wasn't a bot, I'm so mortified right now"
139,"I get what you mean. Something classy, sophisticated. [Here.](https://www.swishembassy.com/collections/funny-tanks/products/pig-aubergine-tank?variant=21284136135)"
140,"I think you only say this because you are physically attracted to him. In your entire post, you haven't said anything about him that makes him a good match other than that.

Give him an ultimatum and be prepared to dump him (very likely, I think). Finish school. Do well. Get a job. Then, you can work on your appearance and date. Focusing on a few things at a time is much, much better and easier than half-heartedly doing everything at once. "
141,"Dad later that night: ""Another scotch barkeep.""

""Sir, you're drunk.""

""Am not.""

""Sir, this is a pet store."""
142,"My boy just calls me his liege, turns me the fuck on. 

Another time he bowed to me and called me his lord. I ended up knighting him that night with my cock. 

Great times! (can be found at medieval times!) "
143,Maybe you should post a few more 😉
144,"&gt; ""I know what's going on in your relationship.

Except he doesn't"
145,I don't understand the Albert piercing fetishes or any genital piercings for that matter. Absolutely weird. 
146,ugh 
147,Having no friends is tough but its a lot god damn easier than putting up with that shit
148,"Well it certainly can't be related to decades of shrieking from the pulpit :  *""burn in hell sodomites!""*"
149,There's a lot of homosexuality and homophobia as well in the bodybuilding community.  Truth is even in competitions things like facial aesthetics are taken into consideration even if they don't actually say so.  
150,Its the special snowflake term for Bi. 
151,I think you really need a new roommate.
152,Shut the fuck up sometimes will you? 
153,"I'm not a Trump supporter, but I think I can narrow it down:

1. Hatred of the Clintons.

1. Wanting to ""shakeup"" the system.

1. Belief in a conservative economic system.

1. Wanting Conservative SCOTUS picks.

1. They believe Trump's rhetoric on free trade, or have been fucked over by job outsourcing or know someone who has. 

1. They've always voted Republican.

Did I miss anything?"
154,It's possible that you're bi. Experts say sexuality is fluid. It's a good thing.
155,"I detest Hillary and generally vote for the libertarian candidate for POTUS because I'm in Texas and a protest vote is usually inconsequential since our electoral votes will always go for the Republican. But I don't have that luxury this year because the race is reasonably close in Texas between Hillary and Trump, so I have to pick as one of them is going to be our next President. 

Here's the best analogy I've heard. You're on a plane and the pilot dies. You have to pick someone to take over and your only choice is between an imbecile who doesn't know how the fly the plane and a crook who *does* know how the fly the plane. **Your only choice is the crook**, so yesterday I held my nose and voted for a hawkish corrupt Democrat for President. "
156,"called my boyfriend at the time the wrong name (accidentally said the name of the last guy I was fucking before we met)

I don't think he heard me, or at least if he did, he never said anything."
157,Religion is pretty awful huh :/
158,Need shirtless pic or we won't be able to help.
159,Get out of here with your rational thinking.
160,"Your friend has absolutely zero perspective on the  incredible turmoil of emotions that went on inside his younger brother's head, *perhaps starting as young as say, 12 years old.*  Having lived through that myself when I was a teen, I describe it as having this massive war inside my brain, trying desperately to figure out that I was not some totally fucked up, sexual deviant pervert.  Mind you, I didn't grow up in a particularly religious household, having to hear church sermons describe being gay as intrinsically evil, nor having to listen to homophobic diatribes from my parents, siblings, extended family, friends and people in the community on a regular basis.  I suppose this is the difference between my having been able to survive those years, and this poor kid who lost that war in his head.

For some perspective, look at some of the [writings of Pope John Paul II](http://www.cnsnews.com/news/article/michael-w-chapman/st-pope-john-paul-ii-pope-benedict-gay-marriage-clear-and-emphatic), a man who while serving as Pope for 27 years was beloved around the world, considered to be a very kind hearted man, and who was ultimately declared a Saint by the Catholic Church.  Here are some quotes from his writing -

 -   Catholics in general have a duty to clearly oppose homosexual marriage, a Catholic politician “has a moral duty to express his opposition clearly and publicly and to vote against” such unions, and if it already is the law, the politician still must oppose it and has a “duty to witness to the truth.”

 - “Legal recognition of homosexual unions or placing them on the same level as marriage would mean not only the approval of deviant behavior, with the consequence of making it a model in present-day society, but would also obscure basic values which belong to the common inheritance of humanity.""

 - “The Church cannot fail to defend these values, for the good of men and women and for the good of society itself.”

 - ""homosexuality is a troubling moral and social phenomenon,” and especially so where gay unions are given legal recognition and include “the possibility of adopting children.”

 - ""No ideology can erase from the human spirit the certainty that marriage exists solely between a man and a woman.” 


For me, this is all bullshit of the highest order, totally evil shit.  But, I can reason it through the prism of having a fully formed adult brain, able to have my own rational thinking on the subject.   As opposed to this poor kid when he was 15, having no ability to see through the evil nature of these kind of writings.  And this, from a Church with over 1 billion people, considered to be one of the most respected religions in the world.  Some kids have no chance to survive growing up in environments where this is what everybody around them believe gay people are  - intrinsically evil and a threat to the fabric of society - and tragically, your friend's brother was one of those.  How many young gay lives have been lost/wrecked because of the writings of Pope John Paul II? Or, from people like Jerry Falwell, Pat Robertson, Tony Perkins?

And yes, I agree with you - he and his family played a significant role in his suicide, gasoline on a burning fire. 100% agree with that."
161,"&gt; Meanwhile guys, who have never had to live with that voice, start having these thoughts and it freaks them out.

There's a word for that but *boy* do people hate to hear it around here...

"
162,"OMG. Listen, it's not about ""convincing"" him. You need to present him with hard and fast rules that have consequences attached. If he doesn't contribute X amount to the rent, you will do Y. (E.g. throw him out.) You have low self-esteem so you tell yourself that no one will love you and want to be with you, so hell, you'll take whatever you can get. **But this lack of self-belief is what undermines you.** I guarantee if you stand up to him, a) he'll back down and try to work on you until you give in again OR b) he'll exit your life, you'll discover some self-respect and you'll attract a better person into your life. "
163,"Jesus Christ. 

TALK TO HIM. 

Fuck sakes you'd expect this to be some decision on whether or not to vaporize the earth. You're in a relationship. That requires communication. Stop whining on Reddit and go talk to him before it implodes because you don't have the balls to have an open discussion with a dude you're dating. "
164,Gay Bible says not to act on those sinful thoughts.
165,it sounds like you have a house boy you can't afford. You know what you have to do. 
166,"It'll only be bad if you don't own it.

Just have a ""so what"" attitude about it. Act like it's any other day, apologize to your friend if you want 

If you act like it's no big deal, people can't even laugh at it for long anyway because it won't be funny and it won't effect you "
167,I have a fantasy you could fulfill . . .
168,"I don't like to be rimmed and don't finger blast me like it's a pussy if you're gonna finger me, you better massage that prostate! "
169,"Something gives me a feeling that the cause here is less that every straight male in existence is apparently an uninteresting clod, and more that you sound insufferable."
170,We have sex in fursuits sometimes.
171,The jewelry is unimportant. The commitment is what counts. 
172,"Kind guys, actually.  Preferably geeky with glasses, too, but the kindness is #1."
173,"Look, I paid for college and worked all my own, but I could not fathom supporting another person. I believe you should figure out why you're feeling like you are ""paying to date him"" because no one should feel that way. He should be helping. He needs to stop being picky and get into survival mode. What he is doing is selfish. He needs to contribute or go home to family or whoever. You must be more honest with him than you are. Have a sit down because it seems like he's not living in the real world or he wants a sugar daddy to take care of him. Also you sound like a hardworking good looking smart young man, hell you don't need the added stress. From your work ethic, plus build type, I'd date you. Go find your self and be your kick ass individual you."
174,I'm an epidemiologist.  It's really awesome.  I get to science all day long.
175,"The Charizard

right when you are close to cumming, you light the bottom's pubes on fire. you ejaculate on his burning bush, flap your arms wildly and shout *""You dont have enough badges to train me!!""*"
176,If you're upfront yes. Baiting and switching guys is what is some bullshit.
177,http://gph.is/2dvgXhG
178,"To all those who say not to get involved are TERRIBLE friends, Id be all over this matter, hes your friend, friends look out for each other, Id beat his boyfriends ass right there on the spot"
179,Trump could build you a wall and make the neighbor pay for it. 
180,I started rimming my boyfriend but got something in my mouth. It was tiny wads of toilet paper. I spit them out and went on to a different activity. 
181,"they lasted long enough but I want a more diverse group - uncut, cut, black, jock, twink, etc.  Something about having at least 10 loads in me is a huge turn on"
182,"Sorry that you're going through this, sounds rough. Have you had a good cry with your guy, and held each other, and told each other how you guys are feeling? Allowing yourselves to be vulnerable with each other is hugely important in figuring this out, and helps allow for intimacy with your man, which is pretty much just as important as how you plan to care for your son."
