,text
183,"Was having consensual sex with a hookup. I checked that he put the condom on, and then we started. We switched positions and while doing so, he took it off and didn't tell me. It wasn't until a little while later that I realized... Ended up making my way to urgent care, getting on PEP and getting STI/STD tests. 

What a great way to lose your virginity, huh?"
184,"Loads of things in my opinion, most of which contradict each other. But it's also part of the beauty about being gay. The unpredictable nature of it all?

If I had my way, normality wouldn't be pushed down our throats so much, but also, I would stamp out those judgmental pro-polygamous folk who now get on you for not embracing their culture. Each to their own. I'd stamp out racism within the community, it's so rife. I experience more racism in the community than I do in everyday life. I'd promote safe sex (lol), and stop putting so much emphasis on things like PrEP. It's great, it's ground breaking, but it still isn't our saving grace. I'd promote more safe, non-clubby spaces for gays etc - just because i feel like apps and bars are the only places to meet people these days. I don't know why I keep saying 'I'd promote' - totally derailing from the question lol.

But overall the gay community needs to change it's way of thinking and expressing these ways. For a community deeply plagued with the worlds resentment, we sure do express similar attitudes towards each other."
185,"The indie movies don't show this, but finding your place with other gay men can be hard. 

Standard advice: be yourself, and keep trying. Eventually you'll find your people."
186,You still need to use lube
187,"No offense, but if there's pain like that you sound like you're either doing something wrong, or misattributing a normal bout of gastrointestinal discomfort to sex without any causative proof. "
188,Lol fuck that dude completely. Anyone who gives you hassle over using condoms is a 10 lb load of shit in a 5 lb bag. You're better off w.o him boo.
189,"Putting on nonprescription glasses and doing a selfie with ""#nerd"" irrationally upsets me.

Same thing with knowledge of mainstream television shows (GoT, TWD, etc) without even knowing anything about the book/comic lore. 



"
190,"FUCK ALL OF THEM. It's 2016, man, you shouldn't be ashamed of yourself of think of yourself as a laughing stock or a social outcast. I'm sure there are good, accepting people in your school that you can talk with. Of course it's not the best scenario to come out, but it already happend, you can look only forward now. Be proud of yourself and don't let them get into you and your spirit. And if someone is a immature child who think being gay is something to laugh about, don't give a fuck about him, show him the finger and go on."
191,[deleted]
192,CSPAN
193,"Can confirm. Am Dad. 

My boys are not quite old enough for me to be in this situation yet. But, I can say, if I stumbled in on this - - I would be mortified.

I'd accept the video game answer, and be a whole lot more careful the next time. "
194,Not all all. I'd hump those legs. Grrr
195,"Well when you are are trying to make a political statement saying you support and have the support of LGBT communities, the least you could do would have the flag displayed correctly.  It speaks volumes to me, that they could not even be bothered."
196,"The guy at work thought it would be hilarious if I told my boyfriend, ""I crave your dong."". Being me, I did it.  And then kept laughing about it the whole time, which pissed my boyfriend off.  10/10 would do again, and I have several times"
197,"People want a lot of the same things and I feel like a majority of people will give you the ""I want monogamy, dating, getting to know someone, not into hook up"" speech that gets said here all the time like they're this anomaly in a sea of people who just said the same thing.

So some of us are like ok cool we're on the same page, you like me I like you let's try and make something work long term...

But then all of a sudden they're like ""Oooohhh it's just that with apps and the ability to get around easier and connect with almost anyone I just don't know if I can bring myself to choose you over the unlimited other choices that could be out there, like yes you're fine but what if I'm one swipe right, or woof away from something more fine...""

I think we're really up against a battle of modern day psychology, can we overcome the need to try and find and end up with the best of the best when something that's perfectly fine is in front of us and available? Especially considering that we've conditioned ourselves to never settle because if we do we ""know"" that ultimately we won't be happy?"
198,"Throwaway here.  Still in the closet. 

Biggest fantasy would be having some gay friends take me to a gay strip club as a joke since they think I'm straight and then they order me a private dance in a private room.  Big hunk comes out wearing nothing but a white underwear barely containing his member and starts to rub it against my face.  I start sucking through the fabric and then after a while I just pull it out and straight out just start blowing him.  Then my gay friends come in and are totally surprised and come over and pull out their cocks for me to suck too. 

Yep.  That's one I've been thinking about for a while. "
