,text
0,You may have brought him a bit of joy to his life at a time when he really needed it.
1,"&gt; I'm going to lose all of my friends.

No, you're going to find out who your *real* friends are. That might mean losing some or all of the people you *currently think of* as your friends, which is hard. But the people who are with you when the dust settles are the ones who are friends with *you* instead of the *image of you* you had been cultivating before.

Good luck, stay strong, and fuck the haters."
2,"You need to calm down. The dad full well knew what he saw, and just wanted to take the dad route and pretend that he didn't see anything since neither of you were in clear or present danger. 

Just go about your business like nothing ever happened. Try and lay off giving your mate blowies while the dad's in the house, that's just bad form. 

"
3,"&gt; He's exactly my type: clean, fem, twink, and a bottom.

So responsible, supportive, adult, self-reliant doesn't describe your type?  

At college age, people still think about their relationships types in terms of sexual compatibility. Now would be a good time to start thinking beyond that. Not only are you good enough to get someone better than that, but he's the one who isn't good enough for you. You may, however, have to learn to settle for someone who isn't a twinkish model type. "
4,"Straight men are like 95% of men. When the pool of people to whom you're potentially attracted is that overwhelmingly heterosexual, you're going to end up being attracted to a straight guy at some point. "
5,I wouldn't even care if Trump came out tomorrow and hosted a gay parade with dancing twinks and penis pinatas. He's not getting my vote. the incompetence is too stronk in that toupeed Oompa Loompa.
6,Don't be sad you're dodging bullets here 
7,"No one can take anything he says about LGBT rights seriously when you look at his VP pick and Supreme Court choices.   It's ludicrous that anyone at this point could even consider this walking buffoon for president. 

Would I normally choose Clinton?  No. But this isn't a normal year. "
8,And thats why he is HIV positive. 
9,"Assert your dominance, annex their house"
10,"If he's a good dad, even if he saw you blowing his son, he's going to take the ""playing video games"" answer.

Just cool it a bit. Don't drop your next-door neighbor/friend over this. Unless the dad's a total dick, you'll be be getting more dick in your future.

Oh, and try to be a little more discreet in the future when you're playing video games.

And I'm so going to laugh the next time someone says that he ""loves playing video games."""
11,Sorry to hear that. I often forget (and try to remind myself) how little I actually know about guys I've gone on dates with. It's a shame he couldn't go on.
12,"So you asked somebody out and faced no negative consequences of any kind other than not getting to go on a date with him, and that has put you off from ever asking anybody out again?"
13,"It sort of like when your cuddling with someone, but your not really doing it just to cuddle, your doing it to be as close as you can to someone. Your wrapped around them as tight as can be and you just wish you could ""morph"" into them while your both locked together like puzzle pieces. 

Thats the best way i can compare it, you not having sex anymore to just get off. Your having sex to feel that same connection, to feel like your both locked into one another and know this is the closest you can get to being ""one person"". At that point sex is no longer just physical, its escalates to an emotional level too. The world around you stops, and your no longer just having sex. Your now making love to that person and your both just enjoying ""that moment of closeness"". Then once your done your just as physically drained as you are mentally. You both just end up laying there not saying a word because theirs really not much else to say. 

Ive only ever felt that feeling with one guy and its the guy im dating now. Ive thought ive been in love with past bfs but nothing has ever come close to what i have felt with my current bf. I feel like when you connect on that level you really know how much you truly love each other. Its not always like that, sometimes sex is just sex, but every so often sex turns into something completely different when your with the love of your life."
14,"&gt; He doesn't even let me masturbate or watch porn in my damn house yet I don't know if he's doing it when I'm gone.

So he's a bully, 
and you love him.
You need to break up with him, kick him out, and see a therapist. "
15,"It is actually quite racist - its sort of like, idk, have you noticed whenever there is interracial gay porn between white men and asian men, the white man is literally ALWAYS the top? 

Does that not count as racist?

Both of these instances are racist, because they're effectively stereotyping races as having roles; to satisfy peoples fetishes; 

Blacks are thugs to make them out to be ""different"" from the cute white guy they're fucking (who's typically seen in pain), and also, I've noticed black guys in porn are typically the ones that live up to the BBC stereotype - its like porn is literally here to reinforce stereotypes?

Similarly, the white guy who ALWAYS fucks the asian guy (and never in reverse), in my opinion, thats racist too, because it suggests that Asian guys are here to serve as white men's fuckboys. Because you and I know very well there are Asian guys out there with big cocks. I mean honestly, go on Pornhub or wherever, and if you see the number of things titled like ""white daddies take turns on Tao's tight hole"", if you think closely its actually really derogatory - as is calling a black dude a thug, which I've also seen."
16,"I would just message him.  ""Hey &lt;brother's name&gt;.  Small world, huh?"""
17,My husband and I sometimes take the mattress off the bed and go make a bed in other rooms to get a change of scenery. We once slept in the study for a month. It was great.
18,"""Wait, I need to poop"" "
19,"A gay man wanting a straight dick... hmm, I believe this is a recurrent theme on this sub."
20,"I think they're pretty much perfect. Thin and light leg hair can look a little strange, it ends up looking like fuzz. 

Don't worry about them, you're all good"
21,Sounds like a good way to get pictures of his brother's spread asshole.
22,This is rape being that you didnt consent. 
23,and then make the dad give *you* a blowjob
24,You're gay not an alien just go out with him and have fun. 
25,"Damn, that went off like a bomb inside me. It's OK to not be attracted to yourself; in fact, it's perfectly normal.

Your little repost just might have fixed my body image issues. Let's see if it sticks."
26,"I clicked on this thinking it was a sincere question. Well played, OP, well played.

Honestly, as a slightly older gay (well, 30, so oldish by the standards of this sub) I think it's pretty cool to see more and more young gay guys who are accepted within a circle of mostly straight friends."
27,"straight = masc = good/desirable/superior

It's pretty fucked up but it is what it is and porn would be stupid not to use that marketing advantage

People who say they're straight on apps I'd say mostly do it for the same reason, they know the ""straight"" label will play into guys' desire to get the forbidden fruit. That said I don't hate on people who identify as straight but want to fuck guys (aka probably heteroromantic but bisexual). I'm not victimized in any way by the labels they choose to put on themselves. The only real damage comes from warping others' expectations of what is normal on the apps.

Bi males are ""unacceptable"" because women can ""dip a toe in the lady pond,"" i.e., hook up with a girl, and still be considered straight, because it's culturally acceptable (because it titillates straight men). But men cannot do the same thing with other men because it's not culturally acceptable, which is obviously shown by even ""excessive"" platonic affection being ""gay,"" when it certainly is not. So agains that cultural backdrop, it's ok to be a bi woman, but not a bi man, because to do anything with another guy = 100% gay. Yes, it's dumb. "
28,[deleted]
29,"How the fuck does that work ? Do they think ""UGh, that guy is acting responsible, that's such a turn off !"".

This is plainly stupid, if someone gives you shit about using a condom, i think you legitimately have the right to tell them to fuck off.

"
30,"It's a reversal of roles is what it is. I think typically women always have to live with a voice at the back of their head saying ""what's his ulterior motive, is he just trying to get me into bed?"". Once they know you're gay that voice goes away and they can be completely comfortable around you. Meanwhile guys, who are comfortable around other guys and have never had to live with that voice, start having these thoughts and they panic.
Edit: revised wording"
31,"Obligatory [""Hot guys are hot""](http://extrafabulouscomics.com/comic/180/) Extra Fabulous Comic"
32,"I think I'd just tell him ""I know what's going on in your relationship. When you need to leave, just say and I'll be there. Anytime."" and leave it at that. If he tries to argue and say that nothing is going on, just repeat to him ""Anytime, I will be there."""
33,"It's the old ""wanting what you can't have"" thing taken to an extreme. "
34,"You know what that means?...

INCEST TIME!!!!! 😲😨🙈😖😈"
35,Putting a pair of glasses on a good looking dude doesn't make him a nerd
36,"Hoosier here - Pence is a piece of shit.  For those of you not in Indiana and don't know about it, our little Religious Freedom Restoration Act (RFRA) last year was a fucking debacle.  Hastily signed into law by Pence and then later ""fixed"" because he didn't think it would cause so much uproar.  Fucking moron."
37,"Well, porn that appeals to stereotypes sells better than pornos that do not.

Whatever the reason, producers make a business decision about what kind of movies they are going to make and what characters to have in them.

The thing that irritates me about black guys in porn is that they prioritize actors having big dicks over them being good looking or in shape. So, the black actors in these race-bait films will be some 30-50 year old guy with dad-bod, but a 10 inch dick. That just perpetuates the stereotype that black men are less attractive overall than white men.

It's a ridiculous stereotype because race has nothing to do with looks, but here we have so many people trying to use that as the justification for why they don't date/fuck black guys."
38,"I've always disliked the desire to quantify intelligence. While intellectual capacities certainly exist, how well you emotionally, socially, or even physically bond with others has very little to do with one's raw intelligence. As a previous poster stated, being able to hold conversation is important, just as it's important to *click* with a potential partner. I'm not wholly suggesting your ego is getting in the way of finding a suitable partner, but such thinking might hinder your happiness. 


Most people can hold intellectual conversations, even if they don't share your 'level of intelligence.' I think what you're looking for is someone who has a passion for learning and a curiosity of life. I wouldn't conflate that with one's academic tenure or ability. "
39,"You said that he doesn't let you masturbate. He's overly controlling (sign of domestic abuse) something that isn't his business (yes, I know you have sex, but it's also your right to jack off). "
40,"&gt;BUT HILLARY OBVIOUSLY HATES GAYS BECAUSE HER FOUNDATION ACCEPTED MONEY FROM MIDDLE EASTERN COUNTRIES TO FUND AIDS DRUGS FOR POOR PEOPLE. TRUMP IS THE BIG STRONG DADDY WHO WILL PROTECT US FROM ISIS. MAGA!

Hillary is a bad bitch who is going to get shit done for us. I'm with her."
41,"All these people saying make profiles or go inspector gadget. Jesus. Whatever happened to being direct with people? If you recognize him as being yours, just message him. Say hey bro, this is awkward. Wanna talk about it? 

He will either avoid, block you or talk. You don't give him any other option there. Sounds like y'all don't have a relationship. Your parents already know. You have nothing to lose. "
42,"&gt;But seriously, who else out there likes dick, but doesn't fit the gay mold very well?

Holy fucking shit, this sub desperately needs to learn to sing another tune.

&gt;I'm sure there are other gay guys with similar interests, but if they aren't into the ""gay scene"" so to speak - how do I meet them?

You're soaking in it, babe. This sub has 33,496 subscribers and virtually every last damn one of them has posted the exact same post you just did, at some point."
43,JERRY JERRY JERRY
44,Gay guys are 4x times more likely to commit suicide than straight guys. Sadly it's a problem in our community
45,"The sort of hobby that doesn't necessarily mean you're gay, but it does make you buy curios. "
46,People who are truly suicidal are good at hiding it and feigning happiness. It's what we're told to do. That's why he seemed so happy.
47,"Chances are, it's not a date.

A dude can go to a bar with another dude without either of them being gay.  Friends do this all the time.

My advice is to be yourself and have a nice night out.  You could casually come out to him by saying that you're gay and miss just hanging out with the guys."
48,"That was quick thinking on your part...I'll file it away in case of emergency.  That was a clever insight, that the best way to intimidate a gay guy is by threatening his home decor 😂 ."
49,Just think how the son feels. He has to deal with his dad seeing him get sucked off now. Follow up with him later and make sure he's okay.
50,"It's easier with straight men to become friends first, then once you come out they are less likely to pass judgment. But better advice is Fuck them! If they have a problem with you being who you are you don't want to hang out with them anyway! Fuck 'em! In fact you may also end up fucking 'em because most guys who react this way are closeted anyway. "
51,"Ha! Jokes on you! I don't have any straight OR gay friends!  

..... :("
52,"1)There are very few openly gay bodybuilders for a reason. 2)There is a gay side. All kinds of different people like muscles. 3)Straight guys are ""allowed"" to admire muscle and beards. I'm not buff but I get beard compliments from straight guys all the time. They're not all trying to fuck me. 4)I really hate how girls are allowed to talk about each others butts and it's not gay but with guys everything is ""homoerotic"". "
53,"Blowjob: √

Kissing: √

Convo re: feelings and intentions: ???

OK, so, you guys seem to be doing things a bit backwards, but who cares? Your friendship is already altered. There's no way you can forget this happened. You two have to talk about it. What's the alternative--spend the rest of your life wondering?

And yes, it could all end in disaster, but you're past the point where that wasn't an option. The only way through is forward."
54,Raise your hand if you've been personally victimized by Regina George.
55,"I'm unattractive, unemployed, bipolar, autistic, don't exercise, have no talents, no education, socially awkward, and that's just the beginning."
56,"That sounds hellish. Though let me say - the difficulties of starting over abroad with no friends are a better consideration than languishing in misery for your whole life, or living a lie, let alone killing yourself. Don't accept powerlessness and despair as permanent states, use them as motivation to find a better life. You deserve it.

Much love bro and be safe. "
57,The important thing is that you finished.
58,"Then it's followed by, ""I'm just one of the guys"". "
59,Being gang banged by 10 or more guys.  All bareback.  I've done it with 3 but that didnt do the trick.
60,They're being who they are. You should be who you are.
61,Notice the use of past-tense.
62,"&gt;and I want him to show more, thoughts on how to not fuck it up?

Honestly, just stop.

He's getting off on the exhibition. It's not about you at all. It doesn't sound like he's interested in fucking a guy, he clearly just enjoys the attention and knowing that it titillates you (I mean, this is kind of the root of all exhibitionism, isn't it). 

I'm really not sure what you want to get out of this aside from seeing his dick, you're not going to date or anything. You even admit that voicing your desire to see more might affect your friendship. Is this really worth it? 

Focus your time and sexual attention on people capable of making that a two-way street; right now, it may seem like it is, but it's not. "
63,"Coaches build up their players. They also discipline them if the players aren't up to the task assigned. 

You might start of with ""You're late, drop and give me 5-10 push ups""(pick a light number that your bud can do) then start off with some stretching, make sure you correct his form with alot of touching.

Get him to go for a jog around the block, actually make him head out and jog. If he balks at the idea, blow a whistle and say it again like it's an order.

When he gets back, let him know he's done well. Slap him on his ass and tell him to hit the showers.

I'm sure you've watched enough locker room coach porn to know what happens next. You could also go the body building route or engage in other sporting activities outside that would seem innocent to the casual observer but erotic for the two of you.

Be a coach, be in charge and don't be afraid to get into the character. "
64,"Had a wife tail her husband to my apartment back in college, she was sure I was a drug dealer and her husband had been hiding an addiction apparently. I'm giving him head when all the sudden there is a wild banging on my door, I'm guessing it's one of my buddies or something, he goes and hides in my closet, I open the door to a 40yr woman in a rage, threatening to call the cops, calling me a drug dealer, demanding to see her husband, he comes slinking out of my bedroom trying to keep his wife from calling the cops, he comes out to her as bi in the middle of my apartment living room, she starts bawling and leaves and he apologizes repetitively while following her.   

I don't fuck with married men anymore. "
65,Get the fuck away from them as fast as you can.
66,I think he's more referring to the obsession some guys have with bagging straight guys more than guys developing crushes or lust for guys who happen to be straight. 
67,"Different taste in music: easy difficulty

Different taste in food: medium difficulty

Different taste in humor: hard difficulty

Different values: legendary difficulty

^^^^^^^^^^^I.May.Have.Stolen.This
"
68,That would be mortifying for the brother. The most amazingly interesting and exciting thing for OP. 
69,"You're not doing anything wrong, he is.  You can't fix it, nor is it your job to fix it. Just be a friend and do friend things. "
70,"I love cuddling (big spoon). I really like when the guy is cold to because i have a lot of body heat and we temper each other out! Sadly, i can't find many guys wanting to cuddle a 6'4 teddy otter"
71,"I have a master's in engineering but my boyfriend struggles with basic algebra at community college. I'm working on writing my own book but my boyfriend makes frequent spelling and grammar mistakes. I enjoy political discourse, he tends to just follow what the news is pushing. A lot of my jokes and sarcasm go over his head.

But he's kind and cute and adorkable and I can't help but smile when I'm around him."
72,"You did the right thing. If my boyfriend was cheating on me and my best friend knew about it and didn't tell me, then he wouldn't be much of a friend, would he?

But to be honest I'm not surprised at the outcome, people don't want to hear the truth if it's not convenient for them. He'll catch the boyfriend cheating himself and come crawling back to you, just wait."
73,Stop pretending cheating is normal or okay.
74,Porn suggests that this is the logical conclusion. 
75,"Wow, looks good man!

Somebody gave you good advice. ;)"
76,"What he did was absolutely unconscionably wrong. In some countries that is considered rape: you did not consent to bareback sex.

Get through the immediate situation and on PEP, be as brave as you can and hold it together for now, but I would immediately talk to someone you trust about this so you can decide if you are going to press charges (if you can in your country). It's understandable you're feeling the way you're feeling, and there's a lot of professionals that can help you work through it, regardless of what you decide to do regarding him."
77,"After kissing and slowly sliding it in, I ran my hand thru his hair then said ""I want to be inside of you forever"".  I'll never forget the look in his eyes as he nodded yes, pulled me closer to him, whispered ""I love you so much"", and we had the fuck of the century.  The rest of the world completely fades away and just doesn't exist.  "
78,"""I can hear your mom next door..."" "
79,"&gt; No, you're going to find out who your *real* friends are. 

This, OP. I came out (somewhat accidentally) to pretty much my whole grade at my school. For context, I live in the deep, deep South, specifically Alabama, and around 95% of the people here are conservative Christians, including my family. At first, things were uncomfortable. I got weird looks, just like you, got called names, got asked uncomfortable questions, and several other things. Some of the people that I called my friends turned out to be unsupportive and shitty. But, something else happened. I was able to find out who my true friends were, the people who would support me when everything went to shit. These people didn't look at me any differently and gave me big hugs when I came out to them. I was able to start talking to them about ""gay stuff"" and they didn't care. Several of them tried to hook me up with their other gay friends, and the other ones helped me out in other ways. I built a network of people who supported me and loved me for who I am, when the rest of the school and even my own family didn't. I feel more comfortable and happy with who I am now than I have ever been before, and the feeling is just so amazing. I've learned over time to fuck the haters and live how I want to live, to be myself no matter how people look at me, and I'm so much better off because of that. 

So yeah, anyway. OP, even though it seems like your life is ending and everything is shitty, trust me when I say that it will get so much better. Those ""friends"" that are talking about you and making fun of you are not your true friends. Fuck them. Find your true friends, and once you do, things will be so, so much better. "
80,tumblr
81,I'm glad I have Trudeau 
82,"Do not deny it. At least say it's nobody's business, then drop it. Own it. Otherwise they'll smell blood and eat you alive.

Get out ahead of it."
83,"You need to separate your feelings for him from your friendship.

Make it very clear that you will be there to support him if and when he decides to leave his boyfriend. "
84,"I don't even understand the idea of ""letting someone"" masturbate. I could not fathom being with someone so controlling that they wouldn't even allow you to take part in one of the most basic human functions. Your partner has absolutely no right to tell you if you can masturbate or not. 

This one point alone would make me break up with someone because only a fucking psycho would tell their partner they're not allowed to jerk off. Even if the dude got a job and started pulling his weight, this is still incredibly controlling behavior. 

Your situation is fucked and I would give this guy the boot tomorrow if I were you. I know you said you're chubby and bearish, and that's exactly what a lot of guys are into. Don't tell yourself you wont find anyone else, because there's someone for everyone. It seems like you have some self-esteem issues that are causing you to let this mooch stick around. "
85,"Yeah then they take turn cumming in my mouth and ass, really gay lol"
86,i love to make out and cuddle more than i like going through with a full hookup.  even more into cuddling as i fall asleep with my head on his chest!!
87,I am 38 yo in good shape and 20-25 year old guys (25% of them) ask if they can call me daddy and I have no qualms. It's in good fun plus I embrace my age so it doesn't bother me at all. 
88,"This paragraph doesn't make sense. I'll tell you something personal about me. I've been working in customer service (clerk, cashier, waiter but mostly bartender) since I'm 13. Im now 23 and finishing my last year of undergrad. Its not that hard. 

Well, its *really hard sometimes,* but that is life. If you just keep enabling this behavior, he's going to keep absorping other areas of your life. Even worse than he is now as you've described.

Tell him to either get employment on campus or to move. You first, always. "
89,"My husband and I have been together for over 30 years, and we have friends who've been together longer than that. "
90,"He is still hanging out with you as normal. He didn't reject you. He rejected the idea of going out with somebody who has anatomy to which he is not attracted. 

Also, the best thing to do when rejection affects you that much is to purposely get rejected over and over and over and over until you just don't care anymore. "
91,Top Gun on DVD
92,"Hmm... I think guys with glasses are hot

Edit: Hot guys with glasses are hot."
93,"Sounds like their intolerance killed him

But their ignorance and religion blind them "
94,"/r/gaybros feels very ... read-only to me. so, not that interested in that."
