,text
193,"I'm the girl, here's one actual recounting. We met at a party. Danced a little. Drank a little. Talked a little (all the basic stuff, where do you go to school, what do you want to do in the future, what kind of music do you like/movies have you seen/books have you read). Moved physically closer and closer to one another over a period of about an hour or so, until it was so incredibly comfortable to feel his arm around my waist and to lean toward his ear to say something so he could hear me over the ambient noise. 

At one point, his mouth touched my cheek as he was telling me about a class he was taking. I turned slightly, his lips brushed mine. We smiled at each other, then leaned forward and kissed fully. Then I said something like ""It's kind of crowded and noisy in here, isn't it?"" and he answered something like ""Yes, and hot, too. How about we go outside for a few minutes?"" We went, then leaning against his car, kept talking for a while longer. Then he said, ""Should we get out of here?"" I said, ""Yes, we can go back to my place, but my roommate might be there, if you don't mind."" He didn't. 

We went. I offered drinks and snacks. He asked if I was getting tired. I said no, just the opposite. More kissing, escalating to touching. I led him to my room, we undressed, and sex happened (twice, and then a third time the next morning). 

Hope these are the kind of details you were looking for! :D"
194,Doing what you want without giving a flying fuck about what others think. 
195,The phrase #notallwomen reverberates in my mind now like a disaster alarm as a result of that sub.
196,"All are different.  There's a lot of childlike frustration I see online with men getting upset that they hear women say things like height/money/whatever don't matter and then they see women who clearly value these and similar traits.


I've known women who married ""down"" from their league because they met an honest, hard-working, good-future-father guy.  I've known women who all through their life ruin stable relationships to be with the abusive never-has-a-job douchebag. I've known women who are genuinely attracted to generally unattractive men.  I've known women who only date conventionally attractive men.


The difference is that when one person says what they like, they're speaking for .0000000000000001% of the population.  Just because you can go online and hear 10 women say they hate big muscles and fancy cars doesn't mean that a big muscular guy with a Ferrari isn't going to pick up the women that do like those things.


In general things like confidence and having your shit together (financially stable, in decent physical shape, etc) manage to attract most types.  But the specifics from there-on-out are completely based on the individual."
197,Events and dinner costing 50% less. 
198,I close the lid. The best compromise leaves both people unhappy.  
199,"Worst case scenario is to get shot down which happens the majority of the time. 

One memorable time. We showed up at this bar/club fairly early. Saw three pretty average looking women and thought ""fuck it, nobody else is here so I might as well try and talk to them"". I got about 5 feet from them, one turned to me and said ""You're not black, go away"". I laughed, turned around and walked away. "
200,Hell no.
201,"I still have no clue as to how to go around it.

I'm the boy who nobody ever wants to pair up with science practicals. I was bullied and isolated extensively in primary school, and don't really have many people I can truly call friends. A handful at best. Never had a girlfriend either outside of two tries on an app, and am afraid I never will. I don't belong, wherever I go, and whatever I do. 

I'm OK with being on my own. It's how I grew up, and it's all I've ever known."
202,Im pretty vanilla but ive always wanted to wake a girl up and then finish all over her. She has to enjoy it though.
203,I've done this! I always think about doing it to my current boyfriend but he always shows up at my door without notice so he out -romances me! Must find a way to do it again
204,"Apparently all women hate it when men show vulnerability and that's why men bottle up their emotions, even around their long-term girlfriends and wives. "
205,Because ugly women already have low standards. A lot of below average men still think they should be able to date up and that they shouldn't have to settle.
206,It's coarse
207,"Naked chicks and spinners, nice"
208,Hiding in flowers and patches of tall grass.
209,We dropped lsd and watched Bob Ross paint all night on YouTube while I kissed her butthole. It was a happy little asscident
210,A girl cosplaying sailor Venus... Or Katarina from League of Legends... Or Yoko from Gurren Lagann... Or all of the above. Basically a hot girl down to dress up as some of my favorite nerdy sexy characters...
211,A girl held my hand after I walked her across London to get her home
212,She mocks you when you aren't around too bud
213,I don't put the seat back down because you've never lifted it back up. If I have to take the time to check the seat then you can too.
214,"I also got banned for ""derailing"". "
215,Eh.
216,A dude gave me $50 so that he could suck my dick.  It was OK.
217,"I had something very similar happen to me last month. Made plans with this girl that I was kind of seeing and she told me, at the last minute while I was waiting for her at the restaurant, that she wasn't going to make it, after she texted me several times that she was getting ready to leave.

I texted her back 30 minutes later and said, ""that hurt"" and she proceeded to call me to tell me that my hurt feelings were not her problem and she wasn't responsible for them. I wish I could live my life without regard to other people's feelings sometimes but then again, I'm not a terrible person."
218,"I talked to a girl at a bar for a while in the smoking area. Nothing too flirty, just a nice chat then I went back inside.


Later, I went up to her to ask for a light and her entire friendship group *rushed* to push me away, yelling that she had a boyfriend and to leave her alone. Loads of people looking, and I thought I had somehow been a super creep or something. 


Spoke to her afterwards and she was totally chill and apologetic, apparently they had totally misunderstood and were being protective. "
219,Someone I do not find attractive.  
220,My guess is this thread will be locked by then. Good luck regardless.
221,"Many baseball players strike out more than they have a base hit, let alone a home run. I think you should just quit counting, it does you no good. Maybe adjust your standards and try something new, it really can't hurt more if this is how things are going.  "
222,"Sounds like a Disney film adaptation in the making. 

(Sarcasm)"
223,Stick a finger in the butt
224,Agreed. I'd probably also go to the nearest bar and end up a weepy mess tbh. Selfish but that's not how you see your little girl growing up.
225,[deleted]
226,"Diablo, as a young woman, I'd be happy to be your daughter. Great dadding 10 out of 10. Would adopt. "
227,"&gt; this one is pretty general

Let's be honest; this sub caters to North American men.

Even people from other western places are often a bit alien to that whole idiosyncratic North American ""first date"" stuff. I've never in my life been asked out, asked my number or whatever by a stranger; that just doesn't happen here."
228,Your comment has been removed for using a gendered slur.
229,Fuck that noise. I would win just so *she* didn't.
230,"&gt; i feel like the next time I see her she will kinda expect things to escalate more

You're assuming.

&gt; she's had some boyfriends before and expects me to know how to kiss :s.

You're assuming.

You're also thinking too much about it. Good kissing is something you feel out. So you know how in kissing, there's a general ""opening mouth into closing mouth into opening mouth"" rhythm that happens? A good kisser will be able to follow along with that rhythm. It's hard to find that rhythm if you're thinking too hard about it. Just slow down and focus on her pacing and try to match it. Learn her timing and open when she opens, closes when she closes.

Fun fact: Most people will generally kiss you the way they themselves want to be kissed. Pay attention to that and go along with it. Do they start using tongue? Throw in some tongue. Are they going fast? Slow? It's a dance, and it's about figuring out what kind of dancer they are. That said, if their dance is too...something for you, feel free to try and dictate the pacing. Are they being too aggressive? Try to kiss them more gently to simmer them down. Guide each other and learn from each other."
231,On watching the Eastern/Western Conference Finals. I think I'll just skip to the part where the LeBrons play the Currys instead because the Finals don't seem like they'll both be anything but blowouts
232,"Don't you know the rules to check if something is consumables if poisonous? 

Step 1. Rub on skin, wait 5 minutes. No rash? Proceed. If rash, discard the consumable.

Step 2 Rub small portion on gums, wash out mouth, wait 5 minutes. No itch? Proceed. If itch, discard the consumable.

Step 3. Consume portion equal to the size of pinky finger nail. Observe and record digestive reaction. Depending on severity, proceed with own judgement

Step 4. Eat exponentially with larger time gaps to Test gut function on consumables.

Step 5. Die because Im not a professional.
"
233,"When I told my girlfriend that I loved her. I was very nervous and it was only three months into our relationship but she smiled at me and told me ""it took you long enough"" and she pulled me in for a kiss. 

I feel really good about this one"
234,"He said British, not Canadian."
235,"Lol like why wouldn't you ever ask her to do this!? You want it, why not get it from the person you love the most? People are weird."
236,"I've pretty much asked her to do everything I've wanted. But there are some things I just don't really ask her for anymore, like spontaneous bjs to completion. She's not a morning person, so I wouldn't mind her being up for sex more at that time (since I'm up early every morning). "
237,"Your wife may be filling a hole insider her with something else. You should seek counseling, as a couple, before your daughter moves out. When she's gone, and it's just the two of you ... your wife will have nothing to anchor her. And then, my friend, you will be in for a wild ride. 

Do not be passive."
238,If you're wife wants to ridicule you about your sexuality insecurities on purpose I think you might need some help bud.
239,"Well that's a graceless generalization, BANNED!

I'm current banned for telling a (upvoted) joke. They said it was against the rules. When I asked how it was against the rules, they said they have to enforce the rules neutrally. When I asked what that meant and what rules they were actually enforcing they said they didn't think my joke was funny to be honest. That is literally the opposite of neutral enforcement. When I questioned that they made fun of me for not being able to do anything about it."
240,"&gt;That they jack off to us wayyy more often than we think. It's crazy man
&gt;But in all honesty, while I've known it all along, it always comes as a shock to me how starved for affection and kindness from girls many guys are, compared to the near constant validation we get. I try to be nicer to guys nowadays  

There is a reason many guys will assume a woman being nice to them means she wants to bang him. For some of us, it is a rare enough event to be easily misinterpreted. "
241,"Not my personal preference. I'm a serial monogamist. 

When I was single I was doing just fine, but I still personally felt not fully complete/missing another level of fulfillment. For some people, sharing your life and experience with someone with an intimate connection to you just makes everything that much richer, from the big experiences to the mundane chores of life. "
242,So tight you can tell what religion you are.
243,"You know, if you tease her enough and then demand this as a condition for kicking it up a notch, this is totally doable."
244,"Yes. But the bar is higher, you have to be established, and you don't get the best pick"
245,"Chicks actually dig forearms, this is good advice."
246,"Not that great.

I had my first date at 24, which was just a shitty one-time online thing. Then was set up through friends, dated that girl twice, didn't really see it going somewhere but definitely wanted to try to date her a little longer, but she blew it off. Then I didn't have any date for three years. Not that I didn't want to, but I don't know, it just doesn't come natural to me. Early this year I re-installed Tinder after using it for years without any success, and in the last two months I've had dates with three girls. One was a disaster, the other one I really liked but she blew me off after two dates, and the third one was at least somewhat of a success (dated twice, discussed that it wasn't really going somewhere, still boned a few times).

It's so goddamn difficult. Being single for so long has made me very independent, so I have a very low tolerance for mind games or doing 'the chase'. I would like a grown-up partner. Of course having this dating record, I'm not the most confident man around women, so that plays a role. And finally I just don't know how to meet eligible and at least somewhat attractive single women."
247,The top answer better be that we are all virgins.
248,[deleted]
249,Blink if you need help! 
250,"I really hope someone has done this, because I'm hoping to do this once I'm established in a career. "
251,Put his nighttime cereal bowl in the dishwasher and then plow me like 40 acres and a mule. 
252,"My penis is a measly 6 1/4 inches. Some of the porn stars have 8-9 dicks. 

Edit: 8-9 inch dicks lol. "
253,I'd be content with just having more sex. I no longer ask or try for more sex because it's a waste of time to do so and never get it. 
254,Having sex with a girl... and getting girlfriend.
255,"Threesome.

I just know better. She's from a conservative background and hasn't explored much. Beyond that, we have stellar sex, I just sometimes fantasize. Asking her would just hurt her, so I'm content with not doing that."
256,He was in line. ðŸ™
257,"Better than if she hadn't

Source: Brother of pregnant 14yo sister"
258,"Men not showing emotion or vulnerability


No shit, we learned not to be emotional or vulnerable because we receive serious social consequences from both men and women for it (and from my experience, more from women, and more serious qonsequences. 

Women will say they want their man to be in touch with his emotional side, until he has a breakdown or cries, then she vanishes like a ghost. Every single time. "
259,"Man...the grass really is greener, isn't it?

My SO refuses to let me be on top. We can kiss and foreplay with me on top, but the MOMENT pants come off, she dead fishes until I let her on top. She'll pin my hands behind my head, and demands that I arch my hips - no bucking, no thrusting - while she rides me.

It's fun, sure, but man sometimes do I just want to be on top."
260,"I started late. 

The pro to this was that I knew a lot about myself and who I am and who I want to be. Also through observation, I knew how to be in a relationship. My girlfriend even told me early on that she couldn't tell I was in my first relationship.

The drawback to starting your intimate life later is constantly wishing you had started it sooner and had more experiences."
261,So unplug me maybe 
262,"Bodybuilding. 

Honestly, it's not a sport. It's a pageant.

I realize there's a lot of hard work involved, but it is simply a beauty competition. Even gymnasts and figure skaters have to execute their routines flawlessly. "
263,"Also, living in the USA."
264,Very much so. There is a reason that the number of women on r/askmen is so infamously high compared to in reverse and that's basically because a lot of women who don't fall into that stuff come here.
265,I want to date someone that loves me as much as much as I love them 
266,"It's called race walking and it sucks balls. And yes, tis an olympic sport."
267,Most people don't want to be in that situation with their sibling.
268,Women are more judgemental of men than I'd realised.
269,http://en.wikipedia.org/wiki/Stockholm_syndrome
270,Monogamy. It's sad that it's broken so often.
271,"I've been riding off my high from ""I like your shoes"" I received ~3 years ago. Good times."
272,"Just what you want when you're trying to have sex - a fussy, inanimate wife. "
273,"Wow. I've never seen so much consensus on a reddit thread. Almost every comment is ""that subreddit does not represent any actual women I know"""
274,The pizza has evolved to seek shelter from predators.
275,"80's hair metal bands do a decent enough of a job. Tight leather pants, enough to show detail between the shaft and head are key."
276,"Men are sexually predatory. 

Only because 1) a woman will generally never make the first move and 2) yall love being chased around by (attractive) guys. I can't imagine anything more validating. "
277,"I love head, but I also love not dying in a fireball."
278,Lol. The exact thing the person you replied to was afraid of.
279,"Replace ""chocolate"" with ""beer"" and you have my problem down. "
280,another explanation. Imagine how irritable you would be if you were walking around and had a bunch of sand in your vagina (or asshole)
281,"First and foremost, what I said is the fucking truth.  I've already had a few guys reply with their own personal experiences agreeing with me.  If you ignored girls when your hormones were starting to explode and go on your first date in your twenties, it's going to be difficult.  It's going to be difficult because you have a lot to learn and it's going to be difficult because while most of your peers went through their phase of stumbling and struggling to figure out how romance works they were surrounded by people who were going through the same thing, meanwhile you're going to be surrounded by people wondering why you're so socially awkward around women.

And that's the truth.  Does it suck?  Of course!  But should I lie instead?  When a guy comes here, a place where men can ask other men weird and awkward questions free of judgement and ridicule, instead of telling him the cold hard truth should I tell him everything is gonna be fine, you have nothing to worry about, and give him about 7 seconds of feeling good while leaving him thoroughly unprepared for what he's about to actually experience?

Not only does lying do no good, it could actively harm people.  If everyone on this thread says that a guy starting to date in his 20's is in for a struggle then when he goes out and has trouble dating he'll understand that's normal and keep trying.  If we all tell him he has nothing to worry about, that missing out on up to a decade of social development will have absolutely no effect on him and then he goes out and repeatedly strikes out with women he's going to think that there's something fundamentally wrong with him. "
282,Being attractive. /r/amiugly says I'm below average.
283,"To be honest I think I've learned more about myself here than guys. Don't get me wrong, I've still learned things about guys that I will use for the rest of my life. But mostly I've learned here how to act around guys. I was (and still kind of am) homeschooled growing up, I never got to talk to boys my own age. I had very few, but close friends. All of them were girls and from the church I went to. I never learned how to socialize with the opposite gender. Because of this I thought that being bitchy, cold, and standoffish was the only way to act around guys. I went to a public school briefly in the sixth grade, I was a sweetheart to the girls and teachers there. But when it came to guys, I was rude and insulting. To my suprise non of the guys wanted to be my friend, for a few years there I avoided all guys my age like the plague. Why bother trying to get to know them when they're not gonna respond back? I came across this sub about a year ago and started reading threads about what guys thought was unnatractive, one thing I noticed was a lot of guys saying how they hated when girls were mean. That's when I realized that the problem wasn't guys, it was me. I've not only began to be nice to guys, but I've also started being nicer to just everybody in general. It's amazing how much nicer guys are to me now that I'm not insulting them and putting them down! I feel incredibly guilty for the way I treated guys back then, and I wish I could apologize, but I have no way of contacting them. I'm so grateful for this sub though, it has really opened my eyes to my behavior. 


Oh, I've also learned that sometimes when guys sit down while peeing, there penis touches the side of the toilet bowl. I shudder just thinking about it and I don't even have a penis"
284,Marriage
285,Plus relationship sex &gt; single sex in my experience.
286,"When they can't handle basic adult tasks like cleaning, cooking, paying bills, etc. combined with being unwilling to make the changes necessary to be able to do so."
287,"The first thing I did was put myself out there. It was very uncomfortable and outside my comfort zone but once I realized that I could get a number and go it put things in perspective. I had to learn that women aren't a mythical beast that I have to solve a riddle for. I had realize that I had talk to them like any another person and hope they'd like me, if not oh well.

The second thing I did was dress better and give a crap about my appearance. I'm still single but it's no big deal from getting a number to meeting someone anymore."
288,Finance. I let excel do the math for me. 
289,"I don't buy more than I can absorb in a day. Food rationing never works for me, so I just don't buy big quantities whenever possible."
290,"""I'd be my wife too"""
291,"Usually this is just a phrase people toss around to shame someone into doing what they want that person to do. 

Outside of that it is someone who lives in perpetual adolescence. That can be someone who has failed to launch or is a ward of the state. It is someone in a perpetual state of immaturity.  "
292,"&gt; Because an obligation blowjob is so much worse then no blowjob.

Ah, yes. I call this one ""The Business Transaction"""
293,And gets everywhere 
294,[deleted]
295,"All the bitches she works with.

""Every woman got a woman at work she hates. And it's always some Dynasty shit.""------Chris Rock"
296,I mean it is abnormally late.  Most people start dating around 15 and there's a lot of learning that goes on in those five years.  Anyone who goes on their first date after 20 is going to have a hard time adjusting. 
297,A girl once talked to me that isn't my cousin.
298,I started that way and moved right as I started getting raped by taxes and realized I don't even like people. 
299,"The movie youre looking for is ""Inception"""
300,"I had a comment removed for using the term ""karma whoring"" which apparently is a ""gendered slur"". The OP was asking what aspects of Reddit do you dislike, and I wasn't even referring to women - only to low quality unoriginal comments. Ever since then I keep my interactions there to a minimum. 

On another note, has anyone yet created an alternate version of Ask Women that isn't run by NaziMods?"
301,Ty
302,"Hey, I just met you"
303,"Woah woah woah.. ""their""?"
304,"Sit on my face, and tell me that you love me..."
305,[deleted]
306,You def should have dumped her and not given the honest reason. Damn dude.
307,"It would either be a ffm threesome with two ladies that are just as into each other as they are me, or watching an incredibly hot and kinky couple have sex in an intimate setting"
308,Maximize your own options while limiting others 
309,Woman here...Something about facesitting makes me feel insecure. I'm super open sexually but for some reason this position is somewhat uncomfortable for me. I find it unusual that men actually desire this.
310,"* Tanks

* Planes 

* Guns

* Star Wars

* Star Gate

* Pasta 

* Halo

* Mass Effect"
311,"Honestly, same thing. My girlfriend says she would be against it but I tell her that even if we try to bar a future daughter from having sex, she will find a way if she wants to. The best we can do is provide a safe and understanding environment for it to happen."
312,"I love the accent, especially when they say
""Hello, Love"" or offer you a spot of tea.
"
313,"Just the time aspect, in a few ways. 

My wife is pretty disorganized, and if we're going somewhere, it always seems to take an extra 10 minutes to leave because she forgot her wallet/phone/keys/sunglasses. 

Also she's more social than me, which means we go to more social stuff, and stay much longer than I normally would. Single me at a party would stay 2 hours or so, then do a quick goodbye and go home. With my wife she has to have a 5-minute conversation with everyone at the party before we leave. "
314,"Whatever she likes to borrow, tell her an ex gave it to you."
315,"First date.. drinks and all that.. back to my place.  We're getting down and during a break she noticed [a set of nunchucks](https://www.karatemart.com/images/products/main/studded-nunchaku.jpg) I had and made a comment like ""Lol.. studded for her pleasure"".  Then she just grinned at me and said ""Wanna fuck me with them?"", so I did."
316,I had a friend who was in a long term relationship at 15. We're in our 30s now and she married him. 
317,Dank emojis and fake kisses at the end of each text! 
318,"Even if its not my house, the paint is my kingdom"
