,text
80,"It's tempting to look at how much more easygoing this sub is than askwomen and conclude men are more chill or whatever, but I think the mod crew kind of sets the tone and attracts the kind of people they're looking for. It's too bad that for every ""I just killed a spider, how were you a hero today?"" there are 10 posts about listing all the ways life was unfair to you recently. I don't believe that's indicative of womens' general opinions or experiences but when the rules are that strict, there's a limit to how much fun you can have. 

It seems like the rules there are oriented towards a siege mentality, here they're just about making sure people aren't dicks to each other."
81,That's actually kind of funny in a painfully accurate kind of way
82,"To be fair, this sub is quite the echo chamber too sometimes, which can get quite tiring"
83,"A shirt that shows a lot of chest. 

Tight jeans. 

So the same as women apparently..."
84,"Started dating around 22 it was pretty shit at first. Lots of confidence/self esteem issues and lack of dating experience.

I'm now 24 and it's still shit but at least I'm somewhat comfortable with myself."
85,"Mostly just raw, animalistic enthusiasm. When I first went out with my wife, we were having sex, and she was on top and basically making this high-pitched noise while riding me. 

Other than that, just being up for whatever kinks I brought up. "
86,And your odds at least double if you remove sexy and make it insane girl!
87,"Final semester of college, had all my finals over the course of two LONG days. I trudged home flopped down on the couch to pass out and suddenly lips on my good bits. She blew me, cooked dinner, blew me, and proceeded to ensure I was pampered and blown that whole weekend. "
88,"Egg salad sandwiches. They look pretty weird but oddly quite delicious. 

"
89,"Gotta love the catch 22 of wanting her to spontaneously jump me of her own accord but suggesting it means it will feel like she's just trying to appease me, so it's not really spontaneous. "
90,Lmfao. R.i.p to your penis 
91,"I prefer having a girlfriend, but I'm comfortable enough with myself that I can handle long periods of singularity. 

"
92,"That I kind of resented missing out on a lot growing up. A lot of the experiences my partners had were missing from my life, and it sort of puts you at a disparity. They're wanting to settle down and have kids, while I'm still at the playing the field stage."
93,"&gt;sounds rapey

Lol even sex sounds rapey to them"
94,"If you think her schedule is going to magically get easier after grad school and getting that job she wants, I have some news for you."
95,"Men are like dogs.  We like cuddles, scratches, meat, salty foods, protecting our pack, being looked up to, getting our hair groomed, playing with sticks, chasing random things on wheels, and never have a clue why people get mad at us, even if there is a very clear reason.

Edit: my highest rated comment so far is about me calling myself(and half of earth's population) a dog.  I have succeeded at reddit."
96,Damn these hos and their strict blessings. 
97,"Express regular fit, basically."
98,Isn't reddit great?
99,"Mods* and yeah, they're vile beings. "
100,"THIS.

The world is so much more complicated than whether you get accepted or rejected by ONE person.

A lot of things make me happier than women."
101,[deleted]
102,Obviously what I meant to say was that you've got this buddy!
103,"i received a ban for replying to a comment with ""men aren't out to get you"""
104,"You have to be ready with some quick bantz. I would have said ""if you think me talking to you is embarrassing, remember the only thing worth complimenting were your boots"""
105,"It hasn't changed that much. I am well aware that that sub caters to a specific group of women, just like there are subs that cater to specific groups of men ( this one is pretty general).

It did surprise me somewhat, just how sensitive women can get ( with the whole ""disagreement means invalidation"" bullshit)."
106,"I've spent long stretches of time single. On purpose. Longest was 5 years.

For me, sex and relationships aren't a requirement for me to be happy...

They're nice, but I enjoy my own company. So not being hung up on being with anyone means I can be picky, and can remove myself from a bad relationship with relative ease.

Being single, to me, isn't the worst thing in the world. It's one of the best, actually."
107,Swimming pool is terrible
108,Goddamn that's so true. You're not even allowed to make jokes over there 
109,"Get a blowjob from 2 or 3 girls at the same time. 

Giving deep anal "
110,"Ironically, it's best to start with having no expectations. Beyond having fun and maybe meeting interesting people. You're open to what the night brings.

You're not worried about flopping because you're not going to hit on every girl you talk to. You'll talk to anyone and everyone. But you're only going to escalate with a girl who's receptive.

You're not in your head, over-thinking it. You just take the next step if it feels natural. 

You see someone across the room. Does she make eye contact? Does she look away--but then look back? Does she smile? Green light.

Go over and talk to her. Keep it simple, don't use an elaborate line. Ask her about what she's drinking, make a quick comment on the music, etc. 

Then introduce yourself. Get to know here a little bit. Tell some stories.

If you see some opportunities to crack jokes, tease her a little, do it. However, try to stay away from self-deprecating jokes, it's too easy to seem like you're seeking her approval. 

Pay her the ultimate compliment you can give anyone: listening. You don't need to constantly come up with new things to say. You can play off of what she says. If she's giving one-word responses, might be better to just gracefully bow out.

Don't worry about being witty, just concentrate on being *present.* Be with her in the conversation, not in your head, judging every thing you say. Make her feel like she's the only girl in the room.

Body language helps. Turn your body towards her. Practice good posture, which makes you look confident.

Let the conversation flow naturally. If you have a different opinion on certain issues, don't be afraid to voice it. A little arguing can be good foreplay. Don't agree with everything she says just so she'll like you. What she'll really like is a man who stands up for what he believes in.

Eventually, there might be a lull in the conversation. Check in with yourself: is it an uncomfortable silence, where you just want to get out of there? Or you'd love to stay in each other's presence without saying anything? Or maybe you're both nervous but don't want to leave each other? (that's sexual tension).

If you feel one of the latter two, suggest you both should go somewhere more private. Leadership is sexy. 

Not necessarily leave the party yet. Maybe go outside for a smoke, a quiet corner, or out on a balcony by yourselves. Create a plausible excuse, e.g. ""It's really noisy in here, want to go outside for a bit?""

As you're walking together, this is a good opportunity to break the touch barrier. Offer her your hand or elbow, because you're such a smooth gentleman. Or touch her lower back to guide her through the crowd. Touch is confidence, touch is saying you're comfortable with being physical.

When you resume the conversation, try standing closer. Maybe touch her shoulder or arm more in response to what she says.

Does she mention being single, or having recently gotten out of a relationship? Does she mention her roommate(s) being out of town and she has an apartment all to herself? Or is she from out of town and feeling lonely? She may be setting the stage for you to make a move.

She finally laughs especially loud at something you say (even if your joke wasn't funny). Does she keep looking at you and smiling? Giggling? Staring at your lips? Even better, does she mock-punch you and/or push you away (""You're too much!"")? Consider kissing her.

Have fun making out with her a little. She'll be more free to kiss in private, since she doesn't have to worry about being seen by her friends and other guests, and being judged. If you're both up for more, go to your place or her place.

Depending now how good the chemistry it is, you could use an excuse like watching a movie, or just simply ask directly like, ""You wanna get out of here?""

Flirt publicly, kiss privately and reserve sex for when you're totally alone together.

California1234567 had a good post from the girl's POV:

I'm the girl, here's one actual recounting. We met at a party. Danced a little. Drank a little. 

Talked a little (all the basic stuff, where do you go to school, what do you want to do in the future, what kind of music do you like/movies have you seen/books have you read). 

Moved physically closer and closer to one another over a period of about an hour or so, until it was so incredibly comfortable to feel his arm around my waist and to lean toward his ear to say something so he could hear me over the ambient noise.

At one point, his mouth touched my cheek as he was telling me about a class he was taking. I turned slightly, his lips brushed mine. We smiled at each other, then leaned forward and kissed fully. 

Then I said something like ""It's kind of crowded and noisy in here, isn't it?"" and he answered something like ""Yes, and hot, too. How about we go outside for a few minutes?"" 

We went, then leaning against his car, kept talking for a while longer. Then he said, ""Should we get out of here?"" I said, ""Yes, we can go back to my place, but my roommate might be there, if you don't mind."" He didn't.

We went. I offered drinks and snacks. He asked if I was getting tired. I said no, just the opposite. 

More kissing, escalating to touching. I led him to my room, we undressed, and sex happened (twice, and then a third time the next morning).

Hope these are the kind of details you were looking for! :D
"
111,"Went up to a girl at a bar and complimented her on her boots

She called me a genetic abomination, told me I was embarrassing her by thinking I had a shot, and told me to ""fuck off""

So yeah, it can get bad"
112,"At this stage: to have sex again would be nice.

Otherwise (not necessarily at the same time): 
* in public.
* in a swimming pool.
* threesome (2 girls).
* a swimwear model.
"
113, Punch you in the balls
114,"&gt;now I'm concerned I can't trust her.

Pretty much the end if it was me. Yeah, you could forget to refill it, but if you regularly take it I don't see how you could forget for an entire month.  "
115,"&gt; I mean it is abnormally late. Most people start dating around 15 and there's a lot of learning that goes on in those five years. Anyone who goes on their first date after 20 is going to have a hard time adjusting.

Those are such shitty things to say. This is a place where a lot of insecure men try to find solace, how is it helping anyone to be throwing around arbitrarily cut measuring sticks?

Fuck normal. Some people have a harder time than others getting out there. Good for them for trying. Who cares about being early or late? That's someone's life, not a fucking middle schoolers' competition.

Anyone who goes on their first date, that's great, period. Whether you're 12 or 90, godspeed. Who cares about adjusting being hard at first? That's not a fucking choice. ""Oh, you're 21, too bad man, it's gonna be harder than it could have been. Better give up on your life then.""

Come on, man. Take a step back, look at what you're writing and where you're doing it."
116,To be lent out to her single friends as a teaser tom.
117,TLDR: I ate it. and I am still alive.
118,"Essentially that guys are actually extremely emotionally ""feminine"". Like, cuddles, affection and love, ya know, girly shit.

Also, I think women tend to simplify men, and don't imagine them complexly. "
119,"I was just standing around at a club and a girl who was as tall as me or a little taller grabbed me, held me close and gave me a kiss that I felt in my whole body. 

It came out of nowhere and it was actually a great kiss."
120,I think you can't complain about a dry spell if you've only tried to get laid 7 times in 3 years dude. That's once every six months.
121,Those 4 antarctic girls must have a long waiting line.
122,Mean Girls.
123,"Holy smokes I didn't want that to end. I'm a sucker for ""falling for a stranger in a foreign land"" stories. Sounds fantastic."
124,Long term at 15? 
125,"&gt;I'm up early every morning).  

You're a fucking disgusting pervert, is what you are.

"
126,"It's higher standards for a single parent regardless of sex. Only one source of income, one caretaker, no backup parent if the dad becomes disabled, sick, dies etc...."
127,"Tinder.

*Oh a coworker has matched me ok lets see what happens*

""LOL MY FRIEND TOOK MY PHONE AND SWIPED ON YOU""

""LIKE YOU HAD A CHANCE SCRUB GONNA POST YOUR MESSAGES TO INSTAGRAM NOW #MENARESOTHIRSTY""

brb, gonna go build an emotional wall."
128,"MEN DESERVE MORE COMPLIMENTS.

Seriously tho, I sort of feel bad that men doesn't get a lot of compliments like women, but I think they should. We all deserve to be complimented &lt;3"
129,"Having nothing going on in their life but the relationship, I can't be in your life 24/7, it's just not possible or healthy"
130,"Hah, I get it, you're blind because you have no ""I""s"
131,[deleted]
132,"TL; DR:

This thread on Askmen: mostly surprise blowjobs.

Same thread on Askwomen: mostly marriage proposals.
Make of this what you will.

PS:  made the exact same comment on Askwomen; removed for derailing. 
Make of this what you will. "
133,"A lot of the comments say that women on r/askwomen don't represent the women in real life, I wonder if women think the same thing about men when they browse this subreddit."
134,I lowered my standards. Wound up dating a very nice girl who wasn't as attractive as I'd typically go for.
135,"Exhibit A: This thread.

The difference is that in this sub if you say something that goes against the circlejerk you'll be downvoted. But if you go against the circlejerk in AW your comme... [removed]."
136,No one gives me crap for having a gay friend.
137,"just turned 20. Became extremely liberal in a lot of stuff. I was always liberal but now i passed from militant liberal in a lot of things to don't give a fuck liberal. 

do whatever you want to do, gay, bi, transgender, identifies as a whale. I don't care and do it. It doesn't affect me. "
138,"Done it a couple time, it's really not that great.  You basically get a chick in real life is a little more attractive than most girls, but half the town has seen naked.  She also gets paid to grind on fat guys in sweatpants and has working hours when you want fun.  It's hard to keep that fresh feeling in that relationship. But by all mean, try it once.   "
139,Phrasing
140,"&gt; My ex-fiancee

Get in line."
141,"A subreddit is a representation of its mod team. As one of the users notes below, the women who run the place have been pretty awful, hateful people for the most part. That's going to breed an awful, hateful discussion place. 

I would never, ever use that subreddit as a basis for my opinions on women. "
142,Removed for derailing.
143,"That they jack off to us wayyy more often than we think. It's crazy man
But in all honesty, while I've known it all along, it always comes as a shock to me how starved for affection and kindness from girls many guys are, compared to the near constant validation we get. I try to be nicer to guys nowadays "
144,I went do a buddies bachelor party this past weekend. Woke up the next morning and decided I need to date a stripper. 
145,"This is a context dependent situation, though. Sort of like, your girlfriends teasingly calling you boy vs. that classic scary cop movie where the white sheriff calls a black man boy. If my dude friends call me a girl I don't think twice about it, but if I'm in a situation with my boss where I'm expecting him to take me seriously and to exhibit that and he calls me girl, it's gross."
146,She took it straight out of her ass and sucked it. That bitch was a *freaaaaak*. 
147,Like [this](https://www.welt.de/img/bildergalerien/mobile164429696/7452503557-ci102l-w1024/Slavko-Kalezic-from-Montenegro-perf.jpg)
148,I'm a female and i seriously need to step my game up
149,"Women complain about how there's a lot of men who just want sex and are players with no feelings. However I have found women start off assholes at a young age, and a lot of male players are that way because they got fucked over by some girlâ€‹. "
150,This is some /r/restofthefuckingowl crap
151,"&gt; gonna go build an emotional wall.

**AND EVERY WOMAN AFTERWARDS WILL PAY FOR IT!!!**"
152,"It really doesn't have to be weight, but the nice thing is that it's very strenuous, can be done quietly alone, and takes concentration so you don't have to think. Personally, I prefer taking a hockey stick and a ball and doing some slapshot practice. Focusing on form and just the repetitive violent nature of slapshots makes it a great way to bleed off stress for me."
153,:D
154,"Thats the sorta mile high club I like, and it aint too cramped too."
155,"Avoid housework.  If you consistently complain about HOW the chore is done I'm gonna eventually think ""I suck at this"" and stop doing it."
