,text
156,"Here are some flirting tips.

As a general guideline:

* What's subtle to you is invisible to him.

* What's obvious to you is subtle to him.

* What's obvious to the point of embarrassing to you, is starting to be visible to him.

Not sure if girls plan it out or just do it naturally, but what works best on me is when girls have ""warmed me up"" a little first with casual conversation. So that when they do finally ask me out, it feels natural and it's easy for me to say yes.

The following may seem like a lot, but many women have gone through many of the steps in one conversation, and closed by asking for the date. Some girls are really smooth.

Here is the process:

* Bring up some excuse to talk to him: class, work, etc.  Then transition into talking about interests and your personal lives.

* Express interest.  Put away your phone, maintain eye contact, and be attentive. Lean in closer to him when he talks. Forget about playing hard to get--that just makes it easier for the guy to think you're not interested. Be engaged in the conversation. 

* Flirt. Girls who are flirty with me from the start will stay out of the female friend-zone.  Be careful with teasing though; some girls don't know the difference between light playful teasing and hurtful insults. When in doubt, err toward being *complimentary* rather than critical, e.g. ""Ooh, I think it's hot when a man [does X],"" not, ""You'll have to learn to [do X] if you ever want to get a girlfriend."" Breaking his balls is not sexy. Stroking his ego is.

* Compliment his appearance.  Guys hardly ever get appreciation, so you'll stand out immediately.  Seriously, I and my guy friends will puff out our chests for a week if we get a sincere compliment from a girl who isn't our mom or relative. **However, make sure to compliment *him,* not just his clothes** (this is a common mistake since clothes are how women compliment each other). Otherwise, he'll assume you like his clothes and shrug it off.  Lots of articles advise women to tell men, ""Hey, I like your shirt.""  Only to have the guy completely miss the hint she was into him. Compliment his face, body, skill (guys pride themselves on skill) etc. Women want to be more than a sex object; men want to be a sex object.

* Offer your phone number first before he asks.  That one is a blatant green light for me.  But get his number too, if it was an accidental meeting and you might never see him again.

* ""Direct approach"": Ask him out on a ""date.""  Actually say the word, ""Date.""  Hinting he should ask you out often does not work.  If you use subtlety, you'll complain to your girl friends later how he doesn't notice.  Use your words and you could be on a date with him tomorrow. Edit: this is more effective in person, not over text or e-mail or Facebook. Via technology, the guy might talk himself into thinking you're joking or you meant that for someone else you were chatting online with. 

* ""Self-invite"" date, e.g. when he talks about a cool bar/restaurant/whatever he discovered you say, ""I'd love to go there! Are you hitting it up later this week?""

* ""Reminder"" date, a good follow-up to the ""self-invite"" date: ""Hey, when are we going to that great bar you told me about?

* ""Student"" approach: you see a guy who's good at something, e.g. throwing darts. You introduce yourself and ask him to teach you. Commence flirting.

* Shy Girl's Stealth Strategy. The girl suggests cool upcoming events: new movie, concerts, shows, etc. Naturally weaves them into the conversation. Eventually one would catch my interest and I'd just react and say, ""Yeah, I'd love to go to that."" Then she says, ""Great! Let's go together on Friday. Meet me at seven."" So smooth that I'd only realize *hours* later she had set me up to ask me out.

* If you want him right now, try to get him alone. ""Hey, it's kinda loud in here, want to go outside for a bit?"" If you really want to go further, suggest splitting a taxi or inviting him back to your place. Or if you're going to his place, ask him to see his bedroom, and make a move on him then.

* Physical touching.  Guys are taught to keep their hands to themselves around women, so a guy will definitely notice if a girl breaks the touch barrier.  You don't have to grope him, but touch his arm in conversation when you're emphasizing a point or laughing at something he says.  

Here are some bolder moves, more suitable for a party/nightclub/bar situation.

Bold: put your hand on his thigh.  

Bolder: sit close to him and press your thigh against his thigh. Or if you're sitting across from him, rub your foot against his leg.
 
Boldest: sit on his lap and put his arm around you. Some girls ""trip"" and fall into guy's laps. Like a dumbass, I've helped girls stand up and sent them on their way, when they actually wanted to talk to me. The more persistent ones stuck around and talked to me anyway.

If you're dancing, dance closer. Grind your body against his.

Keep escalating unless he makes it clear your advances are not welcome. 

**Negative tactics**  

Some girls do these things to attract guys, but they actually repel guys. These should go without saying, but I'm including them for the sake of covering all bases.

* Try to make him jealous.  Flirting with other guys in front of him, talking about how you get asked out a lot, etc. Some girls do it thinking it lets her crush know she's ""in demand."" In most cases, the guy treats it as a sign of *disinterest,* e.g. ""Damn, she flirts with all those guys but never flirts with me."" Or he might actually be disgusted by it.  ""Jesus, no way would I want a girlfriend who flirts with every guy around her."" The problem is girls are turned on by competition in relationships, while most guys are turned off.  

* Complain about guys trying to physically escalate with you. Some girls do this to plant the idea he should make a move. Reverse psychology. This backfires, because the guy will assume the girl doesn't want *anyone* to make a move on her. He doesn't want to be labeled a ""creep"" like all those other guys, so he does nothing. Then he gets confused later if he hears from her (or through her friends), complaining how he never made a move. Disclaimer: not all girls do this.  

* Criticize any girl he's dating, e.g. ""Nah, she's no good for you"" (""Because I think *I'm* right for you!"").  Worse, be rude to the girl if he introduces her to you, e.g. ""Oh, so *you're* [name]"" (looks her up and down to size up the competition). 

* Open the conversation by insulting him.  house_robot explained this really well in another thread.  

Quote:
&gt; 
&gt; When a girl says, ""Oh you're a player aren't you?"" its similar to when they say shit like, ""Oh you want me to go home with you? You sure you don't have other girls there already?""
&gt; 
&gt; Its the female approach to giving a man a compliment: passive aggressively, and couched as an insult. Shes letting you know you have desirable qualities.
&gt; 
&gt; When girls say this type of nonsense to you, never confirm or deny it.

It took me a while to realize this was a thing. I'd meet a new girl, she'd break my balls, and I'd be turned off. Hear later she liked me. WTF?

The key thing is to make it obvious *you're treating him differently and better* compared to other guys.  Like if he sees you hugging every guy, then he'll second-guess your interest and think you're just being friendly if you hug him.  

I thought this was a good example from a past AskMen thread titled, *""Men who have had women make the first move on them, how did she do it?""*

The user deleted their account, but this story was still up. Might be too aggressive for some, but the girl's confidence was attractive.

&gt; My personal favorite: As I was randomly leaving a bar, a girl I'd never seen before grabbed my hand and said ""You can't leave! you're so cute!"" 

&gt;I told her she was very sweet and very cute herself but that I had to leave and that I had a girlfriend, and she goes ""Noooo! Can I at least give you a hug?"" I said of course and she gave me a quick kiss on the cheek during the hug and said ""Sorry, I had to! Your girlfriend is very lucky!""
&gt; 
&gt; Speaking of the girlfriend (still my SO today) she was my good friend a solid year and change before we started dating. One night after some wine she asked why I never was into her, while swearing that she wasn't actually into me.
&gt; 
&gt; The next day when I brought up the conversation to her she said ""yeah well maybe I was lying about not being into you."" I told her that I think she's awesome but that I don't date my friends, and she replied ""We'll see.""
&gt; 
&gt; She spent the next month and a half just being super cute, sweet, thoughtful, and adorable towards me, even after I told her again I wasn't going to change my mind. Eventually, I did.
&gt; 
&gt; I later learned from a mutual friend that she confided that (paraphrasing), ""I know he's not going to change his mind, and I'm okay with that. But I still want to make him happy and be an awesome friend to him, even if it won't make him like me. He deserves it.""

The worst thing that can happen if a girl is too subtle in her flirting: [case study video](https://www.youtube.com/watch?v=qtsNbxgPngA). I'd watch it again without sound to see more of her signals she's interested.

Hope this helps. Good luck."
157,"I'll focus on the useful advice, although there was plenty of the other kind too.

**Mom:**

She would warn me about the games that some women played on men. 

My theory was that she'd seen her brothers end up with the wrong women, and she was worried I'd suffer the same fate as my uncles.

**The Cute Approach** -- She bats her eyelashes, uses her baby-talk voice, fakes stupidity and/or incompetence, etc.  Gets you to play Daddy.

**The Angry Approach** -- Questions your manhood, compares you to her friends' boyfriends/husbands who do those things for them, etc.  Tries to get you to ""prove"" yourself to her.

**The Pity Approach** -- Tears, crying, accuses you of not loving her, makes you feel guilty and abusive, etc.  Wants you to be the caring protector.

**The Seductive Approach** --Self-explanatory.  

They don't necessarily happen in this order.  Although the cute approach tends to be first and the seductive approach usually comes as a last resort.  

It's really hard to deal with at first, especially the pity approach where it triggers your protective male instinct and guilt at appearing ""abusive.""  Most (decent) guys cannot stand feeling like that and cave in. 

One more:

**The Reasonable Approach** -- She talks calmly to reach an agreement on your mutual needs, and works out a compromise that leaves you both mostly satisfied.  Most of the women I've met who do this are quickly scooped up into stable relationships or happily married. 

Mom also warned me about unstable girls who try to get guys to save them. Nice guys are really susceptible to wanting to be heroes and rescuing them. You'll try to lift them up, but they'll end up dragging you down. Don't let a girl emotionally blackmail you by threatening to hurt herself or you. A relationship is not a hostage situation.

Re-reading that, wow that is such a cynic-fest. I should add that she's given positive advice too. But it's the negative stuff that sticks in my mind.

**Dad:**

A suit on a man is like lingerie on a woman.

Don't shower her with compliments. Be the kind of man she'd love to get one compliment from.

If you ask her out, anything she says that isn't a ""yes"" is a ""no.""

No matter what she says when she's flirting, if she stands you up, she isn't really into you.

Your commitment has value. She has to earn your attention the way you have to earn her affection. 

What her friends are like is what *she's* like when you're not around.

How her mother treats her father is how she'll treat you.

What she says about past boyfriends is what she'll say about you.

If she doesn't have hobbies, her relationship is her hobby.

Beware if she seems to be living a lifestyle beyond her income. Expensive clothes, nice car, luxury apartment, knows all the best restaurants, etc. Someone else might be paying for it. If you date her, you'll be paying for it.

How clean she is, is how organized she is in other parts of her life. The converse is also true.

One of the hardest relationships to leave is if you and the girl click in every way--except sexually. A couple's sex life usually defaults to the partner with the lower sex drive.

If she gives you an ultimatum between choosing what's best for you and staying with her, choose yourself. 

For context: he said this when I was telling him how some of my high-school friends were planning to follow their girlfriends to colleges, regardless of whether the college was right for them. Most of those relationships failed within the first few months, leaving the guys stranded in colleges they didn't want to attend. It's simpler when you're younger. It's more complicated if you're older and married.

Don't get so focused on chasing the girl in front of you that you miss out on the girls around you who might be more interested. The girl in front might be higher maintenance than the friend who has a crush on you. 

Right girl, wrong time can hurt more than wrong girl. 

Man, how right he was. The obviously bad relationships were painful but you get over them. You know why they didn't last. But meeting the right girl and losing her due to wrong circumstances? Oh man, that haunts you for a long time.

Naturally, I thought I was too smart and was idealistic about how good people were. My parents were just being negative and cynical. I wanted to believe the illusions.

So I had to re-learn some of those lessons from personal experience. Whereas I could have just listened to them and avoided a lot of trouble. C'est la vie.
"
158,I know right...we are old as fuk
159,"I mean, we're only speaking from practical experience here. "
160,My wife seems to fill the void with spending time on her phone.  It kills me how much time she's on her phone.  I have several friends who's wives are the same way...always doing something on the phone.
161,[deleted]
162,"I have been working in our Brisbane offices for last two weeks (I live in a different city). All the national sales teams are based in Brisbane. Lot of money at stake. Some of these men and women make over 2-3 million dollars per year in sales commissions.

Their weekly team meetings are hyper aggressive screaming matches over territory allocations. last Monday one of the women called another of the women that during a particularly heated argument.

I had no idea what ""sandy vagina"" meant but I chuckled along with everyone else in the room at the time. "
163,"You sound emotionally intelligent and handled the situation in the best way,  I don't understand how women can try to make you feel guilty. Sounds like they're projecting some internal issues"
164,Mate you nasty. 
165,staying too long in the singularity could lead to spaghettification. So I wouldnt stay for too long
166,Storyyyy tiiimmmeeeee
167,"It seriously fucked me up haha. We banged three times that night, with some very vanilla missionary sex. I got her off the first time, and I was going at her in an awkward position. So I didn't cum. I rolled off of her, and just stared at the ceiling basking in the post sex, and I was pleased that I got her off. She then rolls on top of me, rips the condom off, and just proceeds to take me all in with her mouth. The sexual chemistry was explosive and she's the reason why I agree that a lot of women need to step up their game. "
168,"Whatever you do don't put your tongue near her inner mandibles or second set of jaws, they can be very acidic. "
169,"Men earning more money.

Men seek out more lucrative career paths because if we don't we'll most likely die alone."
170,Dear god man this is a family subreddit
171,Solution: work in hospitality or a hospital. The hours are basically the same and you'll both have the same amount of hatred for the average person 
172,"Well they're pornstars, so they'd probably be indifferent to it."
173,"Concur very much. ""Hot"" and ""Sexy"" are easy in today's sex driven culture. Cute though.... cute is tough to pull off and well deserving of the compliment. 
"
174,"You also have plenty of advantages as a foreigner. Basicly, you are playing in god mode.

First, you have a conversation starter: you are new here and try to meet people.
Second, you have a different culture and learning the local culture or explaining your own make for good conversation.
Third, people don't expect you to be as sharp as a local when it comes to language and alike. You are a foreigner, they are forgiving and don't expect subtle playwords.
Finally, foreign is intriguing and generally sexy.

Source: I'm french, lived in the netherland, denmark, japan and the usa. "
175,"Good points made already, here's another 

&gt;Both times it was a girl I'd known for years and was very comfortable with

This could be part of the problem. The old ""I don't feel that way about you, I just love you like a brother"" line isn't JUST a way ugly guys get friendzoned by their hotter friends. It's possible that these girls envisioned you as a platonic, brother-like, ""safe"" figure (safe in the sense of non-sexual). You showing that you wanted it to be more than that may have crossed some internal boundary, the same way they'd be weirded out if their brother tried to make out with them. This is ESPECIALLY true if they had pre-existing hangups about sex.

Just my 2c"
176,"Haha if that! It was pretty exciting. There was a lot of foreplay (see groping and crotch grabbing) on the hike up there so I was pretty much about to pop the second the pants were off.

Edit. I thought it appropriate to clarify that I came at the exact moment the eagle turned in mid air to spread its wings and let off a huge screech of pure unadulterated American Freedom. 

At the moment of climax the eagle and I held each others eyes. And I swear he gave me a look that said ""you and me, we're Eskimo brothers now.""

Obviously none of this edit actually happened, but let's just make that my answer to the OP's question."
177,"I'm gonna walk into work on Monday and greet my (all male) coworkers with ""How's it going, boys?"" and see what happens.  Will report back. "
178,"I remember a thread a little while back asking women who had been unfaithful why they cheated and how they felt. 

The vast majority had very many ""justifications"" for their shitty behavior, and received a lot of support from others. It was very disheartening to see, because I have seen posts in that subreddit vilify men who cheat. It's a very one sided fuckfest.

Nothing justifies infidelity. 

However, once in a while I learn a couple of things from a female perspective, and I do appreciate that. "
179,So woul [this](https://www.youtube.com/watch?v=BSBXqeh5G7U) be called reverse Puma?
180,"&gt;Is he looking up

One of the most drilled-into-my-pysche images of my ex is looking up at her from between her legs. It was so hot. 

&gt;just seeing my tummy pooch and double chin

I know what my gf looks like. I know her tummy pooch. I'm not going to be surprised when I see it from another angle. 

&gt;that cant be sexy

Oh, fuck me dead, it *so* is."
181,"That's awfully racist, assuming I can't be Black because my skin is white"
182,"My generation is universally sad, anxious, insecure and unsure of themselves in really basic ways. "
183,"&gt; She came over with a trench coat on

Did she look like [this?](https://vignette3.wikia.nocookie.net/bojackhorseman/images/f/f1/Vincent.png/revision/latest?cb=20150719055028)"
184,"NASCAR: A sport seemingly predicated on hoping for a terrible disaster that often doesn't happen. I think there are so many more interesting motor sports out there, I just don't understand how collectively a sizable American population decided this should be what we spend hours watching and promoting. Rally racing, Baja racing, formula 1, Le Mans... and then NASCAR?"
185,"Sand is irritating when it gets into sensitive areas, such as a woman's labia and especially if it gets into her vaginal canal.  

It's not particularly fun to get sand in one's foreskin or urethra or in or around the anus for that matter.

So basically the insult is saying that someone is acting overly sensitive and in a foul mood.  It also has the connotations of calling a man a woman if one is addressing a man."
186,I would like to just do a bunch of drugs and fuck for the entire weekend. 
187,You guys are in love now
188,"But he has a sex drive and wanted to stick his penis in a girl at some point and even drove a great distance to do so o3o. and he is a man. rapey. ignore everything else like consent and backing off when she said no the first time, dun matter.

what matters is MAN, PENIS, WANT IN GIRL those are the only words that matter, don't let all that sly talk fool you. That's  just man jibber jabber."
189,For her to dress me up in her clothes and peg me.
190,"Met a girl in Ireland on the first day of a 7 day tour I was taking.  It was basically the start of a long, solo European trip I did.  We hit it off immediately and spent the entire tour together.  In fact, at the end of the tour the tour leader told me she thought the girl and I were together and had been dating for years.

Anyhow, back in Dublin after the tour, we made plans to go out for one final date as she was flying back home the next morning (she was Australian but visiting her mom who lived near London, and went on the Ireland trip as a mini-vacation).  We spent the night together having dinner, walking around Dublin, and enjoying each other's company until late in the night when we finally had to part so she could at least get a couple hours sleep before her flight in the morning.  

We were standing by St. Andrew's Church saying our goodbyes when she burst into tears.  I asked what was wrong and she said (paraphrasing from my memory here), ""It's unfair!  It's so unfair to meet someone like you in a situation like this.  I don't want to leave you.  I don't want to leave this.""  She cried, we embraced, we kissed, we looked into each other's eyes, all that stuff.  Eventually she had to go, we couldn't stand there in St. Andrew's shadow forever, and she turned and walked away toward her hostel.  She said she didn't want me to walk her there because it would only mean ""another goodbye, and I don't think I could do that.""  I watched her walk away as the streetlights shone down on her like spotlights guiding the star of a play off stage.  When she got to the end of the block she stopped and turned back and waved a simple wave.  I swear I could still see the tears on her face reflected in the glow of the streetlights.  She turned once more and rounded the corner out of my life.

I felt like I was in a fucking romantic comedy or something.  I half expected some sort of ""comic relief"" moment to happen next, like I would turn around and immediately see a dog taking a shit or something.


Edit -- Typos etc."
191,"Hope you don't take too much offense to this, but this probably near tops the list when it comes to things women say versus what they do. Close to all women I know *say* they want a man to show emotions, but even SLIGHTLY too much and all of a sudden its a turn off and makes them unappealing and ""I'm not here to be your therapist"" etc etc"
192,"Had a relationship that became a long-distance thing after a while. My girlfriend was a budding artist on DeviantArt, and was constantly inundated with requests and commissions. It came up to Christmas, and I was feeling pretty crap at the time. My grades weren't amazing at the time, my dad had to stay up at his parents house to help take care of them over Christmas, and my other family members were pretty.... Well, unpleasant. So talking to my girlfriend, she sympathised and wished I could come stay with her family for Christmas (not really a possibility due to the cost) which would have been a dream come true at that point. Obviously, it didn't. 

But to try and make me feel better, she postponed all requests and commissions while she made *me* something. It was a large landscape drawing of me having Christmas with her and her family. Looked so picturesque and perfect, and you could tell by the detail that she invested a lot of time and effort into it. I was speechless! She also sent me a heartfelt letter explaining how she wanted my Christmas to be good, and that's all she'd want this year. Well, that and for me to be with her. Really became an overload of emotions for me, and improved my Christmas a ton. 

Just a shame that relationship didn't work out, we were nuts for each other. "
