,text
0,"Her to take charge.

She likes me being dominant, but sometimes I just want her to push me down on the bed and ride my face til it's glazed like a donut.

A man can dream.

Edit: Grammers and stuff"
1,"I used to browse and post there, I found it's kind of an echo chamber, and the opinions there don't really reflect those of women I actually know. One stark example, I was telling a story there about how I went to visit a girl in another state after she told me she was going to have sex with me, but when I got there she wouldn't, and said ""You should have known I was being sarcastic."" I was kind of miffed about it, but didn't push the issue.

The response of AskWomen: ""In spite of the circumstances, she was under no obligation to have sex with you. This whole thing sounds a little rapey.""

The response from women I'm friends with: ""What the fuck is wrong with her? You dumped her on the spot, right?""

In other words, not much, because I don't think the opinions expressed there really represent the views of women in general."
2,"The Puma, the king of all fuck moves.

Basically I would ask my girlfriend to lay on the bed spread eagle. I would climb onto the top of the dresser, growling like the big cat i am. In one move, no hands, i would pounce from the top of the dresser and insert myself without guiding my member or her moving a muscle.

You only get one shot at the puma, you either succeed and get it in, or you break your dick."
3,20+ is considered later on? fuk
4,"I honestly don't feel the women there are an accurate representation of women in general. I have a lot of women I am very close to, and very comfortable with. On occasion I have asked them about threads on there that I simply disagreed with. Most of the women in my life agreed with me, and disagreed with the consensus of the thread.

An example of one that I read said something to the effect of ""No man can ever call me a ""girl"", you call me a girl and were gonna be fighting. The fucked up part is we never call men ""boys"". We have more respect than that, but they call us girls like we're these dantey helpless things.""

I get called boy all the time by girls. And I'm never offended by it. My female friends will say something like, ""Oh no boy, I know you did not just say that!"" (teasingly of course) My girlfriend will say ""You going out with the boys tonight?"" Calling men boys is incredibly common, and every woman I know does it. I'm not offended by it. But that entire thread every woman in their was raging at men for being so sexist by calling women ""girls"" like it was this horrible thing to be called a girl.

I'm not sure who the target audience of that sub is, but I do not believe that it's mature women."
5,"Wait, so she told you she didn't want to have sex with you and you didn't push the issue? That sounds like the opposite of rapey. That sounds like respecting the fact that she said no."
6,"You have a female friend that's roughly your height? Wear her jeans. Get that bulge a showing. You got a button up shirt? Put that shit on. Buttons? Fuck buttons. Leave that shit open, put those 3 chest hairs on display. Have sunglasses? Wear them, no matter the time of day or position of the sun. "
7,firefighter helmet + undies + tool belt. 
8,"I'd thank her for coming to me, promise her that I'd get her what she needed, but FIRST, we needed to talk about sexual responsibility."
9,[deleted]
10,"Why do people feel the need to answer this thread with:  
""Nothing"" or ""We already do everything""  
Ok... then you don't have an answer?"
11,Jeans so tight you can read the lines on my cock.
12,[deleted]
13,"Finding someone emotionally available who can reciprocate feelings, and communicate in an honest matter; ultimately leading to a fulfilling and healthy relationship.

Now that shit right there is hot."
14,"I stopped counting how many times I got rejected and stopped caring about it. I probably get rejected 7 times in a single night sometimes, it's seriously the last thing on a long list of greater problems"
15,"""Motherfucker, what's the ""one thing led to another"" part?""

ðŸ˜‚ðŸ˜‚ðŸ˜‚ðŸ˜‚"
16,"Top of a mountain/cliff w a great view.

Not like, Everest; but you know, if you've ever climbed a mountain, there are some spots that are just ""yup""."
17,Women are less understanding and more hateful than I realized
18,"Because ***HOW DARE*** he have an emotional response to being jerked around by a woman, he's a man, that's just simply not allowed."
19,[deleted]
20,I like women IRL better.
21,"Y'know how sometimes you analyze an interaction with someone after the fact and it goes one of two ways in your head? 

I. E. :

1.) That interaction was positive and there's no way they misinterpreted me. 

2.) They took it the wrong way and, despite my good intentions, they not only think I'm a cockwaffle but I also fucked up their mood/day. 

It's always number 2. It's all shit. "
22,"Dated a journalism major for a while. REALLY wanted to be a TV news anchor of some sort, and I promise this will become a mildly relevant fact. 

She took me back to her place and we played a board game of some sort. Had a good time, got up to go. She slammed me against the wall, and started rubbing my other head. Looked me dead in the eye, slapped me and said ""You're blowing your two pump dump all over the back of my throat."" Never lost eye contact, and it was an INTENSE look, it wasn't a request, it was a pure statement of fact that I would follow. She then gave me the most intense blowjob I've ever had. My knees buckled and I went crashing to the floor. 

I was helped to the couch, given a glass of water and, again TOLD, ""You have 45 minutes to recover."" We played another round of our game and I was manhandled into the bedroom, where she climbed on top and used me as she saw fit. When she had finished, she gave me that intense look again and just started...going. Not going for her anymore, going for me.

And holy shit did she go. I had never before, nor ever since, been ridden like that. She knew exactly what was happening at every moment, and when she could feel me building up she leaned down and whispered ""This just in..."" and I blew my baby batter all over her insides. ""...you finished gloriously.""

I don't think I miss any girl as much as I miss her. She'd get a look in her eye and I knew it was fleshy dildo time for me, and I would be rewarded generously."
23,Threesome with two hot girls I just met.
24,"A girl I was seeing ran down the steps of her front porch, down her driveway, and jumped into my arms when she saw me pull up. 

I melted."
25,"This is definitely achievable, although your odds increase dramatically if you swap "" insanely sexy girl"" for ""girl""."
26,Fuck an insanely sexy girl I just met in the bar bathroom.
27,"""Because even when a man is naked, a woman likes to know he has a job.""

-Jim Jefferies"
28,"I'm not sure, but I'd ultimately not be standing in the way. I'd rather my hypothetical 15 year old daughter have those things if she needed them than go without.

Thankfully, this situation isn't in my near-future. Gives me time to think about what I'd say in the meantime."
29,For her to come to me without asking in her lingerie or naked and tell me she wants me to fuck her right there and then. Won't ask because then I won't feel it's her choice to do it. 
30,"Cool, but... don't ever let her hear that."
31,"I got a list as long as my arm of kinky crazy stuff I want to explore. But I could be content if she just wore some lingerie and gave me head once in a while. 

She's in grad school though, and for those that don't know that basically means 60+ hour weeks for 4-6 years. She doesn't think about it.

She is so wonderful in every other aspect of our lives Im willing to wait. 

And why don't I bring it up? Because an obligation blowjob is so much worse then no blowjob. "
32,"I'm not sure how old you are, but I *can* tell you this: My dear friend had those same thoughts and doubts and quiet little nags in the corners of his head. And... went through with marrying her. It started slowly when they were dating. She was cool enough when they met, so he shushed himself when doubts would arise in a slow, subtle way. In his own words, he never did think that he'd stay with her *too* long, but something-something-frog-in-water. 

Year 1 came and went and it was still pretty fun and casual. They met each other's family and friends, and she was pretty tolerant of his video gaming and weed smoking, and they had a good time, so they kept dating. 

At year 2, same deal. She was hinting at moving in together because her lease was about to be up and ""it was time."" She instead moved on her own to a place closer to his house, giving him another year in her lease to delay facing the issue of whether he truly wanted to live with her. They continued to date, go out to eat, do couple-things - not *too* much in common hobbies-wise, but he tried going camping with her because she's outdoorsy, and she tried lazing at home on weekends because he's not, at all. Differences like that can be charming in early dating, and you both try to compromise. And you don't really have to think about if you want to be dragged along camping your whole life if it's a 2x/ year thing with your girlfriend, so, you don't think about it

Then, 3 years in, she firmly wanted to move in, and nothing was *drastically* wrong, he just didn't feel 100% into it. He felt like a dickhead delaying it more, and 3 years is a LONG time to date without any progression, and he was still living with his brother and smoking weed and drinking and having a good ol' time all the time, and not seeing her a lot - she was pretty patient at first, and didn't nag him about the weed and booze; (that has since changed and she wants him to 'act like an adult') So, he moved in anyway. It wasn't great, but he still saw his brother a lot and saving money was nice - plus, it got her off his back from saying ""we never do anything together"" (which, spoiler, you tend not to over time if you have no hobbies, interests, or ideologies in common). Then she got a dog that he never wanted, and that added to their lives being tied together. 

Then, at about year 4, her sister and friends were murmuring about getting engaged since ""they'd been together so long."" So, they did. In their engagement, I never once heard him enthusiastically call her his 'fiancee' - it was like he couldn't say the word aloud or something. He also never fully changed his mailing address from his brother's house - there were small ""tells"" that were pretty clear - people speak volumes in the words and small actions they choose. They pushed the wedding date back, twice. She went out of town the summer before the wedding, and he spent basically that whole summer at his brother's (like, actively avoiding going to his own house, which was also telling), voicing doubts and concerns and complaints about a LOT about the relationship - her exorbitant debt, their dynamic, their lack of commonalities, her sisters, that she wants more dogs. NONE of their wedding speeches mentioned them as a couple or that they are strong together - I paid deliberate attention because I do think that what your loved ones say about your relationship speaks volumes.

 SPOILER: Literally none of these doubts have improved at any point. She was supposed to get her financial shit together ""after the wedding/ after this birthday/ when she turned 27/ when her dog's vet bill was paid/ after she graduated college"" and... she didn't. He is now in dozens of thousands of debt, and all the doubts he had and concerns he voiced are no closer to resolving. He is seemingly talking himself into it, yet again, after they got married like he did when they were just dating - he *has* invested thousands paying off her debt, and other sunk cost fallacies, after all. 

The point is: the path from ""casually seeing a cool chick that is fun for now"" and ""married and tied down and has no time for video games and is constantly nagged to do chores and drives an hour each way to a job that he hates for a wife that feels completely entitled to his existence and thinks she gets a medal for existing and a mediocre blowjob once per month, while reminding him how lucky he is"" (my friend isn't *quite* there yet, but give it another dog, or baby fever, and I'd put money on it) is really, really, really slow and creeps in. BE CAUTIOUS WITH YOUR LIFE! 

It's really tempting to talk yourself into a dynamic that you know, deep down, in your heart of hearts, isn't right for you. Perhaps there's promise of change or you think that ""all relationships take work"" or you feel like an asshole for wanting to end it when there's nothing wrong like cheating or abuse. But. Do yourself a favor and don't be a bystander in your own life. LISTEN to those doubts. 

**TL;DR-** Nearly every divorced person I know has one statement in common: they knew, well before the divorce, that they should have broken up the first time their psyche told them so

E: formatting, added phrasing, thanks for the gold! If I could impress to young people one thing about relationships, it'd be: breaking up is infinitely easier and kinder than divorce, and 5 years, in the span of your life is NOT a long time - don't give into the sunk cost fallacy! "
33,http://i.imgur.com/NiEclTM.png
34,"My ex-fiancee

I'm a man of simple but borderline unattainable tastes."
35,"Offended easily, uptight, easily upset about something, stubborn, or already in a bad mood. It can be used as an insult."
36,The women in askwomen don't seem to match the women I know in real life. It has shown me that women can be just as big of a dick as men can be and also that some women really cannot handle criticism or reality. 
37,"Was on a second date with this girl. I, being shy and not wanting to come off too aggressive, lightly kissed her. She replied ""What the hell was that?"", grabbed my by the shirt, and pulled me in for a much deeper kiss. It was pretty great, highlight of the year."
38,I see you've encountered their mod.  
39,Facesitting. Just sit on my face and let me work.
40,"That when a man calls a woman ""cute"", it's a bigger compliment than calling her ""hot"" or ""sexy""."
41,"And roll up the sleeves of the button up shirt up, obviously. That's girl bait 101."
42,"Poached eggs.  I didn't previously like them, but I had one with lunch yesterday and it was pretty good."
43,"For me it's more like crave chips -&gt; buy chips -&gt; eat all chips while watching a movie -&gt; feel bad about eating all chips at once -&gt; repeat tomorrow.

Never been much for sweet stuff but salty things are my mortal enemy."
44,"If you can't trust your SO to not be a shitty person and actively judge you and make you feel bad, you probably don't want to be with that person. "
45,"Hey, it's me, two hot girls"
46,"As someone lucky enough to fulfill this on a cliff in the Oregon coast let me say it's fully worth pursuing. She held on to a tree as we had sex looking at the ocean from a cliff about 30-50 meters high. I kid you not, but during the session an eagle flew right by us.

Dream on my man, but make this a memory."
47,"Woke up. Wife had written ""wake me up when you get up"" on the mirror in lipstick. I woke her up and she blew me. "
48,Can single men even adopt? Sounds like a unicorn.
49,I would be proud of her for being safe and for trusting me.
50,"To be honest from a straight female perspective, I think it would be a lot of fun but it makes me insecure. I always fear that a threesome will lead to him wanting it more and more or eventually he will seek out other women on his own :( I have yet to meet a couple who have introduced another person in the bedroom sustain a healthy, faithful relationship"
51,We're emotionally closed off because the vast majority of the time opening up emotionally makes them lose attraction to us. I just had this with my most recent ex. I told her it hurt me when she made plans and broke them and I'd much rather she just tell me if she didn't want to hang out so I didn't get excited for nothing. She told me to grow a pair.
52,Probably give it to her because if she gets pregnant it will be my problem.
53,"First date, she decided to deepthroat/gag on my dick with out saying anything. I miss her :/ "
54,"This place DOESN'T represent all men. This place disproportionately represents nerdy middle-class suburban white guys with a college degree (or in the process of getting one). 

That's just the nature of reddit, I suppose. "
55,"I want her to scream ""I was wrong about our argument! You were right! You were RIIIGGHTTTT!!!"" But I'm afraid she's too prideful :(

edit -- mid-coitus, of course."
56,"&gt; ""No man can ever call me a ""girl"", you call me a girl and were gonna be fighting. The fucked up part is we never call men ""boys"". We have more respect than that, but they call us girls like we're these dantey helpless things.""

What a sad existence she must lead if things like that are enough to set her off and start fighting with someone. "
57,"First GF in college. On my birthday she convinced my roommate to give us some privacy in our room. When I got back to my room from class, I was presented with her naked on my bed with a new tie around her neck and a ring (not an engagement ring but one that spun which would keep me occupied when I'm bored in class) that were gifts. 

That and she made me white chocolate pancakes from scratch on another occasion.  "
58,"I'm pretty vanilla. I'd just be down to be getting some. But I'm on Reddit, so that's a pretty big goal."
59,"Which is great until your wife says no to 99% of the questions. Or says yes to everything to see what kind of crazy things you're into and ridicule you about it. Pretty shitty both ways. 

Edit: Just to clarify, my wife filled the test out and answered no to the majority of the questions. She answered that we already do that, I'd be interested of my partner is, and yes to about to about 12 'vanila' questions. I don't remember how many questions are on the quiz in total.  

The ""I'll answer yes to everything, and ridicule my partner"" was brought up in the first thread I read where Mojo Upgrade was listed a couple years ago.

My wife had not done that, but has become very sexually conservative. Apparently wedding rings have the power to drain female libido. Having children is the equivalent to a Mortal Combat Finishing Move to libido.  I'm painfully aware of the issues this has on a marriage, and I'm working diligently to correct this and many other aspects of my marriage."
60,"In one word, my life is complicated.

I am a single gay man living in New York City, and I chose to adopt older children for at least 4 reasons.

First, I wanted a child who was completely aware of what was happening, and would be 100% on board with having me as his father.

Second, I did not want to fight anybody for an infant.

Third, I already had 4 small dogs (3 Italian greyhounds and a Basenji) and didn't want to further complicate my life with an infant's requirements.

Fourth, I wanted to give an older child an opportunity that they believed they could no longer get.

So how did I end up with 3 teenage sons?

I initially went to adopt a 17-year-old Puerto Rican kid living in a group home in Long Island. There was nothing particularly outstanding about him, and I mean that in the best way possible. I think on some level I just said, ""OK you're my son now. I'm willing to put up with you, if you're willing to put up with me.""

I soon met his best friend, a 14-year-old Black kid who he had known for years and luckily happened to be living in the same group home. He wanted me adopt him, too, and so he became Son #2.

After Son #2 was adopted, I found out that Son #2 had a biological brother who was separated at a young age and adopted by a woman. I do not know if this woman knew that he had a biological brother also in the system. Son #3 is legally not my son, but at this point nobody cares.

So what is my life like?

Well, today I'm a 44-year-old man who (because I chose to adopt older children) has 3 adult sons and 1 granddaughter. My relationship to my sons is better than I could've ever hoped. But it's certainly not traditional. I feel older than 44 because everyone else my age has children in elementary or middle school. Maintaining friendships was hard, because you definitely miss out on all of the things that your friends are doing with their younger children.

I don't want to make this comment too long, but I will answer your question about the adoption process.

I am now 10 years after the fact, but the process still haunts me.

You will learn firsthand that the system is not designed to serve the children. The system is designed to protect the agencies. That will break your heart. There are things that were never explained to my sons, and were never explained to me. There are questions that you will never get answered. There are people who you want so badly to cause physical pain to. On one hand, you could read this and think that I am dark and psychotic. But on the other hand, what I think you really need to understand, is that this process will really force you to fight for your child."
61,Meditation. Thought it was a load of fluffy bull with no substance.  I'm now super chilled and very relaxed.  It's great.
62,"On Christmas my GF sat me down before we went to her family's house so we could talk. She then started to read a letter she wrote about how thankful she was for everything that i've done for her. She was going through a depressed, stressed, and anxious phase because of her parents and school, but i guess i was able to help her a lot. We had been in a kind of ""on again/off again"" relationship over the past year, but that Christmas was when i realized how much she cared and that all i wanted to do is make her happy."
63,:(
64,[donut](http://static.wixstatic.com/media/f98dab_d707adfcec2f48a18384e6fd9a6ced42.jpg_srz_647_495_85_22_0.50_1.20_0.00_jpg_srz)
65,[deleted]
66,A friend of mine had much the same problem.  She got a dog and she lavished it with attention and it filled that nurturing hole which her kids left as they grew up.
67,"I have changed my mind about a dozen times on breaking up with my girlfriend this week. I don't want to, but everyone that I am really close with (except for her, obviously) are telling me I should. "
68,"Used to think our heeler Lacey was growing up, and fully trained enough to be trusted to just be alone without breaking things.

Then last night she ate a whole pizza when we weren't looking ðŸ˜‘"
69,"They're from Britain, I guess."
70,"One woman from each continent. It used to be from each country, but...that aint happening."
71,Get less homophobic friends if this is an issue.
72,"FFM threesome. Because my wife isn't bi, and has turned down my joking requests in the past. "
73,"
&gt; what's the ""one-thing-led-to-another"" part? 

Both parties send signals, one of them escalates things with physical contact like touching a hand or leg and then, if the other party doesn't reject that offer, moves on to kissing and eventually foreplay.

Sometimes things can be kind of blurry even after all that in which case I'll ask how far she wants to take things.

I'd assume that movies and pop culture tend to skip these steps because showing an hour of flirting, making out and touching would be boring.



"
74,"Tell me you're into guys. You don't need to say anything more. I'll understand immediately and give you the information you need to know.

*You -* Hey I have to tell you, every now and then someone reacts badly if I'm not upfront about this, but I like other men.

*Me -* Yeah not my cup of tea, but you do you bud. You're a cool guy, I can't think of a single thing I give less of a fuck about than your sexual preference.

*You -* Thanks man.

That's the whole conversation right there. I've had that conversation before, and fuck if I even know whether they were trying to hit on me or just tell me they were gay. Does it matter? Nope. Still friends either way, so it's really not worth asking."
75,"I've felt like that, now and then. But overall I've found I'm happier in a relationship. 

The last time I broke up with someone, I really enjoyed the single life in the short-term. It was nice not to rely on anyone, and not have to coordinate my schedule with anyone, and to play video games all day sometimes, etc. 

But after a few months I got kinda bored. Disclaimer: last time I was single I wasn't able to get laid. So it's possible if I was getting laid more I might be comfortable staying single longer. 
"
76,If you win he has to insert himself into you by skydiving from a very high altitude while you eat Chobani yogurt
77,"The stated reasoning was that my mistake was assuming that consent given in the weeks leading up to the trip was still valid.

I replied that if she told me ""Sorry, I changed my mind"" I would have received it a lot better, because the way she phrased it, she was blaming me for acting on what she said, rather than what she apparently meant, which was the exact opposite. Got massively downvoted for that one."
78,"judging by this, i miss her too "
79,"Ah that explains why one of my coworkers called another one of my coworkers a ""sandy vagina"". Also explains why the matter ended up with HR. "
