,text
642,"I agree with u/Mabelisms and think it would be nice if she showed remorse, but find that answer neither here nor there as the reality of the situation is much weightier.

There is a reason you asked this question about something that happened years ago, and I would guess it is because of the affect lies have on people and where your imagination goes if this vitriol was ever turned your way.

Lies are so insidious because they increase the distance between our perception and reality. No one's perception ever lines up perfectly with reality, but lies, and incredible ones such as this go a long way in destroying people. You can't tell where the truth begins and ends and as a result you wonder what other lies have been told and could be told.

This may have been for revenge, but that's not the point. People do evil shit to people then try to pick and choose the consequences of their actions. ""I only hit you this hard so you can only hit me this hard back! Ow, you hit me too hard!!!"" This is why I don't fuck with people as much as possible because you never truly know how much you hurt them and how much they may retaliate.

That being said, your girlfriend's tendencies seem to lean more towards metaphorically throwing haymakers and taking bats to knees when someone pushes her in the sand. There are a million of ways she could have retaliated **IF** Monica did something wrong, but she chose this method and that should scare you to a certain degree. The ease in which she told such an incredible and ridiculous lie should also frighten you too.

You are her boyfriend and so there are few ways your relationship will most likely end, in a break up, marriage and divorce, or marriage and death. In 2 of 3 of those scenarios you are her opponent and as you can see she doesn't hold back.

You sure you want to stay in your position?"
643,"I wouldn't want to date someone who is also dating other people. It's a waste of my time, when I could be dating someone who actually cares about me. "
644,"&gt;She claims this has nothing to do with her finding chess boring, me having less time to see her or the fact that Chess is not 'cool'. She refuses to give me an actual reason, other than 'It's not worthwhile.'

I'm dubious about this. It would be one thing if she were upset about the fact that chess is going to take up the majority of your time for the next 3-5 months and she won't be able to see you as much as a result of that. I could dig that.

But she doesn't get to decide whether or not you find something to be worthwhile.

Stick with the chess."
645,"I don't think this is ""Date 1"" material, but it's definitely ""Full disclosure in a private setting before meeting the kids"" material."
646,"Compromise?

Take one shelf in the fridge for you, give one to her. Maybe once/twice a month go shopping together, buy some meats, pastas, etc and split the bill and put on third shelf.

I have found my best living situations, in this department, is being pretty generous with what you call staples. Milk, eggs, cheese, condiments, bread, rice, noodles, etc. I don't want to call my roomie to ask to use his mustard."
647,"Anxiety, left untreated, will control your life. It will prevent you from doing things that can enrich your life, hinder promotions, cut you off from friends. You should be honest about getting treatment. This trip could be a once in a lifetime opportunity- it would be a shame to waste it. "
648,"Stop picking up his stuff and be stubborn until he gets the message. Tell him you're his wife, not his mom, and you stay home to focus on the kids, not his messes."
649,"You need to be comfortable (or at least confidant) saying no. It's a life skill. If you can't say no to people you well end up in a lot of bad situations where you are taken advantage of over time. 

As others said, don't address past behavior. Just tell her no *every single time* now, ignore if she is pouty or tense or looks sad, and she'll catch on it no longer works with you eventually and stop asking. 

&gt;“Hey mind if I join you for breakfast?”. 

""Actually, I was really hoping for intimate meal with boyfriend"" (if you don't want her to sit down) or ""You're welcome to sit with us but the extra food is for me to eat later in the week so you'll have to make yourself something"" (if you just don't want her to eat your food). 

&gt;I was making tomato soup and grilled cheese sandwiches for my boyfriend and I for dinner. Again, we obviously had plenty of soup, so she invited herself to sit down and eat our food with us.

First of all, don't acknowledged any hints and invite her. Don't serve her any soup. If she asks for some, say no. If you want it gentle ""Sorry, I'm saving the soup for later in the week. If you're interested I'd be happy to give you the recipe."" 

&gt; Lynn was trying coach him on how to make the cookies to her own liking (even though she was never offered any). 

Boyfriend: ""These are for OP and Friend, so I'm making them how my girlfriend will like them. But thanks for the advice about adding walnuts, I hope you get a chance to make yourself some cookies with walnuts soon.""

&gt;When he asked me and my friend if he could get us a bowl of ice cream Lynn immediately said “oooh yes I’ll have some” (again it was not offered to her”. She took the biggest scoop(s) and left hardly any for us. 

Boyfriend: ""Oh, I was talking to OP and Friend's name. Sorry if that was unclear."" 

&gt;Then when the cookies were baked she took HANDFULS of them. 

Boyfriend: ""Actually, I made these for OP and Friend's Name since she's having a hard day."" 

If she ever just takes your food or helps herself, I'd go with an indignant ""Excuse me?"" or a ""What are you doing?"" Make sure to get/take back anything she takes. "
650,"Your mother actually *did* get you a $120 gift:  *an excuse*

The next time she asks you to front her some money for something, you can tell her, ""no, because you still owe me $120 from the last time.""  She probably will never pay you, but she will also learn quickly not to ask you for money any more."
651,"Don't be friendly; your relationship is professional. I recommend going and reading a lot of Ask A Manager--and maybe asking her a question. She's the best with issues like this!

You got this, sis."
652,I appreciate you for putting what I could not organize..
653,"It doesn't matter if the OP wears the dress every day or only whenever the commentariat thinks is a special enough occasion - the fact of the matter is that her boyfriend accidentally ripped it, then started swearing at her when she started crying.  That's pretty rude and he owes her an apology and remuneration.  "
654,This. 1. Therapy. 2. Your kid comes first. The adults will have to figure out how to handle their shit 
655,"Child of divorce here. 

Having parents that split is soooo much better than having parents who think you can't hear them fighting Every night"
656,"He's not coming up with a lie.

He is having fun with that girl and ignoring you. Perhaps even, ""well she found out, so who cares now"".

Liars dont take as much time as this to lie, he simply doesnt care right now. He might start caring again once shes out of his sight, but he might not. 

It could be he cheated and now considers himself single..to me, that is the way he is acting.

You can rail against the storm or become the storm."
657,"Essentially this man wants a yes or he’s not interested. I know he did mention therapy but it’s a lot of extremes out of nowhere. Who’s to say he didn’t cheat already and found that he wants more? He did mention that he wants to date and have a fling. 

I’m so sorry OP. Being a divorced woman myself and having been cheated on, i can tell you this is extremely difficult and hate that you have to go through this.

Don’t forget that sometimes people say a little truth to hide a bigger lie. "
658,I got about 10% through your post before thinking you need to break up.  Managed to get through to post only to confirm what I knew from the beginning.  This is way too much drama and you're putting way too much thought into this.  End this and move on.  
659,going to vegas when youre under 21 with a group of 21+ would be a huge drag... sorry
660,"""Hoarding Gourds"" would be kinda a cool band name"
661,If you're not okay with an open relationship you need to tell her no. You don't have to be okay with non monogamy. 
662,"Buddy, being deaf is harder than a pissed off girlfriend. You know it, I know it, everyone knows it.

She has absolutely no idea how deep your ear canal is. Never allow anyone without a medical degree and specialized tools to insert anything into your ear canal. The membrane is so thin, one flick will tear it, and you will be in hell."
663," Speaking as a guy who is okay with period sex, she is completely out of line. Some people don't like bodily fluids, it has nothing to do with misogyny. Should a person automatically be ok with having cum on them/in their mouth? Saliva? Urine? If you don't like it, you don't like it. "
664,"For some women if her periods are becoming irregular she would/could get birth control to regulate them and have a set schedule. 
Does she experience any intense cramping or anything while she’s on her period? (Because birth control can help that too). 
I’m not saying it isn’t a little weird but as a woman I know that there’s several reasons why I started taking the pill at 17, that had nothing to do with sexual things. 
Hope this helps a little! "
665,"Slowly stealing money from your partnership over the years and lying about your daily activities is also dishonest. This is about protecting yourself, your estate, and your children's futures. You need to speak to another lawyer, one who won't be biased and doesn't have a personal relationship with your and your wife. The need for hiring a PI is that you don't have any other way of figuring out what she is up to without tipping her off. "
666,"He deliberately picked the most hurtful things to say so that you’d be too shocked and upset to have a calm and respectful discussion about ending your relationship. Otherwise, you might have brought up awkward tidbits like ‘why would a man want to be with a girl 10 years younger than him?’ Or my favourite ‘oh my god, were you grooming this girl when she was 17? Do her parents know about this?!’.

He doesn’t want a partnership, he wants a girl who isn’t experienced enough to see all the red flags he’s waving. I’m so sorry he has hurt you, but I’m glad you’re now free of him."
667,If you pass up the job you will always regret it. 
668,"Trust is something that's earned.  She's proven that you can't trust her with money, so don't."
669,"ah, thank god for this. One of my friends posted SIX SELFIES today, and they were all posted one by one, at various times today (not doing anything, like, not a selfie w/ a cute animal or something. Just.... her weird smirk). I'm like. Why. But she has a tracker, I know, and I don't want the drama lol"
670,Congrats! Is she now also getting help for her PTSD?
671,"You can’t prove a negative (you’re not cheating), and even if she “comes around” on this, she will still hold it against you. 

She doesn’t trust you, and why put up with that when you’ve done nothing wrong?"
672,"&gt; I noticed there was tension between us after that for a couple weeks, but then she started inviting herself to meals again.

She’s doing it on purpose. Consciously or unconsciously she’s acting towards a deliberate end. There is no subtle way to “hint” that you want her to stop. You have to come right out and say it: “Lynn, I’ve noticed we have kind of a weird dynamic going around food. From now on I’d prefer if you didn’t eat my food or join in at mealtimes with me. Let’s handle our meals separately. Thanks!”"
673,U should run as fast as u can from this guy.... “borderline violent”? Really? Hes sounds like a psycho.. run seriously run from this guy... 
674,"She should leave and live with you again, if possible.

Your mother can't report her for shit if she leaves, your mother is an adult not a child being neglected or an elder being abused. She can call 911 if she has an episode. Or not. Who cares anymore, she's abusive and your sister should just leave immediately. 

Your mom can contact social services rather than keeping her child as a house slave. "
675,"&gt; To be fair, she had help from a whole lot of people who had no reason to give a damn about their soap opera bullshit.

This is what really gets me about this story. They were presented even by Op's post proof time and time again that Callie was lying. But instead of making even minimal attempt to verify any of this before participating in a bullying campaign against some girl they didn't know, they just went along with it for months. 

GF might have been behind the campaign. But Op and everyone else are not guilt free. "
676,"OP excuses it as social awkwardness, but this whole conversation tells me that Lynn knows exactly what's going on, how it's awkward, and is choosing to try to manipulate some free food out of the situation anyways. "
677,"If he'd been sorry and it had been an accident, his immediate reaction would ALSO have been distress, panic, and freezing when he heard the rip. Like, ""Oh no! OH NO! I am so sorry!! Is it okay, can we fix it, I'm really sorry! I didn't mean to, It just came apart-"" etc.

Instead, he told you it wasn't important, your reaction wasn't rational, and essentially that he could do whatever he wanted with the dress, and you needed to deal with it.

What happened here was you communicated a boundary. He didn't like that. So he broke that boundary. KNOWING how important it was to you. In fact, that's why he did it. Then he didn't like that you reacted badly. You should have prioritized HIM over a stupid dress, and taking care of his needs.

Nope, nope, nope, nope. He did this on purpose. You communicated ""This is important to me"", so he went right for what you had said was important and destroyed it without a single apology. Then he got mad at you about it. 100% a huge deal breaker."
678,"But he is a saver.  He's got $35,000 more than many people."
679,"&gt;Is this the 4-year itch, or is something fundamentally wrong with the way we interact with each other?

There's something wrong with the way she interacts with YOU.

&gt;tl;dr girlfriend seems to be only caring about her needs, and can be rather spiteful and hurtful. What can I do to make the situation better?

Find a less spiteful and hurtful girlfriend.
"
680,I'm glad you stood up for her and everything that all the other comments have said. My additional issue/concern is why is it okay with the rest of your friends for him to act this way?  Is he like the general group douche bag or was this out of character for him?  Seems like a sensible group would distance themselves from a person such as this and not ignore his abusive behavior. Little disappointed in your friends 
681,"It sounds like your daughter has plenty of stimulation and doesn’t need her mother to plan special outings with her.  I don’t think your daughter’s developmental progress is at stake here. 

I think the thing that is at stake is your daughter’s relationship with her mother.  Your kid will become less socially dependent and want to do her own things with her own friends in a few years. If she doesn’t enjoy spending time with her mother at that point, it will be hard to change that dynamic. I don’t think mom needs to entertain the kid every minute that she spends with her, but I do think she should make sure that they do some special mother-daughter fun things together and build good memories.  

I also wouldn’t put too much weight on a 5 year old’s declaration of boredom.  Kids can be more cleverly manipulative than they get credit for, and who knows what she’s telling your wife in private about her outings with you. 

Anyway, I think you might approach it by telling your wife that you’ve been finding it really rewarding to get to do all this fun stuff with your daughter and get special bonding time.  Encourage her to do one special kid-centric outing with your daughter per month (edit: and if she’s already doing at least one kid outing per month, I think you should respect your wife’s stance on this).  It definitely doesn’t have to be twice per week, but it would really be a shame if she missed out on those kind of bonding opportunities entirely.  

And, like other people said, its fine for the kid to be bored sometimes.  Also, it sounds like you and your wife currently have a good system going, where you’re both getting breaks and living rich lives, and your kid has a good life as well.    "
682,"""My boyfriend got angry at me because when he behaved badly I didn't anticipate it and cover for him in advance.  To make my boyfriend happy I should expect him to behave badly and preemptively help him hide it.""

Diagnosis: Asshole.

Prescription: Breakup."
683,"Your brother is the common denominator for all of these mistakes and poor choices.  🙄 If I were you I’d disengage from your brother, his exes, his freaking drama.  You can’t stop him but you can stop participating.

If you’re not ready yet then you should encourage him to get a vasectomy so he stops making more babies he isn’t going to support or be there for."
684,"Seconding that — the biggest thing here is that it is *not ok for him to speak to you like that*. What you did to “provoke” him doesn’t matter. And you did nothing to provoke him, for the record; he had plenty of time to do laundry, but he chose to send that text not because of legitimate frustration at being prevented, but because it gave him some satisfaction to hurt you.

Depending on how normal scenarios like this are, this may be one of the classic “iceberg” posts, where one weird incident is actually just the surface layer of a horrifyingly dysfunctional relationship. That’s something you’ll have to investigate for yourself — ideally in individual therapy so you can learn to have healthy expectations of how you want to be treated, and in couple’s therapy if you honestly think your husband can learn to meet those expectations."
685,"Wow, thank you! That's actually very helpful and I never knew about that. I'm going to research more about it haha. That made a lot of things click for me."
686,"I mean, it’s not normal. And no dentist on earth would recommend this kind of dental care, or lack thereof. You can choose to mention to her the facts about neglecting teeth brushing (I’m sure it can be found online) and see if that makes her reconsider. But other than that, you can choose to break up, or accept it as something she doesn’t do and stay. It’s really your call."
687,"Your boyfriend is being a jackass. You did nothing wrong. He just wants to feel like he's always ""helping"" you, even if his help isn't at all helpful, and he thinks what he wants is more important than what you need. He whined and snapped at you when you said no thanks, and now he's trying to make his immature rudeness your fault.

Being in a relationship is supposed to make your life better, overall. Is he making your life better? Or is he just making you anxious all the time?"
688,"I honestly don't know how it's possible to move past something like this. You can't unhear what he said regardless of how he claims he meant it after the fact, and it's obviously still affecting you deeply.

It kinda sounds to me like you two are incompatible in some major ways. You have different attachment styles, he has some kind of erectile dysfunction but won't cut back on his porn consumption, and he wants you to just get over the incredibly hurtful thing he said because your feelings are inconvenient for him. 

I don't think I'd stay in a relationship like that. "
689,"OP, just talk to him. It sounds like your relationship is pretty strong. "
690,"Jesus christ, thank you. The armchair diagnosis thing across reddit is legitimately driving me up the wall.

The greatest irony about all the ''ADD diagnoses'' in this thread is that we're all literally on phones and tablets on reddit.

For what it's worth, I think your suggestion was an excellent one."
691,"Do not apologize  Everyone concerned -- your shouting friend and your other friends who have criticized you -- should be apologizing to you.

You were an ""upstander"" while everyone else stood by and watched someone be mistreated.   You might want to think more about why you are associating with people who wouldn't have a problem with that."
692,"It's only been two months, this relationship has barely even started and instead of being all over each other and enjoying the honeymoon stage, he's been flaky, he essentially stood you up repeatedly, he is blatantly and unapologetically disrespectful of your time and the fact that you have a life outside entertaining him... I think the message he's been sending you is clear: you're an exclusive fwb to him at best, and he only bothers with you when it suits him and he has nothing better to do, plus he clearly assumes you must have nothing better to do yourself. You should have ghosted *him* long ago, you can ghost him back now, better late than never. And when he reappears out of nowhere eventually, please don't respond, not even to call him out. "
693,LOL. I was expecting that she was going to say that she goes home because she hates to use the restroom at work!!
694,"Jesus man, have some self respect. She's betraying your relationship--repeatedly. This isn't a one-time mistake. It takes two people to salvage a broken relationship, and she has no intention to. She's staying with you because it's comfortable, and feels guilty because she knows her behavior is wrong. Stop letting yourself be used and find someone who will give back to the relationship."
695,"Don’t go for it. If the physical attraction isn’t there, neither of you will be happy. Other people have mentioned that he could change and become more attractive, but it’s a bad idea going into a relationship with the intention of changing someone.

Can you imagine if a guy asked you out and you found out his skin crawled at the thought of your fingers touching him? You’d be heartbroken.

Just enjoy your friendship with this guy. "
696,[deleted]
697,"First thing is call off the engagement and get refunds. 

Second thing is to end the relationship. You don’t want to be with someone who, at this point, isn’t sure that they want to be with you. Don’t wait for her to make up her mind; make the decision easy for her by removing yourself from being an option that she could choose. "
698,"Uh, so you really DON'T have an amazing relationship.  "
699,"He's being incredibly rude. He's is comparing your positions and he needs to stop. You need to tell him, if he's interested in your day he needs to ask about it and not ask about specific situations in your day right after he got finished bragging about his specific situations. He's being rude."
700,"She lives far away, and you are the parent of your child not her. Take everything she says with grain of out-dated salt.

&gt;“you keep talking. I have a limited amount of time with you here and you keep talking.”

Incredibly rude. I wouldn't respect her opinion on anything if that's how she treats you. Why would you want to take her advice on children then?? Do what you think is best. If she wants to interject again, shut her down and thanks but no thanks. "
701,"Yeah. A lot of people here are being really hard on this girl for being mad or for wearing it, but that's ridiculous. 

She shouldn't have to worry about her partner fucking up her stuff. They weren't having passionate sex, just kissing. My old boyfriend never ripped any of my clothes during sex because he knew how important they were to me. 

Breaking stuff happens. I broke one of my old boyfriend's wine glasses. You know what I did? I apologized and replaced it, because that's what you're fucking supposed to do. If I were OP's guy, I'd be looking at tons of seamstress shops to pay and get it taken care of."
702,[deleted]
703,"Every time he makes those comments, call him out on it, ""That's a rude thing to say"". Call him out on the behavior in front of his family stop taking the heat and letting him be rude to you. You tell him how you expect to be treated, and just because he apologizes later, you don't have to accept it. "
704,"Your boyfriend is angry because you allowed yourself and the home you share with him become involved in what may well have been criminal activity. He's quite right in pointing out that you don't live alone and you can't make that kind of decision unilaterally. What your friend was doing was very sketchy and holds potential consequences for both you and your boyfriend now that you've made yourself party to it.

So yeah, you're definitely in the wrong here. "
705,"My philosophy is that it's better to just break-up rather than take a break.  She even bluntly said that she is damn sure that it won't work out.

&gt; The more I know you, the more I can't stand you most of the time

&gt; you are still stupid enough to piss me off

Anyone who said this to me - boyfriend, friend, family - would be gone. "
