,text
463,"I have to assume this will get worse right away, considering you’ll have to take client meetings that you’ll be bound by an NDA not to disclose anything about.

If she’s freaked by your work phone, I can’t imagine she’ll love “Hey honey, I’ve got a dinner meeting tonight until 9. No, I can’t really tell you what it’s about. You *know* I can’t talk about it, and I *promise* it’s all boring work stuff anyway.”

Your job means you need an SO who can accept less than total transparency when it comes to work. I mean, you’re not in the CIA or anything, but even those folks get married and work it out. She’s being demanding and y’all are incompatible. Juggling her insecurities will drain the joy from your work *and* your relationship."
464,"It doesn't sound like she expects the same amount she has, and she may not view herself as being compatible with the majority of people.  Savers tend to want to be with other savers - especially if you plan to merge finances you don't want to be with someone who's going to want to spend all the money you want to save."
465,"Hmm I'm of a different opinion of most of the people in this thread. It sounds to me like your partner has been financially supporting you throughout this entire process. He made sure to save up to take this risk. Its really sad that it turned out being a musician wasn't what he wanted, and that he failed, but ultimately he made sure to support you financially throughout this entire process.

I would be pretty disappointed to find that the person that I was financially supporting felt resentful towards me for using my money to take a risk on being happy. And not only that, but he's trying to support you through housework too. You are being cared for in almost every way by this person. "
466,"Don't go back. Get a lawyer. Explore your options.

DON'T GO BACK."
467,"As someone who grew up in a household with parents who stayed together ""for my benefit"" it is the worst thing that I could have gone through as a child and teenager and lead sever depression and left me with major issues I'm still trying to work through in my mid twenties.

Really, really reconsider if she's the kind of person you want to have kids with. "
468,"Don’t meet with him. You’re under no obligation to make this easier for him, and frankly someone that shitty for that long, probably is still shitty on some level. Even if he’s 100% a better person now, his actions still have consequences. You deal with them everyday. I don’t know what your sister is thinking. 

You don’t have to be nice to him. You don’t have to see him again. If your sister knew who he was and still chose to date him, she can handle the awkwardness. This is something you for sure should talk over with your therapist before moving forward. "
469,"You are an adult. If you would just start to act like it, your mom would start to treat you as such. 

Give her control of your feelings and she will always manipulate you into giving in. 

Visit r\Justnomil for tons of tips on setting boundaries between adult children and parents. Good luck."
470,There is absolutely no way in hell I would let you watch my kid again after that. I would make a heartfelt apology and leave it at that.
471,Hire the divorce attorney before making any changes.
472,"&gt;But my sister thinks meeting her could help motivate him and get him excited about the future

This is literally the worst reason to get him motivated. He could be imagining a relationship while she wants to meet him once just to check up. He could be devastated if she never meets him again. Meet her first to vet her intentions of she asks again. If she refuses then she's only thinking about herself and not your brother.  "
473,Being blunt is the best method.   People on the spectrum often miss social cues so being blunt will be the best approach.
474,"IMO the kids will have a better childhood if the parents divorce and have a custody agreement that's civil and fair, than if the parents stay together, cheat on each other, and otherwise bicker each day.

Kids have a tendency to interpret every fight between the parents as if it's somehow their fault.

If your fiancée doesn't get some counseling and doesn't improve her outlook fast, you need to get out of the relationship.  Take her threats to destroy you at face value; weapons are available everywhere, and people who are that crazy are that crazy.  If YOU ever were to threaten her that way, she would fear for her life; you should for yours."
475,"Why did you marry someone who refuses to see you as a team? Why did you marry someone who doesn't respect you? Did you think he'd suddenly be better once you were married, or was he not always like this?

Either way...this is not what a functional relationship looks like. This guy would probably take your future children's clothes out of the washer to wash his own, too. 

And if he's super nice to everyone else, that means he's actively and deliberately choosing to treat you like this. He will help others, but not you. Because you don't matter to him. 

Do you want to be with someone who makes it clear that you're not and will never be a priority?"
476,"&gt;He asks me daily “ do you want my babies “

ugh, this made me shudder in disgust.

OK, now that that's out of the way - dump him. He's lovebombing you and moving WAY WAY WAY too fast. 

&gt;I feel like my entire family is going to be mad if I end this.

Fuck your family. You've only been dating this guy a MONTH, how the fuck are they so invested in him already? "
477,"You can't change her parents' views, but you need to talk to your GF about how badly her parents are damaging your relationship.  If she can't get them to back off, she'll either have to cut them out of her life, or you'll have to just admit that she's effectively choosing them over you."
478,[deleted]
479,"There's a Captain Awkward letter about this (#820 if you want to google) and it basically says ""Some men are just...too much trouble, girl. This guy is one of them."" 

It seems like some people have weirdly low cleanliness standards AND a side of extreme, harmful to self stubborness. Those people need to be single. 

For ""how do I dump him"" I'd give him a call and say ""BF, I've decided that we're not compatible. While I care for you and wish you the best, this isn't working. If you need to talk, I'm here, but I think a clean break would be best."" 

MAYBE give him one chance to realize how serious you are because honestly...99% of men don't take women seriously and then ""suddenly"" their wives leave ""out of nowhere"" despite having been told roughly 4 million times that roaches are not okay. I'd sit him down and explain this is a deal breaker and is he willing to lose you over it. don't fall into the ""stop or I'll tell you to stop again"" trap. Your words have to have meaning and follow through. 

Best of luck. "
480,"Don't give notice until you have a confirmed, accepted job offer and start date at the new place.

As far as your current job goes, who of the remaining people do you think is best suited to replace you?  Have that person work closely with you in developing the new plan, so that they can take over once you leave.  "
481,"&gt;I wanted to include my brother at some level in the wedding, so we were going to add him and his daughter as ushers- we just haven’t let them know yet. 

This is a good solution.

&gt;When my mom called last night, she made it sound like my entire family is upset with us that we have not included my brother as a groomsman. She said people are talking about it

Doubtful.  Its most likely just your mom and brother talking about this.

&gt;“It’s not just your wedding, it’s OUR wedding too.”

No, it's not.  It is YOUR wedding and you are paying for it.  You need to stomp all over this so she doesn't continue to push boundaries associated with your wedding decisions.

Time for you to get your mom out of the middle of this and give your brother a call to ask if he and his daughter will be ushers.
"
482,"Your girlfriend is horrible. She lied and destroyed this girl's life. No wait! She lied and destroyed her SISTER's life. So if you do something that fits her definition of horrible and she destroys your life? What then? Did you just deserve it? 

I wouldn't trust her. That's all that I am going to say. Have you seen Gone Girl by any chance or read it? Because your girlfriend reminds me of Amy. "
483,"Yes, because this is HIS mother. You shouldn't have the added emotional labor of dealing with her on things like this.

I ask you again: why is she the expert on your child?"
484,"So if I make a small list of things in your post that jump out at me immediately, I see:

-He gets mad when you don't beg for money for him

-He gets scary when he gets angry

-He does not stick to meal plans or budgets

-He does not make you feel like you can talk to him openly without anger

-He makes you do things you're not comfortable with like bugging that woman you mentioned for money

To me, it's very obvious he is a manipulator and is NOT someone you should stick around. Leave for your own good. "
485,"I won't lie, I get a little heated when this subreddit comes up and the ole classic ""everyone just tells you to leave!"" immediately comes out. I don't think I have ever seen a post that did not deserve all of the comments advising to leave.

It also completely neglects  to acknowledge the context...if someone has been driven to the point to even post on Reddit in the first place, isn't that a pretty big sign already? And that leads to the also very common post from people actually NEEDING a barrage of comments telling them to leave. People that know they need to leave, they just need some validation...and we give that to them! 

Reddit has helped a lot of people, and this and other relationship subreddits have helped a lot of people, and it's usually been through a barrage of replies saying ""leave!""

That's all I'm saying. /End rant"
486,"Yeah, it’ll be her baby and he’ll expect her to look after it instead of being so entitled to expect that he’d just share the load. "
487,"I have been in her position before. I would have loved for someone to have called the cops to get my SO to stop, because I couldn't. I would call them. "
488,"I'm sorry you're hurting, but thankful this relationship is over. Don't take him back if he comes back later. Anyone who dumps you because you weren't willing to finance his irresponsibility (and regardless of whatever bullshit rationale he threw at you, that's why he did this) isn't worth your time.         

Also, you can try to get him to sign an IOU and repay that money, but I suspect it's going to be your version of the asshole tax everyone has to pay at some point in their life.      "
489,"&gt;I was also told in no uncertain terms that if I went rogue and sat with my boyfriend, then I would be removed from the wedding without a second glance.

This comment would be the end for me.  I would have said enjoy your wedding, I won't be there.

&gt;I don’t think it’s fair to expect my boyfriend to do this (he is providing many of the decorations free of charge as he works for a party planning business) when he’s excluded from being a part of the celebrations. My boyfriend is also expected to be chauffeuring family from the church to the reception after photos have been taken 

You and your BF can enjoy a nice quiet date night at home instead.

Tell you mom about this so she hears your side of the story and knows you were will to compromise and your brother wouldn't."
490,seriously. i also would NOT be comfortable with a bf who spends a lot of time with my best friend and admittedly has a crush on her. that would make my skin crawl. i'd also be looking at the best friend differently. this is so fucked up. 
491,"He's a creep who preys on younger women.  Is this a friend group? 
 Why are any of you hanging out with this guy?  He's a horrible person. "
492,"I've got an idea!! People here are validating your concerns, but not offering a ton of practical advice. I've got a device in my car that was supplied by my insurance company that basically tracks my driving habits and either increases or decreases my rates based on what it finds.

The important part is that anytime I brake hard, it chides me, so I've been wayyyy more sensitive to my driving habits. If you were to get that, then it's not you correcting her, instead an objective little device beeping every time she brakes suddnely. From the sounds of it, it seems that her big issue is hard braking, so this may be a way to hold up a mirror."
493,"I think you should unleash your girlfriend and start taking notes when she stands up for herself and others.  I've dated anxious people before, and I've never been more annoyed and frustrated by them than when their intense compulsion to absolutely never offend, inconvenice, or upset other people applied to everyone else except me."
494,"I was in an abusive relationship in my teen years, and it really messed with me in all kinds of ways.  While I should have been learning about how relationships work, I learned about how to placate an abuser.  It's really hard to describe how it gets into your head, but it does.

That said, you don't deserve to be cheated on and you can't fix your girlfriend.  I think you need to have a really honest conversation with her.  She needs therapy to process her trauma, and she needs to cut all contact with that guy, whether you are together or not.

You are not a bad or unsupportive person if you end your relationship over this."
495,Lol 30 seconds. Yeah girl move on you can definitely get much better than that from someone who will actually put in the work to make you feel good too!!! 
496,That’s not unintentional 
497,No one should ever make their SO feel bad about not wanting to participate in a sexual act they are uncomfortable with.  This applies to both women and men.  This sounds like an insecurity of her own that she needs to work on.  And it's definitely wrong of her to shame you for not wanting to do something you're not comfortable with or to pressure you into doing something you don't want to.  
498,"&gt; Do I risk the great thing we have for years to try the unknown or do I try to get over this?

If you met a hot man, and maybe even one who propositioned you, and you really wanted to have sex with him, would you be prepared to throw away your entire marriage for some hot sex?

If the answer is no, then what difference does it make if it was a woman you were fantasizing about instead?

If the answer is yes, you should probably let your husband find someone else."
499,[deleted]
500,"&gt; Part of Tom's problem with the training program situation is that the co-worker didn't tell me about the program, I overheard him telling someone else he applied.

And WHO CARES? Why does your boyfriend even CARE about this??? He's borderline nuts. OMG OP, I'd quit the relationship now before it drives you insane. He's never going to stop. He's one of those people who's convinced he's right and nothing will change his mind. A self-righteous person. They don't make good SO's."
501,Always take the dream job.  
502,"I am a bit confused. You and Ashley have been dating a year and Jake, your best friend, just met her a month ago. And then you say this:

&gt; Jake is a very competitive and sometimes jealous type of person, and I'm sure that he feels a bit threatened by the fact that I have another significant person vying for my time. 

Have you not been spending time with your friends since you have been dating her? Why is she just meeting your best friend? Honestly the way it reads to me is that your friends want to spend time with you and have missed you being more present with them and that your girlfriend may not be a joy for them to be around. I really cannot imagine yelling at my partner's best friend the second time I ever met them. It is possible you kept the two separate for the time you did because you knew they wouldn't get along?"
503,"She doesn’t like them. Just because you like them and think they’re cute doesn’t mean that’s it’s a thing she can suddenly like about herself. If it’s already a thing that’s effecting her self-esteem, you might want to consider corrective dentistry because she might just get it done herself eventually. It’ll just take longer and cause her more unhappiness."
504,"Its so gross he's trying to teach his wife lessons. This isn't the time for ""tough love."" My abusive bf would do shit like this to me and it felt so creepy like his rationale was what a parent would use. OP's husband isn't her fucking dad. He isn't the person to teach her lessons. And if he were, stranding your SO in the bathroom without toilet paper is not the effing way to do it! What an asshole"
505,"I get how you feel –– but I actually think it is pretty important for you to consider the drugs and the context when you think about the future of your relationship with these people. You say in another comment that you can't even trust that they'll show up sober when they come to apologize to your dad. You don't necessarily need to cut them out of your life forever, but it might be time to think about setting some boundaries with these friends. It sounds like they're taking their lives in a direction that is increasingly incompatible with your own."
506,"&gt; I can't say I fault you for being logical about it especially considering she isn't insured.

That alone gives me pause.  OP, you need to realize that if you let your GF drive your car and she gets into an accident, that's a claim on *your* car insurance because it's a permissive use.  The other party would come after *you* as the owner of the car because your GF has no insurance policy or assets. 

I would not take that risk. "
507,This. Move on. It is clear he doesn't respect you.
508,[deleted]
509,"&gt; I am starting to meet her extended family.

The appropriate time is likely before this happens. "
510,"OK first off, tell Ms Holden Caulfield over here to grow the fuck up and respect your social life, and stop casting judgments upon every social interaction you have. People like her who are obsessed with ""authenticity"" and ""being real"" generally have a very arbitrary and child-like view of what is ""authentic"" and constantly use this random, arbitrary high bar to decry what everyone else around them is doing. It's just a tactic to feel superior to all the people around you. I would find this incredibly exhausting. 

First off - there is nothing authentic about you liking friends and wanting social time with your peers, and then you fold on that desire and don't hang out with your amigos because your GF judges you for it. That is super inauthentic, and mark my words if you do change yourself to fit her ""I just read Atlas Shrugged"" world view, I 100% promise she'll lose respect for you and judge you anyway. Judgmental assholes are going to judge - they trick you into thinking that if you meet their standards, you'll get their approval. But really they just move the bar. What is ""authentic"" and what is ""inauthentic"" to them is constantly shifting, it never stays static -- this keeps you always contorting to fit the new definition. 

I would also tell her that it's OK to have seperate social lives - but she is 100% in the wrong for treating you like shit and saying ""she no longer feels connected to you"" because she observed you cooking with friends. If she doesn't want to hang out with your clique that's totally fine, she doesn't have to. But she shouldn't just linger nearby giving you the withering judgmental glare because you aren't a ""freethinking individual who rises above social expectations to have friends.""

You are dating a close-minded, narcissistic snob who read too much pretentious lit in high school, and is judging you based on a philosophy that she probably hasn't even fleshed out herself. There is no win here - you fold and be like her with your friends (aka cut them off) then you only appease her temporarily. Let Thoreau go live on her pond and judge us lesser humans for enjoying casual company. "
511,"Because it’s not as innocent as you think. You mentioned him constantly complimenting a girl and tried to defend it because she’s gorgeous. A person in a committed relationship doesn’t do that - he likes chasing girls and flirting. 

And he stayed out all night - failed to tell you honestly who he was with. If my partner did that - fail to arrive home, lie about who he was with - I would have been livid. "
512,"Yeah, if anything she's on the younger side of realising she doesn't want children. "
513,"I agree - I didn't grow up like that, either, and I think it's a good thing that I learned to entertain myself and that sometimes, you're just gonna be bored.  It's a part of life."
514,"Confirmed, I'm ugly and happy."
515,[deleted]
516,"That was another thing that bothered me, he never contacted me to see if I made it to my uber, to my car, or back home safely. Then when I got in bed I sent him a message asking to let me know when he got home safe, and he made a few taunting comments then never let me know when he got home. "
517,"The division line is something we've definitely brought up, but she just for some reason assumed that I'd be able to get my work email on my phone because ""that's what most people do"". I have been having a good time with her but especially if this were to go far down the road (0 plans to really ever leave this industry) this would probably only get worse with her insecurity here."
518,"""Hey, I went to a ... convention the other day and saw something you might get a kick out of..."" 

I've learned that the phrase ""get a kick out of"" sounds more platonic. "
519,"Seriously, joke about it. 

I proposed on a mountain with our friends after a really hellish day of people (my best man) getting lost and we thought he was dead lol... 

Then when I propose, she goes ""Wait, why are our friends here??"" before she said yes lol. 

She never thought I'd actually do it in front of people. "
520,"Definitely sounds like there's a trust issue happening there if she's approaching strangers with details of their relationship. 

Best thing would be not to reply and let him know, who knows what she is to him, she could be some kind of stalker. "
521,"Just so you know, your mother didn't spend £120 on the coffee machine, she spent probably £50 and is pocketing the rest.  That's why she can't show you the receipt. The aggressive name calling (""brat"") is so you drop it and just accept the situation without further questions. "
522,"&gt;Now that I’m less in denial I have tried opening dialogues with my parents and they shut me down. They make fun of me sometimes for being too sensitive. Maybe I’ll try to get them to come in for family therapy. 

Don't bother. Child abusers rarely admit they abused children. Your parents won't. "
523,I think you should tell your dad about this stuff. And try to go to court for him to get custody of you
524,"What did he say prior to your best friend's response?

Sounds like he sent the message to the wrong girl, then panicked when he realized he messaged your best friend. There is literally no way to explain way the ""Who Is X?"" text. 

I'm sorry he's such an asshole. At least he's stupid enough that you caught him earlier than later (and in a way that couldn't be explained away). "
525,"He already knows, what I'm worried about is them cutting access between us and him and then brainwashing him. "
526,"This so much. The credit is yours, OP. We, internet strangers, are proud of you. I promise you deserve to be proud of yourself. "
527,"“He told me I sound dumb and I’m overreacting”

Well that’s just really rude and immature of him. It’s also gaslighting if he’s actually into her. 

Try this: ask if you can have 2 nights a week at home just the 2 of you. 

Also... point out that it’s your fucking house too and you don’t want to host someone every single day. "
528,I gave up on ever checking Snapchat maps because it’s been so terribly inaccurate for me. Just something to keep in mind. 
529,"I would think of this like any other illness. If my friend was consistently ""sick"" whenever I needed her help/support, but had no problem taking care of her own business or doing fun things, I would feel used.  But I wouldn't feel used if my friend was just sick most of the time, or happened to be sick when I was moving. I think it's only a problem if it's a pattern."
530,"&gt; didn't want to speak to me for a few days because I was stressing him out 

How *convenient* for him. He takes some time away from you right around the time he is meeting up with another woman and is blaming it on you. So if something happens between them he can blame it on the fact he thought you were on a break and it was somehow your fault."
531,"Yeah, your mom is cruel and manipulative. You had to beg her to meet this guy and she sabotaged the evening. You need to let go of the expectation that once she meets him she will get over it. That's clearly not happening."
532,"Honestly - I am more curious about you guys being together for only “about” a year and are already married. Should have waited at least a few years before tying the knot seeing as you don’t know the type of person your wife is.  
  
Which is shady. What she is doing is very very shady."
