,text
261,"That was 100% inappropriate for your friend to have done that. You aren't a minor and she's not your mom. She has no authority to gatekeep you. Lots of possibilities here, these are some that I thought of:

1. She wanted to bang/date this guy herself and absolutely didn't want you to have him.

2. She's a control freak on a power trip who doesn't want you dating anyone because she's decided you aren't ready, or these guys aren't the ones she's ""chosen"" for you.

3. She's worried you'll abandon her if you begin a relationship with someone else and is jealous in that sense.

4. She is spiteful and doesn't want you to have something she doesn't (a relationship). There are some people who just don't want to see other people happy.

Talk to your friend. Try to get to the bottom of her behavior. Explain to her that it is NEVER ok to cock-block you like that. Ever. And keep your distance for awhile. It's 100% up to you if you decide the relationship isn't worth it and it's better to just be friendly acquaintances."
262,"This is really, really smart. I've been in the position of having my younger brother withheld from me by a spiteful parent, but I can't imagine having to navigate between two siblings. Good thinking to turn it around and use it their controlling behaviors as a safeguard."
263,"First off, congrats! I hope you have a wonderful day tomorrow and that your marriage is happy and all good stuffs.

However, if it were me, I wouldn’t talk to her. Chances are, a conversation would include lots of excuse-making that would just make you angry on your wedding day, which you don’t need. Those are horrible things to say to anyone, especially given that it wasn’t a very big deal in the first place.

The thing is, though, that it may start some additional drama if you cold-shoulder her. People like to forget that your wedding is not about them and the attention they receive. 

"
264,"Oof.

Firstly, good for you for coming out of a bad situation so well. That takes a determination that certainly not everyone has.

Have you talked with your boyfriend about these concerns? Has he indicated any nervousness on his part?

If he's the same guy that was good to you in your youth, he will certainly stand up for you to his family. If anyone makes any snide comments, he better be ready to stand with you in not accepting them.

For what its worth, his mother seems like a lovely woman, and while this may seem counterproductive at first, maybe it would be good to mention to this woman how nice it was for her to prepare backpacks for needy kids every year, and how much it helped you in your youth. Should make her feel good seeing a tangible effect her efforts had on someone.

As for the rest of the family, stay open minded but be ready in case someone says something off or insulting. Make sure if they only say things to you when your boyfriend is not in your general,vicinity, either address it calmly but assertively, or go straight to him and let him know his family is being inappropriate.

Good luck"
265,"I think in a way you got lucky.  This guy showed his true colors before you two got married or brought a baby into this world together.  

He sounds narcissistic in a sense, he was very manipulative and inflexible about your past.  He only wanted a woman within a certain set of parameters, but he was too much of a coward to be honest about it.  

I know your hurting right now, breakups hurt very badly.  Especially ones you don't see coming.  "
266,"Ask the police what they recommend. Will they need you around for the next few days, or not?

edit: if the issue is that you don't want to go right now *regardless* of what the police recommend, then do what you need to do for your mental health. "
267,"For women I’d say sex is more like sushi. When it’s good, it’s GREAT. When it sucks, well...just hope you don’t end up with food poisoning. "
268,Someone can be a good parent in some aspects of parenthood and horrible in other areas. Your father was not being a good husband or father when her allowed his own mother to treat the women of his immediate family poorly for years.
269,[removed]
270,You can't fix a hoarder.  Don't fall for the sunk coat fallacy.  He's 31 and without serious SERIOUS therapy he won't improve.  If you clean it and keep it clean you will fight a neverending battle.  For your own sake I would move on.
271,"You can make it right by breaking up with him. I mean, this person has anger management issues and thinks making fun of others is funny.  Are you really okay with that?"
272,"You are married only in name, because he violated your integrity.

You will live many more decades, and you are beyond unhappy with this man. This will eat your soul - better to get out at 30 than 50. Being considered an old maid is surely preferable to growing old for the next 40 years with this awful man for a husband. If that's possible for you, especially since you studied abroad, perhaps consider living somewhere else? Thirty is young in many regions in the world.

I am sorry you were deceived, but this man never saw you as his equal."
273,I once casually dated a guy who didn't want me to come over to his place because he lived with his brother and he thought it would be awkward. Turns out he was dating someone else/probably living with her at the time...I'm not saying that's definitely happening but it sounds like your guy is hiding something.
274,"You’re not crazy — you’re not wrong. I’m surprised he isn’t THANKFUL you’re extending the offer to stay at your place until this is sorted out. 

I’ve dealt with a mice infestation last year when moving back into my college owned apartment after winter break. Did the exterminators take a while to deal with it? Yes. Did I force my boyfriend to eat at my place and neglect sterilizing everything like a maniac? *Hell no.* I bleached every surface, put ALL food and eating utensils in the fridge to make sure no vermin would touch it, and even bought traps myself until the exterminator came. There are ways to be proactive about this situation before an exterminator even walks through the door if you give a shit, which he clearly doesn’t.  This is a health hazard, and if he refuses to deal with it and acknowledge your concerns, then yes I would see that as a dealbreaker for the relationship. 

Also, just and FYI, if you’re actually seeing mice and roaches frequently in commonly used places where humans usually visit, that’s a sign of a much larger infestation that has been neglected for a looong time. Hearing mice chewing wood and wires in the wall is one thing, but encountering them on counters and in cabinets either means they’re comfortable with human presence or competition is forcing them to be ballsy, or both. "
275,"You need to get cameras for your home's exterior, pronto. If you're renting, get it cleared with your landlord, but you need to have something to record the inevitable lawn tantrum, not to mention the threats, property damage, or physical violence your mother and stepfather may escalate to when they realize you're actually not going to roll over this time. That's something people post about at r/justnomil a lot, and your mother has already shown she's willing to show up at your home without notice.          

I'm really glad you're standing up for yourself and finally enforcing boundaries, but I have the sinking feeling you're in for one hell of an extinction burst from her.  "
276,"Yessss, you can come sit with me. We like you. "
277,LPT: You will instantly enhance your ability to navigate all sorts of social situations if you become okay with awkwardness.
278,"Yeah, you really should have mentioned you live in India in the OP. Most of the advice you're going to get will be based off of people assuming you're American. 

Advice generally changes based off of where you live and if you have Asian parents. "
279,"Yeah I should talk with him. Last time I tried he said that sex is just ""important"" to him lol"
280,"OBGYN nurse here...yeah, she cheated. I am the first to hem and haw and avoid making such assertions, because that's how you practice CYA medicine, but 7 years of monogamy is pretty much a dead giveaway. So sorry."
281,"First of all, fuck him! Second of all... need me to say more?

He left you suddenly for an EIGHTEEN year old? Gross. Gross. Groooooossss. That won’t last long, don’t worry.

He didn’t have as much experience sexually and you’re a whore? Honey, he sounds like a complete psychopath. Who stays with someone for 3 yrs and leaves suddenly because your sexual experience bothered them?

You are much better off without him."
282,"&gt; so what should I do?

You remember that this relationship is 100% optional. He's a 28 year old slob (and horrific pet owner... 2 weeks without cleaning out/changing kitty litter?? That's straight up neglect) who has decided that he is totally okay with living in squalor and forcing you to do the same. He doesn't want to change, which is why he hasn't, yet.

Is this the type of person you really want to spend your life with?"
283,"ETA: alternative solution:

Text your brother or send him and bride a group email ""Hey, just wanted to let you know I passed along your message to [boyfriend] that you guys wouldn't need his help and decorations after all"". Pretend that you genuinely understood that this was your brother's wish. Insist that *he* is the one who told you to cancel the help and decorations: ""I am pretty sure you told me that on our last phone call, remember, you said you didn't want partners at all. Is that not what you meant? I thought you guys wanted the partners to attend as simple guests??"". Pretend you don't get it/genuinely misunderstood and ask clarification. 

It will be on him to explain that by ""no involvment *at all*"", he didn't mean ""no involvment *at all*"" but meant ""involvment in the chores but not the festivities"" and he will have to ask again for boyfriend's help while refusing to involve him, if he cares too. And if he does, you can simply say that this doesn't sound very fair/reasonable.

Then you two actually attend like simple guests. After the ceremony, I wouldn't attend any event during which boyfriend was snubbed, so we'd leave after the ceremony, when the VIPs go get their pics taken, or before dinner. If you don't want to create a scene, you can make up an excuse to the other guests so that only you, your boyfriend, bride-and-groom, and your parents know the truth/drama behind the curtain."
284,"He admitted to it and betrayed your trust; personally, I wouldn’t be able to be with someone like that long term. The fact that he got angry is also a huge red flag to me. "
285,"When he told you he was ""looking for a wife"" he was telling you you were auditioning, not that he was taking your relationship seriously. What an arrogant doof. He's also pressuring you to stay because he ""wants you"" but isn't interested in what you want (exclusivity). If it were me, I'd bail, because he obviously isn't ready for the kind of relationship you want if he's this selfish. "
286,"If it were my husband, I would want to know. Even if it ""breaks up the family"" I'd rather be divorced and co-parenting than married to a lying-ass selfish cheater. Also, I'd say there's a decent chance he finds somebody else to cheat with (if he wasn't already sleeping with other women), and you can save her from that."
287,"Honestly, just tell the dean you didn't agree on it, and that you do have issues but it wasn't discussed.

Had that in university and the students were actually asked to sign it on and the dean asked me why I wasn't the only one not signing it, and took my opinion on the issue as serious as possible,"
288,"So....I reread your post after reading the critical first comment, and I disagree with that first comment. You sound hurt over years of feeling like your parents (esp your mother?) Love your sister more.

I know *exactly* how this feels. I won't go into my 'story' because this isn't about me, but I too have a little sister with whom my parents have an entirely different relationship and expectations. This hurts *so much*. 

That being said, I understand your hurt. I think it is legitimate hurt. I would ask: can you talk to your mother  (because I think letting it go will just foster further hurt and resentment) without bringing up all your other hurts regarding her relationship with your sister? I ask this because any time I have tried to approach my parents on this type of thing, they insist I am 'hanging onto the past' and they don't actually end up hearing what I am saying. 

Maybe write a letter. Explain how you would have liked the one you loved. It's done now, but I think expressing your feelings on the subject will help you move on from this. I am so sorry OP. This is tough. "
289,"Manipulative asshole, I would block his number and move on with my life"
290,"Lol @ the pearl clutching over your mom crying about feeling “judged” for participating in racist shit. Honestly, fuck manipulative tears. You get to decide what’s more important to you: your relationship with your mother or your principles regarding race. I know what choice I would make. And remember that torching a relationship goes both ways. So your parents also have a choice: their fucking son or their beloved racist lawn ornament. "
291,"Sounds like he's overly concerned with ethics, or possibly believes it's morally right for someone to be a pushover/put themselves out for someone else to their own detriment. Because you don't owe someone you don't like a job reference. And white lies help society function - prizing 100% honesty over kindness (""yes, that dress does make you look fat"", or ""I didn't come to your event because I don't like you"") is a false economy.

I'd also say you didn't take an opportunity away from someone else - you didn't do anything underhand, you didn't sabotage their efforts. *They chose to tell you about the program!* You got in because you were better than the other person - that's how life works. That coworker may have found out about the program from someone else himself!

And if he takes ""he forgot how to read"" as a literal complaint, it sounds like he doesn't have much of a sense of humour. You can have legitimate concerns about this guy *and* make a joke about it. All you can do is explain your point of view and not get into an argument about it - either he or you will decide you're too different, or you'll both find a happy medium. But don't feel like you have to endlessly defend yourself, and don't let him berate you for making different choices - he can express his opinion, sure, but everyone in life needs to learn when to leave things alone."
292,"“Hey, I want to be friends and hang out more, but I do want to make sure I’m not stepping on your girlfriend’s toes. How is she, and have you all discussed what’s okay within your relationship?”"
293,"&gt;You can get chlamydia by having vaginal, anal, or oral sex with someone who has chlamydia.

From the CDC. "
294,He is very immature...too immature to be a sexual partner. 
295,"Hello!

An adhd-er here, not suggesting your wife has it or anything but I understand the need to have something on top of just talking to people. There are a million focuses that make it hard to stay checked into a conversation.

While a phone may be a thing that she feels, has she ever tried just having anything else to fidget with that doesn't draw as much attention away from you.

Fidget toys.
Rubber bands.
Pens or pencils.
Paper clips.
A ring.
Etc.

Anything for her to have in her hands to occupy herself while on a date with you. Assuming she is open to this idea.

But as previous comments state she could be a phone addict and if that is the case, she may not be open to these suggestions and that is a different story.


Edit; you can't diagnose her with adhd from one symptom alone and there are plenty of other reasons why she could be like this, I was only trying to offer helpful solutions on the idea that this is a focus thing and not a need for a phone that works for me."
296,"No, she's never done anything like that. It's really off camber behavior. I mean she's even literally came to some happy hours with my coworkers before. But this definitely threw up a red flag in my mind. "
297,"And it passed down to everybody else in the family - the male cousins who LIVE WITH HER aren't stepping up; none of her sons INCLUDING OP's father are stepping up.  Man, it's painful when karma is actually working and somebody tries to overturn it. "
298,"It's not wrong of you to be upset or want to break it off. It sounds like he is wanting you to just be a different person from who you are. I'm also bothered that when you do make an effort, he doesn't even try to help conversation along or anything.  This really comes down to incompatible personalities. "
299,"You didn’t do anything wrong. He is being rude and childish. Personally, this kind of behavior would be an instant dealbreaker."
300,"If she had stayed, you both could have been hurt or died. She ran AND CALLED THE POLICE. 

*DO NOT* take this kind of comment from male friends to heart, when literally most women's entire lives, we're taught to do exactly what she DID. "
301,"It cannot become beautiful when he's only in it for the sex. ""I expected more sex from a relationship"". He came out about the reason why he's in a relationship: sex. And the fact that he rolls off of you when he's finished and makes you  feel used is another proof that he only cares about himself and his penis. "
302,"If he's moping and whining about having sex once a week, he's going to really mope and whine once you dump him.

Luckily, you'll have dumped him so you won't have to listen to it. :)"
303,"Go on the trip, bring a pack of cards, invite classmates to play cards when you're at your hostel or wherever, bonding will ensue. Go enjoy France. It's France!"
304,"&gt; At your age you absolutely need to put your career first and take this job. Giving her a year to decide if she also wants to move is fine if you can both agree to it.

Agree. If you were married or kids were involved I would think differently. But at this age and you guys only dating your career and future should definitely come first. "
305,"Hijacking your comment to highlight some of OP's comments, because they are terrifying. She is in serious danger and doesn't seem to realize it:

&gt; He says he would rather us both dead than me to leave him. I'm sure he's just being dramatic. 

&gt; He's a bit violent when he is really mad. But it's usually when I'm really angry and very mouthy (which I tend to be when I'm really angry). He's pushed me and slapped me upside the head.

Without this information commenters won't be able to give her the right advice, which is - holy shit girl, run! Make a careful escape plan, don't give him any warning, and RUN. "
306,"Honestly, that was my thought too. His mom makes up supply backpacks for underprivileged kids...she can't have a shortage of empathy for them. If mom already knows OP's history, I'd find a quiet moment, look her in the eye and sincerely thank her for making a difference. It could be a disarming and endearing icebreaker."
307,"Comforting a panicking sibling as you did IS NOT WRONG.

Your parents' assumptions are sick and gross."
308,This. You won’t show up in someone’s “discovery” unless you’ve opened the app recently.
309,"Don't disregard their other sentences either.

3 people tried to do something nice for you and all you can do is look at the bad side of it. I mean this in a productive way, you may need to work at managing your anxiety and other issues better. 

Your post is a series of pretty big paranoid leaps and a lot of worry and trouble over 3 people in your life trying to do something nice for your birthday. I'm also not sure why you're so hard on Annette. Sure, she broke up with your friend/FWB, but you're not dating him and you have every reason to believe they're still good friends. You sound like a jealous girlfriend, not someone in a FWB situation."
310,"Thankyou for your advice, deep down I know I can never trust him again. I've given him too many chances and I feel like a doormat."
311,"To add to this: I lived in one living situation where it got kind of tricky to know what was ""up for grabs"" to be shared and things ended up going bad, who's responsibility were they, etc. Someone inevitably buys eggs or milk, but they're special eggs for XYZ and then there's a problem. To be fair, we had 5 people living in the apartment and sharing the kitchen, so it was a bit more confusing and harder to let everyone know to their face. We ended up sticking those cheap circular stickers on the outside of the fridge and any food items dubbed ""shareable"" got a nice red or orange circle tacked on them. It was super duper helpful, and easy to do when putting away groceries since they were just hanging right there. I think just discussing something like this, or what is shared in general, would be a great intro for OP into this convo with their roomie. "
312,"Your relationship with your BF is not fucked. both of you reacted just fine. You can trust him and he should be able to trust you.

---

It is time to set boundaries with your mom and keep them firm.

Call your mom. When she starts talking and won't let you get a word in edge wise, hang up.

Try again the next day.

Repeat until she finally learns to listen.

""Mom, what you did was shitty and manipulative. Guess what, you don't get to choose my BF. I do. NOTHING you do is going to change that.

Now, you have a choice to make. You can continue acting the way you do, in which case you will slowly (not that slowly mind you) push me away, OR you can respect me.

To be clear, I will not tolerate this sort of bullshit anymore.

What you did was disrespectful to me and to the man I invited into your home. Deep down, you know this, because you were trying to push him away so that I would go back to my ex.

Nope, You don't get to talk. I've listened to what you have to say.

think about what I have said."""
313,"It's cocaine. He's taking cocaine for his diabetes. Call OSHA about all the blood (and super don't touch it), then get a new job."
314,"I'd call the cops, personally. No way am I knocking on the door of someone who sounds that furious and unhinged. "
315,"You're someone who had a DUI once, successfully completed the resulting program, got your license back and have moved on. You made a mistake, it was really embarrassing, and you did everything that was required of you to fix it. Sounds like you haven't gotten into any more trouble like that in the intervening three years. Good job!

Your partner is a guy who tries to literally blackmail someone into dating him. Yuck.

I have a hard time imagining anyone is going to side with him on this one, and I agree with the other comment saying that heading him off at the pass is a good idea. Your family and friends like you for a reason (many reasons!) and I really hope that they would have a compassionate response to telling them ""I've just broken up with \[M\], and he is threatening to share something from my past in retaliation. I wanted to keep this private, but I know you would rather hear this from me than him; I had a DUI three years ago, and went through a program to reinstate my license."" Your parents might be upset that you didn't tell them at the time, but it's clearly terrible behavior on your partner's end to use this as ammunition."
316,"I get you - she’s not a threat or an issue herself, it’s all your husband’s behavior. 

He needs to acknowledge he’s been acting inappropriately for anything to change and for trust to possibly be restored. Even if you guys went to couples counseling, I can’t imagine much would improve unless he dropped the defensiveness and owned up. "
317,"I was once having a huge fight with a friend when we were like 20 and I yelled ""just because you're the hot friend --"" and she yelled back ""what the hell? You know you're the hot friend!"" and then we stared at each other for a second before we went back to fighting."
318,"And don't do any sort of couples counseling with him either, OP. He's an abuser, and you need to leave."
319,"Right now you are empty and your mother and wife are asking that you give them all you got and more.

My heart goes out to you. I am going to tell you what I believe you should do and although it will be hard, you must try or you will never get the mental peace you deserve. 

Stop letting tears sway you. Its a form of manipulation and your mom and wife know it works on you. They have no accountability for their actions because you will fold. You are right in saying they are like children, they put on a show to get what they want...and as an experienced mom kids will never keep doing it to a parent who tells them to cut the shit or there will be punishment. You need to tell them to cut the shit or you will go black.

You mom couldn't hold the door open? Let her have that defective heater. Your wife can't stop spending? No more joint account, you will open a separate one for her that you will put money in monthly. Kid not being watched? Wife gets a job and 3 year old gets daycare. 

Stop running yourself ragged for people who know how to get what they want from you. They are willing to sacrifice your peace, money, hard work, time, job so *they can have more more more* without lifting a finger. 

I'm sorry about your dad. I hope you get enough time away from your family to properly grieve him. By enabling his wife to use you and manipulate you  you aren't honoring or taking care of her. I think he would be angry if he knew what they were doing to you."
