,text
0,"Lie.

Talk to your sister and develop conditions that your parents will approve of, and later give them to parents and announce them together to your sister. This way your parents will think they're ""in on it"" and won't feel like they're being cheated. Tell your sister to act surprised, maybe throw a tantrum or get a little upset. But between the two of you, you know what the real rules are."
1,"He sent pictures of himself fake crying? Jesus, if that’s not a turn off, I don’t know what is. "
2,"Not being stood up for teaches you, at the very least subconsciously, that you shouldn’t stand up for yourself.

There’s a reason that “you go girl” type of stuff got really popular. It helped struggling girls gain confidence and stand up for themselves when they might have otherwise felt like society didn’t have their backs.

By doing this you’re signaling to her that she would be in the right to stand up for herself too. Fuck that nonsense your friends said. Being an adult doesn’t mean you grew up right. She could very well have been bullied or had bad parents and never learned how to be hard, or even like she’s *allowed* to stand up for herself.

I was that girl and I was with my abusive ex for 2 years. Outward support is **powerful** and the only reason it lasted so long was because I was used to my dad yelling at me growing up so I always internalized it and thought I deserved it. I watched my mom witness my abuse and stay quiet and that taught me that I should be quiet too. Watching almost all these people quietly accept her being treated poorly likely had the same effect — feeling like it’s not that big of a deal and she’s not allowed to be upset, or that she’d be causing a scene by standing up for herself.

She deserves for society to have her back just like everyone else. Fuck being abandoned to deal with your own shit when clearly you’re being verbally abused. He was nasty as fuck and no one should have even wanted to be around him. Let alone some of you guys not only accepting him, but thinking other people should keep quiet as well. Yeesh."
3,"You absolutely have to ask him.  Just sit him down, tell him his mom showed you the painting, and ask why he's getting the same thing tattooed on him."
4,Your brother sounds amazing! Congrats on getting into your top choice!!
5,"Moping?! Nah. I mean i guess share with him your frustrations and give him a cance to change, but that would be a dealbreaker for me. "
6,"Matching shirts for the wedding party that say ""Please not here"""
7,"He offers a legal separation? Wow. I am so sorry. I can't even imagine my husband bringing up something like that with me and I'm not sure how I would respond to it - I'm trying to put myself into your shoes. I've kind of always wondered what an open relationship would look like and I don't know that I could do it without crossing boundaries (falling for someone) or getting jealous. 

The good news is that he told you. He was honest about what he wants. It's not crazy that he would consider or imagine having sex with another woman or other women. Many married folks have thoughts of straying or just having no strings sex with someone so that's not out of the ordinary. I guess the hard part for you is that he wants to act on it and make his fantasy a reality. That's where it gets dicey.

So, the bad news is that you two do not see eye to eye on this and he's spilled the beans and he can't take back what he blurted out to you even if he wishes he could. It's too late for that and now you're affected emotionally to the point where you are sick over it. Does he know how deeply this request has affected to you? It sounds like he doesn't realize the damage it's caused. If I were you I'd make it 100% clear to him that you have become devastated over this, feel like you can't trust him any longer, and are ready to file for divorce. Show him how upset you are. Don't laugh with him when he tries to joke about it and brush it off. You shouldn't laugh about it because to you, this isn't funny. Your feelings are valid and he needs to recognize it. 

No more jokes, no more pretending you're not crying everyday when you have been crying. Just be as honest with him as he was with you. I know sometimes things get to a point where you just can't talk anymore about what's already been discussed and it gets to be overwhelming and you're not getting anywhere anymore. If you talk it through, show him your honest feelings, and maybe even get some counseling together there might be a chance to salvage what you've got. If not, then I wish you luck. "
8,"This is the first real test in your relationship, but not quite in the way that you think.

First and foremost, don't assume that your bf's parents remember the reputation (no matter how awful it might have been) that a random teenager garnered in high school 8-ish years ago. Even in a small town, you've got to assume they have more to do than keep abreast of the teen gossip, much less connect that gossip they heard to the woman their son is dating in his mid-20's.

Second, your BF knew you in high school. Which means he knows these rumors are false and malicious. He also knows you now, so even if they were true, he should be proud of the person you are in 2018. Which brings us to the actual point:

So the test here is **to tell your boyfriend about your concerns.** Be honest with him. Tell him you're scared that your reputation and your past financial situation make you worry how they'll see you. If he's even remotely worthy of dating you, **he will be 100% on your side in making sure that IF his parents actually do know about anything of the things you mentioned that he's right there by your side to ensure they know those things are FALSE.** That's what a good partner would do.

You two should go into this dinner as a team, and I think you'll feel much better knowing you have ""backup"" in case things shake out even remotely the way you are worried they will. It'll be ok!"
9,"I think you handle the situation pretty well, the moment he started berating his girlfriend in public he made it a public thing therefore everybody's business, and you stepping in probably stopped the situation from escalating. "
10,[removed]
11,"Don’t really have any advice, but you sound like a great brother. Carry on. "
12,"I've got to give your husband *some* credit because instead of just wandering off and having an affair like most people, he brought up his issues with you directly and then backed off when he realized what he was broaching was too hurtful for the relationship. He even committed to getting help. 

That's *something*. 

I can completely understand why you are hurt. It's incredibly hurtful to hear that from somebody and to think that you're not enough for your partner.

But I still see your husband struggling with these urges and trying to do the right thing by you. I feel like that might be enough for you to hold onto and to get through this.

He should follow through on therapy and you guys should get into couples counseling. See where this goes. He does seem to be committed to you and your marriage and fixing himself. That might be enough to make it through this."
13,"Dating is a series of auditions. If someone doesn't seem right for the role, you let them go. You don't try to make them be the right one."
14,Just tell her no? You seem to never make any kind of move to show her you are not okay with it
15,[removed]
16,"If you do this, you should also negotiate with your parents and make clear that if they cut access to your brother in any way, or send him to one of these bootcamps, the alleged ""restrictions"" on your sister will be gone. By ""giving"" them something they want, that puts youin a position of power. Don't squander it.

Oh, and carry on being a fantastic brother :-)"
17,"I think given that she reached out to you when the tables were turned, it's safe to say she'd want to know about this."
18,She clearly has issues from her parents divorce that she didn't take care of properly. She needs therapy. 
19,"&gt;  I guess the ways we each viewed that situation was too different for him (my putting work priorities before family), so he broke up with me when he came back. He said our views are too different 

Dude, no. Your views are different, but it's not work before family, it's acting like a grown-up and making plans in advance so you can afford your hotel room before sponging off your girlfriend. He made his own bed here.

I know this is painful, but sometimes break ups are the right answer."
20,"No OP, life has not magically “improved for the better”.... You MADE it better. "
21,"That's very paranoid behavior. People have work phones all the time , it's pretty normal though her reaction is not normal . I say cut your losses and move on. It sounds like she has some bad insecurity issues. Does she snoop through your personal phone? "
22,"&gt;browsing vibes together was a weird but fun experience!

Is it weird that this is oddly heartwarming? It just shows how good a space you guys are in now- this is a great update. Glad to hear an honest convo was enough to get you both on the same page, and that you're working together to find what works.  "
23,"&gt;She's stopped talking about him to me, but is actively talking about him to friends and she's still looking him up on social media.

Your fiancée wasn't ready for another relationship, let alone marriage.  She was with this other guy for less than a year and yet she's allowed her obsession to overshadow your relationship.  Not only that,  she flat out doesn't care about your feelings.  She dismisses your justified concerns and continues to obsess about the other guy.

I don't understand why you would punish yourself this way.   Shut down all the wedding planning, even if it means losing deposits.  Then tell your faux fiancée you are going to find  someone who will be happy to have you and never look back.


  "
24,"I'm flabbergasted that you would even consider giving up a lifelong hobby that you still enjoy immensely for a girl you've only been dating for ***TWO MONTHS!!!*** Even if she had the world's best reasoning, the decision to give up something like this over an 8 week long relationship would be really short sighted.

If her interest in dating you is contingent on whether or not you play chess, she can absolutely find someone else to date who fits her dating criteria."
25,"He meant to text someone else. He didn't forget you were best friends, he thought he was texting some other girl from the looks of the conversation. Sorry."
26,"I think you will both be better for it if she goes off to college and graduates. You both need real adult experiences on your own, and like you said, not to have things chosen for you. Give her a lot of space to make new friends and connections in college.

Once she gets older and independent enough to make her own decisions, you can see where you both are in life and reevaluate then. It could be neither of you are interested, or become different people once you get some experience.

Keep up with the therapy!"
27,"I would not stay in an apartment with roaches and rats. If that becomes a deal breaker, so be it.

Also, be careful he doesn’t bring any roaches to your place. They can hide in bags and travel to
the next destination. "
28,It sounds like he’s trying to pass off incompatibility as you not being good enough. 
29,"Good for her!

My mum had a small car crash with me in the car when I was 2-3 years old. Since then she has refused to drive again. That was 35 years ago.

My dad and sisters are fed up being her driver. I told her I wouldn't drive her anymore because she stresses me when she's the passenger. She's one of those who screams whenever something ""scary"" happens. Those ""scary stuffs"" are things that nobody else think is scary..."
30,"&gt;When I told him that I wasn’t ready for sex yet, he started to beg and say that he was suffering from the fact that we haven‘t had sex and that „a man needs sex“.

Red flaaaaag!  You don't owe anyone anything, let alone sex.  A guy who actually respects you might be bummed out, but he wouldn't pressure you or act like you owe him anything.  He's emotionally manipulative and I wouldn't waste your time on him.

&gt;Apparently, that day was an important date to him, because his favorite musician died and his favorite sports team won a game, and thats why he wanted to lose his virginity on that exact date.

This is so stupid.  I can't wrap my head around how stupid this actually is."
31,"It's funny because I have a lot of gorgeous friends who would always get hit on before me and when they said they had boyfriends the guys would turn to me like a second option. I felt like it was a great way to weed out guys. The one that's for you, will hit on YOU and think that you are the most beautiful girl. "
32,"&gt;So, this is where I need help. My SO gets very defensive during arguments and I want to raise this as non-confrontationally as possible. Although I've caught him lying, I feel infinitely ashamed that I snooped. How should I go about this reddit?

People assume that a ""break up"" requires an iron-class case, like as if you're going to court. It doesn't. You can tell him ""Hey, I know you're still talking to [ex], we're done"". You don't need to tell him how you know, or show your evidence. You don't need to feel like you can't break up with him, just because you snooped. 

He's proven time &amp; time again that he can't be trusted. Why bother?

You're unhappy, you deserve better, and you can leave."
33,"Thank you.  Thank you so much for standing up for this girl.  How many awful things have been done in this world because people didn't want to get involved?  Because they thought that it wasn't a big deal, or they didn't want to make a scene, or because they thought someone else was handling it? So many horrible things have been done because people lacked the courage of their convictions to stand up when they saw something was wrong.  You stood up.  Thank you.

As for your ""friends"" (who are kind of cowardly IMHO), they say, ""his girlfriend is a grown adult who can handle her own shit.""  Let's question that.  Your friend has become so comfortable with criticizing and berating his girlfriend that he now lets it be seen in public.  How much belittlement goes on behind closed doors to give him that sense of entitlement?  Enough to make him an emotional abuser?  This girl, who may will be emotionally abused, can NOT ""handle her own shit"" if all of her emotional energy is going towards keeping him appeased.  It will make her forgetful (feeding the meter), clumsy with nervous energy (spilling the water), and paralyzed into inaction (her inability to stand up for herself).  People who are locked in these toxic relationships do not have the perspective to see what it looks like to healthy individuals; you gave them both a reality check.

There are four parties here who owe you some gratitude.  First, there is the girl because you told her that she is worth defending.  Second, there is your friend because he needs to know that he is becoming a horrible person and that needs to be corrected.  Third, there are the other people there that night because they need to be reminded what it looks like to do the right thing.  And, fourth, you need to thank yourself because you can look at yourself in the mirror and know that you walk your talk.  Good job.  Keep it up."
34,"Incubation time 1-3 weeks, but it could be months, as there aren't obvious symptoms.  Plus 1.5 months since you noticed your symptoms.  So that puts your infection at 2 months ago.

Her incubation time 1-3 weeks ...  call it another month, so 3-4 months ago, estimated time of her contracting it.  Analyze her behavior back then, if possible; it's a major accusation, so take the time to think back and verify, if possible.

IMO, you know you didn't cheat, so you are suspecting and accusing her.  

From her point of view, she knows she didn't cheat, so she is suspecting and accusing you.  Especially after she demonstrated loyalty for 7+ damn years, you cheat on her after all that effort and trust she put in the relationship and you?  You're an asshole, she's revolted by you, and she's deeply hurt, and it's over, and she never wants to see you again.

Except she's not acting that way.  She's acting meek, and hopes that you won't accuse ~~falsely~~.  IMO she cheated, and she knows when.
"
35,[deleted]
36,"This sounds like the old “I don’t wanna be the ‘bad guy’ so I’m going to be such an intolerable intromittent organ that you break up with me” tactic.

I’d comply and break up. "
37,It's been only six weeks and you're already dealing with problems. This won't turn into something beautiful.
38,"""So I'm good enough to get her groceries but not good enough to be her granddaughter?"""
39,"You and your brother might end up being the only two truly happy people in your family. 

The rest of them sound miserable. "
40,"I'd normally be on her for misleading you for so long, but the 5 years of your relationship started when she was 16...I wouldn't expect *anyone* to know 100% their stance on big life things at that age, or even 18 or 20.  "
41,"""I'm concerned that we're just not very compatible, and he'll never understand.""

Your concerns are well founded, and probably correct. You guys just have differing views on a lot of important things, perfectly reasonable reason to break up."
42,"I don't understand how you found out about the ""which one, the sexy one or no?"" 

But between that and the ""he's not, trusttt meee, he's not"" (that ""friend is not your damn friend)...this sounds so immature. Not that people 20 or 40 years older than you can't be cruel (because they can), but I remember how insane the lack of mouth-filter was back then. 

Here's what: yes, you can do other things together with your BFF, but having a blast in clubs is kinda where everyone wants to be at your age. If you don't like clubs, don't go. But if you do, don't let some idiots deter you. When I look good, know I look good and look good for ME, no one derails that confidence. Sure, being BFF's with a goddess will suck sometimes, but be your own damn goddess. I hate my hair. My best friend has great hair. When we go out, she gets loads of compliments on her hair. Which makes me happy because she rocks. But that doesn't take away from me. I have a bunch of ish I rock just fine. 

And TELL her. She can tell something is up with you. I'm sure it would break her heart to know you're going through this. She will want to talk about it or help if she can. And she should know some guy she's interested in is making awwwful comments like above. "
43,"that's how I feel around literally every girl I know. I've always been the ""funny"" girl, the ""chill"" girl but also always the ""ew no, she's the ugliest of them"" girl. Sadly I do not have any advice for you because I simply got used to it and accepted it, but trust me that not everybody likes ""perfection"" and there is a ton of guys out there who would say you're the sexy one. Keep your head up girl! As you said, it's not your friend's fault but she should know about this. I'm sure you will find a solution together :)"
44,"If you want to be petty, reply to him saying ""Please don't e-mail me again."" and put her in CC."
45,"&gt;Should I move by myself and just have us visit in both directions for a while to ease her into the idea? 

At your age you absolutely need to put your career first and take this job.   Giving her a year to decide if she also wants to move is fine if you can both agree to it.   

&gt;I would then end up paying for two apartments (or one and a half I guess) in two of the most expensive cities in the country since she couldn't quite afford our current place by herself

Nope.  She can find a roommate to split costs in her current location assuming she continues to refuse to move.  You should not saddle yourself with paying her rent.  Pay out the lease you are currently in with the understanding that she will need to figure out her housing situation when the lease runs out."
46,Dude...come on. It's time to leave. For you and for your kid's sake.
47,"Then I guess he can have all the sex he wants. With himself. He is purposefully disregarding your feelings about your own body and your own autonomy. You don’t want to have sex in public places? Perfectly reasonable. Don’t do it, you could get in trouble."
48,"You have every right to call it a night whenever you feel is appropriate, especially if you have to work in the morning. Your boyfriend is being ridiculous."
49,"&gt;he offers legal separation?

I know right? WTF - he says he doesn't want to divorce but then offers up a serving of diet divorce? 

I think he's more serious about making this happen then he's letting on."
50,"You need to just sit her down and tell her that your preferred model for handling food is that you each buy your own groceries and cook your own meals. I've always had a ""condiments are shared"" policy with roommates because otherwise you end up with a fridge full of double and triple condiments, but whatever you prefer, you just need to make it clear.

This is one of those things that there's probably no way for you to keep it from being weird or awkward, because that's not in your control. All you can do is be clear, firm, and kind, and if she takes it badly that's on her.
"
51,"DO NOT RETURN TO YOUR HUSBAND.

Stay with your family, find a divorce lawyer and divorce him. Or just get the marriage annulled.

---

Your husband is an abuser. His threats of divorce are emotional abuse and all about control. 

If/when you call his bluff, his tune will change, but only long enough to get you on the hook again. Then he will slowly start ramping up the abuse again.

Accusing you of lying is basically gaslighting. Trying to get you to believe a false reality so that you will doubt yourself.

Dragging you in front of his family only to yell at you until you cry is just straight up abuse.

For your own safety and health, you need to leave this man."
52,"How has she got to 39 and not realised that the majority of people don’t have $400K in savings?

"
53,That's actually a nice plan. 
54,"That's awesome, I'm not premed but my degree had me working along side a lot of pre med students and the MCAT studying is no joke.. Really happy it all worked out for you two. "
55,"Why can't your wife help your Mom? Couldn't she go over and hang out with her while the water heater guys are there? You're taking care of two adults who don't have jobs -- I don't see why they can't help each other out with the day-to-day stuff. 

You have to put your foot down though. Write down a list of things you need to keep your sanity and work out solutions for each one. The first thing is the crying shit. Do not give into it. Your wife is a child and like a child she needs to cry it out. She's manipulating you because it works. Every single time she starts crying just calmly tell her, ""We need to have a serious discussion about this and that can't happen with you crying. We're going to discuss this again once you've calmed down.""

Then wait for her to finish and do it again. And again. And again. Consistently with every issue. If she wants you to do something you don't have the energy to do tell her no and let her cry. You have to stop this now because your kid is going to catch on soon that if she wails and screams she'll get whatever she wants. 

Separate the finances and get your family on a budget. Use prepaid debit cards for your wife if you have to. Figure out a timeline for when your wife needs to go back to work. You can't keep working two jobs. You're going to burn out. Discuss this with your wife and when she cries about being a terrible person be honest and tell her, ""Right now, you are being terrible. I need to be able to discuss my feelings with you without you crying and making it all about you."" 

It's going to be hard and you need to get tough and be a little selfish here. Your Mom comes last -- she needs to start adulting -- period. Show her how to do basic things, write out a list, and tell her to figure it out. Make yourself unavailable and start saying no. Tears be damned."
56,"&gt; Aww, you only get paid 15.50/hr? That's so little, I get paid 20/hr 

That's an asshole move by your boyfriend.  Regardless of all the other insensitive crap he's doing, this one is the worst.  That's not unintentional either, he's doing this on purpose."
57,OP will look back on this relationship in a few years and shudder. This may or may not be coming from personal experience.
58,"They think Computer Science isn't ""useful""? Are they aware that there are constantly tons of high paying jobs in high demand for that degree?? Good grief. Support that girl, especially if she's going into something like CS. It's hard, it can be isolating as a woman, and it's a great degree to have."
59,"I would have reacted the same way. He's within his rights to tell you he doesn't want to be exclusive, and kudos for his honesty. You're also within your rights to stop seeing him, and if you've already started getting attached or seeing yourself developing feelings, it was the wise thing to do. "
60,"Oh my god. Oh my GOD.

Your girlfriend is .... that is awful. Awful. She gaslit everyone about this poor girl and made everyone hate her... for what? What did it gain her? She manipulated everyone, including you, and you played right along with the cruelty. Monica dropped out of school because everyone thought she was a crazy when she was telling the truth. Callie literally ruined this girl’s life. 

Your girlfriend is really something. And not something good. "
