,text
367,"Admit it, your skin has never been better after that Dove Love Lotion."
368,Shrek
369,He's touring the Caribbean and showing off sack
370,I like to introduce my wife as my ex girlfriend all the time. Its funny everytime except to her and my girlfriend
371,"FYI if this sorta thing happens then quickly put your phone on airplane mode and the message will fail to send. Then just delete the message, and take airplane mode off."
372,"Yup, cruise control or a governed vehicle are your best friends in that situation.  I once nutted while driving a governed vehicle and same thing the leg was pushing down on the throttle for all it’s worth but fortunately it couldn’t go faster than 110kph."
373,"Well, on the plus side, you know her sister still thinks of that encounter positively so when the divorce comes through, maybe there's an avenue you can go down...

When God closes a door..."
374,That gave me a chuckle.
375,"""You have brought shame upon our family."" Ironic."
376,Good on you for getting sober man. That’s what’s up.  I know how hard it is.
377,or a hasty exit
378,"I agree, if it happened before we met, you can’t be mad about that. But keeping it a secret only breaks trust and causes problems. I would be livid, but for that reason alone."
379,"To be fair I think we're several levels beneath ""bad sex."" Even with *bad* sex maybe you'll learn something for future reference. What we read is fucking *vile.*"
380,"Hmm, maybe there’s some truth to the real estate porn genre?"
381,"Seriously, steal the headphones and go where with them? Behind you, in their assigned seat?"
382,YVW - source;  am a parent and the struggle (and the hormone horror show we go through during birth and milk production) is real lol
383,SHRONK
384,"They both are. Finding ""fresh squeezed titty juice"" funny is amaze-balls"
385,He gay.
386,"LOL, it's true she knows how to play me like a fiddle and I can hardly say no to her usually, she's too cute"
387,👉😎👉 zoop
388,I thought 43 was OP's age.
389,People that step right out of the bath/shower without drying off in the tub are the bane of my existence.
390,"Reading through what OP's all said, it seems like he was attempting to lie to cover it up by implying both the sister and him coincidentally have the same sex story. He tried to double down after getting found out basically, which never works"
391,"The fact that he was so understanding of the wife reaming him a new one after her mother did it to her made me think he’s a keeper, his response and apology confirms it.  I don’t think he needed to apologize. That should be the MIL, but I can still appreciate the gesture."
392,"""Someone get this man a proper ass-wiping!"""
393,"Yeah I gotta say you're pretty spot on. I'm only half Asian, and my dad was never like that at all, in fact he's been criticised for being too Americanized in the past. Then again he moved here to the US in the 70s so it's been a while.

But, not all of my family is like my dad, and none of my Asian friends have parents like my dad. Some of the stereotypes couldn't be any closer to the truth.

My dad never told me that I wasn't worth anything because my GPA was subpar. My dad never pushed me to become a doctor, go to a UC, or drive a BMW or Mercedes. All my Asian friends though...

Stuff like this is par for the course for a traditional Asian parent."
394,That's a self-fulfilling prophecy if I ever heard one.
395,/r/avertedTIFU
396,"I'm not usually one to doubt TIFUs and just blissfully assume they're true for the amusement, but..I am doubting."
397,"Clearly not, as Steve already knows this info."
398,"So. . . let me get this straight. You took a bath? And still had shit between your cheeks? 

Please tell me you fell and scared yourself and shit yourself"
399,You need to learn how to gracefully say no and leave!
400,"There's not really anything suspicious or unlikely about not remembering exact details from a drunken wham bam encounter years ago.

Especially if these folks are in their 30's. I dated a girl for 2 years in my 20's. I wouldn't remember or recognize her if she sat on my head.

It's like you remember field trips you took in school but you don't remember everybody that went with you. The ones you do remember and still know you don't think about that field trip when you see them.

It's entirely plausible that he didn't make a connection. He almost definitely thought he was well clear of the wife finding out about the sister hookup years ago.

Poor bastard thought he was safe."
401,"Fuck, man. Im sorry."
402,Stop popping off that amalgamous cacophonous sarcophagus out of your esophagus.
403,"People honestly don't watch to see if their toddlers are in harm's way. It drives me nuts. Like, when I watch small children I make sure they don't stand in front of doors, because of exactly what happened with you, and the toddler sure as hell won't see it coming.
Why do the rest of us have to watch out for these people's spawn? Grr."
404,"Oh hey, I remember in track practice one of our upper classman hurdlers fucked up and landed ass crack on the hurdle and just sat there in pain until help arrived. Maybe he sat on his balls too, idk. 

Now normally these things just tip over if you mess up. They're designed to do so, so I'm really not even sure how he managed it. The coach and assistant coach had to help him waddle to the trainers office so he could get checked out and later campus security drove over in a golf cart to take him somewhere. 

Coach said something like ""Never in my twenty years of coaching have I seen anyone do this"" as he walked the guy, and he says that phrase a lot, but I'm pretty sure he meant it this time. Apparently the dude was bleeding out of his ass, it was that bad."
405,"&gt; And before i leave, she can just say the word and I'm ready to beat the shit out of him. Her head was down to her knees, she didnt say a word just sobbing. All she did was put her hand on top of my hand and gently squeezed it.

Reddit fanfic strikes again."
406,"Ok, Eminem."
407,Broken condom needs this 21/7/19
408,"Really?

I found it horrifying."
409,Shrek
410,I wish that link would have stayed blue.
411,"r/JUSTNOMIL

&amp;#x200B;

Seriously though, your house, your rules, your humour"
412,"Why does this video exist and how does it have 4,000 views?"
413,"To me it doesn't sound like OP was more concerned of what they thought of him, rather he was very depressed and pretty much self-harming."
414,"Upside down meaning she had the speaker next to her mouth, or the active screen away from her head? (Source: have done both, but not for a while phone call...)"
415,Shrek
416,"This reminds me of the movie Kingpin. ""What is it about good sex that always makes me have to take a crap?"""
417,Most impressive thing of the whole story I there may be 42 other u/landlordfuckers.
418,I miss the old TIFU rule where something bad had to result. How is getting buried in Shrek a bad result
419,"I once dated a half-Korean, half-Mexican girl. Her mother was the Korean, and she found out we began our relationship as an open relationship.

Let's just say it began bitter feelings between us that exist to this day. My ex was the victim of sexual battery in high school, and her mother's response to that was to cut my ex's hair super short and refuse to talk to her for months.

I thought I had seen irrationality before, but Jesus H Christ. There was absolutely *no*  reasoning with that woman, and my ex *still* felt like she was a bad daughter. She was constantly having to struggle with making her mom proud.

I've traveled around Asia for quite a while, but I'd never been exposed to Korean culture. Since then, I've learned just how toxic traditional Korean culture can be both within the family unit, but also on a national scale."
420,Maybe he used his twin's name as his cover identity!
421,"Took a few shots, went for a drive, and effectively crashed into a curb? Just be happy you didn’t kill someone..."
422,I'll take things OP didn't say for $500
423,"Why on earth would you have sex with the woman you described in the situation you described, are you fucked in the head"
424,You're probably right. Maybe robots will be my thing. Goodbye fleshies!
425,TIL not to play stupid questions on public forums.
426,Shane Dawson is that you?
427,yah like... it's the definition
428,"""We have an understanding that we both had sex lives before we met""

No.  No you don't."
429,"My boss has a version of this story that ended up way worse than yours. He took off work one day to go pick up the ring and obviously didn’t tell his now-wife. She called him at work for something (this was before cell
phones) and his boss (knowing he was going to pick up the ring) said he was just in the back of the building doing something...she called back a little while later; his boss said the same thing but says that he can’t page him or anything and that he’d give him
the message when he saw him. 

At this point she gets suspicious and decides to call her future FIL to see if he can run down to my boss’s work to see if he’s there. So my boss’s dad (who is unaware of all this) drives down and lo-and-behold, his car is gone and he’s not at work. Now they BOTH think he’s up to something. 

He went home a few hours later at his normal time, and she asks him how work was. He makes up an entire lie about his “day at work”, in which she proceeds to lose her shit and tells him she knows everything, asks who he’s cheating on her with, etc. He tries to cover it up in order to not totally ruin the surprise, but it backfired and she was in tears literally about to pack up her things and walk out the door. That’s when he finally had to pull the ring out of his pocket and be like THIS IS WHAT I WAS ACTUALLY DOING ARE YOU HAPPY NOW???? And she was like oh....yeah :)"
430,"Does she tell your kids ""Ich hab ein Auge auf euren Vater geworfen"" when they ask how you met?

(Too cheesy?)"
431,"Did you feel a gust of wind above your head when you missed the joke I set up?

Read the first letter from every one of those helpful tips"
432,"Ok it's not your fault that you inadvertently slept with her sister before you met her, but you ABSOLUTELY should've told her when you realized. I dont think I could get over something like that. She can never look at you or her sister the same again.  I'm sorry for your unfortunate situation but you shouldve told her back then. Now she wont be able to trust either of you. And like I said if my future husband came out with ""I slept with your sister before we met,"" I wouldnt be able to overcome that. Good luck my dude."
433,The birth of a copypasta. Isnt nature beautiful?
434,shrek shrek shrek shrek shrek shrek shrek shrek shrek shrek shrek shrek shrek shrek shrek shrek shrek shrek shrek shrek shrek shrek shrek shrek shrek shrek shrek shrek shrek shrek shrek shrek shrek shrek shrek shrek shrek shrek shrek shrek shrek shrek shrek shrek shrek shrek shrek shrek shrek shrek shrek shrek shrek shrek shrek shrek shrek shrek shrek shrek shrek shrek shrek shrek shrek shrek shrek shrek shrek shrek shrek shrek shrek shrek shrek shrek shrek shrek shrek shrek shrek shrek shrek shrek shrek shrek shrek shrek shrek shrek shrek shrek shrek shrek shrek shrek shrek shrek shrek shrek shrek shrek shrek shrek shrek shrek shrek shrek shrek shrek shrek shrek shrek shrek shrek shrek shrek shrek shrek shrek shrek shrek shrek shrek shrek shrek shrek shrek shrek shrek shrek shrek shrek shrek shrek shrek shrek shrek shrek shrek shrek shrek shrek shrek shrek shrek shrek shrek shrek shrek shrek shrek shrek shrek shrek shrek shrek shrek shrek shrek shrek shrek shrek shrek shrek shrek shrek shrek shrek shrek shrek shrek shrek shrek shrek shrek shrek shrek shrek shrek shrek shrek shrek shrek shrek shrek shrek shrek shrek shrek shrek shrek shrek shrek shrek shrek shrek shrek shrek shrek shrek shrek shrek shrek shrek shrek shrek shrek shrek shrek shrek shrek shrek shrek shrek shrek shrek shrek shrek shrek shrek shrek shrek shrek shrek shrek shrek shrek shrek shrek shrek shrek shrek shrek shrek shrek shrek shrek shrek shrek shrek shrek shrek shrek shrek shrek shrek shrek shrek shrek shrek shrek shrek shrek shrek shrek shrek shrek shrek shrek shrek shrek shrek shrek shrek shrek shrek shrek shrek shrek shrek shrek shrek shrek shrek shrek shrek shrek shrek shrek shrek shrek shrek shrek shrek shrek shrek shrek shrek shrek shrek shrek shrek shrek shrek shrek shrek shrek shrek shrek shrek shrek shrek shrek shrek shrek shrek shrek shrek shrek shrek shrek shrek shrek shrek shrek shrek shrek shrek shrek shrek shrek shrek shrek shrek shrek shrek shrek shrek shrek shrek shrek shrek shrek shrek shrek shrek shrek shrek shrek shrek shrek shrek shrek shrek shrek shrek shrek shrek shrek shrek shrek shrek shrek shrek shrek shrek shrek shrek shrek shrek shrek shrek shrek shrek shrek shrek shrek shrek shrek shrek shrek shrek shrek shrek shrek shrek shrek shrek shrek shrek shrek shrek shrek shrek shrek shrek shrek shrek shrek shrek shrek shrek shrek shrek shrek shrek shrek shrek shrek shrek shrek shrek shrek shrek shrek shrek shrek shrek shrek shrek shrek shrek shrek shrek shrek shrek shrek shrek shrek shrek shrek shrek shrek shrek shrek shrek shrek shrek shrek shrek shrek shrek shrek shrek shrek shrek shrek shrek shrek shrek shrek shrek shrek shrek shrek shrek shrek shrek shrek shrek shrek shrek shrek shrek shrek shrek shrek shrek shrek shrek shrek shrek shrek shrek shrek shrek shrek shrek shrek shrek shrek shrek shrek shrek shrek shrek shrek shrek shrek shrek shrek shrek shrek shrek shrek shrek shrek shrek shrek shrek shrek shrek shrek shrek shrek shrek shrek shrek shrek shrek shrek shrek shrek shrek shrek shrek shrek shrek shrek shrek shrek shrek shrek shrek shrek shrek shrek shrek shrek shrek shrek shrek shrek shrek shrek shrek shrek shrek shrek shrek shrek shrek shrek shrek shrek shrek shrek shrek shrek shrek shrek shrek shrek shrek shrek shrek shrek shrek shrek shrek shrek shrek shrek shrek shrek shrek shrek shrek shrek shrek shrek shrek shrek shrek shrek shrek shrek shrek shrek shrek shrek shrek shrek shrek shrek shrek shrek shrek shrek shrek shrek shrek shrek shrek shrek shrek shrek shrek shrek shrek shrek shrek shrek shrek shrek shrek shrek shrek shrek shrek shrek shrek shrek shrek shrek shrek shrek shrek shrek shrek shrek shrek shrek shrek shrek shrek shrek shrek shrek shrek shrek shrek shrek shrek shrek shrek shrek shrek shrek shrek shrek shrek shrek shrek shrek shrek shrek shrek shrek shrek shrek shrek shrek shrek shrek shrek shrek shrek shrek shrek shrek shrek shrek shrek shrek shrek shrek shrek shrek shrek shrek shrek shrek shrek shrek shrek shrek shrek shrek shrek shrek shrek shrek shrek shrek shrek shrek shrek shrek shrek shrek shrek shrek shrek shrek shrek shrek shrek shrek shrek shrek shrek shrek shrek shrek shrek shrek shrek shrek shrek shrek shrek shrek shrek shrek shrek shrek shrek shrek shrek shrek shrek shrek shrek shrek shrek shrek shrek shrek shrek shrek shrek shrek shrek shrek shrek shrek shrek shrek shrek shrek shrek shrek shrek shrek shrek shrek shrek shrek shrek shrek shrek shrek shrek shrek shrek shrek shrek shrek shrek shrek shrek shrek shrek shrek shrek shrek shrek shrek shrek shrek shrek shrek shrek shrek shrek shrek shrek shrek shrek shrek shrek shrek shrek shrek shrek shrek shrek shrek shrek shrek shrek shrek shrek shrek shrek shrek shrek shrek shrek shrek shrek shrek shrek shrek shrek shrek shrek shrek shrek shrek shrek shrek shrek shrek shrek shrek shrek shrek shrek shrek shrek shrek shrek shrek shrek shrek shrek shrek shrek shrek shrek shrek shrek shrek shrek shrek shrek shrek shrek shrek shrek shrek shrek shrek shrek shrek shrek shrek shrek shrek shrek shrek shrek shrek shrek shrek shrek shrek shrek shrek shrek shrek shrek shrek shrek shrek shrek shrek shrek shrek shrek shrek shrek shrek shrek shrek shrek shrek shrek shrek shrek shrek shrek shrek shrek shrek shrek shrek shrek shrek shrek shrek shrek shrek shrek shrek shrek shrek shrek shrek shrek shrek shrek shrek shrek shrek shrek shrek shrek shrek shrek shrek shrek shrek shrek shrek shrek shrek shrek shrek shrek shrek shrek shrek shrek shrek shrek shrek shrek shrek shrek shrek shrek shrek shrek shrek shrek shrek shrek shrek shrek shrek shrek shrek shrek shrek shrek shrek shrek shrek shrek shrek shrek shrek shrek shrek shrek shrek shrek shrek shrek shrek shrek shrek shrek shrek shrek shrek shrek shrek shrek shrek shrek shrek shrek shrek shrek shrek shrek shrek shrek shrek shrek shrek shrek shrek shrek shrek shrek shrek shrek shrek shrek shrek shrek shrek shrek shrek shrek shrek shrek shrek shrek shrek shrek shrek shrek shrek shrek shrek shrek shrek shrek shrek shrek shrek shrek shrek shrek shrek shrek shrek shrek shrek shrek shrek shrek shrek shrek shrek shrek shrek shrek shrek shrek shrek shrek shrek shrek shrek shrek shrek shrek shrek shrek shrek shrek shrek shrek shrek shrek shrek shrek shrek shrek shrek shrek shrek shrek shrek shrek shrek shrek shrek shrek shrek shrek shrek shrek shrek shrek shrek shrek shrek shrek shrek shrek shrek shrek shrek shrek shrek shrek shrek shrek shrek shrek shrek shrek shrek shrek shrek shrek shrek shrek shrek shrek shrek shrek shrek shrek shrek shrek shrek shrek shrek shrek shrek shrek shrek shrek shrek shrek shrek shrek shrek shrek shrek shrek shrek shrek shrek shrek shrek shrek shrek shrek shrek shrek shrek shrek shrek shrek shrek shrek shrek shrek shrek shrek shrek shrek shrek shrek shrek shrek shrek shrek shrek shrek shrek shrek shrek shrek shrek shrek shrek shrek shrek shrek shrek shrek shrek shrek shrek shrek shrek shrek shrek shrek shrek shrek shrek shrek shrek shrek shrek shrek shrek shrek shrek shrek shrek shrek shrek shrek shrek shrek shrek shrek shrek shrek shrek shrek shrek shrek shrek shrek shrek shrek shrek shrek shrek shrek shrek shrek shrek shrek shrek shrek shrek shrek shrek shrek shrek shrek shrek shrek shrek shrek shrek shrek shrek shrek shrek shrek shrek shrek shrek shrek shrek shrek shrek shrek shrek shrek shrek shrek shrek shrek shrek shrek shrek shrek shrek shrek shrek shrek shrek shrek shrek shrek shrek shrek shrek shrek shrek shrek shrek shrek shrek shrek shrek shrek shrek shrek shrek shrek shrek shrek shrek shrek shrek shrek shrek shrek shrek shrek shrek shrek shrek shrek shrek shrek shrek shrek shrek shrek shrek shrek shrek shrek shrek shrek shrek shrek shrek shrek shrek shrek shrek shrek shrek shrek shrek shrek shrek shrek shrek shrek shrek shrek shrek shrek
435,Not really
436,"I’ll say it even louder....

LOCK THE BLOODY DOOR!!!!!!!!!!"
437,She doesn't like you and this was an opportunity to vent.
438,"Are we sure he didn't mean ""porpoises"" and are we sure OP isn't a dolphin?"
439,life tip: cut someones eye out if you want to marry them.
440,"My Irish grandmother would have reacted like the Asian grandmother. You don't use a coaster with your water and you'll get a look.

My Italian grandmother probably would have found it amusing af, she once pulled a cucumber outta the fridge, looked at my mom and said ""is this your new toy?""
My mom was mortified my Nona died of laughter."
441,r/outside
442,"If they try to fire you just respond with ""not in my swamp"""
443,"Seriously... I mean the rest of the story is fucked, but come on guys--don't fucking drink and drive. Especially just so you can seppuku your own psyche on a blade made of obese-shit-vampire.

&amp;#x200B;

Shame."
444,3D chess
445,"Tell the MIL that she isnt a required part of your childs life. If she wants to be a little bitch, she can do so with the safe knowledge that her grandchild will not know she exists. what you and your wife do in your home is between you and your wife. She can accept it or FO."
446,Be more constructive with your feedback please
447,he has not yet begun to defile himself
448,How dare you farm for more karma. Downvoted
449,Maybe his name is just saying where the missing underscore is
450,"So real.

I cried when I heard my daughter cry for the first time, when she got the vitamin K shot and I think a second shot.

I cried three times before we even left the hospital (already had chapped nipples from improper latching) plus getting low key attitude from the staff their when I asked for a formula bottle because it hurt so bad.

I cried three times in the three days after we got home. (I didn't produce enough so even less sleep and it still hurt...a lot)

My first cry at home was short lived and kind of a happy cry. My mom took the baby so we could sleep a bit and when I sank down on our soft and comfy bed with fresh sheets I let out a whimper that my husband thought was because of pain(unscheduled C-section) and rushed to see what was wrong.

With tears streaming down my face and little sobs I just turned to him and said ""Bed."""
451,Figured that out. To be honest I probably wouldn't read every single word too cuz I'm a lazy fuck lol.
452,"Lol, this is 2019, if he was over Wifi or had any regular connection to LTE the image was delivered before he had a chance to minimize the messenger app.  This hasn’t worked since like 2012 unless you live in an extremely rural area with poor internet connectivity."
453,Lady pillow latte
454,Totally blindsided her.
455,"Of course Steve looked totally chill. This is probably not his first time doing this. Or his last. 

Just try to stay out of it and interact with them as little as possible. Also no reason to feel guilty, Steve clearly wasn't upfront about his marital status. You had no way of knowing."
456,r/brandnewsentence
457,"&gt;read post together
&gt;at the end go “hahaha that’s so cheesy. I’d propose more like THIS”
&gt;propose"
458,"He's tan, he's chatty, he likes to take naps"
459,I thought I was reading r/justnoMIL
460,#LOCK THE DOOR DUMBASS
461,It sounds like she pooped while falling or sliding.
462,"I think I learned that lol, I was 15, never had an incident with the police and have rarely ever gotten in trouble. I will make sure to get one in the future haha."
463,"Ever feel like nothing? So numb everything almost starts to feel dream like... So almost like a figurative pinch to yourself, you find yourself doing something extreme and uncharastic without second thought.  Once you do it though,  it's all you think about! Either it be banging Jabba the hut, drugs or massive spending. 

Or that's what's its like to be ""manic"" basically invasive thoughts won,  no rhyme or reason. Not to project or speak for OP. Simply my reasoning..."
464,But how were the tits?
465,"Quoth the Raven, ""Watermore""."
466,"I wish I could give you gold, so take this instead 🏅. I’m sorry. I can’t afford gold. I can’t afford silver. I can’t afford food. Just yesterday I had to leave home to bury  my starving son, Ivan. He got the easy way out, the rest weren’t so lucky. Oh god...  I can hear the screams of a man outside our bunker. I can’t help him. None of us can. We can only listen and hope he stepped on a landmine and won’t have to suffer no more. The paint on the walls is peeling off.. Our Herzegovinian flag, now filled with moths.. Food rations are short and the radiation seeping from under the faulty door is increasing by day. Branimir and Karima have not returned from the hospital, I fear they never will. Is there even a hospital there anymore? Did it blow up along with the old university in that bombing? What day is it? I’ve lost track of time. Does time even have a meaning in this war riddled wasteland? Oh god, help me, I’m cold....

But anyways I’m going off track. Very nice, I wish I could give you gold, but take this instead! 🏅"
467,No its definitely too late when your dick is in shrek’s ass
468,"*70s funk starts playing*

""Do you take... travellers check?""

""Oh yeah baby, you know we do.""

*End credits*"
469,"*I was getting death stares all the way out the airport.*

Yeah, but you asserted your dominance, that's why they only stared and didn't actually do anything."
470,**SAD SHANE DAWSON NOISES**
471,Shriek has an amazing ogre bod with his massive ogre dong. He wears Han Solo’s clothes.
472,"Reminds me of a George Carlin bit. ""How does this woman take a shit? Better yet, how does she wipe her ass!? Is she capable of locating her own asshole!?"""
473,"I haven't really been able to say it like how you just put it, but that's pretty much exactly it. No I haven't, I don't really care for therapists, I'm not sure how one could help."
474,"I swear at some point my mother finished like 75% of her sentences with ""... And I guess you'll just send me to the old folk's home when I get old!"""
475,I just spit beer out my nose laughing.  Best comment of the day!
476,What the fuck IS pre nut clarity? Why have I never heard of this phenomenon? I'm only aware of pre nut dick madness and post nut clarity.
477,I am a female and was wondering the same thing.
478,It could have been worse.  Imagine finishing and having post nut clarity.
479,"Yeah, but ""titty juice."" It's worth the price paid."
480,It happened minutes ago? Then text her back and say ‘couldn’t sleep- guess what I’m doing now.’
481,He generates all the power from the bottom
482,"Well, that's enough internet for the day"
483,Thank you
484,"Yeah, jeeez. I told my current GF *before we started dating* that I had kissed her sister and basically flat refused to do anything with now-GF until that was in the open and processed.

Sex and lying about it for years, then *doubling down on it*? That'd make me go livid. I'm pretty sure if that's what had happened with GF's sister and lied to her face about it still years later that I would be single and quite possibly dead."
485,"yeah, especially since he used his real name on tinder so"
486,Double down and reenact that scene from Inglorious Basterds?
487,"Honestly though,  why is pops letting little lad fuck with other passengers?"
