,text
0,This story makes me feel like you raped yourself.
1,"\&gt;  steve looks totally chill

&amp;#x200B;

Such a steve move."
2,The first part of this was objectively hilarious. I feel so bad for you and your wife that your mother-in-law was so rough. Hopefully you can get through this with minimal suffering. Having a newborn is hard enough.
3,We now have dinner at their place on Sunday.  Unenthusiastic yay.
4,"This post goes from 0 to 100 to 1000 real quick.  

Keep this burner account active to update us."
5,"That was a wild ride, my man."
6,FU #2:  Too many details in this post.  No way is your wife not reading this :D
7,coot scoot boogie
8,I would love to see photos of you porpoising at the waterfall
9,"Roses are red

You popped a tire

I'm sorry you had sex with a mega obese vampire."
10,The next time he proporses to a girl lol
11,How tf you can managed to get your dick erect all the time?
12,This made me feel better about my recent decisions. Even the bad ones. Thanks
13,"Wife: ""Hi, my name is Shirly and this is...""

You: ""No need for introductions, ma'am. Steve and I go way back. How's your ass feelin', buddy?"""
14,"Going back to work has been tough knowing I can't help.  This compliment made me feel really good.

Thank you for that."
15,"People don’t believe me sometimes when I say no sex is better than bad sex.  Learn from OP, and believe me when I say that it’s never too late to turn back. It’s way easier to live with the feeling that comes with embarrassing someone than it is to live with the memory of that time your standards were even lower than your self respect."
16,It was a lot worse actually living it
17,"Next time this happens, immediately put your phone in airplane mode to stop the image send."
18,You're a keeper.
19,I wana say this is BS.... but your name makes me think otherwise.
20,"&gt;""I stuck it back in to hopefully wipe it off inside her asshole""

F"
21,"I've only told this to two other people and one of them did say they think I was raped. I'm really not sure, I did bring it upon myself."
22,"What really gets me about this story is, what kind of girl TELLS her sister about her wild sexual encounter, knowing full well it was with her sister's husband? That's some sadistic shit. And it kinda seems like unlikely that they BOTH just forgot it was each other. Seems fishy."
23,"Love it, I have a feeling it wouldn't fly with the mother with the mother in law either lol.  On a positive note, my wife woke up and asked me to get the baby for its titty juice.  so I guess it's still on the menu.

Maybe just not on the labels for awhile."
24,fucking steve... literally
25,"Anyone who wakes a new mom deserves to be decked, MIL or not."
26,"We call it booby juice. And we just put the date, the bottles and bags are pretty distinctive"
27,And then from 1000 to 10000 with the first edit
28,"&gt; EDIT: YALL IM A GUY. sorry, i didn’t clarify that in the original.

THIS was the biggest plot twist"
29,"This is really cool. I’m a zoologist/biologist and have worked extensively with ravens, crows, and other types of intelligent birds. Ravens actually are deemed scientifically the most intelligent birds. They’re able to solve puzzles, recognized love, recognize themselves in a mirror, and in reported cases start cars, leave gifts, and even develop grudges. 

Thanks for brightening my day, gave me a good laugh. I needed this."
30,"Nut Madness is a rarely discussed, but insidious syndrome."
31,You weren't raped - you just defiled yourself. You used a couple of holes and got shit for it in return... both literally and figuratively
32,"NO, don't fuck her cat too!"
33,He was just being polite. Giving her shit back to her.
34,Yeah don't see this situation coming up again XD
35,cats already out of the bag so fuck it 🤷‍♂️
36,Shocked that 42 other people had sex with landlord... buys rental properties.
37,Holy fuck I wish I had gold to give. This killed me.
38,No problem :)
39,"Or dolphining would be fine, too."
40,Neither did she.
41,"&gt;They insisted I put it in her ass, and me being a polite dude, didn't want to offend them, obliged.

What a gentleman 😂😂😂😂😂😂 

This post is beyond disturbing but I couldn't stop reading."
42,"OP: *looks down, sees body covered in feces*
OP: ah, shit... here we go again
OP: *gets back in the bath*"
43,"Im more curious about OPs username, landlordfucker43. There has been 42 landlord fuckers on here in the past......."
44,"Did you at least cum a lot, like a power move?"
45,I think the part where you really fucked up was when you tried to convince her it was a coincidence. That's just insulting her intelligence and losing trust
46,"I can tell you it’s not even about the fact that you slept with her sister, but the fact that you both kept it from her."
47,"Even better would be: 
OP: ""Hi, my name is..."" 
Landlords wife: ""No need for introductions, Bill. Steve and I are open with each other. How's your ass feelin', buddy?"""
48,Like a firehose.
49,What. The fuck. Did I just. Read.
50,"You did so much good today that you’re not giving yourself credit for. You let your wife vent, you gave her a break, and you even brought surprises home. You were her best friend and as a mom I can tell you that’s what she needed most. Good job, dad."
51,I'm gay now.
52,"There were 42 other landlordfuckers before he made the account, seems pretty common."
53,"Not rape but I will say that reckless behavior and unsafe sex are considered forms of self-harm. It sounds like you need some help, and I say that in the most loving way possible. Not caring what happens to you is not normal and you deserve better. A therapist is a really good starting place."
54,same thing with him forgetting about how the chick he banged in the barn was his wifes sister.
55,"&gt;So this was actually a few months ago. I (24M) had just recently bought an engagement ring to propose to my **at the time girlfriend** (24F).



Not gonna lie. My heart kinda dropped at this part. Thought it would end badly. SO GLAD it worked out!!"
56,"Given how chill he was, do you have any corroborating evidence that you haven't met a pair of identical twins?

It's an outrider, but still..."
57,"Dude that edit made this much much crazier! I read through the thing and was like eh, big coincidence that dude ends up being your married land lord. 

&gt; I’m a guy 

**Oh Shit!** nevermind this is nuts lol"
58,"Also I just caught the typo in my post you were referring to, I'll just leave it lol"
59,"I've stopped sex dead on its tracks, like naked-in-bed-type of momentum. No regrets. Its the right thing to do for yourself."
60,"upvote for the jokes, asian mom (now granny, hence the baby) just can't take some joke.

I am asian too :)

cheers mate, it'll pass.. the sleepless nights"
61,it’s a stretch since he had the same name on tinder. (which is weird if you’re cheating but 🤷🏻‍♀️)
62,Looks like someone won't be feeling the love tonight.
63,"EDIT: YALL IM A GUY. sorry, i didn’t clarify that in the original.  


  


  
HAHAHAHAHAAHAHAHAHAHHAAH - it's the best and mature answer to this.A"
64,"Indeed, how blooming rude and selfish over a label. the MiL is atrocious."
65,"*OP shatters phone*

Zoologist: This is really cool!"
66,Pre-nut obscurity
67,Maybe the wife is cool with it and was boning her own tenant in another room Saturday night
68,"Rides typically have ups, downs, and twists. This was an emotional roller coaster that only went down. An emotional slide if you will."
69,Thanks to this post I'm deleting tinder and probably my penis as well
70,"Your TIFU is ruining my day bro. You fuck up and we all suffer by reading that. 

Next time you think it's a good idea to stick your dick in a hole that stinks so bad it's making you tear up, leave the situation immediately lol."
71,"Stop calling the sister, makes you look like you are trying to conspire with her. Just leave her out of it.

Your concern is your wife. Time to tell the whole truth and nothing but the truth. Let your wife know that you recognized the sister at the dinner and the two of you decided to just never talk about it again. And that is where you messed up. You should have told her and you are sorry. Then let her feel how she feels. You can't control that.

If I was your wife I would be hurt that not only had you had sex with my sister but that the both of you think of each other when thinking of wild sex. That would be the thought rolling through my mind, is that you still think of the wild sex you had with my sister that you hid from me.

I have been cheated on before (and I know you didn't cheat), and the thing that hurt most what that others knew something I didn't and I felt so stupid. I am sure that is how she feels.

Now is time to pull out all the stops and have the greatest heart to heart you can. Not sure if you can recover from this. Good luck."
72,I hope you locked eyes with her sister. Assuring dominance
73,‘You just defiled yourself.’ ... I think this sums it up.
74,Shrek
75,Nothing good ever happens after 2 a.m.
76,Or one eye on each. Double-sun power
77,I thought this story was going to be about walking in on your wive’s sister and cousin. My reading comprehension skills suck.
78,Should've checked yourself before you... Shreked yourself.
79,"🎶🎶  Get down, slide around, on the ground, coot scoot booooooogie 🎶🎶"
80,"Ngl, I saw that before I posted this and considered changing it, but figured it would make for a more thrilling read lol. And yes I'm aware that makes me TA haha"
81,I'm depressed for you.
82,god im a dude and i want to marry you now
83,"&gt; left the house saying she doesn't know if she can come back

Wait. I'm sorry. Did you say she disturbed the precious sleep of a woman who has recently given birth to and is caring for a newborn, *to give her a lecture about being a potty mouth*?!?!

Good fucking riddance, then. If anyone had ever woken me from a nap during the newborn phase for anything but ""the baby needs to eat"" or ""the house is on fire"", I would have never spoken to them again. 

Your MIL sucks and you're a good partner for cutting your wife slack for passing the venom on to you. 

But seriously though, if MIL never comes back, that sounds like a problem that solves itself."
84,I read it over twice and still Can't picture it.
85,"I dont think the owner of the shampoo just deposited his seed for an unknown reason. He very likely noticed that all of his things were being stolen by his (sorry OP) terrible roommate and this is his way of revenge. 

Kind of like when someone rubs someone elses toothbrush in their butt crack to get back at someone (lived in apartment style dorms, seen it happen). 

Tough break if that wasnt the first time he had done this anticipating it would get used by someone else."
86,worst/best thing I’ve read in a while lmao
87,this has nothing to do with Lion King lol
88,Thank you
89,"Ya, now I don't feel bad about being a virgin."
90,"Did Steve tell you that perchance?

&amp;#x200B;

Steve."
91,"Literally not computing in my head how and why you decided to continue after seeing and smelling something you weren’t into. That’s the whole point of consensual sex, you can stop at any time. Seems like a long way to go not to hurt their feelings by doing a 180 as soon as you saw the woman."
92,"If this is true, say hello to a year’s worth of free rent."
93,That is... impressive.  Not gonna lie...
94,"Yeah, it's deeply stupid if you're practicing infidelity to use your real name: That sadly doesn't discount the possibility.

How's the housing market where you are? Another outlying possibility is that their marriage is over - coming out as homosexual to his hetero wife would be reasonable grounds for separation - and that they've agreed to share the proceeds of the lease in the interim whilst waiting for the market to improve.

I'm working really hard to think the best here..."
95,It was the implication
96,I'm a landlord... and I find this disgusting. Where do you find these types of tenants? What site did you see them on? This is disgusting. Just tell me what site to find them on already...
97,"Not as bad as your landlord will feel when he loses half his shit in a divorce.

Play stupid games, win stupid prizes."
98,"Yep, Im the same. Haven't had sex for quite some time, despite offers. Gotta be true to yourself, and not lose yourself to the dick madness... jerk off, then see if you still want that person, is my advice."
99,"And we do the freshly squeezed versus cold booby juice too. The freshly squeezed one is ""the good stuff""."
100,"Its only been 3 weeks, sleep seems like such a distant memory already."
101,Plot twist: Steve looked totally chill because he’s openly bi and has an open relationship with his wife so he can get some D on the side
102,F
103,Looks like everyone got fucked that day.
104,Followed by the even worse post-nut guilt.
105,"Even better...OP: ""Hi, my name is..."" Landlords wife: ""Just take off your pants its my turn now."""
106,You had it cumming
107,"""I've been doing this for three weeks now. Someone send help."""
108,"Fine!

You uh, mind passing me that bag?"
109,"This post has a lot of layers to it, like an onion."
110,"A firefighter's pole of despair, if you will."
111,That seemed totally plausible to me...
112,"Why is this a FU? You were successful, OP!"
113,OP knows some people that can change that for ya.
114,"i couldn’t do that, i feel terrible enough already"
115,"Yeah, post-nut clarity has kept me from making some really bad decisions."
116,"""I fucking saw you feeding a robin today you cheating asshole""

..

I mean **caw**"""
117,I like small boobs now
118,Get ready for next years TIFU by accidentally extorting my landlord.
119,I'll post them when I get home from work! Pics are on my phone which I don't have on me during the day lol
120,"Okay funny story, I mentioned your comment and she replied ""Girl or guy?  You know what, doesn't matter, we could use the help."""
121,Momma always told me don’t take no shit.
122,I feel like the last thing he would want is Shamu's shit inside his reverse-penis. I feel like that's all that kept this poor guy going.
123,My man didn’t get chance to set the story straight face to face so he’s doing what we like to call a “pro gamer move” and posting it to reddit which he knows to read and is merely pretending that he hopes she doesn’t read it.
124,How else do you expect to get an apartment in this town?
125,"You're awesome. 

Also, not going to lie, when I read that grandma doesn't know if she can come back to the house I thought ""hopefully she won't for awhile"". 

Never wake a new, sleeping mother or baby, come on, lady! (Obvious urgencies aside, of course)."
126,I honestly can't believe you told that story to that tow truck driver and your friends. I would have taken that shit with me *to the grave*
127,Excuse me
128,With a chunk of shit on the head of the dick...i dont think I'll have a dick anymore.
129,How do I unread something
130,Oh god hahahhaha
131,"Many newly grandmas are like this. I don't know what it is, jealousy over the attention of the new mother, jealousy that they can't have a baby anymore but it isn't rare behavior."
132,"I just want to say this is a great TIFU post, it’s really well written (check that formatting) and isn’t offensive to anyone, with the exception of your MIL. Good job OP"
133,This.  My God.  This.
134,"You know now that you can always leave a situation when/if you feel uncomfortable or change your mind. I’d recommend actually seeing someone about this event, I know it sounds patronising but I don’t mean it that way. I’m sure it was somewhat cathartic just to write it all out so hopefully you can speak to a professional about it, understand better why you did this and then hopefully put it in the past. Time will make this memory less painful and less frequent, trust me.

If you need someone to vent to I’m here and a good listener. 💗"
135,lock a door?
136,r/suicidebywords
137,Your mother in law sucks. To bail on her daughter over that is brutal. Im currently going through something similar except my wife’s mother never came over in the first place.
138,"&gt; To bail on her daughter over that is brutal

It just shows that her mother's love and support is conditional. That's a pretty shitty thing to have too discover about your parent."
139,"Your first fuck up was not saying anything from the get go, the second was telling your wife about the wildest encounter you had which was with her sister (I don't believe you actually forgot that tiny detail), the fourth was not coming clean immediately and apologizing for all the little lies you had to have told over the years to cover it up, the fifth was lying *again* and trying to cover it up *again*, and the sixth was posting it here for your wife, *who you admit uses Reddit*, to read. 

You fucking numpty."
140,Your mother in law is an uptight bitch
141,You’re welcome hahah! That’s sick. Can they be pets?
142,"|  **Oh Shit!** nevermind this is nuts lol 

I mean probably..."
143,Man I cant even get hard for attractive girls sometimes
144,"Dude, whatever your beliefs are in life, the universe or something always sends signs. 1 hour drive, popped tires, basement, flash light. 

For example, let's say you believe that the sun is our holy power. The Sun was like 'how many effin tyres I gotta pop to make this guy turn back!?' 

Enjoy your summer bro, it's all uphill from here"
145,Sweater Kitten Soda?
146,"You didn't ruin it - you observed it with your eyes and it's  now in your memory forever (and ours too because we imagined it from your words). All you did was not video it and startled the ravens. The ravens will be back, doing this again because it worked. Corvids are smart, they will repeat something that gave them a benefit."
147,Gollum wasn’t letting him leave without getting his precious
148,"Should have slapped you wife on the arse, pointed at her sister with eye contact “you’re next.”"
149,"I once had a female friend say something I will never forget and fits in here.  ""You can't rape the willing.""

&amp;#x200B;

It sucks that it happened but something in your head just kept you going on.  I drove a ways once and ended up getting married to the girl later on.  It was more a marriage of convenience in a lot of ways.  We were both lonely and later on when she was hurt at work I stuck around quite a while out of obligation.  Eventually she started enjoying the pain meds way too much and decided she didn't want to be around which was fine by me.  

&amp;#x200B;

I met my second wife and was much happier, she passed away a couple months ago and for the first time in a long while I am alone.   I can only hope that some day I will find someone to be with again."
150,stopping is dying
151,"Wow bro. You’re fucked. Not because you banged her sister but because you’ve lost her trust. The moment you both agreed to never speak of that situation you both consciously made a decision to lie to a person you both love. 

Idk if I’d come back from that one."
152,"Well the tow truck driver I knew I was never going to meet again, and he seemed like the type of wild dude that loves that kind of stuff, and he was laughing pretty hard. My IRL friends don't know, the only other people I did tell were more internet friends."
153,OP was trying to convince his wife that it was just a coincidence that him and her sister had the exact same sex story.
154,"I honestly never thought that he’d be doing it on purpose, but now that people bring that up I’m almost 100% sure that’s the case and I totally brought this on myself"
155,"As a woman, I agree"
156,"Fuck typical asian parenting culture. Often just spoonfeeding and scolding, not given chance to properly take responsibility, but when needed and fail, more scolding. Also more scolding when you get into an argue, regardless you're right or wrong, no reasoning given. ""I'm older than you therefore I know more than you"".

&amp;#x200B;

Sauce: am asian living in asia"
157,"&gt;My wife’s family has a tendency to enter without knocking.  
...  
&gt;  
&gt; We didn't expect them to enter"
158,"Yup, me too."
159,TIFU by committing a felony because of advice from Reddit!
160,Damn bro. That one hit
161,"This wouldn't result in guilt. Guilt is when you Jerk off in your church bathroom during the sermon. This would be post-nut shame. Shame is much, much, worse."
162,"I'm imagining gollum licking his cracked lips and drooling as you go to pound town on what may very-well be the living personification of atomic gonorrhea, before in a moment of pure ecstasy, he orgasmically moans:  
  
"" 'ere pig-pig-pig-pig! *SUUUUUUUUUU-EYYYYYYY*"" followed by collapsing in a puddle of his own making."
163,Standard porn theme.
164,Initial FU with a miraculous save I suppose haha. Still get teased about it though lol
165,"Emphasis on plot, OP has ascertained a position where he's more powerful than the landlord."
166,Exactly what I was thinking. Could this be an elaborate stunt by Disney to market Lion King? 🧐
167,I am honoured to witness the beginnings this thread
168, Apparently she had decided her need for show boating and drama was more important than helping her daughter and spending time with her grandchild.
169,"We didn't expect them to enter and thought we we would be in-and-out in a minute, basically."
170,"Classic attempt to seem genuine online so the wife can see his side of the story. Smart move, I’d do the same. Hope it works out because it’s an innocent coincidence. Although the “collusion” to keep his wife out of the know is probably what she’s most upset about."
171,I feel like reality when out of its way to damage his car to prevent him from making this mistake and he just kept fucking goin like dumb ass.
172,that escalated quickly
173,I just finished watching the latest season and I do not recall seeing that plot point.
174,"I’m going to be straight with you. It gets worse for the next 5 weeks or so. But then it starts to get better. It all starts to work and come together most of the time. Some of that is because you start to figure stuff out, some of it is because baby settles down, and some of it is because you just get used to operating on no sleep.

Good luck. One day you’ll forget how hard it is and think about having another child."
175,"He's got some short shorts and a LOOOOOOOOOOOOONG

SCROTUM."
176,"She hasn't been the easiest lady to along with, all older ladies in her family are kind of like that.  Dad super chill though, good dude have a beer with and quietly discuss the mother in law."
177,It really bugs me that your username is missing an underscore.
178,"OP: HI, my name is

Wife: What?

OP: My name is

Steve: Who?

OP: My name is \*shika shika\* Slim Shady"
179,"Man before it arrived we had a lot of conversation on how long we wanted to wait until the next one.  A week after we were like, ya know how about we just take that second baby idea, stick a pin on it and put it in the parking lot."
180,It’s the number of landlords he has fucked
181,"America... where we can assign books about school shootings... then get upset that people think about the book... but don’t actually do anything of note to address the fucking unending stream of school shootings.

Makes sense guys.

That’s a rough go kid. First rule of talking to police officers is you don’t before you talk to a lawyer. When they pick you up they don’t see you as innocent. They see you as guilty and are trying to nail you, and even innocent people can say things that may “incriminate” them under duress or panic.

Anything you say can AND will be used against you in the court of law. Doesn’t matter if you’re innocent or not."
182,"Using dolphines as a jet ski? I heard they can rape humans, so that wouldn't be a great idea!"
183,"Sounds like your mother in law needs to invest in a sense of humour.

It's a shame, it would be nice to say ""fuck her, makes you and your wife laugh, who cares what she thinks"", but I appreciate it's not that easy.

Still... Fuck her. She needs to lighten up."
184,that’s always an option!
185,"I, too , get sweaty within a couple holes. 

But I’ve never played golf"
186,"I will, we've had our differences of opinions in that past and usually come to some sort relative agreement (pun intended) in one on one conversation.  Usually pretty good at picking which hill to dieon on but today wasn't the day.  My my didn't need the extra stress.

I'll find some time on Sunday to discuss it."
187,"Well, she's Asian. For us, we should be grateful they gave birth to us. Even though we didn't ask to be born and they were the one who wants children"
188,"Agreed! Not to mention it’s his damn house, if he wants to label that titty milk, titty milk it’s his right"
189,And I bet that tenant is a female
190,"&gt; I once had a female friend say something I will never forget and fits in here. ""You can't rape the willing.""

I feel like this was meant to sound profound, but it is just an accurate description of how rape works."
191,Tit-tea
192,"Thanks, comments like this actually make me feel like I'm not too far gone."
193,"Try ""Nipple Nectar"""
