,text
488,Why do People still have sex with unlocked doors while other People are in the house ? I really dont get it. And this was totally deserved. Lock your damn doors !
489,Ditto! I'll have nightmares for weeks.
490,"""Rinse and repeat"""
491,"Would you mind if I propose to my girlfriend after we read this tifu? We usually scan top posts together in the evening, just have to figure out how to transition from post to proposal. Yes, I picked up ring this morning, was going to propose before the 29th."
492,"&gt;We may never be able to get a truly accurate count of landlord fuckers.

r/nocontext"
493,Sorry if I'm being indelicate but you got me curious on how this happened
494,The pre-nut clarity is a life saver
495,I farted and a worm flew out
496,"Congratulations! You know what rock bottom feels like. Now stop digging, you mad man."
497,"Not allowed to have it in the building I work in, nature of the work I do."
498,That’s what he said too!
499,"I’ve had anal sex quite a lot, though only with two partners. Never had any shit on my dick...worst I ever to was a solitary piece of red pepper 😃. Which was funny."
500,"Yes, sometimes my lyrics are sexist but you lovely bitches and hoes should know I'm trying to correct this"
501,It's not real so it doesn't matter
502,He said he was a top.
503,BE PREPAAAAAARED!
504,I have dry earwax but also smell disgusting so idk about that
505,"If they're both boning other guys: OP, this is your chance for a 3-way!"
506,How does her mom look?
507,You deserve to be beaten with rods and cones for this pun but I upvoted you instead
508,r/ cursedcomments
509,Barn animals.
510,"depends on OP's demographic. younger generations are turning out to have a much higher success chance in marriage because they're tending to wait until they feel they're ready for it, maybe financial, idr exactly"
511,Steve has life figured out.
512,"*You turn to climb into the darkness when a grimy hand suddenly clamps shut around your ankle. You feel weightless for a moment, if you could see then perhaps your face may not have taken the full impact of the hardwood staircase. Your last conscious moments filled with confusion, is that the light at the end of the tunnel? Or a flashlight?*"
513,It is almost as if...and hear me out here...the whole story is COMPLETELY MADE UP?!
514,"I'm so sorry OP. As a fellow gaybro, it sucks when you find out you're the side ho. But know it doesn't make you any less of a person."
515,Quoth the raven:  it's a Ford
516,"Good! The child shouldn't be exposed to that kind of person. Fuck this 'family is important' shit.

If your family thinks 'titty juice' is an acceptable reason to scream at you, don't fucking let them be around your child.

If I caught anyone in my family screaming at my child for anything short of a life-threatening situation, I'd slap the taste out of their mouths. Screaming at a child doesn't teach them to recognize a behaviour is bad, it teaches them to be afraid of the person screaming at them."
517,i wish
518,Read this while pumping some freshly squeezed titty juice myself. I don’t care what it’s called. The monster will still drink it!
519,And I was here expecting you to put your dick in the ring
520,"Stay strong, brother, we can beat this thing together. ^^^But ^^^not ^^^until ^^^the ^^^scabs ^^^have ^^^healed ^^^( ͡° ͜ʖ ͡°)"
521,"Being there for support and back up is a lot more than you think it is. I work as a bartender and hear comments about husbands not being able to do things their wives do often. “I can’t put the kids to bed, that’s the wife’s job!!” Is a comment I heard last week. A wife’s job? You as a father cannot (made it out as if he didn’t even want to) put your child to bed? Gendered roles in parenting and even partnering angers me more than I realize at times. Parenting does NOT require gender roles or even genders at all!!!!!"
522,"I think this might be a lesson for you. Whether the friend was a guy or a girl you slept with, it definitely changes he nature of the relationship for a pronged period of time if not forever. In my experience, there is no sex with friends and then going back to normal."
523,upvoted for cooter
524,"as someone with Asian parents, at least traditional ones like this anyway, and who's dating someone non Asian, shit like this gets blown over, they have no concept of this type of playful 'mood lightening"", shit gets taken too serious, it's fucken annoying. They won't understand the idea of trying to be funny with the labeling to make it easier, man I really hate this shit about Asian culture"
525,"I agree. The hand squeeze is incredibly sad, but it’s her way of telling you that she knows it’s not your fault, and she’s forgiving you."
526,the tow truck's plate was 'FRESH' and there was dice in the mirror
527,"“Hmm...sex won’t take too long.  Guess We won’t lock the door.”

Said no one ever."
528,Thanks for this suggestion
529,OP should wait for that threesome invitation.
530,It probably explains the urgency to get it on in the lounge  - the bedroom would have given the game away that he was married.
531,25 more LandlordFuckers and I’m making my account.
532,Why did you go straight for the punch ahah
533,But titty juice is hilarious.
534,Do you have any self-respect?
535,Like a pillow in the eye.
536,"The word “chuckle”, gave me a chuckle."
537,Yeah I read that too... wtf
538,I'd totally call them back and explain... Ya never know what Michael Scott like manager is out there!
539,"See I thought of this afterward, but you know heat of the moment and being in a panic doesn't help lol. Plus this way made for a funnier story to tell over the years haha"
540,I feel like it's fishy too. Happened 20 years ago and he messaged her and got sent a picture? Phone cameras weren't nearly as prevalent back then and when they did have them the resolution was terrible.
541,"Ive struggled with this one. I'm really not sure. Yes after the fact it sucks hard, but being ignorant.....I dont know."
542,I cringed so hard at your attempt to sound clever with the doggy style comment.
543,"Why? Cause I rap about, reality? Like me n my grandma drinking a cup o tea?"
544,So what you're saying is your random hookup has a key to your apartment...
545,There ain’t no party like my nana’s tea party.
546,"Rename it mammary milkshake or something, can't get stroppy about that 🤷‍♂️ or like, tell them to hop"
547,"Yeah, all this many of them in this thread. Bruh. In all seriousness, I hope you're doing ok, man. Sending the good vibes your way."
548,OP is actually 70yo
549,To bad you didn’t**
550,No you fuck that one twice
551,Where is it being made a fetish? And the baby doesn’t know how to read and can’t understand English yet. It doesn’t even realize they’re making jokes about it’s food. If anything the baby would be positively impacted by the happy parents who know how to joke around and have fun
552,Not sure what that has to do with holding a phone upside down but thank you for the explanation.
553,I think that's more her fuck up for not only barging into your house unannounced but into your bedroom
554,Definitely not in a healthy state of mind
555,Millions of miles of open...swamp.
556,Username checks out
557,"Came here for this. ! 

r/himym"
558,Looks like your roommate didn’t read that “Don’t stick your dick in a shampoo bottle” copypasta
559,Usually the landlords wait till after you move in to fuck ya over.
560,"Unless he does have a twin who uses Steve's name to prowl tinder for sex with other men. Hey, it's out there."
561,"Tbh, the father should have been paying more attention to his kid. Yes, the punch was perhaps a bit hasty, but kids need to be taught to respect other people’s space, especially involving touching other people’s shit. ESPECIALLY if said item is being WORN by the person. That said, maybe try to temper your reactions a touch."
562,"men are men gay or straight. Why does everyone assume gay men are better? Trust me, they are just as awful."
563,"Plot twist #2, steve was sent by the wife to hunt for a matching 3 some, after contract was done steve tells wife that the new tenant made the cut for rent but not for bed."
564,"You probably didn't also fuck their immediate family and then swear that fact to secrecy, either."
565,"Actually it's possible that landlordfucker through landlordfucker41 includes at least one repeat who threw away their first account, fucked another landlord, and then made another throwaway account. We may never be able to get a truly accurate count of landlord fuckers."
566,I’m genuinely disturbed.
567,"I don't think that quite qualifies as a fuck up. Had you been caught, probably, but you weren't. And now you've peaked my interest. And I hate you for that."
568,"&gt;I did not sign up for this

&gt;(Signs up for this)"
569,"Why the fuck was her asshole so dirty, though? I mean, doesn't she actually wipe it?"
570,That's 4 cents chief
571,You mean common sense right
572,At least you’re able to talk abut with the FIL. I just have to sit there and take their shit and bite my tongue :/
573,"Just before the end I started to think this was a shitpost that was going to transition into song lyrics or a tongue twister. Given how absurd it seemed by the end, I am actually more surprised that it was a normal story!"
574,Right? When your parent stops seeing you as their child and only sees you as the parent of their grandchild.
575,.....He opens a vagina????
576,Slumlord Steve
577,"It wasn't your fault, not even partially. You met someone, went to his place, hooked up, there's nothing wrong about it. He, on the other hand, is a major asshole who lied to his wife and didn't tell you he's married. What a douche."
578,You've got a good heart. Thank you.
579,MeowwwwwWWWWWWWWCH
580,Yeah he cares more about internet points than not further upsetting his wife. Why even risk it?!
581,"The most I've ever cum was after traveling around with an ex in college, we finally hooked up after weeks of tension and right after I got inside her, her relatives that we were staying with knocked, so I pulled out and jumped into my bed with the covers over me. The sudden movement set me off, and while I'm sitting there trying to act casual I was pumping almost a solid inch of cum into the condom I was wearing."
582,"It's not just mentally scaring, you can get a real bad chaff going. Then every time you get hard after that it stretches the scabs off so bam, now you're awake and your dick stings."
583,I've avoided spray all my life because of the gross kids in the lockerroom that would create walls and walls of it every day after gym class. I got some in a little target 5$ toiletry thing one time and realized I really like it! Dove for men clean comfort. It's pleasant and light. Not all spray deoderant sucks as much as axe.
584,"Will do. Fingers crossed an older coworker says usually you’ll see a random third person, who is actually HR, RSVP’d to the meeting if you’re getting fired. So we’ll see..."
585,"Because, sadly, infidelity is more common than healthy non-monogamy :("
586,"It would have to, because I actually enjoyed reading this. 😂"
587,Social anxiety's a helluva drug
588,Or they have an open marriage guys. That could just be how they do things. Don't know why that hasn't come up as an option here.
589,You should probably get that chuckled out
590,Are you bottlenosed?
591,"I think the asssumption can usually safely be that the microphone and speaker are vertically reversed. I'd use ""backwards"" for screen-away."
592,I feel absolutely filthy for just reading it.
593,Love that she admitted it. Most people would have blamed bad reception or something.
594,"Maybe take a bottle of freshly squeezed man juice as an offering?

Or just break both your arms"
595,Is his name Steve by any chance?
596,It’s better from the tap
597,"He's out there in the middle of nowhere, with some chick he barely know, looks around and what does he see?"
598,"If you're about to be single, you should at least be single with a shit ton of karma.

I should post the story behind my breakup, but i think that's too much FU for TIFU."
599,My mom was complaining that the smoke alarm wasn't working right because it should be going off. I cleaned her glasses for her and she got embarrassed.
600,Yeah I had to picture the tow truck driver getting in on the action before I was able to cum.
601,r/teenagers rise up
602,She stayed to finish the video. She has established dominance. You have my regards.
603,The Warp claims another soul for Slaanesh
604,/r/evenwithcontext
605,POWER MOVE
606,Exactly what I was thinking!
607,Dude. I would have turned around as soon as those first odors struck my nose.
608,"you should join Tinder, tons of bots on there."
609,I would only be shocked if it was that few. I expect more from reddit users
610,What a weird thing to lie about.
611,"It was more I felt reckless. I was kinda drawn into the couple thing because I knew it was fucked up and dangerous. Saying it was out of character is an understatement, but that day I could not give a single fuck."
612,Glad to see I’m not alone.
613,"Congratulations, you raped yourself."
614,"Honestly I assumed OP was a dude cause most girls at least meet up in public first. This sounded like a typical grindr encounter.

Also while unlikely, there's a chance OP's landlord is in an open marriage."
615,"""On the one hand, they might murder me or rob me. Best case scenario, I have sex with whatever smells like this beef stew and B.O. But on the other hand, it'd be rude to back out now. I'd better just be polite and keep going."""
616,"break up with her, then she wont suspect"
617,"I totally missread the title... ""Walked in on my wife's sister and cousin in a crucial part of intercourse""...
Thought I was about to read another Alabama story on tifu xD"
618,43 if you count landlordfucker and landlordfucker1
619,"We’ve all tried it, only the needle dicks can do it. I’m kinda envious"
620,We have witnessed the birth of an internet legend.
621,huh?
622,You're a 7 on the closeness scale but felt comfortable enough to beg her for some menstrual blood... dude. Wtf.
623,Gave them a laugh and a reason to call you - I say it’s not a FU but a successful initiative piece there
