,text
376,"Your submission has been removed.  **Please read this whole thing:**

Thank you for your submission. Per Rule 1, all posts must end with a [**TL;DR.**](/r/tifu/wiki/flairs#wiki_tl.3Bdr) descriptive of your post that includes, at minimum, your fuckup and its consequences.  

If you'd like, you can resubmit your post with a TL;DR added at the end.  **Don't ask to resubmit or modmail us to reapprove your post- you're welcome to resubmit your post with a TL;DR added as long as it follows all other rules.**  Please note that your TL;DR must be formatted like `TL;DR` or `TL:DR` to be acceptable, and formatting it differently may cause your post to be removed again.


*I am a bot, and this action was performed automatically. Please [contact the moderators of this subreddit](/message/compose/?to=/r/tifu) if you have any questions or concerns.*"
377,"...give kid digital device =&gt;
&gt;This leads to shenanigans.

FTFY ;-) (Source: I work IT in a k12...kid+device=Shenanigans!)"
378,"Weed is a hella ofa drug!  
\*Laughs like Rick James\*"
379,I hope you don't like to be choked
380,Narcissism isn’t a good look but you do you 
381,Damn why ya gotta be so salty 
382,I suppose. The funny thing is that he did it in his car to avoid interruptions but accidentally had BT on. I probably should've been aware my surroundings / more careful. I still feel the embarrassment!
383,That's why I don't answer unless I know the number. A lot of those are just logging which numbers answer and which ones don't so they can narrow down responsive numbers to sell / dial.
384,I used to have a dwarf at my old school but I didn't know since noone told me. One day I bumped into him by accident and I didn't know what I should've said. So I went with 'sorry I didn't see you' and walked away as fast as I could.
385,I was immediately hung up on for trying to extend a warranty on a 1991 Celica. Not sure why.
386,"Former teacher here; Kahoot names like yours would [at most] get the class banned from playing any sort of games for a period of time. I usually just kicked them out of the game and made them make a new name. 

The only name that really caused a stir had something to do with bukkake and it caused them to lose their game privileges for the semester. They were probably wondering how I knew what it was."
387,Wow it can even describe the teacher
388,I played Kahoot today and had the name benis and ☭ at different points. Rural schools man
389,"I spent way too much time trying to figure out what the heck ""my life is fourteen the ages"" meant lol"
390,Ur mom is the real story here. Making this about her? I can't imagine the baggage your dad deals with. 
391,What about the French friend? He can fully invade that without much resistance from her.
392,"Can and is, John Oliver setup robocalling to the current FCC commissioners."
393,"Mat, followed by the short lived Asmodean."
394,damn it... DAMN it. i have that url memorized and the splendor of kahoot music drew me in.
395,Wtf is a kahoot? 
396,"Because he is in the pocket of Verizon and potentially others, who have a vested interest in not being regulated."
397,This stories get more and more outlandish by the the day. Did I tell you all about the time I ended up hanging with the yakuza and having to escape on a yacht while keeping a pet tiger in my sweater?
398,Start answering and just press the 0 button a ton. Just keep pressing it til they disconnect. Worked for me. I was getting 4 or 5 calls a day for a while. Just got worse the more I ignored them. 
399,Omg that's so cute and funny 😂😂😂
400,The amount of people who completely ignore the definition of pedophile is astonishing lmao 
401,I thought I was being summoned for a second there.
402,"I was working with a youngster (3rd grade) who had the user name mewtwo and I thought it was making fun of the MeToo movement. I considered asking him to change it, and I got distracted, then I forgot about it. Months later while playing Super Smash Bros., I learned that it’s just some Pokémon cat or something. Glad I didn’t say anything. Also I am happy that the 3rd grader was being a normal 3rd grader. "
403,"You think the objectification of women is funny and still don't get it when your mom explains it to you. Ugh, this shows why it is important for your dad not to think that is funny because apparently you refuse to respect women, even if it is your mother."
404,I think this is a pretty common scam that scammers try to pull on retail stores. They always have the store number and name of managers before they call. I work retail and I get emails whenever a store gets hit so we can warn everyone about it. We will put little signs on all the phones that say “DO NOT LOAD GIFT CARDS OVER THE PHONE” or something like that. 
405,You had me at “TIFU by invading Poland”
406,Upvote because Futurama!
407,"Protip: Don't do to a man's penis what you did to that vibrator. 

&amp;#x200B;

&amp;#x200B;"
408,"Honestly, if this kid wanted to fight back, he could have REPEATEDLY told everyone how the teacher privately “called me a pedophile.” It’s not great for adults to use the p-word, privately, to kids. Maybe explain how you don’t even know what that word means, and how it really upset and confused you, being called such a word by an adult. And the teacher then has to choose to reply with “no, I said it makes him LOOK LIKE a...” and the teacher really looks like a jerk. But this kid seems like a good honest middle schooler, and the teacher’s response may have been a bit emotional, but I don’t think it’s too unfair. I admire the kid for being accountable for his actions. "
409,Most robo calls switch to people after about 30 seconds or so in my experience 
410,"So...I'll assume you and the lady have known each other for quite some time, so one can safely assume she was aware of your fondness for German memorabilia and German history in general. Which promptly begs the question: Why bring her family, who are not fond of all things German, into the home of someone like yourself?

&amp;#x200B;

As whackadoodle as your antics are, I do not believe your GF thought this out all the way."
411,Always have a banana ready for a snack if you're gonna take the long way home. If ya know what I mean...
412,"I’m not that young, but using context, without ever seeing this word written on the internet, I assumed it was a class learning game app thingy, like quizlet.  I’m new to reddit, and I see a lot of “what is Kahoot?” Questions, and I don’t know if this is what the kids call “trolling” or if it’s some kind of run on joke? "
413,Definitely using this. Live in a Spanish speaking country so no one will ever find out 
414,Hope you did not leave the condom in the haste. 
415,One a scale of 1-10 of the weird shit a year 4 teacher hears in class daily this would rate about a 6
416,"I always enjoyed setting my kahoot name to my teachers name, made things more fun when the teacher is giving bonus points to the winning student and the winning student is the teacher"
417,"rarely do I laugh at these. your post, best ever!"
418,**T**(wenty-one years ago)**IFU**
419,That’s awesome! 
420,He probably plotted his vengeance on you for some time and then realized he never saw your face and couldn't find you. 
421,"""What characteristic word even sounds remotely to 'dork'?""

Was not disappointed. Thank you for the laugh"
422,"Teachers don't generally make that choice. They see a problematic behavior, decide whether to submit a referral, then an administrator decides the punishment."
423,Military time also doesn't use the colon but 24h does
424,Omg I JUST made a kahoot quiz for my class tomorrow and I just know they’re going to come up with some horrible names. I can’t wait though I think it’s hilarious
425,Plot twist: she really is 80. 
426,"Couple things, enjoy your day and reflect on your friends and decisions... Time we'll spent ay. Also is someone going to add link to kahoot from Google?"
427,[Don't worry you're not alone](https://youtu.be/keEIsXqCCGI)
428,"It became a thing my senior year in high school (thank you God not any earlier, or else me and my friends would’ve had 7 TIFU’s exactly like this a piece) and my US History teacher used it a handful of times, and as you know 98% of the time in high school history teachers are just dudes who want to be high school football coaches, so naturally he was fun to joke around with. We made a game out of trying to make the most inappropriate name, without getting rejected or yelled at. "
429,"There was a guy in my high school named Michael Hunt... he wanted to be called ""Mike"""
430,Haha. I actually checked that first. 
431,I can imagine it being so.
432,😂 Thank you for sharing! My drunk ass had a nice laugh tonight about this!
433,I’m gonna call BS on that. I pulled 2 days detention for getting into a fistfight in middle school. Why’s a kahoot name (that the teacher didn’t instantly kick anyways) buying 5 days? 
434,"Hey, back in 9th grade my friend got suspended, I kid you not, for high giving someone roughly. For two weeks.

The teacher heard a very loud slap, looked over, and started yelling at him because he thought he slapped my other friend. He sent them both to the Dean, but no matter how much they tried to explain they couldn’t convince the dean that the teacher was dumb enough to mistake a loud high five as a slap. 

"
435,Hunt is bulletproof. 
436,That's.... kinda sweet.
437,Wtf is a kahoot?
438,I don’t understand how this is a TIFU when it happened two decades ago.
439,\ take it 
440,"I dont feel like the victim anymore
YAY"
441,"Told my friend to have his name be “Gay = Sin”. Teacher got pissed and asked who made the name. She kicked him, and his address bar in his browsers covered the words telling him he was kicked right as someone walked by checking for who made the name. He got damn lucky that day."
442,"Said yes to weed; said no to crack.
Now there's glass stuck in his back."
443,[removed]
444,"You're a pedophile because you have interest in people your age?

FBI open up"
445,Nice
446,I got better!
447,That's exactly how I read it.
448,Ah the ol' I'm not a Nazi I just really like German history line.
449,How did she connect this to pedophilia??
450,"My little brother is in elementary school and has a bit of a dark sense of humor inherited from his  high-schooler brother. My parents got an email home the other day explaining that he had been punished for making his Kahoot name “My Dad Beats Me”. 

Man, did that warrant a talking to..."
451,You gotta go hard in HOI4. There’s no other way.
452,Howd the teacher even know? 😂😂
453,OP just got modus pwned
454,Here you dropped this! \
455,"My number got somehow sold I guess to a list of random solicitors. They just keep calling and calling, and the only solution  has been to actually pick up and wait through the spiel to get on the do not call list. 

Sometimes I answer, intending to do this, say hello... nothing. Repeat... wait.. then they hang up!

So it's just a random call with no result. Annoying AF."
456,"It's German humor, mate. It's no laughing matter."
457,"This story makes me think your teacher was one of those people who pronounces dwarf as 'dorf'. 

Which makes her a mental midget."
