,text
0,If it makes you feel better the bird was probably full of parasites..
1,*Indeed*
2,"I've always been proud to experience everything and anything this life ha to offer, but today I'm glad that you did and I didnt. Congrats haha"
3,"Thank you for submitting to /r/tifu, /u/DocWyli.  Your submission, *TIFU by wiping my face with a mentally ill kids cum rag*, has been removed because it violates our rules, which are located in the sidebar.

**Rule 2:** Uninspired, lacking in context, literal shitpost, overly vulgar and glorifying illegal activities posts may be removed at mods discretion  
**Overly vulgar** includes obscene situations, such as, but not limited to, incest, minors, death and assault to humans and animals. Consensual situations between two, unrelated adults should be fine. Vulgar does not mean using bad words.



*^Refer ^to ^our [**^detailed ^rules,**](/r/tifu/w/rules) ^our [**^suggested ^subreddits**](/r/tifu/w/subs) ^&amp; ^list ^of [**^fuckups ^commonly ^removed ^for ^rule ^2**](/r/tifu/wiki/commonfuckups)  [ ^before ^sending ^us ^a ^message](https://www.reddit.com/message/compose?to=%2Fr%2Ftifu)*

^(Reposting a removed post without express moderator approval will result in a ban.)"
4,"Oh nein, the polish reinforcements, aka her family, blitzkrieged my arse before I got to Lwow "
5,Why would you let them near your phone alone?
6,"""What about that tattoo on your chest, doesnt it say ""DIE, POLAND DIE""?

&amp;#x200B;

""No, thats German for ""The, Poland the""!"
7,"A website used for interactive real time quiz

All students log in on their devices and the teacher displays the question on the screen, students the pick the answer and the student that gets the most answers right and the shortest time to think about an answer come first."
8,"I have POTS (postural orthostatic tachycardia syndrome) and I can definitely relate to this. The heat, prolonged standing, and increased heart rate from the “activity” would definitely make me faint. "
9,r/unexpectedsimpsons
10,so... you weren't majestic? 
11,This is the funniest shit I've read in a long time.
12,"I defined a as ""Soviet Russia"", the term we've been discussing. Not an integer, btw."
13,Thanks. Why would they need to pick unique names each time?
14,I can’t even begin to tell you how many times I’ve zoned out when I’m high and having no clue where I’m going
15,"I had one that told me I'd been in an accident. So I pretended the accident was in process.

'MY GOD. THERE'S BLOOD EVERYWHERE. IT'S DRIPPING DOWN THE WALLS. MY ARM! I CAN'T FEEL MY ARM. I THINK I'VE KILLED SOMEONE'

All interjected with a lot of swearing. They hung up almost immediately so I didn't get to waste their time, but bloody hell it was good fun"
16,r/thathappened
17,nice
18,"Fair enough but I'm mainly talking about people who answer knowing (or at least 90% sure) it's a scam. Like OP.

Even if you have to answer it, or answer it by accident, just hang up. Don't hear them out or fuck with them or call them names. Otherwise you give them reasons to call you with new scams or add you to every list they have access to.

Idk why I'm getting downvoted for saying this. People just love fucking with scammers, even to their own detriment I guess. "
19,"This is your roommate's fuckup, not yours.  If an interview is important, you don't do it from a car."
20,New link pls it won't work
21,"Look into RoboKiller on iOS. 

Stops 99% of what I used to get. "
22,XD  Beat me to it..
23,"Uhhh.. i myself an not a native English speaker and yet here I am. I live on a non English speaker country ( English is not even a second language here) , and I know a big group of people that are Redditors.

I mean is not a big deal or anything, just telling you that you probably understimate the amount of non natives English speakers here on Reddit."
24,"Annnd reference:

https://youtu.be/C1STpYAFxJk"
25,Wasting your time singing the jingle city folks just don't get it.
26,"Dat hot water, man. Make sure to leave the doors open just a bit or turn down the heat.

Source: my bf passed out in the shower shortly after screwing me. We've done it many times, but this time left the water on way to hot. TURN IT DOWN, FOLKS

(Or, you know, breath.) "
27,r/socialengineering
28,"And it burns, burns, burns"
29,Figure out what?
30,"If I had to guess, I'd bet that they have enough employees to cover it. Most of these calls are from organizations overseas with call centers, not individuals. And of they are an individual, then presumably the auto-dialer halts when they're on the phone, and will just pick up where it left off after the call is done.

The real solution to this problem isn't to waste their time, because their time is pretty worthless. The solution is to harass and waste your government representatives' time because they're the ones who can actually get momentum going to find a solution. Also your service provider needs to be made aware. The more complaints they get the more they'll do to address it. Even though they won't be able to do anything for specific cases, it will pressure them to invent some tech to solve it. "
31,"Careful, he’s a hero"
32,"
&gt;You were born late enough to not be that reliant on your phone, adjust accordingly moving forward.

What the hell are you on about?"
33,"&gt; reciting pi slowly when he asked for numbers

Brilliant. "
34,"This is actually not at all true. 

We’ve been working on this for quite some time, with multiple carriers from multiple nations involved. It requires basically EVERY carrier worldwide to make changes, because of the handoff of calls to reach other parts of the country and the world. "
35,Does this count as auto-erotic asphyxiation?
36,"To be fair, alcohol can be pretty dangerous too."
37,"The reason anonymous automated calls like this are still even possible is because the telecom industry in the US has not spent any money upgrading their protocols for security. Why would they? The regulatory bodies that would normally demand it are very captured.

The reason we all get so many scam calls is because the government isn't doing it's job."
38,It's a matter of ceramics.
39,"Yeah duck mating habits are kind of disturbing, often times due to species population skewing male, a female duck will basically get gangraped, and due to the violence will sometimes even die.... and the males will keep on going afterwards."
40,Shouldn't this inspire you to fight that antiquated drug policy? Or at least develop a grudge against the rule so when you become management you can change it!
41,Damn that’s like the plot of an anime right there.
42,Are they that unattractive?
43,"""Yo, fucker! Get yer goddam dick and bag off my body!""

Is what everyone in the company would have been repeating for the next three years had that happened to me."
44,"Dude, use a VPN."
45,So true! There were so many things that happened in high school that I thought I would never outlive.
46,/r/punpatrolpatrol
47,"Military? It's just the 24-hour clock - and the ""pm"" doesn't belong. "
48,Yikes. You should really be careful with comments like that. I hope nothing worse happens but in the future keep that kind of talk behind closed doors
49,"Erm, don't think ""looking"" at someone could be sexual assault"
50,"Man, I do not miss high school."
51,Nice
52,"That's on the teacher for kicking your nickname before the game started if she knew what it was and had a problem with it. I always bounce my students with offensive nicknames before starting the game, give them another shot at something wittier and less offensive. 

Source: am middle school teacher. Wouldn't suspend kid for plz send nudes upside down but would dock their participation grade for the day and give teacher glare while trying not to laugh. "
53,Damn
54,"In college I stumbled home drunk many of times. Always made it back home safe and sound before letting the demons out of me. I lived with 7 other guys who were all great friends, and we had a key code to our top floor apartment. One night during finals week I was at the library until about 1am studying. Under no influence but sleep deprivation, I tried to use our key code on the floor below ours. Obviously didn't work, kept trying and got frustrated. I'm thinking, ""the guys don't care if I just ring our door bell, they will understand."" So that's what I do, and some dude I barely recognized answers and gives me a weird look. I share this weird look and wonder what he is doing in our apartment. It dawns on me after about 10 seconds that I just rang the doorbell to another apartment that has 8 other dudes sleeping before finals. I stammer for a bit and the best thing I could come up with is ""You live here"" *points at him*, ""I live up there"" *points up*. Then I proceed to go up the rest of the stairs. He definitely thought I was fucked up."
55,Nice
56,"It could've been worse, Jordan did seem to like writing about spankings. "
57,"Sir, cum vented!"
58, \#woooosh #unexpectedthanos #theydidthemath #theydidthemonstermath #twentycharacterlimit #subsifellfor #askouija #redditsings #unexpectedjojo #increasinglyverbose #decreasinglyverbose #madlads #decreasinglyverbose #jesuschristreddit #everyfuckingthread #comedycemetery #comedyheaven #itswooooshwith4os #me_irl #2meirl4meirl #unexpextedbillwurtz #2meirl42meirl4meirl #subsithoughtifellfor #subreddithashtags #ihadastroke #technicallythetruth #ihavereddit #foundthemobileuser #boneappletea #firstsub #secondsub #thirdsub #fourthsub #fifthsub #sixthsub #seventhsub #eighthsub #ninthsub #tenthsub #eleventhsub #twelfthsub #thirteenthsub #fourteenthsub #fifteenthsub #iamverycool
59,You actually may be a nazi. 
60,You stole this from another post. Fake and gay. 
61,"Honestly, if I walked in and this had happened to one of my male friends I'd be way more worried about you dying than the cum on you. Confused, yes...but not permanently grossed out or angry."
62,"Hi from the Iberian peninsula. You're wrong, but hey, that's socialism.

[http://cosaspracticas.lasprovincias.es/tecnologia/radiografia-fraude-telefonico-20170721190225-nt.html](http://cosaspracticas.lasprovincias.es/tecnologia/radiografia-fraude-telefonico-20170721190225-nt.html)"
63,I miss these kind of situations in which smoking makes your life a mysterious adventure! 
64,"Use Firertc.com for calling scammers, trust me i do this a bit, also check out r/scambaiting"
65,"These asian names man lol

Always so complicated"
66,Why not have the child's actual name?
67,"[""Will you stop talking about the war?""
""You started it.""
""We did not start it.""
""Yes you did, you invaded Poland""](https://youtu.be/yfl6Lu3xQW0)"
68,You don’t even know what she does for a job? 
69,This is a repost 
70,"I did the tilt table test years ago, I didn’t have POTS, just orthostatic hypotension. I also have general low blood pressure between 90/60 and 80/50 on average."
71,It’s not even your post nor image 
72,"It's my post, my images and my dildo what do you want "
73,Lol gross dude 
74,Nice
75,Nice
76,Got it. So it’s legal to make a non sales sales call. 
77,Uh I think you just described Auto-Erotic Asphyxia...
78,"It always feels like I’m the only one that is afraid of death. Not that I’m glad you feel that way too. It’s a terrible phobia. It used to be where I couldn’t even talk about it. Sometimes it still is.

I’m sorry for your loss too. Losing a parent just sucks. "
79,"Nowadays It is better to just ignore phone calls because if they realize you have a live number, they will sell your number over and over and over and you will never get rid of them"
80,"This is one of those stories where I agree with both sides.  It doesn't sound like you are doing anything wrong.  Unfortunately, there are bad parents who make teachers extra cautious, and often they opt for the ""better safe than sorry,"" approach.  Maybe invite the teacher for a home visit, and try to get on the same page.  I think you are both looking out for this kid's best interest, so hopefully you can find common ground there."
81,"Stroke on wildly on your hide

Till you wake up red and white"
82,"No, just not American "
83,"I went Down down down, but the flames went higher."
84,Exactly 
85,Nice
86,"Oh shit, trying not to laugh out loud with a mouth full of Chinese food right now. "
87,Nice
88,[removed]
89,dewit
90,469 was mine xx
91,[removed]
92,r/punspecialforces I’m here for backup
93,"I read the title thinking how because breathing is involuntary then read the post, saw you got high and understood. lol"
94,"Having shared a house that had the WORST drains with a hormonal teen boy, he never clogged the shower with cum, and if any shower was gonna clog, ours was it. And this kid... well he was industrious. washing his laundry was an adventure.

Although if his cum hit another housemate's long hair clogs, it could get kinda gross. Thankfully he was a responsible masturbator and did the drain snaking himself. (It stopped happening once we got a drain guard, the hair would catch in that and get thrown away, not sure if the guard caught spooge but if it did, Lil' Bro was throwing it away somewhere I never found it.) "
95,What I know about dwarves... very little.
96,When a randomer gets heckled by a world class comedian.
97,"I can, but I have a feeling she only like distance relatives.  "
98,"Yeah you're right about that. Still took me a minute, even with only a few small mistakes."
99,O KURVA!
100,I hound it was “Things I Fucked Up”
101,I blame your mother for that one. 
102,Time I Learned?
103,I wonder if they put him on a sexual offender list already
104,r/ihavesex
105,"I'd suggest an external hard drive for this stuff. Sure, if the house burns down they are gone but... Having them physically there is secure in another way... Hackers or simply a company going bankrupt without notice"
106,Do Texans say “grade 4” instead of 4th grade? Seems un-American  
107,I’m not supposed to give my opinion BUT
108,I'll take it
109,"This is why lying to kids is not how one should parent.

Hilariously embarrassing though."
110,[removed]
111,Think I fucked up master race
112,Dude I fucking died at Mike Oxlong 
113,"Your level of passion for history is commendable, that's for sure"
114,"While reading this, all I could think of was this poor guy

https://youtu.be/8kjY9sKdHlY"
115,"LOL, best misunderstanding ever. Go get an internship at wherever Shane Black writes his screenplays."
116,"If she’s not complained that much then don’t worry 

It will heal, and be more careful with that piercing "
117,Where is the pun patrol when you need them?? 
118,"He said he left. That's why she left, to go laugh her ass off."
119,"I blame your company too. They need to set permissions on the console for stuff like VMs, App and compute engines."
120,r/AwardSpeechEdits
121,"Or they’re dead, either or."
122,Just use coconut scented body products. People will never tell the difference
123,"Or ... you know? Approach Alex instead, maybe next time he doesn't need to do it alone."
124,"Teachers didn’t talk like that in the late 90’s.  In fact around then, I had a teacher who didn’t tolerate the work “dork” maybe because it technically means “penis”, or because it was an unfair and hurtful judgement on someone.  Now being a dork is cool so I don’t even know."
125,Burn it down
126,Cant rape the willing 
127,You must be so fun to hang out with 
128,"*considers searching YouTube for old Dorf skits, those were kinda funny."
129,Cool story bro
130,Anyone who says it isn’t is satan
131,they're not? 
132,PAROLE GRANTED
133,"&gt;BUT, if everyone did what OP and his gf did, waste scammers time, their industry would crumble.


Narrator: *""But it wouldn't."""
134,Remember in High school every September they;d coral us in to the auditorium to spend an hour telling us that even pictures of ourselves on our own phones would label us as Pedophiles. 
135,Came back just to upvote this.
136,"Because not all teachers are old and decrepit beings who don’t get online lol. Yes, we too keep up with meme culture and current trends- how mortifying. "
137,Is this a religious school or something? I feel like I’ve said and done much less appropriate things when I was in high school.
138,"Step dad once stayed clean long enough to pass a test then ""celebrated"" that night. Then they surprise tested everybody again the next day. Lost out on a really great job."
139,"Maybe you didn't look in the right places, even though is not legal, i have a dealer with a network so big, he even has home delivery, some guy just arrives at your place, with a white box, and a seal of warranty (if the seal is broken you shouldn't accept the package), he has a wide selection for a street dealer haha, he has strains in the range of 3 to 125 dollars for an oz. (hydro medical being the more expensive one)  


But i agree, it's probably crap compared to the stuff they sell in legal states in the US. Still it's very interesting and he has decent stuff."
140,What the hell is wrong with fish sticks?
141,O my.... maybe one too many Os 
142,Your teacher was puzzled on how can someone be a legend that young
143,"I was kicked out of a musical for supposedly harassing, assaulting, and raping multiple girls. Even though I'm just sitting in the back just cracking jokes. "
144,"Yep. From what OP wrote, it doesn’t even seem like he fully understands why his girlfriend’s family was so distraught (and that they honestly had every right to be upset)."
145,"Actually it's ""orangered"" "
146,At the top of ones lungs.
147,I wouldn't wish what I went through on anyone
148,Clearly a math whiz such as himself does not want to get suspended. 
149,"i mean im not that old, i graduated in 2012, and i never heard of Kahoot.

though i think we sort of used quizlet a bit, it just started getting used a bit by senior year, and got commonplace by the time i went to college."
150,You seem to have had no trouble using in moderation from what I gather. As much as you did at once due to your mistake... I'm hoping I wouldn't do the same thing!
151,"Yeah, definitely orange. Supported by downvote being unquestionably blue. Seeing as orange/blue are opposite on the color wheel I would say orange team wins."
152,"As a former college student (Well, on paper. I admit I still don't know shit.), If I saw my teacher was on Tinder, i'd consider it amusing, at best. Your business is not my business to spread.

&amp;#x200B;

If these 2 fellows are as much adults as they are supposed to be, it'll just be an interesting talking point between them. And they'll probably be wondering what kind of people you're into. Beyond that, I wouldn't expect them to do much.

&amp;#x200B;

But if they do? Well, the only people you should worry about knowing your business is your boss. Your students? Just move along and roll with it. They'll either be mature about it, or they won't. You're there to teach them how to use English properly, not how to behave like adults. That's up to them. "
153,[removed]
154,"https://youtu.be/6k01DIVDJlY

This is a very good video. It's hilarious but all information is factual. Its great."
155,"Off the top of my head, my uni classes have used Kahoot, Go Formative, and iClicker remotes for in-class quizzes like this."
156,"“Manuel!! There are too much butter on those trays!”
“Oh no sir! It’s uno dos tres!”"
157,No genitalia were mishandled in today’s TIFU.  Thank you.
158,Turns out they don't like Germany much... No shit
159,"Be me, cheerleader.

Before we leave for Nationals, we practice.

I hold up my flyer in a half ( two on side, one back spot, holding flyer up to face level).

I forget to breathe during the hold, I pass out, flyer comes down and breaks ankle.

Now we have no flyer, and we all blame her for falling down."
160,"My best friend has syncope (idk the specifics) and he’ll pass out whenever we get into an argument cuz of the sudden rush of blood (at least that’s what he said). 

You’ve now made me wonder if he would pass out during sex. I did not want to picture him having sex. Oh god. Why did you do this "
161,"I'm not dying on any hill, I'm pointing out how ridiculous what you just said was. You lost the battle right when you started it kid."
162,"wait 5'12 is 6 ft ?! HOLY FUCK IM 6 FT!! (We use meters here in Canada, and my dumbass thought 5'12 exists lmao)"
163,"if you've ever combined jizz with water you know it doesn't clean up well. it is fucking gross to do in a communal shower, end of story. there are plenty of other places to jerk off."
164,"Good visualization and great explanation, bravo.
Theres still something missing though. In my last comment, I said following:

&gt; You still didnt specify what country (or not) exactly youre talking about.

In other words, a = ?
Or in even other words;

    Error in Line 2, Column 1: integer ""a"" not defined.

**We cant have an argument if i dont know what were arguing about.**"
165,"You died on the hill apparently about 37 downstabs ago last I saw. 

Remember, basically every hand you’ve ever shaken has had a dick in it and probably semen on it. Also hope you’ve never stayed in a hotel, ever. 

You can keep talking about a battle you think somebody lost though, and keep trying to belittle others with names and insinuation. "
166,W A T E R
167,The out-cum 
168,They’re great unless they have a firewall that blocks them like we do at work. Haven’t figured out how to tunnel around that roadblock yet
169,"Oh god. No, it was not a pun, it’s an expression. **I AM NOT ONE OF YOU FILTHY PUNNERS**"
170,mate if I walked in on a friend who came so hard he smashed through a pane of glass all is feel is jealousy 
171,Or answer the door in your underwear. I hear that works too.
172,"Edibles are easy too, as long as you start small and work your way up. Start with 1mg if you want to be extra safe, but 8mg-12mg depending on your size/how much you smoke should be a good starting point"
173,Yep.. gotta keep those feet above your head. 
174,How? It's all bodily fluids being washed down the drain. 
175,[removed]
176,"Patience, grasshopper"
177,_Nice_
178,What does that do?
179,Nice
180,Penis Pumping Equipment
181,Lol... Don't get suspended like me
182,"Lmfao ""WHAT THE FUCK BRO! Ohh.... OH. OH SHIT. SORRY MAN"" *nopes out of there*"
183,Nice
184,"Please explain what a ""kahoot""  is for us elderly folks."
185,"Funny how you talk about apples to apples when you talk about someone literally jizzing on the floor and someone else walking in on it versus using their hand to jerk off. Thanks for proving you're a fucking idiot once again. And it doesn't matter if a million gross neckbeards with jizz feet downvote me, it is still fucking nasty to jerk off in a communal shower and that is just how it is."
186,You wouldn't be able to see them thus you'd never match but they would be able to see your profile. 
187,Hahaha semantics. Nice.
188,You mean phone call from scammers? Or the phone bomb that they used to send the endless calls
189,Exactly! Then I feel like I'm a creep for wearing her things. I bought a house. We closed one week after she passed. She helped me buy it. I have a room that has a bunch of family pics and some of her antiques. I also have her violin on a shelf I made for it. She was a classical violinist. I miss hearing her play. 
190,Lol
191,So many junkie-stories of them inevitably messing up...yikes
192,This made me chuckle. Thank you. 
193,"or you could tell people that if you let your sexual energy build up for more than a week, you become capable of producing a heroic cumshot with a concussive blast powerful enough to throw a grown man through a sheet of glass. "
194,I don't get it
195,Right? I mean who even does dumb shit when they wre drunk😂 the true mark of an idiot 
196,"John Oliver did a segment on robocalls just the other day, and he mentioned that answering the call and engaging with them just turns your phone number into an ""active"" line and you'll just wind up getting more calls. "
197,When Im close to nutting I do this and it feels really nice after you release the pressure
198,I bet this dude works on one of those ghost Hunter shows.
199,i am a cucumber
200,Bicycle repair man!
201,So everyone in your house walks around with jizz feet? No fucking thank you. And I have no idea why you think jerking off in bed means your housemate needs to smell it. 
202,"I saw “roommates” so I assumed he was referring to them as “colleagues” for some reason, but I then I saw that they were living together through “work accommodations”, so they are also all working together."
203,Someone ate shit before. I guess that isn't gross either according to you.
204,"Because anyone who smokes weed is a junkie?

Good Lord, do you do *anything* but shitpost far-right propaganda all day?"
205,r/foundthemobileuser
206,Another good'un would be Subarashiki Hibi
