,text
207,"Probably because they're more interested in putting controls on our internet then doing any actual good. For the love of god, you'll have to buy some kind of ID card to access porn soon. Who in the hell thought that would be a good idea? This entire thing isn't about protecting kids, it's about controlling our internet and what they want us to see, monitoring what we do and no one seems to care. They started this years ago with their shoddy porn filter. When not enough people signed up they made companies turn it on so we had to opt out manually (it was blocking reddit, but my ex could still access his normal porn sites), now it's on for all new customers and it still isn't good enough. I'm not sure why they're getting so bent out of shape over what porn people watch. Some things should be banned, I agree, but why not use the money they're wasting on adding extra police to the streets, give it to schools to better their education, fix pot holes, feed and house the homeless or any other number of things that need their attention and leave the damn internet alone. I'm not arguing for the porn, I couldn't give a damn about it honestly. I'm just pissed were losing our freedoms online step by step and most people just don't seem to care. Ban the illegal stuff (although I still miss megaupload), leave everything else alone damn it!"
208,"One time I had a bad tinder date and the girl posted my number on Craigslist saying I had a massive amount of free chickens to give away.... keep in my mind I live in a city.... and I got probably 20 calls asking to drive from California to Virginia to get these chickens. Oh and she posted my number on Jacob sartorious account and said it was his, I had to call the cops long story short hahaha. "
209,You want him to post pics of someone else's house?
210,Now I’ve got the mental image of you using the Pickelhaube to quickly cover your Pickelhelm. And it’s hilarious.
211,"""Heads-up I promise I'm not a Nazi"".  

That's exactly the kind of thing a Nazi would say. /s  

Given the entire situation, I think you're best off just giving up on this relationship, and perhaps finding a nice German girl instead?  Well... maybe not so much ""nice"".  Get a big, strung Brunhilde-type.  Maybe some whips and chains and leather and stuff."
212,I can feel your aunts buttcheeks clenching.
213,JUST LET ME STEAL YOUR MONEY UGGHHHHHHHH
214,Probably what broke his fall too.  \#Absolute unit.
215,"Holy shit, that was amazing! I literally laughed my ass off (a first for this subreddit)! "
216,"i belived it untiul
you mentions that they are trump supporters"
217,Or she'd rather you were into older ladies...
218,I work in the film industry myself and God damn its so exhausting I'm surprised you didn't pass out from sheer exhaustion. Not a surprise you forgot to breathe after a long week haha
219,"I found myself in town randomly one year for that festival... Frozen turkeys everywhere!  It's since become an obsession.  I also found a wadded up festival t-shirt in the road, it's still a favorite"
220,Why would he be against fixing it?
221,"I'm with you man, I didn't believe it until I saw it for my own eyes.  Maybe I'll go back and take some pictures "
222,"One day he’s going to fall off and get some chicks. 

Until then, good luck OP. "
223,With CK2 you can avoid all the 20th century issues by expanding Bavaria to the Urals! An empire focused on purity... of beer ingredients 
224,You would think that a modern phone company would have the resources to track spoofed call because they would need some way of communicating the faked number. I always assume it is through some sort of hacked VOIP. Maybe I'm wrong.
225,You got a solid point lol
226,"lol, best tldr ever btw"
227,Hmmm why are people against legalizing...
228,Dass finde ich eigentlich sehr lustig 😂 aber viel Glück mit deine Freundin &amp; ihre Familie 
229,Submitted to UD. Waiting on review and approva;
230,"First fuck up was spending so much on a phone, upgraded from a cheap Motorola and can't reccomend enough."
231,Even Sea Captains have a dating app.
232,No
233,"I’d say of the 20ish most didn’t respond, got a lot of “eeewwwwww”s and 1 dm’d me saying why play pretend when I can play for real. Well worth the post. With today’s climate I’d prolly be in jail"
234,"Better one is ""Mike Litorus."""
235,Hello future people!
236,Im currently in a small town with a huge film crew doing some stuff in the center of town. I really wish I knew what they were shooting but no one knows and none of the workers will say....fuckers
237,"Call her every night for a week at the same time, then tell her the phone has a mind of its own you know nothing of any calls. Tell her it’s doing the same to your mom, you think it hates when women sleep."
238,Waiting for the TIFU by mass texting my recruits and for the next 2 hours 20 people spammed each other with memes. 
239,"Mikeoxlong 

Read it quickly "
240,"I sympathize, I fucked with a random scam caller about 6 months ago, and I get 3 to 4 calls a week now from spoofed scam calls.

Can't block them because they pretend to come from a different number every time, and can't call back to complain because they're a scam and spoof their number.

Can tell instantly when it's one because of the background noise (and the fact that they always ask for ""Mr First name"" instead of ""Mr Surname"").
"
241,Thanks!
242,"I agree, or better yet keep it in ur head. I don't know why you are getting downvoted. Probably just a bunch of dudes who do the same thing and don't want to admit it's wrong"
243,thank you. this helps a lot
244,"I just don't answer my phone if it's not a number I know. If they really want to contact me they'll leave a message. When my phone rings outside of Whatsapp 99.9% of the time it's for PPI checks, insurance crap about me being in a car accident, silence on the other end or some sort of recording. The other 0.01% is Forbidden Planet calling me to remind me to pick up my comics because they've been keeping them far longer then they're supposed to for me. They know I'll come and get them, I'm just very rarely in town to do so. They're a really good store. "
245,A friend passes out if he's standing still for around 20min. A slow fap in the shower would definitely lead him into this scenario
246,"Fake or not, I chuckled. "
247,"Your submission has been automatically removed because your post is too short. Per Rule 3, all posts are subject to a length requirement of **750 characters** of meaningful content.  You are welcome to resubmit your post once it meets the minimum length.  **Do not contact us to reapprove your post.**  You will need to resubmit it as a completely new post.


*I am a bot, and this action was performed automatically. Please [contact the moderators of this subreddit](/message/compose/?to=/r/tifu) if you have any questions or concerns.*"
248,"Your submission has been removed.  **Please read this whole thing:**

Thank you for your submission. Per Rule 1, all posts must end with a [**TL;DR.**](/r/tifu/wiki/flairs#wiki_tl.3Bdr) descriptive of your post that includes, at minimum, your fuckup and its consequences.  

If you'd like, you can resubmit your post with a TL;DR added at the end.  **Don't ask to resubmit or modmail us to reapprove your post- you're welcome to resubmit your post with a TL;DR added as long as it follows all other rules.**  Please note that your TL;DR must be formatted like `TL;DR` or `TL:DR` to be acceptable, and formatting it differently may cause your post to be removed again.


*I am a bot, and this action was performed automatically. Please [contact the moderators of this subreddit](/message/compose/?to=/r/tifu) if you have any questions or concerns.*"
249,Has to be Ozark
250,[removed]
251,Don't cheat.
252,"Five hours ago would be 3pm German time, so you don't work?"
253,"The angry ones always get me.  *You're* calling me to *scam* me and *steal* from me and you have the gall to get pissed or indignant when I mess up your plans?  I mean, come on.  "
254,I'm going to move to a company that supports shaken/stir so I stop getting spam phone calls.
255,When 900 years old you reach *ohshit wrong sub*
256,"Yep, not a big deal."
257,"What??? No way, link?"
258,Yeah I mean. That shits pretty far beyond the line of becoming a nazi haha. And I speak german lmao.
259,lol sadly im not on a throwaway so i have less karma now but it was worth it
260,It’s probably a zero tolerance policy because the insurance company demands it. 
261,"I signed up for RoboKiller a couple of weeks ago, the app that won the FTC contest on shutting down scammers &amp; robocall. Calls have dropped from about a dozen a day to one or two. "
262,"Es sieht so aus, dass du richtig abgefickt hat"
263,"Thanks dood!

It's even worse when I have clarify it to so many people &amp; still no one believes me."
264,"Your submission has been removed.  **Please read this whole thing:**

Thank you for your submission. Per Rule 1, all posts must end with a [**TL;DR.**](/r/tifu/wiki/flairs#wiki_tl.3Bdr) descriptive of your post that includes, at minimum, your fuckup and its consequences.  

If you'd like, you can resubmit your post with a TL;DR added at the end.  **Don't ask to resubmit or modmail us to reapprove your post- you're welcome to resubmit your post with a TL;DR added as long as it follows all other rules.**  Please note that your TL;DR must be formatted like `TL;DR` or `TL:DR` to be acceptable, and formatting it differently may cause your post to be removed again.


*I am a bot, and this action was performed automatically. Please [contact the moderators of this subreddit](/message/compose/?to=/r/tifu) if you have any questions or concerns.*"
265,"Ooof, that doesn't sound like it's your fault. People sure can be annoying. Hope you don't feel too bad about it. Haha guess you might already, otherwise you wouldn't post this.

Well you'll get at peace with it soon. Have a good one! "
266,"I did have one guy yell at me ""SIR PRESSING THE WINDOWS KEY WILL NOT SUMMON INTERPOL"" "
267,"Bro, you're only bringing more attention to your fuck-up by making this post here (in addition to the dozens of other posts and comments you've made about it on various subs, trying to defend yourself). Even if you messed up and people took your words out of context - learn your lesson, delete the post/comment, and move on with your life. "
268,"Yeah, sexual competition among ducks is pretty wild.  Here's an interesting article about it: [Ballistic penises](https://www.nationalgeographic.com/science/phenomena/2009/12/22/ballistic-penises-and-corkscrew-vaginas-the-sexual-battles-of-ducks/) . That's a link to Nat. Geo., in case anyone was worried.  Despite it being Nat. Geo., it contains the unforgettable sentence, ""To really study the mechanics of a duck penis, you can’t just fluff the animal. """
269,"Baaaahahahahahahahaaaaa DUDE. If this is real, you are my hero. "
270,The TL;DR is fucking hilarious
271,"Yo fuck your mom that shits hilarious, also the teacher seems like the pedo for even noticing. Don’t let this change you just because some asshole says otherwise. "
272,"Your submission has been automatically removed because your post is too short. Per Rule 3, all posts are subject to a length requirement of **750 characters** of meaningful content.  You are welcome to resubmit your post once it meets the minimum length.  **Do not contact us to reapprove your post.**  You will need to resubmit it as a completely new post.


*I am a bot, and this action was performed automatically. Please [contact the moderators of this subreddit](/message/compose/?to=/r/tifu) if you have any questions or concerns.*"
273,This just makes me wish I was still in school
274,"&gt; She told me that I was ruining her reputation as a trustworthy volunteer.

No offense, but your mom sounds like she'd be a bitch."
275,they should make a subreddit tiw(holesome)fu
276,A classmate may have informed her. Someone could have discreetly messaged her seeing as how they are all on devices.
277,"Your submission has been automatically removed because your post is too short. Per Rule 3, all posts are subject to a length requirement of **750 characters** of meaningful content.  You are welcome to resubmit your post once it meets the minimum length.  **Do not contact us to reapprove your post.**  You will need to resubmit it as a completely new post.


*I am a bot, and this action was performed automatically. Please [contact the moderators of this subreddit](/message/compose/?to=/r/tifu) if you have any questions or concerns.*"
278,I laughed way too hard at this. Haha oh Netscape
279,"Generally, no.
Unless water is too hot/you aren’t drinking enough."
280,It’s a common reddit debate
281,"IpVanish on iOS won’t go through, working on settings to see if anything works"
282,"Do you have issues with anxiety? Nobody “has” to think to breathe, some feel they do but the thought is caused by anxiety."
283,This is how you accidentally get an auto erotic asphyxiation fetish. 
284,"Well, you'd know her better than me, but from the outside..."
285,"As a college dude, I can honestly say they probably laughed a bit and will forget about it the next day.  It's always nice to have profs that are close to our age because they are usually more understanding and enjoyable overall.  Yeah it would be a little laugh but seriously nothing to be embarrassed about.  We all young and most of us are on that tinder grind"
286,"Good point. I don’t know. I do not get them very often, but also refuse to answer numbers I don’t know"
287,Yes we are working closely on this. 
288,This is the most German comment out here. :)
289,"I have just started saying “to speak to a customer, please press one”. They usually giggle and hang up. I’ve gotten far less calls "
290,How about we just move all of this sub to there
291,Middle schoolers are attracted to middle schoolers.  Pedophiles are also attracted to middle schoolers.  So middle schoolers are pedophiles.
292,"As a teacher, that sounds like a silly thing to suspend over and it’s on the teacher for letting the class create whatever name they want. Of course students will take advantage of that. With Kahoot, I usually just tell my kids to post their first initial and last name to avoid all that."
293,"Bravo, OP, Bravo!

Also, for anyone wondering what the hell a pickelhaube helmet looks like, you know, for the full visual artistry that this story conveys:

https://www.google.com/search?q=pickelhaube+helmet&amp;tbm=isch&amp;source=iu&amp;ictx=1&amp;fir=2idCS172XeSafM%253A%252CVEk-7CaOBbJImM%252C_&amp;vet=1&amp;usg=AI4_-kS7X_SXmjeygWLQdaPSVnub4DrI_g&amp;sa=X&amp;ved=2ahUKEwiv5rPu1oDhAhWE11kKHUdfCWgQ9QEwAHoECAEQBA#imgrc=2idCS172XeSafM:"
294,"Because it's a really minimal site that doesn't connect to anything else. That's part of the popularity. I'd rather have a integrated response system that doesn't cause problems like this but whatever, people don't want to spend the time and schools don't want to spend the money."
295,"I don't even get the fun ones, they're always just blank audio."
296,"I’ve never been, but I thought the general consensus was that it’s best to stay away from that type of thing in Mexico, as the locals will take your money, then alert the federales for the immediate shakedown. 

Sure, it’s one of those old wives’ tale situations. But, the logic makes sense to me. I’m curious if you’ve had better experiences, if you wouldn’t mind elaborating. "
297,You can be an avid historian and be fascinated by Germany without living there... my old tutor in uni (in Australia) was doing a PhD on German history.
298,This got me cracking up so funny. Read the tldr had to read the whole thing
299,I bet you even Albert Fish thinks this is fucked up.
300,"Reminds me of the time I got called out for having nut on my pants, except it wasn't as discrete and they actually did say cum. "
301,Lol I remember kahoot. I used popular porn star names like Madison Ivy. I never got called out for it though. 
302,"I thought so too, but we do live in an overly sensitive world nowadays so this could be due to that."
303,brick her window. 
304,[removed]
305,Wait... really? Why am I just NOW hearing about this?
306,Up voted for something that actually belongs here since it did harken today. 
307,"My first thought after reading that one line was, “okay so the likelihood of him being a Nazi just went up”. That was more like my second thought. First one just laughed.  "
308,Tell that to Louis CK or Bill Cosby.
309,Your first interaction with your teacher was a poor taste dad joke. Lolololol amazing.
310,A mature move indeed
311,Same here what is with that? I didnt answer it...
312,Wtf is a kahoot? 
313,Lighten up teacher and principal. 🙄🙄🙄
314,"""I'm so sorry.. I don't go on the computer often. Sometimes Johnny tells me to check his face book so I start it up, but it usually takes longer than this though."""
315,If he's anything like me he'll actively avoid most people he went to high school with. Can't be having that awkward small talk.
316,F
317,"Honestly, you might want to talk to the admins of your district. It seems like an overstep to suspend you. I do stuff like that just to piss off my school but maybe don’t if you don’t want to piss them off more. Also idk where you live or what your district is like"
318,Is your child's school full of pedophiles? Find out more at eleven. 
319,Why were you downvoted lol
320,"ok, i have one question, what the hell is Kahoot?"
321,How does one laugh in German?
322,That's why I don't answer unless I know the number. A lot of those are just logging which numbers answer and which ones don't so they can narrow down responsive numbers to sell / dial.
323,Edge of a circle?
324,"This gentlemen, is why you play Bhutan."
325,"Well, I have been getting worse, year on year. Runs in my family. Oranges v reds; blues v black; grey v blue; green v blue. I get a lot of, “So .. what color do you think that is?”

Also, I just successfully ran the men’s side of a small clothier in Chicago the past two years. Take that, fashion. "
326,"That was pretty funny. I misheard lots as a child....but I think I was just a poor listener. I thought at the end of game shows the announcer would say, “The Price is Right is brochued by....Toyota, Colgate and Stayfree Maxi Pads.” Years later I realized it was “brought to you by.” Ridiculous. "
327,"This is either made up or op was already on thin ice. There is no way they suspend someone for a silly nickname, admin nor teacher has time to deal with that."
328,"Your submission has been removed.  **Please read this whole thing:**

Thank you for your submission. Per Rule 1, all posts must end with a [**TL;DR.**](/r/tifu/wiki/flairs#wiki_tl.3Bdr) descriptive of your post that includes, at minimum, your fuckup and its consequences.  

If you'd like, you can resubmit your post with a TL;DR added at the end.  **Don't ask to resubmit or modmail us to reapprove your post- you're welcome to resubmit your post with a TL;DR added as long as it follows all other rules.**  Please note that your TL;DR must be formatted like `TL;DR` or `TL:DR` to be acceptable, and formatting it differently may cause your post to be removed again.


*I am a bot, and this action was performed automatically. Please [contact the moderators of this subreddit](/message/compose/?to=/r/tifu) if you have any questions or concerns.*"
329,I go quiet for about 5 seconds. Then in a really quiet calm voice I ask “Does your mother know what you do for a living?”
330,Ehhhh a lot of places are at will hiring and they don’t need a reason 
331,You’re a pedophile for being interested in girls your age? Okay teacher...
332,Really? I had thought there was a way around that as well?
333,"**Enemy spotted**

*Cums*"
334,"You’re a strong, sensual woman. Who tf cares. Do your thang. "
335,"Welp. You tell them that. It’s not the health insurance, though. It’s the liability insurance. "
336,Envisioned &amp; heard this in my head as Ralphie and his teacher from A Christmas Story
337,Or say the numbers in different languages.  Exclaim that you had a bad head injury and you’re no longer able to process numbers in English.  
338,"&gt; My Mom on the other hand was absolutely pissed that I got suspended. She told me that I was ruining her reputation as a trustworthy volunteer.

&gt; So now I have to listen to my mom rant about how I am a bad person.

So her child gets suspended and all she can think about is how to turn it into being about her? Your mum sounds like a narcissist. You should git gone as soon as you humanly can."
339,"That’s when you just tell her it was a random string of letters and that she’s the inappropriate one who put an unintended meaning to it. Whether true or not, chances are it might make her let you off."
340,Just avoid saying anything about setting up new railways and trains.
341,And people actually believed this cringy hallucination
342,Mike Oxlong took me time to understand. 
343,Could always find a Russian friend to go into Poland from both sides 😉
344,"My house phones make an absolutely horrid sound if two are picked up at the same time and one is on speaker. Like fingernails on a chalkboard bad, nonstop. My mom waits for a human, puts a phone on speaker, and then begins shouting ""WHAT? I CAN'T HEAR YOU, SPEAK UP PLEASE!"" Eventually the spammer just gives up trying to scream over the sound and hangs up."
345,"But you said ""please""!!"
346,Shit there's a club?
347,You truly fucked up 
348,"My students have two rules: can't be inappropriate (duh) and must be identifiable so I can look through the data later (because Kahoot makes you an awesome spreadsheet). You can choose to include your name or initials or whatever, just so I can find you. Otherwise, go nuts.

The kids get creative with it, it's fun.
"
349,Why don't the telecoms fix it?
350,"Okay, so wild theory time. They know they're doing something immoral, and that doesn't pass in the human adrenal system neutrally. Lying stresses people out, as well as guilt, and their brain is going to be banging alarms with adrenaline and cortisol.

So they're already on edge, and and even after several successes and a rush of duping delight, they're still always on the edge of an explosion. So reading them with the temptation of an almost orgasmic come down of success and then withdrawing just at the climax, makes them feel, well, as angry as you can imagine in the sexual analogy. 

Someone else study this, I'm lazy, I'll pay you 3 exposures."
351,It’s like competing on Iron Chef when you only know how to make spaghetti using Barilla and Ragu.
352,damn. these scammers are getting more and more aggressive yo
353,"unless they're the blue-dot tests, a rinse with whitening mouthwash will let you pass. I smoked before an interview and rinsed in my car when i got there and passed."
354,The heck is a kahoot?
355,"This is exactly why I do not mess with those guys anymore.

I called them out on their shit a few times, then I started getting these blank phone calls... no voice, no breathing.  Obviously automated.

One morning I got them every 5 minutes for half an hour.  I mean it rang at exactly 8:00:00, 8:05:00, 8:10:00, 8:15:00, 8:20:00. 8:25:00, and 8:30:00.

I no longer do that."
356,Take it as a learning moment ¯\_(ツ)_/¯ 
357,"Sorry....I haven't corrected anyone on Reddit for that, I just....w/c/should of drives me crazy"
358,This is a sweet tifu hahahaha
359,"OMG! This is hilarious! Reminds me of the mischief me and one of my uncles got up to when I was probably six. I had this batman toy that was supposed to stick to windows, but mum didn't want it to leave a mark so I wasn't allowed to stick it to anything. My uncle decided to visit. He would have been probably in his early 30s and got the idea to stick the thing to his forehead. Well it stuck really well and we had a giggle. When he pulled it off, it left a huge red mark. Of cause I found this hilarious and proceeded to stick it to my own forehead, which left a nice red mark as well. My mum called us idiots when she found out what we had done. I had a red mark for a few days, my uncle did as well. "
360,should most ertainly be fired
361,Good thing you didn't go further than a back massage
362,Quality shitpost. 
363,Fr tho... Maybe she has seen that before?
364,"thank you so much for the advice. ill definitely be keeping an eye out for these things now that i know about them. hopefully it’s nothing serious, but i’m really glad i posted here, just in case things do take a turn for the worse. "
365,"Yeah, please look into this op. Normally you can't just forget to breathe, it's an autonomous function"
366,Probably a wooosh but what’s Mike Oxlong
367,Yesterday was the first time I've ever seen it happen 
368,Outcum?
369,Dany everything and make counter accusations what they taught my great grandpa before he was put against a wall that is a lesson to never make counter accusations when you grabbed a high ranking KGB officers drink by mistake
370,"I do this now I’m scared, dam it!"
371,"This makes me remember how my friends and I hijacked stuff like Quizlet Live and Kahoot with joke names. I knew a guy who entered as ""Nick Girtz"" and ""Ben Dover"" in my Biology class, while my friend and I entered as ""Jacques Strap"" and ""Mike Rotch"".

Hell, even this year, in my French class, we had somebody enter a Quizlet Live as ""tetrahydrocannabinol""  (which, in other words, is weed)

&amp;#x200B;

This made me laugh so much, but I feel bad for you. That's not fair that you get suspended over a joke."
372,Probably going through schooling to become a teacher.
373,imagine getting suspending for trying to make people laugh. 
374,"""I'm not racist but..."" ;)"
375,They are not stupid...just very crooked.
