,text
194,"Idk about it being plausible. I think if you never saw the girl again and someone asked who was it or wanted some in depth questions about the individual you might not remember. 

But if you lock eyes with a person you previously fucked and realize both you of know one an another from fucking, AND that encounter happens to be your most memorable fucking moment, AAAANNNNDDD that person now turns out to be your current wife’s sister, odds are you didn’t forget... 

That’s just my two cents. If you asked me right now to name a specific sexual encounter, I may not be able to, but once you add all those other details I’m pretty sure it would jog a memory.. 

I mean just telling the story to your boys should have the person engraved in your mind somewhat. (Not saying I do this, but I heard this is a common guy thing..)

Anyways, that’s just my two cents. Great story nonetheless OP."
195,"I truly laughed out loud, and I almost never do that. Thanks."
196,"me first

  


*unzips pants*"
197,He just kept his mind on the updoots for harpooning a wild wumpus.
198," oh shit, now that's a fuck up 

&gt;EDIT: YALL IM A GUY.

HOL UP, WHAT"
199,"Marry me. I'll do that. You only have to suck my dick daily. Anal would be good, too"
200,You have some now haha
201,Shrek
202,"Are you going to discuss the issue at all with your mother-in-law in private? Everything you said about having something to lighten the mood when you both are caring for a newborn is completely valid, even if it was just a dumb inside joke between the two of you. It'd be terrible if your MIL decided not to help out your wife, her daughter, over something as small and trivial as that. You shouldn't have to apologize but I imagine mending the issue as soon as possible would be best for everyone."
203,Sounds like you weren't the only one to make a poorly-timed entrance.
204,Found the guy who's never had anal sex
205,The both of you have a weird fucking relationship. I'll give you that.
206,Hey I'll take the penis if you're getting rid of it.
207,"You feel your headphone moving/sliding off your ears and instead of thinking it might be the adjacent passenger getting up/moving/his-shoulder, you think someone is trying to steal it??

What land of thieves are you from?"
208,"""Be prepared for the poo of the century; Be prepared when your coochie is slammed."""
209,TIFU by reading this. What the FUCK. I could have gone my whole life without of this stain on my memory. Y'all need Jesus.
210,"I can help. I'm even an Asian woman, but I do have a potty mouth."
211,yeah I’ve done some pretty questionable shit but holy fucking Hannah Montana is this next level
212,Yeah I was thinking it was one of those ones with plastic protruding so you could pull it off and wondering how that didn't hurt at all
213,That's what we're all thinking.
214,"It's ""Chicka Chicka"" you uncultured swine"
215,Their plan worked a little too well
216,"Well shit

Wait a minute..."
217,Nipple nectar
218,"*Plot twist: you and his wife end up being BFFs.*

Seriously, it's a really fucked up situation, but you stayed all cool and nice about it. Kudos to you."
219,Covered in shit and beef stew
220,r/thiswaswholesomedammit
221,"Sorry bud, but your friends didn't even read your resume. They might have looked at it, but they definitely did not read it."
222,"It’s like The girl with the DragonTatoo, where the killer says , “ you’re brain is telling you to run , to save yourself. But you don’t want to be rude so you go anyways”. And then you die"
223,"&gt; I tried to convince her it was just a coincidence. 

&amp;#x200B;

He straight up lied to her after she has figured it out. That's the part that would piss me off too. That's not a small white lie."
224,Yo homes smell ya later
225,"I think your only fuck up in this whole thing was denying it was her sister.

After she started to not believe you, you needed to face that shit head on."
226,Yeah it would probably recede into me and never return.
227,"Why? From what I get from his story it really was a coincidence.

They should have just told her right from the start."
228,"Yeaah, most people here have no clue how crazy traditional asians can be, without having asian friends they know really well. Even then, their own beliefs are given assumptions to what they know."
229,"So you're in a pitch black house, you've been led into the basement and can't see to run away.

Roleplay with me, I'll be gollumn. Hit me with most gracious goodbye and I'll try and see how long I can go without murdering you."
230,"""I wanna slap your lady clam while dressed like the Gorton's Fisherman"""
231,"Once he mentioned Gollum cheering him on and narrating everything, I lost it."
232,Wait a minute....Wait a gosh darn minute!! Steve is that you?
233,Shrek
234,God damnit why did I come here
235,Did you not see the shrek fanfic written about you?
236,Please update on Sunday! I am cracking up at this. Titty juice is an amazing name for it and i May have to use this when it’s my time. Congrats on the baby 😊
237,Lol the edit is major
238,I’m sure OP appreciates you backing them up but not remembering someone you spent two years of your life with is oof
239,*MMF intensifies*
240,"I mean, do you really want to?"
241,"Actually the FU was admitting that the wildest hottest sex of your life was 1.) not with your wife and 2.) with her sister.  

The cover up aside you just dealt her ego a massive blow and now she’s going to be wondering about the two of you, regardless of her having a reason..."
242,And then you'll have a really bad experience on Grindr and you'll be asexual.
243,It was such a preposterous hypothesis
244,"Just act like you don't know your ball was hanging out. If nobody saw a chub, I don't think anyone sane would accuse you of being a pervert."
245,Yeah if any MIL did this to my wife I would have picked up the phone and told her that if she ever behaved that way again she would no longer be welcome in my home. No name calling or yelling required. Just setting very reasonable boundaries.
246,This is why you dont talk to police always use a lawyer. If you started with that then half of this wouldn't have happened. Nothing good can ever help you by talking to the police.
247,priorities man... priorities :)
248,"Thanks, I totally understand now"
249,"Get down, slide around, leave some brown, poop chute boogie."
250,I can't believe you added an extra 's' to the second-person singular future subjunctive of 'propose' in Portugese
251,Just go home Ted!
252,"Boob beer. Y'know, because milk drunk is a thing? 😉"
253,"""Milk straight from the jug"""
254,Well at least you didn’t walk in on him faping to it
255,Lock....a...door....
256,"They walked in on you, you did nothing bad, if they have the courage not to knock before entering its their fucking problem!

Next time, cum on them too, just to make sure you are the dominant one!"
257,"The same way most parents do I imagine

* Doing fun activities together
* Respecting boundaries
* Insisting on manners
* Never Overstepping
* Kindness is key
* initiate positive dialogues regularly 
* Nurture their interests 
* Give them love"
258,"Okay what I'm thinking is they slipped, fell over on their back / side.

Foot shoots out and hits the door, but due to lubing they also slide ass-first into the cabinet under the sink"
259,"I see therapists not so much as figuring you out and telling you things, but instead as people who help you verbalize and explore yourself until something clicks and you understand yourself better"
260,Maybe his wife is cool with it? Staranger things have happened
261,"Some of us have a voice inside us that tells us what to do and we listen.  Other people have a voice and tells them what we shouldn't do, but then pushes us on to do the stupid thing anyway because momma didnt raise no quitter."
262,"I think the hand squeeze was her forgiving you. Poor woman, I hope she find peace after that. You handled that situation the best you could, sorry you had to go through that too."
263,Yes !
264,Talkspace gives you a free week. You should take them up on that.
265,"Mom: Why would you do such a bad thing?

&amp;#x200B;

You: Becau-

&amp;#x200B;

Mom: Woah now you grown up already? Knows how to talk back to me? You're such a terrible person, now you dont even listen to me anymore, and when I get old you'll kick me out and send me to old folks home. \*cries in Asian parents\*"
266,"This made me feel a little better about it, after all the moment is a little more precious just experiencing it raw with no technology. Still pissed about the phone hahaha"
267,Most of which are Shrek
268,... god damnit
269,"To quote another redditor:

""If you knock on poops door, sometimes he's gonna answer""."
270,"he was probably freaking out on the inside as well.

&amp;#x200B;

In either case you've done nothing wrong and as long as neither he or you bring it up you should be fine. Take pictures of your tinder conversations as proof for the future - if he's unfaithful to his wife it's likely he won't spare much consideration cheating on you as a tenant. Be careful and stay safe!"
271,"I was like oh, ok

&amp;#x200B;

Then I read EDIT:

&amp;#x200B;

And I fucking died lmfao"
272,Except he skipped Landlord #13 cus that’s bad luck.
273,I’m still shook.
274,r/usernamechecksout
275,"Maaaannnn, you should have went with it! They were clearly into it!!"
276,"Do what everyone does before doing a sex-related thing they're thinking it could be regretful, fap and suddenly you won't care anymore and get back to your senses.


Second, go get checked for STD's."
277,"I have smashed a toddler with the door of an airplain toilet. I was peeing and after I washed my hands I tried to open the door, but it jammed a little bit. Then the toilet sucked all the liquids out of the toilet and i didn't expect it so it scared me. Then I pushed the door open and there was the little boy. The door hit him right on the forehead. Luckely he was a tough one and didn't cry or something. And the father saw it happen so I could explain if he wanted to, but he didnt. Thats when i walked away fast and got back into my seat. Never again an airplane toilet for me"
278,"He got HER shit together, at least."
279,Shrek
280,You gotta have a needle dick to fit it inside a shampoo bottle opening
281,That was my first reaction as well.
282,My entire night went to SHIT because of the read.
283,"I don't often talk about it, but it was unprovoked.  I was walking down the street not paying attention and the last thing I remembered before blacking out was a man screaming and waving something, which I later learned was a machete.  When I came to I was traveling in a horse-drawn cart which I assumed was taking me to a hospital but I wasn't able to move my hands.  The man on the cart ""hey you, you're finally awake"" and he told me that I had walked right into an imperial ambush"
284,I have second hand nausea
285,I found this difficult to masturbate to.
286,"If you do see her again and start chit chatting, I dare you to bring it up in conversation.

Then of course you run the risk that she didn’t actually see it and now you’re talking about your balls for no reason, so I guess it’s a double edged sword."
287,***Nevermore***
288,I couldn't stop reading! This is so sad! 😂 but hey! Please know not all women in this situation are obese shrek lookalikes. 😜
289,Sounds like you were in a really depressed self destructive state. I hope things have gotten better for you.
290,Heck yes. That's top notch dadding.
291,"Don't need to read the story- title says it all.
Tyfu"
292,I hear you can buy their bath water now for special occasions
293,Marry me too? I'll help with the baby
294,Just means you need to branch out and start finding other names for it.
295,I always read posts without seeing OP’s username... it’s always someone in the comments than posts a funny username checks out comment and it’s always so much funnier this way.
296,he said* i’m a gay man
297,Literally.
298,This guys fucks...
299,"Regardless on if this is rape or not, it sounds like just a... Kind of traumatizing time overall. Especially since how bizarre and intimidating it sounds by your description, and just how it sounds less like you wanted to and more that you really just wanted to punish yourself with disgusting, terrible sex because brain chemistry goes in some fucked places. 

Have you spoken to a therapist since then? It couldn't possibly hurt worse than this entire incident."
300,"I think he meant it as ""a coincidence that I slept with another member of your family before we met"" not ""haha that's so weird that we've both broken rocking chairs at barn parties"""
301,"That is a very stupid design. Every stick deodorant I've ever used has a line down the plastic cover to help you pull it off, which also makes it clearly visible that it's not the real deodorant."
302,Shrek
303,"He doesn't have to be gay... Plenty of people are bi, or anywhere along the spectrum. Maybe he's in love with his wife but gets sexual satisfaction from being a bottom and his wife doesn't wanna top him. It's shitty if she doesn't know what's going on and isn't okay with extramarital sex, but it's not the only possibility."
304,"Parents ask you questions, if you answer they get mad, if you dont, they get mad."
305,Replying because I'm nosy and this is cute :)
306,Property sex on pornhub gets a lot of views.
307,"Universe told him to stop, still went for it though. Salute to OP for keeping up with Shrek in bed though"
308,She's got you all figured out OP. She got a ring and a necklace.
309,"Roses are red violets are blue

That Jabba the Hutt woman sounds disgusting

But OP, I'm more grossed out by you 

You stuck your dick in poo

Then went back for round two"
310,"probably would've ruined it even more.

&amp;#x200B;

at least ask ""you're both 18, right"" cause that leaves some room for ambiguity with the wife ""honey, i was just checking to make sure that them walking in on us was like, legal or something"""
311,"Serves you right for being a nasty, thieving hobbitses"
312,Yep. That's it. I am 100% convinced that TIFU is now just a fantasy porn writing contest.
313,You know what. No. Goodbye.
314,Are you sure he’s using a throwaway?
315,This is 100% on the shitty husband. It’s not your fault he lied to you.
316,I love that this sub has become not “TIFU” but “here’s how this is BS fiction!”
317,"My aunt has a glass eye. When someone asked her to keep an eye on something, she would literally pop it out and put it on the thing."
318,"They do. There was once a woman in my city named “Mrs. Hurlbut” who was the de-facto bird lady. She was in her 80s, and had a small business where she would take care of sick birds. She even had a bird ambulance. Like a super-old ambulance, like the one from Ghostbusters. My mother owned 6 parakeets who contracted a cold virus plague. She desperately sought out help, and somehow, found out about Mrs. Hurlbut.

We show up at Mrs. Hurlbut’s place, and walk into this large, possibly 19th-century home of hers. Immediately, we noticed that this was not a home for humans. Bird crap everywhere in the hole-filled carpet, and her living room was largely taken-up by a giant bird cage. In this cage was Edgar.

Edgar was a Raven. He had pots and pans and all sorts of toys hanging from the sides of his cage to play with and bang on. She said that he needed a lot of things like that, otherwise he got very “ornery.” She said he was not always confined to the cage, but sometimes had free reign.

Edgar was ornery anyway. She had taught him to say “Nevermore” at one point, but he had dropped the “more” part somewhere along the years. She would get up out of her chair waving her finger and say “Edgar!! We have company! You be good Edgar!!!” He would reply “Never!!! Never!!!” It was hilarious. I had never seen shit like this in my life. Edgar would then proceed to peck at the pots and pans and make as much noise as he could in protest of “being good.”

She explained that Ravens are very intelligent and have a lot of needs. Without a lot of things to play with and things to do, they get angry. She pointed out a book on her shelf that she had written about Edgar and herself. I think it was called “Edgar and I.”

In the other rooms of the house were numerous cages of birds that she was taking care of. Only the raven seemed to need such a large area and so many toys. These birds had clearly taken precedence over her house; the whole place was in a terrible state of disrepair. Edgar was the only one who got the full special experience and freedom, though.

Mrs. Hurlbut died not long after that, as did most of my mom’s parakeets. The only one that survived the cold was the bitchiest one of all of them: an albino parakeet that didn’t get along with the others named “Angel.” Angel lived a full life for a parakeet, that little ornery bird. We figure she survived so long because she didn’t socialize with the rest.

I will always remember that crazy experience meeting Edgar and Mrs. Hurlbut. They were both full of piss and vinegar."
319,Thats was a corneass joke
320,It's the top comment you egg
321,"And he'll say ""leave my fucking ex-wife out of this"""
322,"""looks like our marketing machine has some...odd...activity""  
""Nah, it's just doing it's thing. That's part of the innovation. It makes up stuff to reach audiences that wouldn't normally be-"" (looks at monitor) ""oh yeah that IS weird."""
323,The pre-nut clarity is what got OP into this mess!
324,You must be in Area 51!
325,"You know what would be helpful, make your wife little snack packs. When she breastfeeds she gets tired and usually new moms are already low on energy. You can also make extra for dinner, put a serving away for her in a microwaveable container, so she can have a quick lunch while baby is napping. You’re such a great dad and please hang in there, support your wife, and spend as much time with that tiny baby as you can...they grow so fast!"
326,You are?
327,"&gt;reckless behavior and unsafe sex are considered forms of self-harm

Well that explains that period of my life. Don't do drugs, kids. It might lead to really fun and unexpected PTSD flashbacks three an a half years later when your SO touches you in a totally normal, non sexual way, just like he's been doing for three years. 

Good shit."
328,⠀⠀⠀⠀⠀⣤⣶⣶⡶⠦⠴⠶⠶⠶⠶⡶⠶⠦⠶⠶⠶⠶⠶⠶⠶⣄⠀⠀⠀⠀ ⠀⠀⠀⠀⠀⣿⣀⣀⣀⣀⠀⢀⣤⠄⠀⠀⣶⢤⣄⠀⠀⠀⣤⣤⣄⣿⠀⠀⠀⠀ ⠀⠀⠀⠀⠀⠿⣿⣿⣿⣿⡷⠋⠁⠀⠀⠀⠙⠢⠙⠻⣿⡿⠿⠿⠫⠋⠀⠀⠀⠀ ⠀⠀⠀⠀⠀⠀⢀⣤⠞⠉⠀⠀⠀⠀⣴⣶⣄⠀⠀⠀⢀⣕⠦⣀⠀⠀⠀⠀⠀⠀ ⠀⠀⠀⢀⣤⠾⠋⠁⠀⠀⠀⠀⢀⣼⣿⠟⢿⣆⠀⢠⡟⠉⠉⠊⠳⢤⣀⠀⠀⠀ ⠀⣠⡾⠛⠁⠀⠀⠀⠀⠀⢀⣀⣾⣿⠃⠀⡀⠹⣧⣘⠀⠀⠀⠀⠀⠀⠉⠳⢤⡀ ⠀⣿⡀⠀⠀⢠⣶⣶⣿⣿⣿⣿⡿⠁⠀⣼⠃⠀⢹⣿⣿⣿⣶⣶⣤⠀⠀⠀⢰⣷ ⠀⢿⣇⠀⠀⠈⠻⡟⠛⠋⠉⠉⠀⠀⡼⠃⠀⢠⣿⠋⠉⠉⠛⠛⠋⠀⢀⢀⣿⡏ ⠀⠘⣿⡄⠀⠀⠀⠈⠢⡀⠀⠀⠀⡼⠁⠀⢠⣿⠇⠀⠀⡀⠀⠀⠀⠀⡜⣼⡿⠀ ⠀⠀⢻⣷⠀⠀⠀⠀⠀⢸⡄⠀⢰⠃⠀⠀⣾⡟⠀⠀⠸⡇⠀⠀⠀⢰⢧⣿⠃⠀ ⠀⠀⠘⣿⣇⠀⠀⠀⠀⣿⠇⠀⠇⠀⠀⣼⠟⠀⠀⠀⠀⣇⠀⠀⢀⡟⣾⡟⠀⠀ ⠀⠀⠀⢹⣿⡄⠀⠀⠀⣿⠀⣀⣠⠴⠚⠛⠶⣤⣀⠀⠀⢻⠀⢀⡾⣹⣿⠃⠀⠀ ⠀⠀⠀⠀⢿⣷⠀⠀⠀⠙⠊⠁⠀⢠⡆⠀⠀⠀⠉⠛⠓⠋⠀⠸⢣⣿⠏⠀⠀⠀ ⠀⠀⠀⠀⠘⣿⣷⣦⣤⣤⣄⣀⣀⣿⣤⣤⣤⣤⣤⣄⣀⣀⣀⣀⣾⡟⠀⠀⠀⠀ ⠀⠀⠀⠀⠀⢹⣿⣿⣿⣻⣿⣿⣿⣿⣿⣿⣿⣿⣿⣿⣿⣿⣿⣿⣿⠁⠀⠀⠀⠀ ⠀⠀⠀⠀⠀⠀⠛⠛⠛⠛⠛⠛⠛⠛⠛⠛⠛⠛⠛⠛⠛⠛⠛⠛⠃
329,"I lost my eye in a random incident, except what happened to me was brutal. A schizophrenic guy hit me in the face with a machete. Losing an eye really sucks and it takes getting used to so its cool she was chill."
330,I bursted out laughing when I read that
331,"Steve *might* just have an identical twin.

If that's the case, the only weird thing is why they're both called Steve."
332,TIFU by reading TIFU...
333,Y'all assuming op is a top but I'm betting he's a bottom
334,"""So... funny story. I know I'm looking at apartments but don't have money for the deposit for some reason. LOL. Maybe I can make a different type of deposit? 🙃"""
335,"I really hope so. She looked so innocent and shattered, it was 50% my fault so I'd do anything to make it up to her."
336,Shrek
337,"There’s 6 years between our 2. That’s partly due to waiting until #1 was less difficult (he’s an utterly delightful teen now). #2 was easier in lots of ways but he was (and still is) a terrible sleeper. He was awake at least twice a night until he was 2, and he didn’t sleep through until he was 4. I’d have murdered someone if I wasn’t so damn tired (probably one of those parents whose kid slept through from 6 weeks old). You find your way through, though. 

The best advice I can give is keep doing what you’re doing. It’s incredibly hard to be the guy that works all day then takes baby from mom to give her a break when you get home all the time, but it makes you a goddamn hero."
338,"I bet most people who've tried to just not bring it up though. I think it's fair to try and not bring this up, because what, even if he had come clean at the earliest possible time, it might've ended his relationship then.

It's not like he cheated, and I think generally a lot of couples don't talk about specific details of who and how they've fucked.

Assuming OP is telling the truth, I'm with OP 100%, I don't think he did anything wrong.  I understand why his wife is upset, but hopefully she understands that he never did anything shady to her."
339,"If your story happened, then this comment up here is the big truth. Been here before also.  ""Being successful"" in this situation looks like this comment above mine. You have an opportunity to ask ""What kind of person would I want to be in this situation?"" Too often we think ""Whats the easiest way out of this situation?"" The heart to heart is terrifying but it can lead to great growth and closeness after some time passes. If it goes bad, then you did the best you could without regrets and learned a lesson; this happens to all of us."
340,Sir please step away from the cat
341,Holy fuck.. The fact that the officer questioned you without a parent present is enough to have it thrown out long before all that extra bs you went through. Hope you are doing better and this won't follow you through the rest of your life.
342,You were “TWO TIRED”
343,I fucking hate you and everyone else in this thread.
344,"Shrek ⢀⡴⠑⡄⠀⠀⠀⠀⠀⠀⠀⣀⣀⣤⣤⣤⣀⡀⠀⠀⠀⠀⠀⠀⠀⠀⠀⠀⠀⠀ 
⠸⡇⠀⠿⡀⠀⠀⠀⣀⡴⢿⣿⣿⣿⣿⣿⣿⣿⣷⣦⡀⠀⠀⠀⠀⠀⠀⠀⠀⠀ 
⠀⠀⠀⠀⠑⢄⣠⠾⠁⣀⣄⡈⠙⣿⣿⣿⣿⣿⣿⣿⣿⣆⠀⠀⠀⠀⠀⠀⠀⠀ 
⠀⠀⠀⠀⢀⡀⠁⠀⠀⠈⠙⠛⠂⠈⣿⣿⣿⣿⣿⠿⡿⢿⣆⠀⠀⠀⠀⠀⠀⠀ 
⠀⠀⠀⢀⡾⣁⣀⠀⠴⠂⠙⣗⡀⠀⢻⣿⣿⠭⢤⣴⣦⣤⣹⠀⠀⠀⢀⢴⣶⣆ 
⠀⠀⢀⣾⣿⣿⣿⣷⣮⣽⣾⣿⣥⣴⣿⣿⡿⢂⠔⢚⡿⢿⣿⣦⣴⣾⠁⠸⣼⡿ 
⠀⢀⡞⠁⠙⠻⠿⠟⠉⠀⠛⢹⣿⣿⣿⣿⣿⣌⢤⣼⣿⣾⣿⡟⠉⠀⠀⠀⠀⠀ 
⠀⣾⣷⣶⠇⠀⠀⣤⣄⣀⡀⠈⠻⣿⣿⣿⣿⣿⣿⣿⣿⣿⣿⡇⠀⠀⠀⠀⠀⠀ 
⠀⠉⠈⠉⠀⠀⢦⡈⢻⣿⣿⣿⣶⣶⣶⣶⣤⣽⡹⣿⣿⣿⣿⡇⠀⠀⠀⠀⠀⠀ 
⠀⠀⠀⠀⠀⠀⠀⠉⠲⣽⡻⢿⣿⣿⣿⣿⣿⣿⣷⣜⣿⣿⣿⡇⠀⠀⠀⠀⠀⠀ 
⠀⠀⠀⠀⠀⠀⠀⠀⢸⣿⣿⣷⣶⣮⣭⣽⣿⣿⣿⣿⣿⣿⣿⠀⠀⠀⠀⠀⠀⠀ 
⠀⠀⠀⠀⠀⠀⣀⣀⣈⣿⣿⣿⣿⣿⣿⣿⣿⣿⣿⣿⣿⣿⠇⠀⠀⠀⠀⠀⠀⠀ 
⠀⠀⠀⠀⠀⠀⢿⣿⣿⣿⣿⣿⣿⣿⣿⣿⣿⣿⣿⣿⣿⠃⠀⠀⠀⠀⠀⠀⠀⠀ 
⠀⠀⠀⠀⠀⠀⠀⠹⣿⣿⣿⣿⣿⣿⣿⣿⣿⣿⡿⠟⠁⠀⠀⠀⠀⠀⠀⠀⠀⠀ 
⠀⠀⠀⠀⠀⠀⠀⠀⠀⠉⠛⠻⠿⠿⠿⠿⠛⠉"
345,Shrek
346,"Hey, I hear you saying that you hate yourself. 

Here are some things I know about you. You're a great writer. That leads me to believe you're also very intelligent. You're willing to reflect thoughtfully on your own actions. Many people don't bother to do that. You're interested in bettering yourself, which is admirable. 

I hope you're doing better, sincerely.  Thanks for the laughs though."
347,"Wow, what a sentence. Beautiful."
348,"&gt; ... How I ended up with 2 assholes.

Three, if we count your mate."
349,Next step: let coworker let you eat her period blood from the source.
350,"Thanks!  Will do, I'll give you the ESPN highlights on the lecture."
351,"obviously, an update after your meeting tomorrow is required. 

godspeed."
352,thanks for the thrills OP.
353,Preach.  I've been navigating this landscape for a while and still find learning opportunities. There are never apologies just a series of agreements to move on (best case scenario.)
354,"Thanks, appreciate it!"
355,Sounds like they'd need a lot of attention
356,Absolutely not anymore.
357,"&gt;female version of Shrek

*Nice*

So almost as sexy as regular Shrek"
358,Haha thanks my dude
359,Followed by post-nut clarity
360,Perhaps those were the divorce papers
361,what the fuck
362,"yeah, but...think of the karma..."
363,Mate you just made me realise what I've been doing till now. I can repost your tifu with 1 month instead of 6
364,Nipalese cuisine.
365,"Dude, I slept with my landlord and then he let me squat for a month or two after my lease was up.... Four years later, we're still together and I'm madly in love with him."
366,"“Sup, have you seen my balls?”"
