,text
0,"Wow thats rough.
Link the post as proof and ill give you an upvote SO IT WASNT A COMPLETE WASTE"
1,"My manager was yelled at due to a similar situation. Her daughter was really into superheroes and would say she had super powers everyday based on her outfit. So purple shirt = purple power, red shirt = red power. It was okay until she wore a white shirt to daycare and told everyone she had white power. "
2,Trogdor burninated your career.
3,[removed]
4,"Aside from outbursts when an adult fails to honor a contract... not really seeing a huge problem here.

Kinda sounds like maybe the primary lesson might be for the teachers to stop taking the easy route and making dishonest deals with kids; which they have no intention of honoring, in order to get the desired behavior out of the children. That the other children are either not developed enough to detect the dishonesty, or too timid to speak out against it, should not excuse dishonesty.

At the very least, being dishonest with the kids is sending several subtle messages to the kids on subjects such as ""teachers (authority figures) cannot be trusted"", etc."
5,Wow. Yeah my day was boring
6,Hahahaha you went ham on ham
7,"Don't feel bad. When my daughter was in kindergarten she started telling everyone that she saw me kill her ""big fat cousin Carson"" and bury him in the yard. Not only did that absolutely NOT HAPPEN, but she doesn't even have a cousin named Carson! Thank God when she started I told the teacher about her active imagination but the teacher definitely called me... as if I would admit to killing Carson's fat ass if I did do it. "
8,"Or you could become a court reporter and make 150k a year.

Edit: You would have to leave the house, however."
9,REDDIT STOP FUCKING RANDOM THINGS FROM YOUR HOUSE AAAHHH
10,I was worried you were in charge of placing orders for a restaurant and accidentally ordered half a million dollars worth of Mayo from like Sysco or somebody.
11,"I think quitting was just as big a fuck up as oversleeping. Good luck, man. "
12,"If they stopped to think about it for even a minute, they would realise that it would make no sense for a 1 year old to get upset by people using the racial slur because they wouldn’t even know what it meant."
13,I want to vomit at the thought of an adult being so naive as to accuse a small child of being racist.  Especially an adult that is supposed to work with children.  
14,Lol.  Now that is a tifu.  Pick your references carefully.
15,[removed]
16,You should’ve told your youngest one “yesn’t” instead
17,"I'm guessing you're the socially awkward type that would never say ""actually, this amount is fine"" after she handed you the first $13 bag...

I've been there. You should work on that."
18,"I tried to look for it but honestly OP posts SO MUCH. I scrolled for 10 minutes to get to ""4 months ago"" with no sign of the post

Assuming it was probably taken down under Disney orders?"
19,"GOD DAMMIT REDDIT.

STOP FUCKING JIZZING ALL OVER EVERYTHING AND LEAVING IT!"
20,It literally says on the cap “NEVER OPEN WHEN HOT” 
21,Remember to always humble yourself. Don’t brag about anything until you’ve actually got it. There’s a TON to learn from the situation. Keep your head up. 
22,You need to improve your situational awareness or you will not survive the zombie apocalypse
23,I admit that I find it somewhat hard to believe but it's definitely a funny story either way xD
24,"They're one of the fastest captioners in the country, why wouldn't they post a lot?"
25,"Not quite at this level, but I had a discussion with my dad when I was about 6-7 about why businesses were where they were, and houses were where they were, etc, and of course he tells me about residential zoning and business districts and a bunch of other things of that type.  Then one day in second grade, the teacher was reading a story, and in the story, someone opened a business in a neighborhood.  Apparently, me asking about the zoning of the residential area really threw her off. "
26,*puts down hand held blender*
27,The magic of lasagna: Place one lasagna on top of another lasagna YOU STILL HAVE ONE LASAGNA
28,Should've used a coconut instead
29,"1) don’t be afraid to ask questions, such as how much you think for 4-5 sandwiches? 
2) there are signs saying how much things cost, if you’re in a budget it should be habitual to look at them.
3) make sandwiches for everyone tomorrow. freeze the rest"
30,"Jesus christ. I dont know what else to say on the matter. Other than lmfao

WTF PEOPLE?! 4k upvotes?! Holy mother of god. "
31,"I agree, BUT---he probably would have been better off working silently for a few months while frantically beating the bushes for another job. OP-your post gave me intense anxiety. Good luck, man. "
32,"Child Protective Services? Really? Even though it’s not morally right, and even though you didn’t use the word, I don’t think it’s illegal or a form of child abuse for parents to be racist around their children

Edit: Gold for this? On this comment? Really? What a waste "
33,"This TIFU is legit, a necessary break from all the weird masturbators. Thank you, OP. "
34,"Jeez man..I think you've turned ""kicking chestnuts"" into a new idiom for fucking up"
35,"Wtf? This makes it even worse...she had shown by a pattern of behavior what was meant, yet bc using the wrong color, it was bad? What if the shirt had been black? Would that have been as offensive?"
36,"The thing you really need to work on is why you would willingly sabotage your opportunity.   Why couldn't you wait one more day to celebrate? I think you've got some soul searching to do about that. 

I agree with others - ask for the job back, do a couple more years and try to get a lateral promotion. "
37,So you're saying Karl Marx seized the means of production (servers)?
38,"goddamn.

social media is the biggest double edged sword to society in the history of mankind.

"
39,On the bright side you’ll never get appendicitis now
40,I'm laughing with you OP lol but there's something I don't understand. I may be an idiot but how did the fbi even get involved? How'd they get the email?
41,"Well you see, one of my friends forwarded it to the police department and asked if it was real. They called in the FBI to investigate. I intentionally left this out of the story since it’s a whole different rabbit hole that is more dramatic and not as interesting. 

Edit: We’re still really good friends for everyone going “Oh what an awful person to rat you out.” It was an honest mistake and she just wanted to see if the email was real. I’m not letting a good friend go just because of one screw up that didn’t even end badly "
42,Damn more like tifu by making a fucking beast.
43,"""... didn't really get it...""

I think ""...willfully ignored the explanation to satisfy an addiction to outrage..."" is probably more accurate"
44,Logic isn’t everyone’s strength. Also why should it make a 1 year old cry? 
45,"Yes. 

Early on me and my husband made an agreement to never lie or trick our kid. It is a matter of trust, and we think it will pay off in the now fast approaching teenage years.

We have never lied to him. We may say ""this is not your concern"" or ""This is too complicated to explain right now, let's talk about it when we get home""or even ""because I am your parent and right now you need to trust me on this, and ask questions later"". We also simplified things to age appropriate explanations.

But we never, never lied to him.


Edit: For all the 600 of you asking about Santa, this is how we dealt with that: https://www.reddit.com/r/tifu/comments/96afny/tifu_by_reading_contract_law_textbooks_to_my_2/e3zihpy/"
46,"Something very similar happened to us when our son was about 3. He went to daycare and cried because ""his daddy beat him this morning"". THANKFULLY the teacher knows us and didn't jump to conclusions. When she asked my husband what our son was referring to, he said breakfast. That morning, my son and my husband raced to see who would finish their cereal first. Husband won, he beat him in the race. Could have gone so much worse. Kids are selective little sponges aren't they?"
47,People are stupid.
48,"Haha, time to get inventive with your ham consumption.

Ham and eggs for breakfast, huge ham sandwich for lunch, ham and chees potatoes for supper. "
49,[deleted]
50,"""Ants love cum"""
51,Memes do have real world application
52,Next post: How I lost my house and post office job in settlement with Disney.
53,"I work as a consultant for several post production companies that contract with Disney and other large studios.  You'd be surprised how often similar situations come up.  When you handle these types of media every day it's easy to forget that it's not public, and it's owned by companies that care A LOT about controlling access to it.  Typically, we don't allow any internet access to any machine that has access to the assets as this is a security requirement from the studios.  I'm guessing that the company that subcontracted this work is going to be in some hot water for allowing you to access it from home in the first place."
54,"&gt; Lets call him David 

&gt; Proceeds to not call him David, not even once "
55,At least he's demonstrated his skill at cardio.
56,My friend got a tattoo done wrong because he didn’t want to correct the tattoo artist when he saw the design
57,"I respect your dedication to the prank. I've also invested a lot of time in a prank before and I know the payout when you tell them the truth makes it all worth it.

It would've been even better if you hadn't told your friends why the FBI actually wanted to talk to you and let them think that they were questioning you about your illegal business."
58,I upvoted because my husband doesn't clean
59,At least you didn't fuck the chestnut
60,"I mean, if his dad is eating sandwiches for his lunches, and OP starts packing some sandwiches for lunch, 2 pounds isn't even that excessive. "
61,I’m glad someone said it. Right. 2-3 year old learning about contract law. 
62, God I hope this is a real story
63,"I don't know... Have you ever been to r/wokekids ?

A lot of people seem to think kids are magically in tune with societal issues."
64,That's where I thought this was going... Although most Sysco reps I've worked with would flag that shit immediately.. they be calling if I ordered 10 extra mayo gallons..
65,Knowing this sub at least you didn't try to fuck it.
66,Looks like we got here just in time..
67,"Sorry. Google saves all:

https://i.redd.it/jqitpg3u3qd11.jpg"
68,Not bragging at all is the way to go.
69,"""stop playing SimCity and learn about mixed use zoning!"""
70,He was just trying to mix things up 🤷‍♀️
71,Next post: How I was murdered by Disney mascots in broad daylight
72,"In the words of my Dad.  

""Bet you won't do that again."""
73,"Look on the bright side, you never see pornos starting off with the woman banging the closed captioning and subtitle guy, so you got that going for you."
74,"Well, now you know who you can and can’t trust if you ever do end up on the wrong side of the law."
75,Where did you find this recipe? So I know to stay away from it. Thanks. 
76,"pretty petty they didn't pay you for the $6000 owed, though I def understand why you didn't insist on getting that $$.  Also, you sure you aren't violating nondisclosure agreements by talking about this on Reddit?"
77,"This is 100% accurate. She handed me the first bag and then went to slice the second pound... and i was internally screaming ""STOP HER"""
78,"It's hard to pass the speed test, I know. But jobs are not rare, there is a national court reporter shortage. 

Seriously, I know what I'm talking about."
79,"&gt; Aside from outbursts when an adult fails to honor a contract... not really seeing a huge problem here.

The outbursts have been the big issue with the school though.  Although to her credit, the Principal (who was previously the VP as well) acknowledged they can't tell him he's wrong when he breaks it down and did address this with the teacher as she didn't want the kids to lose trust.

He puts his teachers through their paces, that is for sure."
80,I was planning on vacuuming my stairs today. Now... I think I'll have my husband do it because I'm clumsy as fuck. 
81,"It's sad how often CPS gets called and makes visits to the good parents, while the terrible parents never see repercussion. "
82,What is it with horny people and fucking house appliances though. Can't y'all use your fuckin hands like the rest of us?
83,"Getting high and wasted the night before an important presentation = acting impulsively and not considering long-term consequences.

Rage quitting a job you've been at for 4 years out of embarrassment / the possible inability to get a promotion = acting impulsively and not considering long-term consequences.

It feels like a common theme, and hopefully something OP can use as a learning experience. "
84,[removed]
85,That’s about how my friends responded 
86,"I mean, what more can you do but pay?



I understand her being upset, but one day her own kid is going to do something she has to apologize for. Guarantee it.


He's at that age, and they're quick little buggers."
87,Or a squid 
88,"True, it is common sense. However when one is having a mild freakout, common sense goes out the window."
89,I swear the people here will fuck anything
90,"“Only got a measly 150 updoots”

It’s not like you need it lol, you have 7 mil karma."
91,"Also why would the cps care if you use the n-word around your child. As far as I know that is not illegal, only frowned upon culturally.   Unless OP is not American and in a country with hate speech laws."
92,I’m sorry he doesn’t. Currently my wife is working full time and pursuing a nurse practitioner degree. I also work full time and attend college but it’s way less intense. I try my best to make sure she doesn’t need to worry about anything but work and school. 
93,Maybe it wasn't a fuck up after all!
94,"In the words of my Mom: 

""Dumbass."""
95,All of this could’ve resolved with one question. “Can you tell me what the n word is?” Kid says “no” and the end. Everyone has a good laugh. Ugh
96,Very hard to believe. Not saying it isn’t true
97,My aunt tried to get a job doing that for 8 years. They are very difficult to get and job openings are rare.
98,"I have a similar story. I went to visit my mom and step dad the first week of May. Step dad has a few health problems from heavy drinking all his life, so I thought I would bring some home made edibles with me to give to him since he can't drink anymore. He's smoked with me plenty in the past.

First night there, I offered him one and told him that they were pretty potent, but he decided to eat the whole brownie. Within ninety minutes dude was just about in a coma, and couldn't move from his recliner. I think he laid there for a good seven hours before finally getting up to go to bed. From then on, he would only eat half."
99,Finally something that doesn't involve fucking god-knows-what.
100,"
Opposite, please. I'll have what Granny is having."
101,I can post a picture of “Agent Scarn’s” business card. It’s got the FBI seal at the top 
102,"Dude, we both know how this would end:

Teacher: Little Billie, what do you mean by the n-word?

Little Billie: No

Teacher: Now, Little Billie, it's OK, you can tell me. What is the n-word?

And it just go on and on. In fact, this might be where the issue comes from with the teacher. They might have asked the kid what the word was and when they thought that the kid wouldn't say, they thought it was worse than it was.

"
103,"That's what I thought, too. It's such a 17-year-old kid excuse to torpedo your own job this way. "
104,Particularly when you achieve some sort of high standing position in society and then some neckbeard finds a Myspace comment from 2004 where you called your friend a ding dong loving fruitcake and they use it to destroy your entire life.
105,New lpt. If you’re too nervous/shy/whatever to correct  a tattoo artist then don’t get a tattoo.
106,Hahaha I didn’t even think about that. I was in such a panic it didn’t even occur to me to continue the prank
107,This is a creative writing exercise. 
108,TIL nobody on reddit uses their hands and tissues like everybody else...
109,Some things are just best left unsaid...
110,"A year later:


""Like all TIFUs, this happened months ago but here it is. TIFU by posting an FBI Agent's business card on reddit"" "
111,ham ice cream for dessert
112,"Yeah, my kids spent their first 4 years of daycare and primary school in England. Moving back to the U S. was fun. Try explaining ""cheeky monkey"" to a black kid's angry mom."
113,"No. He trusts us, but he is very aware the world is not like his parents. 

He just told a friend to never forward stuff like ""email 10 friends to win"". In his words ""it is spam, and now you gave the spammers my info"". He also went to look for the proof that it was spam, and sent the link to his friend. 

He is very skeptical and logic-driven."
114,"The sticker can come off, but this is common sense lol"
115,[removed]
116,"Absolutely this.  It is much better to find a job while you still have one.  While his chance for future promotion was dashed, his immediate security seemed fine.  He should have kept working while looking for another job.  Who knows?  Maybe this would have blown over when cooler heads prevailed and he would have gotten the promotion in a few weeks or months anyway.  Unlikely, but a possibility."
117,So now you can use the card to impersonate an FBI agent. Brilliant!
118,"They type in a different language (shorthand) so it's not directly translatable to per-letter typing.

In my experience (as a lawyer), the hardest part wouldn't be the speed, it would be transcribing when everyone starts talking at the same time, or transcribing people with a thick accent or who mumble."
119,"Take my upvote and leave, or stay if you like it here, my thread is your thread comrade"
120,"Honestly, I really like this idiom. It’s got a nice ring to it"
121,It's been deleted.
122,"Yeah, I agree. Most people here seem to think this was a normal reaction from the company. It isn’t...so much so that I’m almost thinking this story is false.

This guy puts in 4 years of hard work and proves himself reliable enough to take on a major role at the company. Then he’s late and without any other information or even a hint of concern over why he might’ve been late, they take the promotion off the table? 

And then he quits without even really talking to anyone about this? Things happen. He could’ve been ill that morning, had a family issue, etc. 

I personally wouldn’t want to work for a company where people react like this."
123,"If ever there was a time to fake illness, this is the time.  I think you send a message saying, ""I am the sickest I've ever been.  I am on my way to the hospital.  Please, apologize to the CEO.  I have to go.  I will update you.""  Then, you live that lie forever!  I would actually go to the hospital too.  Just tell them you feel really terrible and you don't know what it is (don't mention the drinking). They will run some tests, and probably eventually conclude that you have some kind of virus and tell to you just wait a few days to see if you feel better. But, you have documentation of going to the hospital now.  

Then, you update to say that you are a little better, but still feeling bad, and you call out of work the next day too.  This sells the lie about being sick the day before even better.  Someone's who hungover may call out one day, but probably only someone actually sick calls out 2 days.  
"
124,Yeah man. Just once I would love to have this kinda thing happen to me. It makes for a great story.
125,[removed]
126,Maybe this isn't even a fuck up
127,"At times like these, this subreddit wouldn't even ask if we masturbated in the bushes while we hide from our friend."
128,"""addiction to outrage,"" I'm going to use this now. Thank you."
129,Because he doesn't have anybody telling him what to write?
130,"Seeing as you're already in the McDonald's, might as well check if they have any openings..."
131,"At least you have an interesting story to use for the often asked ""Why did you start working by at the post office?"""
132,The n word is noonie. Not this word. This word is disgusting.
133,It is just a bunch of weird smelling protein. Ants apparently view it as as smorgasbord of deliciousness.
134,"Along with the countryside, peasants and the peoples (in their thatched roof cottages) "
135,Damn that really sucks
136,[removed]
137,"""I'd give my left nut to be back under 200 lbs!""

""Done!"""
138,"All I see here are over-reactions all round. Yes yes you fucked up, but in the grand scheme of things this is pretty minor. If you were the best person for the role yesterday, I don't understand how you're not still the best person for the role tomorrow. You couldn't have played the ""chronic diarrhoea, very embarrassed, I'm ready to grovel and scrape now"" excuse?"
139,"My parents had numerous visits from CPS (well, in my state they're called Department of Family and Children's Services) because I kept ending up in the ER. Apparently the third visit (and each subsequent one after that for a couple of years) triggered an automatic call. Regardless of the fact that the first two trips were because of allergic reactions to the same bee sting, and all but one of the rest happened when I was at school. Honestly made me nervous as hell to take my daughter to the ER a couple of weeks ago when she dislocated her elbow while we were playing. "
140,"That’s hilarious

Imagine your credit card company calling you about it
“Yes, hello? Is this friscoflip? We were wondering if it was you who ordered something called ‘spicy mayo?’ Oh, it was? Well, are you in good health? Do you need us to call you a police officer? No? Are you sure? *whispering to co-worker* (Call a cop quick!!!) Okay sir, well thank you for picking up. Have a nice day. Bye-bye now”"
141,Yeah I was 23 when I learned it and I still barely know that shit.
142,"Your first point is the best thing you can do when you don’t know how to adult. Ask questions. It seems silly to ask how much deli meat they recommend to get for a weeks worth of sandwiches  until you just roll with it and end up spending thirty bucks on ham that you’ll struggle to eat before it goes bad. Have a question asking attitude. How else do you think any of the rest of us figured out what the hell a deductible is? If you need to know the difference between a W-2 or a W-4, or if you need to know what type of cleaning product is best for bathtubs, ask. 

Or just google that shit"
143,I think you have enough reasons now to skip that waxing appointment.
144,They cut open your stomach and remove your appendix without ultrasound checking it first? 
145,She may just have been caught up in the moment. I would give her a day or two to calm down and then reach out to her about fixing the damages. Best of luck 
146,"Not the Sysco rep I worked with! He would have happily sent that and not said a word. One time my location ordered 100 cases of 2oz clear cups to put spicy mayo, pickles, etc. in. We needed 1. Order day came. 6 pallets of clear cups and nobody wanted to take them back. Took up the whole back dock and over a week to get Sysco to take them back."
147,"You should sit down with the principle and explain the situation to him/her and how you don't appreciate CPS being wasted on you, potentially by a teacher over reacting. "
148,He's captioning the downward spiral of his life.
149,"I would suspect that the ability to more positively deal with complex emotions that stem from injustices like this are probably something that will naturally come with a bit of age and maturity. 

It's tough to fault the kid though... the internal emotional response to injustice tends to be an exceptionally powerful one."
150,"Welfare office lady here. I’ve had more than a few ex court reporters come through my doors. Also closed captioners and medical transcribers. These used to be a freelance job that a single mom in the US could survive on. Now- like every other job they are being asked to do too much for too little while most jobs go overseas. The court reporter equipment isn’t cheap either, so you better be good at typing before you invest. "
151,"This sounds Homer Simpson esq, like couldnt you imagine this as a bit in the simpsons?

Edit: Spelling, and thanks reddit for my most upvoted comment being about the simpsons

Edit 2x: Thus = Thui = This... I dont know why that is so hard"
152,"I'm curious to know how they even found out about it. For something that received such little publicity, it seems like it would be almost impossible for the right person to see that post and say ""that's from an unpublished episode of XYZ. How did that get here?"""
153,That's quite the fuck up. At least you didn't cum into a coconut.
154,This smells of r/thathappened
155,It really do be like that
156,"Speaking of porn, wonder if OP has reached out to any companies to CC for them? Some deaf lad out there may appreciate the valiant effort"
157,"Also relevant ULPT: keep a ziplock bag full of cum on your person at all times. If someone attempts to fight you, you can open the bag and slosh the contents in your attackers general direction. Either the fight ends or he is more aggressive"
