,text
158,"Unfortunately in our beautiful free country CPS is legally mandated to investigate every complaint, no matter how frivolous. They don’t just investigate the allegation though. They will investigate everything to make sure the child isn’t being abused. It’s a big waste of limited resources and one of the reasons why the real problems get missed. I had an anonymous CPS complaint that just happened to coincide with a custody dispute. The investigator spent countless hours investigating nothing. I employed attorneys to ensure everything was done by the book. It happens all too often "
159,"Relevant LPT: Cum can stain tile and linoleum, and can bleach darker clothes and flooring. It's a real bitch to deal with once it dries, so please. Clean immediately after you're done or take preventative measures."
160,probably would have been even more offensive to them
161,[removed]
162,"Good on them for not firing you. Mistakes happen, and you've learned from this one. You're never going to push something like that to the master branch again."
163,"&gt; Teacher berated my wife

So you reported her to her superior, right? People that stupid and aggressive really shouldn't work around children."
164,"Looking at his posts you can tell he's not lying here though. Multiple posts every day until a little over a month ago and this is the first one since. He truly had nothing better to do than shit post. Now all he can do is post shit

  


o7"
165,"&gt; how much you think for 4-5 sandwiches?

Ehh, about 2 pounds should do it."
166,That better be boars head at 13 a pound lol
167,"&gt; white kitchen floor was stained red from the tomate sauce

This is the real fuck up. Who installs a kitchen floor that can be stained by red sauce?"
168,"On a somewhat similar note, I’m used to the metric system in the UK and after moving to the US, I eventually ventured out to a grocery store. I like a good sandwich every now and then too, so to the deli counter I went. 
When asked if 1 pound of smoked turkey would be enough, my brain forgot to remind my mouth which country we were in, and requested 5 pounds. Stupid me heard “would £1 be enough?”, which in the UK would have been a paltry amount of meat barely enough for half a sandwich. 

Needless to say, I ate a lot of turkey for my first few days after moving here, but lesson learned!"
169,"Bragging might be too strong a word, it sounds like he told a few of his friends which isn't unreasonable - the problem is he has idiots for friends. Who celebrates and gets smashed on a Sunday? Do it on Friday or Saturday for god's sakes."
170,[removed]
171,Wrong. It's now A BIG FKING LASAGNA
172,There are days where you should just stay in bed
173,Big  companies with IPs employ people to do just that. 
174,And that kids name? Albert Einstein.
175,"It's 3:00am, and damn, it was hard to laugh quietly."
176,That’s what I thought. All I can do is apologize. He didn’t know what he was doing and it can be fixed. She didn’t see it that way tho. 
177,"Thankfully you only got “minor” burns.  I’ve seen a fellow mechanic do this because he thought he was immune to the laws of physics and pressure.  He got 3rd degree burns on his hands, arms, chest and face.   I’d say you got off easy and a powerful lesson was learned! "
178,"This time, he only fucked himself. "
179,"Do you remember the fuck up from a few months ago that had a guy buy cookies while on vacation. Ignored dosage and freaked the fuck out while on dinner with the in laws? It’s a good fucking laugh. 

Edit: [the fuck up](https://www.reddit.com/r/tifu/comments/7pafrt/tifu_by_stuffing_my_face_with_edibles_before/?st=JKK8Y4PB&amp;sh=bf7a8f5f) "
180,"Sounds like a lot of exaggeration to me.
"
181,"I believe that would be where the ""suing my pasty white ass"" part starts."
182,Eating isn't a competition. If you are healthy and  feel full with your amount of Turkey pastrami and other foods than it is right for you. 
183,Is that a real story
184,Oh please don't give anyone good ideas
185,HE MADE AN ABSOULTE UNIT 
186,"Some states are. If OP became a court reporter, it'd be another dying industry. "
187,[removed]
188,"Next time externally say (not scream), ""Thanks, that's good enough.""

Even better, just ask them.  ""How much ham do you think I'd need to make X sandwiches?""  Alternatively, just go to the packaged meat aisle and visualize the amount of meat in a given weighed package.  Then go to the deli and ask them to slice it if you want.

FWIW 2 pounds is probably good for 8-16 sandwiches depending on how much ham you like in them.

Also $13 a pound is really expensive for ham...even good ham.  You should aim for paying half that at most.  For example I can get 2 pounds of Columbus ham at Costco for $11, and that's the good stuff.  

Edit:  Quit filling my inbox to tell me it’s Canada because picture and kg.  The original post made no mention of Canada, says pounds, and they edited their post after mine and added the image.

https://imgur.com/a/p7q3BmQ
"
189,Just buy a bunch of groupons for laser hair removal. 
190,"Precisely why this tale seems fishy to me. Something doesn't seem or feel right about this story. Formality meeting with a CEO for a promotion of a lowly team leader? Wouldn't the CEO have better things to do than attend a presentation? Why couldn't they come to him? Everyone knowing he blew the meeting? Just how small of a company is this? Just the quick ""well I quit"" and not getting HR involved? It seems like its written with someone either in high school and college and think that thats how people get promoted."
191,"Tomorrow: _TIFU by posting on TIFU, causing over 30,000 extra people to see the image that violates Disneys copyright, and now Disney is suing me_"
192,"Probably forgot the coconut

EDIT: seems like reddit likes cum coconuts yeah"
193,"I thought this was going to be trauma for the 5yo. I thought you were going to say something to the effect of ""raccoons realized food was being left there, so they started digging in the area"" and it was going to end with the well-decayed cat half out of the ground. I'm kind of relieved that it was a location miscommunication. "
194,An exercise in failure. Fucking painful to read.
195,"I am almost 100% positive I never said anything racist/homophobic when I was a kid on the internet. I kinda wanna become a public figure to find out. I think the worst thing I've ever done was send a message to the Jake the Dragon Warrior* forum/website telling him he is a poser who cannot skateboard. I really didn't like that show for some reason... 

*The show was American Dragon: Jake Long. "
196,Maybe I should set up access to the baby monitor and live stream the dinner. 
197,TIL a guy trained a toddler-terrorist how to negotiate :-/
198,"The Golden rule is a good one, but the diamond rule is, ""if there's even a *question*, don't post it""."
199,I've made that mistake too. It was 420 last year. A coworker brought some brownies on a business trip. I ate the half the brownie and had to call into work cause I was wrekt. Edibles are no joke and you definately learn when you've had too much 
200,"As someone who worked IT for a while and routinely got to the 750th post on the front page and scrolled through reddit for 6+ hours a day... trust me, you don't want to do that."
201,this absolute madlad
202,Next post: how Disney cryogenically froze my body to delay my death so that Walt himself could personally strangle me. 
203,[removed]
204,OP's FBI agent is reading this whole exchange slowly shaking his head in disbelief
205,Ham tea for moonlight reading
206,"And this, kids, is why you should ALWAYS check with your company's social media teams before posting anything relating to your job. They'll tell you if it's cool or not, and if it still raises a problem, you can still say ""well I checked with the proper authorities and they gave me the green light"". "
207,"Why don't we just switch to, or add in,  audio/video recording? This seems so antiquated.

Edit: Thanks guys, I get it now."
208,"Welcome to r/Tifu! Here are all of our posts about people fucking stuff and here are all the other posts, enjoy!"
209,If any of the stones are still intact you could put those or the scrap gold into the new ring. It would carry the life of your old ring on. 
210,"yeah, it was a night of drinks and whatelse, but it could also have been an emergency, a sick child or parent or a poisoned food... my 2 cents: quitting his job is not the right move to do in this case"
211,Yeah a real wtf tifu
212,"&gt; It's hard to pass the speed test

Just out of curiosity, what are the speed requirements?

"
213,Dammit Garfield
214,"I worked in the entertainment industry at a fairly high level in production for a long time and saw Disney destroy many Mom and Pop businesses that were *providers* \- not competitors in any way.

They did this knowingly and to save money. Family values is their niche, not their business model. I wouldn't be surprised if they have full-time staff whose job it is to look for violations like this expressly so they can cancel 6k contracts... it's not far off from what they did to the companies I saw go under."
215,Well then start kicking chestnut!
216,[removed]
217,"Yeah, I just couldn’t do it. It will just be weird now in perpetuity.. "
218,Now there’s an idea!
219,"2 pounds is logical if you've got 4-5 lunches a day to make, will last you for roughly a week.

That said, I commend you for taking the initiative of going out for groceries on your own, we all had to learn sometime. I usually just swallow my pride and text my folks with any silly questions if I'm not sure about something.

Latest call was to my dad, asking him how the hell do I start up a charcoal bbq I'd just bought. He had a good laugh."
220,Why did the sperm cross the road? Because I wore the wrong sock to work today...
221,"Glad I am not the only one who actually found this really hard to read. Way too busy and way too many metaphors and parenthesis, I got lost as fuuuuuuuuuck, "
222,They immediately fixed permissions for my account and now I can't even push to the master branch any more.
223,[removed]
224,Being 'the most competent' person on his team has me wondering
225,"I had a similar story with a carrot. I washed it off after and put it back in the fridge (dear god don't ask why..) and my mother opened it in the morning to find it had gone black and gooey. She assumed it was some sort of mold and threw everything out.

Guys aren't the only ones to fuck stupid things and make bad decisions after."
226,"Op should have fucking stabbed himself and claim he got mugged lol. 

Or crashed his car on purpose lol. 

Maybe killed one of his parents. 

All valid reasons to miss a meeting with the CEO. 

You done fucked up OP. Coulda salvaged this. All it have taken is some bodily harm or a wee little murder. "
227,"I heard a story once about a grrrl who was really bored on register duty at a mall store and just pushed ""9"" over and over again to see the biggest number the POS would accept and accidentally put the transaction through. At the end of the day they got a phone call from a company VP congratulating them on blowing away the company record for greatest sales in a single day. The next day when the transaction was reversed, the area manger called up to bitch them out for somehow having the worst sales in a single day in the history of the company."
228,I can't help but think all his classmates stood up and clapped.. 
229,"Yes. They took a blood and urine sample which showed signs of infection, I had a high fever and stomach pain, so they did the operation before waiting for the results as a precaution."
230,"My parents never raised a hand to me, but CPS interviewed us multiple times when I was young. I was so scrawny that teachers thought they were starving me. Plus I always had bruises and dislocations. And lots of ER visits for allergies and asthma. 

Only thing is my mom was always a classroom and church volunteer. It probably helped that my mom was skinny as heck with lots of joint and health issues too. She may not have had a diagnosis but she had plenty of similar symptoms, and so did her mom.

As an adult, found out I had ehlers-danlos syndrome, which causes dislocations and is often associated with gastro issues, slow healing and MCAS. 

If CPS ever comes questioning, literally ask what medical testing they suggest and what issue led to their call. But please don't ever be scared to get your kid medical care. Doing that is most important."
231,"Do it on your deathbed: ""For my last request, please bury me in the corner flower bed. But not in the second one, cause that's where I buried the cat without telling all of you... bye!"""
232,Hands? I would much rather fuck fruits like a sane person. 
233,How do you get a job scrolling through Reddit?
234,"Luckily you got only minor burns. In the future don’t put ice on a burn, you can make it worse. "
235,"&gt; happened yesterday but I’m still traumatised as I’ve never really encountered confrontation on such a big scale.  
&gt;  
&gt;So let me set the scene first. I live (and grew up) in a fairly densely populated city in Europe that has a good amount of nature patches. The people are genuin

Rule #1."
236,"A 4-6 year old, I can maybe believe. I feel like people who easily believe this do not know many 2 year olds. "
237,"I can't smoke it so I've only ever been able to use edibles.  Sometimes you know that you're going to be the first person that's ever died from weed. 
 
Every story about edibles is:

1. I don't feel anything. 
1. I don't feel anything.
1. I don't feel anything.
1. I don't feel anything.
1. I don't feel anything.
1. I don't feel anything.
1. I don't feel anythin̰̯̭͍̣̲g̲̯̝̹͉̠̯
1. Please drive me to the hospital. "
238,Yup. I get a pound of turkey for lunch each week. Lasts me 4 days usually. 
239,"Sad story but, it’s what most people tell their kids.....don’t post anything on Facebook, Twitter, instagram, (now Reddit) unless you first say to yourself......”Self, would this be good posted on the front page of the newspaper?(well after you explain what a newspaper is). And if you don’t want the entire world to see it....don’t frikkin post it or send it.   "
240,A deaf lad who watches porn for the dialogue?
241,"Back in the early oughts I was buying a CD at an HMV in Montreal and somehow it kept scanning for $3.2M and change. Manager comes over, enters a discount to bring the price down to $17 and completes the transaction. I think the receipt even said something like 'you saved $3,237,983 today!'."
242,Hahaha you my friend are the epitome of why we have r/ProgrammerHumor
243,Hahahahah!  That’s a good plan. 
244,I want an update lmao
245,It all started that day...\*cue flashback sequence\*
246,This is a rule of thumb when you kill a wasp : never leave a witness around or they come back like a bunch of Whiterun hold guards.
247,"Former-Chief Bill Myers, you are treading on thin ice here."
248,"And the person behind the counter won’t give a shit if you ask a question, they’ll just answer you and go on with their day.  

Unless you ask “how much ham to feed an orgy of 12 people?”.  Then they might give you a funny look and have a story to tell their coworkers."
249,I'm not a guy..
250,"*record scratch, freeze frame*

Yep, that's me.  You're probably wondering how I ended up in my 40s delivering packages in 90 degree heat.  It all started last year..."
251,"This is interesting, does the kid fall for tricks easily? (Like from friends and ""friends"".)"
252,"So apparently nobody at corporate took the time to wonder how a store managed to do $999,999,999 worth of sales in a day?"
253,Next time you feel frisky just break your arms and call your mom. 
254,"OP:  I made really strong edibles.  Be careful guys.

Reddit:  So...where is this recipe?"
255,Glass half full.
256,He probably deleted it. I don't think Disney will allow him to keep it.
257,"It literally just happened and I'm sure she is just extremely frustrated by the situation. People need time to cool off. Don't write somebody off because they aren't immediately all smiles after something shitty happens. If she is still upset about it after a couple days or after it's fixed then you can judge her. 

Life pro tip: give people some time to be upset sometimes."
258,"Guess your son really.. *dramatic pause..*

...made an impression.

YEAAAAHHHHHHH  **(⌐■\_■)**  "
259,i prefer to just not bury people but thats me
260,I Really thought this was the origin story for lava girl 
261,This is one of the most innocent posts on this sub
262,"I'm sorry girl, it's just that after coconut guy, squid head guy, couch guy, hot dog buns guy, bedside guy, the second I see someone doing it my brain just goes not another one"
263,"Any general surgeon worth their salt in a young female checks at least two things BEFORE  operating on appendicitis: 1) urinalysis 2) pregnancy test. Many will also get ultrasound or CT to confirm diagnosis nowadays given their accessibility.

I am board-certified in general surgery. This is basic knowledge for any surgeon. "
264,"""Ever since Agent Scarn was called out to some godforsaken college for what turned out to be a stupid prank, he had been the laughing stock of the entire bureau. When, to add insult to the injury, all of ShortTail359's charges had been expunged, Scarn had vowed to take his revenge. All this time, he had been carefully observing ShortTail, waiting for the slightest hint, the slightest clue of a mistake. Now, as he basked in the light of his own business card on his computer screen, he knew his time had finally come.""

This autumn on Reddit: TIFU 2: Impersonation Boogaloo. "
265,[deleted]
266,[removed]
267,Wait. With or without clothes. 
268,[removed]
269,"TIL

No one in this world except for me masturbates in the toilet. "
270,"Oh yes, I cancelled it. :) I had scheduled it for Monday because I had a slip n slide party the following weekend, but my boyfriend came up with a scheduling conflict (and they're his friends), so that's not happening anyway.

Means I have more money to go towards other things this paycheck, too. "
271,"Edibles are really crazy, and my wife and I learned the hard way. I've been smoking since I was young, so I have a tolerance, but my wife was not much of a user. She got her med card here in CO before it was recreationally legal, and would buy this CBD oil, which was mostly CBD, but had plenty of THC in it. Well, it came in this syringe, and we had no idea how much to take. She asked me to take some with her, and I wasn't interested. Edibles were always wasted on me, never potent enough. HA...

So I decide I'll take some with her. It's a 5ml syringe, and we each take 1ml around 8pm. She goes to bed, I fall asleep on the couch, only to be awoken by our new-ish-born daughter around 1am. I get up there, take her out of bed, calm her, and my wife walks in with a bottle, looks at me and says, ""I can't do this. I'm so fucking high right now. I can't walk. I can't sleep. I can't be here. I need you to do this."" To which I responded by just staring at her, then she walked away, I fed my daughter, and got her back to bed. As I'm doing this, I realize that I'm really super stoned. Not like, ""I can't function"" stoned, but just really really stoned. Then I start thinking backwards and realize I said nothing to my wife. Not a word. I was so out of it, I didn't even realize it. Got my daughter fed and swaddled, and rocked her back to sleep. I then happily trotted my ass back to bed and fell right asleep. It was a wonderful slumber.

Next morning, I wake up, and my wife is like, ""never again"". I then tell her that I realize I said nothing when she came in and gave me a bottle. She laughed, I laughed, the CBD oil laughed... I was overly impressed, as I had never been so affected by an edible of any kind. Eventually I figured out that I could take 0.4ml and it was awesome. 1ml was WAY overkill. I'm unable to find that stuff anymore, but wow. Holy overboard. Seems like the #1 problem we have here in Colorado with edibles is that people don't understand their potency, especially in relation to their own tolerance level.

edit: Spare me the ""that's irresponsible"" nonsense. In 2012 it was not well-known that over-consumption of edibles would go so badly for some. That's something we all started to learn in 2014 after retail centers opened up. The state even changed edible laws last year in an effort to curb child consumption and over-consumption."
272,Thank you for posting....I'm always telling my husband to wash before wearing but he thinks I'm crazy. Sorry you had to go through this.
273,"I was in touch with the jeweler who made the ring this afternoon. It will basically cost the same to make the new ring out of the old one. I was also in touch with my neighborhood jeweler and we're meeting next week to talk about turning the gold and some of the diamonds into a small pendant. I thought I could do that for now and just buy a new ring once we have the money. I'm worried that my husband will insist on getting the ring now that he's finally ready to buy a new bass guitar he's wanted for so long. Knowing him, he'll get the ring remade with the money we have set aside for the bass, and I do not want that to happen. "
274,You're trying to tell me an elaborate system of pulleys attached to a hardy vegetable isn't the best solution here?
275,"One night, my wife was getting ready to go out with an acquaintance, and said acquaintance was driving. Wife was trying to cut back on her drinking, and opted to have a little weed instead, before they leave. (She likes to pre-game, my wife.) Something possesses her to make her very first edible.

She gets all the shake she has, and cooks it in a little butter on the stove over low heat. She takes out a single crostini. She tops it with an artichoke heart and a lil parmesan, drenches it in the butter, then toasts it in the oven. She eats it as she gets dressed, and they depart for the bar. 

Time lost all meaning. The 2 minutes it likely took for them to find a parking spot in the lot was reportedly four hours. She spent the evening so high that she wasn't sure whether she was actually responding when people spoke to her, or just making facial expressions in super slow motion. 

We aptly filled in a Cards Against Humanity blank with ""All the shake I had"""
276,DONT TELL ME WHERE TO CUM!!!!
277,Did it!
278,This is written like a shitty YA novel.
279,It's kind of a plot hole in the story though.
280,I like how the microwave morphs from a 'magical device' to 'damned machine'. 
281,Whoever didn’t realize you were female after the first two sentences needs to brush up on their cognitive reading skills. 
282,"I also need it, but um, for science"
283,Please do lol
284,Just overlap them green and yellow boxes.
285,Very impressive sleuthing!
286,Looking down at the ground and literally running into someone. Basically the perfect and most acceptable reason to tell someone to watch where they’re going.
287,"Mob mentality brings out the worst in human race. But when people say ""Watch where you're going"" for something as frivolous as a bump, what else can anyone possibly expect?"
288,"*some days you win*
*some days you drop a family sized lasanyer on your bare fucking feet*"
289,"We bought a dodge journey this spring as a second vehicle to our caravan. My husband took his eyes off of our two 3 year olds and in that moment they managed to apply purple nail polish on to the hood of the car. They didn't bother with the brush they threw and splattered it all over the hood.

All I could do after coming home from work was stand there and try not to cry while clenching my fists.

I eventually got over it, nail polish is still there. On hot days I give it a go and try to peel it off and it comes off without taking the paint of the vehicle off, little by little I'm gonna remove that crap.

"
290,You can divide it up and freeze it.
291,[https://www.reddit.com/r/tifu/comments/92kpw3/tifu\_by\_masturbating\_in\_a\_wrong\_area/](https://www.reddit.com/r/tifu/comments/92kpw3/tifu_by_masturbating_in_a_wrong_area/)
292,It’s been a lot longer than a week since that guy came into a coconut.
293,"Fair enough, I don't think many people would be able to keep cool after getting pulled aside by armed FBI agents. "
294,"Yeah, this is what I'd have done. Go to the hospital, get that documentation, and live that lie forever. Hell I'd be taking pictures of the hospital room to send to the team lead as well to try and keep them from shitting on me too much before I return with the paperwork proof. "
295,Yeah don’t leave just a head free that’s how people die. Your chest needs to be able to expand for you to be able to breathe 
296,I made a program that shocks you any time your curse and modified he board game Operation to tase you if you hit the metal. I definitely have too much time on my hands
